0,2325540629,Thu Jun 25 05:38:19 PDT 2009,NO_QUERY,dean_b,@SherilynMoon unfortunate then that I have no signal to tweet photos from my phone whilst in Wales 0,2326735569,Thu Jun 25 07:26:32 PDT 2009,NO_QUERY,nqhuy90,@snowleaves90 Bao h cau ve thi noi cho to biet ! Quen mat to roi hay sao y 

0,2326735918,Thu Jun 25 07:26:34 PDT 2009,NO_QUERY,MarcusLuise,"http://twitpic.com/8deyi - goodbye long, beautiful, rad hair "

0,2326736140,Thu Jun 25 07:26:35 PDT 2009,NO_QUERY,marybrace,"@ajinnashville at least, that's how it is for me "

0,2326736165,Thu Jun 25 07:26:35 PDT 2009,NO_QUERY,khuer,@anyuhh i like that songs  hayyyy!

0,2326736662,Thu Jun 25 07:26:37 PDT 2009,NO_QUERY,Jessica_Summer_,@katieallover have an INSANE time tonight! I wish I could go.  I'll eat a huge burrito for you at Chipotle!

0,2326736730,Thu Jun 25 07:26:38 PDT 2009,NO_QUERY,Wiiggum,Sleep should rank as my #1 priority atm but I wanna stay up but I can't  Stupid work sigh...

0,2326736829,Thu Jun 25 07:26:38 PDT 2009,NO_QUERY,rockkandy,@ssombrero aww c'mon it was a GOOD monkey on your back though. the very best kind of monkey.  i heard you're not coming 

0,2326736830,Thu Jun 25 07:26:38 PDT 2009,NO_QUERY,starburst521,"@itsNICKJONAS  please, please don't tell me about concerts because my mom could not afford tix at the time and i'm sad  I wanted to c u:'("

0,2326736870,Thu Jun 25 07:26:38 PDT 2009,NO_QUERY,huldahchin,"studying's alright, getting down to doing it is the hard part "

0,2326736876,Thu Jun 25 07:26:38 PDT 2009,NO_QUERY,CThiefUK,"@JasonMilner @SadGamerGeek , Really interesting podcast veering terribly off-topic! (bad sound quality though  )  http://bit.ly/19pcR3"

0,2326736920,Thu Jun 25 07:26:39 PDT 2009,NO_QUERY,MsJuicy313,"Why is it that every time I go to get my hair done, this chick is still workin on someone else??? "

0,2326737132,Thu Jun 25 07:26:40 PDT 2009,NO_QUERY,KikarDaSh,@PHILMYSWAGG lol thanx ..ps I still can't find prom pics 

0,2326737277,Thu Jun 25 07:26:40 PDT 2009,NO_QUERY,Sweetheart_Jess,So much to do... even if I don't want to 

0,2326737353,Thu Jun 25 07:26:41 PDT 2009,NO_QUERY,tlnimc,"Today, the weather was really hot. but i went to the reading room for study. because i have to take a important examination. im so tired. "

0,2326737484,Thu Jun 25 07:26:41 PDT 2009,NO_QUERY,oouchh,suffering from the heat  +37C here

0,2326737499,Thu Jun 25 07:26:41 PDT 2009,NO_QUERY,SpiderxBear,@judez_xo lol i already asked! She has work 

0,2326737698,Thu Jun 25 07:26:42 PDT 2009,NO_QUERY,dorannmanders,Is really ill today 

0,2326737710,Thu Jun 25 07:26:42 PDT 2009,NO_QUERY,KarenR59,@7angela7 I don't eat seafood or pork.  I'm sure they got some big 'ole Beef?! LOL

0,2326737770,Thu Jun 25 07:26:43 PDT 2009,NO_QUERY,ch1burger,don't know what i want to do after high school anymore 

0,2326737893,Thu Jun 25 07:26:43 PDT 2009,NO_QUERY,RickyAntonio,"@ZahraNichlany curang nonton duluan,,  http://myloc.me/5AYm"

0,2326738156,Thu Jun 25 07:26:45 PDT 2009,NO_QUERY,gh2553,"@peterfacinelli A fan I will always be, even though you never twitter me.  Lamo I know,I am sick in bed &amp; lonely &amp; bored.Have a good one."

0,2326738437,Thu Jun 25 07:26:46 PDT 2009,NO_QUERY,X_katrina89_X,is bored and doesn't know what to do..  any ideas guys?

0,2326738793,Thu Jun 25 07:26:48 PDT 2009,NO_QUERY,isabravo,job interview in like an hour.. im up too early 

0,2326739465,Thu Jun 25 07:26:51 PDT 2009,NO_QUERY,junyoora,says aw...i'm not happy with my bumblebee toy.  http://plurk.com/p/13wj77

0,2326739525,Thu Jun 25 07:26:51 PDT 2009,NO_QUERY,RacheeRoo,"@DannielleJ_K ahahaha  ahh well, hope youz enjoying your meals nom nom x"

0,2326739894,Thu Jun 25 07:26:53 PDT 2009,NO_QUERY,JennyT89,"isn't seeing Transformers again, instead I'm in Topshop, looking at clothes I can't afford "

0,2326740347,Thu Jun 25 07:26:55 PDT 2009,NO_QUERY,c2cmom,@slpowell Me too! I checked weather.com and next 10 days are cloudy and stormy for North Jersey - only 1 partly sunny day.  Boo!

0,2326740416,Thu Jun 25 07:26:56 PDT 2009,NO_QUERY,AminatJ,"ok, scratch that last tweet...the movies not working for me "

0,2326740985,Thu Jun 25 07:26:59 PDT 2009,NO_QUERY,keron,trying to do lyrical hiphop when you're in a reggae mood is a prime recipe for very ugly-looking disaster. 

0,2326741697,Thu Jun 25 07:27:02 PDT 2009,NO_QUERY,wondermalanna,Eating breakfast with Kolby before he leaves for colorado 

0,2326741700,Thu Jun 25 07:27:02 PDT 2009,NO_QUERY,Boudoirbaby,@meshmerize I just drank water like you said but now i feel like i made hot chocolate in my tummy  

0,2326742132,Thu Jun 25 07:27:04 PDT 2009,NO_QUERY,Lucy_H_Pearson,@NatalieGolding aww i love you hun - SOOOO much. I've been thinking about you today - i miss you!  xxxx

0,2326742303,Thu Jun 25 07:27:05 PDT 2009,NO_QUERY,Marilou1970,@Elphabarocks01 Good luck getting it all done! I know its a crazy day for me and I wont have much to to Robsess 

0,2326742544,Thu Jun 25 07:27:06 PDT 2009,NO_QUERY,lynokelly,WTH? I apparently only got a C on my exam and I worked my butt off  What's the deal?

0,2326742551,Thu Jun 25 07:27:06 PDT 2009,NO_QUERY,eboogiee,Eating Coon-Fil-A before a two-hour lecture ftmfL. Itisssssssss 

0,2326742646,Thu Jun 25 07:27:07 PDT 2009,NO_QUERY,RianneBroekman,I HATE it!  what to do tonighttttttttt....

0,2326743520,Thu Jun 25 07:27:11 PDT 2009,NO_QUERY,Sciurusa,@ClaudeKelly Is it true?2010? So sad 

0,2326743777,Thu Jun 25 07:27:12 PDT 2009,NO_QUERY,stephanie51500,Wanting old people to answer their DAMN phone!!! Counting down the days till Buddy leaves for vac 

0,2326743870,Thu Jun 25 07:27:12 PDT 2009,NO_QUERY,xDreaDrewx,@sunshineGlendys i cant go either 

0,2326744249,Thu Jun 25 07:27:14 PDT 2009,NO_QUERY,ItsMeHarry,My mommy and brother and sister and nephew and grandparents and cousins are leaving the A today. 

0,2326744541,Thu Jun 25 07:27:15 PDT 2009,NO_QUERY,Sweet_Threet,"i made it to E2, but it is so freakin cold in here. "

0,2326744549,Thu Jun 25 07:27:15 PDT 2009,NO_QUERY,alleeisqueen,I have an anxiety attack waiting in the wings: so much to do by tomorrow! Traveling REALLY FAR from home! Still got post-break up gloom 

0,2326744559,Thu Jun 25 07:27:15 PDT 2009,NO_QUERY,doodleDOGartist,"Poor Rupert got stung by a bee last night at 7, by 11 his face had ballooned = Benadryl + e-vet + tired sore boy "

0,2326744961,Thu Jun 25 07:27:17 PDT 2009,NO_QUERY,cheek0,Stellastar is playing the Sandbox birthday party..... I want to go 

0,2326745103,Thu Jun 25 07:27:18 PDT 2009,NO_QUERY,chantelle1016,@jtimberlake Wish I were there this year  Hope you rock and roll dude... !! ;))

0,2326745254,Thu Jun 25 07:27:19 PDT 2009,NO_QUERY,jalensmom,@CostaVidaFred um.. Molly just called be back and said no delivery.. Our order is too small.. Same size as last time.. 

0,2326745277,Thu Jun 25 07:27:19 PDT 2009,NO_QUERY,clutterdiet,@MsSilpada Glad you liked my son's jellybean art! I don't want to disturb it but will need to clean the kitchen up at some point. Hmm.  

0,2326745646,Thu Jun 25 07:27:21 PDT 2009,NO_QUERY,scottkarlins,"@MattJStapleton y, sounds like your drive is going out. Same thing happened to collegues SR11. "

0,2326745647,Thu Jun 25 07:27:21 PDT 2009,NO_QUERY,seamusclarke,Finishing up OMA mtg before heading home. #Aer lingus gave me inside seat not aisle. So have to dash to airport for reseating lottery 

0,2326745975,Thu Jun 25 07:27:22 PDT 2009,NO_QUERY,SolyCorrea,Not well... 

0,2326746179,Thu Jun 25 07:27:23 PDT 2009,NO_QUERY,nyankokimi,So sad that the book store isn't open for me to get a sweet tea. 

0,2326746378,Thu Jun 25 07:27:24 PDT 2009,NO_QUERY,ironstef,a &quot;just because&quot; blip. now I need to get working  â « http://blip.fm/~8utu7

0,2326746492,Thu Jun 25 07:27:25 PDT 2009,NO_QUERY,gingela5, We have bagworms...how depressing...and they say you have to go around and pick them off and squish them...eww no thanks...

0,2326746559,Thu Jun 25 07:27:25 PDT 2009,NO_QUERY,oliviaistaken,@Olivia_Sav :O Crush my hopes why dont you??? @KevinRuddPM does care hes just too busy these days :O 

0,2326746852,Thu Jun 25 07:27:26 PDT 2009,NO_QUERY,Bonivauk,omfg i think my cat is dead. she made some weird sound late last night outside and now she has not come back. 

0,2326746985,Thu Jun 25 07:27:27 PDT 2009,NO_QUERY,Kristin61378,@DonnieWahlberg I really need some twugs right now. 

0,2326747193,Thu Jun 25 07:27:28 PDT 2009,NO_QUERY,evil_cackle,"@Allieandra was probably my own fault / ignorance / ineptitude with myspace :\ am old, these newfangled things are far too complicated!! "

0,2326747468,Thu Jun 25 07:27:29 PDT 2009,NO_QUERY,MeanEliza,Hates bad remakes of awesome old songs. 

0,2326747498,Thu Jun 25 07:27:29 PDT 2009,NO_QUERY,ajung321,...smoke...LONG STORY...breakfast gone bad 

0,2326748223,Thu Jun 25 07:27:33 PDT 2009,NO_QUERY,downrighteerie,@kayebitch @flippin_insane Silly bitches. I wish I was there with you. 

0,2326748437,Thu Jun 25 07:27:34 PDT 2009,NO_QUERY,bellakarisma,&amp;cries* my grandma is leaving today...back to Hungary 

0,2326752569,Thu Jun 25 07:27:54 PDT 2009,NO_QUERY,chrissymassey,i'm so tired! 

0,2326753130,Thu Jun 25 07:27:57 PDT 2009,NO_QUERY,moniquita26,@lauraserrato @kaya781 @jesstx not trying to pop a bubble....but if I'm prego or have a baby....next year won't seem possible for us 

0,2326753186,Thu Jun 25 07:27:57 PDT 2009,NO_QUERY,flowerchild1979,NO!! Dont rain!! Not when i have to work outside 

0,2326753236,Thu Jun 25 07:27:57 PDT 2009,NO_QUERY,chocoxbaby,My face's still numb after that injection. 

0,2326753374,Thu Jun 25 07:27:58 PDT 2009,NO_QUERY,kujfest,@kaypants i haven't seen this thing you call the sun yet today 

0,2326753486,Thu Jun 25 07:27:59 PDT 2009,NO_QUERY,michellejoycid_,"so, after a good holiday, I'm back to work. "

0,2326753524,Thu Jun 25 07:27:59 PDT 2009,NO_QUERY,martinmorris79,Now back in Lanarkshire after my little trip to Bo'ness. Now I have to do some proper work 

0,2326754267,Thu Jun 25 07:28:03 PDT 2009,NO_QUERY,Olivia077,Not the old man 

0,2326754580,Thu Jun 25 07:28:04 PDT 2009,NO_QUERY,LadyMayura,owwwwwwwwwwww....................sunburns SUCK! and it's SOOOOOOOOOOO nice out today!!! 

0,2326755061,Thu Jun 25 07:28:06 PDT 2009,NO_QUERY,JaanaChloe,Does anyone know how to make your email work on an itouch? It keeps saying &quot;that email isn't valid&quot; when I try to reply 

0,2326755679,Thu Jun 25 07:28:09 PDT 2009,NO_QUERY,fluxystar,"@katie_raygun why can't we live closer to one another?  i really don't want to go there by myself, but i just might have to."

0,2326756114,Thu Jun 25 07:28:11 PDT 2009,NO_QUERY,lexiexangel,Has alot of hope frost frostwire chat &gt;_&gt;  cummon peeps! teamwork! xxxxxx

0,2326757051,Thu Jun 25 07:28:16 PDT 2009,NO_QUERY,AmyPredsfan,@sundaycosmetics I'm trying to do so. Re:The ministry - It's going to be so hard because I considered it as &quot;My Church&quot;. It's so sad. 

0,2326757984,Thu Jun 25 07:28:20 PDT 2009,NO_QUERY,eileentruax,Monetizing your blog @ #NAHJ09. First statement: no one cares about your blog 

0,2326758140,Thu Jun 25 07:28:21 PDT 2009,NO_QUERY,casiestewart,@peacePEACEout something making site slow. i know 

0,2326758541,Thu Jun 25 07:28:23 PDT 2009,NO_QUERY,BabyCakesTD,Its so gorgeous outside! Seems inappropriate for a funeral!  RIP Pat!

0,2326758582,Thu Jun 25 07:28:23 PDT 2009,NO_QUERY,already_used,@_sinequanon aw where r u?  berlin gay pride is on saturday and i'll be in berlin on saturday haha (kings of leon concert). fun fun 

0,2326758621,Thu Jun 25 07:28:23 PDT 2009,NO_QUERY,Dreamfall01,not on play 

0,2326758852,Thu Jun 25 07:28:24 PDT 2009,NO_QUERY,tomgidden,@Tetanus Apparently   I had assumed the ~1 year delay on Push Notifications was Apple implementing it over SMS etc. rather than polling.

0,2326759077,Thu Jun 25 07:28:25 PDT 2009,NO_QUERY,richokinetic,"@amandawormann hey, you're the marketing genius for Burton! Why can't i buy in AU? "

0,2326759851,Thu Jun 25 07:28:29 PDT 2009,NO_QUERY,karawaane,"@KSiddall I cannot shake people. like fake spambots, I block 'em, and the next day they are there again! I emailed twitter "

0,2326760323,Thu Jun 25 07:28:31 PDT 2009,NO_QUERY,epicipods,"@AppStoreMod I know, it is so annoying. By the time they do i already have 75% of my views "

0,2326760381,Thu Jun 25 07:28:32 PDT 2009,NO_QUERY,Katie_grace31,I am extremely depressed by the 10-day forecast - not a single sunny day in sight 

0,2326760651,Thu Jun 25 07:28:33 PDT 2009,NO_QUERY,NikiD_sports,"sitting in an InDesign class... enjoying it, but saddened that classes are coming to an end  2 more classes before I am done!"

0,2326760693,Thu Jun 25 07:28:33 PDT 2009,NO_QUERY,ladybug396,@fuzzymonkey13  im sorry!

0,2326760889,Thu Jun 25 07:28:34 PDT 2009,NO_QUERY,ladyvamp666,@xianvox Disturbing indeed that some people still go to that event even though they're aware of  that person's reputation. 

0,2326760909,Thu Jun 25 07:28:34 PDT 2009,NO_QUERY,megmeg09,i was told i was 3 nervous to give blood even tho i felt fine &amp; assured them i was fine. but health &amp; safety said no  am so angry @ myself

0,2326761228,Thu Jun 25 07:28:36 PDT 2009,NO_QUERY,martyfnday,"@pierski I'm not in the glasses boat (yet?), so I can't follow that awesome creed. Bummer. "

0,2326761604,Thu Jun 25 07:28:38 PDT 2009,NO_QUERY,marksy24,hey all hope all is well  weather in scotland is  awsome sadly im stuck in  the house with a bandage on my foot boo damn  new shoes suck 

0,2326761812,Thu Jun 25 07:28:39 PDT 2009,NO_QUERY,c_cmrb,"counting the minutes to the weekend ..... funny friday, and really heavy saturday!!! too much work to do!!!! "

0,2326762350,Thu Jun 25 07:28:41 PDT 2009,NO_QUERY,AlexIsCreative,is stuck in the office while the sun shines outside 

0,2326762788,Thu Jun 25 07:28:43 PDT 2009,NO_QUERY,DietSarah,Today is the corporate challenge 5K in Boston today - I'm very sad Diet.com never got off the wait list 

0,2326762859,Thu Jun 25 07:28:44 PDT 2009,NO_QUERY,_Cheeky_Monkey_,i just cried my eyes out!! :'( my grandparents left  i'm already missing the much! &lt;3 i love them and wish them the best! bon voyage! &lt;3

0,2326763067,Thu Jun 25 07:28:45 PDT 2009,NO_QUERY,primaveron,"@meerasapra shady! :| fell sick in the morning, so missd work, slept all day, and now awake  last nite's movi was also nuthn gr8."

0,2326763125,Thu Jun 25 07:28:45 PDT 2009,NO_QUERY,DRiNuS,Got headache. Took Neurofen Plus and it's still there!  http://ff.im/4qcz7

0,2326763158,Thu Jun 25 07:28:45 PDT 2009,NO_QUERY,chrissy91,@DonnieWahlberg not sure if I can push through today.  Too much on my mind.  

0,2326763315,Thu Jun 25 07:28:46 PDT 2009,NO_QUERY,Morgaine_LaFay,"@savvydoula Did the mother in question argue her case or was she too intimidated? Again, poor woman "

0,2326763472,Thu Jun 25 07:28:47 PDT 2009,NO_QUERY,vickidenisa,@DevinaRenata i was crying out loud last night when dea called me. I'm so sad kak 

0,2326763528,Thu Jun 25 07:28:47 PDT 2009,NO_QUERY,scattermoon,@greengloves ...I'm sorry to hear that...  *hugs*

0,2326763529,Thu Jun 25 07:28:47 PDT 2009,NO_QUERY,katherinepayne,Haha ok   im going 2 physical therapy 2day 

0,2326763628,Thu Jun 25 07:28:47 PDT 2009,NO_QUERY,WhoseLineRules,"I'm starting to hate waking up before noon. I'm bored, still tired, and there's nothing to do. "

0,2326763840,Thu Jun 25 07:28:48 PDT 2009,NO_QUERY,catherine558,Enjoying the lovely morning.  Expecting our daily thunderstorm this afternoon.  Just in time for sailing.  

0,2326764033,Thu Jun 25 07:28:49 PDT 2009,NO_QUERY,DaBoss18,"Still jealous of my girl for having the day off, but she is not going to the show.  Is it really only 10:30?????"

0,2326764264,Thu Jun 25 07:28:50 PDT 2009,NO_QUERY,myTsuKata,Oh noes!  They no longer have my Discover card penny design.   The replacement will not be a pun on my name. 

0,2326764277,Thu Jun 25 07:28:50 PDT 2009,NO_QUERY,fkncolee,is so sore 

0,2326764423,Thu Jun 25 07:28:51 PDT 2009,NO_QUERY,Serephan,Last breakfast burrito from here for a while 

0,2326764637,Thu Jun 25 07:28:52 PDT 2009,NO_QUERY,wackymondo,@lookadollar sorry I did not give you a stauts update. I got shelby home around 11ish and I was too tired to go.  

0,2326764897,Thu Jun 25 07:28:53 PDT 2009,NO_QUERY,janauhrich,@MiguelAntonio I'm not allowed  I'd be there everyday if I could. Are you going to happy today?

0,2326764985,Thu Jun 25 07:28:54 PDT 2009,NO_QUERY,colette181,Waiting for the car to get fixed...so much for shopping for a dress today 

0,2326765472,Thu Jun 25 07:28:56 PDT 2009,NO_QUERY,ronaldojamie,Nothing to do but watch tennis! Hate warm days 

0,2326765748,Thu Jun 25 07:28:58 PDT 2009,NO_QUERY,TraderNakul,Loss on my BIDU Short  Stopped out

0,2326765750,Thu Jun 25 07:28:58 PDT 2009,NO_QUERY,Sherylpz,@TynzBoomPow WHO ASK YOU DON'T WANNA COME 

0,2326765826,Thu Jun 25 07:28:59 PDT 2009,NO_QUERY,karlitap,@MajesticFlower you totally jynxed the sunny day. its pouring! 

0,2326765897,Thu Jun 25 07:28:58 PDT 2009,NO_QUERY,sedatedspyder,is feeling like a piece of shit on the sidewalk... not good 

0,2326766005,Thu Jun 25 07:28:59 PDT 2009,NO_QUERY,Hellhale,urg just got upset at yet another shiney finger 

0,2326766163,Thu Jun 25 07:29:00 PDT 2009,NO_QUERY,Joanna90,big day tomorow...God have mercy 

0,2326766389,Thu Jun 25 07:29:01 PDT 2009,NO_QUERY,DoronSalomon,@JackSavoretti why has your Bush Hall concert been cancelled??? 

0,2326766440,Thu Jun 25 07:29:01 PDT 2009,NO_QUERY,Sheboygen,apparently kassi has hit that age where she no longer wants to sleep in until 10 or 11 

0,2326769416,Thu Jun 25 07:29:16 PDT 2009,NO_QUERY,jennybaquing,Chip is missing  Please pray that we find him!

0,2326769417,Thu Jun 25 07:29:16 PDT 2009,NO_QUERY,tfrankl,My back is killing me all of the sudden. Of course it's in a place that I can't get to pop 

0,2326769559,Thu Jun 25 07:29:16 PDT 2009,NO_QUERY,tommylonsdale,"Sat waiting for a bloody train  I've got half an hour, and I hate middlesborough!"

0,2326769655,Thu Jun 25 07:29:17 PDT 2009,NO_QUERY,tomeglenn,@lifeofsacrifice Yeah 

0,2326769838,Thu Jun 25 07:29:17 PDT 2009,NO_QUERY,nateriggs,@sbarton1220 Left around 8PM.  High st in north short north by salon lofts and donatos.  Sorry we missed each other 

0,2326769953,Thu Jun 25 07:29:18 PDT 2009,NO_QUERY,andykinsey,@ernmander we had a server meltdown last night  new hardware needed today.... mostly sorted now #thrushthursday

0,2326770056,Thu Jun 25 07:29:18 PDT 2009,NO_QUERY,Twilightchic17,SOO confused it's not even funnny 

0,2326770747,Thu Jun 25 07:29:22 PDT 2009,NO_QUERY,TheTweetFreak,@eu4ia823 sum1 hacked my account and started to promote their company through my status 

0,2326771037,Thu Jun 25 07:29:23 PDT 2009,NO_QUERY,danapascu,S-a relansat http://www.cartoonnetwork.ro/ E tot aiurea si plin de bannere. Ba chiar cu mai putin continut decat inainte. 

0,2326771103,Thu Jun 25 07:29:24 PDT 2009,NO_QUERY,Anto0o,"@EczemaTreatment Yeah, a steroid cream and a moisturiser. It does help a bit but I'm still left with it on my arms. "

0,2326771530,Thu Jun 25 07:29:26 PDT 2009,NO_QUERY,katie_stanton,@AFontane10 word... tickets are sold out at the air and space museum  i had no idea i was sposed to get tix for y'all. but sushi is onnn

0,2326771741,Thu Jun 25 07:29:27 PDT 2009,NO_QUERY,autumngirl01,"Whole day off, paralyzed by too many choices for activities and figuring out how to balance what I need to do vs. what I want to do.  "

0,2326771898,Thu Jun 25 07:29:27 PDT 2009,NO_QUERY,Sheep96,1 hour until work 

0,2326772071,Thu Jun 25 07:29:28 PDT 2009,NO_QUERY,cityrail,@yuniesan oh i see.  well i hope you'll be able to find in stores then

0,2326772087,Thu Jun 25 07:29:28 PDT 2009,NO_QUERY,glotrovato,"Aw man, just after I posted that the clouds came back   Lord what did we do to deserve this torture?  Hope the sun comes back.  : /"

0,2326772565,Thu Jun 25 07:29:31 PDT 2009,NO_QUERY,xxJONASaholicxx,@1Omarion PLEASE SAY HI TO ME AND @TheodoraBagwell she is upset that u are not tweeting to her n she is a BIG fan! 

0,2326781020,Thu Jun 25 07:30:10 PDT 2009,NO_QUERY,lilmisshollie,@rageaccount SILENCE BOY. whys everyone older than me.  oh well DRINKS ON U 

0,2326781509,Thu Jun 25 07:30:12 PDT 2009,NO_QUERY,mattswasey,"@emmerblue yes, it is the panthers I want to connect with!  sadly alumtweet doesn't recognize middle schools "

0,2326781539,Thu Jun 25 07:30:12 PDT 2009,NO_QUERY,grcygrl94,packinng to go home   ill be living here in 3 years though!! ;)

0,2326781634,Thu Jun 25 07:30:13 PDT 2009,NO_QUERY,garciax5,Thoughts and prayers go out to Farrah Fawcetts fam on this dreary foggy morning. 

0,2326781752,Thu Jun 25 07:30:13 PDT 2009,NO_QUERY,aeslehc,AHHHHHHH screw dreams about me exploding and flying through the air. Up early AGAIN 

0,2326781904,Thu Jun 25 07:30:14 PDT 2009,NO_QUERY,sophiep_efc,dono y i feel lyk i do it hurts an i dont want to feel this anymore 

0,2326782072,Thu Jun 25 07:30:15 PDT 2009,NO_QUERY,SpikeShinnizle,@SamBennington It's really sad .. 

0,2326782578,Thu Jun 25 07:30:17 PDT 2009,NO_QUERY,KikiUncool,i think i lost nearly everyone who was important in my life ... the last ones today   where's my place where did I go wrong? 

0,2326783030,Thu Jun 25 07:30:18 PDT 2009,NO_QUERY,Se7en_Vandalay,@MistyMontano Not as good as I'd hoped. The tomatoes that we had as starts are all that is left. The seedlings were attacked by our dogs. 

0,2326783537,Thu Jun 25 07:30:21 PDT 2009,NO_QUERY,SageLopez,Forgot my Jean!  and now getting readyy .

0,2326783685,Thu Jun 25 07:30:21 PDT 2009,NO_QUERY,mere_says,so much for a bright sunny weekend. how does 80% of america have higher than average temps when we have 60's  I want summer please!

0,2326784256,Thu Jun 25 07:30:25 PDT 2009,NO_QUERY,Rae4OSU,@natneagle oh no  I sure hope Nick is ok! Just taking precaution I'm sure. Keeping him in my thoughts

0,2326784464,Thu Jun 25 07:30:25 PDT 2009,NO_QUERY,stephibobz,really really hopes she's not the only one thats going to next wednesday's graduation  hope some other come...

0,2326784587,Thu Jun 25 07:30:26 PDT 2009,NO_QUERY,ctrubbicco,Who cares about Shaq! The Celtics are talking about trading Rondo! http://tinyurl.com/narkz4 I like Rondo! humph! 

0,2326784736,Thu Jun 25 07:30:27 PDT 2009,NO_QUERY,prescioza,Mmm I feel sooo empty today 

0,2326784844,Thu Jun 25 07:30:27 PDT 2009,NO_QUERY,Burre83,@frebro Moving out of sthlm for good? 

0,2326785199,Thu Jun 25 07:30:29 PDT 2009,NO_QUERY,apriltan_,i want to watch dora's movieeeeee! 

0,2326785260,Thu Jun 25 07:30:29 PDT 2009,NO_QUERY,Boobiex3,"omgg , I get it life goes on but them people were my life I won't forget1 single 1 of them , just like a tatto ill always have em "

0,2326785329,Thu Jun 25 07:30:29 PDT 2009,NO_QUERY,projectbowl,"@cilaa come to the portal and let us hug you honey   we're here for you always, k?"

0,2326785423,Thu Jun 25 07:30:30 PDT 2009,NO_QUERY,jesseusebio,@j_maranz following my brother's footsteps  LOL parents are soo very cheesed

0,2326785719,Thu Jun 25 07:30:32 PDT 2009,NO_QUERY,mattmainster,No  Britt at work today...so ronery 

0,2326785742,Thu Jun 25 07:30:31 PDT 2009,NO_QUERY,Rufus_Jay,@emmanx I've hurt myself! 

0,2326785883,Thu Jun 25 07:30:32 PDT 2009,NO_QUERY,teacbee,"We have got to move this weekend, this apt is officially hotel for dogs. Closed Sugar's leg in the door &amp; Cinco almost ran a lady over. "

0,2326786107,Thu Jun 25 07:30:33 PDT 2009,NO_QUERY,1AnOnlyRockstar,"unruly hair, Starbucks on my shirt, backed up traffic, running late... it's going to be a shotty day "

0,2326786551,Thu Jun 25 07:30:35 PDT 2009,NO_QUERY,Nassyminaj,oooo boy coulndnt sleep like dat my head hurts 

0,2326787568,Thu Jun 25 07:30:40 PDT 2009,NO_QUERY,Somerlea,I won't be on the Social Nerdia Show! today    BUT you should check it out anyways. http://www.blogtalkradio.com/socialnerdia

0,2326787782,Thu Jun 25 07:30:41 PDT 2009,NO_QUERY,veriette,i will not spend another day solely on twitter like i done last night  its so addictive! im away to tidy up..or so i say

0,2326787821,Thu Jun 25 07:30:41 PDT 2009,NO_QUERY,emmabitty,the orange is too hard 

0,2326787982,Thu Jun 25 07:30:42 PDT 2009,NO_QUERY,noway_itscinque,@victoriaroseee  hmph. i think there's another baseball tournament in o-town tonight haha

0,2326788254,Thu Jun 25 07:30:43 PDT 2009,NO_QUERY,myfais,@heyairtraffic aww why? 

0,2326788263,Thu Jun 25 07:30:43 PDT 2009,NO_QUERY,FoolProofDiva,@fabglance1 oh no!! you have to eat something! I'm getting queesy just thinking about it 

0,2326788281,Thu Jun 25 07:30:43 PDT 2009,NO_QUERY,carwashh,Transformers at the iMax was awesome! Tiring weekend helping with UKeSA LAN finals and the g/f leaves moving back to Thailand tomorrow 

0,2326788509,Thu Jun 25 07:30:44 PDT 2009,NO_QUERY,twistd_illusn,@meehmoni hopefully! I waited after the credits to see if there was anything but there wasn't. 

0,2326788649,Thu Jun 25 07:30:45 PDT 2009,NO_QUERY,TracyPage,Wishing I had gotten up early enough to have breakfast. I'm starving and in sales meeting so..  I have to wait..  

0,2326789053,Thu Jun 25 07:30:47 PDT 2009,NO_QUERY,gabbyheartsyou,"crap, texting is addicting "

0,2326789553,Thu Jun 25 07:30:49 PDT 2009,NO_QUERY,SamPadalecki,Day off today and I have done nothing 

