sentiment,userid,date,query,userId,text0,1967471793,Fri May 29 19:38:34 PDT 2009,NO_QUERY,conceive_plus,Latest news: Why do i feel so crappy?  - Long Term TTC &amp; Assisted Conception ... http://bit.ly/Mn2qv

0,1967472613,Fri May 29 19:38:39 PDT 2009,NO_QUERY,GirlSascha,"At the Griffith Observatory- there's a huge model of all the planets, but Pluto is missing. I forgot Pluto isn't a planet anymore. "

0,1967472668,Fri May 29 19:38:40 PDT 2009,NO_QUERY,chicrunner,"@wwwjeffmayca sand is because you ride/run the beach path, but it's well kept. boyfriend. yes. ha ha sorry "

0,1967472704,Fri May 29 19:38:40 PDT 2009,NO_QUERY,mpandabear,i should be getting ready for owl city. BUT NO. i'm grounded 

0,1967472990,Fri May 29 19:38:42 PDT 2009,NO_QUERY,MisterDiggler,"Grrr. The Kogi Korean BBQ Taco Truck is in Santa Fe Springs. So close, yet so far.  I wanna try it already."

0,1967473090,Fri May 29 19:38:42 PDT 2009,NO_QUERY,thetoughsams,@MyCatIsOnFire i know  but you were absent for the last few days. FACK!

0,1967473291,Fri May 29 19:38:44 PDT 2009,NO_QUERY,Tito211,@court482 not looking good Court!!  Denver is on the ropes...

0,1967474163,Fri May 29 19:38:50 PDT 2009,NO_QUERY,nikkylee,"@angiewarren she posted a blog,  i have a link on mine. She is on a mission  a sucky one, but one she will beat the *@&amp;~+ out of!"

0,1967474424,Fri May 29 19:38:52 PDT 2009,NO_QUERY,kabezzz,twitter wont let me put up a user pic! 

0,1967474902,Fri May 29 19:38:55 PDT 2009,NO_QUERY,Xn00bXb00bX,@pkandrosy hey thats not nice  hahah.

0,1967474961,Fri May 29 19:38:55 PDT 2009,NO_QUERY,LynneFrederick,out for a bit before they leave for the summer 

0,1967474979,Fri May 29 19:38:55 PDT 2009,NO_QUERY,ZEROMSC,@StephSooWavy it says I wasn't 

0,1967479770,Fri May 29 19:39:27 PDT 2009,NO_QUERY,cdeems,When it comes to Jon and Kate I'm on the kids' side obviously but also Jon's. Kate treats him like dirt. 

0,1967479796,Fri May 29 19:39:28 PDT 2009,NO_QUERY,DeserayAlesia,Rain pls go away! 

0,1967479884,Fri May 29 19:39:28 PDT 2009,NO_QUERY,kwindbigler,Fantastic: Health insurance canceled because bill got sent to wrong address while I was in New York. 

0,1967480036,Fri May 29 19:39:29 PDT 2009,NO_QUERY,psyco_chick32,@knittingknots: good to hear!  Being sick sucks 

0,1967480536,Fri May 29 19:39:33 PDT 2009,NO_QUERY,MissInvisiblex3,@hideawayxx sorry about that.  it's really a shame that we both can't go when we're such huuge fans of her.

0,1967481051,Fri May 29 19:39:36 PDT 2009,NO_QUERY,Twilighterleah,I'm going to miss the Trailer premiere of New Moon!!!! *cries and screams* Hug me 

0,1967481089,Fri May 29 19:39:38 PDT 2009,NO_QUERY,KyleGallienne,"Doesn't have a face now, thanks twitter. "

0,1967481782,Fri May 29 19:39:41 PDT 2009,NO_QUERY,rivensky,@trav1sty  well tell everyone I'm there with you in spirit! IFS! Woo!

0,1967481899,Fri May 29 19:39:42 PDT 2009,NO_QUERY,iliveisl,"@ArielRebel bonne nuit d'une autre quebecoise   sheesh, my french stinks after being in the states so long  "

0,1967482526,Fri May 29 19:39:46 PDT 2009,NO_QUERY,freexasxaxbird,@Brieannnn i wish you were on againnn  i was cleaning

0,1967482659,Fri May 29 19:39:47 PDT 2009,NO_QUERY,Santiago_Steph,I hate scary movies 

0,1967483157,Fri May 29 19:39:50 PDT 2009,NO_QUERY,oddie_faneenala,Welp this sunday is gonna be a super sad one 

0,1967483366,Fri May 29 19:39:52 PDT 2009,NO_QUERY,jackieherb,So tired I feel like I can hardly move 

0,1967483929,Fri May 29 19:39:55 PDT 2009,NO_QUERY,ragingmon,is alone here at Kublai's Cafe. I wonder where are the other organizers 

0,1967484122,Fri May 29 19:39:57 PDT 2009,NO_QUERY,angelamelick,And now I gotta drive all the way downtown FUUUUUUUUUUUUUUUUKKkk &gt;_&lt; I guess my Good Luck Friday couldn't keep it up   

0,1967484173,Fri May 29 19:39:57 PDT 2009,NO_QUERY,luismoreno6975,Drinking solo &amp; listening 2 one of my favorit bands &quot;The Postal Service&quot; thinking about u. 

0,1967484418,Fri May 29 19:39:59 PDT 2009,NO_QUERY,bxblondqt21,@gmkhail85 my day was good yea I know I was werkin nd then I was buyin couple shyt since I gt paid  money goes fast fkn rentttt

0,1967484542,Fri May 29 19:40:00 PDT 2009,NO_QUERY,karlynbabb,i miss him already 

0,1967484620,Fri May 29 19:40:00 PDT 2009,NO_QUERY,torturedmommy,@mommytwingirls: it must have been good - it went quick.  I didn't get any.  

0,1967485062,Fri May 29 19:40:03 PDT 2009,NO_QUERY,kezza2909,wish she could sleep 

0,1967485149,Fri May 29 19:40:04 PDT 2009,NO_QUERY,chuckself,frustration with moving website to new host  Many problems. Sometimes it's good to walk away from it.  I will try to figure it out later.

0,1967485156,Fri May 29 19:40:04 PDT 2009,NO_QUERY,blobcoastvegas,My washer and dryer went out.. very bad news.. I had to for the first time go to a laundry mat to do the laundry....It was doo-doo  ha ha

0,1967485444,Fri May 29 19:40:05 PDT 2009,NO_QUERY,Yarkii,@Alyssa_Milano Poor darling Phoenix. It breaks my heart. Dogs have the most loving nature - how could anyone do that? 

0,1967485703,Fri May 29 19:40:07 PDT 2009,NO_QUERY,Amoo23,is going to bed soon work tomorrow 

0,1967485905,Fri May 29 19:40:08 PDT 2009,NO_QUERY,Azleeshy,"@Alyssa_Milano OMG..    Only a monster can do something like that, unreal..   grrrrrrrr"

0,1967486045,Fri May 29 19:40:09 PDT 2009,NO_QUERY,Harmonyjackson,just had a lovely visit with 1 of my fav people.... Betty!!!! but she didn't have my cuban cigerellos with her 

0,1967486087,Fri May 29 19:40:09 PDT 2009,NO_QUERY,KittyBradshaw,@MsLes30 loll everytime you let me out you send me right back in 

0,1967486455,Fri May 29 19:40:11 PDT 2009,NO_QUERY,CrysChantille,@ChollieSwaggmor ahahahahaha! yeah I knew u said no lol poor leon 

0,1967486793,Fri May 29 19:40:14 PDT 2009,NO_QUERY,seconddrink,"@mybonescostme YESH, I SAW THE PICS.  I'M QUITE JEALOUS.  NO LIT CANDLES FOR MY DISNEY PRINCESS DRESS. "

0,1967486844,Fri May 29 19:40:14 PDT 2009,NO_QUERY,yeahprobably,"also, did #GQMF become a trend at any point while I was gone in the last hour or so? "

0,1967486993,Fri May 29 19:40:15 PDT 2009,NO_QUERY,FreeFallin2033,i already miss my anderson ladies...sad day. 

0,1967487099,Fri May 29 19:40:16 PDT 2009,NO_QUERY,trekkiegal,I totally forgot that eastern Indiana is 1 hour later than here.  That means I have to get up an hour earlier than I thought tomorrow! 

0,1967487141,Fri May 29 19:40:16 PDT 2009,NO_QUERY,NicoleCarina,Hmm... Started raining... This is not conducive to going out and about downtown tonight.   Maybe it will let up?

0,1967487206,Fri May 29 19:40:16 PDT 2009,NO_QUERY,Netty1Net,@HEYESCO LOL! I did that for lent. Buuuut @ least u can pretend to be faded. No matter how hard I try a carrot just isn't a cookie 

0,1967487213,Fri May 29 19:40:17 PDT 2009,NO_QUERY,anneANDsam,so when my grandfather gave me this mac.. he forgot to tell me what the password for everything was. now i cant download some things 

0,1967487313,Fri May 29 19:40:17 PDT 2009,NO_QUERY,triciamarie25,My little bro just graduated 

0,1967487335,Fri May 29 19:40:17 PDT 2009,NO_QUERY,shinseiki21,"I miss you so much @leoncitobonito, i wish you could be here "

0,1967487371,Fri May 29 19:40:18 PDT 2009,NO_QUERY,tjmapes,Having a beer and cooking hotdogs. Erin and I failed to find our bistro table 

0,1967487492,Fri May 29 19:40:18 PDT 2009,NO_QUERY,annaaaaaa,im at the berrangs and i didnt even try to be here 

0,1967487528,Fri May 29 19:40:19 PDT 2009,NO_QUERY,schlegel_bagel,i don't get it......ugggg... its too hot 

0,1967487696,Fri May 29 19:40:19 PDT 2009,NO_QUERY,xKARLAVx,"@IAMtheCOMMODORE i'm sooo sad, 'cause i couldn't talk to you guys, i've got questions. if you reply me.. that would make me happy "

0,1967487730,Fri May 29 19:40:20 PDT 2009,NO_QUERY,DaisyFab,Lmfaoo I know! I got someone in mind but I feel lazy  @allstar_ace

0,1967487754,Fri May 29 19:40:20 PDT 2009,NO_QUERY,raeraeeveryday,@Klaye damn. I missed it.    should have BBM'd this info. I forget to check twitter sometimes.

0,1967487826,Fri May 29 19:40:20 PDT 2009,NO_QUERY,w07v3r,@scifigirl oh man! i'm sorry to hear that. sucky! 

0,1967487829,Fri May 29 19:40:20 PDT 2009,NO_QUERY,JuniorDaKid,@danielleashanti my bad I know ur too FULL to be bothered wit my problems. 

0,1967488056,Fri May 29 19:40:22 PDT 2009,NO_QUERY,marurokz,my dog just had a fit 

0,1967488134,Fri May 29 19:40:22 PDT 2009,NO_QUERY,gothicreations,"I'm not going to tell about my dream. sadly, it was a wee bit depressing to wake up and not have it be real. "

0,1967488352,Fri May 29 19:40:24 PDT 2009,NO_QUERY,lelandgirl,@hollia369 its official... she's really mad and refuses to talk to me. i tried talking to her when she got on gmail... but she ignored me 

0,1967488797,Fri May 29 19:40:26 PDT 2009,NO_QUERY,monagalvao,I WANNA GO HOME RIGHT NOW! GOOOSH!! HELP ME 

0,1967488861,Fri May 29 19:40:27 PDT 2009,NO_QUERY,Starstrukk09,ugh it's a Friday night and I'm so bored. There's nothing 2 do. N none of my buddies r on 

0,1967489040,Fri May 29 19:40:28 PDT 2009,NO_QUERY,synthianguyen,@TheRealJordin I almost went to O'Connor before you became an idol! lol but i moved  and i will see you July 13th!

0,1967489106,Fri May 29 19:40:29 PDT 2009,NO_QUERY,Sharonissick,@IKrocks_ Jacky! I love u girl and i miss u soo much! haha funny uhu? we saw us yesterday and now i'm here missing u DAMN! How is Kary? 

0,1967489200,Fri May 29 19:40:29 PDT 2009,NO_QUERY,msansonetti,Poo. I have to go to work tomorrow ... good night all! Last day for teachers. First day of my summer schedule. 

0,1967489203,Fri May 29 19:40:29 PDT 2009,NO_QUERY,Amiloo,16 hours driving makes one's bum quite sore 

0,1967489244,Fri May 29 19:40:29 PDT 2009,NO_QUERY,freewarefiend,realizing that caring for a parent in extremely and rapidly deteriorating health 24-7 single handedly isn't do-able forever 

0,1967489427,Fri May 29 19:40:31 PDT 2009,NO_QUERY,blankomeowlover,@xc_girl o yes and escape the fate. I wish you could be here 

0,1967489476,Fri May 29 19:40:31 PDT 2009,NO_QUERY,ilovejamesryan,@ballhard55 bout what baby 

0,1967489581,Fri May 29 19:40:32 PDT 2009,NO_QUERY,sam212kobus,My pants smell funny 

0,1967489671,Fri May 29 19:40:32 PDT 2009,NO_QUERY,creealice,"@twitoria you don't need to! i'm online using some site haha. ahhh i'm following you now, btw i only just got what your sn means "

0,1967490085,Fri May 29 19:40:35 PDT 2009,NO_QUERY,california_rain,@kellyisakilla aw kelly.  I love youu

0,1967490353,Fri May 29 19:40:37 PDT 2009,NO_QUERY,whiting_c,wants the Arctic sea ice news &amp; analysis satellite back up and operational 

0,1967490427,Fri May 29 19:40:37 PDT 2009,NO_QUERY,rachelmichelle,The last thing I want to think about after an icky day at work is having to go back in the morning....but I do.  

0,1967491515,Fri May 29 19:40:45 PDT 2009,NO_QUERY,SallySteffensen,@twitrbackground I can't figure out how to DM you back.  I did the setting thing you suggested.  Now I have 2 backgrounds from your site. 

0,1967491857,Fri May 29 19:40:47 PDT 2009,NO_QUERY,enygma,"@ramsey awesome...I couldn't get that to cooperate  share your secrets, oh wise one"

0,1967491932,Fri May 29 19:40:47 PDT 2009,NO_QUERY,icantforgetyou,errrrg!! amazing dance today 8 more days of school lol yay and no  wont see patty for 3 MONTHS!!! lol and it was yearbook today

0,1967492158,Fri May 29 19:40:50 PDT 2009,NO_QUERY,skupiter628,Lovely! just got a big chip in my windshield while driving on the freeway! 

0,1967492164,Fri May 29 19:40:49 PDT 2009,NO_QUERY,Dislexa,Paying for the festivities of last night now  Live Nudes Barrack O'PROMa tonight!

0,1967492319,Fri May 29 19:40:50 PDT 2009,NO_QUERY,melsnell7,@ShannaPace as soon as the girl walked out of the room she darted and we immediately noticed she took a vest. couldnt catch her 

0,1967492326,Fri May 29 19:40:50 PDT 2009,NO_QUERY,caitlinmorris,the movie tonight was scary 

0,1967492452,Fri May 29 19:40:51 PDT 2009,NO_QUERY,hummingbird2,"@pamfidler So sad, I have read about their decline  We thought we would give it a try &amp; add 2 more nest boxes. Hope it's not 2 late."

0,1967492460,Fri May 29 19:40:51 PDT 2009,NO_QUERY,_Klaudia_,@gallerycat i miss u all ready  *tear*

0,1967492511,Fri May 29 19:40:51 PDT 2009,NO_QUERY,GiuliaDaSilva,@PaoC_E i did my oral test (cevaz) i miss you 

0,1967492699,Fri May 29 19:40:52 PDT 2009,NO_QUERY,debbie_kermy,home!  I know we need the money but I wish my hubby did not have to work! Missing him!

0,1967492759,Fri May 29 19:40:53 PDT 2009,NO_QUERY,meganlo,"@brolivia_k yes maam! will you be there tuesday, or do you work? "

0,1967492891,Fri May 29 19:40:53 PDT 2009,NO_QUERY,revraygreen,@CkrofOne  it just isn't meant to be  send me a direct w/your user name or ?)

0,1967495290,Fri May 29 19:41:09 PDT 2009,NO_QUERY,sharonelz,"i official have an addiction to spending money on books.  im about to buy 2, &amp; i have about 8 at home that i have yet to read "

0,1967495482,Fri May 29 19:41:10 PDT 2009,NO_QUERY,mjwoo,@kskinder how's his voice he was worried preshow bc he is sickkie. 

0,1967495514,Fri May 29 19:41:10 PDT 2009,NO_QUERY,janeetmb,@steelergurl we are too divided unfortunately.     I feel the sentiment tho.

0,1967495684,Fri May 29 19:41:12 PDT 2009,NO_QUERY,daydreamer22688,I think I'm going back to to Hotel Cafe tomorrow to see Greg Laswell! Even though I wish I was going back to see Sam tonight! 

0,1967496231,Fri May 29 19:41:15 PDT 2009,NO_QUERY,maddiannew,I am wearing a very short skirt and it is fucking cold mum left me here 

0,1967496476,Fri May 29 19:41:19 PDT 2009,NO_QUERY,t00muchcaffeine,@xoizen I'm all about fast Internet.  Tmobile isn't cutting it for me.  3g isn't even out yet for Hawaii 

0,1967496576,Fri May 29 19:41:17 PDT 2009,NO_QUERY,luv4svu,"@conc3p It always been a fav, but particularly right now it's like look how far we've fallen. Made me sad.  I just plain miss Liv &amp; El"

0,1967496914,Fri May 29 19:41:20 PDT 2009,NO_QUERY,kezbat,I can't has sleep 

0,1967497130,Fri May 29 19:41:21 PDT 2009,NO_QUERY,jrrichard9008,I am trying to burn movies off of ethan's computer but he has a compaq and so its bein stoopid... Whatever will i do 

0,1967497292,Fri May 29 19:41:22 PDT 2009,NO_QUERY,leslieyuko,cleaning my room....it's extremely messy. 

0,1967497578,Fri May 29 19:41:24 PDT 2009,NO_QUERY,pianokeyteeth,@muhranduh  it's ok. call me tomorrow

0,1967498264,Fri May 29 19:41:29 PDT 2009,NO_QUERY,JiMpiSh,@tommytrc @tvorse @LisaRedShoesPR The more I hear about it the more I wish I was going! 

0,1967498746,Fri May 29 19:41:32 PDT 2009,NO_QUERY,muhnica,@erickimberlin I want to eric!  that would be sweet!  they closed all the krispy kremes in new mexico.  

0,1967498964,Fri May 29 19:41:34 PDT 2009,NO_QUERY,nomadicmatt,Updated my carnival of blogs to include some people I forgot....sorry  http://bit.ly/nNcYa

0,1967499203,Fri May 29 19:41:35 PDT 2009,NO_QUERY,cosmicpolitan,Why do Dutch people mention &quot;DIE&quot; all the time??!! It scares me. 

0,1967499325,Fri May 29 19:41:36 PDT 2009,NO_QUERY,bkoppe,"w00t! @nineinchnails playing &quot;I'm Afraid of Americans&quot;  Sadly, without David Bowie "

0,1967499370,Fri May 29 19:41:36 PDT 2009,NO_QUERY,elliesadventure,@DodgersNation though I understand most people are turned on by homeruns. Players like Pierre are often underappreciate 

0,1967499708,Fri May 29 19:41:39 PDT 2009,NO_QUERY,onlyrob1402,Y!oi thay doi khi chung ta... thoi day! 

0,1967499868,Fri May 29 19:41:40 PDT 2009,NO_QUERY,stephiej8,Watching the Indians game with my patients...and missing my baby  

0,1967499931,Fri May 29 19:41:40 PDT 2009,NO_QUERY,misskoneko,"noooooo, the music, it starts again, noooooo "

0,1967500143,Fri May 29 19:41:42 PDT 2009,NO_QUERY,_Mattie_,had a rather sad experience 

0,1967500250,Fri May 29 19:41:43 PDT 2009,NO_QUERY,clubdirthill,"@longzheng Your site is down, at least for me. "

0,1967500292,Fri May 29 19:41:43 PDT 2009,NO_QUERY,sexidance,@moefugger ROFL was it really good? i wouldve freaked out  did i tell u bout my walkout of the $ movies when watching texas chainsaw mass?

0,1967500364,Fri May 29 19:41:43 PDT 2009,NO_QUERY,PaulyGonzalez,@RayleneCaceres have fun without me 

0,1967500558,Fri May 29 19:41:45 PDT 2009,NO_QUERY,paojau,"Tonight's gonna be a long night! 2 admissions, recap, and a transfer! "

0,1967500600,Fri May 29 19:41:45 PDT 2009,NO_QUERY,pritaprita,I miss my boyfriend soo much.. 

0,1967500669,Fri May 29 19:41:45 PDT 2009,NO_QUERY,heyimsam,i'm tired and sooooooooo not foward to finishing my barely worked on research paper tommorow. 

0,1967501098,Fri May 29 19:41:48 PDT 2009,NO_QUERY,acts_rox,I so totally wanna write right now...but I have no new material. 

0,1967501468,Fri May 29 19:41:51 PDT 2009,NO_QUERY,AngryHabsFan,"Jim Hughson &amp; Craig Simpson will call the Stanley Cup finals on CBC this year, not Bob Cole "

0,1967502727,Fri May 29 19:41:59 PDT 2009,NO_QUERY,kellykisses522,car died  *his bun bun*

0,1967503153,Fri May 29 19:42:02 PDT 2009,NO_QUERY,annamara,"@aprilleigh909 God, that's so awful. Why would you do that to your kid? "

0,1967503168,Fri May 29 19:42:02 PDT 2009,NO_QUERY,jaycemiguel,@mafiachild Brah Twitter is the Feds. We can see where you at and everything on here. 

0,1967503666,Fri May 29 19:42:05 PDT 2009,NO_QUERY,vicksprimed,#gasol your so sexy. Why are you a #laker 

0,1967504260,Fri May 29 19:42:09 PDT 2009,NO_QUERY,D_Steele,last night to spend with @ilovebicycles. I'm soooo gonna miss my buddy 

0,1967504661,Fri May 29 19:42:12 PDT 2009,NO_QUERY,randomfreak,@Heidibluegirl What??? What's wrong with the kitty?? 

0,1967504900,Fri May 29 19:42:14 PDT 2009,NO_QUERY,BrandyAlexis,The glass is looking half empty today....i don't like half empty 

0,1967505292,Fri May 29 19:42:16 PDT 2009,NO_QUERY,lorachelle,@aaronlowe I'm gonna miss that blue bumper. 

0,1967505433,Fri May 29 19:42:17 PDT 2009,NO_QUERY,nkotb5renee,"back from shopping, did not find ANY shoes in my size. geezz life sucks when it comes to shoe sizes "

0,1967505672,Fri May 29 19:42:19 PDT 2009,NO_QUERY,neonkitten,Business is still dead at my job. Asking for a raise would be laughed at. 

0,1967505675,Fri May 29 19:42:19 PDT 2009,NO_QUERY,plumeriafairy14,"my phone's breaking down on me. and just when something juicy and interesting breaks out via text, i cant effing reply!  super darn it!"

0,1967505803,Fri May 29 19:42:20 PDT 2009,NO_QUERY,huma_rashid,@jesswlin Oh no!   I hope it works out! &lt;3 What job is proving episodic?

0,1967506107,Fri May 29 19:42:22 PDT 2009,NO_QUERY,_lexieLEX_,"I think I'm gonna call it a night.  Sorry, guys."

0,1967506318,Fri May 29 19:42:23 PDT 2009,NO_QUERY,JessicaSarahS,@1Kali3 Me too  I really want to go... I'll try again tonight...

0,1967506348,Fri May 29 19:42:23 PDT 2009,NO_QUERY,baileighann,I'm so confused 

0,1967506932,Fri May 29 19:42:27 PDT 2009,NO_QUERY,juzzdalsanto26,i need a new book  at home. alone. singing all by myself.

0,1967507355,Fri May 29 19:42:30 PDT 2009,NO_QUERY,raymondgoho,Trying Netbeans PHP editor. It doesn't have a code completion 

0,1967507525,Fri May 29 19:42:32 PDT 2009,NO_QUERY,eunichiban,"@aycstacy but I can't go today  I have to go swim and BBQ (nope, no Cherry Kool-Aid ;) and exploit what's left of our schizo weather"

0,1967507543,Fri May 29 19:42:32 PDT 2009,NO_QUERY,jillyconjem,"I wish I'd at least hear a 'no' from him. Then I could stop obsessing... well, at least try to stop obsessing.  "

0,1967507696,Fri May 29 19:42:33 PDT 2009,NO_QUERY,maritza78,Kadence has a canker sore 

0,1967507913,Fri May 29 19:42:34 PDT 2009,NO_QUERY,Band_AidE,Driving up to Anaheim to drop my sister off  Shes goin to colorado for 10 weeks

0,1967508003,Fri May 29 19:42:35 PDT 2009,NO_QUERY,Kelly_Slobo,Ah the weekend...2 bad I'm all booked 

0,1967508054,Fri May 29 19:42:35 PDT 2009,NO_QUERY,mom2jazz,@dramadork001 finaly home myself. @lakernation pipers was packed couldn't get a seat. 

0,1967508506,Fri May 29 19:42:38 PDT 2009,NO_QUERY,lreynolds93,@catwillis awww! hahah they just commented me. wowowow i have way too much luck 

0,1967508687,Fri May 29 19:42:39 PDT 2009,NO_QUERY,daniee_shogun88,on the telephone 

0,1967508725,Fri May 29 19:42:40 PDT 2009,NO_QUERY,neoncolorwaves,@_casserole *sigh* i need a vacation. 

0,1967508885,Fri May 29 19:42:41 PDT 2009,NO_QUERY,nataliefranke,Just watched an ambulance take my next door neighbor away.. Say a prayer. He lost his wife earlier this year &amp; I'm so worried about him.. 

0,1967509124,Fri May 29 19:42:42 PDT 2009,NO_QUERY,keirakeira,"@abbeyeggo EGGS! hows the NZ? It's raining, we didn't play  OMG, me too with those pics... nearly. haha, i've watched it like 6 times now."

0,1967509150,Fri May 29 19:42:43 PDT 2009,NO_QUERY,KrisCleary,"I want a new phone, but I don't like any of the phones currently available. "

0,1967509613,Fri May 29 19:42:46 PDT 2009,NO_QUERY,davidd843,don't forget everyone tonight is Leno's lastnight on The Tonight Show 

0,1967509967,Fri May 29 19:42:48 PDT 2009,NO_QUERY,seh80,Hoping this isn't a kidney stone 

0,1967510290,Fri May 29 19:42:50 PDT 2009,NO_QUERY,jethrocarr,I really need to get a car - sick of having to do exercise to get to places 

0,1967511402,Fri May 29 19:42:58 PDT 2009,NO_QUERY,PaigeBBI,grabup.com has been unreachable all day 

0,1967511459,Fri May 29 19:42:58 PDT 2009,NO_QUERY,SisterDiane,Juuuuuust about done setting up the Provo booth. Missed out on paella.  #mf09

0,1967511604,Fri May 29 19:42:59 PDT 2009,NO_QUERY,sashafierce3,@MissLadii12 Hey girl!!! Shii i couldn't do it... lol.... maybe today my bad day... 

0,1967511695,Fri May 29 19:43:00 PDT 2009,NO_QUERY,cgreeeeeeen,"@TheRealJordin my throats been hurting me too today  it just started during school, so random! but its a genius excuse to have icecream!&lt;3"

0,1967511696,Fri May 29 19:43:00 PDT 2009,NO_QUERY,SkippenMyDesign,Is wishing it was my dad who died and not my mom 

0,1967511723,Fri May 29 19:43:00 PDT 2009,NO_QUERY,MISSKIMMIEBABY,gotta get up early 2morrow 4 wrk ughh!!!!! 

0,1967513698,Fri May 29 19:43:13 PDT 2009,NO_QUERY,yeuh_its_isis,crampssssss 

0,1967513924,Fri May 29 19:43:15 PDT 2009,NO_QUERY,stretchingabuck,@MoneyMethods Sorry to hear what is going on w/your son. I would be ticked as well. 

0,1967514035,Fri May 29 19:43:15 PDT 2009,NO_QUERY,thisischico,@rediscover_me that sucks. I'm sorry 

0,1967514261,Fri May 29 19:43:17 PDT 2009,NO_QUERY,heyyitskate,@ekaa17 i need the copy now. 

0,1967514683,Fri May 29 19:43:19 PDT 2009,NO_QUERY,atebymonsters,"I loved UP, didn't think they needed that type of villain. Story was great, looked like they reused some assets from past movies  #UP"

0,1967514791,Fri May 29 19:43:20 PDT 2009,NO_QUERY,dekal13,All my teams are losing  come on michigan! Losers bracket double header tomorrow!

0,1967514809,Fri May 29 19:43:20 PDT 2009,NO_QUERY,CrystalRye,Huevo and Plum (with an e) r all alone cuz daddy left them at home 

0,1967514894,Fri May 29 19:43:21 PDT 2009,NO_QUERY,Jessicaaleenaa,My stomach hurts. 

0,1967514951,Fri May 29 19:43:21 PDT 2009,NO_QUERY,ItsMeGregory,@jnthnlckwd why pray for me!? 

0,1967515127,Fri May 29 19:43:22 PDT 2009,NO_QUERY,CherylH77,"@emjaystar Omg, I actually did - and ran out of tissues   But then Scrubs was on after - I can't believe I was up until almost midnight"

0,1967515132,Fri May 29 19:43:22 PDT 2009,NO_QUERY,sophieforchuck,I want my cup back... what are the seven stages of grieving? What stage am I at... 

0,1967515661,Fri May 29 19:43:26 PDT 2009,NO_QUERY,UhOhitschristy,I cant believe tonight is the last episode of the tonight show. I'm going to miss Headlines 

0,1967515768,Fri May 29 19:43:27 PDT 2009,NO_QUERY,stNERD,She took away Lyly's cupcakes  Poor Lyly.

0,1967515918,Fri May 29 19:43:28 PDT 2009,NO_QUERY,maddieque,@charleneortiz maybe robert patinson! but i already voted to david archuleta! sorry! 

0,1967516033,Fri May 29 19:43:29 PDT 2009,NO_QUERY,samiajamal,@Canageek my fridays are always for hanging out though... 

0,1967516290,Fri May 29 19:43:31 PDT 2009,NO_QUERY,Andrea219,im totally confused by twitter  lets go LAKERS!

0,1967516840,Fri May 29 19:43:34 PDT 2009,NO_QUERY,innovatory,NOOOO please no cut off at 7:45  please?

0,1967516896,Fri May 29 19:43:35 PDT 2009,NO_QUERY,dhaley76,Long day.  

0,1967517141,Fri May 29 19:43:37 PDT 2009,NO_QUERY,CeratosaurusRex,&quot;Going to the dog races tomorrow.. Need companyy.  Anyone up to it should text me: 8134945146&quot;

0,1967517311,Fri May 29 19:43:38 PDT 2009,NO_QUERY,cesarmtz99,cleaning up the house with no help!! 

0,1967517416,Fri May 29 19:43:38 PDT 2009,NO_QUERY,Cupcake1012,"@CarrinaSophia   Ah, well...I heart you anyway!!"

0,1967517696,Fri May 29 19:43:40 PDT 2009,NO_QUERY,EdwinsStar,Have a Sore Throat hope it doesn't get any worse 

0,1967517920,Fri May 29 19:43:42 PDT 2009,NO_QUERY,syncerepapi,@purplepleather ummmmmm r u neglecting me....  i know you can see me..lol just kidding

0,1967518461,Fri May 29 19:43:45 PDT 2009,NO_QUERY,RICHMO718,@Tripzy IT DON'T MATTER ANYWAY ALL @VH1HOOPZ WANTED FROM ME IS A SCORE  LOL

0,1967518617,Fri May 29 19:43:46 PDT 2009,NO_QUERY,Alska,i gotta go play zomg with my daughter ..  i don't wanna ... see yas later

0,1967518675,Fri May 29 19:43:47 PDT 2009,NO_QUERY,scotolsen,@chadishere AHHHH. dammit...i needed a ride to that 

