sentiment,userid,date,query,userId,text0,2264092344,Sun Jun 21 02:45:27 PDT 2009,NO_QUERY,bryanboy,@novickancy im ill literally sick babes and very ill  completely bedridden

0,2264092742,Sun Jun 21 02:45:32 PDT 2009,NO_QUERY,CosmicMalika,I'm sooo tired.. Feel  like ****.... Gotta finish ICT today ! It keeps haunting me..  

0,2264093035,Sun Jun 21 02:45:35 PDT 2009,NO_QUERY,anneliese123,wishes she was back in al ain. like right now! because she misses everyone  and why is she talking in second person?

0,2264093411,Sun Jun 21 02:45:39 PDT 2009,NO_QUERY,nadienadie83,@traceytwit84 DAMN you really think so??? I did find a condom in his wallet a few months ago... I guess I'm in denial 

0,2264093454,Sun Jun 21 02:45:40 PDT 2009,NO_QUERY,Miss_Chimtastic,@Wereuntouchable mine wont let me update mine 

0,2264093684,Sun Jun 21 02:45:43 PDT 2009,NO_QUERY,j_frankenstein,@tomas_winter make that two  the ticket i thought i had apparently does not exist.

0,2264093836,Sun Jun 21 02:45:44 PDT 2009,NO_QUERY,darcyemily,"` then they handed her a folded up flag, and she held on to all she had left of him. - miss you, daddy "

0,2264094035,Sun Jun 21 02:45:46 PDT 2009,NO_QUERY,tdes,Happy Birthday @Redfrettchen!  .... sucks about the bike 

0,2264094894,Sun Jun 21 02:45:57 PDT 2009,NO_QUERY,missleowhite,he forgot about me tonight  Im going to bed sweeties..night. PS Happy Fathers Day to all the Daddys

0,2264094986,Sun Jun 21 02:45:58 PDT 2009,NO_QUERY,tiff128,"Dofe today, goodbye everybody, i might just die  xxx"

0,2264095000,Sun Jun 21 02:45:58 PDT 2009,NO_QUERY,FrankieNichelle,"finally got some sleep but I woke up, and she's still gone "

0,2264095067,Sun Jun 21 02:45:59 PDT 2009,NO_QUERY,sweetescapee,arghhhhhhhhhh so sorry to everyone that i havent posted a new video yet! i have like 5 assessments due this week and i havnt started any! 

0,2264095247,Sun Jun 21 02:46:01 PDT 2009,NO_QUERY,mileycentral,com'on people...follow @mileycentralnet please...I stiill need my followers back  @mileycentralnet @mileycentralnet @mileycentralnet

0,2264096102,Sun Jun 21 02:46:10 PDT 2009,NO_QUERY,pmk30,bahhhhhh I don't wanna go to work 

0,2264096440,Sun Jun 21 02:46:14 PDT 2009,NO_QUERY,LinaAmalina,i'm heartbroken.  mitchel musso has a girlfriend !!!!!!!!!! (((((((((((((((((((((((

0,2264096499,Sun Jun 21 02:46:15 PDT 2009,NO_QUERY,Melsie2005,"just remembered today is my 6th wedding anniversary or would have been if I hadn't married a lying, cheating bastard! "

0,2264096961,Sun Jun 21 02:46:20 PDT 2009,NO_QUERY,MWeezles,@Spatho cool! Wish I was there but alas it's a TV spectacle for me  #f1

0,2264097006,Sun Jun 21 02:46:21 PDT 2009,NO_QUERY,knutschkugel250,another rainy day 

0,2264097130,Sun Jun 21 02:46:22 PDT 2009,NO_QUERY,kaylafancypants,@BigBearrG  ahh i dont understand i have signed the petetion like 4 times!! and it hasnt even come up once 

0,2264097236,Sun Jun 21 02:46:23 PDT 2009,NO_QUERY,djbtheman,!!@@##NEWSFLASH##@@!! http://bit.ly/11OivN   TIMEWARP2009 PICTURES FINALLY ONLINE!!!!! srry for let u guys waitin  xx

0,2264097325,Sun Jun 21 02:46:24 PDT 2009,NO_QUERY,kelxiz,Am craving for jap meal 

0,2264097360,Sun Jun 21 02:46:25 PDT 2009,NO_QUERY,maralaide,Doesn't wanna study for her finals 

0,2264097428,Sun Jun 21 02:46:26 PDT 2009,NO_QUERY,jacekoii,SCHOOL DAYS AGAIN 

0,2264097475,Sun Jun 21 02:46:26 PDT 2009,NO_QUERY,TeamArmstrong,I can't believe today is fathers day! It's the first one we will have to go through without Armstrong here 

0,2264097742,Sun Jun 21 02:46:29 PDT 2009,NO_QUERY,whereislena,@miss_melbourne I was watching this and thought of Thailand. I miss Thailand now  Nothing like walking through those markets in asia.

0,2264098122,Sun Jun 21 02:46:34 PDT 2009,NO_QUERY,upsie,grieving the loss of beloved i-pod  my cute companion

0,2264098179,Sun Jun 21 02:46:34 PDT 2009,NO_QUERY,monnie,"Hello Melbourne. That was a crap descent, I had horrible chest pain  never had that before. Hmm. Off to crown towers!"

0,2264098208,Sun Jun 21 02:46:35 PDT 2009,NO_QUERY,local_shop_girl,"@RealRobBrydon None of the new dates are Cardiff  Trying to get tickets for you on home turf is hard, always a sell-out!"

0,2264098790,Sun Jun 21 02:46:42 PDT 2009,NO_QUERY,krmsn,Last Tuesday a bobcat killed a little bunny at work  its on the camera

0,2264098856,Sun Jun 21 02:46:43 PDT 2009,NO_QUERY,darthchavie,"@pseud0random hey i got some urea lying around, can u teach me how to turn it into an explosive? can't find nitric acid here... "

0,2264098940,Sun Jun 21 02:46:44 PDT 2009,NO_QUERY,bones_yyy, SOME SAAAAAAAAAAAAAAAAAAAAY I WALK ALONE

0,2264099193,Sun Jun 21 02:46:47 PDT 2009,NO_QUERY,LilSionz,just woken up! need to t.cut the damn car today  Gunna take ages! what's everyone's plan today?

0,2264099438,Sun Jun 21 02:46:51 PDT 2009,NO_QUERY,hogofwar,Being forced to go to a boring horse show 

0,2264099574,Sun Jun 21 02:46:52 PDT 2009,NO_QUERY,causeyoucan,looked through old pictures. some of people that we will never see again. 

0,2264099626,Sun Jun 21 02:46:53 PDT 2009,NO_QUERY,xspike,I want to go to macdonalds  a cheese burger please:'(

0,2264100433,Sun Jun 21 02:47:03 PDT 2009,NO_QUERY,lasiaf,"http://twitpic.com/7ztgw - apple doesnt want you to manufature or produce missile, nuclear/ chemical/ biological weapons with itunes "

0,2264100468,Sun Jun 21 02:47:03 PDT 2009,NO_QUERY,abesbenedict,@UpInTheHills I can't get Fox bidness chanell. 

0,2264100725,Sun Jun 21 02:47:06 PDT 2009,NO_QUERY,zornog,I think I'm becoming friends with someone I don't really want to be friends with.  I hate it when this happens... 

0,2264100987,Sun Jun 21 02:47:10 PDT 2009,NO_QUERY,kawaiikyla,"Espalanade, SG.. I'm missing Singapore each day..  http://twitpic.com/7zthb"

0,2264101138,Sun Jun 21 02:47:11 PDT 2009,NO_QUERY,7Tessa7,"@lafo93 in this shop, its so boring, all i do is sit for 4 hours  urghhh boo. i gotta go now  byeeee..x"

0,2264101155,Sun Jun 21 02:47:12 PDT 2009,NO_QUERY,JohnnyMohawk,@LauraElizabitch i wanna drink.. 

0,2264101219,Sun Jun 21 02:47:13 PDT 2009,NO_QUERY,life_afairytale,@ruchirfalodiya and dad mujhe MCA/MBA nahi karne denge.. so i need to get a gud BE college 

0,2264101639,Sun Jun 21 02:47:18 PDT 2009,NO_QUERY,Sophs105,"Hip is worse today, moving my leg causes pain... ouch "

0,2264101695,Sun Jun 21 02:47:18 PDT 2009,NO_QUERY,hannah4eyes,good night yesterday. wished the neighbours children didn't wake me up so early though 

0,2264101782,Sun Jun 21 02:47:19 PDT 2009,NO_QUERY,eYLUu,a little excited tommorow class-trip!! I don'T know what I wear!! And I think my bag-pack is toooo little (small)))  loook.-..hmhmhh&gt;&gt;&gt;&gt;&gt;3

0,2264101950,Sun Jun 21 02:47:21 PDT 2009,NO_QUERY,hive_cluster,Hum needs help to patch postgrey with tarpit patch 

0,2264102402,Sun Jun 21 02:47:27 PDT 2009,NO_QUERY,boozylil,I lost fab ice lolly as a follower. These are very dark days 

0,2264102581,Sun Jun 21 02:47:29 PDT 2009,NO_QUERY,TallMartin,"@alsutton BAH - QuickPwn Mac only, no Windows at present "

0,2264102786,Sun Jun 21 02:47:31 PDT 2009,NO_QUERY,PoppyPotrovsky,"what shall i wear today? going to the mthers for dinnerbe good to see my sisters, ive missed them so bloody much. "

0,2264103910,Sun Jun 21 02:47:45 PDT 2009,NO_QUERY,HappyHippyMum,@RainbowYzzy did ya hate the song 

0,2264103931,Sun Jun 21 02:47:45 PDT 2009,NO_QUERY,7Tessa7,Off to hell. Oh sorry i meant my work  Be back at 3 hopefully! Wish me Luckk x

0,2264104229,Sun Jun 21 02:47:48 PDT 2009,NO_QUERY,zoe_tacvba,Whatching Edward Scissorhands I'm sure I'm going to cry at the end 

0,2264104839,Sun Jun 21 02:47:56 PDT 2009,NO_QUERY,DarinD19b,"Still in bed, had plans to get up early but its raining outside "

0,2264105890,Sun Jun 21 02:48:07 PDT 2009,NO_QUERY,PearlsPearls,I simply LOVE &quot;Lie to Me&quot; ! Too bad there are only 13 episodes in a season... 

0,2264106130,Sun Jun 21 02:48:10 PDT 2009,NO_QUERY,DareYouToMove,So cold. 

0,2264106137,Sun Jun 21 02:48:10 PDT 2009,NO_QUERY,Luna07,"@Fairywispa Mine is not improving, unfortunately  I think sitting in the car yesterday is to blame, but it was worth it to get that house"

0,2264106525,Sun Jun 21 02:48:14 PDT 2009,NO_QUERY,belinda1980,Watching Lockdown &amp; I must say I am shocked at some people and their crimes against other's 

0,2264106560,Sun Jun 21 02:48:15 PDT 2009,NO_QUERY,Davidsaitken,Battery died before burgers got served last night  but I'll twitpic the baptism photo's when I get them tonight!

0,2264106727,Sun Jun 21 02:48:16 PDT 2009,NO_QUERY,BadSeed2012,"probably gonna wake up around noon again, damn! i need a job! "

0,2264106729,Sun Jun 21 02:48:16 PDT 2009,NO_QUERY,Rose_Bailey,"@AGirlCalledKate I see where you're going, but I have a feeling my student loan is not going to cover the flights  "

0,2264106848,Sun Jun 21 02:48:18 PDT 2009,NO_QUERY,jenny_L_s,just got out of bed and off to help at the stables. its gonna be mega busy there 

0,2264106894,Sun Jun 21 02:48:19 PDT 2009,NO_QUERY,CorinSherryanne,"I think staying at home is unhealthy -_- Down with fever and flu, save me from hell someone "

0,2264107224,Sun Jun 21 02:48:22 PDT 2009,NO_QUERY,LishyyBaba,"i miss wembley,  june 15th.. ill never forget you. i dont think chloe would let me forget you anyway :L"

0,2264108054,Sun Jun 21 02:48:32 PDT 2009,NO_QUERY,HelosGirl,@scarletshimmer oh dear 

0,2264108233,Sun Jun 21 02:48:34 PDT 2009,NO_QUERY,TwilightSteffi,soooo im almost ready. have to make my hair and make up and then im watching pro7  and going to work 

0,2264108287,Sun Jun 21 02:48:35 PDT 2009,NO_QUERY,celebwhore,I have to stop looking at holiday packages! Now I'm dying to go to LA 

0,2264108296,Sun Jun 21 02:48:35 PDT 2009,NO_QUERY,fashearlyxx,"@rawritsvictoria hii honey, just replying to comments and it wont let me on your blog, have you not got it anymore?  xx"

0,2264108641,Sun Jun 21 02:48:40 PDT 2009,NO_QUERY,VickeLicious,"aaarrhhh.. I don't wanna do english, I'm so damn tired -.-' "

0,2264109105,Sun Jun 21 02:48:45 PDT 2009,NO_QUERY,kawaiikyla,"Esplanade,SG.. I'm missing Singapore each day..  http://twitpic.com/7ztjs"

0,2264109231,Sun Jun 21 02:48:46 PDT 2009,NO_QUERY,mystykmch,"Little Miss Skyla wants to be awake when it is almost 3 am she is just talking away, she is almost 5 months they grow to fast "

0,2264109958,Sun Jun 21 02:48:56 PDT 2009,NO_QUERY,liseed,Baaaaaad insomnia tonight. Woofalicious.  http://myloc.me/4OW3

0,2264110001,Sun Jun 21 02:48:56 PDT 2009,NO_QUERY,margefritzi,Wants to shift course...  ---&gt; DEnt. I think it fits me way better than MT..Soo confused right now. 

0,2264110121,Sun Jun 21 02:48:57 PDT 2009,NO_QUERY,amichetti,@intrepidteacher oh no!! It is *so* common at our school - ridiculously so. Climate here also doesn't help. 

0,2264110158,Sun Jun 21 02:48:58 PDT 2009,NO_QUERY,TwilightSteffi,the book ends so sad. i never thought about an ending like this 

0,2264110196,Sun Jun 21 02:48:58 PDT 2009,NO_QUERY,schmmuck,Arrrrrrrrrrgh !! why doesnt chrome pick up xml and rss feeds by default ?  The google toolbar in IE and FF does that.

0,2264110280,Sun Jun 21 02:48:59 PDT 2009,NO_QUERY,Bennett182,@Neekaleak so is mine 

0,2264110368,Sun Jun 21 02:49:00 PDT 2009,NO_QUERY,shashwatdc,Rains come home. Got drenched in the first monsoon showers. Missing a ciggi-stick 

0,2264110592,Sun Jun 21 02:49:03 PDT 2009,NO_QUERY,RonBlanco,oh noes! I seem to gained a spot during my less than considerable sleepy time 

0,2264110627,Sun Jun 21 02:49:04 PDT 2009,NO_QUERY,katrinawebb,@bradcollinswtw i know! gossssh im broke as 

0,2264110799,Sun Jun 21 02:49:06 PDT 2009,NO_QUERY,katsudono,"@almightykey Kick them where it hurts, punch their face then pull their nose hairs out.   {Silent Library is influencing me}"

0,2264110880,Sun Jun 21 02:49:07 PDT 2009,NO_QUERY,mpete,all the lack of sleep is catching me up 

0,2264111262,Sun Jun 21 02:49:11 PDT 2009,NO_QUERY,xiopau,"I'm craving for chocolates and cakes.. Yet i cant have one.. Im all alone, stuck in my house.. "

0,2264111531,Sun Jun 21 02:49:14 PDT 2009,NO_QUERY,Jake_Lester,At the airport problem with our tickets 

0,2264111930,Sun Jun 21 02:49:20 PDT 2009,NO_QUERY,MiSS_ALLiEMARiE,is kinda mad her dad ran outta town for father's day weekend! 

0,2264112182,Sun Jun 21 02:49:23 PDT 2009,NO_QUERY,carrierodriguez,"ugh, our dogs got into another fight.  hassLe."

0,2264112337,Sun Jun 21 02:49:25 PDT 2009,NO_QUERY,ChiChiTrains,"smells food, but rice cooker is not done yet "

0,2264112638,Sun Jun 21 02:49:29 PDT 2009,NO_QUERY,yohanaasyasia,They seem different now  i miss them!

0,2264113223,Sun Jun 21 02:49:36 PDT 2009,NO_QUERY,innocentyouth,"Sunday morning, and here I am studying. And it's all nice outside, but I'm stuck here  I really need to get myself that laptop!"

0,2264113947,Sun Jun 21 02:49:46 PDT 2009,NO_QUERY,Cyberpoint,"Once again I can't follow-back people who are following me, thanks to Twitter's bone-headed limits, sorry Tweeps...  "

0,2264114005,Sun Jun 21 02:49:46 PDT 2009,NO_QUERY,alanniiee,@routyy i missed it 

0,2264114261,Sun Jun 21 02:49:50 PDT 2009,NO_QUERY,am4nduhhhhh,it's 5:50am and i cannot believe i am awake. work until 3 

0,2264114330,Sun Jun 21 02:49:51 PDT 2009,NO_QUERY,judyeats,why is everybody asleep 

0,2264114335,Sun Jun 21 02:49:51 PDT 2009,NO_QUERY,taesuh,@jhipolito before i leave to mexico 

0,2264114360,Sun Jun 21 02:49:51 PDT 2009,NO_QUERY,Joelsk_,@barbtheaussie aawww but ive been good-ish this year 

0,2264114477,Sun Jun 21 02:49:53 PDT 2009,NO_QUERY,ahmedzainal,@cecedesouza oh I'm sorry to hear that 

0,2264115136,Sun Jun 21 02:50:01 PDT 2009,NO_QUERY,Clazzybaby,"ouchie, just clicked my wrist soooooo badly "

0,2264115638,Sun Jun 21 02:50:06 PDT 2009,NO_QUERY,chrisandharvey,"@singleparentdad i can't even grow grass for a lawn! was looking forward to the beach today, which is why we're hiding indoors "

0,2264116147,Sun Jun 21 02:50:11 PDT 2009,NO_QUERY,Becsonspeed,@kyleandjackieo im dying without you on the air!!! the two from the hot 30 are just TERRIBLE for morning radio. and the newsreader sucks 

0,2264117064,Sun Jun 21 02:50:21 PDT 2009,NO_QUERY,Eislann,Finish. I have to replace the Spanish one though. 

0,2264117590,Sun Jun 21 02:50:27 PDT 2009,NO_QUERY,arielbalaguer,can't believe our trip is halfway over and I have to go back to work next week 

0,2264118067,Sun Jun 21 02:50:32 PDT 2009,NO_QUERY,Neeenaa,"grow tall sugarcane, eat that soil, drink the rain. but know they'll chase you if you play their little games, so run fast sugarcane. â « "

0,2264118236,Sun Jun 21 02:50:34 PDT 2009,NO_QUERY,dontforgetchaos,@valberg1 Sorry to hear  Difficult day.

0,2264118362,Sun Jun 21 02:50:35 PDT 2009,NO_QUERY,Sophie_Phantom,@Church_cucumber Dammit! I was gonna watch that! I forgot!! 

0,2264118372,Sun Jun 21 02:50:35 PDT 2009,NO_QUERY,Gadreel23,"LEXX was such a beautiful, wonderful, erotic nightmare... It's SUCH a shame it had to end!  @RealCliveBarker"

0,2264118555,Sun Jun 21 02:50:37 PDT 2009,NO_QUERY,jadebabe3,hurt ma leg  dunno how through haha think at dancin I can't walk sucks balls !!

0,2264118999,Sun Jun 21 02:50:43 PDT 2009,NO_QUERY,rad_ali,I don't know how i'm going to last without my girls. 

0,2264119120,Sun Jun 21 02:50:44 PDT 2009,NO_QUERY,FrenchSquall,"in fact has no conjunctivitis...but a &quot;zona&quot;  my ******* eye is burning, can't sleep and my face looks temporarily like elephant man one's"

0,2264119323,Sun Jun 21 02:50:46 PDT 2009,NO_QUERY,JeXusAlain,"@Elger_Abbink In this instance, slicing and dicing entailed more than just the tomatoes and spring onions "

0,2264119328,Sun Jun 21 02:50:46 PDT 2009,NO_QUERY,mheap,"Overslept and won't make t to #uns1 Sunday  Really enjoyed yesterday, and am looking forward to my next barcamp"

0,2264119403,Sun Jun 21 02:50:47 PDT 2009,NO_QUERY,Ebbii,"I'm in France right now, it's raining  The theatre was very funny !! I sang abba solo-song for the first time, and that was really scary."

0,2264119499,Sun Jun 21 02:50:48 PDT 2009,NO_QUERY,kathrynmdunlap,I wish I could have gone on the Yosemite trip. 

0,2264119622,Sun Jun 21 02:50:50 PDT 2009,NO_QUERY,msonline_uk,"@giloi2009 Yeah I got excited by seeing that changelog, then was bitterly disappointed there's no push notifications for Facebook "

0,2264120277,Sun Jun 21 02:50:57 PDT 2009,NO_QUERY,AmandaElvina,Finally getting started on homework. Boo school. Where did the weekend go? 

0,2264120467,Sun Jun 21 02:50:59 PDT 2009,NO_QUERY,TVFanUK,@jo_whit  Of course I do.

0,2264120873,Sun Jun 21 02:51:04 PDT 2009,NO_QUERY,CathyEyre,Back to fecking work tomorrow 

0,2264120906,Sun Jun 21 02:51:04 PDT 2009,NO_QUERY,Mahria_Babe,Jusst Wokeup Didnttt get much sleep all thee girliees have gnee nw  x

0,2264120994,Sun Jun 21 02:51:05 PDT 2009,NO_QUERY,MK_Woody,"No cards, no kisses! Made myself 3 coffee's, drove my daughter to work! Now havin to make own toast? Must be a bloody big prezy later? "

0,2264121286,Sun Jun 21 02:51:09 PDT 2009,NO_QUERY,XXpurplerainXX6,Im Sooo tired it is an effort to even lift my arms i feel drained may fall asleep and is nervous about tonight  have eaten a bag of sw ...

0,2264121381,Sun Jun 21 02:51:10 PDT 2009,NO_QUERY,Raquel_Rodrguez,"Is up &amp;&amp; watching CNN'S &quot;eye on Tehran, Iran&quot;... :-/ 19 dead... and jst so much going on  my prayers go out to all thts occuring ..."

0,2264121513,Sun Jun 21 02:51:11 PDT 2009,NO_QUERY,KassiIsaac,really sick with Pneumonia... 

0,2264121517,Sun Jun 21 02:51:11 PDT 2009,NO_QUERY,julinka73,@MandyPandy32 Morning..thank you..mum did say he might be in bed today  but we will see..take care hope youre ok xx

0,2264121676,Sun Jun 21 02:51:13 PDT 2009,NO_QUERY,teresjohansson,"I have had summer vacation for 1,5 week now and it has rained almost all the time  Give me sunshine and good weather PLZ!!"

0,2264121750,Sun Jun 21 02:51:14 PDT 2009,NO_QUERY,dontforgetchaos,@Knittalottia Thank you. Difficult times 

0,2264121963,Sun Jun 21 02:51:17 PDT 2009,NO_QUERY,monnie,"Wow I look upset! Still sitting on the damn plane. My chest hurts, I need fresh air  - Photo: http://bkite.com/08JZu"

0,2264123149,Sun Jun 21 02:51:31 PDT 2009,NO_QUERY,eddgrant,D'oh - just realised my EQ has been running at +4dB when it can only take -10dB - Wondered why the peak light kept on randomly flashing 

0,2264123151,Sun Jun 21 02:51:31 PDT 2009,NO_QUERY,georgiadarcie,@LlinosD  are you ok???? xxx

0,2264123283,Sun Jun 21 02:51:33 PDT 2009,NO_QUERY,mile3177,left my other phone in rainy's car 

0,2264123547,Sun Jun 21 02:51:36 PDT 2009,NO_QUERY,EmilySHale,"I have a sick husband who is now asleep after getting home from his gig at 6 this morning, poor thing "

0,2264123556,Sun Jun 21 02:51:36 PDT 2009,NO_QUERY,Karen230683,@Glasgowlassy ah no  u need to sort them oot

0,2264123779,Sun Jun 21 02:51:39 PDT 2009,NO_QUERY,megan1500,I has headache. 

0,2264124116,Sun Jun 21 02:51:43 PDT 2009,NO_QUERY,sekarnakula,Shit. I think Taufik won't win 

0,2264124141,Sun Jun 21 02:51:43 PDT 2009,NO_QUERY,azrina92,@fizzyfizz OUR HBIC!! WHYYYY?! 

0,2264124204,Sun Jun 21 02:51:44 PDT 2009,NO_QUERY,AshRob1985,I am finally done baking and now I am going to bed... good night!! i will be up in 3 1/2 hours 

0,2264124388,Sun Jun 21 02:51:46 PDT 2009,NO_QUERY,lia_nicole,Finally time for bed. Can't believe yvette is really leaving. 

0,2264124411,Sun Jun 21 02:51:46 PDT 2009,NO_QUERY,feverishpoptart,All I want is to wake up somewhat healthy again. 

0,2264124770,Sun Jun 21 02:51:51 PDT 2009,NO_QUERY,shitika,i hate having to work the entire weekend... it just passes by in a zap! i couldn't even relax as much ! 

0,2264125366,Sun Jun 21 02:51:59 PDT 2009,NO_QUERY,sameolg33,i dont wana leave hollywood in 3 hours 

0,2264125708,Sun Jun 21 02:52:03 PDT 2009,NO_QUERY,TwiLove66,@The_Bruno_World oh I'm so jealous!  I guess I'll have to go there! If only I had money haha.

0,2264125833,Sun Jun 21 02:52:04 PDT 2009,NO_QUERY,EricaStanzione,And to make it worse. . . . he is snoring! 

0,2264125915,Sun Jun 21 02:52:05 PDT 2009,NO_QUERY,xbron,i cant decide on a default 

0,2264126067,Sun Jun 21 02:52:07 PDT 2009,NO_QUERY,Cutey_Me,ppl .. I'm Searching for a book ykoon wayed interesting w Fun .. Any Ideas  ?

0,2264126739,Sun Jun 21 02:52:15 PDT 2009,NO_QUERY,nikkizz,yay finished my essay! thank god! thats 3 down 4 to go! freakin hell  tomoro Eurotrip meeting yay!!! i get excited ova the dam meetings!

0,2264126746,Sun Jun 21 02:52:15 PDT 2009,NO_QUERY,SallygMorris,wow 22 followers hehehe and i am olny following 10 ppl.god i am so sad that i am pleased about this [if that makes any sence] skl 2mowo! 

0,2264126927,Sun Jun 21 02:52:17 PDT 2009,NO_QUERY,kristineaov,shoot.. got no time to rest just yet..  missing him.. 

0,2264126935,Sun Jun 21 02:52:17 PDT 2009,NO_QUERY,boxdog,@kahlerisms Guess it spreads awareness of wtf is going on in iran. people dont need to die like that 

0,2264127130,Sun Jun 21 02:52:19 PDT 2009,NO_QUERY,M1SAT0,I want a Black Berry! what type of cell phone are you guys usin'? I use DoCoMo. that's kinda nice but it can be broken easily 

0,2264127155,Sun Jun 21 02:52:19 PDT 2009,NO_QUERY,TVFanUK,@MizzTeeze lots of bloody annoying housework. 

0,2264127232,Sun Jun 21 02:52:20 PDT 2009,NO_QUERY,AntMcl,Doesn't look like I'll be tweeting as often over the next 5 weeks as mobile net is v expensive in Indonesia! 

0,2264127440,Sun Jun 21 02:52:23 PDT 2009,NO_QUERY,Lifesmypuzzle1,I am awake- 2:45 am. Was kind of sleeping restless &amp; then had a bad dream. Had to wake myself to get out. Now wide awake 

0,2264127918,Sun Jun 21 02:52:29 PDT 2009,NO_QUERY,christs,50 miles in. killing hill up next. 

0,2264127956,Sun Jun 21 02:52:29 PDT 2009,NO_QUERY,NicoleKidd,"Cant talk, swallow, drink or eat  Off to the hospital!"

0,2264128456,Sun Jun 21 02:52:35 PDT 2009,NO_QUERY,miss_atkinson,I've got a really bad leg  would you still love me if I had to walk with a stick? X

0,2264128558,Sun Jun 21 02:52:36 PDT 2009,NO_QUERY,Nawel_xx,@RobynHumes :O its not working for me!!!  WHATS GOING ON!!! HAHA

0,2264128730,Sun Jun 21 02:52:39 PDT 2009,NO_QUERY,JelBelx,Straightenin' my hair...OUCH! My ear   Listening to Breaking Benjamin in the background 

0,2264128803,Sun Jun 21 02:52:40 PDT 2009,NO_QUERY,Leyaa15,@demodanger19 cool i wrote amazing one b4 the exams but my teacher took it from me when she saw me writing it 

0,2264128861,Sun Jun 21 02:52:40 PDT 2009,NO_QUERY,masnun,"the thing is that, we had no IB classes today... "

0,2264128920,Sun Jun 21 02:52:41 PDT 2009,NO_QUERY,emmy_563,oh! that's so bad!!! 

0,2264129210,Sun Jun 21 02:52:44 PDT 2009,NO_QUERY,mutanthands,Some how managed to mess up a fry up breakfast 

0,2264129727,Sun Jun 21 02:52:51 PDT 2009,NO_QUERY,Zoesometimes,Oh how I wish that I had a Doctor...  Dr. Who...

0,2264129736,Sun Jun 21 02:52:51 PDT 2009,NO_QUERY,Raquel_Rodrguez,"Omggggggggggg, video of the young lady Neda shot in the heart by a sniper.... "

0,2264129769,Sun Jun 21 02:52:51 PDT 2009,NO_QUERY,IrishDivaJulie,I feel really sad all of a sudden. Loss is a terrible thing. 

0,2264130427,Sun Jun 21 02:53:00 PDT 2009,NO_QUERY,jamerie,Feelin good rite now. Poor Tom from Ohio yakin up a storm 

0,2264130694,Sun Jun 21 02:53:03 PDT 2009,NO_QUERY,seregon,Roast dinner today and I don't feel like eating it 

0,2264130718,Sun Jun 21 02:53:03 PDT 2009,NO_QUERY,Beyy,@lauratee_ haha. ze fools! green day (Y) i'll probably record it though. really tired  xoxo

0,2264130842,Sun Jun 21 02:53:05 PDT 2009,NO_QUERY,SGMMyers,Last week in Germany.    But I'll be back so not so bad.  Looking at Temps in Tally.  Yuck!!  Cool and sunny here so I'll enjoy now.

0,2264130903,Sun Jun 21 02:53:07 PDT 2009,NO_QUERY,Lindavesinger,"@Katie_AK47 don't tempt me!  I need to quit one of my jobs.. maybe my non-paying one for the site, haha.... so time consuming "

0,2264131509,Sun Jun 21 02:53:14 PDT 2009,NO_QUERY,wicked1989,Is revising like mad as I have loads of exams this week 

0,2264131594,Sun Jun 21 02:53:15 PDT 2009,NO_QUERY,bobbybob3680,@GeremiahYouSexy man I'm jealous.  LOL

0,2264131795,Sun Jun 21 02:53:17 PDT 2009,NO_QUERY,jordanxxo,@ANNAMCDIZZLE no but my parents are like &quot;please don't do that again you scared us&quot; 

0,2264131831,Sun Jun 21 02:53:18 PDT 2009,NO_QUERY,faye_ann,"@jesscocaine haha not for much longer, off to work soon  don't likes it"

0,2264131859,Sun Jun 21 02:53:18 PDT 2009,NO_QUERY,UluvUY,Wants things with Panini to be okay  @allyzajim

0,2264132156,Sun Jun 21 02:53:22 PDT 2009,NO_QUERY,moonspabs,i dont like sundays 

0,2264132312,Sun Jun 21 02:53:24 PDT 2009,NO_QUERY,Fiah29,says headache  http://plurk.com/p/12n9jr

0,2264132349,Sun Jun 21 02:53:24 PDT 2009,NO_QUERY,KTHNXGTFFUBI,Parents going to see Take That tonight! I WANNA GOOOOOO! 

0,2264132483,Sun Jun 21 02:53:26 PDT 2009,NO_QUERY,mitchyy,"@melz_memichy , i miss u icha ! "

0,2264132530,Sun Jun 21 02:53:26 PDT 2009,NO_QUERY,sjoerdboersma,"Waking up with a headache, though I drank no alcohol last night "

0,2264132549,Sun Jun 21 02:53:27 PDT 2009,NO_QUERY,roryf,"Sooooo many school boy errors, I don't feel able to call myself a CSS pro after today  #sicamp"

0,2264132822,Sun Jun 21 02:53:30 PDT 2009,NO_QUERY,mikeee09,happy fathers day pop. i miss ya  

