sentiment,userid,date,query,userId,text
0,1793821214,Thu May 14 04:06:05 PDT 2009,NO_QUERY,sumooqip,@APGB yeah.  just good.  Deadpool was WAAAAAY wrong 

0,1793822017,Thu May 14 04:06:14 PDT 2009,NO_QUERY,thatissodope,I feel bad for Danny Gokey. 

0,1793822122,Thu May 14 04:06:15 PDT 2009,NO_QUERY,disney_deb,How much blood do they need from...they took even more today 

0,1793822407,Thu May 14 04:06:18 PDT 2009,NO_QUERY,_magic8ball,@Sebaastgeen My reply is no 

0,1793822439,Thu May 14 04:06:19 PDT 2009,NO_QUERY,klarnie,Noooo!!!! It's raining today! And we have to walk around Arlington National Cemetary 

0,1793822440,Thu May 14 04:06:19 PDT 2009,NO_QUERY,0StacyLynn0,loves how amazing her satin sheets feel this morning... too bad I must part with them 

0,1793822617,Thu May 14 04:06:21 PDT 2009,NO_QUERY,gidgettm,"Okay, apparently can't read Twitter since so many of you commented on Lost from last night.  "

0,1793822741,Thu May 14 04:06:23 PDT 2009,NO_QUERY,VeloTraining,2nd relaxation day and very nice it is too. Off to collect my bike later and send my Z404 off for repair  May turn a pedal tomorrow.

0,1793822774,Thu May 14 04:06:23 PDT 2009,NO_QUERY,Zokathepuppy,@OlgiMolgi loll ... i know .... i just don't get it 

0,1793823006,Thu May 14 04:06:26 PDT 2009,NO_QUERY,AtiKuSDesign,becoming more uncomfortable with this back pain as the day goes on. 

0,1793823023,Thu May 14 04:06:26 PDT 2009,NO_QUERY,eurix,im still sleepy.. got only 2 hours of sleep 

0,1793823251,Thu May 14 04:06:28 PDT 2009,NO_QUERY,hhheathery,keeps thinking it's friday! 

0,1793823370,Thu May 14 04:06:30 PDT 2009,NO_QUERY,kalamario,missing my italian chef 

0,1793823814,Thu May 14 04:06:35 PDT 2009,NO_QUERY,erizalovato,i hate school but gotta find a way to make me like it..  if not..i will be stupid. lol

0,1793823815,Thu May 14 04:06:35 PDT 2009,NO_QUERY,upupcreative,@problogger yes. facebook is NOT very user friendly. everything takes three more steps than it needs to. 

0,1793823856,Thu May 14 04:06:36 PDT 2009,NO_QUERY,dougsky,"@essieruth  it is digital, the uni just doesn't subscribe "

0,1793823929,Thu May 14 04:06:36 PDT 2009,NO_QUERY,billyfishWORC,@griffinmike Is it? I dunno i work in a stupid basement  I bet i'll get lashed on later alright. Date for Andys Stag has been set BTW

0,1793824023,Thu May 14 04:06:38 PDT 2009,NO_QUERY,paigeebaby,I so just forgot what I was gonna twitter 

0,1793824198,Thu May 14 04:06:40 PDT 2009,NO_QUERY,ADAMMUSIK,"@solangeknowles Hey Solo, new to Twitter. Um, yeah that did sound kinda sarcastic, but I don't blame you. BET= eh. I miss the old BET "

0,1793824886,Thu May 14 04:06:48 PDT 2009,NO_QUERY,natalie_megan,@McKerrowTweet mmmm..that sounds so yummy! i had smiley faces and gravy as it appears my mum forgot to shop  flu sucks 

0,1793824966,Thu May 14 04:06:49 PDT 2009,NO_QUERY,wickedcaramel,suddenly misses Cebu.  http://plurk.com/p/tqslo

0,1793825027,Thu May 14 04:06:49 PDT 2009,NO_QUERY,TheJackel92,@Ipswich772 Everyone gets them and someone always asks 1st  So thought I'd ask on here for the record XD

0,1793825623,Thu May 14 04:06:56 PDT 2009,NO_QUERY,crazyduckme,Back to work!   Still sick though!  Booooo!

0,1793826182,Thu May 14 04:07:04 PDT 2009,NO_QUERY,Gadgetgirl,It's supposed to rain 

0,1793826587,Thu May 14 04:07:08 PDT 2009,NO_QUERY,AlexCooper,I love the new Google AdWords interface apart from it's size - i have to scroll sideways on my MacBook. 

0,1793826745,Thu May 14 04:07:10 PDT 2009,NO_QUERY,seapigeon,Raining in Dumfries 

0,1793827182,Thu May 14 04:07:15 PDT 2009,NO_QUERY,jmcwitch,i hate serious conversations 

0,1793827286,Thu May 14 04:07:17 PDT 2009,NO_QUERY,emilysoupx,I feel so sick. Off to school. 

0,1793827385,Thu May 14 04:07:18 PDT 2009,NO_QUERY,danielctull,@steffanwilliams Nooooooooo!!!!! This is largely private now right? 

0,1793827389,Thu May 14 04:07:18 PDT 2009,NO_QUERY,ToniFergie,wants to watch David Cook and David Archie on Saturday but its sooo far 

0,1793827539,Thu May 14 04:07:20 PDT 2009,NO_QUERY,AliSmudge,i love working with cool year 9 kids 

0,1793827688,Thu May 14 04:07:21 PDT 2009,NO_QUERY,kelli_martin,is glad she only has to get her kids up 6 more times before summer vacation!  Time to get ready for work 

0,1793827730,Thu May 14 04:07:22 PDT 2009,NO_QUERY,isAIAaa,thinks Ozzy's sick.  http://plurk.com/p/tqsqu

0,1793827846,Thu May 14 04:07:23 PDT 2009,NO_QUERY,keda2010md,"@ hoseachanchez i'm up too, sorry u can't rest "

0,1793827915,Thu May 14 04:07:24 PDT 2009,NO_QUERY,marinasg,"http://twitpic.com/55a1e - went to therapy with Cesca.  Get well soon, Bleh!"

0,1793828151,Thu May 14 04:07:27 PDT 2009,NO_QUERY,burbleberri,"Bored, Nothing to do "

0,1793828202,Thu May 14 04:07:27 PDT 2009,NO_QUERY,weisslu,"@kissability I have a friend who is still convinced she wasn't raped by her boyfriend. She said no, but they were dating after all. "

0,1793828262,Thu May 14 04:07:28 PDT 2009,NO_QUERY,MelissaWOOF,"im not watching the footy show tonight, cause i love Matty, and that girl is a lsut and channel 9 are homos for sacking him "

0,1793828300,Thu May 14 04:07:28 PDT 2009,NO_QUERY,AmyQcoocachoo,"@linda360 No I'm not, The Footy Show died the other day   I think I DID tell you, on facebook. Justin Melvey is androgynous."

0,1793828339,Thu May 14 04:07:29 PDT 2009,NO_QUERY,Lauramoran2,wondering why things aren't going to plan like they should be 

0,1793828457,Thu May 14 04:07:30 PDT 2009,NO_QUERY,pIt00two,Danny g. is eliminated... aw 

0,1793828466,Thu May 14 04:07:30 PDT 2009,NO_QUERY,eliseisnottaken,@agnoaa photoshop sucks 

0,1793828525,Thu May 14 04:07:31 PDT 2009,NO_QUERY,Doorny,gotta do history and English homework 

0,1793828544,Thu May 14 04:07:31 PDT 2009,NO_QUERY,samenriquez,@One_Tree_Hill why are they leaving? 

0,1793828618,Thu May 14 04:07:32 PDT 2009,NO_QUERY,Sikita,Is SO GLAD that Pau's operation went well!  my poor little boy 

0,1793828680,Thu May 14 04:07:33 PDT 2009,NO_QUERY,brandi151,"finals this morning and tomorrow morning, and crazy morning sickness to go with it. "

0,1793829080,Thu May 14 04:07:38 PDT 2009,NO_QUERY,Skinnybobjunior,Morning wasted!! Have to get ready for work in a bit 

0,1793843015,Thu May 14 04:10:19 PDT 2009,NO_QUERY,Isil_Loves_Mcr,"@dark_fairydust  That makes me feel like stupid,SL.I just i'm here for MCR  Somehow they don't reply.My nerves get twisted-hun "

0,1793843389,Thu May 14 04:10:24 PDT 2009,NO_QUERY,juliawester,@stgoddard that sucks! I hoped you would be mending now 

0,1793843410,Thu May 14 04:10:24 PDT 2009,NO_QUERY,bradgross,"@WGN_Chi_Traffic I'd love to, except I would then be late to work...sorry  "

0,1793843981,Thu May 14 04:10:30 PDT 2009,NO_QUERY,ashleyemma,is going to do a spot of shopping this lunchtime - then will have tomato soup for lunch - oh the joys of drastic dieting! 

0,1793844098,Thu May 14 04:10:31 PDT 2009,NO_QUERY,Sarahashleee,goshhh i'm hungry and want it to go to starbucks soooo badly =/ but it's far away from our home ok it's not that far away but still 

0,1793844192,Thu May 14 04:10:33 PDT 2009,NO_QUERY,graceeeong,cycling buddy fell while cycling 

0,1793844209,Thu May 14 04:10:33 PDT 2009,NO_QUERY,kellimeador,"Morning, i'm soooooo sleepy. plus, I can't get rid of this cold/allergy thing  blah."

0,1793844266,Thu May 14 04:10:34 PDT 2009,NO_QUERY,animaljessica,@andifoo I'm so sorry girl!! I hope fin feels better. I know how scary it is!! 

0,1793844314,Thu May 14 04:10:34 PDT 2009,NO_QUERY,jimmillen,"Governance: great if you're governing, huge hindrance if you're not. "

0,1793844563,Thu May 14 04:10:38 PDT 2009,NO_QUERY,sofiabianca,Why does my back hurt so much today 

0,1793845051,Thu May 14 04:10:43 PDT 2009,NO_QUERY,sciencgeniusgrl,"been up for an hour now (5am) i just couldnt sleep gettin blake to school,cleaning,breakfast for VAN &amp; da girls, laundry then work til 10 "

0,1793845090,Thu May 14 04:10:44 PDT 2009,NO_QUERY,krystal_xo15,"school  history, science, fcs, math &amp; english."

0,1793845895,Thu May 14 04:10:53 PDT 2009,NO_QUERY,blonde_doctor,Feeling a bit dejected at the moment. 

0,1793846029,Thu May 14 04:10:55 PDT 2009,NO_QUERY,SCollinsPhotos,"I am battling to find my way round Facebook, even though I am (almost) the geekiest person I know "

0,1793846133,Thu May 14 04:10:56 PDT 2009,NO_QUERY,PeterPeter74,at work again... I swear you would think that is all i do 

0,1793846177,Thu May 14 04:10:57 PDT 2009,NO_QUERY,thestauntonlick,the sort of nervous that makes you need a poo 

0,1793846398,Thu May 14 04:10:59 PDT 2009,NO_QUERY,MelissaWOOF,"@rana__xx exactly, im hell devo, i lovesd that guy, ahh i hate her  ahah, atleast someone knows my frustration, you going saturday ?"

0,1793846608,Thu May 14 04:11:02 PDT 2009,NO_QUERY,nocturnalie,"@ceruleanbreeze  I've had, like, three. They break really easily. As soon as you drop them, they froth and you can't see the window."

0,1793846767,Thu May 14 04:11:03 PDT 2009,NO_QUERY,lauriewithabeat,http://twitpic.com/55a5q - serious backup at starbucks drivethru 

0,1793846772,Thu May 14 04:11:04 PDT 2009,NO_QUERY,Macgirl147,MCAS today. Ugh  And they STILL give us HW ridiculous....

0,1793846887,Thu May 14 04:11:05 PDT 2009,NO_QUERY,eclypto,"Due to recent sad changes to twitter, we don't see the posts directed at people we don't follow. Is quite sad "

0,1793846937,Thu May 14 04:11:06 PDT 2009,NO_QUERY,fogjones,We still can't believe that Danny G. was sent home last night on AM. Idol 

0,1793847065,Thu May 14 04:11:07 PDT 2009,NO_QUERY,Kalediscope,"@ltd7900 me neither, and i'm super dupe busy got 300+ vms *smh* i gotta go through and return calls, i'm tired dude "

0,1793847125,Thu May 14 04:11:08 PDT 2009,NO_QUERY,Nina_Koestner,well i�m off to lern chemistry...writing a test tomorrow.. 

0,1793847221,Thu May 14 04:11:09 PDT 2009,NO_QUERY,ashleymilli,"2 essays, a book, Macbeth, art history prjct, bio test, math test... i really do hate school. ugh "

0,1793847751,Thu May 14 04:11:16 PDT 2009,NO_QUERY,midnightDOLL,I'm bored with studying  still have to do it through. Anyone reccommend a good fantasy/romance book?

0,1793847958,Thu May 14 04:11:18 PDT 2009,NO_QUERY,missjadeykins,James has returned to Soton and I have 2 English Essays to write then work tonight  fml.

0,1793848082,Thu May 14 04:11:20 PDT 2009,NO_QUERY,catnip,@lornaparsons my brain reads BPN as BNP 

0,1793848112,Thu May 14 04:11:20 PDT 2009,NO_QUERY,tsarnick,@Boddingtons my prediction from the future is that your day will get steadily worse 

0,1793848233,Thu May 14 04:11:22 PDT 2009,NO_QUERY,dirtyrottengoss,Why cant @straylightrun be on tour in the states in july rather than may  I guess i'll just have to wait til they come back to Australia.

0,1793848238,Thu May 14 04:11:22 PDT 2009,NO_QUERY,MissxMarisa,@tsarnick EVERYONE mispells/mispronounces my name 

0,1793848473,Thu May 14 04:11:25 PDT 2009,NO_QUERY,PJSPhotography,"Pants ! Doc says I should stay home for the next few days, was aiming to go to Network Central tomorrow.  "

0,1793848493,Thu May 14 04:11:25 PDT 2009,NO_QUERY,scottyhamilton,mabey not so i will just say that sucked 

0,1793848622,Thu May 14 04:11:27 PDT 2009,NO_QUERY,doylie1988,@dbuch1988 Im stalking u friend!!!! lol! debs I cant do my essay!!! 

0,1793848886,Thu May 14 04:11:30 PDT 2009,NO_QUERY,BJonassen,when am i going to get the time to watch all the movies on my movie list??   (yes i have a list with the movies i really want to watch)

0,1793849265,Thu May 14 04:11:34 PDT 2009,NO_QUERY,andytlc,"Just realised Dean Thomas is supposed to be at Shell Cottage too, right? Guess they cut him out "

0,1793849315,Thu May 14 04:11:35 PDT 2009,NO_QUERY,emarrghlee,"can hardly breath, can hardly swallow, cant breathe at all through my mouth, my ear hurts like hell... imma go cry now "

0,1793849380,Thu May 14 04:11:36 PDT 2009,NO_QUERY,darcydotcom,"Im off to drink some Swedish tea in my HUGE backyard, and do my stupid homework  Toodles x"

0,1793849425,Thu May 14 04:11:36 PDT 2009,NO_QUERY,WizzKid,@Pwheslop Not mu fault man 

0,1793849558,Thu May 14 04:11:38 PDT 2009,NO_QUERY,MarcusCuda,TV died - I'll  have to watch the lost season finale on my computer monitor 

0,1793849649,Thu May 14 04:11:39 PDT 2009,NO_QUERY,yamstersg,"@thesixthaxis Ahahahaha. It's being cit jeez, just not too short. You get used to the warmth around your ears "

0,1793849788,Thu May 14 04:11:41 PDT 2009,NO_QUERY,xoLovebug224,School giorno. Not doing cheerleading knee is killing me   ouch!!

0,1793849881,Thu May 14 04:11:42 PDT 2009,NO_QUERY,leaselou,"@Nikkifeltham Thanks, Nikki. My hub's grandad passed away y/day morning, so not great times...  x x"

0,1793850079,Thu May 14 04:11:44 PDT 2009,NO_QUERY,debbie10864,@999VirginRadio Texas Tang Doritoes...came out the same time as Cool Ranch...but didn't last   I loved them.

0,1793850309,Thu May 14 04:11:47 PDT 2009,NO_QUERY,JettaRenton,I want an LG cookie or an iPhone 

0,1793850443,Thu May 14 04:11:48 PDT 2009,NO_QUERY,kalals,"what happened, America? my bet was on Danny!  hahaha"

0,1793850499,Thu May 14 04:11:49 PDT 2009,NO_QUERY,Wolfgang_,@GrowlyBear There's nary a long weekend in sight! 

0,1793850640,Thu May 14 04:11:51 PDT 2009,NO_QUERY,tsukisumi,"today is hot,too.  the design exhibition  so big that i tired......  http://plurk.com/p/tqtwa"

0,1793850654,Thu May 14 04:11:51 PDT 2009,NO_QUERY,kabesnashe,more state testing 

0,1793850973,Thu May 14 04:11:55 PDT 2009,NO_QUERY,dj4235,another stinking migraine  

0,1793850976,Thu May 14 04:11:55 PDT 2009,NO_QUERY,robynsweeney,Jogging = fail. We walked instead and played in the park. Taking the dog = he played in sewage 

0,1793850982,Thu May 14 04:11:55 PDT 2009,NO_QUERY,samkillip,@stigsy why would you ever think that? (ok so maybe dougie and harry are doing a sigining there today) you know me too well 

0,1793851074,Thu May 14 04:11:56 PDT 2009,NO_QUERY,abbieeeee,this woman just propper looked me up and down like i was stupid 

0,1793851166,Thu May 14 04:11:57 PDT 2009,NO_QUERY,TheCortez,My check engine light is on.  

0,1793851628,Thu May 14 04:12:02 PDT 2009,NO_QUERY,twixnurse72,@kristyoz oh!!! I`m so jelous right now...wish I was there then... 

0,1793851742,Thu May 14 04:12:03 PDT 2009,NO_QUERY,queenlainy,this day is not starting out right.....people wakeing me up all night 

0,1793851946,Thu May 14 04:12:06 PDT 2009,NO_QUERY,derderr,Woke up late  driving to school

0,1793851968,Thu May 14 04:12:06 PDT 2009,NO_QUERY,arianneftsk,"@BrokenRoses in reply to your reblog sarah, the mighty boosh is shown every week on mondays on adult swim  but i think it's heaps late"

0,1793852113,Thu May 14 04:12:08 PDT 2009,NO_QUERY,_DESiMO_,@hoseachanchez im with you  got an early call...

0,1793852250,Thu May 14 04:12:09 PDT 2009,NO_QUERY,textualoffender,@rehabc I was just looking for some free alcohol 

0,1793852404,Thu May 14 04:12:11 PDT 2009,NO_QUERY,starresh,poor robert munsch...it'll come back. you can't forget murmle murmle murmle forever 

0,1793852467,Thu May 14 04:12:12 PDT 2009,NO_QUERY,RomeyoKaine,@MISSQUI I THINK I'M SICK BAY 

0,1793852785,Thu May 14 04:12:15 PDT 2009,NO_QUERY,Tammypcd,"@KimberlyDoll awesome video Kimmy, now why cant Ash do that? "

0,1793852855,Thu May 14 04:12:16 PDT 2009,NO_QUERY,xxrawkstarx,im off peeps g2g to school  damn i wish u could just stay at home but i cant anyways see you peeps laterzz byee peace out ?

0,1793852903,Thu May 14 04:12:17 PDT 2009,NO_QUERY,thoraage,"Just had a horrible customer experience with #Dell - Stubborn, bureucratic and completely lacking in customer focus. Avoid at all cost "

0,1793853642,Thu May 14 04:12:26 PDT 2009,NO_QUERY,siphilp,"@ap4a usual scenario is nice during week, rain, wind, snow at weekend "

0,1793853909,Thu May 14 04:12:29 PDT 2009,NO_QUERY,smurfpop,"@Charzlotte Oh no, he's not a bastard ex is he? "

0,1793854092,Thu May 14 04:12:32 PDT 2009,NO_QUERY,celineros,DAAAAMN Something's wrong with my stomach. :| 

0,1793854726,Thu May 14 04:12:40 PDT 2009,NO_QUERY,catnip, rt @raffertie: please don't buy the version of Stomping Grounds VIP that has come out. mastering has been screwed up. trying to sort it

0,1793854933,Thu May 14 04:12:42 PDT 2009,NO_QUERY,superjono,Finished work yay! Time for assignments boo 

0,1793867582,Thu May 14 04:15:11 PDT 2009,NO_QUERY,landyzone,300tdi disco axles into 200tdi defender?: I want to fit 2 300tdi discovery axles to my defender   (as the fron.. http://tinyurl.com/qezlyw

0,1793867590,Thu May 14 04:15:11 PDT 2009,NO_QUERY,twittamouse,"peer pressure sucks-wouldnt want to be a kid again, kids can be mean. mean kids grow up to be mean adults "

0,1793867610,Thu May 14 04:15:11 PDT 2009,NO_QUERY,devilishone,@tuttle88 good job being 848 in the world you piss loving twat of a cunt; shit fuck bloody balls... I ran out of swears.... 

0,1793867960,Thu May 14 04:15:15 PDT 2009,NO_QUERY,StuartHowell200,goin paintballing today. quite dissapointed didnt realise it was wargames 

0,1793868058,Thu May 14 04:15:16 PDT 2009,NO_QUERY,Bookwhisperer37,"lost her temper today, for her next trick she will lose her mind. "

0,1793868082,Thu May 14 04:15:16 PDT 2009,NO_QUERY,x0EMMAbella,My throat hurts so so badd  

0,1793868843,Thu May 14 04:15:25 PDT 2009,NO_QUERY,bananjessi,i want sushii 

0,1793869741,Thu May 14 04:15:36 PDT 2009,NO_QUERY,sk8rgirl2112,oh crap i got the pole touch...THANK U HAILEY  Nate&lt;333333333333333333333333333333333

0,1793869957,Thu May 14 04:15:39 PDT 2009,NO_QUERY,phillis,@annieoliff not good  used to get that wne i was younger  sucks ass

0,1793870057,Thu May 14 04:15:40 PDT 2009,NO_QUERY,BambiScott, I have to wait till next Tuesday to see star trek cause no one will go with me till then.  Friends suck.

0,1793870386,Thu May 14 04:15:43 PDT 2009,NO_QUERY,NewArtRiot,I can't believe I missed Karen O at the Riff Raff this week 

0,1793870984,Thu May 14 04:15:51 PDT 2009,NO_QUERY,indy_stephenson,why am i always ill  it drives me mad

0,1793871019,Thu May 14 04:15:51 PDT 2009,NO_QUERY,alicephilippa,. @gothicat  I blame the compressed shredded cardboard you've eaten *hug*

0,1793871028,Thu May 14 04:15:51 PDT 2009,NO_QUERY,iVenus,"@biscottigirl us too...starting today just rain. Up way too early to mark papers, exams (grades due Monday) "

0,1793871072,Thu May 14 04:15:52 PDT 2009,NO_QUERY,sportdawg,not feeling quite right - my chest has hurt some all week - think i need to spend day in bed resting 

0,1793871161,Thu May 14 04:15:53 PDT 2009,NO_QUERY,hakanthyr,In dentist waiting room. Nothing quite like the anticipation of pain 

0,1793871317,Thu May 14 04:15:54 PDT 2009,NO_QUERY,Rafas_tache,I think the lost finale takes precedance over work. Looks good 

0,1793871334,Thu May 14 04:15:54 PDT 2009,NO_QUERY,sfaulstich,@KarensLostNotes Jacob gave me a headache...LOL  Im so frustrated by how #LOST ended....I guess poor Sawyer will miss Juliet more than I 

0,1793871378,Thu May 14 04:15:55 PDT 2009,NO_QUERY,lilg17,off 2 school  gotta learn... then track practice to home...

0,1793871449,Thu May 14 04:15:56 PDT 2009,NO_QUERY,fransseh,i so love David A.  haha. i want my arm to be signed  Seriously!  haha

0,1793871522,Thu May 14 04:15:57 PDT 2009,NO_QUERY,miljar,I think something is draining my iPhone battery. Can't figure out what though 

0,1793871555,Thu May 14 04:15:57 PDT 2009,NO_QUERY,ohanne,Absolutely frozen 

0,1793871762,Thu May 14 04:15:59 PDT 2009,NO_QUERY,KittyMadCow,@resiliencyyy now i dont even fl like going anymore... 

0,1793872071,Thu May 14 04:16:02 PDT 2009,NO_QUERY,findsam,Lost finale won't have finished downloading by the time I go to bed 

0,1793872199,Thu May 14 04:16:04 PDT 2009,NO_QUERY,imapuffin,Toni is denying that it is pub lunch Thursday! 

0,1793872342,Thu May 14 04:16:05 PDT 2009,NO_QUERY,105Ross,said no because she wants to go on the field trip today which is happening whether it's storming or not.  So no sleeping in for me! 

0,1793872637,Thu May 14 04:16:08 PDT 2009,NO_QUERY,twebbstack,@swayswaysarah awww  hopefully things get better for you.

0,1793872954,Thu May 14 04:16:12 PDT 2009,NO_QUERY,wonTONfm,@citysage my thoughts exactly 

0,1793873026,Thu May 14 04:16:13 PDT 2009,NO_QUERY,kelsa,Nobody is ever awake at this hour   &quot;Lunch&quot; in 45 minutes; then the world wakes up.

0,1793873036,Thu May 14 04:16:13 PDT 2009,NO_QUERY,zzamboni,@lmacvittie What is &quot;so early&quot; for you? My two little ones get up at 6AM sharp every day 

0,1793873097,Thu May 14 04:16:14 PDT 2009,NO_QUERY,wheat_ies,why does it always have to rain on Thursdays 

0,1793873211,Thu May 14 04:16:15 PDT 2009,NO_QUERY,XAAMYYYX,@BradlyBear heyyy i knoo its been a awhillee ; ive been soo tired latetlyy   lol what about you?(:

0,1793873259,Thu May 14 04:16:15 PDT 2009,NO_QUERY,yamstersg,Here we are. Stinks of haircare in here. I DON'T DO HAIRCARE. 

0,1793873282,Thu May 14 04:16:16 PDT 2009,NO_QUERY,DusonFamily,Rainy day yet again   Work from home day....no driving down the two lane hwy!

0,1793873301,Thu May 14 04:16:16 PDT 2009,NO_QUERY,HPTwiFan00,@crescent013 she never commented back on your post 

0,1793874280,Thu May 14 04:16:27 PDT 2009,NO_QUERY,nikkililly,watching tv wrapped up in my blanket feeling sorry for myself 

0,1793874375,Thu May 14 04:16:28 PDT 2009,NO_QUERY,wordlover84,Missing 'The Sadist'. I've grown accustomed to his face and the torture... 

0,1793874411,Thu May 14 04:16:29 PDT 2009,NO_QUERY,jocalling,"@HariShanker Yeah, wanted to come, but  some problem with planning on my part and I couldn't  Plus am scared of big meetings "

0,1793874862,Thu May 14 04:16:34 PDT 2009,NO_QUERY,its_KateH,"been up since 6am workin on essay, went to get mcds breakfast, car broke, now in garage, gunna be a fun day i can tell "

0,1793875301,Thu May 14 04:16:39 PDT 2009,NO_QUERY,Ethan_Thomson,Not doing much just at home on ma laptop pretty board 

0,1793875362,Thu May 14 04:16:40 PDT 2009,NO_QUERY,uhmbrittanyy,"So, I woke up and thought it was a Saturday; and for a few minutes, was actually excited that I got to sleep in. Then my alarm went off. "

0,1793875823,Thu May 14 04:16:45 PDT 2009,NO_QUERY,wowlew,isPlayer Has Died! Sorry 

0,1793876680,Thu May 14 04:16:56 PDT 2009,NO_QUERY,sarasangiuliano,"damn it... i should SO be in new york right now. eff rainy, cold, nasty markham "

0,1793876757,Thu May 14 04:16:57 PDT 2009,NO_QUERY,TafiApple,It's a rainy rainy day. I can't wear my cute new sunglasses. 

0,1793876801,Thu May 14 04:16:57 PDT 2009,NO_QUERY,Shoniepops,There's an enormous fat wasp in my room  gah

0,1793876897,Thu May 14 04:16:59 PDT 2009,NO_QUERY,codemonkey_76,"Landed HARD on my knee (bruised), had someone land on my shin... and pulled a hamstring, all in all, a good training session "

0,1793877202,Thu May 14 04:17:02 PDT 2009,NO_QUERY,ShannonG311,@ninpolite yeah I would have loved to have gone to the chicago show.... no can do though they cut my hours at work 

0,1793877394,Thu May 14 04:17:04 PDT 2009,NO_QUERY,GinZone,@sixstringsnc I don't have a very high opinion of Verizon (which I have) b/c I have to go stand outside at my house to talk on my cell!  

0,1793877532,Thu May 14 04:17:05 PDT 2009,NO_QUERY,lilgeee,Need Coffee 

0,1793877582,Thu May 14 04:17:06 PDT 2009,NO_QUERY,insteadofdeath,I just had a conversation with @KIllBei that basically ended with YOU'RE GOING TO FAIL CHEMISTRY. 

0,1793877610,Thu May 14 04:17:06 PDT 2009,NO_QUERY,kivryn,insomnia sucks 

0,1793877724,Thu May 14 04:17:08 PDT 2009,NO_QUERY,chanquad,is getting over her 4am starts at work 

0,1793877987,Thu May 14 04:17:11 PDT 2009,NO_QUERY,shanelover3,"can't wait til 7.45pm to watch Mr.byrne in his kit ;) , especially as im now gonna miss out on the cancelled one  xxxxx"

0,1793878135,Thu May 14 04:17:12 PDT 2009,NO_QUERY,ohwhatevs,@hmtangx screw you. i have to do pd  need to start.. right about now would be good..

0,1793878186,Thu May 14 04:17:13 PDT 2009,NO_QUERY,davidotis,Why did I stayed up past midnight when I had to come in for labwork at 7?  &lt;WYD?&gt;

0,1793878220,Thu May 14 04:17:13 PDT 2009,NO_QUERY,logandefreitas,Smells like bacon in here. I already ate but it's making me hungry... For bacon. 

0,1793878305,Thu May 14 04:17:14 PDT 2009,NO_QUERY,suzi_x,revision revision revisionnnnn 

0,1793878316,Thu May 14 04:17:14 PDT 2009,NO_QUERY,hannahphil,damn it!I shud be at David and David's concert..but I'm stuck hir on my non-refundable vacation.. 

0,1793878404,Thu May 14 04:17:15 PDT 2009,NO_QUERY,andrewdude,"School ughh , tmrw is jrprom and it's soppised to rain  fml"

0,1793878433,Thu May 14 04:17:16 PDT 2009,NO_QUERY,claracnth,I cry hopelessly 

0,1793878825,Thu May 14 04:17:20 PDT 2009,NO_QUERY,kim_and_jackie,"YANO Music: After &quot;Tsinelas&quot;, its now &quot;Banal na Aso&quot;.   Natatawa ako, hihihi..."

0,1793878855,Thu May 14 04:17:21 PDT 2009,NO_QUERY,untitled01,back to work 

0,1793879176,Thu May 14 04:17:24 PDT 2009,NO_QUERY,aimzx_x,aiiiiiii. hate modern history irp. 

0,1793879301,Thu May 14 04:17:26 PDT 2009,NO_QUERY,Dreamer888,oh wait....she got it...only sharing cos you're the one i share best with... Dreamer is lost without you... 

0,1793879799,Thu May 14 04:17:32 PDT 2009,NO_QUERY,ref72,looked at the thin layer of snow on the car 

