0,1759452127,Sun May 10 19:14:36 PDT 2009,NO_QUERY,justkarii,I want chris back :'( how did things get this fucked up? I miss my friend 

0,1759452140,Sun May 10 19:14:37 PDT 2009,NO_QUERY,JScooT,@crisrojas i'm crying 

0,1759452394,Sun May 10 19:14:39 PDT 2009,NO_QUERY,Mamita_02,watching Brothers &amp; Sisters!! Can't believe is the season finale 

0,1759452628,Sun May 10 19:14:41 PDT 2009,NO_QUERY,MoMarguerite,Moved back home to des moines  so sad

0,1759452665,Sun May 10 19:14:41 PDT 2009,NO_QUERY,LillyJyn,"Sunday, Sunday oh we have to work tomorrow "

0,1759452761,Sun May 10 19:14:42 PDT 2009,NO_QUERY,MyDogAteLA,Cry almost everyday &amp; barely eat. Hasn't been this bad in a long time.  I need a change. 

0,1759452808,Sun May 10 19:14:43 PDT 2009,NO_QUERY,SunnyInSeattle,It's no longer sunny in Seattle.  http://tr.im/sunnyinseattle

0,1759453161,Sun May 10 19:14:45 PDT 2009,NO_QUERY,andrea_chii,i think i'm coming down with a cold 

0,1759453455,Sun May 10 19:14:48 PDT 2009,NO_QUERY,AdamBMusic,"@christianburke The thing is, I don't have a job...   So I can't pay for insurance &amp; gas.  "

0,1759453457,Sun May 10 19:14:48 PDT 2009,NO_QUERY,v_Lyn,"another work day, another bored day "

0,1759453558,Sun May 10 19:14:48 PDT 2009,NO_QUERY,rachelking,At 1020 with the jschool gang for prob the last time in a long while 

0,1759453897,Sun May 10 19:14:51 PDT 2009,NO_QUERY,maaalloryy,I feel really really sick 

0,1759454126,Sun May 10 19:14:53 PDT 2009,NO_QUERY,DebHyde,@BeckyBuckwild I tried to listen to your radio show but you are cutting in and out through out the entire thing   luv you and Frank!

0,1759454194,Sun May 10 19:14:53 PDT 2009,NO_QUERY,artieka,i pulled a @breedimetria and have to get glue out of my hair. 

0,1759454775,Sun May 10 19:14:58 PDT 2009,NO_QUERY,joycarissa,Here in my fiance's childhood home and I couldn't feel farther from him  27 days....

0,1759455047,Sun May 10 19:15:00 PDT 2009,NO_QUERY,Makeva,All my friends are getting into serious relationships  for them  for me

0,1759455600,Sun May 10 19:15:04 PDT 2009,NO_QUERY,aaronpar,So close to being done! Then its time to be stuck at home 

0,1759456143,Sun May 10 19:15:07 PDT 2009,NO_QUERY,cianaftw,lmao my eyebrows are uneven  they always are haha.

0,1759456255,Sun May 10 19:15:08 PDT 2009,NO_QUERY,beckythegreat,@picturemane oh ok.. thats fine... I REALLY NEED A FUCKIN LIFE 

0,1759456697,Sun May 10 19:15:11 PDT 2009,NO_QUERY,Amyk87,someone bought the car i was going to buy  doesnt matter coz now im getting brand new car now not second hand 

0,1759457106,Sun May 10 19:15:14 PDT 2009,NO_QUERY,J_MacIntosh,Having a fantastic time relaxing and visiting with @James_Robb and the family... not looking forward to going back to work this week! 

0,1759457507,Sun May 10 19:15:17 PDT 2009,NO_QUERY,NutC,I should have been born in latin america. 

0,1759457865,Sun May 10 19:15:20 PDT 2009,NO_QUERY,anneloup,@handsheldhigh I'm hoping I don't get it.  My throat feels a little itchy.  

0,1759457974,Sun May 10 19:15:21 PDT 2009,NO_QUERY,ChRiStA3659,has a really really sore throat 

0,1759457978,Sun May 10 19:15:23 PDT 2009,NO_QUERY,OHYEAHmikeman,why do i have school tomorrow? and i have to run the mile for gymmmm. wtfff! 

0,1759458349,Sun May 10 19:15:24 PDT 2009,NO_QUERY,LOZASsooDOPE,@Bewitched010 DEIDRA!! your leaving me  im going to miss you...

0,1759458438,Sun May 10 19:15:24 PDT 2009,NO_QUERY,JenIngram,@kevinrendon I love taking pics. My friend just lost my camera I just bought 2 weeks ago. 

0,1759458783,Sun May 10 19:15:27 PDT 2009,NO_QUERY,edith182,miis u bby! so much i miis talking on the phone miles and miles the hours  dursh jajaa i lovee u together forever remember always love u

0,1759459230,Sun May 10 19:15:31 PDT 2009,NO_QUERY,Thehalfrican,"@BrieMcLain hey, how come i didn't see you at the wedding??? "

0,1759459310,Sun May 10 19:15:31 PDT 2009,NO_QUERY,kseybold,my wii fit just yelled at me 

0,1759459533,Sun May 10 19:15:33 PDT 2009,NO_QUERY,candance14,I miss my parents 

0,1759460023,Sun May 10 19:15:37 PDT 2009,NO_QUERY,MsTerrika,Headed bck 2 hburg  but only for 5 more days. I'm doing a countdown!!

0,1759460036,Sun May 10 19:15:37 PDT 2009,NO_QUERY,alynndeluc,I feel like I never tweet anymore.  I miss you guys.

0,1759461378,Sun May 10 19:15:47 PDT 2009,NO_QUERY,tburd,@bran1181 ugh does that mean its monday again 

0,1759461409,Sun May 10 19:15:47 PDT 2009,NO_QUERY,prunicki_andrew,Did some grilling for Mother's Day today.  Still trying to figure out how to grill salmon right.  I guess I should google it.  

0,1759461472,Sun May 10 19:15:48 PDT 2009,NO_QUERY,kittygoesmeow,"Dude, I'm like chillin out here. Dayummm school tomorrow "

0,1759461908,Sun May 10 19:15:51 PDT 2009,NO_QUERY,cyrakirsten,Good morning!!! got a lot of things to do today  no tweets till 3pm?? i think so.. =(

0,1759461942,Sun May 10 19:15:51 PDT 2009,NO_QUERY,SpencerKaneT,Tototally wants a Suzy!! But Fendi would be soooo mad!! 

0,1759462023,Sun May 10 19:15:52 PDT 2009,NO_QUERY,moniixmoore,Is awake and still sick 

0,1759462029,Sun May 10 19:15:52 PDT 2009,NO_QUERY,VivienneVaVoom,All the NINJA posts are making me terribly Jealous. WHY do they have to be coming to D-town when I am outta town? 

0,1759462176,Sun May 10 19:15:53 PDT 2009,NO_QUERY,oceana_roll,"Im shaking so bad. She almost got hit by a car. Fuck.  im so mad at her, but glad i got her in time."

0,1759462264,Sun May 10 19:15:54 PDT 2009,NO_QUERY,SarahWilson92,AHHHHHHHHH!! To much!! Way too much...I hate finals. 

0,1759462431,Sun May 10 19:15:55 PDT 2009,NO_QUERY,xtiiina,@TrendySD what happened to the OTHER store in the corner?  jk... do you have any broadway mirrors? i want a new one.

0,1759462443,Sun May 10 19:15:55 PDT 2009,NO_QUERY,hebrew_hammer,"It's too bad Santa Barbara's hills aren't composed of marshmellows, graham crackers, and Hersheys "

0,1759462845,Sun May 10 19:15:58 PDT 2009,NO_QUERY,itslisakeller,finally done with my internship. kind of. still have to train the new intern and cast party and river fest! will miss everybody 

0,1759463205,Sun May 10 19:16:01 PDT 2009,NO_QUERY,JaclynPeta,My labtop has a very nasty bug...thank god for my computer at work or i would be in melt by now 

0,1759463453,Sun May 10 19:16:03 PDT 2009,NO_QUERY,iwantedthisname,@penn_ except if you in Australia where its 2-3 episodes behind 

0,1759463535,Sun May 10 19:16:04 PDT 2009,NO_QUERY,megan713,Trying to fall asleep but im not tired at all. Eww tomorrows monday 

0,1759463667,Sun May 10 19:16:05 PDT 2009,NO_QUERY,xxMegs,ugh tired! and still have 50 pgs left!  i think i'll just finish watching the kardashians and go to bed.  skool tomorrow UGH!!!  xxMeg

0,1759463761,Sun May 10 19:16:05 PDT 2009,NO_QUERY,shanhutch1,@elmoss1 Forgot your throat was hurting!   Sorry UR day was so long! I'm taping Bros &amp; Sisters 2 watch later- my head still hurts.

0,1759464031,Sun May 10 19:16:07 PDT 2009,NO_QUERY,TONYTALIBAN,Starting the grind 

0,1759464218,Sun May 10 19:16:09 PDT 2009,NO_QUERY,realvictor,"ful from mothers day lunch. man, i cant believe the lakers got blown out "

0,1759464258,Sun May 10 19:16:09 PDT 2009,NO_QUERY,GingerbreadmanX,"21k race at the Fort yesterday was poorly organized and was hands down my toughest race of the year. Imagine, we started at 6 am??? "

0,1759464531,Sun May 10 19:16:11 PDT 2009,NO_QUERY,DrWatts,@chcuk why do i fail??! if its because of hayden u can shut up! shes so hot  tear.

0,1759464852,Sun May 10 19:16:14 PDT 2009,NO_QUERY,AprilOj,@ShiftyWooten  I'm broke as a joke. I can guarantee I will not be able to 

0,1759464883,Sun May 10 19:16:14 PDT 2009,NO_QUERY,TannuhFS,"@Jakoby0905 Same shit, we just got extention... And its stressin me. "

0,1759465127,Sun May 10 19:16:16 PDT 2009,NO_QUERY,torixx3,i hope you feel better soon zack! 

0,1759465342,Sun May 10 19:16:18 PDT 2009,NO_QUERY,AvolynFisher,Thinking my cat might not be coming back 

0,1759465383,Sun May 10 19:16:18 PDT 2009,NO_QUERY,TurnErika,I miss volunteering   Just waiting to settle into a real schedule so I can find a new place to volunteer

0,1759465450,Sun May 10 19:16:19 PDT 2009,NO_QUERY,xtiiina,@TrendySD what happened to the OTHER store in the corner of mitsuwa?  jk... do you have any broadway mirrors? i want a new one.

0,1759465454,Sun May 10 19:16:19 PDT 2009,NO_QUERY,Socialbees,@unmarketing Bold is jst a loaner while I figure out my next big move. The carriers don't make it easy 4 us  Thank goodness for @peterpham

0,1759465607,Sun May 10 19:16:20 PDT 2009,NO_QUERY,Asheyna,"@nickb Thanks for the link, sorry to hear ya feel yucky   Grats on the @alltop thing "

0,1759466516,Sun May 10 19:16:28 PDT 2009,NO_QUERY,tooie,how is the weekend already over?  back to school work 

0,1759467170,Sun May 10 19:16:33 PDT 2009,NO_QUERY,ambercantrell,@MaryfkaCrazy  i'm searching for a track list for the movie  but not having any luck 

0,1759467248,Sun May 10 19:16:34 PDT 2009,NO_QUERY,AxeArgonian,"Due to all the craziness of the weekend, I haven't been able to write an Alone in the Dark review or the next Mr. Mind episodes.  "

0,1759467268,Sun May 10 19:16:34 PDT 2009,NO_QUERY,aj99000,I lashed out today 

0,1759467678,Sun May 10 19:16:37 PDT 2009,NO_QUERY,bus_it_lady,about to go clean my room 

0,1759467833,Sun May 10 19:16:38 PDT 2009,NO_QUERY,jenazeen,In Kennesaw....have classes at 8 in the morning 

0,1759468005,Sun May 10 19:16:40 PDT 2009,NO_QUERY,Frizzil,"Well, another Mother's Day in the books, another 900 happy people; less than last year  EAT MORE LOBSTER!"

0,1759491289,Sun May 10 19:19:49 PDT 2009,NO_QUERY,bloomworthy,so sniffly 

0,1759491328,Sun May 10 19:19:50 PDT 2009,NO_QUERY,boatsonagoat,wants some peanut butter rice crispy treats.. 

0,1759491977,Sun May 10 19:19:54 PDT 2009,NO_QUERY,annahabib,wonderful weekend. i miss home 

0,1759492425,Sun May 10 19:19:58 PDT 2009,NO_QUERY,akhatri,thinks weekends go by too fast 

0,1759492723,Sun May 10 19:20:01 PDT 2009,NO_QUERY,SquirePeach,i have two holes in my body- one in my heart and the other in my leg  FIX ME PLEASE!!

0,1759492926,Sun May 10 19:20:02 PDT 2009,NO_QUERY,TriLLieBoi,@_SnowflakE_ omg.. i am tooooo lost!! lol idk wut u talkn bout.. 

0,1759492992,Sun May 10 19:20:03 PDT 2009,NO_QUERY,justhim,@DJMaryE no complaints but I have the feeling that tomorrow is going to be a lonnngggg Monday. 

0,1759493704,Sun May 10 19:20:08 PDT 2009,NO_QUERY,Ryanhayes,kayaked for five hours today on the lake with mom. got the sunburn from hell. my skin is on FIRE! i may die. time for more aloe.  

0,1759493774,Sun May 10 19:20:08 PDT 2009,NO_QUERY,ravenclawgirl,hates the fact that her mom gets this high from randomly unplugging the wifi without warning. 

0,1759493944,Sun May 10 19:20:10 PDT 2009,NO_QUERY,kwkenuf,"Dreading the end of a great weekend.... Work tomorrow, oh  joy "

0,1759494127,Sun May 10 19:20:11 PDT 2009,NO_QUERY,rahmuniz,GOT TO SHOWER AND THEN OFF TO BED AND BACK TO WORK AGAIN! 

0,1759494188,Sun May 10 19:20:13 PDT 2009,NO_QUERY,JAYMO21,chillin at the airport in minnesota....didnt get to see my mom before I left! 

0,1759494421,Sun May 10 19:20:13 PDT 2009,NO_QUERY,girlofwinter,I'm gonna be ill if Joan Rivers wins; she &amp; Melissa are SO ANNOYING 

0,1759494448,Sun May 10 19:20:14 PDT 2009,NO_QUERY,saygoodbyeshai,"just found out that @taylorswift13 has a show in Portland the same weekend i'm there! no more tickets though! slap in the face, much? "

0,1759494480,Sun May 10 19:20:14 PDT 2009,NO_QUERY,GloogyMan,i am dooing homework!!  (can't believe that they give it out over the weekend!!!    :9

0,1759494527,Sun May 10 19:20:14 PDT 2009,NO_QUERY,xoxobreeee,boy in the striped pajamas is the saddest movie ive ever seen  currently crying like a baby

0,1759494574,Sun May 10 19:20:15 PDT 2009,NO_QUERY,ekr8401,"Tension headaches are a horrible, terribly awful thing!!!  "

0,1759494594,Sun May 10 19:20:15 PDT 2009,NO_QUERY,MonkeyDeLaCode,"@WindyPath She is getting her molars right now, so sleep has not been good lately "

0,1759494638,Sun May 10 19:20:15 PDT 2009,NO_QUERY,wickedcaramel,wonders why there aren't any seeds for Made of Honor.  http://plurk.com/p/t07i1

0,1759494784,Sun May 10 19:20:16 PDT 2009,NO_QUERY,jpadamson,Rorschach's last scene always makes me sad.   http://twurl.nl/yyvu5k

0,1759494789,Sun May 10 19:20:16 PDT 2009,NO_QUERY,annabelliefman,"is in photography with fi and andrew, and has work after school "

0,1759494862,Sun May 10 19:20:17 PDT 2009,NO_QUERY,tatujonn,wonder what andrew wood would sound like today?....  ? http://blip.fm/~60n7o

0,1759495312,Sun May 10 19:20:20 PDT 2009,NO_QUERY,Dr_Alli,@brtlightsphere sad news 

0,1759495532,Sun May 10 19:20:22 PDT 2009,NO_QUERY,LKreger,Gotta get the kids off to bed. Had a great mother's day!! Now back to work tomorrow 

0,1759495533,Sun May 10 19:20:22 PDT 2009,NO_QUERY,AshleyFlorea,Jogging at fowler. Ate tooo much  HAPPY MOTHERS DAY!!! Haha

0,1759495939,Sun May 10 19:20:25 PDT 2009,NO_QUERY,biscuit_and_tea,i am so bloody tired. tomorrow's school and im hatin' it already. *insert bad word*! 

0,1759496146,Sun May 10 19:20:27 PDT 2009,NO_QUERY,almeric15,is getting stressful with the apartment thing.  http://plurk.com/p/t07jq

0,1759496235,Sun May 10 19:20:28 PDT 2009,NO_QUERY,jennifermeserve,can't believe vaca is over  Working tomorrow 1-8:30!

0,1759496274,Sun May 10 19:20:28 PDT 2009,NO_QUERY,kelsosaurrr,laying in bed. i feel like a cripple. 

0,1759496454,Sun May 10 19:20:30 PDT 2009,NO_QUERY,Nika_woop,"Geez, I really hate this sickness. I CANT EVEN TALK PROPERLY!!! :'( I wanna be at school with ma friends. "

0,1759497233,Sun May 10 19:20:36 PDT 2009,NO_QUERY,DyllanBrown,I want a blackberry sooo bad 

0,1759497251,Sun May 10 19:20:37 PDT 2009,NO_QUERY,rklandy,It's Sinus time  want a great remedy http://bit.ly/17S2NV

0,1759497737,Sun May 10 19:20:40 PDT 2009,NO_QUERY,clownphish,"augh, i keep waiting for it to get easier but i think of him and instantly cry. i miss you P.  "

0,1759497899,Sun May 10 19:20:42 PDT 2009,NO_QUERY,JKehring,"Heading home after dinner. Had a great weekend with hubby, daughter and baby. So sad it has to end "

0,1759498162,Sun May 10 19:20:44 PDT 2009,NO_QUERY,Domm_LoveLife,"Homee -__- fuck, school tomorrow   Reading and textingg, blah"

0,1759498319,Sun May 10 19:20:45 PDT 2009,NO_QUERY,leonniefm,ai ai..@Ruby1201 I'll DM you the party address. I'd like to offer you a slice of her brain.. but it's so young &amp; tasteless.. so shame 

0,1759498584,Sun May 10 19:20:47 PDT 2009,NO_QUERY,Aryv,@iamjersey me too. 

0,1759498689,Sun May 10 19:20:48 PDT 2009,NO_QUERY,MaariGrace,Going to eat out. I can't stop eatttting 

0,1759498784,Sun May 10 19:20:49 PDT 2009,NO_QUERY,littlefatcat,@lipstickspeak 

0,1759499059,Sun May 10 19:20:51 PDT 2009,NO_QUERY,ericcaa," darn i just found out im getting one of my tooth pulled out tomorrow, its gonna hurt so bad im guessing.(("

0,1759499300,Sun May 10 19:20:53 PDT 2009,NO_QUERY,LoserfaceLucy,Just did a system recovery on my computer and now i have no internet. Wtf did i do? 

0,1759500327,Sun May 10 19:21:02 PDT 2009,NO_QUERY,BlinkAnjell01,@zpxlng am i updating too much i am sorry 

0,1759500561,Sun May 10 19:21:03 PDT 2009,NO_QUERY,valeriej,@crazicrystal I feel your pain. Two huge test tomorrow and I don't feel at all prepared. 

0,1759500989,Sun May 10 19:21:07 PDT 2009,NO_QUERY,Julian_Isip,So cold outside. 

0,1759501095,Sun May 10 19:21:07 PDT 2009,NO_QUERY,vinylcut,@maybelline14  *hugs* definitely ready for a new week. #canucks will win tomorrow!

0,1759501107,Sun May 10 19:21:07 PDT 2009,NO_QUERY,jfollas,@keithelder Same here!  Missing my friends at #teched2009.  

0,1759501215,Sun May 10 19:21:08 PDT 2009,NO_QUERY,wemightspellyou,@wearebirds ohh just kidding 

0,1759501451,Sun May 10 19:21:10 PDT 2009,NO_QUERY,HazelLuve,@epiphanygirl i am callin n itsbusy busy busy 

0,1759502106,Sun May 10 19:21:16 PDT 2009,NO_QUERY,Beccabird09,@kristybelle88  i know and i have work to

0,1759502270,Sun May 10 19:21:17 PDT 2009,NO_QUERY,jtkmoonroofs,@jabbar_ yeah dude! I wish I had that flip mino with me right now! 

0,1759502399,Sun May 10 19:21:18 PDT 2009,NO_QUERY,Colehill,Could some people please mourn fir my lizard with me? I loved her and she died. 

0,1759502529,Sun May 10 19:21:19 PDT 2009,NO_QUERY,simonehudgens,So tired...I really want to sleep in late but I can't 

0,1759502994,Sun May 10 19:21:23 PDT 2009,NO_QUERY,broinjc,"@Pupitmiser I told my friend android blows iPhones out of the water... he got mad  you got me in trouble. oh, songbird = cool"

0,1759503267,Sun May 10 19:21:25 PDT 2009,NO_QUERY,elysemattarollo,"@kelly_6ft_under I have c done, and I have info for a(just have to figure out what I'm going to do) and I'm 1/2 done b  lots of work eh!"

0,1759503457,Sun May 10 19:21:27 PDT 2009,NO_QUERY,Emmilinnee,has just booked my flights back from Cbr to Melbourne. Wish it was the other way though 

0,1759503483,Sun May 10 19:21:27 PDT 2009,NO_QUERY,BlackTsChica,@MinnerDinner  I also can't get back on the boards....it's been up and down for me for the past hour. 

0,1759503485,Sun May 10 19:21:27 PDT 2009,NO_QUERY,AvgAmy,@miss_gato it sucks to make that realization about your friends 

0,1759503567,Sun May 10 19:21:28 PDT 2009,NO_QUERY,ReinaMerrick,"She really wants me to do those dishes. That's ridiculous. And now that the water's back on, I have no choice. "

0,1759503810,Sun May 10 19:21:30 PDT 2009,NO_QUERY,xXAnnieAsylumXx,CRAP i ttly forgot until now that i have detention tomorrow  teachers suck...... :'(

0,1759504252,Sun May 10 19:21:33 PDT 2009,NO_QUERY,tracyr0bles,so dont wanna go back to work on tues! 

0,1759504344,Sun May 10 19:21:34 PDT 2009,NO_QUERY,latinamarie,"@vanessamae01 Zucchini is also my favorite squash. And no, I did not get the video "

0,1759504377,Sun May 10 19:21:34 PDT 2009,NO_QUERY,Rosie21,Ooo...I get to sleep early for 2 weeks! Cos @Gregjames will be on at 4pm instead!  - means I can't listen live.

0,1759504403,Sun May 10 19:21:34 PDT 2009,NO_QUERY,luciliahandojo,Suddenly!! i love twiter. but why people can not find me from my username?? 

0,1759504777,Sun May 10 19:21:37 PDT 2009,NO_QUERY,kelbaker18,@anime_addict. O  that sucks

0,1759505101,Sun May 10 19:21:40 PDT 2009,NO_QUERY,AdelThia,Its hard to know when people think that you are not good enough but it is even harder when you learn it from your loved ones. 

0,1759529249,Sun May 10 19:24:54 PDT 2009,NO_QUERY,RonaAnn,@gliitterx3 it's not a juicy ring though  sorry if the picture didn't work I've never tried twit pic before http://twitpic.com/4yl0d

0,1759529928,Sun May 10 19:24:59 PDT 2009,NO_QUERY,splitenz,@chiwhitesox aw  i hope u get 2 feeling better. Did the brewers and sox play 2day?

0,1759529964,Sun May 10 19:25:00 PDT 2009,NO_QUERY,gabecano,my friend @shallomj got fucked by Dujuour Magazine's Letitia Burrell   http://bit.ly/NgXB5 (via @kk)

0,1759529998,Sun May 10 19:25:00 PDT 2009,NO_QUERY,EmAllTimeLow,just cried like no other watching the movie seven pounds... ahh so sad 

0,1759530169,Sun May 10 19:25:01 PDT 2009,NO_QUERY,dannidavies,"@ShelleyFinch lmao no problem, i've got flu. "

0,1759530233,Sun May 10 19:25:02 PDT 2009,NO_QUERY,alleyreid,not interested in going to school tommorow.. ugrh  night twitterverse ! &lt;3333

0,1759530249,Sun May 10 19:25:02 PDT 2009,NO_QUERY,lindsyredman,"Is seriously going to ralph, I'm so fulllllll "

0,1759530319,Sun May 10 19:25:02 PDT 2009,NO_QUERY,SimpliBeautyful,This mothers day is starting to suck really bad 

0,1759530356,Sun May 10 19:25:03 PDT 2009,NO_QUERY,rufeo,No more white chocolate moments 

0,1759531091,Sun May 10 19:25:08 PDT 2009,NO_QUERY,jjenn_marie,sick of the same old shit every day. 

0,1759531245,Sun May 10 19:25:10 PDT 2009,NO_QUERY,uvagravesgirl,"Going to bed, I don't feel well "

0,1759531437,Sun May 10 19:25:11 PDT 2009,NO_QUERY,reeeezah,@WordxLove i would prolly eat some!    we have tri-tip.

0,1759531609,Sun May 10 19:25:12 PDT 2009,NO_QUERY,DianaLovesDavid,I want to see &quot;My Sister's Keeper&quot;... wow I am going to cry so much!!! Looks like a really sweet and sad movie 

0,1759531738,Sun May 10 19:25:13 PDT 2009,NO_QUERY,zebrayebra,Its trueeeee 

0,1759531912,Sun May 10 19:25:15 PDT 2009,NO_QUERY,Wrestler12359,@taylorbebop @meganandliz @wtccishot is super bored right now and is sick 

0,1759531916,Sun May 10 19:25:15 PDT 2009,NO_QUERY,kikinini7,"First coat of paint is done! My stomach is still really growly and churning, I don't like it "

0,1759531949,Sun May 10 19:25:15 PDT 2009,NO_QUERY,kimbralon,back at the house.  excited that i got my cd.  i need to calm my nerves.  ministry work is hard with no support 

0,1759532153,Sun May 10 19:25:16 PDT 2009,NO_QUERY,hidden_poet,"Dead tired. Walking zombie on Monday morning. No, it's not Monday blues. It's a what??? Monday... "

0,1759532205,Sun May 10 19:25:17 PDT 2009,NO_QUERY,Sydney_Allen,Back to school tomorrow  this sucks.

0,1759532347,Sun May 10 19:25:18 PDT 2009,NO_QUERY,cynthi_a,I've never been so sunburned in my life. Except for that time in fourth grade. I'm still red though. I hate texas weather! 

0,1759532603,Sun May 10 19:25:20 PDT 2009,NO_QUERY,selenieee,Ewww...crappy weather 

0,1759532612,Sun May 10 19:25:20 PDT 2009,NO_QUERY,KatieSmiles131,Hmmm.. So it's 9:30... What should i do...? Go on the computer...? No.. It will be boring... I miss Ashley.  Come home so i wont be bored!

0,1759532826,Sun May 10 19:25:22 PDT 2009,NO_QUERY,rttab,"laying in bed had to wach church from the computor   i have the flu bug,,,,,"

0,1759532874,Sun May 10 19:25:22 PDT 2009,NO_QUERY,CALi_Cutie,@DaRealsebastian omg! Nooooo.. Boston 

0,1759532898,Sun May 10 19:25:22 PDT 2009,NO_QUERY,fozziebear64,"Delima. My dad hates when I open my window cause the air is on but I can't help it, "

0,1759533173,Sun May 10 19:25:24 PDT 2009,NO_QUERY,lmdallatorre,is hiding in the law library... studying.. studying.. hungry though 

0,1759533429,Sun May 10 19:25:26 PDT 2009,NO_QUERY,yogeorgehess,@Markbutlurk: who bailed on what? Im bored and nosey 

0,1759533492,Sun May 10 19:25:27 PDT 2009,NO_QUERY,madzarella,"researching on the great maritime strategies...haha this is my work. Typhoon Emong displaced 64,000 people from their homes, sad "

0,1759533608,Sun May 10 19:25:28 PDT 2009,NO_QUERY,ToddJ,My sister lost her job... 

0,1759533718,Sun May 10 19:25:29 PDT 2009,NO_QUERY,uhreecuh,@marievaleri hahahaha omggggg thats the image u have of me? 

0,1759533763,Sun May 10 19:25:29 PDT 2009,NO_QUERY,LindseyPatton,I really hope that I can enjoy my day off tomorrow. My last day off was last Monday.  

0,1759534072,Sun May 10 19:25:32 PDT 2009,NO_QUERY,shamekko,At home for the night. It's been fun riding around the city all weekend. Gotta take the rental back in the am 

0,1759534236,Sun May 10 19:25:33 PDT 2009,NO_QUERY,PokerPrincess,Worried about my lola. Scariest experience of my life happened today. 

0,1759534713,Sun May 10 19:25:37 PDT 2009,NO_QUERY,ipodtouch15,"Okay so, I went downstairs and said &quot; HELLO FAMILYY!!, I'M AWAKE!&quot; and these were the responses, hi, whatever, hello, wtf loser. "

0,1759535081,Sun May 10 19:25:40 PDT 2009,NO_QUERY,AnnaBNolan,ok got my personal evaluation done! sweet! now must finish watching satc and then head to bed for like....a whole 6 hours 

0,1759535246,Sun May 10 19:25:41 PDT 2009,NO_QUERY,alyssaleduc,does not want to go to school tommorow ! 

0,1759535434,Sun May 10 19:25:43 PDT 2009,NO_QUERY,CharmaineHanna,Exam in just unda 7hrs  x

0,1759535773,Sun May 10 19:25:46 PDT 2009,NO_QUERY,nytonkla,@sugree will ask @jingjun to provide one. BUT ADSL not working today due to yesterday lightning.  find solution.

0,1759535774,Sun May 10 19:25:46 PDT 2009,NO_QUERY,lost_dog,@RedTeflon I am lost. Please help me find a good home. 

0,1759535949,Sun May 10 19:25:47 PDT 2009,NO_QUERY,SallyMesser,"@LeighWoodward thanks babes, 24 hours to go omg. I hate this time, I get so stressed out "

0,1759536131,Sun May 10 19:25:49 PDT 2009,NO_QUERY,midzi28,i hurt my back yesterday 

0,1759536253,Sun May 10 19:25:50 PDT 2009,NO_QUERY,nakedjawa,"@wtcc saw your latest vid, boy your house is huge ! but your bedroom (previous vid) looks small and no windows in it ? sad "

0,1759536489,Sun May 10 19:25:51 PDT 2009,NO_QUERY,darkstar21,"Finishing rereading a book I have read multiple times, need something new to read again "

0,1759536764,Sun May 10 19:25:54 PDT 2009,NO_QUERY,NKOTBmama,"@hersheysweet Wasn't meant to be, I guess  "

0,1759536808,Sun May 10 19:25:54 PDT 2009,NO_QUERY,nin_flamzors,I ate too much toast and now I'm sick 

0,1759537052,Sun May 10 19:25:56 PDT 2009,NO_QUERY,alyssa_XD,Hasnt talked to Sam in a super long time  -alyssaBRUNO&lt;3

0,1759537262,Sun May 10 19:25:58 PDT 2009,NO_QUERY,Michestellar,"Gave my mom a nice card for Mother's Day, and she just laughed and walked away. "

0,1759537529,Sun May 10 19:26:00 PDT 2009,NO_QUERY,AmyColalella,http://bit.ly/GvBji  Someone teach me that 

0,1759537733,Sun May 10 19:26:02 PDT 2009,NO_QUERY,briannaxl3,toothache 

0,1759538175,Sun May 10 19:26:05 PDT 2009,NO_QUERY,tyler0314,"Monday, ewwww "

