sentiment,userid,date,query,userId,text0,2190160914,Tue Jun 16 01:56:38 PDT 2009,NO_QUERY,archieway09,just got back from school..so tired..I'm still going to do a bunch of homeworks.Ugh! 

0,2190161046,Tue Jun 16 01:56:40 PDT 2009,NO_QUERY,Pearlsandwhirls,"Morning all, what another beautiful day! Not a morning to be stuck cleaning the oven, someones gotta do it tho "

0,2190161110,Tue Jun 16 01:56:40 PDT 2009,NO_QUERY,loisy21,It's raining cats and dOgs!!! tsk.. tsk.. 

0,2190161934,Tue Jun 16 01:56:49 PDT 2009,NO_QUERY,JohannaFelicia,Cleaning and laundry day to day  itÂ´s nice to have it done... but not to exciting to do

0,2190161991,Tue Jun 16 01:56:50 PDT 2009,NO_QUERY,conzon,come on ppls follow me!!!!!!!!! ive got like 17 now cos they took all all the susended accounts away from my list 

0,2190162850,Tue Jun 16 01:56:59 PDT 2009,NO_QUERY,zombiecommand,That's a negative on the bites @marawitch and @lendmeyoureyes. Drunk wrestling has led to what a neck sprain. No sleep for me last night 

0,2190162989,Tue Jun 16 01:57:00 PDT 2009,NO_QUERY,grum,My shots from The Fumes/The Novocaines gig the other night. Half got destroyed in the harddrive crash   http://bit.ly/Gyo5J

0,2190163070,Tue Jun 16 01:57:01 PDT 2009,NO_QUERY,cintaaaa,"10 more days, graduation. And the nightmare is that day will be the last day we meet guys. Can I stop the time ? "

0,2190163117,Tue Jun 16 01:57:02 PDT 2009,NO_QUERY,zenojones,@MsJuicy313 soo mine been doing that alot lately too 

0,2190163187,Tue Jun 16 01:57:02 PDT 2009,NO_QUERY,iamajeanius,Today I had to crawl under my table 2 get 2 my chair coz every1 was in the way. I accidentally crawld on a thumbtack. It went into my leg 

0,2190163232,Tue Jun 16 01:57:03 PDT 2009,NO_QUERY,mocha_mix,cannot sleep !! 

0,2190163238,Tue Jun 16 01:57:03 PDT 2009,NO_QUERY,TyPie,"I saw something funny today that I wanted to post to wrongworddammit, but I can't remember what it was "

0,2190163243,Tue Jun 16 01:57:03 PDT 2009,NO_QUERY,HughDavis,Arriving at the end of the world (St Andrews) to give seminar. Cloudy and cool 

0,2190163575,Tue Jun 16 01:57:06 PDT 2009,NO_QUERY,littledreamx,back to work in 30 min... 

0,2190163587,Tue Jun 16 01:57:06 PDT 2009,NO_QUERY,shakiralove,"haha whenevr laa. btw, by next week im gone!  @Jiaamrol"

0,2190163772,Tue Jun 16 01:57:08 PDT 2009,NO_QUERY,pezholio,"@nickbrickett Ah cool, turnns out I might be too skint to get one  at the moment anyway! "

0,2190163883,Tue Jun 16 01:57:09 PDT 2009,NO_QUERY,Riley_D,Chemistry exam tomorrow 

0,2190164075,Tue Jun 16 01:57:11 PDT 2009,NO_QUERY,Stephaniestarr,Omg it's 4:53 omg am screwed for today  oh. Well like am going to do anything that important :/

0,2190164120,Tue Jun 16 01:57:12 PDT 2009,NO_QUERY,vintagetrash,@MakerOfShadows I didn't ddo school today so I am now 

0,2190164708,Tue Jun 16 01:57:18 PDT 2009,NO_QUERY,DustinECL,"@youngmoneyyy Why are you up this early?  If you're bored call me, I'm up and super bored."

0,2190164965,Tue Jun 16 01:57:20 PDT 2009,NO_QUERY,kristinyang,so overworked. not funny 

0,2190165029,Tue Jun 16 01:57:21 PDT 2009,NO_QUERY,kovster,@jwil1 not over here it isn't 

0,2190165157,Tue Jun 16 01:57:22 PDT 2009,NO_QUERY,cerealjoe,Feels like a wednesday today. Why do I always feel like I'm living one day ahead of the scheduled time 

0,2190165233,Tue Jun 16 01:57:23 PDT 2009,NO_QUERY,1Cherub,Was watchin some Jamaican daggering pissed me right off dam whats wrtong with our people.....dam shame. 

0,2190165390,Tue Jun 16 01:57:25 PDT 2009,NO_QUERY,TeeQ2,"@arifandi mendingg..... Bau org sakit fan, huuufff... Really hate hospital... "

0,2190165816,Tue Jun 16 01:57:29 PDT 2009,NO_QUERY,kat_n,"@sorcha69 yeh.thy usually shift my cold  in like1 day,lol.i get hayfever too.cant take pills for it,thy give me sore stomach  xxx"

0,2190166265,Tue Jun 16 01:57:34 PDT 2009,NO_QUERY,Janan_a,@muscati i havent recieved anything but i think its because nobody loves me 

0,2190166450,Tue Jun 16 01:57:35 PDT 2009,NO_QUERY,sarzahhh,@_nicoletam it was not funny  where were you? Swine?

0,2190166569,Tue Jun 16 01:57:37 PDT 2009,NO_QUERY,AMPMinnie,Sims is sooo addicting!! Installing it on my lil bro desktop cozz my laptop suckkzzzz 

0,2190166573,Tue Jun 16 01:57:37 PDT 2009,NO_QUERY,Connie_MW,"@_Antoinetta omg I really want that,but I have to save money "

0,2190166914,Tue Jun 16 01:57:40 PDT 2009,NO_QUERY,Rikou26,"Having to go to college to check my email, hoping i'm not going to be late for Kyra. "

0,2190167102,Tue Jun 16 01:57:43 PDT 2009,NO_QUERY,zarazombie,@ the course. she's skipping the class again 

0,2190167115,Tue Jun 16 01:57:43 PDT 2009,NO_QUERY,romantic_Steph,"@DavidArchie ahh! omg, its 4am and i just got back from the hospital cause i got a chemical in my eye!  im glad you made it safely to CT!"

0,2190167834,Tue Jun 16 01:57:51 PDT 2009,NO_QUERY,annaats,"too cold, damn this air conditioning! "

0,2190168256,Tue Jun 16 01:57:55 PDT 2009,NO_QUERY,fayebo27,going home today  dont wanna. . school tom as well *sighs*

0,2190168384,Tue Jun 16 01:57:57 PDT 2009,NO_QUERY,vixey,@purepulse64 awwww that sucks... 

0,2190168448,Tue Jun 16 01:57:58 PDT 2009,NO_QUERY,anaredsox424,Going to bed. SO much to do tomorrow.  So many people to call this week. Trying to get my life back in order.

0,2190168463,Tue Jun 16 01:57:58 PDT 2009,NO_QUERY,NicolaKenny,@tickingclocks dude i think i am gunna cry i am in the library in tears 

0,2190169360,Tue Jun 16 01:58:07 PDT 2009,NO_QUERY,RowinnDinosaur,i just drank my 4th protein shake.. hahhaha my metabolism is fluxuating again ~o and i love eating fruits &lt;3 &amp; their high sugar contents 

0,2190169409,Tue Jun 16 01:58:08 PDT 2009,NO_QUERY,Tigergrrrrl,@iSpyLevis What about Canberra 

0,2190169811,Tue Jun 16 01:58:12 PDT 2009,NO_QUERY,BrokenFairy87,@cal_el_uk tell me about it. I wanna go back to bed - curse you for making me get up 

0,2190169825,Tue Jun 16 01:58:12 PDT 2009,NO_QUERY,halftone84,"Woke up with a headache, looks like today isn't gonna be a good one either "

0,2190169839,Tue Jun 16 01:58:12 PDT 2009,NO_QUERY,solutions4web,Hard work day 

0,2190170184,Tue Jun 16 01:58:16 PDT 2009,NO_QUERY,charlene_kate28,nothing happened. we didn't have class. i just wasted my allowance. 

0,2190170190,Tue Jun 16 01:58:16 PDT 2009,NO_QUERY,birdsonwires,"@lunasaisho Haha, Axe can has some really nice and some horrble variations. I accidentally bought &quot;Unlimited&quot; once "

0,2190170588,Tue Jun 16 01:58:20 PDT 2009,NO_QUERY,clicheddisaster,"Got woke up by sister and Mum lying beside me in my bed at 7am, now can't sleep. "

0,2190170729,Tue Jun 16 01:58:22 PDT 2009,NO_QUERY,natasyawoohoo,I saw the haunted house! Tht haunted house is near with my home! Aaaaggghh I totaly freakin' out 

0,2190170843,Tue Jun 16 01:58:23 PDT 2009,NO_QUERY,garyandrews,"@twofootedtackle Yeah, would have been a nice easy trip for me. Midweek fixture means I'm unlikely to make a home tie "

0,2190171062,Tue Jun 16 01:58:25 PDT 2009,NO_QUERY,markhernz,Wait wait wait... this is myh first tweet of the day?! Amazing! Must be the weather... but I have work until 5am tomorrow 

0,2190171096,Tue Jun 16 01:58:26 PDT 2009,NO_QUERY,Adwil24,"@Naughty_Dog Damn too late, looks like I'll never get to play the BETA! Never got the code with inFamous &amp; all the giveaways are USA only "

0,2190171142,Tue Jun 16 01:58:26 PDT 2009,NO_QUERY,TrealAss_Taylor,alone smoking roaches  hiphop keeps me sane.

0,2190171474,Tue Jun 16 01:58:30 PDT 2009,NO_QUERY,lonely_h3art,going home alone! 

0,2190171689,Tue Jun 16 01:58:32 PDT 2009,NO_QUERY,xomusicfreakxo,there is an end to things no matter how much we want to hold onto them.. 

0,2190171706,Tue Jun 16 01:58:32 PDT 2009,NO_QUERY,BLACCHYNA,@LEGENDARYDOLCE r u still in Miami ..... I txted u  but u did text me back .... I will call u Sunday when I come home love ya hehe!!!!!

0,2190171754,Tue Jun 16 01:58:33 PDT 2009,NO_QUERY,jtb81100,relaxing in my room while my pics from today download off my camera. amazed that my body is still on ET only 2a here and ready for sleep 

0,2190171961,Tue Jun 16 01:58:35 PDT 2009,NO_QUERY,MissHollyBee,Pain killers not working  Two more down the hatch!

0,2190172086,Tue Jun 16 01:58:36 PDT 2009,NO_QUERY,SallyDunstone,Last nights episode of Ideal is hilairious ! Jealous of my sister in NY 

0,2190172124,Tue Jun 16 01:58:37 PDT 2009,NO_QUERY,1Cherub,Was watchin some Jamaican daggering pissed me right off.... dam whats wrong with our people.....dam shame. 

0,2190172478,Tue Jun 16 01:58:41 PDT 2009,NO_QUERY,HotRachel,How dare you trick me into watching scary movies! I am so not prepared for this. I need my teddy 

0,2190172561,Tue Jun 16 01:58:42 PDT 2009,NO_QUERY,zrah,@littlepianodiva did you get the podcast? sorry i couldn't make the Fridge last night! 

0,2190172718,Tue Jun 16 01:58:44 PDT 2009,NO_QUERY,pauldunn_,"rebuilding a flattened .psd, not a great start to the day "

0,2190172904,Tue Jun 16 01:58:45 PDT 2009,NO_QUERY,jamesuniversal,@indeeeee awww  its alright xo

0,2190173824,Tue Jun 16 01:58:55 PDT 2009,NO_QUERY,seojieshim,google is down! 

0,2190173851,Tue Jun 16 01:58:56 PDT 2009,NO_QUERY,RacerGirlx,changed my name o ere altho it iis not saying i have.. what is the crack with this twitter man?? I just dont get it..very quiet 4 me lol 

0,2190174022,Tue Jun 16 01:58:58 PDT 2009,NO_QUERY,TAMATOAWASHERE,it is for me! its annoying me  i never realized how much i googled. and now i can't do anything. STUPID GOOGLE. its broken.

0,2190174042,Tue Jun 16 01:58:58 PDT 2009,NO_QUERY,bthaxor,"hehe spamming twitter... can't wait til 3.0 comes out tomorrow D: also shit, i just remembered i have maths enrich "

0,2190174598,Tue Jun 16 01:59:03 PDT 2009,NO_QUERY,dearestjanice,Traveling this early reminds me of being in Oxford 

0,2190174708,Tue Jun 16 01:59:05 PDT 2009,NO_QUERY,AleCherry,my ears still hurt from that auriculothingy haha omg i cant believe its 5am! and im not tired  booo insomnia you suck!!!!

0,2190175123,Tue Jun 16 01:59:09 PDT 2009,NO_QUERY,jaygorman,@Jazzybam Nooooo    iphone 3.0 leaked for those who cant wait till tomorrow

0,2190175334,Tue Jun 16 01:59:12 PDT 2009,NO_QUERY,robz45,i am at collge still bord 

0,2190175345,Tue Jun 16 01:59:12 PDT 2009,NO_QUERY,twototango,"@iamdesign Unfortunately not, instead water from the britta can "

0,2190175434,Tue Jun 16 01:59:13 PDT 2009,NO_QUERY,andygalloway93,"not liking today, got to make some serious decisions. About the rest of me life "

0,2190175549,Tue Jun 16 01:59:14 PDT 2009,NO_QUERY,omfgitsella,i hate it! LT tomorrow ( gotta do my homework and study now. 

0,2190175687,Tue Jun 16 01:59:15 PDT 2009,NO_QUERY,connievstack,@victoriabush OMG!! dammit im going on friday! ahh  xx

0,2190175885,Tue Jun 16 01:59:17 PDT 2009,NO_QUERY,dtt75,is suffering very badly with hayfever today 

0,2190176287,Tue Jun 16 01:59:21 PDT 2009,NO_QUERY,poltri,"stuck in my head! grrr!..  &gt;&gt; you keep me hanging on and we're not moving on, we're standing still, jenny ....."

0,2190176386,Tue Jun 16 01:59:22 PDT 2009,NO_QUERY,liyutamiru,"emma winder, i NEEED to talk to you. like seriously need too!  x"

0,2190176498,Tue Jun 16 01:59:24 PDT 2009,NO_QUERY,aniedj,I've spent hours to write I don't know what to write 

0,2190176813,Tue Jun 16 01:59:27 PDT 2009,NO_QUERY,debajo,raining.. again! 

0,2190176844,Tue Jun 16 01:59:27 PDT 2009,NO_QUERY,KrisBuytaert,@tomklaasen thats what we told our current one .. the others don't seem to be interrested .. 

0,2190176886,Tue Jun 16 01:59:28 PDT 2009,NO_QUERY,sotodance,@AmazingBecause same old. same old. 

0,2190176958,Tue Jun 16 01:59:29 PDT 2009,NO_QUERY,netjagan,reading docs.......  .... but cant wait for the match Sri and NZ.....

0,2190177229,Tue Jun 16 01:59:32 PDT 2009,NO_QUERY,DizzyMalfoy,"My dad's fixing our sink.....since I couldn't.  actually, I never tried."

0,2190177374,Tue Jun 16 01:59:33 PDT 2009,NO_QUERY,emilyclue,@daisylane_ are you alright? 

0,2190177781,Tue Jun 16 01:59:37 PDT 2009,NO_QUERY,Rachel88439,Has a bad feeling about college  -Watch Tv On Your Pc go http://bit.ly/sOSGph

0,2190178426,Tue Jun 16 01:59:45 PDT 2009,NO_QUERY,stwange,"back in Bath, driving down this morning made for a 5am start to my day "

0,2190178471,Tue Jun 16 01:59:45 PDT 2009,NO_QUERY,XxAmziexX,Sooo tired ryt now  dont think im gunna make it lol...

0,2190178717,Tue Jun 16 01:59:48 PDT 2009,NO_QUERY,emz_001,@JLSOfficial awww stupid police  never mind theres always nxt tym!!! hope u guys had fun last nyt!! xxxxx

0,2190178754,Tue Jun 16 01:59:48 PDT 2009,NO_QUERY,sprinkles_,"@lejjewellery aw, give her a cuddle from me. colds suck "

0,2190178830,Tue Jun 16 01:59:49 PDT 2009,NO_QUERY,katrienlurve,i'm really upset.  wa ko kbaw where ko nsayup. AHAY! :|

0,2190179103,Tue Jun 16 01:59:52 PDT 2009,NO_QUERY,JeniferClare,wants to go on ad adventure  why won't anyone let me xoxo

0,2190179772,Tue Jun 16 01:59:59 PDT 2009,NO_QUERY,day2daypa,"Good grief, now its one called sophie - look out @maddisondesigns, here's another one "

0,2190181002,Tue Jun 16 02:00:06 PDT 2009,NO_QUERY,tickingclocks,"@NicolaKenny I know! But I'm going to see JB in November so I'm not that bummed and McFly at V Fest, so I feel more for you "

0,2190181082,Tue Jun 16 02:00:07 PDT 2009,NO_QUERY,hadramie,Hadoih.. someone is spamming my #fb with irrelevant tweets. 

0,2190181470,Tue Jun 16 02:00:09 PDT 2009,NO_QUERY,MarWaters,@richawaters when I paint my masterpiece! Miss Jer. 

0,2190181875,Tue Jun 16 02:00:12 PDT 2009,NO_QUERY,harness87,helping out at frank's work today 

0,2190182200,Tue Jun 16 02:00:15 PDT 2009,NO_QUERY,jasonfry,@TomGrange DÃ guerpissez ! Nous avons dÃ truit le Monsieur Marsaud  Il est mort avec le baguette (totally cheated and used the translator)

0,2190182338,Tue Jun 16 02:00:16 PDT 2009,NO_QUERY,ASOS_Fi,"Getting stuck in torrential rain last night, coupled with our antartic air conditioning, is making me poorly "

0,2190182383,Tue Jun 16 02:00:16 PDT 2009,NO_QUERY,wattscooking,@wattsupman England lost though  To the West Indies. Boo!

0,2190182676,Tue Jun 16 02:00:18 PDT 2009,NO_QUERY,TerriEddyAlice,I have to go tweeters  tweet you soon xo

0,2190183052,Tue Jun 16 02:00:22 PDT 2009,NO_QUERY,imkarladee,still sick..  I miss you..

0,2190183187,Tue Jun 16 02:00:23 PDT 2009,NO_QUERY,matthewbudd,"An update to my tweet on #safari4 font rendering. I've just been told the Mac is the same, its only on the PC version they're correct "

0,2190183467,Tue Jun 16 02:00:25 PDT 2009,NO_QUERY,stevieg69,@Kenzielee_ Work is really stressful today!!  Need cheering up! =p

0,2190183617,Tue Jun 16 02:00:27 PDT 2009,NO_QUERY,Burto1980,@Pammy_Peaches oh dear. Last time that happened to me was Wanniassa. It seeped down into the Asians downstairs house through the roof. 

0,2190184050,Tue Jun 16 02:00:30 PDT 2009,NO_QUERY,Kimberley__,"@PinkTrees: i'm going to lay down for a while, i'm all crampy and feeling yuck! i really hate being a woman at times "

0,2190184658,Tue Jun 16 02:00:35 PDT 2009,NO_QUERY,happytobealone,@gfalcone601 I have cold   here's autumn in Chile  enjoy the sunshine for me!!!  Xx

0,2190184804,Tue Jun 16 02:00:37 PDT 2009,NO_QUERY,Rubybelle,Book club was good and food received approval. Smashed the glass jug on my blender though - had even frozen strawberries for daiquiriâ€ s! 

0,2190185059,Tue Jun 16 02:00:39 PDT 2009,NO_QUERY,AaronTunney,Aagh! It's Royal Ascot week and the train to Staines is packed. 

0,2190185645,Tue Jun 16 02:00:44 PDT 2009,NO_QUERY,laurenvharrison,i thought i was happy today but i just walked into a box and i think ive broken my toe so im sad now  ahahha.

0,2190185849,Tue Jun 16 02:00:46 PDT 2009,NO_QUERY,aini,I shouldn't have panicked!! It's all my fault. 

0,2190186537,Tue Jun 16 02:00:52 PDT 2009,NO_QUERY,reithegenki,"Bah - I was exhausted hours ago, but somehow I forced myself to stay awake until 2am.  Bad Sims 3  Bad!!!"

0,2190186724,Tue Jun 16 02:00:54 PDT 2009,NO_QUERY,NicolaKenny,@tickingclocks i am bummed out for myself i miss them 

0,2190186777,Tue Jun 16 02:00:55 PDT 2009,NO_QUERY,whuchton,"FML stomach virus! Cant even focus my eyes, must have water "

0,2190187202,Tue Jun 16 02:00:59 PDT 2009,NO_QUERY,LoveMeDeux,@ezrabutler I have totally done that before. 

0,2190187240,Tue Jun 16 02:01:00 PDT 2009,NO_QUERY,WashDesign,@mark_e_f Very jealous. 2 years since I've been 

0,2190187288,Tue Jun 16 02:01:00 PDT 2009,NO_QUERY,Thefashionite,Someone help me! I can't go to sleep. 

0,2190187836,Tue Jun 16 02:01:04 PDT 2009,NO_QUERY,emmanuellaiero,lie down on bed. i don't have idea to my story. actually i have had the story till end in my mind but i can't translate it into english 

0,2190187838,Tue Jun 16 02:01:04 PDT 2009,NO_QUERY,blasha,@DiiLee Kaaaaaaaaaaaaak 3al shayib in UP!!! Abi kevin  ana

0,2190187889,Tue Jun 16 02:01:05 PDT 2009,NO_QUERY,charlizeshore,wishes she was in New York with her friends 

0,2190188323,Tue Jun 16 02:01:11 PDT 2009,NO_QUERY,ainimountei,"Again, I don't think the 140-character limit is enough.  #twitter"

0,2190188509,Tue Jun 16 02:01:13 PDT 2009,NO_QUERY,sarahlestrange,The Nanny is over.  WANT MORE!

0,2190189528,Tue Jun 16 02:01:21 PDT 2009,NO_QUERY,jazzyweb,snacks with steph and ces.  Everyone's surprised and sad about my temporary transfer  http://plurk.com/p/11arqt

0,2190190366,Tue Jun 16 02:01:29 PDT 2009,NO_QUERY,Nerdymusicazn,Gah my dog shed all over my bed now i can't breathe 

0,2190191065,Tue Jun 16 02:01:36 PDT 2009,NO_QUERY,allMywonders,@greensleeves33  I decided to give H-C.org to Britt. That saves it from certain other people who've asked for it haha I hope this is ok!

0,2190191127,Tue Jun 16 02:01:37 PDT 2009,NO_QUERY,angi94,Craving vanilla and choco pudding from germany.... 

0,2190191549,Tue Jun 16 02:01:41 PDT 2009,NO_QUERY,gigogoomba,@berticus sorry 

0,2190191673,Tue Jun 16 02:01:42 PDT 2009,NO_QUERY,wolframkriesing,Why is my dojo build not properly interning the locale stuff i set via localeList? 

0,2190192031,Tue Jun 16 02:01:46 PDT 2009,NO_QUERY,kewlanupam,Feels great to see the 3.5G status!Yup 3G hs finally arrivd!..pity i cant use it on ma iphone 

0,2190192100,Tue Jun 16 02:01:46 PDT 2009,NO_QUERY,Mskimberhaze,Okay why do i always wake up 3 hrs early... FML 

0,2190192576,Tue Jun 16 02:01:51 PDT 2009,NO_QUERY,rebekahnew,I really want to see someone right now but its just not possible  I hope they know who they are because this tweet is for them.

0,2190192750,Tue Jun 16 02:01:53 PDT 2009,NO_QUERY,jmoo2,@deliciousmag My parents used to get Walls Viennetta when special guests came over for dinner 

0,2190192761,Tue Jun 16 02:01:53 PDT 2009,NO_QUERY,getvisible,Jumpcut.com closed by Yahoo! shame I never used it 

0,2190192805,Tue Jun 16 02:01:54 PDT 2009,NO_QUERY,gw212, byee guysss

0,2190192934,Tue Jun 16 02:01:55 PDT 2009,NO_QUERY,huntahead,The European auto market contracted 4.9% in May but Dacia doubled sales http://tinyurl.com/nzhtgb German &quot;AbwrackprÃ¤mie&quot; helps Romania 

0,2190192948,Tue Jun 16 02:01:55 PDT 2009,NO_QUERY,andybee,"@jamescridland Struggled with OO Impress a couple of days ago myself. Sad though it is, I actually preferred PowerPoint "

0,2190193208,Tue Jun 16 02:01:58 PDT 2009,NO_QUERY,Ex0T,@mileycyrus missing your pictures... 

0,2190193822,Tue Jun 16 02:02:03 PDT 2009,NO_QUERY,Fieldflower,Leaving Hawaii tomorrow; not happy!! 

0,2190194231,Tue Jun 16 02:02:07 PDT 2009,NO_QUERY,SisStormEurope,It's bloomsday!!!! Almost better than Christmas! I wasn't tipsy last night but poor girls  -anw

0,2190194238,Tue Jun 16 02:02:07 PDT 2009,NO_QUERY,drdogbiscuit,@ghickman Ah. That makes more sense. I was wondering what your dog was doing with an ATM. Hope your dogs OK 

0,2190194300,Tue Jun 16 02:02:07 PDT 2009,NO_QUERY,prianca_y,Got news bout my pay revision......now m sad why we went on a strike to get this earlier 

0,2190194489,Tue Jun 16 02:02:09 PDT 2009,NO_QUERY,Shawnpaul81,Time to work... Yay!!! 

0,2190194520,Tue Jun 16 02:02:09 PDT 2009,NO_QUERY,Tracey_Mac,@braveheart76  oh god!  xxx

0,2190194699,Tue Jun 16 02:02:11 PDT 2009,NO_QUERY,sam_13,damn !!! i'm so sick now 

0,2190195403,Tue Jun 16 02:02:18 PDT 2009,NO_QUERY,littleredfoxx,@krissyb thanks Krissy. Keeping my fingers crossed that something still can be done. 

0,2190195449,Tue Jun 16 02:02:18 PDT 2009,NO_QUERY,angelakeochrn,@Oakley trying to find womens asian-fit in the UK with no luck. Having a small nose bridge doesn't help  Any ideas?

0,2190195512,Tue Jun 16 02:02:18 PDT 2009,NO_QUERY,grundyp123,Really bored and tyred  wot should i do?

0,2190195558,Tue Jun 16 02:02:19 PDT 2009,NO_QUERY,AMANDATYRER,OMG! I think I slept funny last night. My neck is in excruciating(sp?) pain 

0,2190195754,Tue Jun 16 02:02:21 PDT 2009,NO_QUERY,iambuddelt,Hurry doc!!! I wanna leave  http://myloc.me/40Bp

0,2190195890,Tue Jun 16 02:02:22 PDT 2009,NO_QUERY,Marawitch,@Zombiephile Noooo. Sadly  I've got the cat at the front window keeping an eye out though!

0,2190195959,Tue Jun 16 02:02:23 PDT 2009,NO_QUERY,koltregaskes,@tanath There is supposed to be some issues with Chrome and Windows 7. 

0,2190196290,Tue Jun 16 02:02:26 PDT 2009,NO_QUERY,rubberbandage,"Why does drupal's search suck so hard, and why does command-line access to a hosted server cost so much? I want sphinx, or at least solr! "

0,2190196862,Tue Jun 16 02:02:32 PDT 2009,NO_QUERY,WillAEllis,@VitalNorwich bury ring any bells? 

0,2190197201,Tue Jun 16 02:02:35 PDT 2009,NO_QUERY,debbiebigbee,had decided not to go for School's Out this year. 

0,2190198029,Tue Jun 16 02:02:44 PDT 2009,NO_QUERY,priscila9,rainy days are for beeing in bed   

0,2190198471,Tue Jun 16 02:02:49 PDT 2009,NO_QUERY,a4arvind,Ah... havent watched TBBT for a long time now  wens the nxt season/epi coming?

0,2190198512,Tue Jun 16 02:02:50 PDT 2009,NO_QUERY,Silent_One07,Watching another stupid sunrise.. This is getting to be to hard.    

0,2190198634,Tue Jun 16 02:02:51 PDT 2009,NO_QUERY,eyyJD, life goes on right? G'night.

0,2190198716,Tue Jun 16 02:02:52 PDT 2009,NO_QUERY,natwebb,"aghh watching wiggles, dinner nearly ready im not hungry though, operation tomorrow  no school for 2 weeks, who wants to keep me...."

0,2190199051,Tue Jun 16 02:02:56 PDT 2009,NO_QUERY,XkayliiX,Has a headache ouchh 

0,2190199396,Tue Jun 16 02:03:00 PDT 2009,NO_QUERY,ryanupton,This morning I awoke twice - the first time my mum came in at 7:50! Wtf? Then at 8:10 there was the sound of builders  No sleep for me.

0,2190199549,Tue Jun 16 02:03:01 PDT 2009,NO_QUERY,roaringrepub,@jen004  Always been that way?

0,2190199615,Tue Jun 16 02:03:02 PDT 2009,NO_QUERY,Menage_A_Moi,Back to Coventry Day 2. More client abuse probably 

0,2190199648,Tue Jun 16 02:03:02 PDT 2009,NO_QUERY,snowyskinny,Hard day for me  http://myloc.me/40By

0,2190199711,Tue Jun 16 02:03:03 PDT 2009,NO_QUERY,fragtastic,fukin hate when I quote a job and get it and know I was too cheap - like puts a damper on doing it 

0,2190200391,Tue Jun 16 02:03:10 PDT 2009,NO_QUERY,fly3vic,@stanmorePhoenix very welcome. When r u next busking? I was on Pitt st on sat but don't remember seeing anyone busking 

0,2190201142,Tue Jun 16 02:03:18 PDT 2009,NO_QUERY,CheekTV,"@3sixty5days Contact the bank, the atm should have some sort of record that it retained the card. Welcome to London...sorry.  x"

0,2190201191,Tue Jun 16 02:03:18 PDT 2009,NO_QUERY,Shiminay,"@Jaoibh Actually, custard :p Scones give me heartburn for some reason - sucks cause I love them "

0,2190201193,Tue Jun 16 02:03:18 PDT 2009,NO_QUERY,aqueenix,@monikahosiana what time will u be done? 

0,2190201215,Tue Jun 16 02:03:19 PDT 2009,NO_QUERY,NicTMPG,off to Cha Cha!..this should be interesting as i missed last week's lesson cos of the flu   #fb

0,2190201335,Tue Jun 16 02:03:20 PDT 2009,NO_QUERY,vcwave,"Oh,It's a thunderstorm.  "

0,2190201640,Tue Jun 16 02:03:23 PDT 2009,NO_QUERY,titchxo,well that was a fun morning :/ horrible news. grrrr 

0,2190201641,Tue Jun 16 02:03:23 PDT 2009,NO_QUERY,stephendonner,"so...Blink 182 is back together; is that the death of Angels &amp; Airwaves, then? "

0,2190201883,Tue Jun 16 02:03:26 PDT 2009,NO_QUERY,prettyeana,im starting to hate her..  gosshhh ..

0,2190201893,Tue Jun 16 02:03:26 PDT 2009,NO_QUERY,baconhairhale,laying in bed wif the swine flu bc i ate 2 much bacon nd now i've got the swine flu. 

0,2190202289,Tue Jun 16 02:03:30 PDT 2009,NO_QUERY,matthew_raymer,is stuck in line waiting for a taxi 

0,2190202383,Tue Jun 16 02:03:31 PDT 2009,NO_QUERY,Roibahodsnblods,Back from Munich ... back to work ... 

0,2190202443,Tue Jun 16 02:03:32 PDT 2009,NO_QUERY,iadoreisha,@mykol07 yea I kno. 

0,2190202504,Tue Jun 16 02:03:32 PDT 2009,NO_QUERY,lorissaprid,"wtheck, i got disconnected from xbox live.  i guess it's a sign that i should sleep soon.. my mom called me a vampire cos i'm up so late."

0,2190202573,Tue Jun 16 02:03:33 PDT 2009,NO_QUERY,1sb,Trying to detox 2day! No more tea or coffee for the day. Not feeling great about no tea &amp; cake! I LOVE CAKE ahhh......cake + water = 

0,2190202603,Tue Jun 16 02:03:33 PDT 2009,NO_QUERY,sabrina_tan,Feels that her latest blog post is too short. 

