0,2208186583,Wed Jun 17 08:53:18 PDT 2009,NO_QUERY,AdiLeigh,Why am I dragging this week? I cannot wake up to save my soul AND my coffee isn't working! 

0,2208186778,Wed Jun 17 08:53:19 PDT 2009,NO_QUERY,suebrody1,"@DougAway Really? No girl of your dreams anymore? Sorry.  No guy for me, either. Am consoled by enjoying Kradam info and songs. LOL"

0,2208187209,Wed Jun 17 08:53:21 PDT 2009,NO_QUERY,JGilliland_Art,No Force Cast tonight.  

0,2208187381,Wed Jun 17 08:53:21 PDT 2009,NO_QUERY,DeviantPlay,Hmmm.. I think that went well. No eye contact at the end gave me a clue though. 

0,2208187486,Wed Jun 17 08:53:22 PDT 2009,NO_QUERY,DeLore,@evyled NO!!!! 

0,2208187595,Wed Jun 17 08:53:22 PDT 2009,NO_QUERY,JonnySayer,Really needs a P 

0,2208187597,Wed Jun 17 08:53:22 PDT 2009,NO_QUERY,tanyiajo,"@jonlee3 @hipstergigante Yay for Camera Obscura. Drats missing Metric+Phoenix   I, too, think @dangerousbacon is hilarious! #similitude"

0,2208188037,Wed Jun 17 08:53:24 PDT 2009,NO_QUERY,dontforgetchaos,@Orchidflower Me too. Might try that sleep thing again as I only have 1 more day off. Sniff sniff sob 

0,2208188486,Wed Jun 17 08:53:27 PDT 2009,NO_QUERY,shine365,Omg I hope I remember where I parked my car 

0,2208188770,Wed Jun 17 08:53:28 PDT 2009,NO_QUERY,tehnakki,I'm not authorised to see @BrokenAngel tweets anymore. she h8s me  

0,2208188838,Wed Jun 17 08:53:28 PDT 2009,NO_QUERY,richard_hughes,@RealBillBailey I couldn't find it 

0,2208189247,Wed Jun 17 08:53:30 PDT 2009,NO_QUERY,HarleyzWorld,Anybody wanna go in 2 work 4 me tonite? I'll let u borrow ma chevrons and u just run shift for me. My head is bangin man 

0,2208189521,Wed Jun 17 08:53:31 PDT 2009,NO_QUERY,LordieJordie,@ELBerger aww! I'm working 

0,2208189840,Wed Jun 17 08:53:33 PDT 2009,NO_QUERY,ColieMarieeex3,"Work, yuck. "

0,2208190128,Wed Jun 17 08:53:34 PDT 2009,NO_QUERY,lizigee,@LinzWaddy  *hugs*

0,2208190136,Wed Jun 17 08:53:34 PDT 2009,NO_QUERY,inimeg,The worst part of being an SEO content writer -  you can never claim u wrote it  

0,2208190350,Wed Jun 17 08:53:35 PDT 2009,NO_QUERY,larissaland,@_SNO_ I'm still in denial that you're leaving 

0,2208190452,Wed Jun 17 08:53:36 PDT 2009,NO_QUERY,emlyons17,I miss summer 

0,2208190651,Wed Jun 17 08:53:37 PDT 2009,NO_QUERY,WhoisMAYA,@xoxoMarianna I would gladly go! but my VISA just expired  I love LONDON

0,2208190892,Wed Jun 17 08:53:38 PDT 2009,NO_QUERY,MzSherlz,Bout to hit tthe gym...maybe...still sore from yesterday 

0,2208191309,Wed Jun 17 08:53:40 PDT 2009,NO_QUERY,Slayton22,Excited to see the Laker parade but bummed I can't be there!! 

0,2208191471,Wed Jun 17 08:53:41 PDT 2009,NO_QUERY,Mimiteh26,@JustFoxy I'm very well thanks. I'm missing Sarah...she unfollowed me   

0,2208191529,Wed Jun 17 08:53:41 PDT 2009,NO_QUERY,peekandsneak,my blog is down because there is some server error 

0,2208191592,Wed Jun 17 08:53:41 PDT 2009,NO_QUERY,Denise20380,why are folk ignoring me 

0,2208191880,Wed Jun 17 08:53:42 PDT 2009,NO_QUERY,jayme_wild,"i woke up stoked to install iphone os 3.0, but it wasnt there. Its like saying no santa on xmas morning "

0,2208192172,Wed Jun 17 08:53:44 PDT 2009,NO_QUERY,32f,Arrgh! Does media temple have to have 311 greatest hits as their on hold music 

0,2208192208,Wed Jun 17 08:53:44 PDT 2009,NO_QUERY,PascalReid,"I just got the new OS 3.0 upgrade for the iPhone and too many apps aren't working well, not too happy about the upgrade "

0,2208192451,Wed Jun 17 08:53:45 PDT 2009,NO_QUERY,mykale007,@Jayme1988 Later Monkey Butt!!!!  I'll just go to the corner and sulk since ya won't cheer me up!!!!  

0,2208192476,Wed Jun 17 08:53:45 PDT 2009,NO_QUERY,justlovemusic,"omfg, its going to rain on prom "

0,2208193043,Wed Jun 17 08:53:48 PDT 2009,NO_QUERY,conflagratio,"OMG was a terrible mistake, my phone operator sent me an SMS that yes but still 2.2.1 "

0,2208193085,Wed Jun 17 08:53:48 PDT 2009,NO_QUERY,JessMcFlyxxx,@xMissMelisax same i really wanted to go but i wasnt allowed lol i didnt see any of them today  but i will tomorrow so ill ask them  xxx

0,2208193312,Wed Jun 17 08:53:46 PDT 2009,NO_QUERY,crystalhunter,@kellycree when I go to Vegas to visit my family.    not often enough.

0,2208193509,Wed Jun 17 08:53:50 PDT 2009,NO_QUERY,mw20iscrushin,i have a headache 

0,2208193798,Wed Jun 17 08:53:51 PDT 2009,NO_QUERY,chadreyes,@bring2help2 I have one in Product &quot;B&quot; but still need one more  It truly is amazing how people who need rescued give the most resistance?

0,2208193911,Wed Jun 17 08:53:52 PDT 2009,NO_QUERY,TiffyLaw,My eyes are in pain. 

0,2208194067,Wed Jun 17 08:53:53 PDT 2009,NO_QUERY,sleepingqueen,@minnaeii thats very true na! people cant come to peace 

0,2208194185,Wed Jun 17 08:53:53 PDT 2009,NO_QUERY,dalemathieson,"Want to reinstall anyway, but can't find my Leopard disk. "

0,2208194346,Wed Jun 17 08:53:54 PDT 2009,NO_QUERY,Ashley_mehnert,7 weeks of 'morning' sickness hopefully only 2 left. Could be in hospital over weekend 

0,2208194465,Wed Jun 17 08:53:54 PDT 2009,NO_QUERY,berndschiffer,"@luebken Okay, I see. At least they are somehow annoying. Don't want spam neither in email nor in Twitter.  I'm so &gt;2.0 "

0,2208194719,Wed Jun 17 08:53:55 PDT 2009,NO_QUERY,shannonvicious,Wow. Its so sad how everything seems to work out perfect 

0,2208194738,Wed Jun 17 08:53:56 PDT 2009,NO_QUERY,lomavil,I dont think im going anywhere today. I am beyond tired and i feel ill. Someone come visit and rub my back 

0,2208196222,Wed Jun 17 08:54:02 PDT 2009,NO_QUERY,cornlover,at school and very boring (summer school)   but its ok

0,2208196423,Wed Jun 17 08:54:03 PDT 2009,NO_QUERY,moneyhighway,markets seem to be going back south 

0,2208196591,Wed Jun 17 08:54:04 PDT 2009,NO_QUERY,ClearX,And fatigue is making my bb keyboard skills even worse than usual.. Crunch stayed up til 5am 

0,2208198047,Wed Jun 17 08:54:11 PDT 2009,NO_QUERY,pickwick,@dakegra sorry to hear about the job 

0,2208198335,Wed Jun 17 08:54:12 PDT 2009,NO_QUERY,jaimy_marie,@chuckmilam @mattmutz What?! #chuckup isn't happening now? 

0,2208198477,Wed Jun 17 08:54:13 PDT 2009,NO_QUERY,lyrically_me,@7angela7 I think I have more trouble with my mom than either of the kids. It's because of her that they don't listen to me 

0,2208198619,Wed Jun 17 08:54:14 PDT 2009,NO_QUERY,cheydee,"I miss Britney, now I just got some random horny hottie on my case "

0,2208198666,Wed Jun 17 08:54:14 PDT 2009,NO_QUERY,caithomas44,@lilyroseallen Where abouts are you? Turned cloudy and rainy over here in the SW. Was kind of hoping to beach it tomorrow 

0,2208198702,Wed Jun 17 08:54:14 PDT 2009,NO_QUERY,LilianasMom,My parents just landed in Naples Italy why am I not with them??? oh yeah work  I wish I could have gone!!!

0,2208198920,Wed Jun 17 08:54:15 PDT 2009,NO_QUERY,amberlynnloves,I Just Got Icy-Hot in My Eye! OUCHIE! Where is my boyfriend when I need him?  I need to snuggle so bad right now. I hurt.

0,2208198984,Wed Jun 17 08:54:15 PDT 2009,NO_QUERY,madalainev,@itsonalexa wish I could watch the show live but I'm at work 

0,2208199306,Wed Jun 17 08:54:17 PDT 2009,NO_QUERY,miniaturekites,the paint stir stick broke 

0,2208199412,Wed Jun 17 08:54:17 PDT 2009,NO_QUERY,nerua_L,Good morning! Twitteroos!  today is danicas last full day! Nooooo

0,2208199583,Wed Jun 17 08:54:18 PDT 2009,NO_QUERY,WestonBare,"We're back. Nice long nap. Frieda took off. Left a note saying &quot;It's been nice, but time to move on.&quot; Feels like a country song "

0,2208199752,Wed Jun 17 08:54:19 PDT 2009,NO_QUERY,RachelLily,@CherryPoint49 I feel like I am getting Bronchitis. My chest has been so heavy 

0,2208199883,Wed Jun 17 08:54:19 PDT 2009,NO_QUERY,MeggzBabyy,"my energy level is real looowww right now..  I'm feeling sick , damn"

0,2208200540,Wed Jun 17 08:54:22 PDT 2009,NO_QUERY,conflagratio,@digitalzack finally not 

0,2208200607,Wed Jun 17 08:54:22 PDT 2009,NO_QUERY,mikey_nw19,@britt_mxgirl oh my bad! lol we are hella cool! haha my step-dad doesnt like sports. 

0,2208200774,Wed Jun 17 08:54:23 PDT 2009,NO_QUERY,iLayLou,@officialLatrice is it freakin out yet 

0,2208200785,Wed Jun 17 08:54:23 PDT 2009,NO_QUERY,aimeesherry,someone talk to me  x

0,2208213890,Wed Jun 17 08:55:22 PDT 2009,NO_QUERY,hayduchovny,why do families have to be so awkward 

0,2208214366,Wed Jun 17 08:55:24 PDT 2009,NO_QUERY,themexbox,"@Sogeman you want Sam and Max, I want magic the gethering. Been waiting all day. It'll work soon though, because I have to go to work now "

0,2208214386,Wed Jun 17 08:55:24 PDT 2009,NO_QUERY,ashstoner,@apricotzombie awh that is cute im so sad i have to miss the concert  *tear*

0,2208214679,Wed Jun 17 08:55:25 PDT 2009,NO_QUERY,raisinbraid,I feel tired.  Don't want to read my stack of readings! 

0,2208214900,Wed Jun 17 08:55:26 PDT 2009,NO_QUERY,annabethblue,Ugh. It is hot and sunny out.   I hate summer. Can I have autumn yet?

0,2208215128,Wed Jun 17 08:55:27 PDT 2009,NO_QUERY,mcantuu,@DwightHoward i wanna see that superman stunt you do 

0,2208215368,Wed Jun 17 08:55:28 PDT 2009,NO_QUERY,spurrdy,"at work; missing my Mom, Diana and @cupcakee89; feel like I have not seen them in years "

0,2208215946,Wed Jun 17 08:55:31 PDT 2009,NO_QUERY,ashleymckean,@emilielena thanks for dropping the stuff off love!! p.s we need to get nsn tickets!! except i have no money...  aaaaah!

0,2208216021,Wed Jun 17 08:55:31 PDT 2009,NO_QUERY,raep09,i have a cold that its driving me nuts i couldnt sleep at all last night 

0,2208216060,Wed Jun 17 08:55:31 PDT 2009,NO_QUERY,ohhmandie,@jamesivanlayne i feel dumb. i thought you really wanted to hang out 

0,2208216074,Wed Jun 17 08:55:31 PDT 2009,NO_QUERY,sammychan08,I want to wawtch True Blood  #trueblood

0,2208216489,Wed Jun 17 08:55:33 PDT 2009,NO_QUERY,Sweettisdalex3,such a bad day 

0,2208216778,Wed Jun 17 08:55:34 PDT 2009,NO_QUERY,seouldaddy,"@seanchoe I'm just a pessimist   I should be more of a glass half full guy. I'm returning to Seoul in August, hope to get it then."

0,2208216785,Wed Jun 17 08:55:34 PDT 2009,NO_QUERY,neildalzell,Has sunburn from Portugal 

0,2208217044,Wed Jun 17 08:55:36 PDT 2009,NO_QUERY,prissdiggsdanny,geez.......is the work day over.....yet???? It's killin me..... 

0,2208217606,Wed Jun 17 08:55:38 PDT 2009,NO_QUERY,aznJaime,Almost cried watching the video 

0,2208218002,Wed Jun 17 08:55:40 PDT 2009,NO_QUERY,I_am_Heather,@BrokenStruggle They are making a new Poddington Peas!! I'm not joking. And I am actually excited. I hope they keep the theme tune 

0,2208218478,Wed Jun 17 08:55:42 PDT 2009,NO_QUERY,alexisnicholex3,Talking to my baby.  and missing my sissy really bad. 

0,2208218589,Wed Jun 17 08:55:43 PDT 2009,NO_QUERY,ModifiedVision,@mccartd1 You fail at tweeting. 

0,2208218660,Wed Jun 17 08:55:43 PDT 2009,NO_QUERY,CanuckBlondie,It is now that lovely time of year where I sign my life away to Residence. And pay way to much to do so 

0,2208218746,Wed Jun 17 08:55:43 PDT 2009,NO_QUERY,SandyDetaranto,woke up to blue skies for first time in 3 weeks. I live in the desert. this ain't normal weather.  Bad storm last night. scared my dog 

0,2208219721,Wed Jun 17 08:55:47 PDT 2009,NO_QUERY,cheboludo,is wondering where the eff has mauri23 been 

0,2208220125,Wed Jun 17 08:55:49 PDT 2009,NO_QUERY,a_b_cris,"relax-ing time is up,LOL just woke up,can i sleep again? "

0,2208220441,Wed Jun 17 08:55:51 PDT 2009,NO_QUERY,JessieWelsh,sad about not hiking today because of the rain 

0,2208220650,Wed Jun 17 08:55:52 PDT 2009,NO_QUERY,mshurtmeplz,Twitter doesn't want me to reply to people for some reason. 

0,2208220797,Wed Jun 17 08:55:52 PDT 2009,NO_QUERY,laylabear1,rain rain go away please  lm feeling the need for a hot holiday with my hot guy and kids  xx

0,2208220826,Wed Jun 17 08:55:53 PDT 2009,NO_QUERY,tobiasbuckell,@Rhiarti I fell asleep before the laptop did 

0,2208221036,Wed Jun 17 08:55:54 PDT 2009,NO_QUERY,roccoman,I won't be posting much for the next few days. I'll be hanging out with my cat sitter! 

0,2208221232,Wed Jun 17 08:55:54 PDT 2009,NO_QUERY,cyanotype,@missal You should!!!! I can't go.  Go for me.

0,2208221238,Wed Jun 17 08:55:54 PDT 2009,NO_QUERY,prIncessstYle,"i want my dog  NOW.... turquoise is just 2 great,i love it x.x XOXO"

0,2208221726,Wed Jun 17 08:55:57 PDT 2009,NO_QUERY,ericlafontaine,@JulieSco you seem to do that rather often! I miss you friend! 

0,2208222147,Wed Jun 17 08:55:58 PDT 2009,NO_QUERY,rountrjf,Too bad I paid 5 bucks for TwitterFon Pro 

0,2208222266,Wed Jun 17 08:55:59 PDT 2009,NO_QUERY,chelsea16_123,still HATES life very very veyr very much! Cannot wait to get away 

0,2208222466,Wed Jun 17 08:56:00 PDT 2009,NO_QUERY,lucaspimentel,"r @Rutilia usaba twhirl, ahora TweetDeck para separar por columnas (e.g. friends, work) y search. TweetDeck no soporta multiple accounts "

0,2208222482,Wed Jun 17 08:56:00 PDT 2009,NO_QUERY,lisachaves,@denisecua But its too much for accessories. I die every time I approach the rack of bangles and rings 

0,2208223137,Wed Jun 17 08:56:03 PDT 2009,NO_QUERY,SayraOatcakes,@McAleavy @s_b_g It's my Boss's wedding tomorrow...if I'm not on  top of my game he'll probably defenestrate me... 

0,2208223398,Wed Jun 17 08:56:04 PDT 2009,NO_QUERY,jrstanley,@BrydieW I miss maddie  she was really cool. Looks like the new people are quite awesome tho' =]

0,2208223477,Wed Jun 17 08:56:04 PDT 2009,NO_QUERY,aimecharmante,No longer on storm watch 

0,2208223594,Wed Jun 17 08:56:05 PDT 2009,NO_QUERY,salesrecruiter,@juliaerickson take your salary/12 - lose that every month you are unemployeed and become less employ-able. Sad. 

0,2208224185,Wed Jun 17 08:56:08 PDT 2009,NO_QUERY,jax1161,"@joesephjonas Bought it tues,  day after we saw ur amazing wembley show ! Loved it guys, wanna c u again but tickets already sold out "

0,2208224245,Wed Jun 17 08:56:08 PDT 2009,NO_QUERY,CiggyButtz,thanks twitter friends for making Amanda feel all warm and fuzzy! Now we must work 

0,2208224630,Wed Jun 17 08:56:09 PDT 2009,NO_QUERY,lowcadence,7 seconds now.  Don't see Hincapie anywhere near the front. 

0,2208224775,Wed Jun 17 08:56:10 PDT 2009,NO_QUERY,pinedaferet,Dropped my Treo adjustg mic earlier.REALLY!Brokn!Borrwg laptp 2say: Show up Dutch Tweeps. Help buy new 1 @lunch so I cn kp twtg #140conf 

0,2208225319,Wed Jun 17 08:56:13 PDT 2009,NO_QUERY,AugInBethany,The helper monster got stolen out of my backyard  

0,2208225410,Wed Jun 17 08:56:13 PDT 2009,NO_QUERY,purpleandgold,@tiffychua The registration is over already?!?!?!? That sucks 

0,2208225737,Wed Jun 17 08:56:15 PDT 2009,NO_QUERY,Jimmers31,@hansy_k I just went!! But the lineup is long and I have a meeting at 12  lol

0,2208225824,Wed Jun 17 08:56:15 PDT 2009,NO_QUERY,Dovebyrd,"Stomach turning - BP up - epidural starting in 1 min. - IV in. AcK! Needle going into spine.  Send LIGHT, healing, peace please. Gratze!i"

0,2208226034,Wed Jun 17 08:56:16 PDT 2009,NO_QUERY,FGasperini,Gotta to 2 work!!! Dammit 

0,2208226592,Wed Jun 17 08:56:18 PDT 2009,NO_QUERY,Angelbstar,@iKieran yw  aww thanx  *hugs* feels liek we wont b havin much of a summer by the look of the weather these days  lol xxx

0,2208226843,Wed Jun 17 08:56:19 PDT 2009,NO_QUERY,MadisonApril,Does anyone have an extra AT&amp;T cell phone I can have/borrow please??  This is frustrating me!! baaahh.

0,2208226922,Wed Jun 17 08:56:20 PDT 2009,NO_QUERY,itselizabeeeth,Last lunch with noora 

0,2208227122,Wed Jun 17 08:56:21 PDT 2009,NO_QUERY,MadamSalami,"@sprinkles_  taking a break or I might scream, Ninja says its good but I think its a mess! "

0,2208227299,Wed Jun 17 08:56:21 PDT 2009,NO_QUERY,clazluvsdolphin,camcorder is being mean  won't record sound onto comp 

0,2208227546,Wed Jun 17 08:56:22 PDT 2009,NO_QUERY,nathanangelo,"I've always been a fan of thunder storms, until the thunder sent a loud crash through my headset while recording vocals for the ballad. "

0,2208227694,Wed Jun 17 08:56:23 PDT 2009,NO_QUERY,emmy_563,just ate... yummy... but a discusion again! - why they don't understand me?! It'S so bad and I feel terrible 

0,2208227800,Wed Jun 17 08:56:23 PDT 2009,NO_QUERY,avaccaro90,"I've started reading about 12 books this summer and can't get into any of them, even ones that I love. "

0,2208228335,Wed Jun 17 08:56:26 PDT 2009,NO_QUERY,mandaril,"@psynister I dunno... and I can't check armory, as I logged out in my dps/pvp gear "

0,2208228570,Wed Jun 17 08:56:27 PDT 2009,NO_QUERY,IfaTheOnlyOne,"movie marathon with mum  no one at home, dad flied to Vietnam alrd, howw saddd "

0,2208229190,Wed Jun 17 08:56:30 PDT 2009,NO_QUERY,dianehapke,Got half of my daughters Lyme test results back. It's looking like a positive showing  #squarespace );

0,2208229327,Wed Jun 17 08:56:30 PDT 2009,NO_QUERY,shawnasstoller,@stacey79 yeah they so dont get that they have..ummm larger size women as fans...lol the t shirts are just as bad. 

0,2208229350,Wed Jun 17 08:56:30 PDT 2009,NO_QUERY,dclevitt,Had to shave off the beard last night...Realized I had shaved too much off one side and it was irritating the piss out of me 

0,2208229724,Wed Jun 17 08:56:32 PDT 2009,NO_QUERY,LiddoC,"Strike 2. I am the worst alarm clock ever.. Why do others tell me my alarm went off, turn it off for me, but choose to not wake me up? "

0,2208229868,Wed Jun 17 08:56:33 PDT 2009,NO_QUERY,taybaby0611,Im starting to think we wont stay the whole summer.... 

0,2208229915,Wed Jun 17 08:56:33 PDT 2009,NO_QUERY,laura_barnard,@TehDonDitty I know.  I was going to wait for it to break everyone else's phones first then install it later but I cannot wait! Must have!

0,2208230005,Wed Jun 17 08:56:33 PDT 2009,NO_QUERY,itsal_hbk,#haveyouever stood up ur blind date because he is so cute and u r not - i have   felt guilty..still

0,2208230187,Wed Jun 17 08:56:34 PDT 2009,NO_QUERY,caitlyndelaney,No iPhone update  now I'm at work. It's gloomy outside.. I just wanted to snuggle in bed all day.

0,2208230208,Wed Jun 17 08:56:34 PDT 2009,NO_QUERY,ChelsHammond,Cant wait for Monday! Boxing again! Its been way to long 

0,2208230470,Wed Jun 17 08:56:35 PDT 2009,NO_QUERY,jhosyaja,"goodnight tweeps! huaa i'm sick  sorry late for reply and follow back your twitter ya, so tomorrow maybe ahaha going to off byeee"

0,2208230629,Wed Jun 17 08:56:36 PDT 2009,NO_QUERY,ByAnyMeans15,I dont get this 

0,2208230780,Wed Jun 17 08:56:37 PDT 2009,NO_QUERY,ginabanana,i stayed up for an hour just to talk to u.. can't believe that i only got to talk to u for thirty secs.. 

0,2208231379,Wed Jun 17 08:56:39 PDT 2009,NO_QUERY,July_babie,Feeling blue.... maybe its the rain... 

0,2208245073,Wed Jun 17 08:57:41 PDT 2009,NO_QUERY,LadiesSaladRan,"Aaaargh, sod you Megavideo! I have NOT watched 72 minutes of video! Liar liar pants on fire! "

0,2208245149,Wed Jun 17 08:57:42 PDT 2009,NO_QUERY,abcaryndef,@heyaimeee I honestly don't have it. 

0,2208245613,Wed Jun 17 08:57:44 PDT 2009,NO_QUERY,loupepper,I have become my mother - I just packed teabags for a weekend in NY 

0,2208245665,Wed Jun 17 08:57:44 PDT 2009,NO_QUERY,OshiHidra,"@misadesu PNC Bank Arts Center? Been there for a Rush show, Lawn seats are iffy, I had a pillar blocking my view of Geddy Lee "

0,2208246402,Wed Jun 17 08:57:47 PDT 2009,NO_QUERY,Gooshty,school atm consists of registration and going to pe  Seems like a waste of my precious time but it's not like a have anythin better to do 

0,2208246743,Wed Jun 17 08:57:49 PDT 2009,NO_QUERY,jenfamous,Well I'm thinking if taking off my bse on my iPhone. The top right is peeling off and the bottom by the port is peeling too  should I??

0,2208247319,Wed Jun 17 08:57:52 PDT 2009,NO_QUERY,KHRISKORN,I wish i was going to the Lakers parade! But i cant  Ill watch it on TV

0,2208247671,Wed Jun 17 08:57:53 PDT 2009,NO_QUERY,PeskyJay,@Stargate_Addict  Waves madly at you as well. I have to go cook dinner soon  

0,2208247698,Wed Jun 17 08:57:53 PDT 2009,NO_QUERY,smont,@paulclark72 I love the mgmt album soooooo much... you still not coming tomorrow night? 

0,2208247788,Wed Jun 17 08:57:54 PDT 2009,NO_QUERY,itsjuliobitch,Tennis was fun... I'll miss my Gay coach during the summer break  now at the hair salon ;) kiss

0,2208247891,Wed Jun 17 08:57:54 PDT 2009,NO_QUERY,Thesixxteens,"@lashlady Nicola, that is something i have always wondered and will porbally continue to be one of lifes unanswerable questions "

0,2208248240,Wed Jun 17 08:57:56 PDT 2009,NO_QUERY,anibunny,@JohnFinn Awww.    I have one follower who seems to like to DM me a lot.

0,2208248321,Wed Jun 17 08:57:56 PDT 2009,NO_QUERY,TiaBenjamin,"I toured ancient rome today and saw some of the most beauitiful places in the world...but I miss home....and by home, I mean AMIN "

0,2208248351,Wed Jun 17 08:57:56 PDT 2009,NO_QUERY,tfsr,"@amarus I like the brown and highlights, though. I guess I'm just picturing, like, Carrot Top when he says ginger. "

0,2208248478,Wed Jun 17 08:57:57 PDT 2009,NO_QUERY,WineWonkette,"@jpippert Had planned to, but if this migraine doesn't go away, I shall not be going  You?"

0,2208248526,Wed Jun 17 08:57:57 PDT 2009,NO_QUERY,dsadeghi88,I hate the doctors 

0,2208249016,Wed Jun 17 08:57:59 PDT 2009,NO_QUERY,causeimrossome,@ktnunna I'm dead weight??? 

0,2208249188,Wed Jun 17 08:58:00 PDT 2009,NO_QUERY,Amanda_Denise,My eyes are itchy!!! 

0,2208249196,Wed Jun 17 08:58:00 PDT 2009,NO_QUERY,KJGregson,"Starting my day listening to Tape 101 webcast   So wish I was at the Social Media Marketing Summit in NY, it seems far more interesting"

0,2208249319,Wed Jun 17 08:58:01 PDT 2009,NO_QUERY,time2stand,"@shafto59 Damn, now I want a cup of tea and jaffa cakes "

0,2208249473,Wed Jun 17 08:58:01 PDT 2009,NO_QUERY,justemm,had a really bad anxiety attack today 

0,2208249475,Wed Jun 17 08:58:01 PDT 2009,NO_QUERY,LONGAIR_,"Leave for Philidelphia tomorow night/ friday morning! So excited, Hate long haul flights though "

0,2208249557,Wed Jun 17 08:58:02 PDT 2009,NO_QUERY,JonNinham,Updated iTunes this morn &amp; macbook stopped recognising iPhone! Took a lot of clearing to fix. Glad I know abiut ROOT and shell commands. 

0,2208250026,Wed Jun 17 08:58:04 PDT 2009,NO_QUERY,curlykew,"@flygirljules23 Well, we are considering looking at other providers.  Prob is, we're under contract with t-mobile right now.  "

0,2208250320,Wed Jun 17 08:58:05 PDT 2009,NO_QUERY,mizcosb2u,@MissAmazin no sunny Carolina skies here  I'm sad bc we were supposed to meet a friend for a playdate

0,2208250435,Wed Jun 17 08:58:06 PDT 2009,NO_QUERY,themaincourse,"@meaganirene im glad your safe, and i hope you figure it out, looks like a bitch  hows life besides that?"

0,2208250573,Wed Jun 17 08:58:06 PDT 2009,NO_QUERY,bracismeis,@brybryy I don't.  no time!

0,2208250948,Wed Jun 17 08:58:08 PDT 2009,NO_QUERY,krismajew,@GillyCoop what about meeeeeeee!?? 

0,2208251395,Wed Jun 17 08:58:10 PDT 2009,NO_QUERY,NicoleKristen7,"@Tripledee84 Hey Bella, this is my new account. I hope you are feeling better  Sorry you missed Russell Peters."

0,2208251983,Wed Jun 17 08:58:13 PDT 2009,NO_QUERY,cloudsthename,@camillevdytan i know it's a really sad song. 

0,2208252054,Wed Jun 17 08:58:13 PDT 2009,NO_QUERY,CBMandly,The SAAB is dead!!!! 

0,2208252339,Wed Jun 17 08:58:14 PDT 2009,NO_QUERY,talesofsaku,I wish this feeling would go away  So bad that I'm stressing over things that isn't work or school

0,2208252511,Wed Jun 17 08:58:15 PDT 2009,NO_QUERY,dellibell,"has never used twitter before so any help in understanding would be much appreciated, nursing a hangover "

0,2208252897,Wed Jun 17 08:58:17 PDT 2009,NO_QUERY,Yuricastano1,Exploring contradictory normative states  . Off

0,2208252981,Wed Jun 17 08:58:17 PDT 2009,NO_QUERY,Oliviabenson09,Has a bangin headache..........Not Good 

0,2208253241,Wed Jun 17 08:58:18 PDT 2009,NO_QUERY,littlesunflower,"@Juicytots @joanna1979 @that_kat yes, I think it's fair to say the Shopkeeper is displeased   Ah well, another one for the memoirs!"

0,2208253350,Wed Jun 17 08:58:19 PDT 2009,NO_QUERY,jenniferumana,i dont want it to rain tomorrow 

0,2208254225,Wed Jun 17 08:58:22 PDT 2009,NO_QUERY,Angeltears12,Can't talk have to run physio 

0,2208254430,Wed Jun 17 08:58:23 PDT 2009,NO_QUERY,hotgymdiva,"BTW, I had a diet pepsi, not beer!! Guess what? Our flight has been delayed!!! "

0,2208254532,Wed Jun 17 08:58:24 PDT 2009,NO_QUERY,DaddyNewts,@Decibelia GEODUDE! Don't let him out in the rain - he'll turn into a Grimer 

0,2208254813,Wed Jun 17 08:58:25 PDT 2009,NO_QUERY,Katrinxi,@danielledeleasa Heeey did you come to London with JB? kept an eye out for you at wembley but couldnt see you  lyl X

0,2208254888,Wed Jun 17 08:58:25 PDT 2009,NO_QUERY,trickyxian,"Ow, my head.  "

0,2208255492,Wed Jun 17 08:58:28 PDT 2009,NO_QUERY,shriisall,coke can in car--&gt;90F--&gt;can burst--&gt;coke all over --&gt;procrastintd cleaning--&gt;thgt will evaporate--&gt;2 days later--&gt;turned syrupy--&gt; stinks 

0,2208255612,Wed Jun 17 08:58:29 PDT 2009,NO_QUERY,alvarocker,"what a hard week, I need a clone "

0,2208255791,Wed Jun 17 08:58:29 PDT 2009,NO_QUERY,sarah1328,having a rubbish day 

0,2208255923,Wed Jun 17 08:58:30 PDT 2009,NO_QUERY,chegrimandi,meh  granny dying 

0,2208255999,Wed Jun 17 08:58:30 PDT 2009,NO_QUERY,leighvargo,rainy day go away 

