0,2209940359,Wed Jun 17 10:58:54 PDT 2009,NO_QUERY,mobylee,Not going to the movies 

0,2209940641,Wed Jun 17 10:58:55 PDT 2009,NO_QUERY,Rachhhhx,"@Jonasbrothers haha, i was just talking about u.  And i can't i live in UK. have a great time there. anyways x"

0,2209940985,Wed Jun 17 10:58:57 PDT 2009,NO_QUERY,lisacat,"@PRsarahevans Yes, losing an iPhone is crummy  In the past I've found the warranty to be generous for wear/tear. 3 replaced in 2 yrs."

0,2209941014,Wed Jun 17 10:58:57 PDT 2009,NO_QUERY,RichieeKrausee,NO INTERNET  / i love marissa so much!

0,2209941237,Wed Jun 17 10:58:58 PDT 2009,NO_QUERY,SassySara81,"@Lilmissweetlips Ahh well enjoy hun, we got a mass sort out of stuff this weekend  had a mini 1, now its the biggun !!"

0,2209941386,Wed Jun 17 10:58:59 PDT 2009,NO_QUERY,freddielee,@andeejohnson what!!?? i thought you left monday.  

0,2209941688,Wed Jun 17 10:59:00 PDT 2009,NO_QUERY,chrisaltdelete,3.0 downloaded &amp; installed. now what?! i still want the new phone 

0,2209941753,Wed Jun 17 10:59:00 PDT 2009,NO_QUERY,jkhewett,My feet hurt   But I am looking forward to a nice pasta dinner and a glass of wine out in my garden 

0,2209941954,Wed Jun 17 10:59:01 PDT 2009,NO_QUERY,MiniMeLucy,god damn it everyone i care about seems to be leaving me behiind am 16 and goin to be all alone apart frm the bf 

0,2209941956,Wed Jun 17 10:59:01 PDT 2009,NO_QUERY,andreaexmarie,@talksquid My Dad's brother died.  Come cuddle me.

0,2209942100,Wed Jun 17 10:59:02 PDT 2009,NO_QUERY,kdr76,WHY THE HELL AM I RETAINING WATER TODAY?!?!?!?  

0,2209942112,Wed Jun 17 10:59:02 PDT 2009,NO_QUERY,WilliamJOWade,have hurt my lower back and am now house bound  However visiting the doctor tomorrow for help!!!!

0,2209942325,Wed Jun 17 10:59:03 PDT 2009,NO_QUERY,KEKateyElliott,my dress has gone 

0,2209943019,Wed Jun 17 10:59:06 PDT 2009,NO_QUERY,bsimms,@kateearl why didn't &quot;only in dreams&quot; make the EP ?  

0,2209943073,Wed Jun 17 10:59:06 PDT 2009,NO_QUERY,curly1396,this day needs to be over now. or it needs to be 5:30 central time STAT. nothing is going my way today 

0,2209943156,Wed Jun 17 10:59:06 PDT 2009,NO_QUERY,Nyreeee,Damn im bored!! Text me mun peeps. I have a serious lack of internet. 

0,2209943518,Wed Jun 17 10:59:08 PDT 2009,NO_QUERY,sarahnd,@mmla40 don't work too hard and u shouldn't be working that late 

0,2209943629,Wed Jun 17 10:59:09 PDT 2009,NO_QUERY,Jackbruva,My xbox got teh red lites of doom!!!!! Omg I want to die 

0,2209943689,Wed Jun 17 10:59:09 PDT 2009,NO_QUERY,MegMarra,@kkkkkkdddddd me neither. 

0,2209944072,Wed Jun 17 10:59:10 PDT 2009,NO_QUERY,amysav83,right... i need to go 

0,2209944414,Wed Jun 17 10:59:12 PDT 2009,NO_QUERY,Bradds056,Damn can't get ipod 3.0 softwere yet need to wait till tomorrow 

0,2209945146,Wed Jun 17 10:59:15 PDT 2009,NO_QUERY,almmmak,...i wish i lived in Texas 

0,2209945154,Wed Jun 17 10:59:15 PDT 2009,NO_QUERY,Chestyroo,I NEED MY BLACKERRY BOLD BITCH! AHHHH  i hate my sonywalkmanphonegay

0,2209945218,Wed Jun 17 10:59:15 PDT 2009,NO_QUERY,sermoa,@littlebluefish: I'm coming home now sweetie! All my strings done for tonight; more left to do tomorrow 

0,2209945264,Wed Jun 17 10:59:16 PDT 2009,NO_QUERY,sasa_21,I hope Clare and Katie are up for the pub...been nearly a week 

0,2209945289,Wed Jun 17 10:59:16 PDT 2009,NO_QUERY,WillStrohl,"Once you go to PE, it doesn't sound like you'd want to stop the subscription. A message gets displayed on your site.  #dnnpe"

0,2209945343,Wed Jun 17 10:59:16 PDT 2009,NO_QUERY,KatieLynnFoster,Pasor Jamie just pointed out a hair in my chipotle..I want to puke! 

0,2209945499,Wed Jun 17 10:59:17 PDT 2009,NO_QUERY,MicheleMullen,@nevaith It's already over 

0,2209945818,Wed Jun 17 10:59:18 PDT 2009,NO_QUERY,astgermain,@enormus Thanks! It was really bad...and everyone is hoping that he makes it through it but chances are highly unlikely 

0,2209946093,Wed Jun 17 10:59:19 PDT 2009,NO_QUERY,walrusoct9,why are all these Twitter people taunting me telling me about Eddie Vedder tickets?  Ugh...want to go. 

0,2209946204,Wed Jun 17 10:59:20 PDT 2009,NO_QUERY,tritressatops,@Jonasbrothers I wish I lived in Texas! 

0,2209946742,Wed Jun 17 10:59:22 PDT 2009,NO_QUERY,daaaanii,"Gotta do some school work now, eventhough I don't want to, but I have to "

0,2209947380,Wed Jun 17 10:59:25 PDT 2009,NO_QUERY,Neil_F,"@andygriffwozere STEPs Monday and AEA Wednesday, its just dawned on me how close they actually are "

0,2209947417,Wed Jun 17 10:59:25 PDT 2009,NO_QUERY,sharmichelle,Watching the parade from home  But Loving all the highlights from the season! I LOVE THE LAKERS!!!!!!!!!!!!!!!!!!!!!!!xoxoxoxoxoxoxoxoxoxo

0,2209947543,Wed Jun 17 10:59:26 PDT 2009,NO_QUERY,MichaelTao,@MissJennyYang text sent... but you didn't like what i wrote.. sorry never again 

0,2209947640,Wed Jun 17 10:59:28 PDT 2009,NO_QUERY,lainelaine88,@cem120 @rylee429 Ahhh!! It's downloading but it says it's gonna take 45 minutes! 

0,2209948258,Wed Jun 17 10:59:29 PDT 2009,NO_QUERY,edsaxman,Uhmmm #squarespace I need an iPhone please &amp; #trackle I could also use your help! Please help!! My wife won't let me buy one 

0,2209948452,Wed Jun 17 10:59:30 PDT 2009,NO_QUERY,thekach,Still up. This is bad. 

0,2209964702,Wed Jun 17 11:00:35 PDT 2009,NO_QUERY,gabehabe,"@imbirdgirl can I have some? I've got a crappy pie and 2 waffles, I can't be arsed to do anything "

0,2209964734,Wed Jun 17 11:00:36 PDT 2009,NO_QUERY,PornStoreClerk,"At this particular moment in time, &quot;Piano Man&quot; is the worst song I have ever heard, ever. It also happens to be on the radio in the back. "

0,2209965126,Wed Jun 17 11:00:37 PDT 2009,NO_QUERY,Mhae92,@peace_love_rosa yes i did 

0,2209965757,Wed Jun 17 11:00:40 PDT 2009,NO_QUERY,LeDids,Tweetdeck for iPhone is super cool but crashes a lot 

0,2209965793,Wed Jun 17 11:00:40 PDT 2009,NO_QUERY,angelab_log,"at work, left my phone at home "

0,2209965882,Wed Jun 17 11:00:40 PDT 2009,NO_QUERY,Sulieka,So bored...nothing good on the telly and I don't have any good books to read because I've read them all...and so not in the mood to study 

0,2209965896,Wed Jun 17 11:00:40 PDT 2009,NO_QUERY,Kimberlyjb,got the day off and I'm researching placements for next year's internship! Also trying to put up a new pic.. not working too well 

0,2209966082,Wed Jun 17 11:00:41 PDT 2009,NO_QUERY,bellaumbrella,not allowed to have anyone over today  but at least i get to go to dance classes today.. i'm a little nervous but excited. eating lunch

0,2209966174,Wed Jun 17 11:00:41 PDT 2009,NO_QUERY,KatiePoulton,@GingerAndProud whatt? why cant you do it 

0,2209966573,Wed Jun 17 11:00:43 PDT 2009,NO_QUERY,lizless,"@dave_potts OSU just discontinued it here, they couldn't get it to catch on. "

0,2209966686,Wed Jun 17 11:00:43 PDT 2009,NO_QUERY,aliciastacy3522,Sucks that I only get to see Tristan in the evenings when my Dad is home. 

0,2209966830,Wed Jun 17 11:00:44 PDT 2009,NO_QUERY,kaylacelina,"@Jonasbrothers awww man, wish I lived in dallas  even if I drove now,I wouldn't get there on time "

0,2209966832,Wed Jun 17 11:00:44 PDT 2009,NO_QUERY,teebin,"Dont stand in line behind me at the iTunes store, tried and filed 4x to get 3.0 "

0,2209967051,Wed Jun 17 11:00:45 PDT 2009,NO_QUERY,ChrisHangsleben,How in the hell did I end up following someone with the word &quot;mistress&quot; in their screen name? #followFAIL 

0,2209968259,Wed Jun 17 11:00:49 PDT 2009,NO_QUERY,_sammm,@TeamCyrus maybe because of nick. i dunno  miley's not following @taylorswift13 anymore either

0,2209968620,Wed Jun 17 11:00:51 PDT 2009,NO_QUERY,BigFatKaz,@tonykenobi i was in keyboard short cuts but can't find it 

0,2209968624,Wed Jun 17 11:00:51 PDT 2009,NO_QUERY,livlab,I am really enjoying the content but not the presentation 

0,2209968889,Wed Jun 17 11:00:52 PDT 2009,NO_QUERY,eryn_elizabethh,Some old guy just tried hitting on Kaylee and I 

0,2209968913,Wed Jun 17 11:00:52 PDT 2009,NO_QUERY,kaitididwhat,@Deanna64 omg ! i wish i lived there .. thats so sad 

0,2209969504,Wed Jun 17 11:00:54 PDT 2009,NO_QUERY,Earniece,Is at Mimi's and its been so long all the techs almost didn't know who I was.  I told them its a recession :-\ Real Talk

0,2209969532,Wed Jun 17 11:00:54 PDT 2009,NO_QUERY,carolinehiggins,"@mvanduyne i wish i could go but im in omaha, NE "

0,2209969620,Wed Jun 17 11:00:55 PDT 2009,NO_QUERY,reii_,Now everyone is talking about #iPhone.. When will I get mine? 

0,2209969662,Wed Jun 17 11:00:55 PDT 2009,NO_QUERY,MacBeezle,Damn... gf just called me on my iPhone during initial 3.0 backup. Now starting over again 

0,2209969936,Wed Jun 17 11:00:56 PDT 2009,NO_QUERY,mono_poly,F*CK tried my reverb today it doesn't work 

0,2209970022,Wed Jun 17 11:00:56 PDT 2009,NO_QUERY,char_justine,"@bmofoto You know your site is down, right? "

0,2209970134,Wed Jun 17 11:00:57 PDT 2009,NO_QUERY,barabino18,Wants to go home.... I miss darien 

0,2209970735,Wed Jun 17 11:00:59 PDT 2009,NO_QUERY,Arantza92,@systemchildren ohhh! that's bad 

0,2209970997,Wed Jun 17 11:01:00 PDT 2009,NO_QUERY,jamesheart24,http://twitpic.com/7mxkv - I stuck my wet finger in the toaster!  owwy owwy owwy

0,2209971039,Wed Jun 17 11:01:00 PDT 2009,NO_QUERY,srxtclay,@lauradoeslaura but that fell thru like a motherfucker...so funds for three days of loll just doesn't see. To be in the cards. 

0,2209971169,Wed Jun 17 11:01:01 PDT 2009,NO_QUERY,PokerPlayer323,I didn't sleep last night at all..now i'm really tired but have to stay up  a little bit more to watch the Lakers parade. 

0,2209971414,Wed Jun 17 11:01:02 PDT 2009,NO_QUERY,atroquininium,"@brianovi I don't like the kanji for modesty.  Also, I want to go to Cheeburger with you. "

0,2209971424,Wed Jun 17 11:01:02 PDT 2009,NO_QUERY,VeniVendetta,@respekfresh im not on my sidekick its dead  did u got to the youtube i sent u?

0,2209971534,Wed Jun 17 11:01:02 PDT 2009,NO_QUERY,camiigonzalez,@Jonasbrothers    i wanna hug Joe right now....(hugs Joe)

0,2209971609,Wed Jun 17 11:01:03 PDT 2009,NO_QUERY,DonnieMossberg,@JeffTheGirl yo i'm madd late! lol talkin bout can you get a beat! you already know you can! you done forgot about me and all that 

0,2209971676,Wed Jun 17 11:01:03 PDT 2009,NO_QUERY,SchoolDuggery,"@spanishsam they are grammatically interchangeable. I always use learned, though this says that's an Americanism  http://is.gd/14C5t"

0,2209971746,Wed Jun 17 11:01:03 PDT 2009,NO_QUERY,3nalicious,@BlueSpirit3 Hewitt unseeded 

0,2209971836,Wed Jun 17 11:01:04 PDT 2009,NO_QUERY,joeloverton,@parboo Oh damn. I had this idea the other day. Is there a single twitter app that hasn't already been done? 

0,2209972072,Wed Jun 17 11:01:05 PDT 2009,NO_QUERY,KyleHance,I think my dog might have worms 

0,2209972417,Wed Jun 17 11:01:06 PDT 2009,NO_QUERY,jbrockinvix,"@Jonasbrothers that's awesome! i wish i could be there, but i live in New Jersey, not Texas. "

0,2209972443,Wed Jun 17 11:01:06 PDT 2009,NO_QUERY,joleneeeee,is going to bed at 2am againnnnn!  Me wants to sleep early!

0,2209972462,Wed Jun 17 11:01:06 PDT 2009,NO_QUERY,ms_cedes,On my way to work 

0,2209972524,Wed Jun 17 11:01:06 PDT 2009,NO_QUERY,NattNatt81,Made way too much tea not used to cooking for 1  Off to Britney now though see you later ))))

0,2209972575,Wed Jun 17 11:01:06 PDT 2009,NO_QUERY,thepjmorton,Only wack thing is getting a new license 

0,2209972812,Wed Jun 17 11:01:07 PDT 2009,NO_QUERY,iwant2believe,@imthepilot hahah dude the titanic one is horrible lol what happen ur not on messenger 

0,2209972943,Wed Jun 17 11:01:08 PDT 2009,NO_QUERY,biancacerise,@Austinp3 me too 

0,2209973209,Wed Jun 17 11:01:09 PDT 2009,NO_QUERY,kbimmz,OMG!!! @MPaintal and @ptserkonis I just read about some brit who came up with an idea to dispense flip flops from a vending machine!!!! 

0,2209973220,Wed Jun 17 11:01:09 PDT 2009,NO_QUERY,TamaraDTaylor,"Lucky to be in love with my best friend.... Ugh, unfortunetly its not mutual  &lt;3 B~ Thanks jason mraz for killing my good mood asshole"

0,2209973352,Wed Jun 17 11:01:10 PDT 2009,NO_QUERY,ktbenson,is packing up her room! 

0,2209973921,Wed Jun 17 11:01:12 PDT 2009,NO_QUERY,maryrivss,@desireeapril no cause then they make you clean it with dish detergent.  ahahaha

0,2209974045,Wed Jun 17 11:01:13 PDT 2009,NO_QUERY,Connor10,Tons of problems downloading os 3.0  had to restore iphone hopefully i didnt loose anything.

0,2209974131,Wed Jun 17 11:01:13 PDT 2009,NO_QUERY,MattGillian,@mellow_D don't even trip...I got 'em both : just shattered the iphone face 

0,2209974146,Wed Jun 17 11:01:13 PDT 2009,NO_QUERY,HeatherBabiii,my stomach hurts.   lol

0,2209974178,Wed Jun 17 11:01:13 PDT 2009,NO_QUERY,whit3b0i,Apple has just put a hold on delivery of my new iPhone 3GS. WHYYYYYYYY????????????  #iPhone #Apple

0,2209974207,Wed Jun 17 11:01:14 PDT 2009,NO_QUERY,liviutudor,@io_me No it hasn't-and companies don't understand yet that banner advertising on mobile is for brand awareness only not conversions 

0,2209974284,Wed Jun 17 11:01:14 PDT 2009,NO_QUERY,DinaPietrantoni,clearing things out of my room     1 more week till the big move

0,2209974463,Wed Jun 17 11:01:15 PDT 2009,NO_QUERY,MartijnSnels,I'm disappointed in iPhone OS 3.0!  I expected much more fun after using the GM seed.

0,2209974866,Wed Jun 17 11:01:16 PDT 2009,NO_QUERY,ilovetwilightxo,MSN keeps on crashingggggggg 

0,2209975519,Wed Jun 17 11:01:20 PDT 2009,NO_QUERY,lnzsho,i jus now realizd the majority of my clothes r missn. wth! 

0,2209975548,Wed Jun 17 11:01:20 PDT 2009,NO_QUERY,davidplexco,@jen004 Sorry you got an angry comment on your blog. 

0,2209975845,Wed Jun 17 11:01:21 PDT 2009,NO_QUERY,davidtreynolds,@jmons my mms don't work yet 

0,2209975968,Wed Jun 17 11:01:22 PDT 2009,NO_QUERY,cooperla,Annoyed with everything  wish something good would happen. Please? #squarespace

0,2209976428,Wed Jun 17 11:01:24 PDT 2009,NO_QUERY,kpolice,I got the #iphone 3.0 update but I won't have my phone until friday 

0,2209976642,Wed Jun 17 11:01:25 PDT 2009,NO_QUERY,grant04,"@Tiffanyco22 I'm sry boo     honest mistake, I got u later @ ........  ;)"

0,2209976699,Wed Jun 17 11:01:25 PDT 2009,NO_QUERY,emjonaslover,@Jonasbrothers omj i wish i lived there  (i was the first person in my town to get your cd!) its amazing btw! 

0,2209977064,Wed Jun 17 11:01:26 PDT 2009,NO_QUERY,astar33,Ok I just heard Bebe and Cece using Autotune on their new gospel song.. 

0,2209977189,Wed Jun 17 11:01:27 PDT 2009,NO_QUERY,ELLEohhELLExx,@Jonasbrothers too bad i'm not in texas yet 

0,2209977242,Wed Jun 17 11:01:27 PDT 2009,NO_QUERY,annelupi,@Jonasbrothers wish i could be there.... 

0,2209977481,Wed Jun 17 11:01:28 PDT 2009,NO_QUERY,DJMattyMan2k9,i so want an iphone but only if i had the money hmmm 

0,2209977514,Wed Jun 17 11:01:28 PDT 2009,NO_QUERY,Rosie21,"@jordanhowell excuse me sir, can i have some? "

0,2209977542,Wed Jun 17 11:01:28 PDT 2009,NO_QUERY,ladykyra,"I wish I could go see the Nashville Symphony do Brahms 2 on Friday, but I can't afford a hotel room. "

0,2209977909,Wed Jun 17 11:01:30 PDT 2009,NO_QUERY,childstar22,@Tony_Mandarich nope 

0,2209977974,Wed Jun 17 11:01:30 PDT 2009,NO_QUERY,arjunRockz,am having my GD and Interview 2mrw...am soo tensed up now 

0,2209978096,Wed Jun 17 11:01:30 PDT 2009,NO_QUERY,melissa_07,"@Jonasbrothers ohmy! Thats amazing, idt i have time to come from conroe to dallas in less than an hour. Dang it "

0,2210021557,Wed Jun 17 11:04:35 PDT 2009,NO_QUERY,LuvTwilight1632,i lost my lego batman game for my DS 

0,2210021580,Wed Jun 17 11:04:35 PDT 2009,NO_QUERY,bball12345,@Jonasbrothers How about to Rockwall? I have to work! 

0,2210021694,Wed Jun 17 11:04:35 PDT 2009,NO_QUERY,spookygirl,It's official NOTHING except the actual phone and TXT seem to be working on my #iphone  3.0 FAIL!

0,2210021723,Wed Jun 17 11:04:35 PDT 2009,NO_QUERY,yoimjo,not even finished my first lot of homework yet 

0,2210021796,Wed Jun 17 11:04:36 PDT 2009,NO_QUERY,sophiie92,eating dinner was harder than i thought it would be  

0,2210022027,Wed Jun 17 11:04:36 PDT 2009,NO_QUERY,Sophieeeeee_x,@FrankieTheSats hmmmm thats not good! what the matter?  xxxx

0,2210022044,Wed Jun 17 11:04:37 PDT 2009,NO_QUERY,florinanghel,"Can I get the new iPhone 3G S for Christmas? Oh, wait, I can't wait until then! "

0,2210022166,Wed Jun 17 11:04:37 PDT 2009,NO_QUERY,jijipunch,Saw the nice doc today - he thinks I may have asthma so has prescribed me an inhaler. Gah sucks! But I guess if it helps 

0,2210022325,Wed Jun 17 11:04:38 PDT 2009,NO_QUERY,LG_JB_Miley_fan,@Jonasbrothers wow! you guys are amazing! i wish i could go but i live in Canada 

0,2210022476,Wed Jun 17 11:04:38 PDT 2009,NO_QUERY,heidiptrc,@ambermhaynes what are you going to do in Tahoe? I guess 1 of my tweets was on mtv but I can't seem to find video of it 

0,2210022993,Wed Jun 17 11:04:41 PDT 2009,NO_QUERY,improv58,Prepping for another rehearsal.. No act..no money..just rehearsal 

0,2210023186,Wed Jun 17 11:04:41 PDT 2009,NO_QUERY,its_me_betty,"@permeister yeah I know, totally sucking at bowling today "

0,2210023522,Wed Jun 17 11:04:43 PDT 2009,NO_QUERY,DCult,No radio tonight!!!  had some real heavy weight bizal to lay down on ya ears too!! o well dees tings happen

0,2210024157,Wed Jun 17 11:04:47 PDT 2009,NO_QUERY,LevnUMesmerized,@Karboso .. OMG! It seems like I don't do anything else BUT WORK! Some ppl's work end @ 5 but I take mine HOME with me..  But it pays off!

0,2210024422,Wed Jun 17 11:04:47 PDT 2009,NO_QUERY,1045CHUMFM,"@TDOT_Blockette Hmm, good question... tomorrow morn. that's all they've told us. Sorry  - Fav"

0,2210024877,Wed Jun 17 11:04:49 PDT 2009,NO_QUERY,henryhenderson,got back from a walk on the beach. Taking a shower because a lot of sand got on me an in my hair 

0,2210024970,Wed Jun 17 11:04:49 PDT 2009,NO_QUERY,MJtheBossLady,"LBJ is a total loser, douchebag! Look at this douchebaggery! Must be a sore loser.  I used to respect him  http://bit.ly/mAyG4"

0,2210025348,Wed Jun 17 11:04:50 PDT 2009,NO_QUERY,Katie_Welch,ohhh noo... #iPhone has surpassed #IranElection -  thats upsetting.

0,2210025492,Wed Jun 17 11:04:51 PDT 2009,NO_QUERY,davidrayramos,Went home during lunch to gt the iPhone 3.0 update; was not available yet  Will have wait till 5:30 now

0,2210026951,Wed Jun 17 11:04:57 PDT 2009,NO_QUERY,LoveDevorne,@dyellagurl Ooooooooooooooooh Eybar was that last night lol 

0,2210027198,Wed Jun 17 11:04:58 PDT 2009,NO_QUERY,robinmwood,It's so wrong that I have to update my iTunes before I can get my iPhone update. 

0,2210027524,Wed Jun 17 11:05:00 PDT 2009,NO_QUERY,sillyPanicluvr,Gabe just told me his parents don't like me 

0,2210027627,Wed Jun 17 11:05:00 PDT 2009,NO_QUERY,MissyPereira,I went swimmin' to my friends house 'cause my pool isn't filled (  the water was green cause of the rain so we drained it ) BTW I had fun

0,2210027678,Wed Jun 17 11:05:00 PDT 2009,NO_QUERY,MeccaMoore,@MsBourgeoisie hmm... still waiting on my email. 

0,2210027940,Wed Jun 17 11:05:01 PDT 2009,NO_QUERY,itslucero,"@Jonasbrothers I would love to be in texas now, but I live in Argentina  Please come back guys you are the best (L) Love lvtt!"

0,2210028083,Wed Jun 17 11:05:02 PDT 2009,NO_QUERY,grum,Tweetdeck for the iPhone seems to be demolishing my API limits 

0,2210028132,Wed Jun 17 11:05:02 PDT 2009,NO_QUERY,CinderellaAsh,"@Sovidia Yez, sure sild. Still can't find them .. "

0,2210028133,Wed Jun 17 11:05:02 PDT 2009,NO_QUERY,WalkBoy,Don't tell me my tweets have stopped again 

0,2210028502,Wed Jun 17 11:05:04 PDT 2009,NO_QUERY,punkasskatie,"Feel like I'm getting sick  I hope not...time for Motrin, soup and a nap."

0,2210028604,Wed Jun 17 11:05:04 PDT 2009,NO_QUERY,logan72,i have to give in and go back to my job at toys r us. its time to make some money. probly only some 

0,2210028892,Wed Jun 17 11:05:05 PDT 2009,NO_QUERY,kokobano,"Tragically, this also means that I will not have easy access to all his comics and books. Also the PS. I was getting so good at Infamous. "

0,2210028967,Wed Jun 17 11:05:05 PDT 2009,NO_QUERY,gtirre1,Is gutted she can't go out tonight 

0,2210029055,Wed Jun 17 11:05:06 PDT 2009,NO_QUERY,sunshine_mafia,been told to take it easy and rest since i appear to have done some proper damage to myself up that mountain  ouch

0,2210029073,Wed Jun 17 11:05:06 PDT 2009,NO_QUERY,Luna07,@Paraldasfyre I'm sorry hun  I'm not going to ignore you - that's what we Equinockers are here for! Support and to be lent on xxxx

0,2210029144,Wed Jun 17 11:05:06 PDT 2009,NO_QUERY,guibooo,@DawnYang1 wisdom tooth removal is an even more painful process! I was on meds for a week 

0,2210029274,Wed Jun 17 11:05:07 PDT 2009,NO_QUERY,glitteryjessica,@paulineypies email my personal I miss your voice and face 

0,2210029325,Wed Jun 17 11:05:07 PDT 2009,NO_QUERY,CLOinfinity,@love_yourself nope nope i will not be working today not in a box and not with u (a fox) 

0,2210029365,Wed Jun 17 11:05:07 PDT 2009,NO_QUERY,troopshome,Not sure if anyone reads my stuff. Should read theirs. Paragraph 3. Second half of Pagagraph 4. Hu has the last word on financial. USA 

0,2210029506,Wed Jun 17 11:05:07 PDT 2009,NO_QUERY,KevinDoyle,@b33f4l0 I still don't qualify as mine was in December anyway  super double sucks!

0,2210029893,Wed Jun 17 11:05:09 PDT 2009,NO_QUERY,Emmacurtis,@Jonasbrothers i wish i could come but i don't think even a private jet would get me from the UK to texas in less than an hour! 

0,2210030292,Wed Jun 17 11:05:10 PDT 2009,NO_QUERY,ynnatirb,I need to stop waking up by 11 

0,2210030403,Wed Jun 17 11:05:11 PDT 2009,NO_QUERY,squaredeye,@priestap URL is no good 

0,2210030434,Wed Jun 17 11:05:11 PDT 2009,NO_QUERY,Ellelou_x,is not doin much at da moment  no-one seems to talk to me on msn  waa its raining  (what a supprise....) x

0,2210031038,Wed Jun 17 11:05:14 PDT 2009,NO_QUERY,vanessatorweihe,Got the new iPhone software....yessssss! Now I just need the new phone since mine can't send pictures 

0,2210031105,Wed Jun 17 11:05:14 PDT 2009,NO_QUERY,Kio_Redsen,"@Galley87 Awwr  that sucks. Mine has new strings and it sounds awful, need to wear them in some more."

0,2210031530,Wed Jun 17 11:05:16 PDT 2009,NO_QUERY,ophelie53,Tomorrow i go to work in proxi pfff it's so bad! I hate that! but i start at 9:00 and i finish at 17:30! 

0,2210032203,Wed Jun 17 11:05:18 PDT 2009,NO_QUERY,liezlrodriguez,being sick and at work is not fun 

0,2210032282,Wed Jun 17 11:05:18 PDT 2009,NO_QUERY,lindsayrevae,Forgot my lunch so I had to go to the store and get lunch and that took up half of my break  well back to work!!! Woo hoo :|

0,2210032736,Wed Jun 17 11:05:20 PDT 2009,NO_QUERY,LegalDown,@generalisation Can we upload this up on www.LegalDown &quot;Bulletproof-MG Piano Mix&quot; ? plz 

0,2210032931,Wed Jun 17 11:05:21 PDT 2009,NO_QUERY,luckystar37,@mrs_mcsupergirl I HAVE to keep myself interested cos I'm a magpie. &amp; you are SO not fail! I've been loosing the same 10 lbs every year 

0,2210032936,Wed Jun 17 11:05:21 PDT 2009,NO_QUERY,redvers,@Mooley  what had you planned to watch?

0,2210032971,Wed Jun 17 11:05:21 PDT 2009,NO_QUERY,plujan,found my new beautiful kitten in the backyard dead 

0,2210033001,Wed Jun 17 11:05:21 PDT 2009,NO_QUERY,JanelleIM,"STILL not on my PC. I miss my Karen (yes, the PC has a name, get over it). She's a best friend "

0,2210033210,Wed Jun 17 11:05:22 PDT 2009,NO_QUERY,TaraHaynes,what a lonnnng week and it's only wednesday   ....apps tonight @ crabbies with the girls

0,2210033449,Wed Jun 17 11:05:23 PDT 2009,NO_QUERY,duvien,"Annoying, something wrong with my internet connection. It's crawling like a snail... Let's hope it'll be fine tomorrow "

0,2210033659,Wed Jun 17 11:05:24 PDT 2009,NO_QUERY,rebelgrrrli,@alwayswyser GROSS!!!  Chicken bones in your soup.  Ewww. 

0,2210034566,Wed Jun 17 11:05:28 PDT 2009,NO_QUERY,analogy72,I tried to be careful and quiet coming in the other night. Instead I ran into a wall. 

0,2210034581,Wed Jun 17 11:05:28 PDT 2009,NO_QUERY,Ivanainc,Not so nice  crash during installing iPhone 3.0 wtf?

0,2210034719,Wed Jun 17 11:05:29 PDT 2009,NO_QUERY,sarahnd,@VictoriaPolice melbourne is becoming very violent &amp; I don't feel very safe anymore. What is happening to our beautiful city? 

0,2210034962,Wed Jun 17 11:05:30 PDT 2009,NO_QUERY,stephmariexoxo,nothing to do todaaaaaay 

0,2210035061,Wed Jun 17 11:05:30 PDT 2009,NO_QUERY,angie_onie,"@JessicaVickery no word on why, but I guess power was out to half of my town for about 4 hours Then when the power was up my net was down "

0,2210035197,Wed Jun 17 11:05:31 PDT 2009,NO_QUERY,rochtrev,@thorrad I heard is avail now. I'm at work w/ no iTunes so don't get it til tonite.   hope it's cool. you'll have to let me know

0,2210035388,Wed Jun 17 11:05:31 PDT 2009,NO_QUERY,FluffyFanoona,"@freshstate nah man the rain kinda ruined it  ahh well, it was fn anyway  and we wrapped the teachers presents, theyre so daym awesome!"

0,2210035756,Wed Jun 17 11:05:33 PDT 2009,NO_QUERY,EricDiepeveen,Need iPhone 3.0 jailbreak. Otherwise I can't make a phone-call with my American iPhone 2g. 

0,2210035927,Wed Jun 17 11:05:33 PDT 2009,NO_QUERY,mommyyacky,Gooooo lakers!! i wish i can go to the parade! 

0,2210036080,Wed Jun 17 11:05:34 PDT 2009,NO_QUERY,elyssaramos,Exit 0 no more 

