0,2207597064,Wed Jun 17 08:08:25 PDT 2009,NO_QUERY,jamieewilliams,having quick study session before a test  ....the guy beside me is jammin to rhianna's &quot;rehab&quot; Hahahaha.

0,2207597548,Wed Jun 17 08:08:27 PDT 2009,NO_QUERY,melsersluis,up early and cranky 

0,2207598861,Wed Jun 17 08:08:33 PDT 2009,NO_QUERY,_Emilyyy_,Txtin' friends! Mom and sis r fighting! 

0,2207599557,Wed Jun 17 08:08:36 PDT 2009,NO_QUERY,AbbieKirwan,Omg terrential rain...  Hope it brightens up for saturday!

0,2207600374,Wed Jun 17 08:08:40 PDT 2009,NO_QUERY,cherrieleong,"Bb was throwing tantrums today, wonder if it's due to itchy skin?? Btw, she took &gt; 1 hour crying to put to bed tonight "

0,2207600508,Wed Jun 17 08:08:41 PDT 2009,NO_QUERY,bernadetteolsen,@TraceyJ305 if only you were selling curling irons.. 

0,2207600804,Wed Jun 17 08:08:42 PDT 2009,NO_QUERY,mvo_darkwing,@jeromevill @raizarevilla: Haha. Still don't get it though...  HAHAHA. Slow ko ba.

0,2207601009,Wed Jun 17 08:08:43 PDT 2009,NO_QUERY,clarianne,@ronaji same  i brought my usb to work..im so tempted to download itunes on this computer! lol

0,2207601178,Wed Jun 17 08:08:44 PDT 2009,NO_QUERY,Shika3,@HONEYMATTHEWS i know right...spent everyday on the beach and the pool and now i'm peeling..but i still miss it  hehehe thanks!

0,2207601287,Wed Jun 17 08:08:44 PDT 2009,NO_QUERY,Danielle_Wales,Why does it have to rain sooooooooooo heavy? 

0,2207601400,Wed Jun 17 08:08:45 PDT 2009,NO_QUERY,AmandaMcQueen,"The first part of my day is spent doing English, the second part is spent doing psych HG &amp; D  dumb school."

0,2207601876,Wed Jun 17 08:08:47 PDT 2009,NO_QUERY,joeyanne,ARGH running out of power and can't see a plug outlet 

0,2207602052,Wed Jun 17 08:08:48 PDT 2009,NO_QUERY,joeyanne,ARGH running out of power and can't see a plug outlet 

0,2207602170,Wed Jun 17 08:08:48 PDT 2009,NO_QUERY,danielhadaway,@myrickstudios Ohhh. Well I haven't beat it like THAT. I just meant the adventure mode. I was feeling all good about myself for that. 

0,2207602331,Wed Jun 17 08:08:49 PDT 2009,NO_QUERY,ms_cedes,I have horrible nightmares when im really comfy in bed 

0,2207602540,Wed Jun 17 08:08:50 PDT 2009,NO_QUERY,South_Paw_Ent,"@DymondStilettos Mornin, I think we r part of ur family but ur not part of ours. "

0,2207603221,Wed Jun 17 08:08:53 PDT 2009,NO_QUERY,cliffmcc,"Playing with a DLink DWA-130 USB WiFi adapter on my MacPro. Works, but drivers panic at shutdown. "

0,2207604038,Wed Jun 17 08:08:57 PDT 2009,NO_QUERY,swalesrockstar,I think kelly is mad at me  and i haven't a clue as to what i have actually done.. she was the one being all weird with me

0,2207604229,Wed Jun 17 08:08:58 PDT 2009,NO_QUERY,wastethisnight,Finished the english exam. Now I have chem 

0,2207604353,Wed Jun 17 08:08:59 PDT 2009,NO_QUERY,matiemouse,@JessBushell Hope you are okay   Love you lots. xx

0,2207604615,Wed Jun 17 08:09:00 PDT 2009,NO_QUERY,oldergirlbeauty,"@Jaxthatgirl I'm sorry you feel so sucky, esp after such a kick ass weekend.  "

0,2207604628,Wed Jun 17 08:09:00 PDT 2009,NO_QUERY,antzpantz,@racheld83 I thought that movie was as vacuous as its premise! 

0,2207604647,Wed Jun 17 08:09:00 PDT 2009,NO_QUERY,cornnutsss,sick day  feeeling kinda shabby.

0,2207605000,Wed Jun 17 08:09:02 PDT 2009,NO_QUERY,hilaurenjohnson,@calebkdesign i couldn't actually go through with it  my boss asked me to stay and i'm moving in two months so i'll just deal til then =\

0,2207605067,Wed Jun 17 08:09:02 PDT 2009,NO_QUERY,subedei7,cat has gone missing 

0,2207605115,Wed Jun 17 08:09:02 PDT 2009,NO_QUERY,boabmatic,cant wait for the weekend ... DJin in Estonia with the Bunty..... not looking forward to the 6am flight on Friday though 

0,2207605541,Wed Jun 17 08:09:04 PDT 2009,NO_QUERY,eloranoeldannon,@beartwinsmom fast kickups are the bane of my existance; really hard; haven't yet been able to do them all the way through 

0,2207605723,Wed Jun 17 08:09:05 PDT 2009,NO_QUERY,londonthings,See he should give up the name...now I have londonthings 

0,2207606297,Wed Jun 17 08:09:07 PDT 2009,NO_QUERY,ErinGrapejuice,new backdoor installed yesterday. Looks great. Was trying to play SKATE the whole time and the work guys were making fun of me. 

0,2207606363,Wed Jun 17 08:09:08 PDT 2009,NO_QUERY,funtoread,i guess i'm the only one who hasn't bought Jonas Brothers new CD.. but don't have any money so what can i do? 

0,2207606941,Wed Jun 17 08:09:10 PDT 2009,NO_QUERY,starlace,@AD76 Sorry to hear that. 

0,2207607284,Wed Jun 17 08:09:12 PDT 2009,NO_QUERY,Bex_Smith,@WickedChessie omg i dont know anything. So i wrote as much as i should on a 20 mark essay :s. I dont think i will get a gd mark on that 

0,2207607328,Wed Jun 17 08:09:12 PDT 2009,NO_QUERY,keepyounear11,"I guess I have to face it -- the fact that in this economy, I'll never find a job...pfft. "

0,2207607333,Wed Jun 17 08:09:12 PDT 2009,NO_QUERY,fine_rabid_dog,I feel poorly 

0,2207607972,Wed Jun 17 08:09:15 PDT 2009,NO_QUERY,jessaminiaaaaaa,Friday (yn)  just has P.e and science   xx http://tinyurl.com/n5tzn8

0,2207608082,Wed Jun 17 08:09:16 PDT 2009,NO_QUERY,lillykaymusic,It's raining  after I was almost late this morning straightening my hair! Argh! Y meeeeeeeeeeee?

0,2207608395,Wed Jun 17 08:09:17 PDT 2009,NO_QUERY,TaTa3333,missin the @lakers championship parade. very very upset 

0,2207616578,Wed Jun 17 08:09:55 PDT 2009,NO_QUERY,shannyx3x,I have a really bad cold! 

0,2207617212,Wed Jun 17 08:09:58 PDT 2009,NO_QUERY,MiiSSGiiSELLE,"At school  to early. Math exam, wish me luck..  Ps Congrats to all graduates this year!"

0,2207617236,Wed Jun 17 08:09:58 PDT 2009,NO_QUERY,kriskendal,@youbeautyclare i'm so jealous 

0,2207617697,Wed Jun 17 08:10:01 PDT 2009,NO_QUERY,dN_redNests,My daughter got sent home sick from school today so even more I want be home NOW! ... but got a 5 hour journey first 

0,2207617854,Wed Jun 17 08:10:01 PDT 2009,NO_QUERY,LucyMcFly,maths exam tuesday 

0,2207617997,Wed Jun 17 08:10:02 PDT 2009,NO_QUERY,passi66,I am soooo laaaame today 

0,2207618470,Wed Jun 17 08:10:04 PDT 2009,NO_QUERY,Sue_Taylor,My ear hurts. 

0,2207618566,Wed Jun 17 08:10:04 PDT 2009,NO_QUERY,sierraxx,"@rockevans it's supposed to be available today, right? I went to update and couldn't. "

0,2207618592,Wed Jun 17 08:10:04 PDT 2009,NO_QUERY,adylla_,"Yeah Villa, how on earth did you miss that? "

0,2207618634,Wed Jun 17 08:10:04 PDT 2009,NO_QUERY,widyatarina,@cinta91 aww I miss you too chaaa   *hugs*

0,2207618922,Wed Jun 17 08:10:05 PDT 2009,NO_QUERY,pleasefindthis,@xtreasurex  &lt;3

0,2207619258,Wed Jun 17 08:10:07 PDT 2009,NO_QUERY,shiningcher,@Luv_Fashion nooo  what it said? my tweets arent color coded...smh...lol

0,2207619279,Wed Jun 17 08:10:07 PDT 2009,NO_QUERY,nunu_boujuah,mad at my babymomma @justvonecia ...she was cheatin on me last nite!!! 

0,2207619690,Wed Jun 17 08:10:09 PDT 2009,NO_QUERY,RobertShippey,"Is iPhone 3.0 out yet? If so, how come I cant get it yet "

0,2207620423,Wed Jun 17 08:10:12 PDT 2009,NO_QUERY,takemeback,"also, fml, i forgot to do @travelchannel trivia yesterday. THERE GOES THE FREE CRUISE I WAS PLANNING TO WIN. "

0,2207621640,Wed Jun 17 08:10:17 PDT 2009,NO_QUERY,gisuck,You know you are a geek when you thought the highlight of the video started at 2:15 http://digg.com/d1tsVp ... someone help me! 

0,2207622276,Wed Jun 17 08:10:20 PDT 2009,NO_QUERY,NattNatt81,@Victoria2105 Can I sponsor you after run?? I def will but payday is Monday 

0,2207622797,Wed Jun 17 08:10:22 PDT 2009,NO_QUERY,anbanan313,Good morning! Last day at the lake 

0,2207623216,Wed Jun 17 08:10:24 PDT 2009,NO_QUERY,HarleyzWorld,Good morning once again twitterville. Done with my meeting and back home in bed nursing this headache. Gotta work later  oy..

0,2207623662,Wed Jun 17 08:10:26 PDT 2009,NO_QUERY,megavortex,Blah... Another crappy day at work 

0,2207623705,Wed Jun 17 08:10:26 PDT 2009,NO_QUERY,SaraDeSantis,@JonyBoi6f6i I love how on FB you are advertising yourself on twitter...it's not going to work though...tried for months  so sad

0,2207623713,Wed Jun 17 08:10:26 PDT 2009,NO_QUERY,iTSLeeZyyyBaBie,@KattyLenoir88 I really didn't  lol fml.

0,2207624051,Wed Jun 17 08:10:28 PDT 2009,NO_QUERY,shellymallare,"@crmunar its okay its only summer. try that for your first day of the semester.. haha, i stayed in the wrong room for 2 and a half hours. "

0,2207624468,Wed Jun 17 08:10:29 PDT 2009,NO_QUERY,libby_vandoris,I just had the greatest dream about Damon and now that I know it isn't real...I wanna cry! It was so precious! 

0,2207624672,Wed Jun 17 08:10:30 PDT 2009,NO_QUERY,Littlemisscocoa,has lost my mum to cancer 

0,2207624797,Wed Jun 17 08:10:31 PDT 2009,NO_QUERY,tracicavendish,using my glasses (because I have to) in order to check fb from my phone... Im getting old. 

0,2207625018,Wed Jun 17 08:10:32 PDT 2009,NO_QUERY,tinannette,@Stuart_Lee I'm coming in at 2! That's probably when you're leaving 

0,2207625430,Wed Jun 17 08:10:34 PDT 2009,NO_QUERY,LOVERGiRL31,where is the sun 

0,2207625624,Wed Jun 17 08:10:34 PDT 2009,NO_QUERY,sugamichael,'Transformers 2' is (are?) truly unwatchable. Even CGI-friendly Megan Fox won't make this ride any better. Even the press conf was dull. 

0,2207626502,Wed Jun 17 08:10:39 PDT 2009,NO_QUERY,kristenlyn,I had a dream that carmen was still alive. I was about to give her a big hug but i woke up. 

0,2207626681,Wed Jun 17 08:10:39 PDT 2009,NO_QUERY,ms_treesap,http://bit.ly/ai7xy  Why is Judd Apatow? 

0,2207627045,Wed Jun 17 08:10:41 PDT 2009,NO_QUERY,Vikx993,@boffbowsh I know when i get upset/really stressed I get nasty stys on my eyes  Had 3 in the past few weeks!

0,2207627137,Wed Jun 17 08:10:41 PDT 2009,NO_QUERY,kathrine_21,watching one tree hill   got soaked on the way home even though i had an umbrella 

0,2207627405,Wed Jun 17 08:10:43 PDT 2009,NO_QUERY,Bec_ladypink,is feeling a little bit rubbish and lonely today  Had such a crappy mad day at work  Wanna go somewhere nice &amp; hot far far away!

0,2207627636,Wed Jun 17 08:10:44 PDT 2009,NO_QUERY,metricula,"Oh gee, I can't find my iPod cord. "

0,2207627811,Wed Jun 17 08:10:44 PDT 2009,NO_QUERY,Shazzybabez,Mountain of dishes calling  will listen to muse's showbiz album.... So not totally bored!

0,2207627817,Wed Jun 17 08:10:44 PDT 2009,NO_QUERY,HayleighGlasper,I'm going for a bath. I feel like crap. 

0,2207628271,Wed Jun 17 08:10:46 PDT 2009,NO_QUERY,twinnieannie,Ugh its that rain that wets you 

0,2207628504,Wed Jun 17 08:10:48 PDT 2009,NO_QUERY,TATIx3JONASDuh,"Hey @souljaboytellem yoooo , comee back too NYC immediatly ! i wanna meet youuuu .   (Soulja Boy live &gt; http://ustre.am/2UhS)"

0,2207628511,Wed Jun 17 08:10:48 PDT 2009,NO_QUERY,categio,"NOOO! Not another CRAPPY Indiana Jones flick! Stupid Speilberg, Harrison is too old. "

0,2207628534,Wed Jun 17 08:10:48 PDT 2009,NO_QUERY,stephdizzle13,Went past aunt betty's house. It's a huge complex now 

0,2207629089,Wed Jun 17 08:10:50 PDT 2009,NO_QUERY,I_am_MrRebutle,My day off was awesome but it has ended  we watched the new Friday the 13th last night.. Lol .. Ya .. Work time now ! And I need gas !

0,2207629585,Wed Jun 17 08:10:53 PDT 2009,NO_QUERY,beckyhope,@shaunmichaelb yep  got physics on Friday and then chemistry next wed but then that's it  that's kind of when my summer begins..xcept..

0,2207629624,Wed Jun 17 08:10:53 PDT 2009,NO_QUERY,LEANAAA,I want to go to the lakers parade 

0,2207629666,Wed Jun 17 08:10:53 PDT 2009,NO_QUERY,nartlee,i need inflatable neck pillow for the bus journey there la  i'm auntie like that. WHERE ISSIT

0,2207630330,Wed Jun 17 08:10:56 PDT 2009,NO_QUERY,lexley,@thekoolaidmom no comcast here  apparently lightening hit our lines 

0,2207630426,Wed Jun 17 08:10:56 PDT 2009,NO_QUERY,Allie_Cicmansky,shitty morning to start a shitty day  c'est la vie.. i'm determined to beat this funk i've been in.. positive energy yall!

0,2207630463,Wed Jun 17 08:10:56 PDT 2009,NO_QUERY,suzieRIOT,my wee Becca is going to Florida tomorrow  gonna miss her :'(

0,2207630616,Wed Jun 17 08:10:57 PDT 2009,NO_QUERY,johnb76,Wow..I'm feeling abandoned today 

0,2207630743,Wed Jun 17 08:10:58 PDT 2009,NO_QUERY,MobileMommy,"@rinkmom Had my latte and it was good, but a little disappointed cause had no sugar-free vanilla syrup, had to go with hazelnut "

0,2207631691,Wed Jun 17 08:11:02 PDT 2009,NO_QUERY,john_bautista,NSMT is closing?! 

0,2207632026,Wed Jun 17 08:11:04 PDT 2009,NO_QUERY,torehtard,"would like winter to be how it used to be, with lots and lots of rain. I'm bored of this 'winter'. Global warming FTL "

0,2207632074,Wed Jun 17 08:11:04 PDT 2009,NO_QUERY,ethangreen20,"@gary360 what is the difference from tweetie and twitter, man can't they just keep it to one program "

0,2207632123,Wed Jun 17 08:11:04 PDT 2009,NO_QUERY,ErikasNstyle,OH MAN. day 2 of being sick.. i really shouldve stayed home... 

0,2207632185,Wed Jun 17 08:11:04 PDT 2009,NO_QUERY,Ebcas,"I'm getting a cold. My throat is sore, so I can't swallow without it hurting. "

0,2207632351,Wed Jun 17 08:11:05 PDT 2009,NO_QUERY,angels_life,@sxytigg whats wrong ?? why so 

0,2207632550,Wed Jun 17 08:11:06 PDT 2009,NO_QUERY,standam,musim se naucit lip vyhledavat informace na twitteru 

0,2207633707,Wed Jun 17 08:11:11 PDT 2009,NO_QUERY,SHLEYAEM12,Well went for blood work and passed out! My boyfriends grandfather passed away yesterday. Now I am doing hair for them  pray for the fam.

0,2207633796,Wed Jun 17 08:11:11 PDT 2009,NO_QUERY,Mugello,@JordanKlicious Aqui tambem  following more then followers.

0,2207633805,Wed Jun 17 08:11:11 PDT 2009,NO_QUERY,b_melv,@tommcfly urgent: i'm dying for Mcfly to play America 

0,2207633957,Wed Jun 17 08:11:12 PDT 2009,NO_QUERY,wiltj,Wittnessed this today  sucks some old guy with slow reaction time  http://yfrog.com/eihcksj

0,2207633984,Wed Jun 17 08:11:12 PDT 2009,NO_QUERY,sessy1231,everyone tell @rob2rab to GET WELL SOON  he is out sick today

0,2207634283,Wed Jun 17 08:11:14 PDT 2009,NO_QUERY,clpahmiyer,@weathergirl05: There is a sign... I put it there... I thought it would be funny... I'm sorry  

0,2207640316,Wed Jun 17 08:11:41 PDT 2009,NO_QUERY,UluvUY,@hellomirv I got in Makro but my yaya got the last peace and it's the color of crap  OH WELL JEWEL! @rocketcracker

0,2207640718,Wed Jun 17 08:11:43 PDT 2009,NO_QUERY,awesomeaponte,no mroe good seats left for incubus at merriwether 

0,2207640925,Wed Jun 17 08:11:44 PDT 2009,NO_QUERY,dajbelshaw,@guyshearer SSAT stuff costs  

0,2207641909,Wed Jun 17 08:11:48 PDT 2009,NO_QUERY,sandra_melissa,over slept again today 

0,2207641914,Wed Jun 17 08:11:48 PDT 2009,NO_QUERY,Ashley__Ann,Every time i go to starbucks i get a deformed lid. 

0,2207641929,Wed Jun 17 08:11:48 PDT 2009,NO_QUERY,Yoowalk_chat,Ratty: Didn't see it 

0,2207642706,Wed Jun 17 08:11:52 PDT 2009,NO_QUERY,JoeSTATEADX,woke up with the neighbor mowing his lawn. allergy town here i come 

0,2207643253,Wed Jun 17 08:11:54 PDT 2009,NO_QUERY,mynameisyazer,darn .. i hate my sched ..tsk 

0,2207643443,Wed Jun 17 08:11:55 PDT 2009,NO_QUERY,nikkikikicoco,@rocketsBABY ohhhhhhhhhh  if i win the lottery am so there!!

0,2207643849,Wed Jun 17 08:11:57 PDT 2009,NO_QUERY,minni_e,hates men in music 

0,2207643915,Wed Jun 17 08:11:57 PDT 2009,NO_QUERY,jconneringalls,"@stephaniepratt He's Just Not That Into You has the best advice. Saw the US weekly cover &amp; I know how it is  Also, @perezhilton is mean."

0,2207644252,Wed Jun 17 08:11:59 PDT 2009,NO_QUERY,ameliesoleil,oh well; dont need to worry about what to get edd for b-day as he's decided to go spend it in bristol instead. Boo 

0,2207644750,Wed Jun 17 08:12:01 PDT 2009,NO_QUERY,NiggHole,not sure if it was the 4 shots in 10 minutes lastnight or the cookie cake but i dont feel good...  ewwie

0,2207644834,Wed Jun 17 08:12:01 PDT 2009,NO_QUERY,lilyravelvt,About to take  my baby to the airport.  I will really miss him 

0,2207645245,Wed Jun 17 08:12:03 PDT 2009,NO_QUERY,nabilathohir,I didn't ate all day and i'm not hungry at all. I think it's because of the cough 

0,2207645370,Wed Jun 17 08:12:04 PDT 2009,NO_QUERY,linhkawaii,@makink0 yeah i guess  are you excited for japan? XD

0,2207645707,Wed Jun 17 08:12:05 PDT 2009,NO_QUERY,Gem_W,#Glasto question.. how long does it normally take to escape on the Monday? I now have to be somewhere on the Monday afternoon 

0,2207645817,Wed Jun 17 08:12:06 PDT 2009,NO_QUERY,dannideetz,"@EZYTEES ayee, i have my fingers crossed too, Heard there is going to be a monsoon though, hope not "

0,2207645989,Wed Jun 17 08:12:06 PDT 2009,NO_QUERY,amigastu,"Trying to move a calendar from Outlook 2007 to iCal on Leopard, not a straightforward job "

0,2207646154,Wed Jun 17 08:12:07 PDT 2009,NO_QUERY,hayssteilberg,"@TobiasSchirmer Hey, I thought about posting this link, but it sort of depressed me "

0,2207646226,Wed Jun 17 08:12:07 PDT 2009,NO_QUERY,Virginia04,i finished paying my car about a month or two ago &amp; it now needs a new motor - what a bummer 

0,2207646504,Wed Jun 17 08:12:09 PDT 2009,NO_QUERY,kittym77,Wondering how some1 so close can b such a stranger 2 my heart 

0,2207646544,Wed Jun 17 08:12:09 PDT 2009,NO_QUERY,adrianamunoz,@AlexMiles09-I have no way to get in touch with you except computer! 

0,2207646644,Wed Jun 17 08:12:09 PDT 2009,NO_QUERY,AfroBebop,"@babyycoolie  hook me up with a SUB, but im not hungry anymore  . yea my manager can be a big Fart too"

0,2207646996,Wed Jun 17 08:12:11 PDT 2009,NO_QUERY,reema0,"I cant focus ,,,, I'm afraid  ..I have Phobia exams god Help me "

0,2207647058,Wed Jun 17 08:12:11 PDT 2009,NO_QUERY,Shadoeworks,"@butterflylinds  nope... won't let me purchase anything Canadian. I want the EP, I want the live sessions and I want the new single."

0,2207647298,Wed Jun 17 08:12:13 PDT 2009,NO_QUERY,lexipanda,@Street3 omgosh. I am so sorry 

0,2207647490,Wed Jun 17 08:12:13 PDT 2009,NO_QUERY,XKELL92X,is stressed 

0,2207647591,Wed Jun 17 08:12:14 PDT 2009,NO_QUERY,lukelutman,"@xinsight Hehe, that's what I was trying to avoid. Adding shadows to the images makes resizing them more complicated  #iphonedev"

0,2207647689,Wed Jun 17 08:12:14 PDT 2009,NO_QUERY,Stephie_2011,@aShLeYmeltjonas  you've gots to let zachary live!!!  PPPPLLLEEEAAASSSEEE!??!?

0,2207647806,Wed Jun 17 08:12:14 PDT 2009,NO_QUERY,joel_torres09,"1 gcse left, chillin but can't find the Spain game on tv "

0,2207648006,Wed Jun 17 08:12:15 PDT 2009,NO_QUERY,cassandrang,Who wants to join Youth Day's Comm's pity party? 

0,2207648025,Wed Jun 17 08:12:15 PDT 2009,NO_QUERY,t0ny_the_beat,@deepthroatmilk i know  me so sorry Wann geht's heim?

0,2207648081,Wed Jun 17 08:12:16 PDT 2009,NO_QUERY,MissPaulaFlava,@TashiaStar also...did not forget about ur pics from last photo shoot...Q (photgrapher) loves making us wait  we are sorry 4 that delay

0,2207648771,Wed Jun 17 08:12:19 PDT 2009,NO_QUERY,rock967,Webcam is dead 

0,2207649066,Wed Jun 17 08:12:20 PDT 2009,NO_QUERY,MoTalking,about to test in IE 

0,2207649585,Wed Jun 17 08:12:22 PDT 2009,NO_QUERY,MatchesMalone,"@poker_gal Fiona V was supposed to send me her headshot and resume, and she never did  #fail"

0,2207649982,Wed Jun 17 08:12:24 PDT 2009,NO_QUERY,kaattiiex,why dont tweets go to my phone? 

0,2207650418,Wed Jun 17 08:12:26 PDT 2009,NO_QUERY,applev,@DobraWorks yeah...you gotta buy and make your own Dunkin Donuts coffee around here. 

0,2207650606,Wed Jun 17 08:12:27 PDT 2009,NO_QUERY,writetoremember,@Cazzidilla missed you 

0,2207650648,Wed Jun 17 08:12:27 PDT 2009,NO_QUERY,petecullen,Finally got new desk assembled after much gnashing of teeth. Now the drawer unit..with 20 pages of instructions 

0,2207650695,Wed Jun 17 08:12:27 PDT 2009,NO_QUERY,LaurisJunior,im at the bus stop falling asleep...to tired to go to work. 

0,2207650826,Wed Jun 17 08:12:28 PDT 2009,NO_QUERY,aboateng,"WOAH, its a fkin tsunami goin on outside.. proper heavy rain!!! "

0,2207650896,Wed Jun 17 08:12:28 PDT 2009,NO_QUERY,alishagwen,day off. and no sun. boo. 

0,2207651094,Wed Jun 17 08:12:29 PDT 2009,NO_QUERY,sparklingshoes,"My twitterfon isnt working properly  goodnight , it better be better tommorow ."

0,2207651221,Wed Jun 17 08:12:30 PDT 2009,NO_QUERY,kimquebec76,i'm going work 

0,2207651677,Wed Jun 17 08:12:32 PDT 2009,NO_QUERY,genXdesigner,"Today OS 3.0 for iPhone is released...but they haven't switched the website yet to let me download it  Come on people, it's the 17th!"

0,2207651827,Wed Jun 17 08:12:32 PDT 2009,NO_QUERY,baby_juicy,"omg, proper raining outside, its mad  quite scared"

0,2207651829,Wed Jun 17 08:12:32 PDT 2009,NO_QUERY,christinaousley,My babys last day of 2nd gr! It just hit me when I watched her get out of my car 

0,2207652085,Wed Jun 17 08:12:34 PDT 2009,NO_QUERY,KandiceLeigh,@kristenlyn i have dreams about her all the time. 

0,2207652236,Wed Jun 17 08:12:34 PDT 2009,NO_QUERY,cwelch22,@CandaceRae aww i wish u could do that for me! 

0,2207652348,Wed Jun 17 08:12:35 PDT 2009,NO_QUERY,breathejess,cold weather can suck my dick. 

0,2207652910,Wed Jun 17 08:12:37 PDT 2009,NO_QUERY,camflan,@shauninman any reason why I can't enter my internal-db.sxxxxxx.gridserver.com address for the db server? can't connect to db server. 

0,2207653045,Wed Jun 17 08:12:38 PDT 2009,NO_QUERY,murieeeel,still working on my assignments. uggghh! SO TIRED! 

0,2207653204,Wed Jun 17 08:12:38 PDT 2009,NO_QUERY,iseducerobots,"So I just realized that I only use two fingers on my right hand when I type, and it's totally bothering me "

0,2207653397,Wed Jun 17 08:12:39 PDT 2009,NO_QUERY,jolynnvandam,"yuk, it's so cold "

0,2207653545,Wed Jun 17 08:12:40 PDT 2009,NO_QUERY,executioneer,@asilarae oh no that's what i do 

0,2207653594,Wed Jun 17 08:12:40 PDT 2009,NO_QUERY,Sanda611,Sure wish i had time to go see my little man...he would make everything better 

0,2207653668,Wed Jun 17 08:12:40 PDT 2009,NO_QUERY,RedNikita,"@missdevon it was definitely nice seein her and havin her here, I was sad to see her go   usually I see her abt once a month and ur right"

0,2207653738,Wed Jun 17 08:12:41 PDT 2009,NO_QUERY,Wolfgang_,@MuscleNerd you reckon a jailbroken iPhone at ver 2.2 can be upgraded to 3.0 and not be bricked? 

0,2207654001,Wed Jun 17 08:12:42 PDT 2009,NO_QUERY,virgotara,@TheEllenShow Josiah Leming's mom lost her battle to cancer yesterday  Such an amazing woman. I hope you will have him on your show again.

0,2207654596,Wed Jun 17 08:12:45 PDT 2009,NO_QUERY,OxfordRoma,"i need something to do over the summer, coz the tennis is going to stop being on the tv soon "

0,2207655072,Wed Jun 17 08:12:47 PDT 2009,NO_QUERY,Shaneya,@kbarstereo D: I missed the Seattle show  my mom was like &quot;them or The Summer Set&quot; (sorry) Stereo Skyline and TSS would be an awesome tour

0,2207655529,Wed Jun 17 08:12:49 PDT 2009,NO_QUERY,chineselouise,#movingin AND it's a penthouse (sounds like a good thing). But there's almost no chance it'll still be there in 6 weeks  Typical

0,2207655691,Wed Jun 17 08:12:49 PDT 2009,NO_QUERY,ladyIuck,@Cibu17 me too  except i just have to go to physical therapy

0,2207655873,Wed Jun 17 08:12:50 PDT 2009,NO_QUERY,pradnyaw25,What are the odds of BRUNO releasing in India...? Close to none i guess... 

0,2207669913,Wed Jun 17 08:13:56 PDT 2009,NO_QUERY,oscartorrado,Twitter user is entered in another country 

0,2207670444,Wed Jun 17 08:13:58 PDT 2009,NO_QUERY,sahana2802,Looks like a long night ahead...in office.  The demo is not quite shaping up.

0,2207670511,Wed Jun 17 08:13:59 PDT 2009,NO_QUERY,Xamethx,"I wish there'd be warm summers in Lithuania, like in Philippines... "

0,2207671132,Wed Jun 17 08:14:02 PDT 2009,NO_QUERY,linsiefelldown,@jpuch why arent you at signs? 

0,2207671163,Wed Jun 17 08:14:02 PDT 2009,NO_QUERY,KissMonika,"Leaving the office earlier than usual to take advantage of the nice weather today. From tomorrow, it is raining again. "

0,2207671198,Wed Jun 17 08:14:02 PDT 2009,NO_QUERY,melkearns,Goodmorning sunshine. I'm still tired though 

0,2207672038,Wed Jun 17 08:14:06 PDT 2009,NO_QUERY,jamesganderson,@absmac isn't it always the same 

0,2207672039,Wed Jun 17 08:14:06 PDT 2009,NO_QUERY,ncsulilwolf,"@ghostlikeswayze  So THAT'S where my minimize option went... dang, I liked that much better too.  Yes, #tweetdeck fail"

0,2207672309,Wed Jun 17 08:14:07 PDT 2009,NO_QUERY,adelemcalear,@acriley So sorry that you are still unwell  I'll miss you at your favourite hotel. Calling you shortly with verbal chicken soup.

0,2207672534,Wed Jun 17 08:14:08 PDT 2009,NO_QUERY,cfsilence,"@Vinny49 yeah, i know the feeling "

0,2207672537,Wed Jun 17 08:14:08 PDT 2009,NO_QUERY,mcrfan579,"@wardenbecks yeah, i have dial up, it really does suck. i feel your pain "

0,2207672812,Wed Jun 17 08:14:09 PDT 2009,NO_QUERY,infamousBluStar,@tootise86 I know. Lucky you damn it! 

0,2207673522,Wed Jun 17 08:14:13 PDT 2009,NO_QUERY,Eve_Garcia,@johnlegend  are u going to come to south america? please!!! 

0,2207673533,Wed Jun 17 08:14:13 PDT 2009,NO_QUERY,Davecroc,fell bit yucky today me chest is bit wezzey  tuc me inhaler did nothing 

0,2207673942,Wed Jun 17 08:14:15 PDT 2009,NO_QUERY,kpdesigns07,Ohhhh I am already hungry and it is not even close to lunchtime.  This GD diet is not keeping me full!  

