0,1983770922,Sun May 31 13:48:14 PDT 2009,NO_QUERY,tadgh,Why isn't my picture showing! Hmmm - maybe it's cos I've got a face for radio and not for twitter! 

0,1983771193,Sun May 31 13:48:15 PDT 2009,NO_QUERY,jessicalouisexo,dang you forget how sad moulin rouge is til the very end 

0,1983771408,Sun May 31 13:48:17 PDT 2009,NO_QUERY,scottythehotty,listernin to eminem cos im kool and its hott yet again so means no sleep 

0,1983771722,Sun May 31 13:48:19 PDT 2009,NO_QUERY,OliviaHamilt0n,is in SO much pain!!! 

0,1983771778,Sun May 31 13:48:20 PDT 2009,NO_QUERY,mn2kl,@samantharonson hm a little help please - on myspace it says mahiki at 8 and whiskeymist 11.30. ur website says 11pm and 8pm.  eh..? 

0,1983771853,Sun May 31 13:48:20 PDT 2009,NO_QUERY,bsb_lsrfan09,"@singingcourtney god, i hope so!! Deirks played at our county fair back in '06 and i missed it "

0,1983772163,Sun May 31 13:48:22 PDT 2009,NO_QUERY,RussellPitt,"now has to empty underneath the stairs as somebody put the weights at the back; right at the back.  Ah well, getting there slowly."

0,1983772241,Sun May 31 13:48:23 PDT 2009,NO_QUERY,Stevie_615,is realizing we wont have the money to go to Michigan in a couple weeks  

0,1983772707,Sun May 31 13:48:26 PDT 2009,NO_QUERY,Phantom124,Finally home and showered. Tons of work to do tonight for my finals tomorrow. 

0,1983772878,Sun May 31 13:48:27 PDT 2009,NO_QUERY,caro_hanspach,@Olneyenzo i miss you  comee now! WaLLe e e

0,1983772909,Sun May 31 13:48:28 PDT 2009,NO_QUERY,Misscharchar,@HunniRae  lol why doctor phill have to help me?? 

0,1983772989,Sun May 31 13:48:28 PDT 2009,NO_QUERY,deeebii,and he speaks only with you during the classes 

0,1983773158,Sun May 31 13:48:29 PDT 2009,NO_QUERY,phwez,I need a massage! 

0,1983773355,Sun May 31 13:48:31 PDT 2009,NO_QUERY,Chinchookie,@NIYANA  Breakfast Club is here! I'll be in MIA this week but gonna be missing my fellow breakfast clubbers  Need another excursion asap.

0,1983773576,Sun May 31 13:48:34 PDT 2009,NO_QUERY,Cely_H,@Ameriicaa i miss u too 

0,1983773773,Sun May 31 13:48:34 PDT 2009,NO_QUERY,Raulza08,@TimDisaster can I still get mah trophies without the net?! ;( 

0,1983773818,Sun May 31 13:48:34 PDT 2009,NO_QUERY,giannaluvs2smyl,working on a math project...  boring!! wishing i could have some fun and do some more shopping! or just chill out!

0,1983773839,Sun May 31 13:48:34 PDT 2009,NO_QUERY,mom2twinsplus1,"Awwww, nuggets! @TonyKanaan is done for the day  His car is billowing smoke. #indycar"

0,1983773894,Sun May 31 13:48:35 PDT 2009,NO_QUERY,keri_mitch,"church at the lake (AWESOME!), mall, watched Rafa lose @ the French open, and now watching Planet Earth. So sad for Rafa "

0,1983774035,Sun May 31 13:48:37 PDT 2009,NO_QUERY,davidrodriguez,@will9c1 tomorrow is Monday 

0,1983774249,Sun May 31 13:48:37 PDT 2009,NO_QUERY,LeannaJade,2day was so nice.. its sucks dat i had to wrk tho 

0,1983774388,Sun May 31 13:48:39 PDT 2009,NO_QUERY,natashabailie,"@BeautyPages I have, I have! Very burnt fingers from a sudden burst of excitement! Ouchie "

0,1983774569,Sun May 31 13:48:40 PDT 2009,NO_QUERY,_mermaiden,"@amyerrett that is really sad- makes you pretty sure he's not buying food with your generosity      and *hey*, by the way!"

0,1983774610,Sun May 31 13:48:40 PDT 2009,NO_QUERY,Crystlemethod,"@cdnbelle That's cool, I'm still at home. Did nothing today, getting ready to possibly go to Graham's new place. He says I'm distracting "

0,1983774892,Sun May 31 13:48:42 PDT 2009,NO_QUERY,kitchentiles,@_constantstatic why arent you answering me on skype 

0,1983775486,Sun May 31 13:48:47 PDT 2009,NO_QUERY,kantnokdahustle, I just ran out of my favorite cologne...Who wants to buy me some more??

0,1983775551,Sun May 31 13:48:47 PDT 2009,NO_QUERY,DonnaBihn,@macitout   what's the 1st date?  can you bring nkotb to kfest??  I'm trying to go to Scranton but can't find someone to go with me 

0,1983775588,Sun May 31 13:48:47 PDT 2009,NO_QUERY,beautyblackdiva,@Svillebaby23 that truee haha! i knoww  im sure u can

0,1983775612,Sun May 31 13:48:47 PDT 2009,NO_QUERY,DAiSiiEE_x,i dunno what to do might do some homework when mum goes downstairs xoxox lol i hate my new hair cut  xoxox

0,1983775730,Sun May 31 13:48:48 PDT 2009,NO_QUERY,wassaf,Sarah won't let me kidnap a baby duck 

0,1983775800,Sun May 31 13:48:49 PDT 2009,NO_QUERY,XxCradyxX,My last day in Germany  But I miss CA !

0,1983775894,Sun May 31 13:48:49 PDT 2009,NO_QUERY,nadacabani,"@zizekspeaks Slavoj Zizek! You DM me to join you on spymaster game, have you gone senile? Re-read ur book:'Violence' duhhhh "

0,1983776277,Sun May 31 13:48:52 PDT 2009,NO_QUERY,TheDEXpress,"I don't think we'd be able to check out Orfus Road anymore. Not even the Roots outlet store in Eglinton.  Oh, well..."

0,1983776393,Sun May 31 13:48:53 PDT 2009,NO_QUERY,Sophyy_X,is burnt like mad 

0,1983776755,Sun May 31 13:48:56 PDT 2009,NO_QUERY,KerryMorrisx,ive missed desperate housewives!  bummeeer!

0,1983776765,Sun May 31 13:48:56 PDT 2009,NO_QUERY,aaronfuller,"@TronjanHorse they SHOULD, but I'm selfish and don't want to wait that long. I wont cave. "

0,1983776858,Sun May 31 13:48:56 PDT 2009,NO_QUERY,kanalrattenkind,"@LuciLifeLover yeah, i already figured it out. i don't think that the setting will improve your english. damn,muss noch kunst machen "

0,1983777016,Sun May 31 13:48:58 PDT 2009,NO_QUERY,NVSicc,@dellydel44 awww.. its okay.. so is the CAVALIERS SEASON!... ugh.. OH EM EFFING GEE!.. I can't beileve we lost..! 

0,1983777079,Sun May 31 13:48:58 PDT 2009,NO_QUERY,itscodyhilton,Still got a hangover from hell  but it was so worth it!

0,1983777210,Sun May 31 13:48:59 PDT 2009,NO_QUERY,kanfoosheh,can you guys keep giving me the updates on the MTV movie awards pls!i can't watch it .. i have to study 

0,1983777572,Sun May 31 13:49:02 PDT 2009,NO_QUERY,laubow_,@if_i_fell i know itd be horrible  when its finished aswell &amp; having nobody to get all excited over it with 

0,1983777600,Sun May 31 13:49:02 PDT 2009,NO_QUERY,MC_Feste,"RIP Dr. George #Tiller.  There are some actions that I'll never understand. I get the rationalization, yes; can I empathize? No. "

0,1983778228,Sun May 31 13:49:06 PDT 2009,NO_QUERY,iamSwitz,I wish i could be at E3 

0,1983784475,Sun May 31 13:49:50 PDT 2009,NO_QUERY,Holebucks,Watching the hills / getting ready for work .  Missing the season finale tonight 

0,1983784550,Sun May 31 13:49:51 PDT 2009,NO_QUERY,rebeccamjlima,talking online with my friends .. i miss they  

0,1983784592,Sun May 31 13:49:51 PDT 2009,NO_QUERY,sklazola,@ScarlemNocturne just got your messages now  would have been sweet

0,1983784895,Sun May 31 13:49:53 PDT 2009,NO_QUERY,deadrickandre,@caliprodigy i know.  Cleveland choked

0,1983784911,Sun May 31 13:49:53 PDT 2009,NO_QUERY,atia1126,@Ray_Marie have you talked to Ree? I heard she was a mess 

0,1983784993,Sun May 31 13:49:53 PDT 2009,NO_QUERY,joellem,"@designerbrent Well, I needed a day off and I'm not getting it.  haha. I say &quot;yes&quot; to doing too many outside projects!"

0,1983785206,Sun May 31 13:49:55 PDT 2009,NO_QUERY,lovepowell,Still feeling yucky! And I'm workin an 8 hour shift  I think I might pass out. Blah

0,1983785396,Sun May 31 13:49:56 PDT 2009,NO_QUERY,lilprettybarbie,lifeeee sucksz! 

0,1983786290,Sun May 31 13:50:03 PDT 2009,NO_QUERY,Starsfan5,Omg a baby shitz zut passed out cuz of his reaction to his shot  poor baby

0,1983786440,Sun May 31 13:50:04 PDT 2009,NO_QUERY,fionaaa_,ppppfffffffffffffffffffffffffttttt     fiona's not amused tbh

0,1983786659,Sun May 31 13:50:05 PDT 2009,NO_QUERY,auntievay,"is at the Bridge, as usual. I want transportation!  sad face for my car Bonita"

0,1983786925,Sun May 31 13:50:07 PDT 2009,NO_QUERY,piera84,Has a rotten cold. Can't breathe out my nose at all!  had a fun day of mini golf though x

0,1983787693,Sun May 31 13:50:12 PDT 2009,NO_QUERY,waffleslayer,"@thevowel i can haz E3 too?  Memphis, TN Fail"

0,1983787712,Sun May 31 13:50:12 PDT 2009,NO_QUERY,isabeeella,@Dannymcfly dont go guys  come back soon . we really like. im angry because in the stage i cant kiss u 

0,1983787862,Sun May 31 13:50:13 PDT 2009,NO_QUERY,brykins,"@iaingilmour We have two cars, plus a new company car, so one has to go. Shame to lose my Mazda but makes sense "

0,1983788062,Sun May 31 13:50:14 PDT 2009,NO_QUERY,jvwissen,"Created a nice personal mashup to follow everything about pinkpop. Livestream, twitter and pictures. Couldn't be there  #pp09"

0,1983788358,Sun May 31 13:50:16 PDT 2009,NO_QUERY,Cazibo,"@Official_Leon Omg I'm so jealous, I wanna go to the park with you "

0,1983788559,Sun May 31 13:50:17 PDT 2009,NO_QUERY,BornPerformer,But I dont think it gets shown in England 

0,1983788573,Sun May 31 13:50:17 PDT 2009,NO_QUERY,MonkeyGirl0102,"@LaurenConrad That sucks   Oh well, you're gonna look gorgeous in whatever you're wearing!"

0,1983788898,Sun May 31 13:50:19 PDT 2009,NO_QUERY,kellyfullagar,"Goodnight Twitter, School Tomorrow so i suppose i better go to bed!!! "

0,1983788904,Sun May 31 13:50:20 PDT 2009,NO_QUERY,maureenxiv,"@winggirl oh, honey. "

0,1983788923,Sun May 31 13:50:19 PDT 2009,NO_QUERY,mattrogowski,Can't figure out how to make form options that you select show after you submit the form... 

0,1983788948,Sun May 31 13:50:20 PDT 2009,NO_QUERY,BryanBrilliance,fuck my life im too nice to people 

0,1983789037,Sun May 31 13:50:20 PDT 2009,NO_QUERY,autumnconfusion,"@galaxydazzle aww, I hope you got the tickets! Wish I could have seen them "

0,1983789679,Sun May 31 13:50:25 PDT 2009,NO_QUERY,FunStarLiz,Night At The museum FTW! And oh so ever so tired 

0,1983789716,Sun May 31 13:50:25 PDT 2009,NO_QUERY,primarymuse,"I don't feel well, and I don't mean physically. "

0,1983790019,Sun May 31 13:50:27 PDT 2009,NO_QUERY,wordsthatkiss,going on this fun trip down memory lane! I almost want to crawl up in a ball and not do this. Getting rid of childhood toys is hard 

0,1983790043,Sun May 31 13:50:27 PDT 2009,NO_QUERY,moodyje2,@Cashstwit you always go on saynow when i can't call 

0,1983790265,Sun May 31 13:50:28 PDT 2009,NO_QUERY,debbyem,Boo  i have a cold.

0,1983790458,Sun May 31 13:50:30 PDT 2009,NO_QUERY,textdrivebys,@misskrisha  @fiercebanana it's goya yellow rice  never had arroz con gandules

0,1983790760,Sun May 31 13:50:32 PDT 2009,NO_QUERY,twoebby,Grabbing a bite @ Heartland Brewery on Union Square. My time in NYC is quickly drawing to a close. 

0,1983790839,Sun May 31 13:50:32 PDT 2009,NO_QUERY,HotRod_,6.5 hrs left still to drive...   brighter side -&gt; I have a samuri sword and half a bottle of patron in my trunk! 

0,1983790944,Sun May 31 13:50:33 PDT 2009,NO_QUERY,Laydeelouella,Really sun burnt lay in bed 

0,1983791117,Sun May 31 13:50:34 PDT 2009,NO_QUERY,chrisweet,mmmm.....so bored and sad still about not going. mmm.....sad 

0,1983791193,Sun May 31 13:50:35 PDT 2009,NO_QUERY,Saimaeve,@faitaccompli Time sucks! I don't want to go back to work already 

0,1983791406,Sun May 31 13:50:36 PDT 2009,NO_QUERY,KitiaraTomsen,Retweet from @RepliesPetition: Was hoping we'd have more followers by now  #Fixreplies

0,1983791449,Sun May 31 13:50:37 PDT 2009,NO_QUERY,MelanieDawn,Just watched marathon session of 24. Over for another year 

0,1983791753,Sun May 31 13:50:39 PDT 2009,NO_QUERY,chantalbrown80,my twitterberry hasn't been working  haven't been able to update

0,1983792009,Sun May 31 13:50:40 PDT 2009,NO_QUERY,formannn,Eating a whole bag of sour gummy worms was not smart...I feel like I'm going to die 

0,1983792021,Sun May 31 13:50:41 PDT 2009,NO_QUERY,Skibble,@beverleycuddy My weakness is chocolate and crisps.... I follow Weightwatchers - now need to get back to it after my visitor goes 

0,1983792068,Sun May 31 13:50:41 PDT 2009,NO_QUERY,fragilekristy,partying tonight!!! can't see mtv movie awards must be youtube tomorrow then  but Party!!!!!!!!!!!! wooooooooooooooo 

0,1983792183,Sun May 31 13:50:42 PDT 2009,NO_QUERY,XxXcotyXxX,Oh summer is here and now I have no communication with anyone... 

0,1983792699,Sun May 31 13:50:46 PDT 2009,NO_QUERY,AlishaSheena,where's plec ? 

0,1983792754,Sun May 31 13:50:46 PDT 2009,NO_QUERY,lenorosey,trying to get my iPod to work 

0,1983793112,Sun May 31 13:50:49 PDT 2009,NO_QUERY,haneol,"@stevebiscuit im going to the zoo so might get some good sun, but i burn and peel... "

0,1983793179,Sun May 31 13:50:49 PDT 2009,NO_QUERY,LaLaTheCoolest, sometimes I 2nd guess my decisions... Like now.

0,1983793526,Sun May 31 13:50:51 PDT 2009,NO_QUERY,Mister_Showtime,"hello everyone. been out most of the weekend, i'm shattered. and have a sore head "

0,1983793588,Sun May 31 13:50:52 PDT 2009,NO_QUERY,kswilkin,I'm really depressed that the Hills is ending tonight. 

0,1983793646,Sun May 31 13:50:52 PDT 2009,NO_QUERY,nialler9,easter sunday and updating other people's good times  - europavox - http://bit.ly/UqIto  &amp;   http://bit.ly/YasY4

0,1983793824,Sun May 31 13:50:54 PDT 2009,NO_QUERY,lameep,@crosshatches Think happy thoughts! 

0,1983793902,Sun May 31 13:50:54 PDT 2009,NO_QUERY,xcherylax,Sunburn is a bitch! I cant get comfy at all!  x

0,1983793936,Sun May 31 13:50:55 PDT 2009,NO_QUERY,cardiacheart,Aaah! no cigs again 

0,1983794151,Sun May 31 13:50:56 PDT 2009,NO_QUERY,dde9009,Im tired of acting like it doesnt bother me and im also beginning to question my friends &quot;actions&quot;. i wish i had someone to talk to. 

0,1983794260,Sun May 31 13:50:57 PDT 2009,NO_QUERY,chelseaharrison,I'm super sick and I'm at work   I feel like I'm about to pass out 

0,1983794302,Sun May 31 13:50:57 PDT 2009,NO_QUERY,OnMyRadio,Sitting poolside reading trashy novels sippin on...water 

0,1983794581,Sun May 31 13:50:59 PDT 2009,NO_QUERY,KellyEStone,@buckhollywood I Changed my twitter name now....dont ask why....its a LONG Story....i bet you think im weird now  I'M SORRY (wow..so emo)

0,1983794929,Sun May 31 13:51:02 PDT 2009,NO_QUERY,bridiemann,Elly has a fever for the first time...very scary 

0,1983794969,Sun May 31 13:51:02 PDT 2009,NO_QUERY,joannamarie_x,really miss's my baby  &lt;3

0,1983795216,Sun May 31 13:51:04 PDT 2009,NO_QUERY,CELTICS_LOVE,@KimKardashian its sunday and your show isn't on  i already miss it haha can't wait til ur sisters show... will u be making appearances?

0,1983795320,Sun May 31 13:51:05 PDT 2009,NO_QUERY,gwinnclan,I really dislike trying for formal pictures of my kids! They are super uncooperative! 

0,1983795625,Sun May 31 13:51:07 PDT 2009,NO_QUERY,cloverdash,"@leannenufc Silly man pissing you off, grrr  Will it cheer you up at all to know I just ordered S3 of West Wing?"

0,1983795672,Sun May 31 13:51:07 PDT 2009,NO_QUERY,FayeLoseby,Finds living with a diabetic very stressful sometimes 

0,1983795816,Sun May 31 13:51:08 PDT 2009,NO_QUERY,hettie,and now into overgeneralising and scaremongering mode. What a shame. 

0,1983795921,Sun May 31 13:51:09 PDT 2009,NO_QUERY,jellybear89,"@CherylH77 don't say that... please... this week will be long... since the guy i picked up last night, wont be there next sunday... "

0,1983800393,Sun May 31 13:51:40 PDT 2009,NO_QUERY,rosalbav,I just want to show you she don't even know you she's never gonna love you like I want to 

0,1983800429,Sun May 31 13:51:41 PDT 2009,NO_QUERY,Goodikins,@rawr_megasur im so so confused    are you comin on msn o.o.i? xx

0,1983800442,Sun May 31 13:51:41 PDT 2009,NO_QUERY,maddyhoppe,@carlybuns99 

0,1983800859,Sun May 31 13:51:44 PDT 2009,NO_QUERY,Angelcutepie,Ahh i just missed my lover 

0,1983800861,Sun May 31 13:51:44 PDT 2009,NO_QUERY,SoCalMario,5 more day for my brand new toy the Palm Pre in my hands!! I cannot wait!!!! and 1 more day for my wifes Nextel BB Curve 

0,1983800863,Sun May 31 13:51:44 PDT 2009,NO_QUERY,bubbles108,wish i had a pool i don't  i almost ran out while the spriklers where on oops...

0,1983801050,Sun May 31 13:51:46 PDT 2009,NO_QUERY,xAllThatRemains,i think i broke my retainer 

0,1983801094,Sun May 31 13:51:46 PDT 2009,NO_QUERY,BurbankBoy,@Peter_Nehem Darn it..Andrew says its canada only 

0,1983801273,Sun May 31 13:51:47 PDT 2009,NO_QUERY,lmorrison79,@funkyfairy24 yeah not bad am a bit gutted had to spend my nk fund today!  but never mind i'll get saving again lol

0,1983801414,Sun May 31 13:51:48 PDT 2009,NO_QUERY,Divyak,"Attended kickboxing yesterday...Didnt know, human body has so many muscles, given that each one of them hurts now "

0,1983801492,Sun May 31 13:51:49 PDT 2009,NO_QUERY,CHASE_DC,@Elle202 stuck n efin del by myself my sisters comin back 2mrw to get me cuz lani lost her car keys so they took jen car to get her spare 

0,1983801996,Sun May 31 13:51:52 PDT 2009,NO_QUERY,AtmaSingh,but i thimk i may have lost my first mini project-has an auto save function which apparently is a bit dodgy according to google 

0,1983802140,Sun May 31 13:51:53 PDT 2009,NO_QUERY,coopersvictim,"Nooo... Washburne will probably be gone by the end of June, probably more around July.   "

0,1983802226,Sun May 31 13:51:54 PDT 2009,NO_QUERY,cognac62,"@ChiefHava that place looks awesome. If I wanna smoke, gotta hit the porch. 90 degrees right now "

0,1983802630,Sun May 31 13:51:57 PDT 2009,NO_QUERY,xXHAZELXx,Just gave myself an electric shock from my iphone wire never noticed the rubber came off it. 

0,1983802684,Sun May 31 13:51:57 PDT 2009,NO_QUERY,laironald,What happened?  It was such a beautiful day.. its raining now.  my bike is going to get rusty!  

0,1983802996,Sun May 31 13:51:59 PDT 2009,NO_QUERY,annzoo,Now I have a stomach ache 

0,1983803165,Sun May 31 13:52:01 PDT 2009,NO_QUERY,danielleoliverr,my computers messed up!!! HELP!!! 

0,1983803293,Sun May 31 13:52:02 PDT 2009,NO_QUERY,xoxKittyxox,@ArchAngelica17 I'm disappearing from the top! 

0,1983804017,Sun May 31 13:52:06 PDT 2009,NO_QUERY,drsteventucker,"@djsampson : No, where?  I may have conflict though "

0,1983804023,Sun May 31 13:52:06 PDT 2009,NO_QUERY,viva_la_morgan,"so bored, happy, sad school almost over!! freinds leaving for the summr "

0,1983804101,Sun May 31 13:52:07 PDT 2009,NO_QUERY,SueSveiss,"my dad and mom talk to me about to buy shoes and raincoat , i'm gonna be here in 30min or 15  but i'm going to come back SOON"

0,1983804422,Sun May 31 13:52:09 PDT 2009,NO_QUERY,apzvasan,Is trying to study. End sems in fricking ONE day! 

0,1983804611,Sun May 31 13:52:10 PDT 2009,NO_QUERY,hannahmcdermott,workworkwork throught the sun  and i wasnt at NFG yesterday  or polar bear club on fridayÂ ! this is... http://tumblr.com/xsp1x01dz

0,1983804738,Sun May 31 13:52:11 PDT 2009,NO_QUERY,sexyredd90,@youngmoneyfly hey love! hope yu not mad @ me still.. 

0,1983804755,Sun May 31 13:52:11 PDT 2009,NO_QUERY,Phillippa22,interest. I kinda feel like I'm going to end up in the same category as ppl hu think sticking a photocopy in a sketchbook is gd reasearch 

0,1983805482,Sun May 31 13:52:16 PDT 2009,NO_QUERY,Itzhak770,Welcome to all my new followers - will start tweeting again tomorrow after I catch up from Shavuos and another computer virus 

0,1983805885,Sun May 31 13:52:19 PDT 2009,NO_QUERY,KDH945,studying chemistry     its so not fun

0,1983806147,Sun May 31 13:52:21 PDT 2009,NO_QUERY,pbrack,"@davidsmalley np, don't think they were raw unfortunately "

0,1983806194,Sun May 31 13:52:21 PDT 2009,NO_QUERY,slthorpe,Watching college softball! Hoping bama goes all the way! Sad about season finale of the hills tonight 

0,1983806249,Sun May 31 13:52:22 PDT 2009,NO_QUERY,amirababyy,At baccalaureate ceremony baking my ass off!! Ah not diggin this cap thing.. Flattening my hair 

0,1983806333,Sun May 31 13:52:22 PDT 2009,NO_QUERY,km_teacher,"@JulieBanderas - Julie, please go back to wearing your mid-thigh skirts and dresses. I don't think I'll make it through the show today. "

0,1983806459,Sun May 31 13:52:23 PDT 2009,NO_QUERY,LaurenHandley,got sunburn  but dont mind cos thats rare in dumfries! ha

0,1983806603,Sun May 31 13:52:24 PDT 2009,NO_QUERY,acgaughen,Didn't get to go on the boat; apparently there's a leak   lobbying for jakes for dinner

0,1983806611,Sun May 31 13:52:24 PDT 2009,NO_QUERY,sarahsaarcasm,lone night 

0,1983806634,Sun May 31 13:52:24 PDT 2009,NO_QUERY,witenike,@siana_mia It came on 10-15 times while I was watching baseball. 

0,1983806641,Sun May 31 13:52:24 PDT 2009,NO_QUERY,Hillary_B,"@Caitermonster Yep, sadly. "

0,1983806722,Sun May 31 13:52:25 PDT 2009,NO_QUERY,HannahCarmel,"i wish it would stop raining, i only have a little bit of vacation left "

0,1983806774,Sun May 31 13:52:25 PDT 2009,NO_QUERY,VballChicaxLOVE,ready for summmmer 

0,1983807163,Sun May 31 13:52:28 PDT 2009,NO_QUERY,libertysnippet,"@eastcoaster1237 I don't know Plattsburgh; I'm heading to the belly of the beast (DC) this week, which I know all too well "

0,1983807212,Sun May 31 13:52:28 PDT 2009,NO_QUERY,cush_nz,wish i could see the New Moon trailor 

0,1983807641,Sun May 31 13:52:31 PDT 2009,NO_QUERY,gituta,DC SHOES IN THE BODY AWNNNNNNNNNNNNNN mtmtmtmtmt felixxxxxxx 

0,1983807678,Sun May 31 13:52:32 PDT 2009,NO_QUERY,toddiss,Shadow ran away...  

0,1983807711,Sun May 31 13:52:32 PDT 2009,NO_QUERY,gab_iii,@WaywardAllen hahaha that is NOT sexual. i ask that all the time! 

0,1983807712,Sun May 31 13:52:32 PDT 2009,NO_QUERY,Falkork,Nooooo I have to reinstall windows bang goes my wow time 

0,1983808016,Sun May 31 13:52:34 PDT 2009,NO_QUERY,lmorrison79,@chilli2722 damn i forgot that was on  they will repeat it i'm sure

0,1983808285,Sun May 31 13:52:36 PDT 2009,NO_QUERY,see_air_uhh,knowing i'm miles away from the place i need to be  ilyy &lt;|3

0,1983808444,Sun May 31 13:52:37 PDT 2009,NO_QUERY,KrstnaMri,"I wish I could watch the awards.. But I wasn't invited, "

0,1983808542,Sun May 31 13:52:38 PDT 2009,NO_QUERY,clairexxox,"@timmmmehh omg timmy what a waste  it was beautiful today  I went to the beach ^^, was awesome"

0,1983808926,Sun May 31 13:52:41 PDT 2009,NO_QUERY,Ronnie_ASA,House sad 

0,1983809362,Sun May 31 13:52:44 PDT 2009,NO_QUERY,PaulDewey,Time to pass out 

0,1983809396,Sun May 31 13:52:44 PDT 2009,NO_QUERY,jctrick,Romantic weekend just came to an end. Sir has left for work. 

0,1983809678,Sun May 31 13:52:46 PDT 2009,NO_QUERY,CARAMELDAWN,Chris won't make me no food 

0,1983809761,Sun May 31 13:52:47 PDT 2009,NO_QUERY,dakar2000,"@tomer no vista here. have dual boot, Linux&amp; XP. unfortunately most of the ppl I work with want .doc and will not do with .pdfs "

0,1983809854,Sun May 31 13:52:47 PDT 2009,NO_QUERY,brookenyc,"Damn this is beautiful...A lil lonely tho, guess this is what happens when your not missed  "

0,1983809895,Sun May 31 13:52:48 PDT 2009,NO_QUERY,kwame_martin,I could really use some pick-me-up sex right about now. 

0,1983810153,Sun May 31 13:52:50 PDT 2009,NO_QUERY,aaTurley,Im crying because im missing hannah and my clock isnt helping me! 

0,1983810273,Sun May 31 13:52:50 PDT 2009,NO_QUERY,LPBekka,"My LC is in three days  I;m scared, I wanna get into college so much!"

0,1983810698,Sun May 31 13:52:53 PDT 2009,NO_QUERY,Kelsey_L,hit her elbow really hard last night - still hurts and tingles 

0,1983811067,Sun May 31 13:52:56 PDT 2009,NO_QUERY,Greliz,@reneengstrom did they seriously JUST send this out because that's completely ridiculous  I'm supposed to have a table with some friends

0,1983811090,Sun May 31 13:52:56 PDT 2009,NO_QUERY,Tanya_xO,"@AmyStar92 Yeah, you coming? coolies. Aww "

0,1983811236,Sun May 31 13:52:57 PDT 2009,NO_QUERY,_writersblock_,@Jchawes what happened to his law?? 

0,1983811482,Sun May 31 13:52:59 PDT 2009,NO_QUERY,TillyRossetti,@kathrynmercer: this is exactly what I thought earlier! I made myself boiled egg&amp;soldiers for tea and just lamented impending adulthood  x

0,1983811532,Sun May 31 13:52:59 PDT 2009,NO_QUERY,jemjem1983,@Icklesal oh yes. Don't get me started on anxiety   we could defo be a double act!! LOL

0,1983812361,Sun May 31 13:53:05 PDT 2009,NO_QUERY,vestalas,Hmmm boobs are a little too big.  I'm popping out all over.  http://yfrog.com/15keazj

0,1983812660,Sun May 31 13:53:07 PDT 2009,NO_QUERY,Laurabr15,oooh noo the weekend is almost over  school tomorrow ... that sounds terrible :/

0,1983812684,Sun May 31 13:53:07 PDT 2009,NO_QUERY,lisarec11,@mundah  oh the things we would do for pens tickets.

0,1983812868,Sun May 31 13:53:09 PDT 2009,NO_QUERY,benelie,@_emeline poor Katee too  I was so sad about Amy and Miracle!

0,1983818840,Sun May 31 13:53:51 PDT 2009,NO_QUERY,studioprisoner,@emsimmons enjoying Sunday Funday? I'm back at work today 

0,1983819238,Sun May 31 13:53:54 PDT 2009,NO_QUERY,Captain_Ron,@ShawnKing well you could be doing home improvement chores like me all weekend 

0,1983819581,Sun May 31 13:53:56 PDT 2009,NO_QUERY,kkFarrell,how come my burns last for weeks? 

0,1983819748,Sun May 31 13:53:58 PDT 2009,NO_QUERY,beiana04,grocery store 

0,1983819853,Sun May 31 13:53:59 PDT 2009,NO_QUERY,bee_ritt,Don't make me go back to workkkkk 

0,1983819910,Sun May 31 13:53:59 PDT 2009,NO_QUERY,Iskate2222,Really bored 

0,1983819983,Sun May 31 13:53:59 PDT 2009,NO_QUERY,karmachord,@shadowfish Oh no that girlie giving you trouble again? 

0,1983820577,Sun May 31 13:54:03 PDT 2009,NO_QUERY,Moeneeke,"Watching tattoo hwy right now on cable, its soooo sad right now I wanna cry "

