0,2325540629,Thu Jun 25 05:38:19 PDT 2009,NO_QUERY,dean_b,@SherilynMoon unfortunate then that I have no signal to tweet photos from my phone whilst in Wales 0,2326295920,Thu Jun 25 06:50:23 PDT 2009,NO_QUERY,HeshieBoy,My take on Transformers....wait for it. hahahaha. it was unbelieveable..and not in a good way! *sigh*  

0,2326296293,Thu Jun 25 06:50:25 PDT 2009,NO_QUERY,iman888,I cannot get in touch with my bebep 

0,2326296315,Thu Jun 25 06:50:25 PDT 2009,NO_QUERY,yyuyin,I forgot about this friend I have. We used 2 b close..then one day I decided 2 ignore her. she still txts me every few mths w/ a 

0,2326296366,Thu Jun 25 06:50:25 PDT 2009,NO_QUERY,DomC234,@jemmahatty You promised us no aneamic breasts 

0,2326296530,Thu Jun 25 06:50:26 PDT 2009,NO_QUERY,kt34510,Come on juan 

0,2326296663,Thu Jun 25 06:50:26 PDT 2009,NO_QUERY,kyler09,"loves his friends so much... our fun times: painting, upward bound, herbert...  gahhh i love you guys :'("

0,2326296794,Thu Jun 25 06:50:27 PDT 2009,NO_QUERY,mattscoggins,Heading to a debriefing at the EOC. Guess they need to talk to people if you were there when they pull a 5 year olds body from the lake 

0,2326296910,Thu Jun 25 06:50:28 PDT 2009,NO_QUERY,Janna2784,I am beginning to forget what the sun looks like 

0,2326296949,Thu Jun 25 06:50:28 PDT 2009,NO_QUERY,alexandra_orr,Idk what to do today 

0,2326296981,Thu Jun 25 06:50:28 PDT 2009,NO_QUERY,_elliee,headache 

0,2326297273,Thu Jun 25 06:50:30 PDT 2009,NO_QUERY,signedlovealwys,"my twitter scope is usually 90% right, odd.  just try to rise again?"

0,2326297414,Thu Jun 25 06:50:30 PDT 2009,NO_QUERY,RyanSchumann,Is at work 

0,2326297541,Thu Jun 25 06:50:31 PDT 2009,NO_QUERY,KatyLinda,"@SweetyCBS I was shopping for the kids, not for me. Sorry. "

0,2326297941,Thu Jun 25 06:50:33 PDT 2009,NO_QUERY,juliewhorror,Noooooooooo the chocolate timbits are gone   little bitches hahaha

0,2326298068,Thu Jun 25 06:50:34 PDT 2009,NO_QUERY,ohpleaseyt,says I'M LEFT WITH ONE LAST HOMEWORK! and i think that i wont finish it today  . i wanna finish my homework!... http://plurk.com/p/13w3pw

0,2326298085,Thu Jun 25 06:50:34 PDT 2009,NO_QUERY,KimberlyEddy,"grieving the loss of someone close to me, and wishing I had one more chance to say goodbye. "

0,2326298369,Thu Jun 25 06:50:35 PDT 2009,NO_QUERY,shellenay,@summerkiss he is taking my car there..yes my car that i just put 200 in for tires now the muffler needs done  pray for $ blessing

0,2326298386,Thu Jun 25 06:50:35 PDT 2009,NO_QUERY,lufullagar,i wanna go to GLASTO  sad times 

0,2326298809,Thu Jun 25 06:50:38 PDT 2009,NO_QUERY,x0keelz0x,Social last class 

0,2326299236,Thu Jun 25 06:50:40 PDT 2009,NO_QUERY,Arcania,@Kenichan *huggles* Sorry hear that Keni... 

0,2326299543,Thu Jun 25 06:50:42 PDT 2009,NO_QUERY,CarmenGoldberg,Those days are gone...yes they are.   â « http://blip.fm/~8urqz

0,2326300215,Thu Jun 25 06:50:45 PDT 2009,NO_QUERY,csupo,@AnoopDoggDesai hi there anoop.... it kinda SUCK cuz maybe i can't join the chatting time this june28. i'm not available during the time 

0,2326300318,Thu Jun 25 06:50:46 PDT 2009,NO_QUERY,LaBetenoir,"@Saradia yeah wooooooooooo! rock on! (took 2 codein earlier, totally sleeeeepy right now     )"

0,2326300383,Thu Jun 25 06:50:46 PDT 2009,NO_QUERY,leonakimeera,@thomasgoodwin Errands that take faaaaaaar toooooo loooooong! 

0,2326300835,Thu Jun 25 06:50:48 PDT 2009,NO_QUERY,vedavn,Oh so THIS is what they mean by 'feeling low'... 

0,2326302106,Thu Jun 25 06:50:55 PDT 2009,NO_QUERY,nutmegxo,"Dear lower back, please stop hurting. I cant take you any longer "

0,2326302283,Thu Jun 25 06:50:56 PDT 2009,NO_QUERY,Oh_EreWeGo,"@simplecake @LizeeH It's true, it is just Michael. I'm actually a man  but shhh! I don't want anyone to know..."

0,2326310673,Thu Jun 25 06:51:40 PDT 2009,NO_QUERY,AP_Cali,A fly just tried to go in my ear   me in hills and running is not a good combo

0,2326310783,Thu Jun 25 06:51:41 PDT 2009,NO_QUERY,clarexsaula,@VOLTAGErockcity I thought she'd win it too! Not fair  haha

0,2326311367,Thu Jun 25 06:51:43 PDT 2009,NO_QUERY,TheMusicTech,"@tired_mommie Is she ok now? Poor her, poor you! I owe you an e-mail but seem to have lost the original  I'll make something up :-D"

0,2326311740,Thu Jun 25 06:51:45 PDT 2009,NO_QUERY,wandaalston,good morning! in class. someone save me! 

0,2326311768,Thu Jun 25 06:51:46 PDT 2009,NO_QUERY,mwfishman,"common denominator of my last two not-feeling-well-moments, OYSTERS!  Someone tell me what to do because i don't want to stop eating them "

0,2326311788,Thu Jun 25 06:51:46 PDT 2009,NO_QUERY,Emmers1974,@BreBaby143 and Im thinking the closest i'll get to them is 4th row in Indy no 5* for me 

0,2326311854,Thu Jun 25 06:51:46 PDT 2009,NO_QUERY,developit,Farah Fawcett given last right 

0,2326312427,Thu Jun 25 06:51:49 PDT 2009,NO_QUERY,jmkluvsnkotb,@DaniAlexLuna hey u! how r things? i've been going nkotb crazy-just got back from Cleveland OH- only 1 more show then my tour ends 

0,2326312490,Thu Jun 25 06:51:49 PDT 2009,NO_QUERY,blimey85,@codinghorror an iphone can survie a drop on the floor. Mine went face down on pavement. It did not survive. 

0,2326312753,Thu Jun 25 06:51:51 PDT 2009,NO_QUERY,Luna07,"@orbie23 @lynsoliver @Paraldasfyre @Fairywispa Well, I tried to get an acupuncture appointment, but they couldn't fit me in  Doing my"

0,2326312791,Thu Jun 25 06:51:51 PDT 2009,NO_QUERY,nindyrazr,"well thats explain why i feel so tired, i got fever what a bumer "

0,2326313402,Thu Jun 25 06:51:55 PDT 2009,NO_QUERY,Shannon_Alex,Being at my brothers college orientation thing really makes me miss cuse 

0,2326313616,Thu Jun 25 06:51:56 PDT 2009,NO_QUERY,CrazyEvilDodo,i don't know what to do i must kill someone but i don't know where he is  ! help plz  !!

0,2326313629,Thu Jun 25 06:51:56 PDT 2009,NO_QUERY,FaceTimeChris,"@Donnie Wahlberg - NK dancers are amazing, and talented - I applaud those girls for a great job - I don' t think many give them credit "

0,2326314203,Thu Jun 25 06:51:59 PDT 2009,NO_QUERY,noTHINGfaced,Records retention policies are a PITA. 21 CFR Pt 11 is a PITA. Sarbanes Oxley is a PITA for a PM sometimes 

0,2326314206,Thu Jun 25 06:51:59 PDT 2009,NO_QUERY,noTHINGfaced,Records retention policies are a PITA. 21 CFR Pt 11 is a PITA. Sarbanes Oxley is a PITA for a PM sometimes 

0,2326314802,Thu Jun 25 06:52:02 PDT 2009,NO_QUERY,mhm276,@nonquickoatmeal omg you're right. horrifying. delirium. wish you were coming on our weekend adventure!! 

0,2326315379,Thu Jun 25 06:52:05 PDT 2009,NO_QUERY,MahmoudGhieh,Today ill go play some 360 because im sick 

0,2326315538,Thu Jun 25 06:52:05 PDT 2009,NO_QUERY,apathyisafad,25$ only gets me half a tank. 

0,2326315598,Thu Jun 25 06:52:06 PDT 2009,NO_QUERY,meday,Heading out to a work day with church peoples! Then will watch them play paintball; can't play myself due to herniated disc and stuffs 

0,2326315755,Thu Jun 25 06:52:06 PDT 2009,NO_QUERY,deafkidsparent,Miranda reports after having 4 wisdom teeth removed yesterday: &quot;I ate some green tea ice cream in the early am. I couldn't sleep.  &quot;

0,2326315762,Thu Jun 25 06:52:06 PDT 2009,NO_QUERY,chubbyasianlove,"im soo freaking craving a good sandwich...or something, ive been craving to eat SOLID food instead of noodles all the time "

0,2326316184,Thu Jun 25 06:52:08 PDT 2009,NO_QUERY,lorz4, its 10 am nd i cant sleep any more nd no1 will wake up

0,2326316609,Thu Jun 25 06:52:10 PDT 2009,NO_QUERY,twitatjna,I think i'm hungry again  - http://tweet.sg

0,2326316707,Thu Jun 25 06:52:11 PDT 2009,NO_QUERY,charlieke001,@NaomiLovesJB_x Not in the mood to get ready 

0,2326316721,Thu Jun 25 06:52:11 PDT 2009,NO_QUERY,Tom_Tracey,Short run today - 1 mile in 9 min 30...  

0,2326317170,Thu Jun 25 06:52:13 PDT 2009,NO_QUERY,Divinne,My bangs are all messed up. 

0,2326317604,Thu Jun 25 06:52:16 PDT 2009,NO_QUERY,nicoleleemer,i miss you  http://plurk.com/p/13w4fg

0,2326317717,Thu Jun 25 06:52:16 PDT 2009,NO_QUERY,bnorthfestival,twitter is in meltdown haha!  I don't want to follow U.S. sports and fashion freaks go away.  It won't even let me delete them! bah 

0,2326317859,Thu Jun 25 06:52:17 PDT 2009,NO_QUERY,InkedMinx,getting ready to paint my bathroom cabinets 

0,2326318013,Thu Jun 25 06:52:18 PDT 2009,NO_QUERY,thej,@kv same thoughts about pre. But its going to be near 30+k in india I guess 

0,2326318036,Thu Jun 25 06:52:18 PDT 2009,NO_QUERY,hello_noelle,I'm soooo shleeeeeeeeeepy 

0,2326318554,Thu Jun 25 06:52:21 PDT 2009,NO_QUERY,keela_culver,@dbowen57 tell kels i wish i was there 

0,2326318599,Thu Jun 25 06:52:21 PDT 2009,NO_QUERY,yoyulia,"my leg is still hurt, "

0,2326318639,Thu Jun 25 06:52:21 PDT 2009,NO_QUERY,redfive202,Yoville's buggy today  Someone call an exterminator.

0,2326318915,Thu Jun 25 06:52:22 PDT 2009,NO_QUERY,jakibabi,really dont wanna leave my class  we have so much fun together!!

0,2326319085,Thu Jun 25 06:52:23 PDT 2009,NO_QUERY,Shannon_xoxox,is too hot  needs ice-cream =D

0,2326319121,Thu Jun 25 06:52:23 PDT 2009,NO_QUERY,Alli232,@DatMad how was the party I wanted to come unuh 

0,2326319714,Thu Jun 25 06:52:26 PDT 2009,NO_QUERY,janiceshiu,i miss my good friend. been a few days already. 

0,2326319801,Thu Jun 25 06:52:27 PDT 2009,NO_QUERY,theinkedblonde,can't believe they blocked twitter from work too! 

0,2326320255,Thu Jun 25 06:52:29 PDT 2009,NO_QUERY,devoburrito,"Lesson learned, no more all nighters when i have to work 430 to 130 "

0,2326320539,Thu Jun 25 06:52:31 PDT 2009,NO_QUERY,KarisRae,Driving back home to dothan! Work this afternoon and ethics assignment  Bleh

0,2326321383,Thu Jun 25 06:52:35 PDT 2009,NO_QUERY,aemixson,I hate it when people yell  some things are just so unnecessary

0,2326321552,Thu Jun 25 06:52:36 PDT 2009,NO_QUERY,karlaveloso,http://bit.ly/HudH1  i wish i could sing  im listening to this instead of homework hah

0,2326321649,Thu Jun 25 06:52:37 PDT 2009,NO_QUERY,anazombee,im up waaaaay to Early 

0,2326322085,Thu Jun 25 06:52:39 PDT 2009,NO_QUERY,shellykaye,@dtanton nah  I don't like iced coffee give me the real thing!

0,2326322396,Thu Jun 25 06:52:41 PDT 2009,NO_QUERY,AwesumJacob,@iDeKay i love TACO bell aewesum as HECK but mom nevar taeks me there but once a month 

0,2326322432,Thu Jun 25 06:52:41 PDT 2009,NO_QUERY,tangrae,@faerieimp ur bb can wifi? Mine can't...  Keep updating then! 

0,2326322773,Thu Jun 25 06:52:43 PDT 2009,NO_QUERY,pigphone,Its FINALLY my day off!!! Yeah for me!!!!  It has been a long week.  Now to see what is wrong with my CAR???  

0,2326322821,Thu Jun 25 06:52:43 PDT 2009,NO_QUERY,MarieinHolland,HELP ME HELP ME HELP ME I am bored like hell 

0,2326323008,Thu Jun 25 06:52:44 PDT 2009,NO_QUERY,aping4362,@1iranian i'm sorry... i know that not everyone has twitter... i was just retwitting 

0,2326323598,Thu Jun 25 06:52:47 PDT 2009,NO_QUERY,TeamNickJ,"Morning, wok eup too early "

0,2326323826,Thu Jun 25 06:52:48 PDT 2009,NO_QUERY,CoConutShelle,Ohh m ge..eurgh cnt hear nething wiv all the drilling goin on opposite..too too loud! bring me some ear muffs argh! 

0,2326323843,Thu Jun 25 06:52:48 PDT 2009,NO_QUERY,TulsiiV,why won't my background change? 

0,2326323844,Thu Jun 25 06:52:48 PDT 2009,NO_QUERY,celinda_m,boo for Blackberry having extra characters for texts. 

0,2326323974,Thu Jun 25 06:52:49 PDT 2009,NO_QUERY,Giania,@T_Roguestar  This is why we can't have nice things

0,2326324079,Thu Jun 25 06:52:49 PDT 2009,NO_QUERY,Gilly72,housework is calling 

0,2326324357,Thu Jun 25 06:52:51 PDT 2009,NO_QUERY,UnaLeahy,Eh where is the sun gone???! 

0,2326324482,Thu Jun 25 06:52:51 PDT 2009,NO_QUERY,loischantrelle,GOOD MORNING FELLOW TWEETERS! packing for my trip to Panama City. Gotta million things to do today including a Bio exam  hope i finish up

0,2326324533,Thu Jun 25 06:52:52 PDT 2009,NO_QUERY,neworleanslady1,"Yep now gotta fix a flat, my spare tire is flat "

0,2326324985,Thu Jun 25 06:52:54 PDT 2009,NO_QUERY,peapoles,Why does everyone feel that twitter is boring?  I am so going to change their mindset. HAHA.

0,2326325012,Thu Jun 25 06:52:54 PDT 2009,NO_QUERY,poopistaken,Kid in class got my sn. Smh* it was Jo 

0,2326325291,Thu Jun 25 06:52:56 PDT 2009,NO_QUERY,mizzt2hot,How did I reach 25 without a single best &quot;friend&quot; male or female? I have plenty of &quot;associates&quot; though. Clearly this isn't healthy. 

0,2326325329,Thu Jun 25 06:52:56 PDT 2009,NO_QUERY,shauna1991,Cant wait to see my baby on tuesdayyy. . miss u   Xxxxxxx

0,2326325566,Thu Jun 25 06:52:57 PDT 2009,NO_QUERY,monetty,floods in the Czech Rep. AGAIN 

0,2326325698,Thu Jun 25 06:52:58 PDT 2009,NO_QUERY,na000mii,Rolled my ankle at work last night. Don't know how well I'm going to do with training now.  http://dailymile.com/e/zHX

0,2326331132,Thu Jun 25 06:53:27 PDT 2009,NO_QUERY,tcn33,@mbd if we 5 are successful: 200 sadarses. If we are not: 5 sadarses 

0,2326331592,Thu Jun 25 06:53:29 PDT 2009,NO_QUERY,ayman_alharbi,Still looking for good news which is represent peace but i think they are really few 

0,2326331848,Thu Jun 25 06:53:30 PDT 2009,NO_QUERY,MitushiB,"why did i choose MBA!!!! whats the point in doing 1 thing that everyone else is doing, i thought it didn't need brains  uaaaaaa"

0,2326331939,Thu Jun 25 06:53:31 PDT 2009,NO_QUERY,avmfan,"I miss you , my honey  Come back......... please"

0,2326332262,Thu Jun 25 06:53:32 PDT 2009,NO_QUERY,AmBOLISTICS,awh am currently an insomniac I CNT SLEEEPP  need sick rest  tomrw is guna suckk

0,2326332379,Thu Jun 25 06:53:33 PDT 2009,NO_QUERY,vivz93,"@Emsparks i had to time to go buy one before dance either, and right now i cant be bothered to go to the shop as its to hot! "

0,2326332881,Thu Jun 25 06:53:36 PDT 2009,NO_QUERY,Dysfnctnl85,Sick today  coding from the couch.

0,2326333506,Thu Jun 25 06:53:39 PDT 2009,NO_QUERY,katharinedavis,school  but last day =D

0,2326333767,Thu Jun 25 06:53:40 PDT 2009,NO_QUERY,MJam76,such sad news this morning...my thoughts and prayers are with my friend brian and his family 

0,2326333817,Thu Jun 25 06:53:41 PDT 2009,NO_QUERY,MJam76,such sad news this morning...my thoughts and prayers are with my friend brian and his family 

0,2326333853,Thu Jun 25 06:53:41 PDT 2009,NO_QUERY,Witchblade77,the weather is soooo great and IÂ´m sitting here in the office 

0,2326334237,Thu Jun 25 06:53:43 PDT 2009,NO_QUERY,Mzpurrfection,"@PLPhotography cool thats wzzup, damn u saw it already lol , I jealous.. shit tickets prob sold out this week "

0,2326334535,Thu Jun 25 06:53:45 PDT 2009,NO_QUERY,lindadoll,Taking Grandma to chemo today. I hate hospitals. 

0,2326334544,Thu Jun 25 06:53:45 PDT 2009,NO_QUERY,sianelen,delaying the inevitable... Work in half an hour 

0,2326334802,Thu Jun 25 06:53:46 PDT 2009,NO_QUERY,nachirami,@KennyAshleyxoxo i need to know the same ... 

0,2326334823,Thu Jun 25 06:53:46 PDT 2009,NO_QUERY,veromadrigal,Too many people at the starbucks drive thru!!!!!!!!!!! Ahhhhhh! I guess coffee from the grungy old office coffee pot it is 

0,2326335595,Thu Jun 25 06:53:50 PDT 2009,NO_QUERY,Jonpro03,i guess ill go back to work...   

0,2326335648,Thu Jun 25 06:53:51 PDT 2009,NO_QUERY,avanders,Missing the boyfriend. 

0,2326335775,Thu Jun 25 06:53:51 PDT 2009,NO_QUERY,dumasiregar,I miss my hubby  gk ketemu 2 hari...hiks

0,2326335811,Thu Jun 25 06:53:51 PDT 2009,NO_QUERY,shaviswa,@sivajayaraman please - I have stopped taking tea/coffee from the vending machine.  I drink a glass of hot water instead 

0,2326336012,Thu Jun 25 06:53:52 PDT 2009,NO_QUERY,CoverGirl_76,Sitting in traffic just crawling along I hate construction 

0,2326336252,Thu Jun 25 06:53:54 PDT 2009,NO_QUERY,SquishyBobb,I can't wrinkle my nose anymore 

0,2326336351,Thu Jun 25 06:53:54 PDT 2009,NO_QUERY,jacquelinesteps,@purplerazberryy TY bff. i feel like i haven't seen U in months. hope U all have fun @ Ronnie's party.  i will take all the drunk dials!;D

0,2326336966,Thu Jun 25 06:53:57 PDT 2009,NO_QUERY,iseraphim,wishes she was reading a novel instead of faking study for her exam tomorrow. Pretending to study is really exhausting. I'm so run-down 

0,2326337195,Thu Jun 25 06:53:59 PDT 2009,NO_QUERY,amberlynnloves,Wants this pain to go away so I can go to YATEC. But I probably won't be able to go. Blah 

0,2326338464,Thu Jun 25 06:54:06 PDT 2009,NO_QUERY,kimberley_ann,@missyelam But what would I do without my tv shows??? I'm addicted to Showtime. 

0,2326338728,Thu Jun 25 06:54:07 PDT 2009,NO_QUERY,blondechicken,@velmalikevelvet Hmm...maybe it's best if you hold it (then I don't have to pack/unpack it!) but I want it NOW 

0,2326338967,Thu Jun 25 06:54:08 PDT 2009,NO_QUERY,t_isfortammy,@whatcassiesaid i have barely even had energy to leave my bed let alone the house  it's kinda worrying me now

0,2326339033,Thu Jun 25 06:54:08 PDT 2009,NO_QUERY,hana_adnan,is at home watching Criminal Minds and then Las Vegas and then.... forced myself to sleep!! 

0,2326339264,Thu Jun 25 06:54:09 PDT 2009,NO_QUERY,AGreear,Going to the final Third year discipleship  then off to bowl and eat ice cream with the #GTAustin Staff the @GT20mobile Great day

0,2326339298,Thu Jun 25 06:54:09 PDT 2009,NO_QUERY,emmy_563,back from school.. Hard day 

0,2326339449,Thu Jun 25 06:54:10 PDT 2009,NO_QUERY,bethrider09,@bballgal_508 hey jules! i know uve prob texted me somewhere down the line... my phone's not working right now  r we still on for July 4??

0,2326339476,Thu Jun 25 06:54:10 PDT 2009,NO_QUERY,axyaesthetic,And all the horses have small cuts on there hawks 

0,2326339597,Thu Jun 25 06:54:12 PDT 2009,NO_QUERY,leirastorm,@avengedpunk GTS you mad woman!  i want you to feel better!

0,2326340186,Thu Jun 25 06:54:14 PDT 2009,NO_QUERY,thejennyjets,Is back to reality 

0,2326340190,Thu Jun 25 06:54:14 PDT 2009,NO_QUERY,stephyisawesome,Working in College Park today 9-5. I hate new places 

0,2326340235,Thu Jun 25 06:54:15 PDT 2009,NO_QUERY,lily_scott,"is jobhunting, it fucking sucks when you're in direct competition with 3 of your BFs...   "

0,2326340375,Thu Jun 25 06:54:15 PDT 2009,NO_QUERY,bannana666,So.screwed up getting the morning suits for my bros wedding  now alex and I will end up in spiderman costumes ( I kid J. Will get sorted)

0,2326340839,Thu Jun 25 06:54:18 PDT 2009,NO_QUERY,laname,"@JustineCullen no he was the right one, he was the only one and as usual I screwed up, I think ive lost my bff also "

0,2326340889,Thu Jun 25 06:54:18 PDT 2009,NO_QUERY,panoot,is bummed out.  http://plurk.com/p/13w58h

0,2326340936,Thu Jun 25 06:54:18 PDT 2009,NO_QUERY,zerorin00,doesn't like dogs who chew on books.... 

0,2326341267,Thu Jun 25 06:54:20 PDT 2009,NO_QUERY,debbiex3,feels guilty for lying.  this is y i dont lie.

0,2326341428,Thu Jun 25 06:54:21 PDT 2009,NO_QUERY,trickassshane,It's only 10 and it's already SO hot. 

0,2326341930,Thu Jun 25 06:54:24 PDT 2009,NO_QUERY,Zombulator,Afraid of what's gonna happen when Howard gets home. 

0,2326342301,Thu Jun 25 06:54:26 PDT 2009,NO_QUERY,gaqt466,http://twitpic.com/8dcd0 - The leach field and septic tank debacle continues.   

0,2326342710,Thu Jun 25 06:54:28 PDT 2009,NO_QUERY,cflanagan,Wish I could change tags for past posts  #e2conf48 to #e2conf47

0,2326343251,Thu Jun 25 06:54:31 PDT 2009,NO_QUERY,pbrooks,"Once again my debugger won't attach to a Silverlight process, and once again I have no idea why "

0,2326343654,Thu Jun 25 06:54:33 PDT 2009,NO_QUERY,rivenskyatwinda,"i don't know, i'm so confused "

0,2326343959,Thu Jun 25 06:54:34 PDT 2009,NO_QUERY,Annabs,it feels like i'm coming down with something...  *away! away!*

0,2326343995,Thu Jun 25 06:54:35 PDT 2009,NO_QUERY,PurpleHeather,"@catnip Oh, if I wasn't full of the lurg I'd bite your arm off for them - was lem &amp; didn't get any "

0,2326344274,Thu Jun 25 06:54:36 PDT 2009,NO_QUERY,superduperchic,The results werent  good...waiting for more info 

0,2326344337,Thu Jun 25 06:54:36 PDT 2009,NO_QUERY,Jayme1988,"@bobby_todd No its wednesdays, I hate.. "

0,2326344890,Thu Jun 25 06:54:39 PDT 2009,NO_QUERY,modelchick85,man its sooo nice out...but my back hurts like no other 

0,2326345093,Thu Jun 25 06:54:40 PDT 2009,NO_QUERY,tweetics,"Was running late to my train, pushed my bike so hard I dislodged the handle bars "

0,2326345330,Thu Jun 25 06:54:42 PDT 2009,NO_QUERY,lfeeney,Not sure why I try to give blood anymore... it seems like I fail the test 2 out of 3 tries  

0,2326345590,Thu Jun 25 06:54:43 PDT 2009,NO_QUERY,fierce_22,is so so tired...omg this day is gonna suck 

0,2326346238,Thu Jun 25 06:54:47 PDT 2009,NO_QUERY,purplesense,can't believe it has been one year already.. yet the pain I feel whenever i think about it is no less than what i felt before. 

0,2326346297,Thu Jun 25 06:54:47 PDT 2009,NO_QUERY,jennirussell,"@sueupton Be glad it's warm there! It's been rainy, dreary, and cool here in the Northeast  #dumbledore"

0,2326347126,Thu Jun 25 06:54:51 PDT 2009,NO_QUERY,Tian73,"Thank f**k works finished, now jobs at home to do "

0,2326347145,Thu Jun 25 06:54:52 PDT 2009,NO_QUERY,jddalton,@launton d'oh chaffing would make for a very unhappy experience   I shoulda powdered

0,2326347328,Thu Jun 25 06:54:53 PDT 2009,NO_QUERY,DieGoOchOa,woke up early  helluh tiredd. text it(:

0,2326347579,Thu Jun 25 06:54:54 PDT 2009,NO_QUERY,AbaGadol,Yup - late for work!   But not nearly as late as the UN an international &quot;human rights&quot; organizations are in working to free #Gilad !

0,2326347740,Thu Jun 25 06:54:55 PDT 2009,NO_QUERY,__callmesara,I have a sunburn. That really hurt 

0,2326347776,Thu Jun 25 06:54:55 PDT 2009,NO_QUERY,sdp912,In class 

0,2326348251,Thu Jun 25 06:54:57 PDT 2009,NO_QUERY,ThaGirlEstar,"feeling soo dayum good , its too hot to go anywhere . "

0,2326348270,Thu Jun 25 06:54:57 PDT 2009,NO_QUERY,ulovefran,http://www.oceanup.com/3.html nick testifying for diabetes. he pricks his finger 12 times a day  We need a cure for type 1 diabetes!!

0,2326348352,Thu Jun 25 06:54:58 PDT 2009,NO_QUERY,bekahdalex,"hmm what to do today....nothing as per  wish i had my car  or even better wish people would remember i exsist, haha -_-"

0,2326348472,Thu Jun 25 06:54:59 PDT 2009,NO_QUERY,xjojoliciousx,about to watch &quot;he was a quiet man&quot; anyone watched it? scary yes/no? thoughts? its 2am so warn me if its scary 

0,2326348636,Thu Jun 25 06:54:59 PDT 2009,NO_QUERY,AlainaFrederick,@kellymccausey Can you believe he's a year older already! It goes by so fast 

0,2326348776,Thu Jun 25 06:55:00 PDT 2009,NO_QUERY,JP_DCruz,"I'll definitely missed the net, the aircon and many stuffs when I stayed on the dorm already.. "

0,2326357950,Thu Jun 25 06:55:47 PDT 2009,NO_QUERY,Danni_Andersen,"@Rachelle_Lefevr  Great interview this morning on KAK. Hope you enjoying Australia, pitty you couldn't make it to Adelaide "

0,2326357951,Thu Jun 25 06:55:47 PDT 2009,NO_QUERY,colincoe,Can't w8 till next weeks pay day already this weeks shocking pay 

0,2326358057,Thu Jun 25 06:55:48 PDT 2009,NO_QUERY,lotsofadybugs,@yqlairotciv I think I'll miss you even more! Aw. 

0,2326358147,Thu Jun 25 06:55:48 PDT 2009,NO_QUERY,officiallady_j,@marshallbu *shudders*...good luck with the test. I'm all test'd out. I got class and homework for the majority of my day 

0,2326358568,Thu Jun 25 06:55:50 PDT 2009,NO_QUERY,_Bostonx,I wish you would just stop 

0,2326359103,Thu Jun 25 06:55:53 PDT 2009,NO_QUERY,whitelight007,@freakgoddess okay thats it ..i am real hungry now . thnks to u i m also craving for reshmi kababs but can't hav one cauz its thursday.. 

0,2326359963,Thu Jun 25 06:55:58 PDT 2009,NO_QUERY,IsaChatterbox,just spilled my cup of coffee all over me. it was so embarassing. 

0,2326360261,Thu Jun 25 06:55:59 PDT 2009,NO_QUERY,Mib94,Talking to Jonathan on the phone 

0,2326360548,Thu Jun 25 06:56:01 PDT 2009,NO_QUERY,favknightlie,I wanna go to ibiza now... O cant wait to aug 

0,2326360584,Thu Jun 25 06:56:01 PDT 2009,NO_QUERY,brisseaux,"@Secretshowcase a damn, wish i could make it bro "

0,2326360826,Thu Jun 25 06:56:02 PDT 2009,NO_QUERY,itsmekaseyb,"@JessieHand ugh i know, stupid clouds!! i forget what the sun looks like! i cant go to aqua sunday  im pisssssed."

0,2326360930,Thu Jun 25 06:56:03 PDT 2009,NO_QUERY,tamk7,Leavers Day tomorrow...I don't wanna leave 

0,2326361244,Thu Jun 25 06:56:04 PDT 2009,NO_QUERY,Silvana274,"Is Still @ The Office And Running Late!!! Om Half 5 Een Meeting In Amsterdam, Ik Ga Het NOOIT Redden "

0,2326361255,Thu Jun 25 06:56:04 PDT 2009,NO_QUERY,Nephiko,#22725 - The Anonymous Hugging Wall in London .. I want to hug too  http://viigo.im/01yT

0,2326362348,Thu Jun 25 06:56:10 PDT 2009,NO_QUERY,fleecc,@elaineching i kena before so do understand u guys feeling ....  my 3 previous LV gone !!!

0,2326362685,Thu Jun 25 06:56:12 PDT 2009,NO_QUERY,CdbMobile1,At Erica's house responding to emails/messages then headed to the pool for some Q.T. with the cuzzos and homeboy before I leave Saturday 

0,2326362704,Thu Jun 25 06:56:12 PDT 2009,NO_QUERY,shahhdowss,Lol cheer up fat Asian blob. I'll see meeeee yay ugh I bruised my elbow today cleaning my room 

0,2326362795,Thu Jun 25 06:56:12 PDT 2009,NO_QUERY,pffftkennedy,i feel like shit 

0,2326362930,Thu Jun 25 06:56:13 PDT 2009,NO_QUERY,shanexedge,@BrianNippon do you have those Hate demos? myspace blocked the links 

