0,2325540629,Thu Jun 25 05:38:19 PDT 2009,NO_QUERY,dean_b,@SherilynMoon unfortunate then that I have no signal to tweet photos from my phone whilst in Wales 0,2325902505,Thu Jun 25 06:14:57 PDT 2009,NO_QUERY,joffwl,@K8loulee stupid eBay/paypal...  xxxx

0,2325902602,Thu Jun 25 06:14:58 PDT 2009,NO_QUERY,lilo_a27,graduation 2day yay!!!!!!!!!!!!!!!!! i cant wait.... missin  all my peeps already &lt;3 

0,2325902835,Thu Jun 25 06:14:59 PDT 2009,NO_QUERY,nmhrbrtsn,Omg i have come across so many cute clothes today and ofc i cant go and spend all my money omg 

0,2325902885,Thu Jun 25 06:14:59 PDT 2009,NO_QUERY,Michaela1791,im going to prague on saturday. airport. im not flying away though 

0,2325903274,Thu Jun 25 06:15:02 PDT 2009,NO_QUERY,makenzie_aleece,@hiiikelci when? MISS YOU SUGA i havent seen you in a whileeeeee. ok it was the other day but thats still too long 

0,2325903359,Thu Jun 25 06:15:02 PDT 2009,NO_QUERY,craigmcgill,@jackiecameron1 It would be fab but I have a few things over the weekend that might not be moveable 

0,2325903793,Thu Jun 25 06:15:04 PDT 2009,NO_QUERY,rickhurst,ugh more lost earnings while dealing with insurance company paperwork 

0,2325903895,Thu Jun 25 06:15:05 PDT 2009,NO_QUERY,ameliaonthereal,my brothers leaving for flordia...without me 

0,2325904366,Thu Jun 25 06:15:07 PDT 2009,NO_QUERY,martijnadema,"No inspiration  But with some help I`ll manage, I hope!"

0,2325904863,Thu Jun 25 06:15:10 PDT 2009,NO_QUERY,GGGKeri,@MargoHay that sucks! 

0,2325906133,Thu Jun 25 06:15:16 PDT 2009,NO_QUERY,JerriLynn1981,So wishes I could have slept in today. 

0,2325906869,Thu Jun 25 06:15:20 PDT 2009,NO_QUERY,davidjabez,too many outstanding to follow up  watch me die tmr.

0,2325906906,Thu Jun 25 06:15:20 PDT 2009,NO_QUERY,Kieranizer,"Had a heart-to-heart with someone last night, and it quite shocked me the stuff that got said. I wish id have been more honest before "

0,2325906990,Thu Jun 25 06:15:21 PDT 2009,NO_QUERY,lifegoesjon,"Getting Lea ready for her day camp trip to Monterey. Wish I can go, too. "

0,2325907312,Thu Jun 25 06:15:22 PDT 2009,NO_QUERY,PhilipNelson,@jeriellsworth Left flipper on my F-14 Tomcat stopped working..  Needs the Jeri touch.

0,2325908254,Thu Jun 25 06:15:27 PDT 2009,NO_QUERY,msvalarry,@TyaraBee I went to hang with h.s friends  and we were all drinking &amp; my tolerance has gone dwn since I dnt drink so I was done off 

0,2325908528,Thu Jun 25 06:15:29 PDT 2009,NO_QUERY,icyflames13,got so sick last night so i couldn't go to school today and it's also the last day. I got better in the morning but mom didnt let me go 

0,2325908809,Thu Jun 25 06:15:30 PDT 2009,NO_QUERY,nic0lepaula,How am I supposed to sleep with this loud thunder?  My sleeping schedule is so fucked up... I had a very good night though. Thank you =]

0,2325909197,Thu Jun 25 06:15:32 PDT 2009,NO_QUERY,princelili,@mmm_gash you can't be a black american ginger woman! It's just physically impossible 

0,2325909337,Thu Jun 25 06:15:33 PDT 2009,NO_QUERY,nereaLA,OMJ! I want go to the JB concert in New Orleans! Is the Joe's birthday!!! 

0,2325909349,Thu Jun 25 06:15:33 PDT 2009,NO_QUERY,djannalyze,Really wish I could fall back to sleep 

0,2325909535,Thu Jun 25 06:15:34 PDT 2009,NO_QUERY,leeengkai,"got only one friend using twitter, so damn sad "

0,2325909592,Thu Jun 25 06:15:34 PDT 2009,NO_QUERY,girlzluvme,I wish the weather would stay like this..but instead it's going up to 100 and humid 

0,2325910133,Thu Jun 25 06:15:37 PDT 2009,NO_QUERY,laratera,"@monutza que penÃ³s el meu anglÃ¨s... Que disfrutis dels 17, per molt lluny que siguis sempre et recordem. We miss you "

0,2325910399,Thu Jun 25 06:15:39 PDT 2009,NO_QUERY,mimidancer,@ZeroOP revenge not so sweet he was gone b4 i came back out 

0,2325910782,Thu Jun 25 06:15:41 PDT 2009,NO_QUERY,kimberly__joy,wonders if this feeling is chicken pox.... all over again  NOOOOOOOO.... !!!

0,2325910832,Thu Jun 25 06:15:41 PDT 2009,NO_QUERY,Plochman,@johanbruyneel Freeking outstanding flash intro on @TeamAstana website its time wish @hornerakg could have made it   http://trunc.it/lajl

0,2325910938,Thu Jun 25 06:15:41 PDT 2009,NO_QUERY,hanluckie,@pitchforkmedia your eyewonderlabs imeem button on your website means I can't read the Jim James/George Harrison article - boo 

0,2325911010,Thu Jun 25 06:15:42 PDT 2009,NO_QUERY,Stacyd76,Is gettin ready for work 

0,2325911046,Thu Jun 25 06:15:42 PDT 2009,NO_QUERY,DanKulp,@plentz Hmm...  a test comment I just did seemed to work fine.  

0,2325911306,Thu Jun 25 06:15:44 PDT 2009,NO_QUERY,helen_ktbspa,"I can't believe it...They actually love the PANIC dance?! Sorry to say that, but it's real disappointment "

0,2325911433,Thu Jun 25 06:15:44 PDT 2009,NO_QUERY,AshleeNino,im soooooo over this weather! 10 day forcast...thinderstroms NOOOO! my fam is visiting for the 1st time and its gonna rain everyday 

0,2325911621,Thu Jun 25 06:15:45 PDT 2009,NO_QUERY,neglectdhusband,"@secret_thoughts I'm more than a bit stressed TBH. Too much work and not enough space between it, Mrs NH or small NH  "

0,2325911854,Thu Jun 25 06:15:47 PDT 2009,NO_QUERY,ToffeePoppet,just can't sunbathe on her own  I am really missing everyone at Uni right now... bring on the Girls holiday in Sept!!!

0,2325912237,Thu Jun 25 06:15:49 PDT 2009,NO_QUERY,itsreallyerin,no class tomorrow... so excited! but as for now... gettin ready for class 

0,2325912751,Thu Jun 25 06:15:52 PDT 2009,NO_QUERY,keeperbinns,@howdomedia why cant i direct messaage you? 

0,2325912967,Thu Jun 25 06:15:53 PDT 2009,NO_QUERY,iMattR,I'm really tired. Almost falling asleep in Maths... 

0,2325912994,Thu Jun 25 06:15:53 PDT 2009,NO_QUERY,KathrynMinor,going to pick up @killieboy97 from his last 3pm finish  &lt;33

0,2325913244,Thu Jun 25 06:15:55 PDT 2009,NO_QUERY,CocoaGeek,we've re-submitted Commodore 64 for iPhone to Apple for review - hopefully all goes well. (via @manomio) &lt;- Sadly BASIC had to be removed 

0,2325913376,Thu Jun 25 06:15:56 PDT 2009,NO_QUERY,jerrymannel,I love the time after 6PM in office.U can play songs loud and no one cares at all. Hmm.. wait a sec oops i'm the only one here  #GetALife

0,2325913415,Thu Jun 25 06:15:56 PDT 2009,NO_QUERY,emilyyrm,back from summer morning workouts; feel the burnn... at 8 in the morning 

0,2325913977,Thu Jun 25 06:15:59 PDT 2009,NO_QUERY,supernaturalamy,@abs1399 i got that email 2 but no dd around here 

0,2325914141,Thu Jun 25 06:16:00 PDT 2009,NO_QUERY,MamaAutism,We have been on waitlist since my son was 18 months - waited 3 years already and have only moved 100 spots on waitlist! We are 109 now 

0,2325914246,Thu Jun 25 06:16:00 PDT 2009,NO_QUERY,littledoodles,"bummed that I might not be able to make it to glug tonight, was looking forward to illustrator/crafty people meet up "

0,2325914618,Thu Jun 25 06:16:02 PDT 2009,NO_QUERY,TokyoTowerWAWL,@UzamakiJ Sorry for responding so late  Got a bit busy in studio Thanks for the song info too Our notes are weak even when music's strong!

0,2325914971,Thu Jun 25 06:16:04 PDT 2009,NO_QUERY,marcii_chan,another nightmare 

0,2325915153,Thu Jun 25 06:16:05 PDT 2009,NO_QUERY,xforgetdecembuh,@ChronoHawk  what a great start.

0,2325915434,Thu Jun 25 06:16:06 PDT 2009,NO_QUERY,LakeishaKena,Why can't I get any work done? Such nice weather... I should be in Glastonbury right now  Maybe next year. ohh.. http://tinyurl.com/mukblu

0,2325915600,Thu Jun 25 06:16:07 PDT 2009,NO_QUERY,splrefdept,Phia. Inquirer wasn't delivered.  Had to run down to Frank's News.  A total of 7 minutes there and back.  I'm not 21 anymore 

0,2325915943,Thu Jun 25 06:16:09 PDT 2009,NO_QUERY,jenniwren12,"right, exercise time, then ironing. "

0,2325916214,Thu Jun 25 06:16:11 PDT 2009,NO_QUERY,hamm44,@kanaa evn megan fox wasnt that hot 

0,2325916378,Thu Jun 25 06:16:12 PDT 2009,NO_QUERY,alligoob,Stupid les got me sick and i feel like shit 

0,2325916825,Thu Jun 25 06:16:14 PDT 2009,NO_QUERY,joejm65,"@GodLovesIran No, I've been up all night.  I'll nap soon. My sleep is off. "

0,2325921654,Thu Jun 25 06:16:42 PDT 2009,NO_QUERY,_Bergi_,itÂ´s to rainy for the party that sucks 

0,2325922277,Thu Jun 25 06:16:46 PDT 2009,NO_QUERY,sandee79,@Emily0309 aww!  Some1 is giving away an English Pointer on CL. He's so cute 

0,2325922279,Thu Jun 25 06:16:46 PDT 2009,NO_QUERY,Dnez1105,Good morning...feelin a little Blah..My weekend starts on Thursday and of course that would be the day not to feel good   

0,2325922306,Thu Jun 25 06:16:46 PDT 2009,NO_QUERY,ashlinnshannon,"just got up AN HOUR TOO EARLY 'cause I'm a huge dumbass. all that potential sleep... gone, forever... "

0,2325922390,Thu Jun 25 06:16:47 PDT 2009,NO_QUERY,wide_receiver,@Boogaloo1 it's awful - felt such a dick. EVERYONE was pointing and laughing. Never felt such a silly sausage... 

0,2325922671,Thu Jun 25 06:16:48 PDT 2009,NO_QUERY,sashatjie,"So far, i've asked @wynneprasetyo for Spore, @nanadnour @yhzkylryn for Bandung, @hellowinz for Sydney. I am on fire. Still long way to go "

0,2325923064,Thu Jun 25 06:16:51 PDT 2009,NO_QUERY,lissyvz,"&lt;-- going to bed, very cold. also look like i have two black eyes. I'm so tired "

0,2325923318,Thu Jun 25 06:16:52 PDT 2009,NO_QUERY,lindseyperrodin,work at 11-6. 

0,2325924204,Thu Jun 25 06:16:58 PDT 2009,NO_QUERY,SindyBennett,Hallelujah for payday!! Although half my money is gone already 

0,2325924250,Thu Jun 25 06:16:58 PDT 2009,NO_QUERY,BobbiGalvin,"   From Gongwer OH Report, sounds like leadership still considering library cuts, not considering tax increases. #saveohiolibraries"

0,2325924254,Thu Jun 25 06:16:58 PDT 2009,NO_QUERY,babybee3,@_JAYsee @heykristi my girls!!!! my phone is broken so sorry if im not texting back  i miss you guys terribly.

0,2325924269,Thu Jun 25 06:16:58 PDT 2009,NO_QUERY,Stewart249,"After a seven year or so absence, my hayfever's back - and with a bloody vengeance too. "

0,2325924350,Thu Jun 25 06:16:59 PDT 2009,NO_QUERY,MicheleWalters,Does anyone want to buy me Taylor Swift tickets? I just want to take my sister. And I didn't win them on the radio. 

0,2325924476,Thu Jun 25 06:16:59 PDT 2009,NO_QUERY,ailish79,"@jennzahling I miss ya, too! My net connection sucked  DM me the # so I can txt ya! Sorry about earlier"

0,2325924521,Thu Jun 25 06:16:59 PDT 2009,NO_QUERY,caitlynnx,D: i can't fall back asleep. 

0,2325924618,Thu Jun 25 06:17:00 PDT 2009,NO_QUERY,irdinosaur,Is sick of proposing the same things since he started 

0,2325924834,Thu Jun 25 06:17:01 PDT 2009,NO_QUERY,Memee14,Today's plan: Shopping (: then off to the doctor (Lame..) 

0,2325924873,Thu Jun 25 06:17:01 PDT 2009,NO_QUERY,sinergystarfall,My eyes are on the verge of falling out 

0,2325925066,Thu Jun 25 06:17:02 PDT 2009,NO_QUERY,_sophiesoph,"stupid woman didn't hear me when i won  was twenty five quid as well, stupid cow"

0,2325925072,Thu Jun 25 06:17:02 PDT 2009,NO_QUERY,RoyalMinnette,@RycheRockinGirl haha Nothing sadly 

0,2325925117,Thu Jun 25 06:17:03 PDT 2009,NO_QUERY,njhamer,"@VicThompson Oh no! Hope you'll be ok, or is it too late for that? "

0,2325925463,Thu Jun 25 06:17:05 PDT 2009,NO_QUERY,ChibaChi,"Biologie, it is so much! Still interesting, but way to much "

0,2325925506,Thu Jun 25 06:17:05 PDT 2009,NO_QUERY,gtvone,&quot;Your application for press passes to Spinal Tap at Wembley Arena was declined on this occasion&quot; - This? it's THE only occasion. bahhh! 

0,2325925761,Thu Jun 25 06:17:06 PDT 2009,NO_QUERY,jspartacus,"Thursday... wow, this week is crawwwwling by.  "

0,2325925993,Thu Jun 25 06:17:08 PDT 2009,NO_QUERY,aliciamaudilee,grrr fusterated. Everything in my house is breaking... 

0,2325926404,Thu Jun 25 06:17:10 PDT 2009,NO_QUERY,vivilicious_,I have to do something fÃ¼r school. school sucks! 

0,2325926481,Thu Jun 25 06:17:11 PDT 2009,NO_QUERY,ksuave,http://twitpic.com/8d9l4 - Great times at MOTM last night! Not feeling so good this morning 

0,2325926531,Thu Jun 25 06:17:11 PDT 2009,NO_QUERY,MReaux,"Not a good start. I just got stung by fire ants while trying to water my parched lawn. I've got to drive my mom today, so no benadryl. "

0,2325926698,Thu Jun 25 06:17:12 PDT 2009,NO_QUERY,xoxoshahirah,Okayyyy. I have to go. There's nothing to do with this computer. Might tweet with my phone. I think I might have insomnia again. 

0,2325926885,Thu Jun 25 06:17:13 PDT 2009,NO_QUERY,bloombie,http://twitpic.com/8d9la - Edited in a hurry. Sorry 

0,2325927064,Thu Jun 25 06:17:14 PDT 2009,NO_QUERY,neglectdhusband,Time to go back to work again 

0,2325927424,Thu Jun 25 06:17:16 PDT 2009,NO_QUERY,fionaaa_,still waiting on a train ... 

0,2325927666,Thu Jun 25 06:17:17 PDT 2009,NO_QUERY,benchidol,says nanood ang mga nilalang ng passion of the Christ sa bahay  wala ako dun.. http://plurk.com/p/13vphk

0,2325927757,Thu Jun 25 06:17:18 PDT 2009,NO_QUERY,khaldaaa,i hate wakawaka! lose again 

0,2325928018,Thu Jun 25 06:17:20 PDT 2009,NO_QUERY,jb1881,@pylesa   Hopefully you can get a nap in today!

0,2325928033,Thu Jun 25 06:17:20 PDT 2009,NO_QUERY,shellenay,Awww poor guy  Jesus please touch his body

0,2325928208,Thu Jun 25 06:17:21 PDT 2009,NO_QUERY,PeterBlackQUT,i can confirm that #spoonerist is alive - i just chatted to him on msn - but i don't know when he'll return to twitter 

0,2325928331,Thu Jun 25 06:17:22 PDT 2009,NO_QUERY,zahoore516,Up and soo tired! I got surgery after work! Didn't sleep well at all 

0,2325929606,Thu Jun 25 06:17:29 PDT 2009,NO_QUERY,lockets24,Results back from Drs owen fine..my tests show no ovulation need to be tested again 

0,2325929679,Thu Jun 25 06:17:29 PDT 2009,NO_QUERY,thunderagram,On the 9th of July IÂ´ve got my surgery   I canÂ´t do sports for an half year! :'( MAN IÂ´M GONNA DIE! *sigh*

0,2325929834,Thu Jun 25 06:17:30 PDT 2009,NO_QUERY,greenFREAK33,wanna start work on an artistic masterpiece ...any ideas ???   

0,2325929856,Thu Jun 25 06:17:30 PDT 2009,NO_QUERY,Temptationcoil,They killed off Santina....  

0,2325930471,Thu Jun 25 06:17:34 PDT 2009,NO_QUERY,virtualmiss,"had such good intentions this week, and didn't get to training once  just saw Wil at Qpac...nice guy...but not so funny as i thought..."

0,2325930528,Thu Jun 25 06:17:34 PDT 2009,NO_QUERY,itsael,@Vanezzle pleaseee tell mee lo punya bb sayaaaang  we need alotta chat add my pin!!!

0,2325930605,Thu Jun 25 06:17:35 PDT 2009,NO_QUERY,godenzigirl,@djdlux1 sounds like an awesome way to start the day! 

0,2325930805,Thu Jun 25 06:17:36 PDT 2009,NO_QUERY,NadRamli,Needs to fall asleep early today 

0,2325931050,Thu Jun 25 06:17:37 PDT 2009,NO_QUERY,DarthMolen,@FueltheFighter No  The funds didn't materialize in time to make that appearance at the Fan Expo 

0,2325931846,Thu Jun 25 06:17:42 PDT 2009,NO_QUERY,tercowas,@sadekhm I can't  we've to go to the opera for her rehearsal 

0,2325932015,Thu Jun 25 06:17:43 PDT 2009,NO_QUERY,thcarouseluv,Feels so bored. I cant use the com  - http://tweet.sg

0,2325932155,Thu Jun 25 06:17:43 PDT 2009,NO_QUERY,kiskitty,@canceranswer i think that the house and senate will screw his vision up anyway. I have no confidence in them 

0,2325932449,Thu Jun 25 06:17:45 PDT 2009,NO_QUERY,vanitys_arrived,just came back from jogging; i need a work-out partner. i felt so lonely 

0,2325932817,Thu Jun 25 06:17:47 PDT 2009,NO_QUERY,jessvergottini,I feel so helpless without my iPhone.   Damn me forgetting it!

0,2325932914,Thu Jun 25 06:17:48 PDT 2009,NO_QUERY,DayNese,Note: don't sleep with a fan on 100 blowing in you're face... U will wake up and realize u need to go buy meds cause your sick 

0,2325933157,Thu Jun 25 06:17:49 PDT 2009,NO_QUERY,ninjadza,@nickthevortex good luck with the tour!I cant make it to dunfermline  but hope to catch yous in Edinburgh or Glasgow soon!gonna B mega!

0,2325933504,Thu Jun 25 06:17:51 PDT 2009,NO_QUERY,LYNTURNIP,"cant believed when i sneezed this morning,my back tweeked! &amp; now it hurts "

0,2325933638,Thu Jun 25 06:17:52 PDT 2009,NO_QUERY,Mel30stm,my pen leaked all over 

0,2325933800,Thu Jun 25 06:17:53 PDT 2009,NO_QUERY,huggedroses,finally i have received my zipper wirstlet and i haven't mail out the money yet to the blogshop as i mailed wrongly 

0,2325933805,Thu Jun 25 06:17:53 PDT 2009,NO_QUERY,dimsumdiva,"Holy crap. Back from S'pore, pregnant with huge food baby. Will miss Milo Dinosaur   "

0,2325934083,Thu Jun 25 06:17:55 PDT 2009,NO_QUERY,Ashhhleyy,I have the largest headache known to man. If I'm not better by sunday I can kiss warped goodbye 

0,2325934659,Thu Jun 25 06:17:58 PDT 2009,NO_QUERY,BarbieGoesRetro,remember someone's words &quot;stop acting like ure strong from those shits.i know ure fragile&quot; AARGG 

0,2325934739,Thu Jun 25 06:17:58 PDT 2009,NO_QUERY,nmhrbrtsn,srsly CUTE SUMMER DRESSES EVERYWHERE OMG   

0,2325935134,Thu Jun 25 06:18:01 PDT 2009,NO_QUERY,chrisntr,Note to all: Shazam iPhone app does not pick up songs sung by a human. Shame  (I know there are apps that do though)

0,2325935154,Thu Jun 25 06:18:01 PDT 2009,NO_QUERY,starbuckz04,in class...bored 

0,2325935233,Thu Jun 25 06:18:01 PDT 2009,NO_QUERY,Teighan,i got called a stupid whore from a random 40 yr old gay guy today... 

0,2325935352,Thu Jun 25 06:18:02 PDT 2009,NO_QUERY,321Christina123,if that would work like a charm...OH MY GOSH!! My life would be so perfect â ¥â ¥ but it's so implausibly 

0,2325935752,Thu Jun 25 06:18:04 PDT 2009,NO_QUERY,TimaFBaby,Mornin Twitter Fam! Soo tired from lastnite 

0,2325936230,Thu Jun 25 06:18:07 PDT 2009,NO_QUERY,lolakay84,@rachelbryson   any time you have one of those you should call and run it by someone first! Love u!

0,2325936243,Thu Jun 25 06:18:07 PDT 2009,NO_QUERY,dieting14yroldg,I'll try and solve this now. 

0,2325936464,Thu Jun 25 06:18:08 PDT 2009,NO_QUERY,MidwestWoman,@kayotickitchen ... I crushed my camera so I will see what I can do. The zoom is not all that great now 

0,2325936542,Thu Jun 25 06:18:09 PDT 2009,NO_QUERY,autojoy,@Alexmilway I've been wondering this myself!  That and Creationist &quot;Museums&quot;.....omfg.

0,2325936820,Thu Jun 25 06:18:10 PDT 2009,NO_QUERY,RealMegBishop,"Had a scary dream bugs were crawling all over me, therefore, I couldn't sleep!!  sleepy today!!"

0,2325941848,Thu Jun 25 06:18:39 PDT 2009,NO_QUERY,kittykat707,"@DwightHoward good luck to ur friends!!! Cant wait for the draft, mad chicago is at the bottom of the totem pole tho "

0,2325941935,Thu Jun 25 06:18:40 PDT 2009,NO_QUERY,KarKar1220,ugh. I don't like mornings.. 

0,2325942541,Thu Jun 25 06:18:43 PDT 2009,NO_QUERY,Wiltshire69,"Working again  had a good one last nite tho, new trike build took it's first problem free test flight  awesome "

0,2325942892,Thu Jun 25 06:18:45 PDT 2009,NO_QUERY,Eislann,(( idk when will my mom finish cooking *delayed due to out of gas* gaah it's already 9.20  ))

0,2325943224,Thu Jun 25 06:18:47 PDT 2009,NO_QUERY,ThiagoAcquaviva,@Olkaaaaa yep! its 10:18 AM here i work til 17:00! (5PM) lol 

0,2325943377,Thu Jun 25 06:18:48 PDT 2009,NO_QUERY,hayleyjoanne,she is now touring some place in uk -- talking about food  no far!!!

0,2325943417,Thu Jun 25 06:18:49 PDT 2009,NO_QUERY,Fauxred,"my two friends who moved to London a few months ago have to move back to SF. Their situation echoes mine, only without the school stuff. "

0,2325943552,Thu Jun 25 06:18:49 PDT 2009,NO_QUERY,gigiphotography,Had a horrible nightmare last night about my children - ugh - ... I need to shake it off! 

0,2325943763,Thu Jun 25 06:18:51 PDT 2009,NO_QUERY,mdemanatee,Mom just came to me w/ another ruined (at least torn) sweater. What the heck is happening to them in the wash?! I love my sweaters 

0,2325943766,Thu Jun 25 06:18:51 PDT 2009,NO_QUERY,spartachek,Injured shoulder at gym yesterday 

0,2325943979,Thu Jun 25 06:18:52 PDT 2009,NO_QUERY,MrsMinifig,"God, I could cry.... "

0,2325944055,Thu Jun 25 06:18:52 PDT 2009,NO_QUERY,becki40hands,@beezandhoney: right before I left u tweeted about transformers so I assumed u were out w peeps. 

0,2325944196,Thu Jun 25 06:18:53 PDT 2009,NO_QUERY,Lqdtnt,"Did I offend anyone? Forgive me as I have no common sense. I am a rude girl, sorry "

0,2325944263,Thu Jun 25 06:18:53 PDT 2009,NO_QUERY,villykassiou,@JodiAlbert Aww sending you many hugs sweety!  Is it not better at all with what u did last night? I hope it'll b fine quickly.take care x

0,2325944349,Thu Jun 25 06:18:54 PDT 2009,NO_QUERY,caitywait,cheapest tix on ebay are $218  i hate scalpers!!

0,2325944365,Thu Jun 25 06:18:54 PDT 2009,NO_QUERY,NikFreeman,@vellvegas  lol how are you? what did you bring me back from Italy ;-)

0,2325944831,Thu Jun 25 06:18:56 PDT 2009,NO_QUERY,ninamorena,....that cup of coffee did not work this morning 

0,2325944843,Thu Jun 25 06:18:56 PDT 2009,NO_QUERY,CeolBeag42,"@nuttia It is interesting, depressing though. Plus when I wrote that I was seeing all the stuff about Megan Fox   the oh so hot"

0,2325944864,Thu Jun 25 06:18:57 PDT 2009,NO_QUERY,chrislovesjesus,i lost my pot  i had to ditch it in the woods cause i almost got caught. im gunna go back and look for it soon.

0,2325945922,Thu Jun 25 06:19:02 PDT 2009,NO_QUERY,CoConutShelle,struggling to stay awake.. don't know why...? 

0,2325946159,Thu Jun 25 06:19:04 PDT 2009,NO_QUERY,howdyitsjessica,"@earthtobella ok, well i actually just got another interview for this evening.. wont be able to make it! "

0,2325946438,Thu Jun 25 06:19:05 PDT 2009,NO_QUERY,disel001,@sundotshine What happened to plan A? 

0,2325946895,Thu Jun 25 06:19:08 PDT 2009,NO_QUERY,Live2Laph,"@epiphanygirl has shouted every city  and town that she's been on tour to, but she was in Philly on Wednesday and we aint get no twit luv "

0,2325947354,Thu Jun 25 06:19:10 PDT 2009,NO_QUERY,edbaldry,"cs4 has failed, going back to cs3 "

0,2325947406,Thu Jun 25 06:19:11 PDT 2009,NO_QUERY,makikaysantos,I gotta go now.  I`ll sleep early today. No cable. ((( I even know why. :| ugh. Goodnight Twitterland. Dream of me. 8-&gt;

0,2325947497,Thu Jun 25 06:19:11 PDT 2009,NO_QUERY,IAm_Laurie,@ParisTennille why u dont follow me ?? 

0,2325947634,Thu Jun 25 06:19:12 PDT 2009,NO_QUERY,Lottie93,@Georgiee120193 Haha it wasn't a date. Didn't go! What illness do you have  x

0,2325947748,Thu Jun 25 06:19:13 PDT 2009,NO_QUERY,c0r0nel,@harpomaxx me too 

0,2325948626,Thu Jun 25 06:19:18 PDT 2009,NO_QUERY,NaTasHa3x3,@OPTIMUStik You're a liar babe 

0,2325948963,Thu Jun 25 06:19:19 PDT 2009,NO_QUERY,emmabarnes80,"Sorry, got my wires crossed.  It actually starts today.  Queens of the Stoneage today, Doves tomorrow, Brucie on Sat  Poor Emma B"

0,2325949096,Thu Jun 25 06:19:20 PDT 2009,NO_QUERY,donbarger,is wondering why his 2 year old daughter's blood sugar dropped so low again last night. 41 is too low.   

0,2325949968,Thu Jun 25 06:19:25 PDT 2009,NO_QUERY,kellz_bellz,I think I am getting sick 

0,2325950023,Thu Jun 25 06:19:25 PDT 2009,NO_QUERY,NatalieStanford,"hoping the lab yeast undergoes some kind of miraculous growth spurt in the next two hours, otherwise no pub science for me "

0,2325950311,Thu Jun 25 06:19:27 PDT 2009,NO_QUERY,dequimi,Having a crappy morning so far 

0,2325950588,Thu Jun 25 06:19:28 PDT 2009,NO_QUERY,tavianago,feels very down rn 

0,2325951187,Thu Jun 25 06:19:32 PDT 2009,NO_QUERY,itsprettyokay,why can I not seem to get up/get to work on time?    it upsets me.

0,2325951323,Thu Jun 25 06:19:32 PDT 2009,NO_QUERY,AyeshaZainal,http://twitpic.com/8d9rg - I am going to miss this view 

0,2325951409,Thu Jun 25 06:19:33 PDT 2009,NO_QUERY,jadedwish,"Wtf, I must be really ugly or funny looking because I can't make any friends here my own age.  self-esteem -10"

0,2325952180,Thu Jun 25 06:19:38 PDT 2009,NO_QUERY,sandee79,@Emily0309 yeah   definitely not the right time   if it were I would take him in a heartbeat. He's white but from his collar up is brown

0,2325952238,Thu Jun 25 06:19:38 PDT 2009,NO_QUERY,kristinamc07,just woke up and i dont kno why im up this early...work today from 1 to 5 boo 

0,2325952279,Thu Jun 25 06:19:38 PDT 2009,NO_QUERY,Sambo18x,don't know how many pain killers i've took today but my sore head and throat won't budge 

0,2325952285,Thu Jun 25 06:19:38 PDT 2009,NO_QUERY,KartyBe,@sxxxh I want coffee too  Imma go tomorrow. Omg I wanna go to that Booklovers place in Canno on Albany Hwy. I LOVE books! Coincidence??

0,2325952526,Thu Jun 25 06:19:40 PDT 2009,NO_QUERY,m00ny,i have to wait till saterday to watch trancformers cuz it alredy started and the next show is at 5 and ends 9 

0,2325952787,Thu Jun 25 06:19:41 PDT 2009,NO_QUERY,mattambar,Working it !!!!!!!! Time of departure not sure 

0,2325952975,Thu Jun 25 06:19:42 PDT 2009,NO_QUERY,ontheflypr,@brooklynbabs Miss you too  LOOOOOVVVE the pic!!! Super HOT!!!

0,2325953124,Thu Jun 25 06:19:43 PDT 2009,NO_QUERY,BundlesMcGee,"Good morning. My rash is down to a category 3. So, we're making progress. It's going to be pretty hot today. I hate wearing sun screen. "

0,2325953468,Thu Jun 25 06:19:46 PDT 2009,NO_QUERY,stephiedoodle,Getting ready to go to class and learn some perms 

0,2325953663,Thu Jun 25 06:19:47 PDT 2009,NO_QUERY,RoofInfo,@ematty I did not have the man controller. Had to watch Lou Diamond take the jungle crown. 

0,2325953679,Thu Jun 25 06:19:47 PDT 2009,NO_QUERY,Katonym,@Myasis_Dragon these are street-wise house-mice! urban little shits! they are clever  traps used to work now they have got wise!

