sentiment,userid,date,query,userId,text0,1795846121,Thu May 14 08:28:04 PDT 2009,NO_QUERY,thismodernpanda,@melovemakeup aw no  hope you get them soon!  will try moisturizser next time i think. i'm so pale :|

0,1795846136,Thu May 14 08:28:05 PDT 2009,NO_QUERY,aHbby,Just had to sign with mr dunlap on all of the refunded senior ads. Fail.  

0,1795846384,Thu May 14 08:28:07 PDT 2009,NO_QUERY,jbmcdlts,And the tickets are only �13 and there is still some left :O I wanna go sooo bad!! 

0,1795846621,Thu May 14 08:28:08 PDT 2009,NO_QUERY,songbookbaby,@JaYdOtHollA Me never...I'll walk back to my time out corner and continue to eat Elmer's glue and rub it in my hands just to peel it off 

0,1795846961,Thu May 14 08:28:10 PDT 2009,NO_QUERY,amberharkins,"taking sweetie boy to the drs - thinkin bout my brother, thought I'd see him Sun before he left for the army but they took him early "

0,1795847141,Thu May 14 08:28:10 PDT 2009,NO_QUERY,divokc,@Kimberley__ ...I kinda thought it was dumb!  

0,1795847608,Thu May 14 08:28:13 PDT 2009,NO_QUERY,TheWineWhore,@1WineDude @DavidMcDuff Google is hosed!  

0,1795847811,Thu May 14 08:28:14 PDT 2009,NO_QUERY,AMYADAMS11,Feel like someone is playing bongo's on my head  took painkillers and a banana an hour a go but no luck!

0,1795847950,Thu May 14 08:28:15 PDT 2009,NO_QUERY,The_real_kimmm, promise not cried YET no promises tho !!! i wish everyone the best  &lt;&lt; that btw wasnt a final good bye xx

0,1795848463,Thu May 14 08:28:18 PDT 2009,NO_QUERY,Datdymefyne,I just want to curl up in my covers and go to sleep.  class is out..now off to intern at court!

0,1795848497,Thu May 14 08:28:18 PDT 2009,NO_QUERY,FoxlairSolitare,"@Julieannex oh no! its my 1 day off! grrr, of course that would happen "

0,1795848884,Thu May 14 08:28:20 PDT 2009,NO_QUERY,lillyelizabeth,Have Heart is breaking up wtf 

0,1795849185,Thu May 14 08:28:22 PDT 2009,NO_QUERY,trippinma,@iitzfresh but damn dawl I was tryna surprise you with some uh extra goodies on it 

0,1795849280,Thu May 14 08:28:23 PDT 2009,NO_QUERY,loveandbooze,@faffypants sorry to hear that  thats really horrible. My boyfriends situation is a little different. He wants nothing more than to be in

0,1795849829,Thu May 14 08:28:26 PDT 2009,NO_QUERY,danipickles,Dani has been diagnosed with shingles and will require antibiotics every 8 hrs for next 5 days. 

0,1795849874,Thu May 14 08:28:27 PDT 2009,NO_QUERY,Sparrowsrflying,"Trying to do a GIS on iPhone, google not loading "

0,1795849876,Thu May 14 08:28:27 PDT 2009,NO_QUERY,garlicdog,"I wonder if M&amp;S at Kings Cross is closed for good, no Percy Pigs "

0,1795849917,Thu May 14 08:28:27 PDT 2009,NO_QUERY,Karanikaa,"I love walking my doggie, Suzie! Although it's a bit chilly today   A x"

0,1795849965,Thu May 14 08:28:27 PDT 2009,NO_QUERY,ktfry246,Very excited that greys is on tonight. Not so happy that its it for the season 

0,1795850109,Thu May 14 08:28:28 PDT 2009,NO_QUERY,jabberjim,Why would i d-load an app called the &quot;Moron Test&quot;... its inevitable it will label me a moron 

0,1795850114,Thu May 14 08:28:28 PDT 2009,NO_QUERY,daisymorgan,"Got may puppy back, she is almost bald "

0,1795850355,Thu May 14 08:28:30 PDT 2009,NO_QUERY,bencossette,Day off.. still gotta go in and get my check 

0,1795850360,Thu May 14 08:28:30 PDT 2009,NO_QUERY,Shoniepops,"They should make DLC longer, I finshed the new Fable 2 DLC the same day it was out "

0,1795850382,Thu May 14 08:28:30 PDT 2009,NO_QUERY,t7bfg,Dealing with a migraine this morning....It's rainy and dreary here.....What a yucky day!!! 

0,1795850586,Thu May 14 08:28:31 PDT 2009,NO_QUERY,misscourtneyjoy,@deckerm i wont see you before i leave today... 

0,1795850663,Thu May 14 08:28:32 PDT 2009,NO_QUERY,loveandbooze,@faffypants his daughters life.  she is being difficult for no reason.  there are so many dead beat dads and he doesnt want to be 1 of em

0,1795850748,Thu May 14 08:28:33 PDT 2009,NO_QUERY,nikkijanay,Really do NOT feel like being at work... the man always be bringing me down  Text me if ya got it..

0,1795851113,Thu May 14 08:28:34 PDT 2009,NO_QUERY,yuanjilong,"I don't like farewell, that's why I always reject to watch the final season of FRIENDS. "

0,1795851167,Thu May 14 08:28:35 PDT 2009,NO_QUERY,darlingnikki08,"@terrymyers I can't get into docs, trends or gmail "

0,1795851579,Thu May 14 08:28:37 PDT 2009,NO_QUERY,TraeIsaac,@missbrandii sry...still thursday... 

0,1795851825,Thu May 14 08:28:39 PDT 2009,NO_QUERY,sylviaabel,Is bored @ work 

0,1795851923,Thu May 14 08:28:39 PDT 2009,NO_QUERY,wowlew,isPlayer Has Died! Sorry 

0,1795852041,Thu May 14 08:28:40 PDT 2009,NO_QUERY,iknowspiffy,my baby pit got hurt. po bebe. 

0,1795852211,Thu May 14 08:28:41 PDT 2009,NO_QUERY,hookedonheat,Just woke up... can't believe I slept half my morning away!! 

0,1795852585,Thu May 14 08:28:43 PDT 2009,NO_QUERY,jordynmallory,@tswiftlover13 aww I hope you feel better! I'm doing good... It's raining here  I really need the sunshine! I'm about to leave to go watch

0,1795852800,Thu May 14 08:28:45 PDT 2009,NO_QUERY,optimusgene,to collect the laptops so you can imagine how well that is going over.  Today sucks!

0,1795853157,Thu May 14 08:28:47 PDT 2009,NO_QUERY,lcssings,"Owowow my eye hurts and is all red, but I can't take out my contacts or I won't be able to see! 3 hours of school left till I can go home "

0,1795853392,Thu May 14 08:28:48 PDT 2009,NO_QUERY,TickleVPink,Kitchen is filled with carbo-licious treats and I can't enjoy any of it 

0,1795853743,Thu May 14 08:28:51 PDT 2009,NO_QUERY,NiksieThePixie,@_JAILBAIT LOL a cloggie as an ex cool ...but ex fiance?? ohhh thats uhmm not good news 

0,1795853985,Thu May 14 08:28:52 PDT 2009,NO_QUERY,jessicanfinley,Can't log into twitter today... 

0,1795854267,Thu May 14 08:28:54 PDT 2009,NO_QUERY,Bambi429,"@sage_in_spain aw that's rough  Working from home is a nice thing - I've been a work at home mom for the past year, it's nice!"

0,1795854379,Thu May 14 08:28:55 PDT 2009,NO_QUERY,Edamr,"@adammurlewski I guess, but still, a hint...it's unfair beyond belief  - I bet - nothing changes. It was meant to happen."

0,1795854518,Thu May 14 08:28:56 PDT 2009,NO_QUERY,SenoritaRegina,"it's raining and i just wanna sleep ALL day, but i can't, cause i gots a job. "

0,1795854521,Thu May 14 08:28:56 PDT 2009,NO_QUERY,jessalldo,needs to go revise for the psychology exam tomorrow 

0,1795854864,Thu May 14 08:28:58 PDT 2009,NO_QUERY,bckyfsh1,Think it is safe to say that the cysts are attacking my ovaries again 

0,1795854939,Thu May 14 08:28:58 PDT 2009,NO_QUERY,geerayce,@tequedasotevas aw I'm booked for saturday already  but I'll let you know.

0,1795855104,Thu May 14 08:28:59 PDT 2009,NO_QUERY,cguanche,@NBomb Too bad you're playing a game I don't have. 

0,1795855598,Thu May 14 08:29:02 PDT 2009,NO_QUERY,cjibo,hrm may need to rethink using google docs to host the images for my blog.  All of my content won't load 

0,1795855806,Thu May 14 08:29:03 PDT 2009,NO_QUERY,dzydzilelya,"@bloodriot aww, pity.  Gonna be on tomorrow though?"

0,1795855950,Thu May 14 08:29:04 PDT 2009,NO_QUERY,hellocharly,realised today i am unbelievably bad at arm wrestles 

0,1795856481,Thu May 14 08:29:08 PDT 2009,NO_QUERY,kristiluv797,wut the... is google / gmail down for anyone?? its not loading for me 

0,1795856622,Thu May 14 08:29:09 PDT 2009,NO_QUERY,bhumika_b,is sad.  m i over reacting?

0,1795856673,Thu May 14 08:29:09 PDT 2009,NO_QUERY,TrishaVanHouten,"@diraheythere dira im really really sorry my big bro just ruined my dvds collection,he took chuck and bring it to his home "

0,1795856700,Thu May 14 08:29:09 PDT 2009,NO_QUERY,14aviran,- Today I made my own coffee.....  now I am going to starbucks 

0,1795856812,Thu May 14 08:29:10 PDT 2009,NO_QUERY,mizrik,"@MissJuice oh yeah, didn't get to hug you at #IDM... "

0,1795856840,Thu May 14 08:29:10 PDT 2009,NO_QUERY,anotherstory,I forgot my Klean Kanteen at home 

0,1795856946,Thu May 14 08:29:10 PDT 2009,NO_QUERY,kristiluv112,wut the... is google / gmail down for anyone?? its not loading for me 

0,1795856955,Thu May 14 08:29:10 PDT 2009,NO_QUERY,indiefern,"At my bed, i don't know him anymore  maybe lo perdimos"

0,1795857137,Thu May 14 08:29:11 PDT 2009,NO_QUERY,hillary80,@Awapy I miss you too!  This place is definitely less fun without you.  And I don't even get to run into you at the gym anymore 

0,1795857271,Thu May 14 08:29:12 PDT 2009,NO_QUERY,IrynnePadua,I didnt get my season tickets... I'm so sad 

0,1795857326,Thu May 14 08:29:13 PDT 2009,NO_QUERY,rachel_simmo,"@James_Rock I love #Hayfestival, my bank account doesn't though "

0,1795857514,Thu May 14 08:29:14 PDT 2009,NO_QUERY,kristiluv263,wut the... is google / gmail down for anyone?? its not loading for me 

0,1795857566,Thu May 14 08:29:14 PDT 2009,NO_QUERY,tinydaisy,I'm SOOO fidgety!! WHY?? How am I to sleep 

0,1795857801,Thu May 14 08:29:16 PDT 2009,NO_QUERY,Sherylpz,Omg  i didn't even update tday. I stayed home to watch EU  going sentosa tmr &lt;3

0,1795857947,Thu May 14 08:29:16 PDT 2009,NO_QUERY,Sala_Sorous,i miss diego  i hate being stuck at home.

0,1795858109,Thu May 14 08:29:17 PDT 2009,NO_QUERY,kristiluv616,wut the... is google / gmail down for anyone?? its not loading for me 

0,1795858152,Thu May 14 08:29:18 PDT 2009,NO_QUERY,RoachHater,I hate side effects  i didnt have a headache or drymouth before  [becca #1]

0,1795858499,Thu May 14 08:29:20 PDT 2009,NO_QUERY,garywarren,@MadameAllen Ohh yeah I've seen all of your pics on Facebook! looks like you had well loads of fun! Jealous  x

0,1795858919,Thu May 14 08:29:22 PDT 2009,NO_QUERY,steveeq,so tired-! english is going to suck! 

0,1795858970,Thu May 14 08:29:22 PDT 2009,NO_QUERY,racstar,"@IsabellaPadilla I miss you too, baby "

0,1795945630,Thu May 14 08:37:55 PDT 2009,NO_QUERY,ms_sugakane,I not feel too well today. 

0,1795945638,Thu May 14 08:37:55 PDT 2009,NO_QUERY,HellYeahHolcomb,I don't know what to do tomorrow.  People will get angry at me either way.

0,1795945664,Thu May 14 08:37:55 PDT 2009,NO_QUERY,samanthahensch,"WFH today, seeing a doc at 10:45. eye is not better "

0,1795945760,Thu May 14 08:37:56 PDT 2009,NO_QUERY,brittanytastic,@frickxx @joshuwaa everyone is feeling poopy today!  i'm in such a happy mood haha

0,1795945872,Thu May 14 08:37:57 PDT 2009,NO_QUERY,jacktownlane,"@tonyfrazier I won't see 8.5 for another year at least (testing, managed upgrades, etc). REALLY wish I had work email on my phone. "

0,1795946309,Thu May 14 08:38:00 PDT 2009,NO_QUERY,iyazialcita,@inlovewithsteff I told you to come with me! 

0,1795946452,Thu May 14 08:38:01 PDT 2009,NO_QUERY,Greystocks,On way to pick up new motor  last chance to drive the mx5 

0,1795946506,Thu May 14 08:38:01 PDT 2009,NO_QUERY,Texskiss,Why can I not open any links on Twitter??  

0,1795946659,Thu May 14 08:38:02 PDT 2009,NO_QUERY,karenthecrasian,happy birthday @smylechristina love you best! sorry i can't be at dinner tonight 

0,1795947218,Thu May 14 08:38:05 PDT 2009,NO_QUERY,brandond0209,Well work is SLOW!!!  The rain is gone.   sad day!

0,1795947449,Thu May 14 08:38:07 PDT 2009,NO_QUERY,cjscott,@laurenkinsey Booooo for sucky day jobs   **hugs**

0,1795947838,Thu May 14 08:38:09 PDT 2009,NO_QUERY,Paradigmsl,"LOL, Did you read my blog? "

0,1795947868,Thu May 14 08:38:09 PDT 2009,NO_QUERY,LisaLayne,Would love to go to the Strawberry Festival but doubt it would help me get my pants buttoned... 

0,1795947892,Thu May 14 08:38:09 PDT 2009,NO_QUERY,Jonnykreider,Going to take the drivers test and I don't feel good at all!!!! 

0,1795947968,Thu May 14 08:38:10 PDT 2009,NO_QUERY,MSURabbott,Times like this when relying on webmail (gmail) sucks.. NEED access 

0,1795948195,Thu May 14 08:38:11 PDT 2009,NO_QUERY,truzone,I'm in school and it sucks 

0,1795948205,Thu May 14 08:38:11 PDT 2009,NO_QUERY,likeyellowlemon,"@Gem_92 your exams are all over?!? NO FAIR! Mine don't finish till June  the week AFTER WTK, Cobra and NFG are all in the UK...so shit!"

0,1795948309,Thu May 14 08:38:12 PDT 2009,NO_QUERY,garrettfrazier,"Is Google down for iPhone? No email, search or Reader "

0,1795948325,Thu May 14 08:38:12 PDT 2009,NO_QUERY,Lu_Lu77,"@jordanm11 well,that just sucks an blows lol i had 2 sit through a 2 hour exam,i finishd it in half an hour... 1 1/2 hours of doin nothin "

0,1795948568,Thu May 14 08:38:13 PDT 2009,NO_QUERY,stuartsharpe,Just saw my TweetCloud. I feel I must apologise to everyone...  http://is.gd/zQB2

0,1795948660,Thu May 14 08:38:14 PDT 2009,NO_QUERY,lilacgirl,Working until close tonight. I'm going to miss the Hell's Kitchen finale...nooo 

0,1795948803,Thu May 14 08:38:15 PDT 2009,NO_QUERY,stupidsucks,I really need to finish my blog redesign! Unfortunately I won't be able to do it for at least a week. 

0,1795949170,Thu May 14 08:38:17 PDT 2009,NO_QUERY,annieexo,"home, not feeling well ! "

0,1795949221,Thu May 14 08:38:18 PDT 2009,NO_QUERY,kenoakes,Housebound at wrong time 

0,1795949522,Thu May 14 08:38:19 PDT 2009,NO_QUERY,ArabelaLai,I miss you too 

0,1795949671,Thu May 14 08:38:20 PDT 2009,NO_QUERY,mello32,"@INFECTEDPB503 Haha, don't worry about it.  My PS3 wouldn't update to 2.76.   I told Desz when I met him awhile back I'd get in on one!"

0,1795950124,Thu May 14 08:38:23 PDT 2009,NO_QUERY,dbrindza,Back from California and not happy about it..  come home to cold weather.. summer where are you??

0,1795950133,Thu May 14 08:38:23 PDT 2009,NO_QUERY,Kimberly781,@aplusk what a shame the beautiful car 

0,1795950196,Thu May 14 08:38:23 PDT 2009,NO_QUERY,LaurenAlien,Psychology exam tomorrow ergh  time to fail!

0,1795950424,Thu May 14 08:38:25 PDT 2009,NO_QUERY,CubanaLAF,@Inkognegro Yes. I feel so disconnected without Google and Gmail.  @steelergurl

0,1795950451,Thu May 14 08:38:25 PDT 2009,NO_QUERY,alanwardle,"FUCK!!!! Size? online, had the Air Yeezy's in but i'm too late. Fuck, fuck, fuck  http://tinyurl.com/r8feuz"

0,1795950670,Thu May 14 08:38:26 PDT 2009,NO_QUERY,xxsophie24xx,has a spanish exam 2moz!! 

0,1795951084,Thu May 14 08:38:29 PDT 2009,NO_QUERY,KatieBlockley,@JBFutureboy I missed it  busted need to do a reunion tour. That would make my year. No joke.

0,1795951458,Thu May 14 08:38:31 PDT 2009,NO_QUERY,paolocastillo,Just finished the bass track and I must say that I'm very unhappy with how unlively it sounds  I hope it'll get better after the guitars.

0,1795951719,Thu May 14 08:38:32 PDT 2009,NO_QUERY,ewdi,Google Apps is down - and ours is Enterprise edition 

0,1795951784,Thu May 14 08:38:33 PDT 2009,NO_QUERY,Lisa__T,just wanna go home and cuddle with my little bean who has her first cold ever 

0,1795952051,Thu May 14 08:38:34 PDT 2009,NO_QUERY,AlexxAvalanche,Bored at home with a bum ankle 

0,1795952206,Thu May 14 08:38:35 PDT 2009,NO_QUERY,JustheSidekick,I can't get my laptop to start up  I guess that's what I get for using a laptopi bought off of ebay for so long.

0,1795952220,Thu May 14 08:38:35 PDT 2009,NO_QUERY,hylz,@shutupjami I don't know what else to pick for a picture 

0,1795952833,Thu May 14 08:38:39 PDT 2009,NO_QUERY,IAMHED,bad hair day 

0,1795952835,Thu May 14 08:38:39 PDT 2009,NO_QUERY,eliagreenluv,@christina1227 nooo I don't  awh you gotta tell me if they play!

0,1795953070,Thu May 14 08:38:40 PDT 2009,NO_QUERY,ElsieLou,@Pinkribbonwendi You'll be fine!  Sorry that you have booboos.  

0,1795953440,Thu May 14 08:38:42 PDT 2009,NO_QUERY,ChenthilMohan,is pissed !! The flight is delayed by 30 mins... Now I'l reach Mumbai after 12am 

0,1795953972,Thu May 14 08:38:45 PDT 2009,NO_QUERY,tom_cho,"@missyjack: Link doesn't work  &quot;*Not Found*... URL was not found on this server. Additionally, a 404 Not Found error was encountered...&quot;"

0,1795954130,Thu May 14 08:38:46 PDT 2009,NO_QUERY,briannabby,It's lunchtime but i have no money so that means no food 

0,1795954132,Thu May 14 08:38:46 PDT 2009,NO_QUERY,mnstrsnmnchkns,@that_kat awww.. you should have said sooner ! Just ordered some   http://bit.ly/RBGia

0,1795954404,Thu May 14 08:38:48 PDT 2009,NO_QUERY,ChubbyBanana,"@ian_cummings not bad. Not to be a debbie downer, but I'm not a fan of the large font used. "

0,1795954944,Thu May 14 08:38:51 PDT 2009,NO_QUERY,kaseygrenon,"sometimes you just have those, &quot;I feel shity&quot; kind of days.... "

0,1795955409,Thu May 14 08:38:54 PDT 2009,NO_QUERY,sarebearxx8,Gave katy a devil tail as a last 9383211 decision. Tree has been chopped  but idc!

0,1795955506,Thu May 14 08:38:55 PDT 2009,NO_QUERY,princezztia,@TTSTylerNelson so mad i missed you today on my dad's show  i was just watching rush hr 3 the other night and thought of u! miss u lots!

0,1795955656,Thu May 14 08:38:55 PDT 2009,NO_QUERY,QinetiqNRG,"Twin worked overnight, so i am eating lunch alone today... "

0,1795955715,Thu May 14 08:38:56 PDT 2009,NO_QUERY,kirinqueen,"aahh, no, Google apps still no worky.  And SugarStats is super slow, too."

0,1795955837,Thu May 14 08:38:56 PDT 2009,NO_QUERY,mishababy,@mrskutcher - I am so sad. I completely missed ur twitter about the dingdongditch in downtown ATL. I would've totally been there! 

0,1795955853,Thu May 14 08:38:56 PDT 2009,NO_QUERY,tekidiaz,"@danieleazar i miss you too  so dani, i think, san beda alabangers na."

0,1795956008,Thu May 14 08:38:57 PDT 2009,NO_QUERY,EmailKarma,3.5 Billion Email addresses for sale only $3000 - WOWsounds like a great offer... This is the type of spam I get 

0,1795956443,Thu May 14 08:39:00 PDT 2009,NO_QUERY,MaggieS42,@SeanBartley  You look sad 

0,1795956511,Thu May 14 08:39:00 PDT 2009,NO_QUERY,AvraGolden,writing my writing requirement  at least I'm in sunny SB!

0,1795956712,Thu May 14 08:39:02 PDT 2009,NO_QUERY,cascandar,@Johangsl .. i know.. she's not as passionate about it like me.. 

0,1795956743,Thu May 14 08:39:02 PDT 2009,NO_QUERY,SophieXOXOX,depressed. have to tidy my room  gonna take ages x

0,1795957111,Thu May 14 08:39:04 PDT 2009,NO_QUERY,NickNormality,Listening to all the things she said  where is paige?

0,1795957831,Thu May 14 08:39:08 PDT 2009,NO_QUERY,tygerstyle,"I spent the last 2 hours printing about 400 sheets, folding them in half, and stapling them. Not my idea of being productive. "

0,1795957913,Thu May 14 08:39:09 PDT 2009,NO_QUERY,jamimjon,@Missyshianne I've been slackin  pms-y and all that jazz ya know

0,1795957915,Thu May 14 08:39:09 PDT 2009,NO_QUERY,lastyearswishes,wtf is with google/gmail this morning? theyre not working for me. 

0,1795958403,Thu May 14 08:39:11 PDT 2009,NO_QUERY,JoReynolds55,"@RogtheDodge79 Don't start me off, I have stopped listening to the news when it is on "

0,1795958526,Thu May 14 08:39:12 PDT 2009,NO_QUERY,maybeme,"@bigwormy  I would love a painting but alas,am broke "

0,1795958643,Thu May 14 08:39:13 PDT 2009,NO_QUERY,FadeToBright,@margesona I tend to lose flash drives due to the plastic piece breaking off my keychain 

0,1795958873,Thu May 14 08:39:14 PDT 2009,NO_QUERY,Alexandra324,@heidimontag I was his VERY FIRST MESSAGE ON THAT....and he never answered me  boo!

0,1795959065,Thu May 14 08:39:16 PDT 2009,NO_QUERY,RebeccaKaz,"@djfog86 aww, isn't that the way it always happens with your fantasy team? "

0,1795959371,Thu May 14 08:39:17 PDT 2009,NO_QUERY,MobiMom,"@ThingsMomsLike Oooh, that's ugly.  Sounds like he's learning a lot, none of it good. "

0,1795959549,Thu May 14 08:39:18 PDT 2009,NO_QUERY,stu_art_ist,Damon and Debbie - oh how she cried when Damon got stabbed... now a great nurse in Casualty... though a bit to late for Damon 

0,1795959845,Thu May 14 08:39:20 PDT 2009,NO_QUERY,Synesthesia27,@MsCareerGirl You're not alone...mine's not working either  

0,1795960461,Thu May 14 08:39:24 PDT 2009,NO_QUERY,StJeanie,@stepheneyre ahaha fair enough. I have no more #crumpets in my house.  Gonna have to go to tescos and get some more.

0,1795960705,Thu May 14 08:39:25 PDT 2009,NO_QUERY,ikanov,"Do things with nds(still playing sushi academy)haha, while I'm waiting call from ay.. Miss him badly "

0,1796164097,Thu May 14 08:59:17 PDT 2009,NO_QUERY,ladollyvita,HELP THERE'S A SPIDER  + 600th update lol

0,1796164559,Thu May 14 08:59:20 PDT 2009,NO_QUERY,trickijen,@NotWithJesse I AM the next one due out for a visit. We have debt to pay off too tho  so dunno when I'll get to. But I AM NEXT!!

0,1796164742,Thu May 14 08:59:21 PDT 2009,NO_QUERY,rachmurrayX,@nadie20  i could probally find money... but i cant go to london on my won 

0,1796164763,Thu May 14 08:59:21 PDT 2009,NO_QUERY,SoIceyBreeZ,Wtf i got a leak n my ceiling!  -Zymir Eden

0,1796165061,Thu May 14 08:59:23 PDT 2009,NO_QUERY,kanosai,Lost summary: I don't want to wait for season 6 

0,1796165330,Thu May 14 08:59:24 PDT 2009,NO_QUERY,jnystromdesign,Heading to Anglais for meeting up some fellow geeks. Battery's dead on my iphone. 

0,1796165415,Thu May 14 08:59:25 PDT 2009,NO_QUERY,MistressBonnie,OMG I just wrecked my car 

0,1796165581,Thu May 14 08:59:26 PDT 2009,NO_QUERY,allixsenos,@digitaltoast i can't even open the appsstatus page 

0,1796165949,Thu May 14 08:59:28 PDT 2009,NO_QUERY,_CandyMandy_,got them crispy dogs for lunch =D tha later tha lunch tha faster tha day goes by...wish i was layin next to my love right now 

0,1796166106,Thu May 14 08:59:29 PDT 2009,NO_QUERY,jamik_hhp,My night was okay. They made me do p90!! lol it felt good. Aiden didn't let me get a gr8 sleep &amp; I woke up w/ a headache!! 

0,1796166264,Thu May 14 08:59:30 PDT 2009,NO_QUERY,Julesinglis,Another crap dy over with 2 more to go this wk 

0,1796166371,Thu May 14 08:59:30 PDT 2009,NO_QUERY,jaimegrey,"My niece graduated from preschool last night....so cute, I wish I could have been there. "

0,1796166499,Thu May 14 08:59:31 PDT 2009,NO_QUERY,Moonbeamdisco,"@mossyrants @lucypaw I'd like some sexy dreams too, but all I'm having is nightmares about the Science center "

0,1796166747,Thu May 14 08:59:33 PDT 2009,NO_QUERY,jessieberry,"@heroicfools I didn't get mcdonalds! I was chillen at home and he came home with it, so I had to eat it  but I've been good since then"

0,1796167044,Thu May 14 08:59:35 PDT 2009,NO_QUERY,nilswesterlund,new friend! yahoo.com now that google let me down 

0,1796167390,Thu May 14 08:59:37 PDT 2009,NO_QUERY,aalthouse,#Google seems to be running on about 1/2 a cylinder today... 

0,1796167967,Thu May 14 08:59:40 PDT 2009,NO_QUERY,slornie,is remembering two years 

0,1796168214,Thu May 14 08:59:41 PDT 2009,NO_QUERY,BCon87,Learning guitar...my fingers hurt!! 

0,1796168323,Thu May 14 08:59:42 PDT 2009,NO_QUERY,babyregal,Scratched my MacBook this morning... What a crappy way to start my day. 

0,1796168339,Thu May 14 08:59:42 PDT 2009,NO_QUERY,joereno,I haven't slept yet 

0,1796168426,Thu May 14 08:59:43 PDT 2009,NO_QUERY,margauxargo,@luisaramos please post the pictures on your birthday kasi sa camera ko wala ako dun  PLEASE!

0,1796168473,Thu May 14 08:59:43 PDT 2009,NO_QUERY,cassandROAR,"@tommcfly i hate deal or no deal at the moment, clowns "

0,1796168585,Thu May 14 08:59:44 PDT 2009,NO_QUERY,sufiaa,"ahhh, i'm so achey "

0,1796168635,Thu May 14 08:59:44 PDT 2009,NO_QUERY,Monofader,.... To ....Early! I'm so sleepy! Dang you birds!!!! Stop singing!!! 

0,1796168675,Thu May 14 08:59:45 PDT 2009,NO_QUERY,niviking,"@FaeriBex Damn, damn hazard perception  You'll get it next time."

0,1796169346,Thu May 14 08:59:49 PDT 2009,NO_QUERY,srncmm4709,Just woke up! Don't wanna work!!! 

0,1796169616,Thu May 14 08:59:50 PDT 2009,NO_QUERY,msinvisible,arghhh the forum is down 

0,1796169850,Thu May 14 08:59:52 PDT 2009,NO_QUERY,FuchsiaStiletto,@mrmidasonline lol &gt; is a maths formula ting meaning more than so twitter&gt;facebook means Twit is better. Sorry 

0,1796169989,Thu May 14 08:59:53 PDT 2009,NO_QUERY,MaraJonas,theres NOTHING to eat in this houseee. 

0,1796170057,Thu May 14 08:59:53 PDT 2009,NO_QUERY,brajana,"One of my guildmates got hacked   He's one of our main tanks too, I feel so bad! He went away for a couple days and came back to nothing!"

0,1796170253,Thu May 14 08:59:54 PDT 2009,NO_QUERY,margretcalderon,Goodbye Danny Gokey  I still think you're the best. http://plurk.com/p/tt320

0,1796170353,Thu May 14 08:59:55 PDT 2009,NO_QUERY,marianneluu,@fer319 i'm bored  i have to work forever today. and it's beautiful today  meow meow. my parents won't let me get a cat. boo.

0,1796170398,Thu May 14 08:59:55 PDT 2009,NO_QUERY,justsel,"@oceanphoenix haiz, kh? th�n anh  ? th?  � kqu? ph?ng v?n ch?a :-? ch? th?y n�i j"

0,1796170461,Thu May 14 08:59:56 PDT 2009,NO_QUERY,neonbutterfly1,"@itschristablack Yeah, Lost was definitely a play on emotions.  And now what's going to happen????  I don't want to wait,   lol"

0,1796171063,Thu May 14 08:59:59 PDT 2009,NO_QUERY,already_used,seems like google and gmail are dead. do not like! 

0,1796171142,Thu May 14 08:59:59 PDT 2009,NO_QUERY,incitatus4,Gah... I can't believe I so woefully and inadvertantly spoiled lost.  http://myloc.me/RsF

0,1796171471,Thu May 14 09:00:02 PDT 2009,NO_QUERY,LegendaryWriter,"@TLWH  they are not back!    if u arent following someone and they send u a reply, u cant see it! sadness"

0,1796171717,Thu May 14 09:00:03 PDT 2009,NO_QUERY,OMFGItsJace,youtube is not working for me today. 

0,1796172225,Thu May 14 09:00:05 PDT 2009,NO_QUERY,JessMeurer,wishes the sun would come out 

