0,2265877228,Sun Jun 21 07:29:05 PDT 2009,NO_QUERY,isdead,I'm planning to buy a Dell Mini9 on next payday for the iPhone application development... poor me 

0,2265877337,Sun Jun 21 07:29:06 PDT 2009,NO_QUERY,venesssy,is is back after 1 day of not checking her accounts (karma down.so saad)  http://plurk.com/p/12ptlc

0,2265878007,Sun Jun 21 07:29:10 PDT 2009,NO_QUERY,stephetchison,Up taking mom to work then I have to go to work  only for 5 hours though not to bad   ~*stephanie*~

0,2265878300,Sun Jun 21 07:29:12 PDT 2009,NO_QUERY,beznee,"@vickytors Boooooo being ill sucks  Haha yes I did and no we didn't see jon j, which upset me A LOT."

0,2265878411,Sun Jun 21 07:29:13 PDT 2009,NO_QUERY,samconductor,work till 7 

0,2265878521,Sun Jun 21 07:29:14 PDT 2009,NO_QUERY,leeluzzi,@kmoore238 lol not right now... but later if i dont finish assignments... sadly... yes  but they said i'd be confused for 3 months...

0,2265878673,Sun Jun 21 07:29:15 PDT 2009,NO_QUERY,revybbcholic,"@theodorainish yes they are, I've tried to not to car or even tink about him, but idk why, gue keinget terus sama dia.. "

0,2265878782,Sun Jun 21 07:29:15 PDT 2009,NO_QUERY,MeeJong,This morning my daughter asked me if I hate my life.  

0,2265878808,Sun Jun 21 07:29:16 PDT 2009,NO_QUERY,dandan_2300,@peterfacinelli That was so cute!... not fathers day in Australia 

0,2265878856,Sun Jun 21 07:29:16 PDT 2009,NO_QUERY,shamzleroc,@nunnie20 stoppppp!! You're just making me miss New York even more! 

0,2265878869,Sun Jun 21 07:29:16 PDT 2009,NO_QUERY,VINYL_SHAKER,pretty shit party last night  my legs are covered in nettle stings and cuts!

0,2265878904,Sun Jun 21 07:29:16 PDT 2009,NO_QUERY,ArcathWhitefall,Last can of jolt 

0,2265879088,Sun Jun 21 07:29:18 PDT 2009,NO_QUERY,x3Lovebug,@cookiedorksx3 Awws Whyy ? 

0,2265879163,Sun Jun 21 07:29:18 PDT 2009,NO_QUERY,LeRaySpeaks,Voting to lytle with @J3nn_Lee and Oriana for a fathers day breakfast. If feel I should be allowed to sleep in. Some how I can't do that 

0,2265879988,Sun Jun 21 07:29:24 PDT 2009,NO_QUERY,Peter760,I feel ill! Self induced hangover after a bottle of Morgans. 

0,2265880066,Sun Jun 21 07:29:25 PDT 2009,NO_QUERY,tgmcrox,@jordynbabylove awww poor nick  still luv him tho...lolz

0,2265880544,Sun Jun 21 07:29:28 PDT 2009,NO_QUERY,jff316,@ work  missing church praying for the service to go great move God!

0,2265880794,Sun Jun 21 07:29:30 PDT 2009,NO_QUERY,WarrenWhitlock,@AgingBackwards you can see me? I better brush my hair. 

0,2265880988,Sun Jun 21 07:29:31 PDT 2009,NO_QUERY,writeoutdoors,@Hawkbow Happy Father's Day Hawk! Sorry to hear about your tooth 

0,2265881167,Sun Jun 21 07:29:32 PDT 2009,NO_QUERY,deathrockk,Just woke up. I have to do my accounting assignment today. 

0,2265881702,Sun Jun 21 07:29:36 PDT 2009,NO_QUERY,ziiastarr,"Aw, Poor Mitchell Davis. "

0,2265882095,Sun Jun 21 07:29:39 PDT 2009,NO_QUERY,Torylove,"Ehhh  i am so sleepy i feel like i am about to collapse at work, i'm fighting to keep my eyes open."

0,2265882225,Sun Jun 21 07:29:39 PDT 2009,NO_QUERY,TheRealWilliam,Damnit.  No RockBox for me. 

0,2265882727,Sun Jun 21 07:29:43 PDT 2009,NO_QUERY,oohcarrera,i don't feel so good 

0,2265882885,Sun Jun 21 07:29:44 PDT 2009,NO_QUERY,miss_Tiary,Stayed up til 4am watching Rise of the Lykins and of course my phone rings and I'm up before eleven. Never get ANY sleep 

0,2265882933,Sun Jun 21 07:29:44 PDT 2009,NO_QUERY,blami,is experiencing some strange font problem with fresh firefox-3.5pre build 

0,2265883429,Sun Jun 21 07:29:48 PDT 2009,NO_QUERY,MontanaOne,@mmalkoff Hello from down on the ground WISHING I was up in the sky!  

0,2265883767,Sun Jun 21 07:29:51 PDT 2009,NO_QUERY,sidlefan8,ugh don't feel well today 

0,2265883780,Sun Jun 21 07:29:51 PDT 2009,NO_QUERY,allie_,Leaving Dallas today. 

0,2265884538,Sun Jun 21 07:29:56 PDT 2009,NO_QUERY,annehemmings,@Ali_Gardiner housework so sucks. &amp; nobody ever notices - unless u don't do it 

0,2265884991,Sun Jun 21 07:29:59 PDT 2009,NO_QUERY,prettyannoyed,@heyshanny Physically-- I feel horrible  Thanks for the good thoughts!!

0,2265885127,Sun Jun 21 07:30:00 PDT 2009,NO_QUERY,triciaayroso,Finishing assignments. 

0,2265885194,Sun Jun 21 07:30:01 PDT 2009,NO_QUERY,groupiness,"home, hopefully napping while my poor hubby goes to work for like 2 seconds "

0,2265885313,Sun Jun 21 07:30:01 PDT 2009,NO_QUERY,vintagepolka,@KylieAAM yea! omg! wish i could be there in Manila..  btw check this out. http://bit.ly/8bord

0,2265885684,Sun Jun 21 07:30:03 PDT 2009,NO_QUERY,UnicornBabii,Wanting some food  but cnt coz me cba to go downstairs and get something :L

0,2265885812,Sun Jun 21 07:30:04 PDT 2009,NO_QUERY,apizzagirl,I think overworking yesterday has made me sick today 

0,2265886070,Sun Jun 21 07:30:05 PDT 2009,NO_QUERY,anderssonmimmi,my head is hurting so bad. I feel sick  buuhh!

0,2265886149,Sun Jun 21 07:30:06 PDT 2009,NO_QUERY,Llamouy,Nobody wished me happy Father's Day yet 

0,2265886448,Sun Jun 21 07:30:07 PDT 2009,NO_QUERY,Hearthannah,@CreeperTheRobot hey creeper! Miss you tons. why haven't you talked to me? 

0,2265886927,Sun Jun 21 07:30:10 PDT 2009,NO_QUERY,aura83,:/  sometimes u're too rude.. with me.. I'm human.. remember it.. a human in love if u treat me like this u hurt right to my heart..please

0,2265887127,Sun Jun 21 07:30:11 PDT 2009,NO_QUERY,yoedelbarrio,"@startastic oh, where'd she get it from? "

0,2265887291,Sun Jun 21 07:30:12 PDT 2009,NO_QUERY,skeeter226,@juliegr: definitely will b some new ones.  Library  to print my boarding pass my printer is broke 

0,2265887380,Sun Jun 21 07:30:12 PDT 2009,NO_QUERY,rawrsaysdave,Crying at a Scrubs episode  -D.

0,2265887462,Sun Jun 21 07:30:13 PDT 2009,NO_QUERY,Mz_Ebo,Just left the cemetary visiting my dad...... Kinda sad 

0,2265890953,Sun Jun 21 07:30:35 PDT 2009,NO_QUERY,erictheking7,@Jason_Manford I really really miss the Trafford centre! 

0,2265891231,Sun Jun 21 07:30:37 PDT 2009,NO_QUERY,simsgalore,Completely Missed The #F1 

0,2265891615,Sun Jun 21 07:30:40 PDT 2009,NO_QUERY,maressaz,@_nuruljannah OMG please take some kind of medication! why does ur bronchitis act up during ur auditions?! shit!!!! 

0,2265891998,Sun Jun 21 07:30:43 PDT 2009,NO_QUERY,NickRoseway,at work  7am is to early.  work schedule next week is horrible! uh.later

0,2265892157,Sun Jun 21 07:30:44 PDT 2009,NO_QUERY,tuxv,Is feeling pretty down and doesn't want to tweet about #t20 

0,2265892340,Sun Jun 21 07:30:45 PDT 2009,NO_QUERY,Miss_Mandy_Moo,i can see your interview but not hear it 

0,2265892442,Sun Jun 21 07:30:45 PDT 2009,NO_QUERY,mixtisai,Wishes I could spend fathers day with my daddy 

0,2265892744,Sun Jun 21 07:30:48 PDT 2009,NO_QUERY,Rogem002,@thinbegin I just checked with my Localized apple and it's seems a little cheaper. Sorry 

0,2265892761,Sun Jun 21 07:30:48 PDT 2009,NO_QUERY,everbelle,needs to sleep early..duty 

0,2265893037,Sun Jun 21 07:30:50 PDT 2009,NO_QUERY,mustntgrumble,@lisa24270 This packet's better than the last (which I put down to experience) in Waitrose they're always fine. Son very disappointed 

0,2265893956,Sun Jun 21 07:30:55 PDT 2009,NO_QUERY,joelled93,"has just done one past paper, will do another in 5 mins "

0,2265893992,Sun Jun 21 07:30:56 PDT 2009,NO_QUERY,g3mini521,@vimarie you're forgetting... *sniff sniff* to say hi &amp; goodnight. i'm sad...  (not really... lol)

0,2265894393,Sun Jun 21 07:30:58 PDT 2009,NO_QUERY,piaarayna,i have a pain in the side of my stomach 

0,2265894819,Sun Jun 21 07:31:01 PDT 2009,NO_QUERY,Astaryth,"@CyndysZoo @Tara_R Too Bad for me horses can't come inside, so I end up spending plenty time sweating.They've needed rinsed most evenings "

0,2265894861,Sun Jun 21 07:31:01 PDT 2009,NO_QUERY,rubiepearl,its 10:31 PM. and im still up. chemistry and trigonometry are killing me! damn! 

0,2265894875,Sun Jun 21 07:31:02 PDT 2009,NO_QUERY,mikemadness,"Just woke up, and saying bye to everybody today before I leave to China on Monday morning "

0,2265895037,Sun Jun 21 07:31:03 PDT 2009,NO_QUERY,BarbFukuoka,@peterbalogh find a job... not my favorite plan  !

0,2265895055,Sun Jun 21 07:31:03 PDT 2009,NO_QUERY,rodolphoeck,so I forgot to install latex on my new machine 

0,2265895241,Sun Jun 21 07:31:04 PDT 2009,NO_QUERY,wizardry,i wish i could see my dad today  i have the best one in the world

0,2265895421,Sun Jun 21 07:31:05 PDT 2009,NO_QUERY,lysogenic,"@AndrewJParker Tibia or fibula? Either way, ouch  Get well soon Jenna &lt;3"

0,2265895973,Sun Jun 21 07:31:09 PDT 2009,NO_QUERY,Leap1523,@DonnieWahlberg  Happy Father's Day!! I hope you have a wonderful day!  I lost my dad 16 years ago. 

0,2265895984,Sun Jun 21 07:31:09 PDT 2009,NO_QUERY,SweetDarkDreams,anyway...I'm out to celebrate fathers day and then to utuado until tuesday  goodbye

0,2265896101,Sun Jun 21 07:31:09 PDT 2009,NO_QUERY,christinechapa,the 2 year old iphone suffered a deadly fall yesterday. RIP 

0,2265896157,Sun Jun 21 07:31:10 PDT 2009,NO_QUERY,JackehTresslah,I just had a really bad dream 

0,2265896585,Sun Jun 21 07:31:13 PDT 2009,NO_QUERY,Capitulino,helpiranelection.com failed to me 

0,2265897085,Sun Jun 21 07:31:16 PDT 2009,NO_QUERY,lilcaz10,has been told she might have glandila fever.......how did get that it sure puzzles me! 

0,2265897171,Sun Jun 21 07:31:17 PDT 2009,NO_QUERY,eldade,"Landed in Helsinki. My first time ever, looks beautiful from above. Unfortunately it's a brief 24 hour visit. "

0,2265897178,Sun Jun 21 07:31:17 PDT 2009,NO_QUERY,ptolemy_booth,I have a temporary phone now. Yay? @lilithselysium: noooooooooooo not bacon! 

0,2265897400,Sun Jun 21 07:31:18 PDT 2009,NO_QUERY,BlueNotes95,Grrr. Shopping on my own. Stoopid friends BBQ 

0,2265897575,Sun Jun 21 07:31:19 PDT 2009,NO_QUERY,lavilicious,"@SanamNaqvi Youre sucha bum bum! But who am I to talk really? I pretty much, sleep (maybe not as much as you) &amp; live off my 'rents too! "

0,2265898016,Sun Jun 21 07:31:22 PDT 2009,NO_QUERY,ADirtyDecember,I think this guy is super fly but i doubt he'll notice me...  oh well i still have my bff

0,2265898213,Sun Jun 21 07:31:24 PDT 2009,NO_QUERY,Miss_Mandy_Moo,@Dan88w i can see your interview but not hear it  xxx

0,2265898407,Sun Jun 21 07:31:26 PDT 2009,NO_QUERY,micgamer16,i want this car   damn my mate is so lucky to have it  http://twitpic.com/808lb

0,2265898627,Sun Jun 21 07:31:26 PDT 2009,NO_QUERY,Leap1523,@dannywood   Happy Father's Day!! I hope you have a wonderful day!  I lost my dad 16 years ago. 

0,2265898669,Sun Jun 21 07:31:27 PDT 2009,NO_QUERY,nadgahan,@alf101 no liveherenow yet 

0,2265898794,Sun Jun 21 07:31:28 PDT 2009,NO_QUERY,jgenender,@bdudney Excellent hike.  How was the weather on the west side?  It was cloudy and cold here 

0,2265898801,Sun Jun 21 07:31:28 PDT 2009,NO_QUERY,dianechia,@skyenat oh...  oh well it depends on my results then... and my ability to work it well. -.-

0,2265899300,Sun Jun 21 07:31:31 PDT 2009,NO_QUERY,Legion11,With the BBC would show the F1 in high def   

0,2265899477,Sun Jun 21 07:31:32 PDT 2009,NO_QUERY,samota,PACKING PACKING...  I DON'T WANT 2 LET GO... VERY SAD http://myloc.me/4QoC

0,2265899563,Sun Jun 21 07:31:33 PDT 2009,NO_QUERY,jazzedjoyce,Father's Day!  I hope all of you fathers have a great day.  I miss my father.  He has been gone for nine years 

0,2265899663,Sun Jun 21 07:31:33 PDT 2009,NO_QUERY,gauneyKAY,im happy but im also sad coz everyone else is 

0,2265900052,Sun Jun 21 07:31:36 PDT 2009,NO_QUERY,reishaolavario,"Q: Can I log in YM using an @rocketmail.com username? Help! I'm out, btw. 8am class tom &amp; I'm still on p37 of a 57-page article. Deyum! "

0,2265900119,Sun Jun 21 07:31:37 PDT 2009,NO_QUERY,xbox360gamerXx,"new ps4 It seems like the Playstation 4 release date has varied from 2010, 2011, and 2014. not been anouced yet "

0,2265900128,Sun Jun 21 07:31:37 PDT 2009,NO_QUERY,413alanna,Not as good as good as the ones in my dream 

0,2265900343,Sun Jun 21 07:31:39 PDT 2009,NO_QUERY,soumya_mallick,"2 many updates by 2 many ppl , 2 difficult 2 follow "

0,2265900442,Sun Jun 21 07:31:39 PDT 2009,NO_QUERY,Peppermintgrl,@utop14gl Genna is moving today  *cries*

0,2265900487,Sun Jun 21 07:31:39 PDT 2009,NO_QUERY,blimey85,Great church service this morning. Heading to my life group now. Rebecca has lost her voice so missed her first choir performance. 

0,2265901249,Sun Jun 21 07:31:45 PDT 2009,NO_QUERY,Gone_Again,"It is Father's Day, how do I show love through commercial products? "

0,2265901373,Sun Jun 21 07:31:46 PDT 2009,NO_QUERY,Noellebg,1:28 en 15k not very good  !!

0,2265901518,Sun Jun 21 07:31:47 PDT 2009,NO_QUERY,jakey8592,am bored as fuck 

0,2265901606,Sun Jun 21 07:31:47 PDT 2009,NO_QUERY,SirCrumpet,Hmmph. Having trouble Convincing laptop to boot from the leopard DVD in ext. drive. Tries ~5 times then gives up and boots to OS X 

0,2265902006,Sun Jun 21 07:31:50 PDT 2009,NO_QUERY,Leap1523,@jordanknight   Happy Father's Day!! I hope you have a wonderful day!  I lost my dad 16 years ago. 

0,2265902037,Sun Jun 21 07:31:50 PDT 2009,NO_QUERY,yorkiesilove,I want the signature golden retriever so bad!! 

0,2265902825,Sun Jun 21 07:31:56 PDT 2009,NO_QUERY,dplum,misses my Mosaic fam. 

0,2265902921,Sun Jun 21 07:31:56 PDT 2009,NO_QUERY,sheismel,@disanya ahahha. i was playing it tonight but it kept crashing 

0,2265902955,Sun Jun 21 07:31:57 PDT 2009,NO_QUERY,goodlemax,@blackwhiteworld ahah ok I will get some money to bribe miss hill....o wait :S I'm broke 

0,2265903251,Sun Jun 21 07:31:59 PDT 2009,NO_QUERY,ClaireOJD,"i feel horrible, my stomach hurts "

0,2265903577,Sun Jun 21 07:32:01 PDT 2009,NO_QUERY,xClaire_Cullenx,@SherieheartsRob yay! i think it does! oh...did your msn stop working on your phone ???  xxxxx

0,2265904082,Sun Jun 21 07:32:04 PDT 2009,NO_QUERY,Keleigh,Off to church and for pictures. I need a silver belt  and a necklace.  oh well. Check me out today! http://twitpic.com/808mu

0,2265904554,Sun Jun 21 07:32:07 PDT 2009,NO_QUERY,JennieShort,the suns gone in 

0,2265905083,Sun Jun 21 07:32:11 PDT 2009,NO_QUERY,Leap1523,@joeymcintyre  Happy Father's Day!! I hope you have a wonderful day!  I lost my dad 16 years ago. 

0,2265905179,Sun Jun 21 07:32:12 PDT 2009,NO_QUERY,BuzzRoyale,I have to iron my clothes now 

0,2265905287,Sun Jun 21 07:32:12 PDT 2009,NO_QUERY,mandab89,@sgirl18 That sucks. It's nice here...for now but the weather's been changing a lot lately 

0,2265905481,Sun Jun 21 07:32:14 PDT 2009,NO_QUERY,Pantsofgold,So sad i'm not getting wendi's tweets     (*pouting)

0,2265905531,Sun Jun 21 07:32:14 PDT 2009,NO_QUERY,sarahlynn85,How is it okay to smoke pot in a bar but not cigs? either thing is not cool in my book. my coat smells 

0,2265905829,Sun Jun 21 07:32:16 PDT 2009,NO_QUERY,gagi001,i will be stopping by the cemetery to visit my dad today ... wow its been 12 yrs 

0,2265905973,Sun Jun 21 07:32:17 PDT 2009,NO_QUERY,angeljones,Forcing this nasty toast down my throat BLAH!!! HJGKFDHJKDFJDJKD 

0,2265906599,Sun Jun 21 07:32:21 PDT 2009,NO_QUERY,ellezirk06,I don't want to go to school tomorrow.  What a tiring day! I enjoy twittering at my phone by the way.

0,2265906934,Sun Jun 21 07:32:24 PDT 2009,NO_QUERY,NotChristine,Getting ready for the Mets game. EFFING rain!!! Can't wait to wear my blue poncho. 

0,2265907025,Sun Jun 21 07:32:24 PDT 2009,NO_QUERY,samonthenet,@thankgodforpink Hahaha I fell asleep in the end; couldn't get meesiam! 

0,2265907157,Sun Jun 21 07:32:25 PDT 2009,NO_QUERY,oxoxBethxoxo,@_JadeLakeasha i know how you feel 

0,2265907689,Sun Jun 21 07:32:29 PDT 2009,NO_QUERY,francesb001,a summer doing nothing is kind of boring now 

0,2265908126,Sun Jun 21 07:32:32 PDT 2009,NO_QUERY,anise87,here we go again twitter is going crazy again adding and deleting my follwers and who im following again 

0,2265908388,Sun Jun 21 07:32:33 PDT 2009,NO_QUERY,wunnieC,just came back from midvalley and is now back in cheras 

0,2265908491,Sun Jun 21 07:32:34 PDT 2009,NO_QUERY,rum4life,"@PoynterJones Tired and sweaty, but content. Miss you  I've been avoiding the boards, just don't feel like diving back into all that"

0,2265908695,Sun Jun 21 07:32:35 PDT 2009,NO_QUERY,Shinybiscuit,@jackfaulkner I meant it was really hard to tal to people  Mean. I tried to clarify but it all went wrong.

0,2265908770,Sun Jun 21 07:32:36 PDT 2009,NO_QUERY,letstakethemoon,I don't feel very well today &amp; I don't know why 

0,2265909172,Sun Jun 21 07:32:38 PDT 2009,NO_QUERY,Sajo_wynn,Why do dogs eat poop? sick 

0,2265909314,Sun Jun 21 07:32:39 PDT 2009,NO_QUERY,MrGaGa_,"Going for a little nap, cause I'm absolutely....SHATTERED! "

0,2265909450,Sun Jun 21 07:32:40 PDT 2009,NO_QUERY,sabrinahenry,@danielak Who will say &quot;Good Morning&quot; when I head to bed over the next month  Seriously have a marvelous time &amp; check in when you can!

0,2265909543,Sun Jun 21 07:32:41 PDT 2009,NO_QUERY,Catkriendler,@drew_roy awww drew.. You were lonely  whenever you are you should text me ;)

0,2265910216,Sun Jun 21 07:32:46 PDT 2009,NO_QUERY,lavenderella,@syimah yeah! i slept at 3.40am coz i went home late.  tired!

0,2265910871,Sun Jun 21 07:32:50 PDT 2009,NO_QUERY,anise87,here we go again twitter is going crazy again adding and deleting my followers and who im following again 

0,2265911022,Sun Jun 21 07:32:51 PDT 2009,NO_QUERY,arashizm,No classes until July 1 because of an AH1N1 case.  I'm happy about the short break but I really hope the girl gets well soon. 

0,2265911175,Sun Jun 21 07:32:52 PDT 2009,NO_QUERY,honeybeess,@katie_bea so sad  can't believe I have to endure full on family functions instead of splashing in the Atlantic. have fun!!

0,2265911197,Sun Jun 21 07:32:53 PDT 2009,NO_QUERY,renarin,"realising that i did a heck of a lot of travelling the past month. 4 countries in 4 wkds is fun, but my bank a/c definitely took a hit... "

0,2265911202,Sun Jun 21 07:32:53 PDT 2009,NO_QUERY,jGday704,"@gavincreel i saw you tht night, and had no idea neil patrick harris was in the audience. i got everyone's autograph tht nite cept urs. "

0,2265911235,Sun Jun 21 07:32:53 PDT 2009,NO_QUERY,AmyWCanFly,"@CorruptedAston Nope, i just heard it from faraway...i can hear him again as i type this "

0,2265911384,Sun Jun 21 07:32:54 PDT 2009,NO_QUERY,LaTiaChantal,I just realized I touched this lady's boob money! EEEWWWWW 

0,2265912033,Sun Jun 21 07:32:58 PDT 2009,NO_QUERY,janelleglare,Thinking of getting the n97. Definitely not getting the iPhone though (can't). 

0,2265912359,Sun Jun 21 07:33:01 PDT 2009,NO_QUERY,ercool,I just realized that I'm bombarding my site with tweets. Haha. I guess I'm just lonely. There's no one to talk to 

0,2265912546,Sun Jun 21 07:33:02 PDT 2009,NO_QUERY,Abigaill,I miss my Daddy 

0,2265912558,Sun Jun 21 07:33:02 PDT 2009,NO_QUERY,cheeeeer,WE ARE REALLY TH WEENERS LEHHHHHHH SAMSUNG HOME THEATRE ;) BUT I AM TH LOSER WHO LEFT HALF WAY 

0,2265912837,Sun Jun 21 07:33:04 PDT 2009,NO_QUERY,EmelyCuellar,"Blah, my body is still shaking from latsnight.  im never good enough for anyone. I miss my best friend.. Ray and alex "

0,2265913916,Sun Jun 21 07:33:11 PDT 2009,NO_QUERY,CranerD,Just ate some pop tarts and now i'm gonna head to the gym and then to work 

0,2265914577,Sun Jun 21 07:33:16 PDT 2009,NO_QUERY,CharlotteMarie,@bentriderro NO! Can't have my shiny  whaaaaaa - you do know I still have time to show up don't you 

0,2265915517,Sun Jun 21 07:33:22 PDT 2009,NO_QUERY,camashe,Well I'm finally done with Spring cleaning - just in time for Summer. It's hard being an adult......  

0,2265915529,Sun Jun 21 07:33:22 PDT 2009,NO_QUERY,SB_BSB,"will i ever be ok again?! i can't eat, sleep or breathe and it feels like i am drinking away my life.... oooooh, hurts so much "

0,2265915685,Sun Jun 21 07:33:24 PDT 2009,NO_QUERY,Kieli,"@TeaksterArt LOL! Sorry, mate. Sounds like a parent to me  But take comfort in that you'd make a good husband "

0,2265915761,Sun Jun 21 07:33:24 PDT 2009,NO_QUERY,FKTH,sigh - sisters' bday party...so bored and lonely 

0,2265915897,Sun Jun 21 07:33:25 PDT 2009,NO_QUERY,beckyboo_x,Is Very Boreddddddd  x

0,2265916496,Sun Jun 21 07:33:29 PDT 2009,NO_QUERY,Lizzle09,@loisyoung92 yeahh i know  did your dad like his present?

0,2265916564,Sun Jun 21 07:33:30 PDT 2009,NO_QUERY,lindz123,Feeling like shit 

0,2265916678,Sun Jun 21 07:33:30 PDT 2009,NO_QUERY,TeamArmstrong,But it's his first father's day after losing Armstrong  So we are all trying to make it the best it can possibly be!

0,2265917412,Sun Jun 21 07:33:35 PDT 2009,NO_QUERY,TheLook514,@rjdennis I always love reading your posts. You keep me entertained. Wish I knew you in real life 

0,2265917456,Sun Jun 21 07:33:36 PDT 2009,NO_QUERY,HeritageJazz,"@bvkcreative hey bhawna, amazingly, i slept 5 hours through the afternoon today. But of course, I don't know why I couldn't last night "

0,2265917814,Sun Jun 21 07:33:38 PDT 2009,NO_QUERY,Lozzatheblue,So tired 

0,2265917874,Sun Jun 21 07:33:38 PDT 2009,NO_QUERY,bnr0814,"I need to figure out how to be strong today...I know its been a long time since my dads death, fathers day is always hard? "

0,2265918723,Sun Jun 21 07:33:44 PDT 2009,NO_QUERY,Graciecox,Im inlove with Him Too     I Just want to meet him ive got  A Magazineand there in it  I will show you tomorrow ..xx

0,2265918951,Sun Jun 21 07:33:45 PDT 2009,NO_QUERY,emilyrathge,About to finally knuckle down to revision. 

0,2265918967,Sun Jun 21 07:33:45 PDT 2009,NO_QUERY,darrell,"At least online, it seems some news sites may be swallowing Iran's coolade without tasting other beverages along the way... "

0,2265919199,Sun Jun 21 07:33:47 PDT 2009,NO_QUERY,NatCall,"@KirstyHilton Aww, I miss SuBo  which Sats gig you going to next?"

0,2265919200,Sun Jun 21 07:33:47 PDT 2009,NO_QUERY,OpieRadio,For FH and the rest of the father's that are no longer with us  http://post.ly/uYs

0,2265919210,Sun Jun 21 07:33:47 PDT 2009,NO_QUERY,buge,"Ugh, feeling a bit kakkie this afternoon. I think the dreary weather has rubbed off on me. "

0,2265919468,Sun Jun 21 07:33:49 PDT 2009,NO_QUERY,nocturnalturtle,@uriel1998 the npr contest is only open to people in the u.s. 

0,2265919569,Sun Jun 21 07:33:50 PDT 2009,NO_QUERY,Jenifesto,Back in Campbell River ... still sick 

0,2265920234,Sun Jun 21 07:33:54 PDT 2009,NO_QUERY,hollyknowsbest,@charleypearson me toooo  it took us AGES to get out of the forest :')

0,2265920316,Sun Jun 21 07:33:55 PDT 2009,NO_QUERY,LA_Reed,@frannyfroofroo just sent you an email.  Don't think Tuesday is in the cards for me   Miss you lots and lots and lots.  XoxoSee you soon!

0,2265920359,Sun Jun 21 07:33:55 PDT 2009,NO_QUERY,Lunnita,"Studying..again..getting sick of this..c'mooon,it's summer time..! "

0,2265920383,Sun Jun 21 07:33:56 PDT 2009,NO_QUERY,CatalinaEllis,"Hoping to avoid heat exhaustion today, though I still have a migraine     22 more hours till Chicago, 32 more hours till Laura Izibor!!!"

0,2265920527,Sun Jun 21 07:33:57 PDT 2009,NO_QUERY,vicicasas,@Tantantiniiin Yes unfortunately  They found him in his bed this morning.

0,2265921766,Sun Jun 21 07:34:05 PDT 2009,NO_QUERY,Rhianne08,lmao your kids sound sooo Cute !! My sister never said anything that funny !!  lol @Peterfacinelli

0,2265922573,Sun Jun 21 07:34:10 PDT 2009,NO_QUERY,superstarBRY23,Mornin twitts 

0,2265922676,Sun Jun 21 07:34:11 PDT 2009,NO_QUERY,judel,"Happy Father's Day to all you dads out there.  Unfortunately, I lost mine when I was a teenager!  "

0,2265922844,Sun Jun 21 07:34:12 PDT 2009,NO_QUERY,hija_de_dios,i have an unsettling feeling in my gut - it's actually scaring me! 

0,2265922988,Sun Jun 21 07:34:13 PDT 2009,NO_QUERY,charlesmok,Don't know what choice Twitter really has 

0,2265923074,Sun Jun 21 07:34:14 PDT 2009,NO_QUERY,brianalynnnnnn,"Woke up at 7 but realized that I don't need to get up till 7:45 so I tried to go back to sleep, but I just cannn't!  oh well, I'm up and"

0,2265923297,Sun Jun 21 07:34:15 PDT 2009,NO_QUERY,CAMERALUCIDA333,remember when Nokia made the best phones?  â « http://blip.fm/~8me1g

0,2265923463,Sun Jun 21 07:34:16 PDT 2009,NO_QUERY,prat3Ek,@hnprashanth dude i'm so jealous o u guys!n angry too!u had to have d tweet up today?  i so badly wanted to attend it!damn my effin exam

0,2265925966,Sun Jun 21 07:34:34 PDT 2009,NO_QUERY,Obama88,At work Sweatin hot as hell  But I Get Out at 2 Pce

0,2265926039,Sun Jun 21 07:34:35 PDT 2009,NO_QUERY,nizarnoor,@Xird I CAN HEAR IT TOO!!!!!!! LOL @flimisthename Iya nih.  @niissaa I don't think that's the cause deh. Tp gak tau jg ya.

0,2265926213,Sun Jun 21 07:34:36 PDT 2009,NO_QUERY,mardetanha,http://bit.ly/2cSPOk   you can see who sabotage the country

0,2265926270,Sun Jun 21 07:34:36 PDT 2009,NO_QUERY,kzelyosukkel,| i want to have beats by dr. dre  http://www.beatsbydre.com/

0,2265926726,Sun Jun 21 07:34:39 PDT 2009,NO_QUERY,rizard209,ive definitely shared my luv of poetry and sunny dispositon. imma miss workin here. not here now but at the skool im at rite now 

0,2265926876,Sun Jun 21 07:34:40 PDT 2009,NO_QUERY,FavJade,dag yo my Daddy is sooooo old. makes me sad but that's life.  at least i knew him for 23 years and counting. so i'm blessed.

0,2265926974,Sun Jun 21 07:34:41 PDT 2009,NO_QUERY,kellykell1,Great. I already have a crazy run in my pantyhose. 

