sentiment,userid,date,query,userId,text0,2253861647,Sat Jun 20 08:51:29 PDT 2009,NO_QUERY,nehzorts,MY ENTIRE EXCEL PROJECT THAT I HAVE BEEN WORKING ON THE WHOLE DAY IS GONE BECAUSE I FORGOT TO SAVE AND CANCELED THE WHOLE THING 

0,2253861697,Sat Jun 20 08:51:30 PDT 2009,NO_QUERY,kaitlyn13,Still not too happy.. DONT LEAVE ME ALONE FOR LONG PERIODS OF TIMEEEEEEEE I GET DEPRESSED     *note to... http://tinyurl.com/kt6n84

0,2253861993,Sat Jun 20 08:51:31 PDT 2009,NO_QUERY,AshleyMarie28,"Feeling sick today  NOT COOL. Eyes feel puffy, nose is running, throat is sore. This is NOT the way to begin this summer!"

0,2253862353,Sat Jun 20 08:51:33 PDT 2009,NO_QUERY,PLDesigns,Waiting on my mom to get here so we can decide if car can be driven or needs to be towed  oil leak]

0,2253862375,Sat Jun 20 08:51:33 PDT 2009,NO_QUERY,MrYGT,i went to the beach; but the sea is very cold 

0,2253862421,Sat Jun 20 08:51:34 PDT 2009,NO_QUERY,tomeduarte,It seems I don't know quite a lot.. 

0,2253862533,Sat Jun 20 08:51:34 PDT 2009,NO_QUERY,ClakyDruott,Pc is running now. Barely.  need new one stat.

0,2253862650,Sat Jun 20 08:51:35 PDT 2009,NO_QUERY,audiodoll,"packing crunch time. augh, i really do hate packing. i just want everything to be done for me.  i should get a maid."

0,2253863088,Sat Jun 20 08:51:37 PDT 2009,NO_QUERY,f33dyourlungs_,@rach018 Tell Kimbo I said hi if she's there! 

0,2253863215,Sat Jun 20 08:51:38 PDT 2009,NO_QUERY,brainybrunette,Thinks its lame that she woke up to find  wekiva springs is closed. 

0,2253863496,Sat Jun 20 08:51:40 PDT 2009,NO_QUERY,normandemorriso,My dad is in the hospital in the Us and I can't see him 

0,2253863798,Sat Jun 20 08:51:42 PDT 2009,NO_QUERY,geetarchurchy,Radian6 being particularly unresponsive- not helpful 

0,2253864200,Sat Jun 20 08:51:44 PDT 2009,NO_QUERY,xmellyssax,"@snufsnuf work ape? sdri ke work opis? lame la i x paint,bz sgt "

0,2253864353,Sat Jun 20 08:51:45 PDT 2009,NO_QUERY,imkhris,Leaving NYC today. So sad. I don't want to go back to Alaska...  I'm a city girl and I realized I belong in the city.

0,2253864732,Sat Jun 20 08:51:47 PDT 2009,NO_QUERY,daniellemjc,"oh man 4 more sleeps in this bed..ever!. sad times, i dont waNT to move!i like my room,i like my house,i like most of the ppl i live with "

0,2253864983,Sat Jun 20 08:51:48 PDT 2009,NO_QUERY,Minnie_Flux,does not want to move from bed 

0,2253865124,Sat Jun 20 08:51:49 PDT 2009,NO_QUERY,BiddyMcBidson,"@mooshinindy and then you will be a case widow  but! You'll have a hott lawyer hubby, new house, and awesome car! (not to mention the ..."

0,2253865149,Sat Jun 20 08:51:49 PDT 2009,NO_QUERY,_Rawra_,"First Twitter post , and hoping Ashley Young doesnt leave the Villa "

0,2253865165,Sat Jun 20 08:51:49 PDT 2009,NO_QUERY,lixue88,"Well, ended up in the ER Thursday night for the worst migraine of my life and vomiting. Lying in deathbed now. Missing Amanda's wedding "

0,2253865258,Sat Jun 20 08:51:50 PDT 2009,NO_QUERY,Luhkey1,Dealing with a sick 2 year old 

0,2253865580,Sat Jun 20 08:51:52 PDT 2009,NO_QUERY,cappellathx,has feasted in a gluttonous manner.  Watching Mount Cappella slowly rising.

0,2253865688,Sat Jun 20 08:51:53 PDT 2009,NO_QUERY,minaluvsjonas,"@meghan705 i can't even go, not enought money for any more concerts "

0,2253865961,Sat Jun 20 08:51:54 PDT 2009,NO_QUERY,rwo,&quot;Ã? thá» c tráº» em Viá»‡t Nam cÃ²n thua ThÃ¡i Lan vÃ  LÃ o&quot;. Nghe Ä‘au xÃ³t quÃ¡ 

0,2253866091,Sat Jun 20 08:51:55 PDT 2009,NO_QUERY,doubleSy,Good morning! Last day in NYC and it's raining  I need some coffee or a smoothie. My dads in Dallas where the JB World Tour kicks off!

0,2253866697,Sat Jun 20 08:51:59 PDT 2009,NO_QUERY,bwatson6,@gilbirmingham does this mean u aren't going 2 tweet anymore? 

0,2253866708,Sat Jun 20 08:51:59 PDT 2009,NO_QUERY,SilviaFuen,I dont feel my best today i hope i will tonite 

0,2253866970,Sat Jun 20 08:52:00 PDT 2009,NO_QUERY,jordanfrombklyn,rain in NYC already....Citi Field looking like it will not happen 

0,2253867294,Sat Jun 20 08:52:02 PDT 2009,NO_QUERY,SamHoward1,"Had a good day + Starbucks, Then a rain had to come "

0,2253867671,Sat Jun 20 08:52:04 PDT 2009,NO_QUERY,Callie06,@ddlovato aw I love those dreams 

0,2253867718,Sat Jun 20 08:52:05 PDT 2009,NO_QUERY,ChloChlo5525,@rayjnia Never seen it! 

0,2253873676,Sat Jun 20 08:52:38 PDT 2009,NO_QUERY,alphamares,"@EnglishProfi   I don't drink  (too much sideways thinking without drinking already) So ... 1 Guiness , 1 Starbucks?"

0,2253873867,Sat Jun 20 08:52:39 PDT 2009,NO_QUERY,Al_ice,I don't believe I just did that... I fell asleep and missed the rugby completely  Oh well at least we won...

0,2253874371,Sat Jun 20 08:52:42 PDT 2009,NO_QUERY,LivingWoutMeat,Going camping later this summer so I stocked up on vegan marshmallows ... just wish they were a little bigger for roasting 

0,2253874564,Sat Jun 20 08:52:44 PDT 2009,NO_QUERY,jalyn88,Good Morning peeps... Sooooooo sick 4m allergies ughhhh :/  

0,2253874640,Sat Jun 20 08:52:44 PDT 2009,NO_QUERY,carolemoyes,@StephanieEllen its the' wilds of waneee'!! or the northumberland coast (about 30 miles north of newcastle) - + very rural 

0,2253875120,Sat Jun 20 08:52:47 PDT 2009,NO_QUERY,XDashleighXD,i didnt end up goin to the metro  lol guess i will just have to were my crappy shoes for college

0,2253875150,Sat Jun 20 08:52:47 PDT 2009,NO_QUERY,BrianisTuft,@grrlgenius Sorry.  I had been out and wanted to say hi. I feel bad.

0,2253875489,Sat Jun 20 08:52:49 PDT 2009,NO_QUERY,librarienne,@Rudibrarian Ouch! It was sounding like such a good morning before that last part.  

0,2253875501,Sat Jun 20 08:52:49 PDT 2009,NO_QUERY,SkittlesOverMms,@daverosin that's horrible!  are you guys still playing today?

0,2253875636,Sat Jun 20 08:52:50 PDT 2009,NO_QUERY,EmilyMLuvsMCR,"just watched nightmare on elm street, i feel a freddy kruger nightmare coming on "

0,2253875691,Sat Jun 20 08:52:50 PDT 2009,NO_QUERY,xklaux,joseph! I hate when you do that! ahhh!!! that's so bad to me!   ANywAY I still love you!!!! 4ever dork dude! mUuuA!

0,2253875838,Sat Jun 20 08:52:51 PDT 2009,NO_QUERY,rolandobrown,"When Hip-Hoper's confessed LUV of Nike, I said SweatShops &amp; BlingTrade, too far to care  But, I'm confused by our new LUV of the NY Ti ..."

0,2253876042,Sat Jun 20 08:52:52 PDT 2009,NO_QUERY,wiipalsfan,@raeptar aw  I failed? I have never heard of them.  What do they play?

0,2253876116,Sat Jun 20 08:52:53 PDT 2009,NO_QUERY,ambermedi,Another rainy day in NY 

0,2253876482,Sat Jun 20 08:52:55 PDT 2009,NO_QUERY,MollyJailed,"@BabygirlSoMajor me too girl! its ridiculous! we started a twibe &amp;&amp; twitition against it, &amp;&amp; twitter tried to shut us down "

0,2253876525,Sat Jun 20 08:52:55 PDT 2009,NO_QUERY,Junction10,Wishing I was down south shooting @Jason_Mraz tonight 

0,2253876602,Sat Jun 20 08:52:55 PDT 2009,NO_QUERY,Aphrodita,Why did the end of Made of Honor just make me cry? 

0,2253877207,Sat Jun 20 08:52:59 PDT 2009,NO_QUERY,tutties,havent talked to him in a whole week 

0,2253877352,Sat Jun 20 08:53:00 PDT 2009,NO_QUERY,Muffinsquire,"I might actually finish my hat today. This is exciting. However, I've got like.. no money to buy yarn for my next project. "

0,2253877373,Sat Jun 20 08:53:00 PDT 2009,NO_QUERY,tjt2013,just at the library...oh and one of the security guards is doing the &quot;I'm into you&quot; hello everyday   WHEN WILL MY LAPTOP BE DONE?!?!?!

0,2253877718,Sat Jun 20 08:53:02 PDT 2009,NO_QUERY,dspringa,@calierenee I work at my college's library so all the cute fire students are always coming in. it's been raining a lot now  and good luck!

0,2253877756,Sat Jun 20 08:53:02 PDT 2009,NO_QUERY,Joycie4archie,@Dustinnnn omg are you ok? Is it very bad?! 

0,2253877928,Sat Jun 20 08:53:03 PDT 2009,NO_QUERY,rjstewart,@EMS_Medic prob was pp website can't combine 2x$10 card for $20 min top up. SDmart only had $10's 

0,2253878106,Sat Jun 20 08:53:04 PDT 2009,NO_QUERY,TudorPopa,adobe presentations is pretty cool... but it's full flash 

0,2253878475,Sat Jun 20 08:53:06 PDT 2009,NO_QUERY,mynameisnotmaja,@therebecca Me too. Now its just... nothing? 

0,2253878477,Sat Jun 20 08:53:07 PDT 2009,NO_QUERY,specialdave197,@Eldernas fuck off. I miss that life style 

0,2253878614,Sat Jun 20 08:53:07 PDT 2009,NO_QUERY,Trickamo,Rip &quot;Bennie k Powell&quot; i will miss ya dearly!!! 

0,2253878839,Sat Jun 20 08:53:09 PDT 2009,NO_QUERY,miscelana,"@vval oh, yeah! That one was great, hehe. And no, I didn't.  I forgot about the 5$ sale... yes, I'm dumb."

0,2253879741,Sat Jun 20 08:53:14 PDT 2009,NO_QUERY,chengsaephanh,Gotta go to work early today.  I'll be Twittering there. Until then... adios!

0,2253879768,Sat Jun 20 08:53:14 PDT 2009,NO_QUERY,ILoveToPout,@sexualninja No drunkardness tonight!!!  URGH awful day  x

0,2253879907,Sat Jun 20 08:53:15 PDT 2009,NO_QUERY,smilinggal,@vabavdekar Really.... lucky u!! v in Delhi still frying.. 

0,2253880120,Sat Jun 20 08:53:16 PDT 2009,NO_QUERY,duhhnelle,@ddlovato I totally know how that feels 

0,2253880331,Sat Jun 20 08:53:17 PDT 2009,NO_QUERY,marisobad,good mornin twitdolls .. oh no! rain again 

0,2253880454,Sat Jun 20 08:53:18 PDT 2009,NO_QUERY,MissAmyLynnRose,apparently leaving a bag with a carton of eggs in the living room overnight is a BAD idea! I wanna bake! 

0,2253880506,Sat Jun 20 08:53:18 PDT 2009,NO_QUERY,summerphillips,bacck home.  .... drinkkkss tonight ?

0,2253880578,Sat Jun 20 08:53:19 PDT 2009,NO_QUERY,Samiiixox,"doesn't think this weather is gonna be great for summer...I love the rain, but not for my summer vacation! "

0,2253880838,Sat Jun 20 08:53:20 PDT 2009,NO_QUERY,j_erin,Cyrasaurus Rex is sick today.  my poor little man.

0,2253881016,Sat Jun 20 08:53:21 PDT 2009,NO_QUERY,nicolemonicat,@applenutbutter I knoow. 

0,2253881023,Sat Jun 20 08:53:21 PDT 2009,NO_QUERY,DnM11,@Gina_Rye have a great time today!! we'll miss having you out tonight....@thegleampt2 won't be joining us either  who will tweet with me?

0,2253881164,Sat Jun 20 08:53:22 PDT 2009,NO_QUERY,chutmarshall," Had to work today. 1 hour down, 6 to go."

0,2253881301,Sat Jun 20 08:53:23 PDT 2009,NO_QUERY,iluvcountry144,"graduation party later, then maybe going to the verizon store to get a new phone "

0,2253881700,Sat Jun 20 08:53:25 PDT 2009,NO_QUERY,meganshoffner,Im sad. We couldnt find the store that has TOMS in Elon. 

0,2253881880,Sat Jun 20 08:53:26 PDT 2009,NO_QUERY,iLoveElleB,@Bajan_Sensation  NO bootLeg! I want the Real Deal!! &amp; naw I didn't go out I was out during this wk so much I need a break

0,2253882061,Sat Jun 20 08:53:27 PDT 2009,NO_QUERY,NKOTBFlamesFan,Surrounded by FOBs 

0,2253882307,Sat Jun 20 08:53:29 PDT 2009,NO_QUERY,GemHowley,@HannahRobertson  Don't cry Han.. he's not worth it!!!!!!!!!! Stupid stupid stupid man..  grrrrrrrrr

0,2253883102,Sat Jun 20 08:53:34 PDT 2009,NO_QUERY,alexchanchi,"I just read the article on MSN &quot;Love Lessons from Dad&quot; and love it.  Very wise, too bad mine was never around to give any to me "

0,2253883387,Sat Jun 20 08:53:35 PDT 2009,NO_QUERY,deziisdopex3,"i feel like i have arthritis in my hands from so much texting, piano, and being on the computer - the only things that keep me sane "

0,2253883462,Sat Jun 20 08:53:36 PDT 2009,NO_QUERY,shackled_muse,should've been somewhere else today 

0,2253883809,Sat Jun 20 08:53:38 PDT 2009,NO_QUERY,_samanthara_,"@jannliss I'm sorry Julie, he was a lovely pet "

0,2253883963,Sat Jun 20 08:53:39 PDT 2009,NO_QUERY,iamepiclyamazin,@katie_andhearts PSP? Weiird. I want internet on my psp 

0,2253884029,Sat Jun 20 08:53:39 PDT 2009,NO_QUERY,natea,Tweetdeck for iPhone discards my tweet if I exit the app before pressing send.  Tweetie handles this better.

0,2253884135,Sat Jun 20 08:53:40 PDT 2009,NO_QUERY,tgxoxo,Ughh its raining here... again. I wish the sun would come out already! 

0,2253884520,Sat Jun 20 08:53:42 PDT 2009,NO_QUERY,Cathie1054,"Power co says we should have elec back by 2.  Hope they're right. Where we r, if no power, no water either. "

0,2253884572,Sat Jun 20 08:53:43 PDT 2009,NO_QUERY,claspclasp,The cops are still looking for Mr Pickering 

0,2253884600,Sat Jun 20 08:53:43 PDT 2009,NO_QUERY,darekkg,@aerxo  thaaanks 

0,2253884825,Sat Jun 20 08:53:44 PDT 2009,NO_QUERY,caitlingoode101,cleanin my room  goin 2 the beach after

0,2253885304,Sat Jun 20 08:53:47 PDT 2009,NO_QUERY,SkullyRox,"@WestEndWitch I'm in London tomorrow, hoping to catch at least some of W.E.L. Well gutted I couldn't do any more "

0,2253885395,Sat Jun 20 08:53:47 PDT 2009,NO_QUERY,dachedawu,Hubbie leaving today to head back to NYC.....  

0,2253885434,Sat Jun 20 08:53:48 PDT 2009,NO_QUERY,valerina9806,Well I'm awake. Happy about it...no. I am not!  still so sleepy!!

0,2253885456,Sat Jun 20 08:53:48 PDT 2009,NO_QUERY,Shayisthe1,@SassyAssRedbone WTF does couch shooting mean I'm old 

0,2253885488,Sat Jun 20 08:53:48 PDT 2009,NO_QUERY,ilovepumkin2,"Waitin for my mom to b here, 20 mins late already. "

0,2253885688,Sat Jun 20 08:53:49 PDT 2009,NO_QUERY,xohanna,"@jennypoynter I got a new tv, so mine went "

0,2253885721,Sat Jun 20 08:53:49 PDT 2009,NO_QUERY,palomagrace,The hangover is probably the BEST movie. I lost my bberry  

0,2253885765,Sat Jun 20 08:53:49 PDT 2009,NO_QUERY,x_shazzy_x,@ddlovato aww! that so sweet! are you coming back to london? everytime you come we miss you 

0,2253885805,Sat Jun 20 08:53:50 PDT 2009,NO_QUERY,fueledbyregret,Why don't trains look like this anymore?  http://tinyurl.com/nxsmd4

0,2253886047,Sat Jun 20 08:53:51 PDT 2009,NO_QUERY,hollycruddnikki,@monicaclare i really never went on b/c i didnt talk to anyone  my twitter was for celebs though. its my aunts bday today asnd 2mrw church

0,2253886234,Sat Jun 20 08:53:52 PDT 2009,NO_QUERY,crinky,I'm going to have to drop money on a laptop cooler  I got a really bad burn on my leg last night because it got superheated. Ugh.

0,2253886563,Sat Jun 20 08:53:54 PDT 2009,NO_QUERY,karma_musings,"@mrsikhnet   Bummer - Maybe I'll call Dharam and see what he has to say abt it. So you're not videoing for archive, either?"

0,2253886609,Sat Jun 20 08:53:54 PDT 2009,NO_QUERY,HeyItsRiley,orentation. really crowded and im bored. they wont  let me have coffee. 

0,2253886631,Sat Jun 20 08:53:55 PDT 2009,NO_QUERY,MrsGriff0610,@JazzeeJEF Looks like it wants to rain about here but I know that aint gonna happen. Guess you will be staying inside 

0,2253886870,Sat Jun 20 08:53:56 PDT 2009,NO_QUERY,kasey1905,Some of the Harry Potter kids did not age well... 

0,2253887403,Sat Jun 20 08:53:59 PDT 2009,NO_QUERY,tinacase,@MIGGS_Band ugh. not good. 

0,2253887771,Sat Jun 20 08:54:01 PDT 2009,NO_QUERY,mirafar,@AmiraHasni that's great! i really want the poster..  

0,2253888088,Sat Jun 20 08:54:03 PDT 2009,NO_QUERY,TaliahD,cleaning...boo 

0,2253888302,Sat Jun 20 08:54:04 PDT 2009,NO_QUERY,jdomann,"@MuscleNerd When I use redsn0w on ipt1g, it goes to a blank screen after redsn0w says done. From the comments, this seems common "

0,2253888921,Sat Jun 20 08:54:07 PDT 2009,NO_QUERY,hankb,@lisa_ballew still waiting at the apple store.  http://twitpic.com/7wo8y

0,2253894877,Sat Jun 20 08:54:42 PDT 2009,NO_QUERY,anastasiaHOO, I shouldn't miss you. &gt;_&lt;

0,2253894883,Sat Jun 20 08:54:42 PDT 2009,NO_QUERY,hallienb2012,5 hours of sleep?... Not good  even the best of Elvis Costello and Duran Duran isn't gonna help me wake up any better

0,2253895176,Sat Jun 20 08:54:44 PDT 2009,NO_QUERY,meggyybear,@Shaunnayo omg shaunna i get noonnnne of your updates on my phone!!!    double sad.

0,2253895191,Sat Jun 20 08:54:44 PDT 2009,NO_QUERY,salonegal85,"@dreadmalik I agree, that's the worst thing to be &amp; very cowardice...sorry to hear about this "

0,2253895347,Sat Jun 20 08:54:45 PDT 2009,NO_QUERY,Cheech_Sobrante,@Rorzshach What Up? What happened? 

0,2253895392,Sat Jun 20 08:54:45 PDT 2009,NO_QUERY,ifel,sickatronic: I made mine in March! I miss you.  http://tumblr.com/xfj23n9bf

0,2253895718,Sat Jun 20 08:54:47 PDT 2009,NO_QUERY,caeonfire,text messaging with tiffany. i miss her. 

0,2253896375,Sat Jun 20 08:54:51 PDT 2009,NO_QUERY,alexandramarieb,@melissa_ryder i know fml he tweeted that 2 months ago. thats my birthday. Too bad ill be gone 

0,2253896545,Sat Jun 20 08:54:52 PDT 2009,NO_QUERY,ldyxillusion,Is desperately lookin for a job 

0,2253896682,Sat Jun 20 08:54:52 PDT 2009,NO_QUERY,nicoleroberto,@moleksiak back in MN and yes woke up in the middle of the night freaking out and couldnt get back to bed 

0,2253896787,Sat Jun 20 08:54:53 PDT 2009,NO_QUERY,karlaveloso,had my first class for basic photography today. i hope it gets better (socially. for me.)   haha good vibes!!

0,2253896956,Sat Jun 20 08:54:54 PDT 2009,NO_QUERY,SirriAchi,Doesnt Know If he has to go to class today wants to sleep 

0,2253897313,Sat Jun 20 08:54:56 PDT 2009,NO_QUERY,cassandra02,@ddlovato never care with me 

0,2253898116,Sat Jun 20 08:55:01 PDT 2009,NO_QUERY,huttah,work is cooking bacon and it smells so friggin good! i'm so hungry 

0,2253898160,Sat Jun 20 08:55:01 PDT 2009,NO_QUERY,zamzamdesign,have a feeling we will have a crappy summer like last year... 

0,2253898571,Sat Jun 20 08:55:03 PDT 2009,NO_QUERY,mswaterford,"@postpacific we are also asking for a refund here.  rain, rain go away     "

0,2253899346,Sat Jun 20 08:55:08 PDT 2009,NO_QUERY,xALfhiax,"@ohshataptep it`s super scary  especially a while ago, i was the only one left in the jeep and the route was like, errrr dark places. :|"

0,2253899389,Sat Jun 20 08:55:08 PDT 2009,NO_QUERY,danarobinson6,@nappturalbeauty I lost my camera 

0,2253899606,Sat Jun 20 08:55:09 PDT 2009,NO_QUERY,inspissated,@lykethebyrd sorry you're having a bad day 

0,2253899687,Sat Jun 20 08:55:09 PDT 2009,NO_QUERY,stylish_in_dc,@VtgRoseClothing absolutely but it won't stop raining here 

0,2253900045,Sat Jun 20 08:55:11 PDT 2009,NO_QUERY,emsuckle,"home tomorrow boo.  had a great time, cant wait to see everyone and compare their paleness LOL. dont want to come home."

0,2253900621,Sat Jun 20 08:55:14 PDT 2009,NO_QUERY,shermanhu,@mikehaydon oh shoot! Didn't wanna scare tweeps  that's why I landed those Asian gangster acting gigs! LOL!

0,2253900827,Sat Jun 20 08:55:16 PDT 2009,NO_QUERY,luvmeorhateme,"@danecook I was supposed to come to your Omaha show for my b-day, but my bf decided to take the kids to the zoo instead  "

0,2253900901,Sat Jun 20 08:55:16 PDT 2009,NO_QUERY,cooze,forgot my cell at home  boooo... working til 5

0,2253900907,Sat Jun 20 08:55:16 PDT 2009,NO_QUERY,roxiijonas,SORRRRRYYY  I';ve got everyone talking about it! I've started a rumour and i didnt even intend too :L:L

0,2253901064,Sat Jun 20 08:55:17 PDT 2009,NO_QUERY,Natexpress13,is bored as andre is playing on the wii 

0,2253901093,Sat Jun 20 08:55:18 PDT 2009,NO_QUERY,BenjaminHopps,is screwed for my English exam. I can't find my binder so I can't study  FML.

0,2253901274,Sat Jun 20 08:55:18 PDT 2009,NO_QUERY,PoyntlasLove,It's super cold over here 

0,2253901440,Sat Jun 20 08:55:19 PDT 2009,NO_QUERY,bentoast,2 flags short of a masayf set  #assasinscreed

0,2253901539,Sat Jun 20 08:55:20 PDT 2009,NO_QUERY,squinta90,"Gettin ready for a long day , hope this weather stays clear "

0,2253901636,Sat Jun 20 08:55:20 PDT 2009,NO_QUERY,WiseGrass,"@LancasterHomes You know what, one of your old pics from square one I just tagged the photo with names.  sorry"

0,2253901666,Sat Jun 20 08:55:20 PDT 2009,NO_QUERY,sreeramgopal,Trying to study BCI...this 8085 thingy is nt making any sense... 

0,2253901801,Sat Jun 20 08:55:21 PDT 2009,NO_QUERY,flapjacks9702,"@mellowdi yup, when I'm, I'm on. But when I'm off, I'm wayyyyy off "

0,2253902024,Sat Jun 20 08:55:23 PDT 2009,NO_QUERY,kyleejames,Rain follows me!!! Shopping in the rain = the worst 

0,2253902995,Sat Jun 20 08:55:28 PDT 2009,NO_QUERY,sarah_canning,take that tomorrow  so excited!  Hopefully it doesn't rain 

0,2253903041,Sat Jun 20 08:55:29 PDT 2009,NO_QUERY,LACERZ,Heading into work 

0,2253903043,Sat Jun 20 08:55:29 PDT 2009,NO_QUERY,afrysak,About to get some shopping done...for a new swimsuit...its about to get depressing 

0,2253903213,Sat Jun 20 08:55:30 PDT 2009,NO_QUERY,brasseye,"Had the second football tournament in two weeks this morning, now minus a big toenail "

0,2253903288,Sat Jun 20 08:55:30 PDT 2009,NO_QUERY,anitarenee22,All liquid diets = MAJOR AWFUL LEG CRAMPS! (And I'm taking a multi-vitamin go figure I'd not drink enough and get dehydrated!) 

0,2253903508,Sat Jun 20 08:55:31 PDT 2009,NO_QUERY,megafarras,"Hi guys,what are you doing now?What? Ontheway home?Me? Hmm,staying at home.Watching night at the museum,it's am... You've watched it? ok "

0,2253904278,Sat Jun 20 08:55:36 PDT 2009,NO_QUERY,psweeney,Here's a good one!! http://sfbay.craigslist.org/eby/boa/1229710200.html  Too bad the chugboat would cost so much in fuel 

0,2253904507,Sat Jun 20 08:55:37 PDT 2009,NO_QUERY,uniquenfabulous,@twitterapi i'm not sure why but the twitter update for my blackberry isnt working properly. I'm not getting any updates what so ever. 

0,2253904512,Sat Jun 20 08:55:37 PDT 2009,NO_QUERY,screenscribe,It is 85 degrees in the apartment and it's only noon. 

0,2253904571,Sat Jun 20 08:55:37 PDT 2009,NO_QUERY,ELSUNGDO,at the house having problems with my chick 

0,2253904678,Sat Jun 20 08:55:38 PDT 2009,NO_QUERY,nongravity,Buster Keaton's The General on 16mm: stolen from my doorstep. 

0,2253904826,Sat Jun 20 08:55:39 PDT 2009,NO_QUERY,camiilandree,please don`t leave me alone (8) 

0,2253905005,Sat Jun 20 08:55:40 PDT 2009,NO_QUERY,kristyysueex3,"it's raining, it's pouring. the old man is snoringg "

0,2253905072,Sat Jun 20 08:55:40 PDT 2009,NO_QUERY,tommyreyes,@YankeeMegInPHL shit I wish! They love in Manhattan  lol

0,2253905094,Sat Jun 20 08:55:40 PDT 2009,NO_QUERY,Perignonic,@stingerx of course you can!! you don't belong to the &quot;frat beach hair saloon&quot; what.. i'm gaining weights 

0,2253905589,Sat Jun 20 08:55:43 PDT 2009,NO_QUERY,Kadendark,"@SherylClouse goodluck with the appliance shopping, it's never any fun "

0,2253905665,Sat Jun 20 08:55:43 PDT 2009,NO_QUERY,podelz,"what happen with my Y!M, I can't connect tonight "

0,2253905870,Sat Jun 20 08:55:45 PDT 2009,NO_QUERY,judez_xo,Where did Bonddiiiieeee gooooo 

0,2253905896,Sat Jun 20 08:55:45 PDT 2009,NO_QUERY,meganfvaughan,@kateatthemotel It's rubbish that he's going but I think if I'd been treated like a spare part I'd want out as well. 

0,2253905901,Sat Jun 20 08:55:45 PDT 2009,NO_QUERY,Anthole,"IS going bowling tonight in Llandudno, hate bowling "

0,2253906063,Sat Jun 20 08:55:46 PDT 2009,NO_QUERY,crazystins,Awake with the biggest migrane known to man kind 

0,2253906438,Sat Jun 20 08:55:48 PDT 2009,NO_QUERY,michaeldivinee,omg its so humid outside... 

0,2253906931,Sat Jun 20 08:55:51 PDT 2009,NO_QUERY,DanaGuckin,@heathaaa6405 gary papa died?  so sad

0,2253906957,Sat Jun 20 08:55:51 PDT 2009,NO_QUERY,einfach_mich,@moonwitche I hope that work doesn't suck your will too much. 

0,2253907210,Sat Jun 20 08:55:53 PDT 2009,NO_QUERY,LordByron42,x.new X() where x is an instance of the class. But if the class is static the .xml layout document can't see it 

0,2253907936,Sat Jun 20 08:55:57 PDT 2009,NO_QUERY,Jenjenzi,hasn't had a good day with the kiddies  maybe they'll take on board what I said tho ??? ha ha ha

0,2253907979,Sat Jun 20 08:55:57 PDT 2009,NO_QUERY,Kelsey_Burd,@dougharvey  *hug*

0,2253908087,Sat Jun 20 08:55:57 PDT 2009,NO_QUERY,nehzorts,@Quackkkkk I've got econs project meeting after sch 

0,2253908116,Sat Jun 20 08:55:58 PDT 2009,NO_QUERY,chicrunner,@cNicRun @cNicRun no it's just the child ha ha. BUT it's  not activated yet still waiting on slow apple 

0,2253908505,Sat Jun 20 08:56:00 PDT 2009,NO_QUERY,Ninchi,finished my garden...now it`s raining in Cologne  Babe i miss you please give me a call....

0,2253908578,Sat Jun 20 08:56:00 PDT 2009,NO_QUERY,sabinagl,Its pouring  &lt;Fob is my life&lt;3&gt;

0,2253908634,Sat Jun 20 08:56:01 PDT 2009,NO_QUERY,andiecropper,"@AliBee16 i havnt taken any photos for ages, as i have no camera  desparately need a new one, but skint!!"

0,2253909151,Sat Jun 20 08:56:04 PDT 2009,NO_QUERY,antoinechan,"says After I update my iPhone, I can't use plurk again  http://plurk.com/p/12hi9u"

0,2253909522,Sat Jun 20 08:56:06 PDT 2009,NO_QUERY,BumbleB012,was unpleasantly awakened 

0,2253909670,Sat Jun 20 08:56:07 PDT 2009,NO_QUERY,JanC60,"@glennbeck Hubby not with me on this, tho' he liked your stage show.Thinks Obama firing IG illegally was a technicality, maybe more 2it "

0,2253909738,Sat Jun 20 08:56:07 PDT 2009,NO_QUERY,mehulved,"@Spitphyre ohk. /me heading in opposite direction. Town side from Andheri, now. "

0,2253913546,Sat Jun 20 08:56:29 PDT 2009,NO_QUERY,TragicMatt,hasn't had a day completely off work in almost 2 weeks (i think)...and I don't know what to do.  

0,2253913802,Sat Jun 20 08:56:30 PDT 2009,NO_QUERY,evertoniantoddy,I'm in a bad mood. Bored and pissed off 

0,2253913886,Sat Jun 20 08:56:31 PDT 2009,NO_QUERY,ilyse324,wonders if Pride parade will happen?  Nasty weather out there and I am laid up on the couch with a bad back 

0,2253913940,Sat Jun 20 08:56:31 PDT 2009,NO_QUERY,Unima,@sv4ns ... and unlocking (iPhone 2G only) ... 

