sentiment,userid,date,query,userId,text0,2199162399,Tue Jun 16 17:06:27 PDT 2009,NO_QUERY,michxxblc,@DDubsTweetheart I have no idea. LMFAOOO! I'm out of it right now. 

0,2199162606,Tue Jun 16 17:06:28 PDT 2009,NO_QUERY,RosieB17,cute black- but not the Ones..... 

0,2199163544,Tue Jun 16 17:06:33 PDT 2009,NO_QUERY,cammietreppie,"everybody else has lines, vines, and trying times. except me and anna.      i am crying."

0,2199163711,Tue Jun 16 17:06:34 PDT 2009,NO_QUERY,Tidus,@dftya Poor lil' guy.  I've never been in a cast.  My left wrist remarkably hasn't healed 100% yet since I last flew over my handlebars.  

0,2199163844,Tue Jun 16 17:06:34 PDT 2009,NO_QUERY,CRYSTALLLLLLLL,Headacheeee 

0,2199164069,Tue Jun 16 17:06:36 PDT 2009,NO_QUERY,mikegrant,@bobwcaincom I really don't like south wigston 

0,2199164582,Tue Jun 16 17:06:38 PDT 2009,NO_QUERY,peaceoutHelga,"@Heyyjamieheyy i think i said &quot;awwwww i loove you!&quot; hugged him, signed his yearbook, and said bye "

0,2199164654,Tue Jun 16 17:06:39 PDT 2009,NO_QUERY,crocked_knee,"@hsingling called me fat and old. unfortunately, she's right "

0,2199165065,Tue Jun 16 17:06:41 PDT 2009,NO_QUERY,JoJoDJDanger,"@KevoJonas Spanish fans were a little bit sad...because you leave the concert without saying goodbye..  PLEASE,PLEASE,PLEASE REPLY MEE!!!"

0,2199165113,Tue Jun 16 17:06:41 PDT 2009,NO_QUERY,foodjunky,@kmitts RIP bicycle? What happened to it? 

0,2199165287,Tue Jun 16 17:06:41 PDT 2009,NO_QUERY,Lwdove2509,Feeling really sick.. wish my sore throat would go away 

0,2199165708,Tue Jun 16 17:06:43 PDT 2009,NO_QUERY,paST0Psweatnme,I miss my blonde hair   http://mypict.me/45cR

0,2199165892,Tue Jun 16 17:06:44 PDT 2009,NO_QUERY,michael_mcclain,Praying for the Ikes as the family deals with Mrs. Ike's cancer discovered too late to treat. Father also has heart trouble. 

0,2199166225,Tue Jun 16 17:06:46 PDT 2009,NO_QUERY,jlainemusic,@littlemsclever figures. thats always been my luck  (goes back to mopping floor)

0,2199166378,Tue Jun 16 17:06:47 PDT 2009,NO_QUERY,lizu93,@shaheershahid whatever..  I'm so effin sad though.. I just got mine in february and now there's a new one :[

0,2199166634,Tue Jun 16 17:06:48 PDT 2009,NO_QUERY,s5h,Wow ummm..... trying not to care but i do....why? ughhh Whatever Fuck it. I dont care anymore.......i think 

0,2199166730,Tue Jun 16 17:06:49 PDT 2009,NO_QUERY,fu_imnAtt,washing my own hair.... this might take a few hours ugh damn alex for not being at work today 

0,2199166805,Tue Jun 16 17:06:49 PDT 2009,NO_QUERY,tamaralamala,"@cstatus ew. pet stores are bad and they should all be blown to bits (w/o the animals, obv) wish your friends had done some research, smh "

0,2199167106,Tue Jun 16 17:06:51 PDT 2009,NO_QUERY,geekbrat,my tummy hates me and wants me to diiiiiiie 

0,2199167289,Tue Jun 16 17:06:52 PDT 2009,NO_QUERY,Kclp20,Wishing I was at the cmt awards 

0,2199167296,Tue Jun 16 17:06:52 PDT 2009,NO_QUERY,painted_flame,Really need to sort out my body clock...especially as I have to get up at 7 on saturday... 

0,2199167328,Tue Jun 16 17:06:52 PDT 2009,NO_QUERY,earlbobadilla,sophomore year... first time using comp. shops...   not really used to this.. the keyboard feels so different..

0,2199167375,Tue Jun 16 17:06:52 PDT 2009,NO_QUERY,jessmarie1224,it just cost $30 to fill my car up. sad story 

0,2199167587,Tue Jun 16 17:06:53 PDT 2009,NO_QUERY,oliviaspruill,GAH bubbles just popped and I smeared a little of it 

0,2199167661,Tue Jun 16 17:06:53 PDT 2009,NO_QUERY,MsDeeDee1,I'm feeling down in the dumps  Lord I need you. Not asking for things...Just FAVOR!!

0,2199169163,Tue Jun 16 17:07:01 PDT 2009,NO_QUERY,nkotbblockhead,@donkeymomma Can I hide in the trunk when u go to Va? I swear I will jet as soon as we are there. I MISS it!  Any sign of Miley yet? ;)

0,2199169328,Tue Jun 16 17:07:02 PDT 2009,NO_QUERY,Aubriss,#haveyouever Dropped your phone in the toilet? I HAVE! 

0,2199169638,Tue Jun 16 17:07:03 PDT 2009,NO_QUERY,SamVolz,has a huge headache. 

0,2199170774,Tue Jun 16 17:07:09 PDT 2009,NO_QUERY,iliassyayouss,Still in this fucking town!! Diamond City Antwerpen in Belgium!! I swear that's suck like ever!!  nthg to do!!

0,2199171406,Tue Jun 16 17:07:12 PDT 2009,NO_QUERY,SunShineStuvS,@eneni @miispuffie I hate y'all because you have access to party rice and I don't  I got hungry thinking about it's orangey goodness lol

0,2199171590,Tue Jun 16 17:07:13 PDT 2009,NO_QUERY,KyMaurene,"im soooo sick, and i have a studio session in an hour and a half  gotta lay these vocals!"

0,2199172398,Tue Jun 16 17:07:17 PDT 2009,NO_QUERY,mikemakin,"first day back in work tomorrow and ive just got round to starting galattica season 4, cant put it down "

0,2199173342,Tue Jun 16 17:07:21 PDT 2009,NO_QUERY,Redbullgurl,http://twitpic.com/7ky3w - the other car is on the right side this ones on the left. ouch!  sucks

0,2199173468,Tue Jun 16 17:07:22 PDT 2009,NO_QUERY,emilytheunicorn,why wont school just closee 

0,2199173626,Tue Jun 16 17:07:23 PDT 2009,NO_QUERY,JovannyG,my board snapped 

0,2199173660,Tue Jun 16 17:07:23 PDT 2009,NO_QUERY,shaw_na_na,@billyontheradio Billy why don't we get to hear your sexy voice as much as we use to? NYC took u away from us here in Dallas 

0,2199173893,Tue Jun 16 17:07:24 PDT 2009,NO_QUERY,Extremo,"Oh man, this is going to take all freaking day... "

0,2199174038,Tue Jun 16 17:07:25 PDT 2009,NO_QUERY,meiii_,is finding it really hard to get out of bed this morning 

0,2199174189,Tue Jun 16 17:07:25 PDT 2009,NO_QUERY,bethm92,haha taylor swift rapping with t-pain. i love her. and cant believe it was only 5 days ago that i saw her live. it seems like forever ago 

0,2199174651,Tue Jun 16 17:07:28 PDT 2009,NO_QUERY,scottpierce,"@david_wiggs Jiminy, Zicam was my homeopathic of choice, too! "

0,2199174717,Tue Jun 16 17:07:28 PDT 2009,NO_QUERY,NikkiMontana,damn it . why ghostface have to go to the club tonight...  wheres the frozen peas at

0,2199175808,Tue Jun 16 17:07:33 PDT 2009,NO_QUERY,Neketa01,I wish I was going to convocation... 

0,2199175824,Tue Jun 16 17:07:34 PDT 2009,NO_QUERY,miawoods2005,@SweetEpiphany I really don't know. Try googling it  sorry. I only know about iPhones. I use twitterfon app and it allows me to do it

0,2199176206,Tue Jun 16 17:07:36 PDT 2009,NO_QUERY,VinceNotVance,WTF I have over 500 updates already? Why do I never realize it until it's too late? 

0,2199176323,Tue Jun 16 17:07:36 PDT 2009,NO_QUERY,dwankrista,I go to work and miss the party pics?    Sad times.

0,2199176674,Tue Jun 16 17:07:38 PDT 2009,NO_QUERY,stephaniems11,I am sooo exhausted. I have had a headache aalll day 

0,2199176751,Tue Jun 16 17:07:38 PDT 2009,NO_QUERY,erinashleyJBfan,@taylorswift13 ..im watching CMT and theres no sound  but your rap was cool..althoughi couldnt hear it  ...sounds back!

0,2199176775,Tue Jun 16 17:07:38 PDT 2009,NO_QUERY,unclefuzz,http://twitpic.com/7ky54 - @ingalingus I don't like the sound of that idea 

0,2199176849,Tue Jun 16 17:07:39 PDT 2009,NO_QUERY,tiffanyroberts,"is going to australia! meow. someday tehran, hopefully "

0,2199177390,Tue Jun 16 17:07:42 PDT 2009,NO_QUERY,turtleturd6736,headache. 

0,2199177572,Tue Jun 16 17:07:42 PDT 2009,NO_QUERY,dsmith33,ASU vs. UT in the College World Series and Cubs vs. White Sox!!!  It's a great night for baseball...and I'm studying for a Greek exam. 

0,2199177860,Tue Jun 16 17:07:44 PDT 2009,NO_QUERY,roxytheonly1,Omg my car won't start I know its the battery but that's all I know well someone is comming to get me 

0,2199177906,Tue Jun 16 17:07:44 PDT 2009,NO_QUERY,TitsMcGee206,Someone poisoned the bunny that my dog got a hold of and now he's in the doggy ER 

0,2199178344,Tue Jun 16 17:07:46 PDT 2009,NO_QUERY,mpmll,"homework and more homework, why ?!?!  todaaaaaaay LVATT ! YEAH , now gotta go to do more homework."

0,2199178401,Tue Jun 16 17:07:47 PDT 2009,NO_QUERY,hilaryrockwood,"lkajflalfahlkaklsd! Stupid A- history of consciousness grade, messing up my 4.0 "

0,2199178481,Tue Jun 16 17:07:47 PDT 2009,NO_QUERY,OhhRachel,I wish my boyfriend would hurry and come home 

0,2199178512,Tue Jun 16 17:07:47 PDT 2009,NO_QUERY,NikFreeman,@BrentLauren I can't have dairy 

0,2199178688,Tue Jun 16 17:07:48 PDT 2009,NO_QUERY,runfrommaddy,I have to boil water on the stove cause our kettles broken 

0,2199178955,Tue Jun 16 17:07:50 PDT 2009,NO_QUERY,madox_gold,feeln down in the dumps hate been sick......hope its not swine flu! 

0,2199178970,Tue Jun 16 17:07:50 PDT 2009,NO_QUERY,clareishere,Why do they get so big?! Yuck yuck I hate bug bites.  http://twitgoo.com/tutu

0,2199179708,Tue Jun 16 17:07:54 PDT 2009,NO_QUERY,brokenangel1982,@donkeypunkmist Oh shit! What happened hon? If you need anything feel free to call me. In the mean time I hope you guys find him. 

0,2199179794,Tue Jun 16 17:07:54 PDT 2009,NO_QUERY,hahaitsliz,my cousin toby died last night  i dont think i can handle anymore dieing this year 

0,2199180660,Tue Jun 16 17:07:58 PDT 2009,NO_QUERY,JoseVLara,Driving home in traffic from Westwood! I am so hungry!!!  long way to go to get home! HELP!!!

0,2199180887,Tue Jun 16 17:07:59 PDT 2009,NO_QUERY,had02,I LOVE work... but I miss talking to my brother during the day 

0,2199181028,Tue Jun 16 17:08:00 PDT 2009,NO_QUERY,Heyyjamieheyy,@peaceoutHelga aww how sad  why did he tell you on the last day of school?

0,2199181104,Tue Jun 16 17:08:00 PDT 2009,NO_QUERY,gibbs831,im frekin bored and im sick  my tummy hurts again

0,2199181161,Tue Jun 16 17:08:01 PDT 2009,NO_QUERY,errica,Ugh. Gas is so expensive. 

0,2199181428,Tue Jun 16 17:08:02 PDT 2009,NO_QUERY,kevmetz,RIP North Shore. So close...yet soooo far 

0,2199187324,Tue Jun 16 17:08:32 PDT 2009,NO_QUERY,ewabartecki, its soooo cold out &amp; my bed is soooo warm! I don't wannaget up....

0,2199187555,Tue Jun 16 17:08:33 PDT 2009,NO_QUERY,Y0NAI,...but it's harder to meditate without a rain 

0,2199187893,Tue Jun 16 17:08:35 PDT 2009,NO_QUERY,Merebearrr,@Athlete065 join the club. 

0,2199187950,Tue Jun 16 17:08:35 PDT 2009,NO_QUERY,clouddancefest,@SteveHills Not a peep. Still 22 hours and 52 mins to go... 

0,2199188050,Tue Jun 16 17:08:36 PDT 2009,NO_QUERY,anilam18,Sigh. I thought maybe when they did the update it would fix me not getting tweets to phone. But nope  i feel in the dark!

0,2199188107,Tue Jun 16 17:08:36 PDT 2009,NO_QUERY,sarahweddle,"If I got CMT, I'd be watching the Country Music Awards. Alas, I'm watching the repeat of NCIS instead.  No country music for me tonight."

0,2199188180,Tue Jun 16 17:08:36 PDT 2009,NO_QUERY,Ke3bZ,"-- unfortunately lost alot of the music I'd been working on recently   , but good a time as any to start anew!"

0,2199188196,Tue Jun 16 17:08:37 PDT 2009,NO_QUERY,JonathanRobert,Ahhh work at 8pm again  nobody likes me

0,2199188286,Tue Jun 16 17:08:37 PDT 2009,NO_QUERY,AleehM,coooooooooooold 

0,2199188398,Tue Jun 16 17:08:38 PDT 2009,NO_QUERY,Jessy016,@fiyacrackaa i tanned .. but then i took a shower and now it seems like my tan went away 

0,2199188400,Tue Jun 16 17:08:38 PDT 2009,NO_QUERY,michellesallen,so cold this morning  I don't wanna get out of my house

0,2199188649,Tue Jun 16 17:08:39 PDT 2009,NO_QUERY,VictoriaPlumley,Disney movies failed.. computer ran out of batteries so I couldn't finish the download 

0,2199188727,Tue Jun 16 17:08:39 PDT 2009,NO_QUERY,CYNTHIAMUNOZ,I am leaving my house because my mom no longer wants me here  but it's her house so I'm leaving

0,2199189418,Tue Jun 16 17:08:43 PDT 2009,NO_QUERY,LoopholeStacie,@beemusings Yeah!  Two more partially lost toenails   !!!!

0,2199189432,Tue Jun 16 17:08:43 PDT 2009,NO_QUERY,nelya8503,It's been an awful summer so far. Sinus infection that won't go away. Bed ridden since Saturday 

0,2199189622,Tue Jun 16 17:08:44 PDT 2009,NO_QUERY,Ojisama,"Twitter, you are making me lonely by not sending me device updates "

0,2199189811,Tue Jun 16 17:08:45 PDT 2009,NO_QUERY,yeliab29,"It's not fair, and i think your really mean...i think your really mean "

0,2199190650,Tue Jun 16 17:08:49 PDT 2009,NO_QUERY,GirlNatalie,Omgee sum 1 called my office and the lady wanted to report something and theman came runnin and  yelled at her and started beating her!!! 

0,2199191514,Tue Jun 16 17:08:54 PDT 2009,NO_QUERY,brgulker,"I just got the E 74 error from my Xbox 360; in other words, it's dead  #fb"

0,2199191689,Tue Jun 16 17:08:55 PDT 2009,NO_QUERY,kaylashootsup,"Taking all the things out of my car that make it my own, like stickers and buttons. This is sad "

0,2199191924,Tue Jun 16 17:08:56 PDT 2009,NO_QUERY,misfit_narciss,Were all just broken hearts 

0,2199192497,Tue Jun 16 17:08:59 PDT 2009,NO_QUERY,beltsquid,Curse my inability to write unless I have just the right music to do so 

0,2199192598,Tue Jun 16 17:09:00 PDT 2009,NO_QUERY,keithweaver,@briantweaver Bob Moores. 

0,2199192732,Tue Jun 16 17:09:01 PDT 2009,NO_QUERY,colbystream,Car brakes broke. I'm now walking home.  oh well. At least I'll get lots of exercise.

0,2199192764,Tue Jun 16 17:09:01 PDT 2009,NO_QUERY,_megan_marie_,"No power= no sleep= cranky pants 101, ahhhh make it stop it's almost my birthday "

0,2199193023,Tue Jun 16 17:09:02 PDT 2009,NO_QUERY,Az84,Almost half way through the week. Found out I can't go see cog Saturday night  anyone want a ticket?

0,2199193055,Tue Jun 16 17:09:02 PDT 2009,NO_QUERY,MrHendo,Gonna start Manhunt 2. I hope this scares the crap out of me but it probably won't 

0,2199193527,Tue Jun 16 17:09:05 PDT 2009,NO_QUERY,AnikaRamirez,@kassles7 I'm a pescetarian (a cheater I know but yummy sushi) and that place is delicioso fo sho. Too bad you're not in SoCal!!! 

0,2199194135,Tue Jun 16 17:09:08 PDT 2009,NO_QUERY,Noreen811,Trying to get motivated to go to the barn...got drenched on my walk to the train 

0,2199194898,Tue Jun 16 17:09:13 PDT 2009,NO_QUERY,iamlottie,my moma always told me its okayy to cry  smhh

0,2199195241,Tue Jun 16 17:09:13 PDT 2009,NO_QUERY,jimmybott,Still havent managed to finish that damn emma frost picture 

0,2199195436,Tue Jun 16 17:09:14 PDT 2009,NO_QUERY,SailorPsychic,Waiting for a friend w/ a truck at target and I really want one of these collage picture frames for our London pictures 

0,2199195564,Tue Jun 16 17:09:15 PDT 2009,NO_QUERY,Ms_TyahnaTaylor,#iwould love to see all my old friends from carver. 

0,2199195670,Tue Jun 16 17:09:15 PDT 2009,NO_QUERY,kmdmozzone,Was just relieved from my post an hour earlier than expected...Don't really know what to do with myself 

0,2199196096,Tue Jun 16 17:09:18 PDT 2009,NO_QUERY,sara_smile,@o0vide0kid0o nah  I don't think they have it for ps2 and its too expensive rn

0,2199196121,Tue Jun 16 17:09:18 PDT 2009,NO_QUERY,GinaBjerke,"@officialTila ohmygosh, Take me "

0,2199196150,Tue Jun 16 17:09:18 PDT 2009,NO_QUERY,Sethophers,World is a scary place. Brother just talked to me about the Texas Syndicate and how predominant they are 

0,2199196499,Tue Jun 16 17:09:20 PDT 2009,NO_QUERY,Kamden1221,"@Cortneyr3 I know, right?!!!! He replys to other people...I've seen it  that is mean. haha..he will though..I can feel it. haha"

0,2199196846,Tue Jun 16 17:09:22 PDT 2009,NO_QUERY,januszNyC,@bromco i got too late:/ and i missed my only chance to meet David 

0,2199197224,Tue Jun 16 17:09:23 PDT 2009,NO_QUERY,Princess_Holly,"@Badcrumble I went to the pimc blog to see if I could click on it and watch, but no such luck. "

0,2199197264,Tue Jun 16 17:09:24 PDT 2009,NO_QUERY,AlainaW,I think i am just destined to wear high waters. They just dont make pants for tall little people 

0,2199197844,Tue Jun 16 17:09:27 PDT 2009,NO_QUERY,Cakattack,Hey @alyankovic Are you going to Portland OR on your next tour? you snubbed us last time   (#WeirdAl live &gt; http://ustre.am/3nDH)

0,2199197947,Tue Jun 16 17:09:27 PDT 2009,NO_QUERY,lbgmonchichi,"&quot;Bitch run, he wont catch you&quot; lol I had know idea about all of that, very sad "

0,2199198078,Tue Jun 16 17:09:28 PDT 2009,NO_QUERY,DaveTheStalker,"No 1 1/4lb MEGA burgers tonight. Maybe, no baseball "

0,2199199668,Tue Jun 16 17:09:36 PDT 2009,NO_QUERY,derekiscanadian,@jeepersmedia awww i wish i could be there to watch you mike but im at work....    &lt;(Derek)&gt;

0,2199200171,Tue Jun 16 17:09:39 PDT 2009,NO_QUERY,mommytaco,@JessicaYahn if i had cable i would 

0,2199200331,Tue Jun 16 17:09:40 PDT 2009,NO_QUERY,LynnMaudlin,@KKDur I hear that GPS devices are a big come-on for thieves... I'm so sorry--  #hhrs

0,2199200332,Tue Jun 16 17:09:40 PDT 2009,NO_QUERY,chrisdejabet,Dinner prep delayed. Meat hasn't completely thawed. 

0,2199200533,Tue Jun 16 17:09:41 PDT 2009,NO_QUERY,SunKissd,@imcudi I ordered a pizza &amp; asked for triple extra cheese and now I'm in the same predicament 

0,2199201116,Tue Jun 16 17:09:44 PDT 2009,NO_QUERY,Kristijan,@RoseCavar The truth can be dirty 

0,2199201577,Tue Jun 16 17:09:46 PDT 2009,NO_QUERY,fateliesahead,"Things I'm currently loving: summer, chipotle, pinkberry and spw. Things I'm not currently loving: The fact that I have a final tomorrow "

0,2199201715,Tue Jun 16 17:09:47 PDT 2009,NO_QUERY,iamselenamgomez,I reallyyy miss @drewseeley  The mermaid show!!!  I love and miss you so much!- xoxo Selena ~â ¥~

0,2199201949,Tue Jun 16 17:09:48 PDT 2009,NO_QUERY,elallemand,workin late as always 

0,2199202042,Tue Jun 16 17:09:49 PDT 2009,NO_QUERY,hellivina,"@curveballmami nope, Jimmy said Seattle will not happen  apparently Denver might be lucky and get him!"

0,2199202099,Tue Jun 16 17:09:49 PDT 2009,NO_QUERY,sweeetnspicy,@yellowduckx good luckkk!!!! im still upset about tetris 

0,2199202540,Tue Jun 16 17:09:51 PDT 2009,NO_QUERY,Skittl1321,did not skate well tonight.   So much work to do  I'm ready for this week to be over.

0,2199203344,Tue Jun 16 17:09:55 PDT 2009,NO_QUERY,unechevre,@mcdoeli07 i'm going crazy... i think literally  a friend is giving me her old shuffle to get me by...

0,2199203627,Tue Jun 16 17:09:57 PDT 2009,NO_QUERY,yunlingng,bored since school is out! 

0,2199203998,Tue Jun 16 17:09:59 PDT 2009,NO_QUERY,brandon_hart,Why must xbox live be down on the one day i need it to work? Devin and i wanted to play Call Of Duty before she leaves for cheer camp 

0,2199204052,Tue Jun 16 17:09:59 PDT 2009,NO_QUERY,tamaralamala,just threw up some bile since I haven't really eaten much the past few days and nothing but water today 

0,2199204215,Tue Jun 16 17:10:00 PDT 2009,NO_QUERY,RCachATX,my iPhone 3GS order is still &quot;prepared for shipment&quot; 

0,2199204364,Tue Jun 16 17:10:01 PDT 2009,NO_QUERY,desertlibrarian,Very bummed I won't be able to attend Embassy Ball tonight - have just taken migraine meds and will crash soon  #slapam #slait #sla2009

0,2199204397,Tue Jun 16 17:10:01 PDT 2009,NO_QUERY,Mry_,"arg, it's getting late now over here - 2 am  - and I got work to do tomorrow... Though, wouldn't be the first time I didn't get slept -_-"

0,2199204486,Tue Jun 16 17:10:01 PDT 2009,NO_QUERY,cartrouble,roxytheonly1: Omg my car won't start I know its the battery but that's all I know well someone is comming to get me 

0,2199204594,Tue Jun 16 17:10:02 PDT 2009,NO_QUERY,betsymaebartlet,@billbeckett the chat keeps dying and i can't get back in 

0,2199204666,Tue Jun 16 17:10:02 PDT 2009,NO_QUERY,ginamarierantis,rain delay  gonna go to the gym..come on sox you've got these 6 games!!!

0,2199204673,Tue Jun 16 17:10:02 PDT 2009,NO_QUERY,Tidus,"@SnowyXue Sorry, I never explained the MUNI (Municipal Transportation) bus to you.    It's San Francisco's main public transportation."

0,2199215138,Tue Jun 16 17:10:53 PDT 2009,NO_QUERY,iMcFly,Someone got off the bus too early. 

0,2199215270,Tue Jun 16 17:10:54 PDT 2009,NO_QUERY,chrisfarber,"@benlebar yep, I think I am going to do the same. It just stinks because I have some deep scratches in this one's display "

0,2199215628,Tue Jun 16 17:10:56 PDT 2009,NO_QUERY,supercoolhotwea, Am I sad because I miss the lamest people that just left my house? Unfortunately. No. More. sDot.

0,2199215636,Tue Jun 16 17:10:56 PDT 2009,NO_QUERY,jamesbrnett,I've stuck a big wet blanket on the clothes line outside and I don't think it has a chance in hell of drying and it'll probably go mouldy 

0,2199215661,Tue Jun 16 17:10:56 PDT 2009,NO_QUERY,caitisfalling,Super studying for finals  not in a good mood...you're so immature !!!!

0,2199216005,Tue Jun 16 17:10:58 PDT 2009,NO_QUERY,CassandraMouco,"Europe next Tuesday, guh! Gonna miss my B  &lt;3"

0,2199216191,Tue Jun 16 17:10:59 PDT 2009,NO_QUERY,dityararas,mau ke sekolah trus langsung BTA. It's a loooong day! 

0,2199217198,Tue Jun 16 17:11:04 PDT 2009,NO_QUERY,Montse_S5,"@stephanie_xoxo I wasn't being intense...  And it's okay. I knew you were,"

0,2199217369,Tue Jun 16 17:11:05 PDT 2009,NO_QUERY,styliiista,an up &amp; down day of tears &amp; sadness. my love lost his 1st cousin in new jersey 2day. it made headline news. my heart feels broken 2day. 

0,2199217808,Tue Jun 16 17:11:07 PDT 2009,NO_QUERY,brikeane,ew it's been raining alllll day  going for a jog (soft J!) at the gym then maybe reading some school stuff..?

0,2199218054,Tue Jun 16 17:11:08 PDT 2009,NO_QUERY,MattK187,@lovegisele hey hun your site appears to be down 

0,2199218166,Tue Jun 16 17:11:09 PDT 2009,NO_QUERY,shanerzz,@RobbyRav i haven't seen The Hangover yet either. 

0,2199218275,Tue Jun 16 17:11:09 PDT 2009,NO_QUERY,Zhulufuse,just went to Youtube... my stupid computer keeps exitting me outta there 

0,2199218528,Tue Jun 16 17:11:11 PDT 2009,NO_QUERY,valeriemcfly,Tired to be sick and cough my lungs out 

0,2199218783,Tue Jun 16 17:11:12 PDT 2009,NO_QUERY,LiamWPC,@Drizzle772 and I knew u held one of my citizenships against me.    Btw- down 10% battery left.

0,2199218906,Tue Jun 16 17:11:12 PDT 2009,NO_QUERY,jonasgirl020,some many things so little time 

0,2199218952,Tue Jun 16 17:11:13 PDT 2009,NO_QUERY,charzimmerman,"Ripped my shorts in the crotch, accidentally took all the Air Race pics in small resolution=pissed fiance, and my face is puffy from sun. "

0,2199219029,Tue Jun 16 17:11:13 PDT 2009,NO_QUERY,quinsterM,I am moving to Chicago soon for school and I must say I am really gonna miss cali!! And Im alittle sad.  The count down begins.

0,2199219149,Tue Jun 16 17:11:14 PDT 2009,NO_QUERY,rehes,ok grrrr....my tummy is serious rumble in the bronx....gahhhh! shutup! 

0,2199219297,Tue Jun 16 17:11:14 PDT 2009,NO_QUERY,banhart,"my dad is home form the hospital, he had a bladder infection  but he is alright now"

0,2199219460,Tue Jun 16 17:11:15 PDT 2009,NO_QUERY,lilBailey04,out of sports for awhile   agh what am i gonna do!!!

0,2199219757,Tue Jun 16 17:11:17 PDT 2009,NO_QUERY,Medeiros83,Still no live!  I'm well on my way to finishing Xmen Origins Wolverine then maybe I will do the hard campaign on COD...

0,2199219858,Tue Jun 16 17:11:17 PDT 2009,NO_QUERY,ReiserKarin,"@kirstiealley: today I have my sad-day, need someone to make me a little bit happier.. "

0,2199219882,Tue Jun 16 17:11:17 PDT 2009,NO_QUERY,Indiiee_Kids,"My feet are so sore , poor little toesies "

0,2199220049,Tue Jun 16 17:11:18 PDT 2009,NO_QUERY,nomysteryleft,Driving to Walnut Creek and I'm so tired! 

0,2199220063,Tue Jun 16 17:11:18 PDT 2009,NO_QUERY,danelf84,Less than 24 hours and I'm already being persecuted for twittering. 

0,2199220167,Tue Jun 16 17:11:19 PDT 2009,NO_QUERY,davis_25,"Enjoying summer break....oh wait, I have a job now too "

0,2199220210,Tue Jun 16 17:11:19 PDT 2009,NO_QUERY,Tray_Sea,@Bay_B_Doll I have the same damn problem.  it's so frustrating!

0,2199220300,Tue Jun 16 17:11:19 PDT 2009,NO_QUERY,dumpy3k,@joatthedisco i will dont worry   oh tell the whole world why dont ya lol 

0,2199220356,Tue Jun 16 17:11:20 PDT 2009,NO_QUERY,Gno2Smoothnwavy,bout to light up...need a smoke buddy 

0,2199222155,Tue Jun 16 17:11:29 PDT 2009,NO_QUERY,MzMiaCuNnt,Men are crazy.. Idk wat to do now 

0,2199222578,Tue Jun 16 17:11:31 PDT 2009,NO_QUERY,Bubbles_pop4,depressed  why would he do that to me :S if only i could rewind time..

0,2199222888,Tue Jun 16 17:11:32 PDT 2009,NO_QUERY,akopp1025,I am so tired... But I know I won't be able to go to sleep.  Baby Ella please come soon!

0,2199222900,Tue Jun 16 17:11:32 PDT 2009,NO_QUERY,scotzchick,@kirsty1181 I knew about the overtime. Kim told me bout the long runs though  bollocks I say!!  And I wont regret it surely!? lol

0,2199222991,Tue Jun 16 17:11:33 PDT 2009,NO_QUERY,mike_john,ive finished another peice of artwork.... now i really want to put it on deviant art ... but my cameras broken 

0,2199223206,Tue Jun 16 17:11:34 PDT 2009,NO_QUERY,ladynastydotnet,"No power means no driving, and no AC "

0,2199223293,Tue Jun 16 17:11:35 PDT 2009,NO_QUERY,amyreid26,@PRoachCrackHead Nope i tried it  i'll try to re-download them. It's gunna take a while but its worth it  !

0,2199223331,Tue Jun 16 17:11:35 PDT 2009,NO_QUERY,cutthroatpixie,THIS ISN'T MY IDEA OF FUN  #IMISSCATH #IMISSCATH #IMISSCATH #IMISSCATH #IMISSCATH #IMISSCATH #IMISSCATH #IMISSCATH #IMISSCATH #IMISSCATH

0,2199223501,Tue Jun 16 17:11:36 PDT 2009,NO_QUERY,notmyforte,"@Motoko_K Well, if you do like it, don't talk to me about it. "

0,2199223537,Tue Jun 16 17:11:36 PDT 2009,NO_QUERY,natagomez,this tea doen't taste good at all but I have to drink it 

