0,2266221316,Sun Jun 21 08:07:18 PDT 2009,NO_QUERY,hellokrystal,I love Juan Carlos Huerta Jr.  and I always will.

0,2266221610,Sun Jun 21 08:07:20 PDT 2009,NO_QUERY,ox_tara,think i have a cold... in june 

0,2266221749,Sun Jun 21 08:07:21 PDT 2009,NO_QUERY,oolizzy,Wake-Up!! Ugh . It's Rainy  

0,2266222346,Sun Jun 21 08:07:25 PDT 2009,NO_QUERY,ienouiti,Dead @ work until 9:00PM. FML 

0,2266222362,Sun Jun 21 08:07:25 PDT 2009,NO_QUERY,Erin_shikari,sore tummy  guff weather .......suckky day suckey indeeed !

0,2266222859,Sun Jun 21 08:07:29 PDT 2009,NO_QUERY,babyyg,@louieeee whatt feeeling? 

0,2266222951,Sun Jun 21 08:07:29 PDT 2009,NO_QUERY,steve228uk,@Tooory I guessed as much 

0,2266223150,Sun Jun 21 08:07:31 PDT 2009,NO_QUERY,IAMWHATUC,very sad...today is my last day of my mini vacation   I really don't want to go back to work. UGH.......

0,2266223491,Sun Jun 21 08:07:33 PDT 2009,NO_QUERY,KaraLovan,Good morninggg! Happy Father's Day!!! I have bug bites EVERYWHERE. 

0,2266223634,Sun Jun 21 08:07:35 PDT 2009,NO_QUERY,KarenBancroft,Should really make a move towards getting dressed today. Hangover is inhibitting progress 

0,2266224045,Sun Jun 21 08:07:37 PDT 2009,NO_QUERY,snipeyhead,@brlittle Ugh... this interface is already so horrible.... I don't know if I can bear adding another option 

0,2266224061,Sun Jun 21 08:07:38 PDT 2009,NO_QUERY,biaaiueo,"i feel so lonely, i don't feel like i have any best friends "

0,2266224193,Sun Jun 21 08:07:38 PDT 2009,NO_QUERY,SheikherAP,"back home! missing my roomie, Joe, my TLP and my campers badly! *sigh* "

0,2266224326,Sun Jun 21 08:07:39 PDT 2009,NO_QUERY,KristineCamille,Today was a text-less day  http://tumblr.com/xbs23y0jk

0,2266224563,Sun Jun 21 08:07:40 PDT 2009,NO_QUERY,Libsbabe," burnt tongue, hot chocolate has a downside"

0,2266225113,Sun Jun 21 08:07:44 PDT 2009,NO_QUERY,FaraFaya,"Td sore iseng k salon kecil gt. Cuci+blow cm 15rb! Duuuh, pgawainya dbayar brp ya sbulan? Miris deh  pdhl lmyn jg kjaannya"

0,2266225159,Sun Jun 21 08:07:44 PDT 2009,NO_QUERY,Perignonic,@devinjay *bites @devinjay's* finger sobs... the price for sims3 on itunes scares me mah 

0,2266225201,Sun Jun 21 08:07:44 PDT 2009,NO_QUERY,jennyjardine,"On the way hame fae the caravan, some are feeling a bit peakie  x"

0,2266225343,Sun Jun 21 08:07:45 PDT 2009,NO_QUERY,pattiluvsnkotb,@mdkate I don't think so...... 

0,2266225354,Sun Jun 21 08:07:45 PDT 2009,NO_QUERY,SarahxFrancis,@kayleeosaurus Aww  I am spending it fatherless too. I probably won't see mine until wednesday. *hugs* &lt;3

0,2266225826,Sun Jun 21 08:07:48 PDT 2009,NO_QUERY,Shannonstar,messed up tummy. again. 

0,2266225940,Sun Jun 21 08:07:49 PDT 2009,NO_QUERY,kintarasan,All the Sunday engineering works on the Tube and the rail lines are seriously screwing with my timings today.  #fb

0,2266226080,Sun Jun 21 08:07:50 PDT 2009,NO_QUERY,leeadi,Taking the kids back 

0,2266226934,Sun Jun 21 08:07:56 PDT 2009,NO_QUERY,Shaun_Dillon,"It's weird how I still use twitter on my phone even if I'm on a computer, got a mosquito bite on my cheek "

0,2266227186,Sun Jun 21 08:07:57 PDT 2009,NO_QUERY,omgcurry,@sockmonkeymax I'm sorry to hear that. 

0,2266228465,Sun Jun 21 08:08:06 PDT 2009,NO_QUERY,bloomberggirl,Just dropped off shauno at the airport 

0,2266228784,Sun Jun 21 08:08:08 PDT 2009,NO_QUERY,abdulla77,@funaki still at the 100's for me.. looongg way to go!  need to tweet 200 times a week for a month to reach your level! ;)

0,2266228932,Sun Jun 21 08:08:09 PDT 2009,NO_QUERY,nabtweeter,@Owais_Iqbal ooh what happened?!  I missed it! 

0,2266229197,Sun Jun 21 08:08:11 PDT 2009,NO_QUERY,fallinginlovee,Stupid channel 10 has to put The Biggest Loser and the Grand Prix on before Harpers Island. 

0,2266229203,Sun Jun 21 08:08:11 PDT 2009,NO_QUERY,S_Tenuta,I'm up way too early! &gt;&lt; haha trying to finish Eclipse then getting last minute stuff for dad. Ugh I do NOT wanna work today 

0,2266229314,Sun Jun 21 08:08:11 PDT 2009,NO_QUERY,chloooebartz,chillen with my dadd. possibly working today. 

0,2266229450,Sun Jun 21 08:08:12 PDT 2009,NO_QUERY,Amill09,@ThisIsRobThomas PS__I NEEDED THAT AS HAD TO LAY OFF 20 PEOPLE LAST WEEK!  SUCKS! 

0,2266229461,Sun Jun 21 08:08:12 PDT 2009,NO_QUERY,HuSkySkatE,Will the movie Street Dreams become a worldwide show? Please make it global! I wanna watch it badly 

0,2266229490,Sun Jun 21 08:08:13 PDT 2009,NO_QUERY,mexicanguy07,I had the worse birthday ever 

0,2266229561,Sun Jun 21 08:08:13 PDT 2009,NO_QUERY,cassandROAR," just been taken into a pet shop with @staceynoir tarantulas and mini crocodiles, ah quite scared. But i want a bearded dragon."

0,2266229801,Sun Jun 21 08:08:16 PDT 2009,NO_QUERY,Smilingbecs,Went to 3 of NYC's supposed best donut shops this morning. I was let down by all 3. 

0,2266229977,Sun Jun 21 08:08:16 PDT 2009,NO_QUERY,McGimpy,On my way 2 ovh 2put babycat to sleep 4 Lori  booooo

0,2266230006,Sun Jun 21 08:08:16 PDT 2009,NO_QUERY,ChellyIsTheShit,Damn I sure wish Cafe Dupri was still open. I could go for sum fried green tomatoes and crawfish wit a side of tilapia rite now. 

0,2266230768,Sun Jun 21 08:08:22 PDT 2009,NO_QUERY,Jotuu,@realin I am jealous!! 

0,2266231078,Sun Jun 21 08:08:24 PDT 2009,NO_QUERY,default_bb,@vvrain im up to wk3 lol...now in front of my pc trying to install something  oh n the assignment mark is out la der. my group sucks

0,2266231209,Sun Jun 21 08:08:24 PDT 2009,NO_QUERY,renatarapyo,what did I do? 

0,2266231637,Sun Jun 21 08:08:27 PDT 2009,NO_QUERY,bglim,http://twitpic.com/80bkt - my dad brings home a stack of chocolates just when i can't eat sweets for a month. 

0,2266231729,Sun Jun 21 08:08:28 PDT 2009,NO_QUERY,ElspethMurray,"@RSNO Was  not to see the Huddersfield Choral Soc &amp; RSNO gigs at #stmagfest Shoulda got tix sooner, dammit!"

0,2266232471,Sun Jun 21 08:08:33 PDT 2009,NO_QUERY,sophienetter,"@katieanncurtis I know!  I wish we could all just fly over to America and watch ones of their shows, that would be amazing"

0,2266232479,Sun Jun 21 08:08:33 PDT 2009,NO_QUERY,haHasparky,"Cinnabon's remind me of papa, I miss him. I feel bad for missing fathers and mothers day. But I really wanna do this  Srry lovely parents."

0,2266232518,Sun Jun 21 08:08:34 PDT 2009,NO_QUERY,Salvo_Alex,@vioviovioleta 'Twas grrrrrreaat! I wanna see it again...but it made me miss WDW 

0,2266232802,Sun Jun 21 08:08:36 PDT 2009,NO_QUERY,ItsAlexDoo,The water is cold as hell and it feels good. No good looking girls though 

0,2266233686,Sun Jun 21 08:08:42 PDT 2009,NO_QUERY,amyluvinsum1,@sarahlouiseoxo am not at college tomoz!!! Woohoo!! Am babysitting tho.  Neva mind I'll get some money for it hehe

0,2266233711,Sun Jun 21 08:08:42 PDT 2009,NO_QUERY,cs278,"return of Top Gear tonight to the TV, shame it conflicts with pub quiz night.  #topgear #bbc #stig"

0,2266233727,Sun Jun 21 08:08:42 PDT 2009,NO_QUERY,danslinky,"missed my train by a few seconds., and forgot my phone and I know it'll have an important missed call "

0,2266233970,Sun Jun 21 08:08:44 PDT 2009,NO_QUERY,Lunenaar,David Tennant + Russel T Davies + Neil Gaiman + Amanda Palmer at Comic Con this year. *asplodes* 

0,2266234090,Sun Jun 21 08:08:45 PDT 2009,NO_QUERY,Immortal_Flower,(Gone to work now  Boo)

0,2266234401,Sun Jun 21 08:08:47 PDT 2009,NO_QUERY,tashanzac,Omg I'm sooooooo tired.  need vacation in the ocean. A beach and a shirtless Zac

0,2266234442,Sun Jun 21 08:08:47 PDT 2009,NO_QUERY,ThinkerGoneMad,Golf plans are cancelled. Daddy's not feeling well.  #FB

0,2266234492,Sun Jun 21 08:08:47 PDT 2009,NO_QUERY,Katrinonus,"It's father's day in the states so I just told my stepfather how much I love him because he's my real father. However, gotta call BioDad. "

0,2266234972,Sun Jun 21 08:08:51 PDT 2009,NO_QUERY,strebel,Flying back a day early.. May be our last days with Pete Dog. 

0,2266234982,Sun Jun 21 08:08:51 PDT 2009,NO_QUERY,LindsDesiree,I slept absolutely horrible.I blame that damn &quot;black dahlia&quot; movie.I think of messed with my psyche 

0,2266235198,Sun Jun 21 08:08:52 PDT 2009,NO_QUERY,JAverieS,Headed home. 

0,2266235307,Sun Jun 21 08:08:53 PDT 2009,NO_QUERY,HouseOfLord,It's raining and Eric and I feel sick - caravans are not the best places to feel I'll and irritable 

0,2266235648,Sun Jun 21 08:08:55 PDT 2009,NO_QUERY,CaseyLillian,"Canot wait for T4, shame McFly arent playing  Summer '09: my birthday, cocktail party, t4, free house, spain!!"

0,2266236110,Sun Jun 21 08:08:58 PDT 2009,NO_QUERY,colourings,"Also can't believe that this race may have been the last at Silverstone, where F1 began "

0,2266236255,Sun Jun 21 08:08:59 PDT 2009,NO_QUERY,johnnypalumbo,I'm hating on myself big time this morning...trying to get over it 

0,2266236278,Sun Jun 21 08:09:00 PDT 2009,NO_QUERY,megmegDF,It is way too early to be up  my arms decided to stay asleep cause they had too much fun at the concert ha. Now for fathers day

0,2266236298,Sun Jun 21 08:09:00 PDT 2009,NO_QUERY,paperxstars,"Ugh, how very dismayed I am with all sorts of people today "

0,2266236341,Sun Jun 21 08:09:00 PDT 2009,NO_QUERY,lewis_k,i just dont know what to say. i just want to..... to.....cry 

0,2266236354,Sun Jun 21 08:09:00 PDT 2009,NO_QUERY,angeraaoo,@artzybrothers we only had one meeting last week maybe next week is the terror week ( rumor is that we'll have classes even on weekends 

0,2266236559,Sun Jun 21 08:09:01 PDT 2009,NO_QUERY,scosta25,@DonnieWahlberg happy fatheres day!! hope u guys have a gr8 show in toronto..couldnt make it this time  much love xoxo

0,2266236944,Sun Jun 21 08:09:04 PDT 2009,NO_QUERY,misskirstenxx,Annoyed that 10 mins before the end of Extreme Makeover my sky decided to break so I missed the big reveal  gutted!!!!

0,2266236958,Sun Jun 21 08:09:04 PDT 2009,NO_QUERY,rantingteacher,@marktugwell Very melancholic for a Sunday morning 

0,2266237779,Sun Jun 21 08:09:09 PDT 2009,NO_QUERY,drewhartland,My exhaust is about to fall of my car 

0,2266237795,Sun Jun 21 08:09:09 PDT 2009,NO_QUERY,KristinaKey,@therealdemi I can't cuz I'm in sweden  And I still hope that you will come here ;)

0,2266237865,Sun Jun 21 08:09:10 PDT 2009,NO_QUERY,jmejia1187,I am crying out for change. Change to free internet! I have none 

0,2266238332,Sun Jun 21 08:09:13 PDT 2009,NO_QUERY,TalayRiley,Bored as hell moving my stuff out my house in kingston was supposed to be in a session with Kyle James  bullocks!!!

0,2266238473,Sun Jun 21 08:09:14 PDT 2009,NO_QUERY,JaneRuby,my gnome left me  two days were not enough for our happiness  I MISS HER ALREADY

0,2266238806,Sun Jun 21 08:09:16 PDT 2009,NO_QUERY,tweetme_sweetly,I just woke up with a 100.9 fever  staying in bed for awhile. Anyone wanna bring me some soup?

0,2266238918,Sun Jun 21 08:09:17 PDT 2009,NO_QUERY,darknlovely4,I'm upset this new ubertwitter keep freezin my phone when I try to send my twitpics 

0,2266239578,Sun Jun 21 08:09:21 PDT 2009,NO_QUERY,skdev,"my legs are killing me now, tv is in another room I can't keep running back here for tweeting  bye from here folks.. will just watch now"

0,2266239808,Sun Jun 21 08:09:23 PDT 2009,NO_QUERY,Rina1257,All this twittering is making me miss my dad and stepdad wondering who is treating them to a meal over on the west coast  have a good day!

0,2266239922,Sun Jun 21 08:09:24 PDT 2009,NO_QUERY,shyuanie,Fervently praying for an extension   

0,2266240000,Sun Jun 21 08:09:24 PDT 2009,NO_QUERY,zachhenderson,"Got Fathers Day stuff going on this mornin, missin @lifeco peeps "

0,2266240170,Sun Jun 21 08:09:25 PDT 2009,NO_QUERY,alipaigereyn,i wish the sun was out today!  booo rain!

0,2266240293,Sun Jun 21 08:09:26 PDT 2009,NO_QUERY,novarez,"@stay_awake yang ada line &quot;dont fuck this whole thing up for me&quot; ituu, kan ngga ada judulnya. katanya ngga bakal masuk nothing personal "

0,2266240800,Sun Jun 21 08:09:29 PDT 2009,NO_QUERY,jfabbian76,barely functioning today 

0,2266241262,Sun Jun 21 08:09:32 PDT 2009,NO_QUERY,Nawel_xx,@sabrinaxx heyyyy yeah still on eoghan forums.. bad times!! 

0,2266241666,Sun Jun 21 08:09:35 PDT 2009,NO_QUERY,BattleBabeeyx,ive been tweeting alot today even though its been a slow day on twitter  where are you guyss?? xx

0,2266241880,Sun Jun 21 08:09:37 PDT 2009,NO_QUERY,theREALjarvai,"is wondering if it is possible to write on therealbeach's post thing, but i dont think so  and random people are following me ? :| :o"

0,2266242475,Sun Jun 21 08:09:41 PDT 2009,NO_QUERY,ShannonQT,I love my daddy!! Wish I could be with him today 

0,2266242561,Sun Jun 21 08:09:41 PDT 2009,NO_QUERY,DKoles,I'm too lame for twitter 

0,2266242773,Sun Jun 21 08:09:43 PDT 2009,NO_QUERY,jonesmonster,stupid cable box missed the start of the grand prix 

0,2266242823,Sun Jun 21 08:09:43 PDT 2009,NO_QUERY,arabstar,being bored 

0,2266243213,Sun Jun 21 08:09:46 PDT 2009,NO_QUERY,amberrutland,Wishes I could be with my daddy for fathers day 

0,2266243226,Sun Jun 21 08:09:46 PDT 2009,NO_QUERY,sarahrpatterson,Would really like the day off to clean the apartment and do laundry. Will have to wait until tomorrow. 

0,2266243894,Sun Jun 21 08:09:50 PDT 2009,NO_QUERY,justmuneeb,oops boundry  #PakCricket

0,2266243980,Sun Jun 21 08:09:51 PDT 2009,NO_QUERY,adeenadaa,@icasillasf http://twitpic.com/7nb7s - you must be missing him 

0,2266245760,Sun Jun 21 08:10:02 PDT 2009,NO_QUERY,elektrosoundwav,"@Dbirdy I am  Well, am I at least doing  good job of it?  LOL"

0,2266245776,Sun Jun 21 08:10:03 PDT 2009,NO_QUERY,JeffW123,"only have a couple more items to unlock on TF2, of course i still need all the hats "

0,2266246441,Sun Jun 21 08:10:06 PDT 2009,NO_QUERY,MileyParamore,Stick learning for a scinece GCSE 

0,2266246492,Sun Jun 21 08:10:06 PDT 2009,NO_QUERY,defragged,@matthewbadger 

0,2266246738,Sun Jun 21 08:10:08 PDT 2009,NO_QUERY,TheSushiOne,@mistakepro this sucks. . .i won't be able to see your video for a while  no internet

0,2266247196,Sun Jun 21 08:10:10 PDT 2009,NO_QUERY,lauderlyn,@xinch My legs hurt like HELL 

0,2266247688,Sun Jun 21 08:10:13 PDT 2009,NO_QUERY,RaihanSangherra,Off to re-cert my CPR training... be back at 5 

0,2266248042,Sun Jun 21 08:10:15 PDT 2009,NO_QUERY,mickj23q,OMG [1:10AM MONDAY] and I cantt slleep 

0,2266248396,Sun Jun 21 08:10:17 PDT 2009,NO_QUERY,YoungUSAPlaya,I need a real female don't seem 2 be any left around 

0,2266248825,Sun Jun 21 08:10:20 PDT 2009,NO_QUERY,Zweibz7,I left the &quot;Taking Music Online&quot; session once as I realized it was just an excuse for the corporate sponsors of #musicedweek to promote 

0,2266249295,Sun Jun 21 08:10:23 PDT 2009,NO_QUERY,HouseOfLord,"Eric and I are in the caravan, not the best place to be irritable and ill "

0,2266249446,Sun Jun 21 08:10:24 PDT 2009,NO_QUERY,Killax3,@EmilyLovesGlee @JasmineTafoya1 i think he should be with nikki flores again  she was SO prefect for him!

0,2266249498,Sun Jun 21 08:10:24 PDT 2009,NO_QUERY,kookychick,"@Titivillus You're welcome--glad to help!  Sorry to hear about your Magnum 360, though. "

0,2266249592,Sun Jun 21 08:10:25 PDT 2009,NO_QUERY,Ladyxash,does not want sops to go waaa wish i wasnt staing in southampton now 

0,2266249803,Sun Jun 21 08:10:26 PDT 2009,NO_QUERY,YodiTheYorkie,I want everyone to know that Sam is bossy and his Nana cant even hold me or he throws a fit 

0,2266250556,Sun Jun 21 08:10:31 PDT 2009,NO_QUERY,AdrianakaBUS,Waking up gona go to work 

0,2266250844,Sun Jun 21 08:10:33 PDT 2009,NO_QUERY,cheryllohmt,I'm super bored please! Sianz  - http://tweet.sg

0,2266250927,Sun Jun 21 08:10:33 PDT 2009,NO_QUERY,CMKozak,My priest is leaving my church. I've never felt so abandoned. 

0,2266251458,Sun Jun 21 08:10:37 PDT 2009,NO_QUERY,margauxargo,@timangconcept yeah that sucks 

0,2266251656,Sun Jun 21 08:10:38 PDT 2009,NO_QUERY,kelp715,"So far, had 1 person pick up an order. Not worth being open on father's day "

0,2266251914,Sun Jun 21 08:10:40 PDT 2009,NO_QUERY,AimeeSaras,My neck and back is hurting. Will I be able to go to the gym tomorrow? 

0,2266252150,Sun Jun 21 08:10:41 PDT 2009,NO_QUERY,camonanne,learning english for test tomorrow  I hate macbeth! /Anne

0,2266252164,Sun Jun 21 08:10:41 PDT 2009,NO_QUERY,missbheartsu,Since I can't be with my dad on Father's Day  I'm off to suprise Gramps. Happy Father's Day Dad and Gramps!! #fb

0,2266252278,Sun Jun 21 08:10:42 PDT 2009,NO_QUERY,jackiejb,I am SO TIRED! I slept on my neck wrong  must get ready.... then going back to katieeeeees

0,2266252365,Sun Jun 21 08:10:42 PDT 2009,NO_QUERY,xSuzyx,Wish i was at home so i could take my dad out for father's day 

0,2266252396,Sun Jun 21 08:10:42 PDT 2009,NO_QUERY,adimas_a,Being on an unsupported carrier with iPhone is a BIG hassle. Took me a while to get tethering to work and  MMS hasn't work yet. 

0,2266252743,Sun Jun 21 08:10:45 PDT 2009,NO_QUERY,inspirex,Direct throw by no wicket  #Pakcricket

0,2266252980,Sun Jun 21 08:10:46 PDT 2009,NO_QUERY,Tudors_girlie,@fitzDJ thank you fitzdj. a sad  day for me as my dad passed away a few years ago 

0,2266253120,Sun Jun 21 08:10:47 PDT 2009,NO_QUERY,Heyhomee,"I really can't clown goin to WalMart anymore!  When u have a babygirl, u'll find ur way there also!!"

0,2266253169,Sun Jun 21 08:10:48 PDT 2009,NO_QUERY,Sherif_129,@Gawge &quot;An error occurred while processing your request.&quot;  I'll try again later

0,2266253262,Sun Jun 21 08:10:48 PDT 2009,NO_QUERY,Witherance,downloading ps cs4... 

0,2266253397,Sun Jun 21 08:10:49 PDT 2009,NO_QUERY,Tutsays,Working.  then celebrating fathers day at the hideout. And hanging out with jack!! 

0,2266253586,Sun Jun 21 08:10:50 PDT 2009,NO_QUERY,bibstha,Regreting friday nights wicked mixes  caused a lot of nuisance

0,2266253609,Sun Jun 21 08:10:52 PDT 2009,NO_QUERY,LeDerek,"not going to nyc, its to rainy "

0,2266253736,Sun Jun 21 08:10:51 PDT 2009,NO_QUERY,brittanysworldx,This is one of the times when I need to talk to Maria! Butttt.. she won't answer her cell phone 

0,2266253808,Sun Jun 21 08:10:52 PDT 2009,NO_QUERY,bbarricadex,i'm sorry  but i really do like you

0,2266254027,Sun Jun 21 08:10:53 PDT 2009,NO_QUERY,meganbemo,@youlikeashley 

0,2266254148,Sun Jun 21 08:10:54 PDT 2009,NO_QUERY,GraceMcEwen,@MMaritza HAHA. i doubt she'll come to K-town. not enough paparazzi for her ;) ahha jk. i dont wanna study for science! 

0,2266254218,Sun Jun 21 08:10:54 PDT 2009,NO_QUERY,missteapot23,would really like a hug please 

0,2266255208,Sun Jun 21 08:11:01 PDT 2009,NO_QUERY,ShotLipgloss,I gotta sleep now. Class tomorrow and that is so not cool.  High School days were WAY better.

0,2266255781,Sun Jun 21 08:11:04 PDT 2009,NO_QUERY,LegitLenaa,@Nicole1253 Cheyenne..She went to the concert last night. And like. She hasn't texted me back or anything. 

0,2266256090,Sun Jun 21 08:11:07 PDT 2009,NO_QUERY,Hattifur,"Good day, Went out. Had lunch and now settling down to do French Rev source task "

0,2266256120,Sun Jun 21 08:11:07 PDT 2009,NO_QUERY,wheelsee,@abersparky  yeah neither do I... 

0,2266256696,Sun Jun 21 08:11:10 PDT 2009,NO_QUERY,Sandra_2019,not to good after a night out 

0,2266256763,Sun Jun 21 08:11:11 PDT 2009,NO_QUERY,paulinaoh,Why's everyone's twitter font getting bigger?  Mine isn't but I want it to.

0,2266257642,Sun Jun 21 08:11:16 PDT 2009,NO_QUERY,CharlotteMcFLY,@Pineapple18 hey!! no black eye.... yet. i can feel it bruising.. hope it doesnt mark tho  WAS SO GOOD!

0,2266257874,Sun Jun 21 08:11:18 PDT 2009,NO_QUERY,kodys_angel,Off to my house to clear out the last lot of stuff :/ hate that someone will be living there on Thurs 

0,2266258387,Sun Jun 21 08:11:21 PDT 2009,NO_QUERY,mtzo81,just realized i don't have any financial for the last two years ..... 

0,2266258620,Sun Jun 21 08:11:22 PDT 2009,NO_QUERY,eddybaur,what's up? not much 4 me  Ha i like never use this 

0,2266258723,Sun Jun 21 08:11:23 PDT 2009,NO_QUERY,AmyLynne83, I can already tell that it's going to be one of *those* days...

0,2266258771,Sun Jun 21 08:11:23 PDT 2009,NO_QUERY,sodapopsonia,4 n a half hours to go still..  then i get fooood!!!

0,2266258828,Sun Jun 21 08:11:24 PDT 2009,NO_QUERY,CristineSegui,can;t believe the time has come to say goodbye to her friend Joel. His party and tomorrow will be a barrel of tears. 

0,2266258896,Sun Jun 21 08:11:24 PDT 2009,NO_QUERY,tayleedhs,Making breakfast. Dad's at work  but ill see him later!

0,2266259188,Sun Jun 21 08:11:26 PDT 2009,NO_QUERY,greentactics,#greentactics #iranelection   Problem!!! I dont see a peaceful way for the revolution 

0,2266259217,Sun Jun 21 08:11:26 PDT 2009,NO_QUERY,ohmell,good morning all!! Today kinda suxs gotta wrk cant spend the day with daddy. 

0,2266259393,Sun Jun 21 08:11:27 PDT 2009,NO_QUERY,Maustallica,All I can say is: I'm glad I wasn't around and reading this stuff in 2007. It must have been CARNAGE. 

0,2266259680,Sun Jun 21 08:11:29 PDT 2009,NO_QUERY,squareboyy,@flowasone  yeah it's happening too quickly and stuff. oh well. haha and we're rooming together hehehe.

0,2266259682,Sun Jun 21 08:11:29 PDT 2009,NO_QUERY,egggman,Damn it. Just found out @CoolxKids are playing a free show at Dundas Square tonight. Wish I could go see  Brother texted me the info...

0,2266259899,Sun Jun 21 08:11:30 PDT 2009,NO_QUERY,AkaOMiru,"Well, at least the raccoon didn't make a mess around the garbage can... inside is a different story though "

0,2266259914,Sun Jun 21 08:11:31 PDT 2009,NO_QUERY,kimberly625,Gaaah I've only seen a few videos and I can't watch the test till I get home. 

0,2266260339,Sun Jun 21 08:11:33 PDT 2009,NO_QUERY,x_beki,"@charlottewhoax i feel like shite dno whyy, and i burnt my leg on the iron the other day  hahaha, clever me"

0,2266261709,Sun Jun 21 08:11:42 PDT 2009,NO_QUERY,jennywangui,hates the fact that most her twitter friends get up when she's about to go to sleep. 

0,2266261777,Sun Jun 21 08:11:42 PDT 2009,NO_QUERY,emmypemmy,Most people have left and the sun isn't shining. 

0,2266261904,Sun Jun 21 08:11:43 PDT 2009,NO_QUERY,spectoral,"#iranelection Graphic, horrifying, tragic, but this is reality. Iran needs OUR help, world. http://bit.ly/BguyU  "

0,2266261957,Sun Jun 21 08:11:44 PDT 2009,NO_QUERY,rckvm,enjoying fathers' day... too bad I've got to give the kid back today 

0,2266262004,Sun Jun 21 08:11:44 PDT 2009,NO_QUERY,kisekiaoi,i â ¥ watching suju's old videos. teukie looked more cheerful in the past 

0,2266262362,Sun Jun 21 08:11:46 PDT 2009,NO_QUERY,jasonperryhawk,"@blang88 that sucks, but we could all tell it was coming. "

0,2266262582,Sun Jun 21 08:11:48 PDT 2009,NO_QUERY,JazzzyJamie,I woke up SOOOO sick  heading to my parents to spend Fathers Day with my stepdad anyway....I'm gonna sleep on their couch...great daughter

0,2266263207,Sun Jun 21 08:11:52 PDT 2009,NO_QUERY,thisisbananas,I'm sucking at life right now 

0,2266263808,Sun Jun 21 08:11:56 PDT 2009,NO_QUERY,melcjones,work alll day 

0,2266263910,Sun Jun 21 08:11:56 PDT 2009,NO_QUERY,VerdyBaby,Oh my god my head hurts so damn bad!  I wanna sleep!

0,2266264181,Sun Jun 21 08:11:58 PDT 2009,NO_QUERY,undermysombrero,"@yannx Entrep tomorrow or what? Yeah I know I'm not even started on SEFest yet, wtf. I hope I get better by tomorrow. I can't taste anyth "

0,2266264322,Sun Jun 21 08:11:59 PDT 2009,NO_QUERY,Jessieface823,Good Morning people even though i never even went to sleep...i up sick allllll night!  

0,2266264463,Sun Jun 21 08:12:00 PDT 2009,NO_QUERY,_ItsMel,Its rainning 

0,2266264723,Sun Jun 21 08:12:01 PDT 2009,NO_QUERY,kutti,"My favorite True Blood character is going to die eventually, no "

0,2266265116,Sun Jun 21 08:12:04 PDT 2009,NO_QUERY,ammaryasir,This duznt look too gd... we werent suppose to give away these runs  #PakCricket

0,2266265379,Sun Jun 21 08:12:06 PDT 2009,NO_QUERY,ben_gonzales,Oh Yay. Fathers day. . . . Who care's. I miss my girlfriend 

0,2266265515,Sun Jun 21 08:12:07 PDT 2009,NO_QUERY,drivernj,Oh dear.  I totally have a small glass chip on this iPod touch 

0,2266265738,Sun Jun 21 08:12:08 PDT 2009,NO_QUERY,tricoquine,at the office 

0,2266266031,Sun Jun 21 08:12:10 PDT 2009,NO_QUERY,Zidapi,"Doing a quick twitter check, then off to sleep. Working all day and up at 7am. Hoped to talk to @hardertospell but time got away from me "

0,2266266092,Sun Jun 21 08:12:10 PDT 2009,NO_QUERY,ErinPietrowski,its way too hot for soccer practice... 

0,2266266769,Sun Jun 21 08:12:15 PDT 2009,NO_QUERY,latenitelafter,"getting ready for church...i HAVE to do a poem b/c i kno its not just me, but old ladies just volunteer you!! its really sad "

0,2266267171,Sun Jun 21 08:12:17 PDT 2009,NO_QUERY,Ajramblingon,Watching Logan's Run. My palm Flower has turn black. 

0,2266267955,Sun Jun 21 08:12:22 PDT 2009,NO_QUERY,heathershanks,Had a dream that i became good friends with miley and nick. wish it was true 

0,2266268302,Sun Jun 21 08:12:25 PDT 2009,NO_QUERY,orlmain,found some AWESOME dresses. but they're too pricey 

0,2266269016,Sun Jun 21 08:12:29 PDT 2009,NO_QUERY,britt_mxgirl,Just talked to some really cool guys who were on their way to go ride dirt bikes. Wish I could go with them 

0,2266271189,Sun Jun 21 08:12:43 PDT 2009,NO_QUERY,njeeess,somebody please make me understand about twitter 

