0,2257780241,Sat Jun 20 14:52:56 PDT 2009,NO_QUERY,Mindwiper,@HABEAS2 Not even the &quot;Matrix of Leadership&quot; for Natascha or Ulric? That makes me sad  ...*G* -Mindi

0,2257780282,Sat Jun 20 14:52:56 PDT 2009,NO_QUERY,jdtuck32,"Shopping for a ping pong table, but not sure my extra room is big enough...9x5 is standard.  "

0,2257780319,Sat Jun 20 14:52:57 PDT 2009,NO_QUERY,ifyouseekangela,@crystlfalcn no. I work both Sat and Sun 

0,2257780393,Sat Jun 20 14:52:57 PDT 2009,NO_QUERY,taylorleighhh,@damorebaby i know! and every time i wear that shirt i'm going to think about him and his hands on it nd become depressed all over again 

0,2257780424,Sat Jun 20 14:52:57 PDT 2009,NO_QUERY,3sarahstack,http://twitpic.com/7xxzh - good times 

0,2257780639,Sat Jun 20 14:52:59 PDT 2009,NO_QUERY,kateybella,@pudge75 thinking of you by katy perry. It reminds me of my situation with Kirk. 

0,2257781490,Sat Jun 20 14:53:04 PDT 2009,NO_QUERY,heysusannah,ughhh i really dont feel good. at all 

0,2257781591,Sat Jun 20 14:53:04 PDT 2009,NO_QUERY,ljmcq,Headache  too much tinternet recently.

0,2257781858,Sat Jun 20 14:53:06 PDT 2009,NO_QUERY,may_ribeiro,"@Dannymcfly  You answered everyone, and dont reply me! i'm very sad  HAHA"

0,2257781936,Sat Jun 20 14:53:07 PDT 2009,NO_QUERY,DivaDebut,working on one of my many projects. I have a long weekend ahead of me..... 

0,2257782404,Sat Jun 20 14:53:09 PDT 2009,NO_QUERY,irishstryke, I think I have a cavity...

0,2257782624,Sat Jun 20 14:53:10 PDT 2009,NO_QUERY,duelistking,@dantheshive you mean I can't get the world for free?    damn....

0,2257782664,Sat Jun 20 14:53:11 PDT 2009,NO_QUERY,Mellow_Mel,Lacking some serious motivation to get through my readings before Thursdays exam 

0,2257782955,Sat Jun 20 14:53:12 PDT 2009,NO_QUERY,Moonchild67,@Gem_W Not working for me yet  Still waiting for the text...

0,2257783804,Sat Jun 20 14:53:17 PDT 2009,NO_QUERY,rhodamorgan,"@vie_elle awww I'm sorry hun  that's tough, keep ya head up"

0,2257783950,Sat Jun 20 14:53:18 PDT 2009,NO_QUERY,davidjungwoohan,Wish work would end so I can go swimming too.. 

0,2257783991,Sat Jun 20 14:53:19 PDT 2009,NO_QUERY,TelleTWA,Just threw up for the 4th time in under 3 hours...  Almost everything about today has gone the complete opposite of how I hoped it would 

0,2257790321,Sat Jun 20 14:53:55 PDT 2009,NO_QUERY,kesoleil,@Dornilust oh shit! that was today! I wanted to go! 

0,2257790411,Sat Jun 20 14:53:56 PDT 2009,NO_QUERY,givagocontato,E nem vÃ­ ONE TREE HILL hj 

0,2257790611,Sat Jun 20 14:53:57 PDT 2009,NO_QUERY,swirlywand,"We still get 3 chances to come back!  And, in the grand scheme of things- people are tweeting how to save gunshot victims in Tehran... "

0,2257790702,Sat Jun 20 14:53:58 PDT 2009,NO_QUERY,emarvinney,My mom just fucked everything up  including my mood.

0,2257791067,Sat Jun 20 14:54:00 PDT 2009,NO_QUERY,Rkoluvsdiana, realised how much he like pixie tonight 

0,2257792310,Sat Jun 20 14:54:07 PDT 2009,NO_QUERY,beck_guitar, stupid puppy kept me up all night only had 3 hrs sleep

0,2257792454,Sat Jun 20 14:54:08 PDT 2009,NO_QUERY,tonyflynn1977,was asleep. Arrrgh! 

0,2257792457,Sat Jun 20 14:54:08 PDT 2009,NO_QUERY,shortyfourth,off to the Emergency Vet with KGBS cat Mister Jude. 

0,2257792882,Sat Jun 20 14:54:10 PDT 2009,NO_QUERY,W1fey,"@RomeyoKaine times are rough, I can only afford one "

0,2257793118,Sat Jun 20 14:54:12 PDT 2009,NO_QUERY,karlitack,I hate having to apologize but this time it was my fault 

0,2257793259,Sat Jun 20 14:54:12 PDT 2009,NO_QUERY,princesslg,is getting ready to eat dinner!im so incredibly bored without my 2 yr old being home! 

0,2257793394,Sat Jun 20 14:54:13 PDT 2009,NO_QUERY,jrgoddess,"OMG!  I've been working on my shops all day.  Pity, since it's a beautiful afternoon   I should go out..."

0,2257793585,Sat Jun 20 14:54:14 PDT 2009,NO_QUERY,lauradawg,"@SugaLuke True- I hated Number One video; hardly showed Tulisa&lt;3 Though to be fair, Tulisa&amp;Phase did nothing in that song "

0,2257793856,Sat Jun 20 14:54:16 PDT 2009,NO_QUERY,Jasperblu,"@perksofbeingme Having lost my mother to Alzheimer's, I sincerely hope that is NOT the case w/ your grandma. So sorry either way. "

0,2257793913,Sat Jun 20 14:54:16 PDT 2009,NO_QUERY,unixchick,"ATL Rollergirls.. The Sake Tuyas are losing pretty badly at halftime.  Everytime I glance at the penalty box, 3 or 4 girls are there!"

0,2257794047,Sat Jun 20 14:54:17 PDT 2009,NO_QUERY,sophielockley,Matt was allowed a McDonalds. I wasnt.  So unfair! All I had was yoghart! 

0,2257794168,Sat Jun 20 14:54:18 PDT 2009,NO_QUERY,marqdiggy,"dawg, my $10 nolex watch is tearing apart by the seams. they just don't make low quality watches like they used to!! "

0,2257794312,Sat Jun 20 14:54:19 PDT 2009,NO_QUERY,michaelahillx3,"@bekasaur i've told her too, i want my kitty  and yep, deleted ahah."

0,2257794323,Sat Jun 20 14:54:19 PDT 2009,NO_QUERY,AndyStoneMusic,"@NancyKellyMusic Yay!I hope you had a good gig!  I see you sent this by text,only one network in the UK works with twitter , not mine "

0,2257794689,Sat Jun 20 14:54:21 PDT 2009,NO_QUERY,nosenseaeae,"cry, bitch, cry "

0,2257794729,Sat Jun 20 14:54:21 PDT 2009,NO_QUERY,D_AMAZIN,well time 2 get dress on this ugly ass day in la...dont know what im doin 2nite and thats the exact reason why i club every week  lol

0,2257794756,Sat Jun 20 14:54:21 PDT 2009,NO_QUERY,aubreereno,"Workingg 6-close  I haaate el chico! Haha if you love me, come see me!"

0,2257795740,Sat Jun 20 14:54:27 PDT 2009,NO_QUERY,BIPINGU,"@BPDINOKC poor Pearlz.I have that trouble with men too.They dance round me&amp;lick my nose,but never hump me or sniff my butt "

0,2257795785,Sat Jun 20 14:54:27 PDT 2009,NO_QUERY,StarDustDee, Its wasnt me your honour i swear!! on my life!!! Im blonde!! please take pity!!

0,2257796015,Sat Jun 20 14:54:29 PDT 2009,NO_QUERY,KComer,@Official_jjizzy same ... Rainly day 

0,2257796065,Sat Jun 20 14:54:29 PDT 2009,NO_QUERY,AbbieKinno,Want my dad back! fathers day tomorrow and i miss my dad 

0,2257796268,Sat Jun 20 14:54:30 PDT 2009,NO_QUERY,ThisAintSeanF,I need some more 600 thread count sateen queen sized sheets for my bed 

0,2257796329,Sat Jun 20 14:54:30 PDT 2009,NO_QUERY,kd7ltn,Fathers Day is here and I can't even communicate with my sons  http://www.myspace.com/hope4fathers

0,2257797418,Sat Jun 20 14:54:37 PDT 2009,NO_QUERY,kpopkin,6/15 dons...no good 

0,2257797477,Sat Jun 20 14:54:37 PDT 2009,NO_QUERY,saffyre9,@jrodgers only $10? I paid $12US/day at Marriott in Seattle..   stupid Marriott chain..

0,2257797678,Sat Jun 20 14:54:38 PDT 2009,NO_QUERY,ariherstand,Wishing I was at Phish right now  #fb

0,2257797703,Sat Jun 20 14:54:38 PDT 2009,NO_QUERY,valkyrierisen,"@amypage that's craziness.  Especially on a weekend, I think."

0,2257797712,Sat Jun 20 14:54:38 PDT 2009,NO_QUERY,MrAntony,GGGRRRR  bored of all this now! / Russell Brand is good xD

0,2257797741,Sat Jun 20 14:54:38 PDT 2009,NO_QUERY,BankyM,"@CariAlice Spa - just got back, we're all acting like stoners, we're so chilled, n shiny - watching SATC-our massuese wasnt like*that* "

0,2257797950,Sat Jun 20 14:54:40 PDT 2009,NO_QUERY,TheSonicMole,Just finished Half Life 2 Episode 2. The ending is quite upsetting 

0,2257797953,Sat Jun 20 14:54:40 PDT 2009,NO_QUERY,Kattius,@alexyish also BB says you are not existence or the king so you can't have titles 

0,2257798091,Sat Jun 20 14:54:40 PDT 2009,NO_QUERY,rebecca_tait,grrr   ahh mann 6 hours work tomorrow  but off for the next two weekends yay!!!

0,2257798139,Sat Jun 20 14:54:41 PDT 2009,NO_QUERY,kayyyla_baby,"surprisingly, i'm in a very NOT good mood. :/ "

0,2257798373,Sat Jun 20 14:54:42 PDT 2009,NO_QUERY,seMarsh,"ok so two days after teeth pulling is too soon for ravioli, but i was really really hungry! "

0,2257798404,Sat Jun 20 14:54:42 PDT 2009,NO_QUERY,lysalala,@gobearsemily everyone lost 

0,2257798581,Sat Jun 20 14:54:43 PDT 2009,NO_QUERY,HayleyBee1,I feel really bad. Ive spent no time with my family tonight. 

0,2257798832,Sat Jun 20 14:54:45 PDT 2009,NO_QUERY,wraithgar,"@adambrault yeah well guess what it's like chernobyl there now, all overgrown and abandoned, I'm so sad   gotta go somewhere else."

0,2257798988,Sat Jun 20 14:54:46 PDT 2009,NO_QUERY,crackerjaxshop,@bloodpurple my father passed away years ago...   

0,2257799206,Sat Jun 20 14:54:47 PDT 2009,NO_QUERY,XpimpcessX,Home by myself. Wishing i was in Bton at the MAS for Absolute Justice 3. 

0,2257799403,Sat Jun 20 14:54:48 PDT 2009,NO_QUERY,angelinaaaax,"My mom decided today was &quot;summer cleaning&quot; so I have to clean out my closet, my drawers, and under my bed. Ahhhh "

0,2257799477,Sat Jun 20 14:54:49 PDT 2009,NO_QUERY,ScrapbookLatino,"I'm here, but about to leave for a couple hours...   @NancyinMaine: do we have any scrapbookers around right now?"

0,2257799554,Sat Jun 20 14:54:49 PDT 2009,NO_QUERY,JBnVFCLover786,"@leenuhvfc ohhh  okkk nevermind then ..it;'s okk but give me your no. and I'll text you, you don't need to text back"

0,2257799775,Sat Jun 20 14:54:51 PDT 2009,NO_QUERY,burcuakyol,Writing a blog post. Won't be able to finish tonight  Good night everyone!

0,2257800259,Sat Jun 20 14:54:55 PDT 2009,NO_QUERY,kirstenferguson,ok then hmm time for bed early start tomorrow...again!  night xx

0,2257800448,Sat Jun 20 14:54:54 PDT 2009,NO_QUERY,naughty_fairy,@gemma_thomas  consequences of the condition i was born with   and hows ya fine self? i see you re recovering quite well......?

0,2257800555,Sat Jun 20 14:54:55 PDT 2009,NO_QUERY,uhthedeal,No one wants to look at art today. 

0,2257800599,Sat Jun 20 14:54:55 PDT 2009,NO_QUERY,randomsubu,"Bought local Upslope IPA 6-pack yesterday. Just bitter, not hoppy   Prefer Southern Sun's FYIPA."

0,2257800679,Sat Jun 20 14:54:55 PDT 2009,NO_QUERY,rlsay,@Nikkers how'd you get sick? 

0,2257800726,Sat Jun 20 14:54:56 PDT 2009,NO_QUERY,tiffanynb,It looks like its about to storm and were going to a bonfire. 

0,2257801274,Sat Jun 20 14:54:59 PDT 2009,NO_QUERY,HarringtonCox,Stuck in the rain 

0,2257801291,Sat Jun 20 14:54:59 PDT 2009,NO_QUERY,mslemoncookie,Hmm.. waiting for the weather to be nice... so gloomy out there.. 

0,2257801403,Sat Jun 20 14:55:00 PDT 2009,NO_QUERY,JosetteSantos,"Practiced with the choir for 5 hours straight, no breaks! Soo tired! Aargh! "

0,2257801549,Sat Jun 20 14:55:01 PDT 2009,NO_QUERY,sparklyirisheye,"@nycgirl2388 cool! saw her in manchester&amp;was tres disappointed,crowd weren't behind her though,wish i was der tnit cudnt get babysitter "

0,2257802231,Sat Jun 20 14:55:04 PDT 2009,NO_QUERY,kRungx2,He totally forgot what today is! LOL 

0,2257802783,Sat Jun 20 14:55:07 PDT 2009,NO_QUERY,satori,@xennyeh very sad and haunting. an image I won't soon be able to forget. 

0,2257803055,Sat Jun 20 14:55:09 PDT 2009,NO_QUERY,TiaDanielle,@Meshelleelaine OH NO!!!!! Is everything ok!!!! I didnt know you were go to Greek Picnic!!!! :-O Im shocked!!! LOL Hope you had fun tho! 

0,2257803781,Sat Jun 20 14:55:13 PDT 2009,NO_QUERY,HAYLEY0614,@labanya_x3 whats wrong 

0,2257803884,Sat Jun 20 14:55:13 PDT 2009,NO_QUERY,MochaSweet,hmmm what should I eat when I get off work....really wanting some harolds chickin! wish I was back home 

0,2257804176,Sat Jun 20 14:55:15 PDT 2009,NO_QUERY,cooze,fyi I'm not getting any texts to my phone   how will I survive tonight???

0,2257804651,Sat Jun 20 14:55:18 PDT 2009,NO_QUERY,DsBabyGirl,@DonnieWahlberg Have a great show tonite!!! The Bean misses u   That pic of u &amp; Elijah is too frickin cute for words!!! He's a mini-u!!!!

0,2257811610,Sat Jun 20 14:55:58 PDT 2009,NO_QUERY,R_Claw,"Starving and stuck in my room.  Ugh, cannot wait to move into my own place again.  "

0,2257811621,Sat Jun 20 14:55:59 PDT 2009,NO_QUERY,iLivebymusic,@ddlovato wish i could of been their  stupid uk

0,2257811740,Sat Jun 20 14:55:59 PDT 2009,NO_QUERY,missbrandii,@MrPaulEvans:  awwwwwwww I'm so sorry honey.

0,2257811948,Sat Jun 20 14:56:00 PDT 2009,NO_QUERY,maureenrx,its pouring and I don't want to make the trek from my car to the house 

0,2257812412,Sat Jun 20 14:56:03 PDT 2009,NO_QUERY,KrustyCanuck,Both kids are coming down with something.  Running fevers and don't want to eat anything.. Poor little munchkins. 

0,2257812592,Sat Jun 20 14:56:04 PDT 2009,NO_QUERY,AniyahMariie,twitter is being a bitch! had to make a new profile 

0,2257813082,Sat Jun 20 14:56:07 PDT 2009,NO_QUERY,dean_b,@wampykitty @tuckle Yeah poor Kristin! She'll be bombarded 

0,2257813213,Sat Jun 20 14:56:08 PDT 2009,NO_QUERY,sugarpoultry,@thomasmize Yah but its that sponsor stuff 

0,2257813248,Sat Jun 20 14:56:08 PDT 2009,NO_QUERY,fefeemcfly,"@Dannymcfly DANNY, baby i love you so much, reply me please, say :hi!  you'll make me so happy  please please"

0,2257813427,Sat Jun 20 14:56:09 PDT 2009,NO_QUERY,kenzie4eva,have the hick-ups! won't go away! i have tried everything! some body plz help me! 

0,2257813513,Sat Jun 20 14:56:10 PDT 2009,NO_QUERY,shaestar,@ childrens hospy w Harper  I hate bronchiolitis.

0,2257813855,Sat Jun 20 14:56:12 PDT 2009,NO_QUERY,mainesteam,sooooo much work to do....and the rain doesn't help...tomorrow looks to be more of the same 

0,2257814045,Sat Jun 20 14:56:13 PDT 2009,NO_QUERY,hotlana,Stealing free beer (?) at Feldman bbq with Peter Elkas... start of the most ridiculous night EVER  Round two tonight! #NXNE

0,2257814050,Sat Jun 20 14:56:13 PDT 2009,NO_QUERY,silentxbeauty,"Oh yay, my parents friends are here. Time for another Saturday night where I sit in my room doing absolutely nothing while they have fun. "

0,2257814090,Sat Jun 20 14:56:13 PDT 2009,NO_QUERY,lyric352,I canNOT beLIEVE they threw me in the pool AS SOON as I got here 

0,2257814368,Sat Jun 20 14:56:15 PDT 2009,NO_QUERY,MichelleDom,y do I consistantly let my gas tank get damn near below the E before I fill my baby up? I'm sorry Lexie 

0,2257814460,Sat Jun 20 14:56:15 PDT 2009,NO_QUERY,mermaid_love,Long day so ready to go home and my monkey isn't eating 

0,2257814537,Sat Jun 20 14:56:16 PDT 2009,NO_QUERY,vcampos89,I'm going to miss these guys  http://twitpic.com/7xyem

0,2257814871,Sat Jun 20 14:56:17 PDT 2009,NO_QUERY,madremariposa,lo hope you are better....I am tired and need sleep....much to do before then.....  

0,2257814890,Sat Jun 20 14:56:18 PDT 2009,NO_QUERY,lydia_adelle,i stills hurt! its a 2nd degree burn sunburn.... 

0,2257814911,Sat Jun 20 14:56:18 PDT 2009,NO_QUERY,ian0012,"@silverwolf555 nestle cookie dough is the only good manufactured cookie dough, but for now, NOT ANYMORE "

0,2257815067,Sat Jun 20 14:56:19 PDT 2009,NO_QUERY,emshilie,@kylieskylindsey i want one 

0,2257815068,Sat Jun 20 14:56:19 PDT 2009,NO_QUERY,yamagushi,@Dannymcfly @mcflymusic @mcflyharry @dougiemcfly everybody twitting at the same time. I'm going crazy ahahh but... where's Tom? 

0,2257815120,Sat Jun 20 14:56:19 PDT 2009,NO_QUERY,Will2609,On computer bored 

0,2257815154,Sat Jun 20 14:56:19 PDT 2009,NO_QUERY,Cat_Williams,@globalheartcouk - glad to hear you are having a fab time.. but i do miss you both.. the house is rather quiet 

0,2257815183,Sat Jun 20 14:56:19 PDT 2009,NO_QUERY,Jaimiewint,I wish my new computer wasnt broken 

0,2257815406,Sat Jun 20 14:56:21 PDT 2009,NO_QUERY,giugarritano,"@danielleandrade no, i didnt. i'm going to the party junina in my school now  night night honey xx"

0,2257815597,Sat Jun 20 14:56:22 PDT 2009,NO_QUERY,unc_loverr,trying to download open skies by david crowder band and can't find it on limewire. 

0,2257815725,Sat Jun 20 14:56:23 PDT 2009,NO_QUERY,CathElliott,@pickledpolitics The only reason I'm not green is because after a week off the net I've got no idea how to go about it! 

0,2257817025,Sat Jun 20 14:56:31 PDT 2009,NO_QUERY,arianaandjessi,lost the game.  totally bummed. im gonna miss my GIRLIES!  oh well. still have all stars. gooooo EAGLES! -ari

0,2257817574,Sat Jun 20 14:56:34 PDT 2009,NO_QUERY,bsalt,srsly... i hate when people don't know how to take a hint. 

0,2257817636,Sat Jun 20 14:56:34 PDT 2009,NO_QUERY,flameeyes,"Strange, usually on Saturday I can find Real Time with Bill Maher online "

0,2257817901,Sat Jun 20 14:56:36 PDT 2009,NO_QUERY,mharagao,@ddlovato say happy birthday nanda to @nanda_marinho please 

0,2257818567,Sat Jun 20 14:56:40 PDT 2009,NO_QUERY,Maybach,@designerscouch why i cant click on the &quot;Chance to win a macbook pro&quot; ad? its not linking! 

0,2257818798,Sat Jun 20 14:56:41 PDT 2009,NO_QUERY,lilleskvat,"I hate Roxette singing in Spanish, though. What an awful idea! Who is the stupid bastard that translated the songs???? "

0,2257819085,Sat Jun 20 14:56:43 PDT 2009,NO_QUERY,AuroraFirechild,... no grater... lemon zest fail  FML i'll do this tomorrow.

0,2257819188,Sat Jun 20 14:56:44 PDT 2009,NO_QUERY,aapresas,Is sad to see his girlfriend leave for summer 

0,2257819216,Sat Jun 20 14:56:44 PDT 2009,NO_QUERY,666forever,ppl were totally doing &quot;photo shoots&quot; with &quot;models&quot; at twin falls today.  i gotta &quot;card&quot; from a scary man who does &quot;underwater photog&quot; 

0,2257819329,Sat Jun 20 14:56:44 PDT 2009,NO_QUERY,Banks_Brittany,missing my como friends 

0,2257819524,Sat Jun 20 14:56:46 PDT 2009,NO_QUERY,Amanda2704,at home about to clean...yay 

0,2257820359,Sat Jun 20 14:56:50 PDT 2009,NO_QUERY,Valgrind,is upset that FreeRPG is not for him 

0,2257820609,Sat Jun 20 14:56:52 PDT 2009,NO_QUERY,ruebluestar192,OMFG WHY DOES EVERYOONE THINK IM 14 this girl from one of my classes thought i was a freshmen or something she said i look 14 

0,2257820924,Sat Jun 20 14:56:54 PDT 2009,NO_QUERY,kdevaney11,I miss Chicago 

0,2257821214,Sat Jun 20 14:56:56 PDT 2009,NO_QUERY,slickta,Ummmm my 3Gs is sitting at home while im on a 4 day trip! talk about sad! 

0,2257821251,Sat Jun 20 14:56:56 PDT 2009,NO_QUERY,anthony_milas,Off to my dad's house for Father's Day. Goodbye Star Wars: Knights of the Old Republic. 

0,2257821410,Sat Jun 20 14:56:57 PDT 2009,NO_QUERY,mikenott,Am so so gutted - weather forecast for Glastonbury has changed - now predicting rain instead of sun - am crying 

0,2257821585,Sat Jun 20 14:56:58 PDT 2009,NO_QUERY,AlphaSigWhitney,Hoping that Dani and I can hang out tonight.  I wish Mariha could come out too though. 

0,2257821874,Sat Jun 20 14:57:00 PDT 2009,NO_QUERY,MoneyManJake,@Wizet Do you think you can pm me to??? I want to be a gm 

0,2257822152,Sat Jun 20 14:57:01 PDT 2009,NO_QUERY,christina_82,Melsie2005 i've not been out since oct 

0,2257822220,Sat Jun 20 14:57:02 PDT 2009,NO_QUERY,ladyangelface,Just came in from a trip to Dairy Queen...its blazin hott out here in the Queens City! I wonder when boo is getting home from work??? 

0,2257822485,Sat Jun 20 14:57:04 PDT 2009,NO_QUERY,bikerchick250,I wish I were at my friend's wedding right now  

0,2257822486,Sat Jun 20 14:57:04 PDT 2009,NO_QUERY,NAYKIDD,@_mOoky lol M&amp;M on deck! @cosmodoll u were supposed 2 hit me yesterday  left an hour ago

0,2257822541,Sat Jun 20 14:57:04 PDT 2009,NO_QUERY,illustriousoul,I miss my Sunshine. Friends with no jobs ftl. 

0,2257822637,Sat Jun 20 14:57:04 PDT 2009,NO_QUERY,missrara,@jimmynaks well I'm glad you and @mrmedwin had fun last night. Wish he'd stay in hawaii till the weekend  At least we'll drink 2gether lol

0,2257822661,Sat Jun 20 14:57:05 PDT 2009,NO_QUERY,cr3ativ3,Walking over to Fenway Park... Rain stay away! Just heard Mike Lowell has the night off 

0,2257822670,Sat Jun 20 14:57:05 PDT 2009,NO_QUERY,TizzySizzleberg,@originaldewgirl i love you too. 

0,2257822773,Sat Jun 20 14:57:05 PDT 2009,NO_QUERY,NeilTomStewart,In on a Saturday night  damn you anti biotics!

0,2257822819,Sat Jun 20 14:57:05 PDT 2009,NO_QUERY,BBTkitties,Bernoulli &amp; Tesla: why do Bunsen get to be the picture?  we'z cute too!

0,2257822967,Sat Jun 20 14:57:06 PDT 2009,NO_QUERY,MichelleWeeds,i seriously hope that this summer's weather gets muchh muchh better and stays that way 

0,2257823026,Sat Jun 20 14:57:07 PDT 2009,NO_QUERY,marisavasan,"I spilled a venti vanilla latte all over my arm, body, bar &amp; floor -_- Its been so busy "

0,2257823197,Sat Jun 20 14:57:07 PDT 2009,NO_QUERY,Tinaaaho,i want my food already !! 

0,2257823234,Sat Jun 20 14:57:08 PDT 2009,NO_QUERY,_Greyson_Rose_,@TheLastDoctor ( *panics* I did not.. did I?  )

0,2257823762,Sat Jun 20 14:57:11 PDT 2009,NO_QUERY,crysttall,i have a dancing workshop all day today 

0,2257823764,Sat Jun 20 14:57:11 PDT 2009,NO_QUERY,funmiosiyale,@stephmccall but I felt like I had to the voices in my head told me too 

0,2257823782,Sat Jun 20 14:57:11 PDT 2009,NO_QUERY,Capone822,About to work out. 

0,2257823923,Sat Jun 20 14:57:11 PDT 2009,NO_QUERY,pechomuchacha,Am wide awake...feel bad that I didn't get to pack lunch for the husband 

0,2257823938,Sat Jun 20 14:57:12 PDT 2009,NO_QUERY,Toii,@dubharris i don't know why i am going to this its my stepdad family and i have to remind them who i am everytime i see them 

0,2257824112,Sat Jun 20 14:57:12 PDT 2009,NO_QUERY,Rubberduky182,Nevermind  No more party at spencers 

0,2257824426,Sat Jun 20 14:57:14 PDT 2009,NO_QUERY,jackacrack,i wish the mexican pizza place across the street from my house would deliver a chicken roll so i dont have to walk in the rain 

0,2257824499,Sat Jun 20 14:57:15 PDT 2009,NO_QUERY,1azylizzie,ugh.. I hate being sick 

0,2257824711,Sat Jun 20 14:57:16 PDT 2009,NO_QUERY,ckwebgrrl,@EggsHall5 C'MON!   

0,2257824783,Sat Jun 20 14:57:16 PDT 2009,NO_QUERY,mickrush,Opened toilet wall cabnet  today and full bottle of after shave fall into sink and shashed everyware... Was gutted 

0,2257825602,Sat Jun 20 14:57:21 PDT 2009,NO_QUERY,MzDivaNicki,hmmm i'm gonna look for a fuckin job! i'm sick of bein poor 

0,2257825805,Sat Jun 20 14:57:22 PDT 2009,NO_QUERY,_Lalalauren_15,Watching titanic ...so sad  hah

0,2257832584,Sat Jun 20 14:58:03 PDT 2009,NO_QUERY,CPM87,"@kkob haha, care to elaborate? :-p made too much food tonight  x"

0,2257832631,Sat Jun 20 14:58:04 PDT 2009,NO_QUERY,Haarlz,I missed Bb 

0,2257832991,Sat Jun 20 14:58:06 PDT 2009,NO_QUERY,LobeliaStorm,My entire body is achy.  Monday night I go to the Fibromyalgia Dr.

0,2257833246,Sat Jun 20 14:58:07 PDT 2009,NO_QUERY,SteveAllen2,@BOBBYFRESH09 Car accident 

0,2257833521,Sat Jun 20 14:58:08 PDT 2009,NO_QUERY,Defsounds,you ever been watchin a porn and notice the chicks vag lookin awfully penisey then realize you've been had 

0,2257833764,Sat Jun 20 14:58:10 PDT 2009,NO_QUERY,reetax,"@ddlovato - Awww, great timing  Still wish you the best of luck!"

0,2257834031,Sat Jun 20 14:58:11 PDT 2009,NO_QUERY,diggie,@kristafromvista I tried clicking through to your site but the homepage isn't working properly for me under FF3/Flash 10 

0,2257834569,Sat Jun 20 14:58:14 PDT 2009,NO_QUERY,brittanydobler,@ddlovato ARE YOU KIDDDING? we were gonna come and seee you but we didnt have a ride  i hope you meet you tomorrrow. PLEASE COME OUTSIDE.

0,2257834638,Sat Jun 20 14:58:15 PDT 2009,NO_QUERY,naticancino,holy crap!!! I've a lot of things to study 

0,2257834725,Sat Jun 20 14:58:15 PDT 2009,NO_QUERY,kristinreeds,why dont you like my frands 

0,2257835136,Sat Jun 20 14:58:18 PDT 2009,NO_QUERY,curlyq423,I really want to play Donkey kong right now...... 

0,2257835405,Sat Jun 20 14:58:19 PDT 2009,NO_QUERY,walelaann,"just came home. in search of a good headache reliever, advil is not working for me anymore. "

0,2257835559,Sat Jun 20 14:58:20 PDT 2009,NO_QUERY,MylahMusic,Oooooh this one's bad. Fatality I think 

0,2257835841,Sat Jun 20 14:58:22 PDT 2009,NO_QUERY,missmandy8706,sitting at work  left my cell charger in Delaware. phone's dead...

0,2257835884,Sat Jun 20 14:58:22 PDT 2009,NO_QUERY,misskixx,?snkrdivamob OMG so I'm covered in mud cuz I helped this old man that fell Bendito poor old man 

0,2257835941,Sat Jun 20 14:58:23 PDT 2009,NO_QUERY,rosaliehalerpg,@AliceCullenRPG /sighs/ I always miss him by minutes! I'll come on and he like just left or something 

0,2257836281,Sat Jun 20 14:58:25 PDT 2009,NO_QUERY,kaitmackinnon,Playing Wii Sports by myself  @stellerm8 wish you were here to play insane games of tennis lol some crazy moments we had Haha

0,2257836440,Sat Jun 20 14:58:25 PDT 2009,NO_QUERY,littlemisskorz,i miss it  wish i could go back. with my mum and dad of course!

0,2257836485,Sat Jun 20 14:58:27 PDT 2009,NO_QUERY,putoutthemoon,@itschristablack those lucky bitches! They get to see you all 

0,2257836526,Sat Jun 20 14:58:26 PDT 2009,NO_QUERY,JadeMiddleditch,#BTS #BTS can't wait even though i'm not there!  #BTS

0,2257836669,Sat Jun 20 14:58:27 PDT 2009,NO_QUERY,Adderleyreport,Def not feeling 2 good 2day 

0,2257836754,Sat Jun 20 14:58:27 PDT 2009,NO_QUERY,MyNameIsLaurrra,"@elTweeno Yeah, it's been rather uneventful, in a good way, been spoilt by rain though "

0,2257836949,Sat Jun 20 14:58:28 PDT 2009,NO_QUERY,hiediearwood,"@stephanie04 lol! I really left! But not from a lack of @RyanStar ;-) Im a mom foremost, and a 5 yr old can only take so much  Oh wel ..."

0,2257837264,Sat Jun 20 14:58:30 PDT 2009,NO_QUERY,anne2491,Work tomorow  The dreaded Primark Please can it be quiet for one day!!!!

0,2257837448,Sat Jun 20 14:58:31 PDT 2009,NO_QUERY,greedy_girl,@CHRISDJMOYLES oh damn was last guess!  pleaseee tell me lol

