4,2052192642,Fri Jun 05 23:56:46 PDT 2009,NO_QUERY,sonotthepoint,One thing I love about the summer: I wake up early just because of the sunlight and I don't waste the whole morning 

4,2052192700,Fri Jun 05 23:56:46 PDT 2009,NO_QUERY,Air_Rik,"Ahhhhhhhhh...nothing like cold, soggy leftovers from Chili's and beatin two dudes on Madden Online to a pulp...GOOD TIIIIIIIIIIMES "

4,2052192814,Fri Jun 05 23:56:47 PDT 2009,NO_QUERY,stephaniechanel,@greeneash whatttt? haha sorry i had to. your gorgeous btw 

4,2052192821,Fri Jun 05 23:56:47 PDT 2009,NO_QUERY,jaelpandabear,wonderful show Au Revoire Simone. So amazing!! 

4,2052192857,Fri Jun 05 23:56:48 PDT 2009,NO_QUERY,AlanBleiweiss,OMG @mollermarketing - I had no idea!!  TY TY TY !  @DanicaPatrick is beyond awesome

4,2052192879,Fri Jun 05 23:56:48 PDT 2009,NO_QUERY,enamoredsoul,@gamathew any requests for what i play next!?!? 

4,2052192884,Fri Jun 05 23:56:48 PDT 2009,NO_QUERY,itsmejlee,I love random phonecalls to hang out. 

4,2052192922,Fri Jun 05 23:56:48 PDT 2009,NO_QUERY,britespark,Laters Tweeps!!!! 

4,2052192968,Fri Jun 05 23:56:49 PDT 2009,NO_QUERY,thehealthymom,is in front of a campfire with friends 

4,2052193041,Fri Jun 05 23:56:50 PDT 2009,NO_QUERY,massiecabot,Life sucks and then you die.  I miss reading. I need books.

4,2052193043,Fri Jun 05 23:56:50 PDT 2009,NO_QUERY,vijayranjan1983,its fantastic victory by neths this will lit up eye of every t20 lover wait for some more surprizes 

4,2052193081,Fri Jun 05 23:56:50 PDT 2009,NO_QUERY,dvroegop,@ddoomen Yes you should 

4,2052193108,Fri Jun 05 23:56:51 PDT 2009,NO_QUERY,aikochang,new chapter in bleach.. 

4,2052193111,Fri Jun 05 23:56:51 PDT 2009,NO_QUERY,eviegarland,"Open Happiness damands you to smile and drink Coke. Which I'm doing.  there goes my giving it up. Coke, that is."

4,2052193147,Fri Jun 05 23:56:51 PDT 2009,NO_QUERY,ahh_itsciara,"@jessebarrera rancho bernardo! its so nuts here now, theres a DJ and free shots. come sometime and i can drink with you guys "

4,2052193165,Fri Jun 05 23:56:51 PDT 2009,NO_QUERY,moniCOCOpuffs,SO tireeed BUZZIN itt! HITTIN la mirada tomorooow ! hitt theee celly up! 

4,2052193177,Fri Jun 05 23:56:52 PDT 2009,NO_QUERY,sc137,I was able to jump into a 25 Naxx today while my wife was getting a pedicure and picked up three nice upgrades by &quot;default&quot; 

4,2052193212,Fri Jun 05 23:56:52 PDT 2009,NO_QUERY,mmuszynski,"@jorgEsk Did ya? Well, then you're awesome too! "

4,2052193233,Fri Jun 05 23:56:52 PDT 2009,NO_QUERY,pissandink,@heinrichfrei DO IT  Then cam whore and post it all over the internet :p

4,2052193298,Fri Jun 05 23:56:53 PDT 2009,NO_QUERY,bureikuz3r0,"THIRD AND FINAL A-MAT VIDEO UPLOADED! Watch, and enjoy! "

4,2052193311,Fri Jun 05 23:56:53 PDT 2009,NO_QUERY,sianluvsboosh,"Hey followers all two to of you, hint hint! im tired! follow me please "

4,2052193363,Fri Jun 05 23:56:53 PDT 2009,NO_QUERY,AaliyahLove69,"@becomingjennie 1 of my fav customers just bought me a new 1, you can have my old tv if u want  It's ancient but works fine "

4,2052193404,Fri Jun 05 23:56:54 PDT 2009,NO_QUERY,Bowling_Amanda,Happy 150th Birthday Queensland! 

4,2052193417,Fri Jun 05 23:56:54 PDT 2009,NO_QUERY,spionchen,I can't believe i'm out singing karaoke. But having fun 

4,2052193609,Fri Jun 05 23:56:56 PDT 2009,NO_QUERY,Hexxagon,Zero Punctuation on Bionic Commando: http://u.nu/2ct9 It's Schadenfreudetastic! 

4,2052193625,Fri Jun 05 23:56:56 PDT 2009,NO_QUERY,mssillythang,@jeaneentang cuz you're a hero with super freaky powers! 

4,2052193651,Fri Jun 05 23:56:56 PDT 2009,NO_QUERY,swimsista62,"@Oprah   Oprah, you are a hot mess.  I luv ya, girl."

4,2052193822,Fri Jun 05 23:56:58 PDT 2009,NO_QUERY,pwincessbebe,thank you Tami  http://lookbook.nu/look/65954

4,2052193867,Fri Jun 05 23:56:59 PDT 2009,NO_QUERY,Kazziiieee,@nancylien thank you so much for the bear  love it

4,2052193880,Fri Jun 05 23:56:59 PDT 2009,NO_QUERY,Twinklybird,@EPumphrey Happy bday Eric  Have fun today!

4,2052193922,Fri Jun 05 23:57:00 PDT 2009,NO_QUERY,MysticMo,"You can blame people who knock things over in the dark, or you can begin to light candles. Makes a lot of sense to me "

4,2052193936,Fri Jun 05 23:57:00 PDT 2009,NO_QUERY,SinaLigia,@HallAlle hminktakingmydogout after completing work training material. hes groggy from his nap  it better be warm out..

4,2052194086,Fri Jun 05 23:57:03 PDT 2009,NO_QUERY,stevendelman,My phone is dead but I'm twittering via mind power.  Leave me something to turn my phone on to 

4,2052194138,Fri Jun 05 23:57:02 PDT 2009,NO_QUERY,allysonalfonso,@JonasAustralia I just heard before the storm with miley 

4,2052194178,Fri Jun 05 23:57:02 PDT 2009,NO_QUERY,Sir_Almo,Hey i'm on FaceBook come check me out http://bit.ly/17jIy8   tell me ur username if you ADD ME  

4,2052194294,Fri Jun 05 23:57:03 PDT 2009,NO_QUERY,sarabethbrooks,"@prncsstwtrtoes Oh, I should play my djembe.  That's a fabulous idea.  "

4,2052194296,Fri Jun 05 23:57:03 PDT 2009,NO_QUERY,mbach16,best rainy night in a LONG time! 

4,2052194355,Fri Jun 05 23:57:04 PDT 2009,NO_QUERY,Tonange,Goodnight everyone  Have a great Saturday! HUGS! @saulalover72852 @singinbrimarie @Dancegurl91 @PaulaAbdul @ticimeliani

4,2052194401,Fri Jun 05 23:57:05 PDT 2009,NO_QUERY,regeenahh,@MsTimaB : that's good. 

4,2052194429,Fri Jun 05 23:57:05 PDT 2009,NO_QUERY,JudithAlyssa,Is so happy she fixed her phone! 

4,2052194458,Fri Jun 05 23:57:05 PDT 2009,NO_QUERY,surfnmusicexpo,@BigCityDiner we still love you!  we still on for tomorrow right?

4,2052194469,Fri Jun 05 23:57:06 PDT 2009,NO_QUERY,HighAsKites,"GOTTA love a good catchphrase!   (Not gonna hate,  No time to.)  Nice job, gents."

4,2052194630,Fri Jun 05 23:57:07 PDT 2009,NO_QUERY,lmwmusic,Ooh la la..just changed our backgroung image and main Twit pic     hahahahaha

4,2052194663,Fri Jun 05 23:57:08 PDT 2009,NO_QUERY,lliinnaa,eating lasagna and watching princess diaries. what a perfect way to end this night 

4,2052194668,Fri Jun 05 23:57:08 PDT 2009,NO_QUERY,lvbosworth,I love WIFI in Rome  hopefully we will have it in Florence too!!!

4,2052194950,Fri Jun 05 23:57:11 PDT 2009,NO_QUERY,shaynubla,Listening to random music on my ipod 

4,2052195047,Fri Jun 05 23:57:12 PDT 2009,NO_QUERY,tmcmahon2,Steve Bug is on his way to loda. 

4,2052195057,Fri Jun 05 23:57:12 PDT 2009,NO_QUERY,angelasauceda,"So tired from driving all day, relaxing with mojitos before going to bed, seeing Bette Milder tomorrow "

4,2052195201,Fri Jun 05 23:57:14 PDT 2009,NO_QUERY,original_one,"@audreybenck ur mums book is reviewed here, a gud description http://bookbag.co.uk  search from there Audrey "

4,2052195222,Fri Jun 05 23:57:14 PDT 2009,NO_QUERY,chelzmae,@MYIDOLTOWN Hello Towny.  Received your DM... I can't believe it that a Gokester would hate Danny.

4,2052195239,Fri Jun 05 23:57:15 PDT 2009,NO_QUERY,HeartTaylor,Half of me wants to go code while I'm 'full of life' - the other half dreads picking through such a mess in the morning. Sleep it is 

4,2052195251,Fri Jun 05 23:57:15 PDT 2009,NO_QUERY,DjSplifone,Just got to shipmates already kinda buzin 

4,2052195252,Fri Jun 05 23:57:15 PDT 2009,NO_QUERY,chauncypepper,"@Taylor_jensen I'm sending you something in the mail, it will come in a small box....  "

4,2052195348,Fri Jun 05 23:57:16 PDT 2009,NO_QUERY,Britty0314,@Shadowkitten701 turned 23. 

4,2052195359,Fri Jun 05 23:57:16 PDT 2009,NO_QUERY,thatsabebeapril,is super tired and feels really awkward being back home. i left my heart in california..hahaha 

4,2052195428,Fri Jun 05 23:57:16 PDT 2009,NO_QUERY,TeeMonster,"NZ TWITTERAKIANS: I'm on Sunday Morning with Chris Laidlaw, RADIO NEW ZEALAND National 101FM. Please have a listen!  #socialNZ"

4,2052195497,Fri Jun 05 23:57:17 PDT 2009,NO_QUERY,roxiiexfoxiie,"at kimmys,baby shower tomorrow "

4,2052195530,Fri Jun 05 23:57:18 PDT 2009,NO_QUERY,aarthycrazy,@oldfox004 yeah I have already typed the skeleton of the last post but it is in my home PC. Will have to get home 2 develop &amp; post it.. 

4,2052195552,Fri Jun 05 23:57:18 PDT 2009,NO_QUERY,ashleylangton,@court31187 ahhh loved tonight! now eating my sangy  yum

4,2052195657,Fri Jun 05 23:57:19 PDT 2009,NO_QUERY,ezyblogger,@HansKee Ya Hans. I guess it's just me. It's much better now 

4,2052195658,Fri Jun 05 23:57:19 PDT 2009,NO_QUERY,DireGreenSlime,Had a great evening with Jeremiah and Belinda. Should've stole leftovers when no one was looking... 

4,2052195659,Fri Jun 05 23:57:19 PDT 2009,NO_QUERY,xXDesXx,"@chelseyann226 You didn't leave idf did you? If you did, go back...I'm bored haha "

4,2052195792,Fri Jun 05 23:57:21 PDT 2009,NO_QUERY,alexsmith13,limewire  (L) i predict that the internet bill will be massive LOL

4,2052195814,Fri Jun 05 23:57:21 PDT 2009,NO_QUERY,Beyy,@twinkle_x thats nice. im eating chocolate  im off to work at 5:50. gahhhhhhhhhhhhhhhhhhhhhhhhhhhhhhhhhhhhhhhh. ily much xoxo

4,2052195931,Fri Jun 05 23:57:22 PDT 2009,NO_QUERY,DJRFresh,I'm going to my twiggin Bed. Be safe my twiggas and twiggettes  lol

4,2052196023,Fri Jun 05 23:57:23 PDT 2009,NO_QUERY,larispan,Ms. Tsaby's our class adviser! Guess who's getting great recommendation letters for college!? 

4,2052196048,Fri Jun 05 23:57:23 PDT 2009,NO_QUERY,MichaelMcNeill,"@ErinSchmidt Sounds like YUM! I'm staying home, too much partying last night. "

4,2052196106,Fri Jun 05 23:57:24 PDT 2009,NO_QUERY,rcb23,no im on my phone.. im jus on twitter mobile  but I still don't get updates like u and ray

4,2052196112,Fri Jun 05 23:57:24 PDT 2009,NO_QUERY,kaitlinkaboom,@plkw31 thank you. the feeling is mutual. 

4,2052196182,Fri Jun 05 23:57:25 PDT 2009,NO_QUERY,siwawong,good 80's song  â « http://blip.fm/~7qakk

4,2052196274,Fri Jun 05 23:57:26 PDT 2009,NO_QUERY,scarletmandy,@sharleedoble aww thanks  you too!

4,2052196315,Fri Jun 05 23:57:26 PDT 2009,NO_QUERY,cYntthiaa,"TOday I went to the Nauty  it was so great,, I had a'lot of FUN "

4,2052196362,Fri Jun 05 23:57:27 PDT 2009,NO_QUERY,godsgrl182003,just watched High School Musical with buddy Anna... good times 

4,2052196387,Fri Jun 05 23:57:27 PDT 2009,NO_QUERY,bbhamby,"Debating on making ramen or not.  I wanna see UP soon, any takers? "

4,2052196549,Fri Jun 05 23:57:29 PDT 2009,NO_QUERY,b3lt3r,@softjunebreeze Oh yeah - me @ your pic: &quot;blinkblinkstare&quot; he's cool but it makes me feel wrong every time I see your name &amp; that pic 

4,2052202298,Fri Jun 05 23:58:37 PDT 2009,NO_QUERY,thereseismyname,just woke up. i had fun swimming while raining 

4,2052202396,Fri Jun 05 23:58:39 PDT 2009,NO_QUERY,sweynh,@philosophytweet Thank you for your...erm... thoughtful FF 

4,2052202400,Fri Jun 05 23:58:39 PDT 2009,NO_QUERY,GlamorousMe,Just got bak 4rm the Marvell..time to tak a shower then sleep Hair APPT tomoRRow  Nite Twitters!

4,2052202421,Fri Jun 05 23:58:39 PDT 2009,NO_QUERY,G_Yeyii,Hey @bowwow614  Can i please get a shout out too Bow?   (officialbowwow live &gt; http://ustre.am/3gi1)

4,2052202424,Fri Jun 05 23:58:39 PDT 2009,NO_QUERY,emily_rbbns,Watching Star Trek at the drive-in. This is my first outside movie experience 

4,2052202445,Fri Jun 05 23:58:39 PDT 2009,NO_QUERY,Zunii,@tromboneforhire i'm going to the pool again lol..yes more sun! and possibly seeing a movie 

4,2052202497,Fri Jun 05 23:58:40 PDT 2009,NO_QUERY,janicecyt,Wow Chictopia now allows Tweeting! 

4,2052202514,Fri Jun 05 23:58:40 PDT 2009,NO_QUERY,xXKatyXx,1973 - James Blunt  It's not Mcdonalds but I'm lovin' it 

4,2052202518,Fri Jun 05 23:58:40 PDT 2009,NO_QUERY,joshchow,Wow. I just brutally dropped my phone. ): but thank God for invisible shield! 

4,2052202589,Fri Jun 05 23:58:41 PDT 2009,NO_QUERY,MikeTheTech,"@CrazyCatLadie ok cool, thanks for the update. Glad she's home safe. "

4,2052202610,Fri Jun 05 23:58:41 PDT 2009,NO_QUERY,adianette,"and its time for my exam . bye for a while , dont miss me , i'll b back "

4,2052202629,Fri Jun 05 23:58:41 PDT 2009,NO_QUERY,MCal27,@trent_reznor   Congrats Mr Reznor on 8yrs sobriety. Nothing more needs to be said I think....  Great news 

4,2052202637,Fri Jun 05 23:58:41 PDT 2009,NO_QUERY,TheChrisChicago,@thejeffbrown thanks mc jeffy b! 

4,2052202676,Fri Jun 05 23:58:42 PDT 2009,NO_QUERY,lvg,"@shita ah -  I didn't know you attended!  Yeah, this was a very busy week - hoping to see you in Japan soon "

4,2052202749,Fri Jun 05 23:58:42 PDT 2009,NO_QUERY,inthebag,@IdgyOoh  it will have.... NDA 

4,2052202848,Fri Jun 05 23:58:43 PDT 2009,NO_QUERY,paul_steele,"@FizzyDuck yes, will tweet one just before settin off lol  and then some later when back home (if able to see, walk, sit, speak) lol "

4,2052202892,Fri Jun 05 23:58:44 PDT 2009,NO_QUERY,lytysha05,is eating gummy worms and reading! 

4,2052203127,Fri Jun 05 23:58:46 PDT 2009,NO_QUERY,saydiemason,@CorrinaT Tweet Dreams! 

4,2052203137,Fri Jun 05 23:58:46 PDT 2009,NO_QUERY,0hB4BY,is going putt putt golf tonight 

4,2052203163,Fri Jun 05 23:58:47 PDT 2009,NO_QUERY,fattieart,I am definitely lucky to be so loved! 

4,2052203170,Fri Jun 05 23:58:47 PDT 2009,NO_QUERY,Jess10604,signing on Twitter for the first time... 

4,2052203201,Fri Jun 05 23:58:47 PDT 2009,NO_QUERY,japulickal,Hotel food made my stomach upset. Recovering from that 

4,2052203235,Fri Jun 05 23:58:48 PDT 2009,NO_QUERY,the804Boyz,"@honeydip206 hey hellen, tell ppl to follow the 804 boyz fanpage "

4,2052203395,Fri Jun 05 23:58:50 PDT 2009,NO_QUERY,fueledbyamy,trash tonight 

4,2052203577,Fri Jun 05 23:58:52 PDT 2009,NO_QUERY,protijy,fridge is full.... well of beer  PBR and all!

4,2052203616,Fri Jun 05 23:58:52 PDT 2009,NO_QUERY,HarmonicThought,@BenMack Had a magician @ my girl's b-day party. She loves magic  What are some good resources for kids to learn magic and #goodenergy Thx

4,2052203638,Fri Jun 05 23:58:52 PDT 2009,NO_QUERY,MyNameIsSmooth,Gonna go play pool off warm springs and eastern who wants to join? 

4,2052203639,Fri Jun 05 23:58:52 PDT 2009,NO_QUERY,_veroniggaaa,@oemGeeItzPauul show me next time your on court k 

4,2052203687,Fri Jun 05 23:58:53 PDT 2009,NO_QUERY,megelder,@maxime68 thank you  @FaithfulChosen good morning!

4,2052203760,Fri Jun 05 23:58:54 PDT 2009,NO_QUERY,Laurentiius,Watching: DVR'd Tonight Show and shopping the net. 

4,2052203795,Fri Jun 05 23:58:54 PDT 2009,NO_QUERY,alwaysxmichelle,@pfchangsheaven I have no idea where it'll come from I just hope its soon! 

4,2052203918,Fri Jun 05 23:58:56 PDT 2009,NO_QUERY,NathanMillson,@CateP36 I was waiting for a tweet reply with something different... But your a machine to do the whole packet..  I'm addicted to shapes.

4,2052204019,Fri Jun 05 23:58:56 PDT 2009,NO_QUERY,mahafreed,Mom is trying to braid my hair with an automatic hair wrap. Girl fun is coming 

4,2052204024,Fri Jun 05 23:58:56 PDT 2009,NO_QUERY,MurderShe_Wrote,home  crazy ass night! uploading pics soon. about to watch @Bowwow614 ; @SongzYuuup ; @Souljaboytellem ; and @drakkardnoir on webcam 

4,2052204039,Fri Jun 05 23:58:57 PDT 2009,NO_QUERY,mannykimchi,@JourneyJoe hell yeah!  The machete! hahahaha

4,2052204079,Fri Jun 05 23:58:57 PDT 2009,NO_QUERY,hummingbird604,@Crystal_clear Totally 

4,2052204111,Fri Jun 05 23:58:58 PDT 2009,NO_QUERY,catieronquillo,@annhamilton your new babies are too cute! 

4,2052204176,Fri Jun 05 23:58:58 PDT 2009,NO_QUERY,Mastercorp,What color is smoke?  And my favorite color is ember  ( smoke and ember should be a color!)

4,2052204202,Fri Jun 05 23:58:58 PDT 2009,NO_QUERY,wearingmascara,@Mindpirate @amyhobbit Have fun you two!!!! 

4,2052204249,Fri Jun 05 23:58:59 PDT 2009,NO_QUERY,cece_newnew,@thesselonious 

4,2052204259,Fri Jun 05 23:58:59 PDT 2009,NO_QUERY,karinb_za,"@fake_vyvyan @fakE_Rik lol, you guys are extremely entertaining. "

4,2052204270,Fri Jun 05 23:58:59 PDT 2009,NO_QUERY,KiddSwaggThu,HAHA!! GO DRIZZY!!!!   (#souljaboytellem live &gt; http://ustre.am/2UhS)

4,2052204283,Fri Jun 05 23:58:59 PDT 2009,NO_QUERY,azzanator,off to work again! Customers better not give me crap i'm no mood to deal with it... just a little warning for my possible chicken buyers 

4,2052204315,Fri Jun 05 23:59:00 PDT 2009,NO_QUERY,postino67,5 more days until Road Trip to North Carolina for my 1st Family Reunion 

4,2052204361,Fri Jun 05 23:59:00 PDT 2009,NO_QUERY,newtothis704,@abbygaloshes You're the first real person following me!  thanks!!!

4,2052204367,Fri Jun 05 23:59:00 PDT 2009,NO_QUERY,xcupofcake,"Surprisingly, Harry Potter books are better than I thought they would be.    And a lot better than the first chapter of the first book."

4,2052204404,Fri Jun 05 23:59:01 PDT 2009,NO_QUERY,Paulaa182,I Love McFLY  â ¥

4,2052204432,Fri Jun 05 23:59:01 PDT 2009,NO_QUERY,shayimani,"@chantellmarie lol aw, it doesn't mess with me!  You prob be blowing up like Raspucia &quot;HOW YURRR DURRIN&quot; hahaha"

4,2052204442,Fri Jun 05 23:59:01 PDT 2009,NO_QUERY,EmmyATL,@jrdnpl ive seen them twice  March and then like 2 weeks later in April to see if they remembered me. haha

4,2052204450,Fri Jun 05 23:59:01 PDT 2009,NO_QUERY,StayGolden13,@williamjone found the info on that pic: the artist is Alberto Cerriteno and its called &quot;The Enamored Whale&quot;. i love his work 

4,2052204681,Fri Jun 05 23:59:04 PDT 2009,NO_QUERY,okym3z,Laying in bed waiting for con  i lovelovelove that boi &lt;3

4,2052204707,Fri Jun 05 23:59:04 PDT 2009,NO_QUERY,whoamireally01,Completly forgot i had a bottle of captin morgan in the freezer 

4,2052204708,Fri Jun 05 23:59:04 PDT 2009,NO_QUERY,OzgaEMS1289,haha no problem @lisaa_love #jessicaveronica is the best  i love that vid btw!

4,2052204727,Fri Jun 05 23:59:04 PDT 2009,NO_QUERY,tropicalchicken,I love the rain!!...gusto ko lumabas ng house....haha  lol!!

4,2052204759,Fri Jun 05 23:59:05 PDT 2009,NO_QUERY,DJimSD,@pinkydiamonds no need sleep la. go play with ur new toy. later stretch again. 

4,2052204781,Fri Jun 05 23:59:05 PDT 2009,NO_QUERY,emsi_b,leaving today  yippee!!! no more alcoholic disrespectful noisy losers 

4,2052204994,Fri Jun 05 23:59:08 PDT 2009,NO_QUERY,v4vikash,My recording plan got cancelled. Thank God I scheduled another thing for tonight. New day plan includes watching rest 2 stargate movies. 

4,2052204999,Fri Jun 05 23:59:08 PDT 2009,NO_QUERY,GiselleCanNom,&quot;...impact on the lives of those that you've come across...I thank the Lord every day 4 He has put u in my my life  I can't wait til u..&quot;

4,2052205003,Fri Jun 05 23:59:08 PDT 2009,NO_QUERY,CourtneyElie,@cookiesz_02 Please support Electrik Red and sign these http://bit.ly/42zJa http://twitition.com/f5iae Thanks!!! 

4,2052205161,Fri Jun 05 23:59:09 PDT 2009,NO_QUERY,mikedotta,"@mikeprasad For decoration or to play games? If it's to play old games, DL an emulator and ROMs of your favorites. River Raid, baby! "

4,2052205197,Fri Jun 05 23:59:10 PDT 2009,NO_QUERY,KonaMtbkr,is done with work ... now I can enjoy my wine  #fb

4,2052205251,Fri Jun 05 23:59:10 PDT 2009,NO_QUERY,IBloginOC,or they are in their 40s and they want a 20 year old 

4,2052205264,Fri Jun 05 23:59:11 PDT 2009,NO_QUERY,Keryje,thought id better give @austinslide a run for his money in profile pic stakes 

4,2052205284,Fri Jun 05 23:59:11 PDT 2009,NO_QUERY,YarielaNolasco,Goodnight tweets. 21 more days for my big break  CAN'T WAIT !!!!

4,2052205329,Fri Jun 05 23:59:11 PDT 2009,NO_QUERY,tdahle,OMW home to Ames meow. Glad I'm not driving! Successful night nonetheless 

4,2052205341,Fri Jun 05 23:59:11 PDT 2009,NO_QUERY,Crystal_clear,@lacouvee And thank you for the #followfriday   Looking forward to meeting you soon 

4,2052205363,Fri Jun 05 23:59:11 PDT 2009,NO_QUERY,eve0887,@wtfanabel thnx for hanging out with us tonight!!  chakaaa!!

4,2052205383,Fri Jun 05 23:59:11 PDT 2009,NO_QUERY,_SnowflakE_,@THEHUSTON8 Get rich or die trying.  lol! 

4,2052205423,Fri Jun 05 23:59:12 PDT 2009,NO_QUERY,chris_sdca,"Watched 'Definitely Maybe&quot;, very cute flick, and had baked glazed salmon with brocolli and rice for dinner. An excellent evening.  Sle ..."

4,2052205527,Fri Jun 05 23:59:13 PDT 2009,NO_QUERY,TraceyWalker93,Just had my friend over  she's cool   Might be going to queensland in the holiday 

4,2052205535,Fri Jun 05 23:59:13 PDT 2009,NO_QUERY,tpetsovi,Updating my computer and studying my web development software. 

4,2052205655,Fri Jun 05 23:59:15 PDT 2009,NO_QUERY,MCT777,"Chilling morning, having a lazy 1!  "

4,2052205833,Fri Jun 05 23:59:16 PDT 2009,NO_QUERY,Charlootteee,"Saw 'Ghosts of Girlfriends Past' last night, was pretttttty goood! funny "

4,2052205865,Fri Jun 05 23:59:17 PDT 2009,NO_QUERY,xJoeJonasGirlx,@nileyxlove Awesome! 

4,2052205870,Fri Jun 05 23:59:17 PDT 2009,NO_QUERY,mikeySTRENGTH,oh and frikken rootbeer and ice cream is a close 2nd! 

4,2052205875,Fri Jun 05 23:59:17 PDT 2009,NO_QUERY,Emmilene,@MisShammie dude. i was way cool before you lol'fest 

4,2052205886,Fri Jun 05 23:59:17 PDT 2009,NO_QUERY,NabilaAnn,..I'm sold. How fun! 

4,2052205958,Fri Jun 05 23:59:18 PDT 2009,NO_QUERY,paul_steele,"@Woody_in_MK cheers, I love it, gettin up and about the mountains "

4,2052205982,Fri Jun 05 23:59:18 PDT 2009,NO_QUERY,PubChick,@StweartKris - glad you guys are back... 

4,2052206001,Fri Jun 05 23:59:19 PDT 2009,NO_QUERY,EmyXOXO,"These girls are getting me drunk! My cousin is dope, she chillin. Her man here @ the club and she trust him. Priscilla aint trippin   ..."

4,2052206019,Fri Jun 05 23:59:19 PDT 2009,NO_QUERY,chelzmae,@alisonbez09 I'm doing fine tweeting with great fans around. 

4,2052206194,Fri Jun 05 23:59:21 PDT 2009,NO_QUERY,asdfaggot,I'm finally OL again 

4,2052206216,Fri Jun 05 23:59:21 PDT 2009,NO_QUERY,mollermarketing,"@AlanBleiweiss she's following 95 people - if you can get her to follow you, i believe you're a true twitter gamer "

4,2052206221,Fri Jun 05 23:59:21 PDT 2009,NO_QUERY,acemin,no more school except for arena =P working at mc laren lodge 

4,2052206225,Fri Jun 05 23:59:21 PDT 2009,NO_QUERY,Serin_Broccoli,We didn't have enough $ to do any real shopping so Mum &amp; I spent our time finding hats  http://twitgoo.com/obkn

4,2052206228,Fri Jun 05 23:59:21 PDT 2009,NO_QUERY,danharding,"in transit in korea...been awake for waaay over 24hrs, noah only slept 2hrs  can't wait to hit Australian soil!"

4,2052206244,Fri Jun 05 23:59:21 PDT 2009,NO_QUERY,StayGolden13,heading to bed twitter-world... goodnight 

4,2052206254,Fri Jun 05 23:59:21 PDT 2009,NO_QUERY,PortiaME,folow http://twitter.com/jojo_momo shes awesome  thats u joey btw  xxx

4,2052206266,Fri Jun 05 23:59:21 PDT 2009,NO_QUERY,UpgradeBrigade,I love the acacia strain. And corrie. Corrie more than the acacia strain. 

4,2052206410,Fri Jun 05 23:59:23 PDT 2009,NO_QUERY,kwaters2008,"@ashlynbrooke hahahaha, yes we are! starting tomorrow "

4,2052206435,Fri Jun 05 23:59:23 PDT 2009,NO_QUERY,Nollie38,Watching Cubs vs. Reds rerun. Zambrano earned win #100 by hitting the go-ahead solo HR in the 5th!  Sad that he wants to retire in 2012.

4,2052206645,Fri Jun 05 23:59:25 PDT 2009,NO_QUERY,twebbstack,"@jesskarrr hahai know aye, i was like ewww ahha "

4,2052206762,Fri Jun 05 23:59:27 PDT 2009,NO_QUERY,erin_marcella,"@joshthomas87 they put you as understudy because youre better than whoever was supposed to do it, and they didn't want them to be jealous "

4,2052206807,Fri Jun 05 23:59:27 PDT 2009,NO_QUERY,danaduggins,"home from work, had a good night, headed to bed.  We have a fun day with friends planned tomorrow.  Be looking for pics of the kids "

4,2052206811,Fri Jun 05 23:59:27 PDT 2009,NO_QUERY,DavidOAtkins,Going go-kart racing tomorrow.  Should be a blast 

4,2052206835,Fri Jun 05 23:59:27 PDT 2009,NO_QUERY,salmafan,@PerezHilton Zach makes me pee sitting down! And I'm a grown gay man! 

4,2052206884,Fri Jun 05 23:59:28 PDT 2009,NO_QUERY,doofesHuhn,@dominiccampbell on my way 

4,2052214375,Sat Jun 06 00:00:39 PDT 2009,NO_QUERY,Cooley623,Loving seanalds new car!  in the backseat with Alicia!

4,2052214377,Sat Jun 06 00:00:39 PDT 2009,NO_QUERY,kdawks,So much for an epic night. Well being confronted by crack heads and Creepy old men in downtown kinda made my night 

4,2052214440,Sat Jun 06 00:00:39 PDT 2009,NO_QUERY,BeachBaby2460,and I want to see Drag Me To Hell again sooo badly! 

4,2052214508,Sat Jun 06 00:00:40 PDT 2009,NO_QUERY,iamjaysung,I'm feeling so happy and blessed 

4,2052214650,Sat Jun 06 00:00:41 PDT 2009,NO_QUERY,BurgerBradshaw,"this guy said my skin was beautiful, umm can you see me glowing? lmao. "

4,2052214675,Sat Jun 06 00:00:41 PDT 2009,NO_QUERY,itsmaniacmaria,@RichardBPenn hi my new follower  Have a great weekend ;)

4,2052214750,Sat Jun 06 00:00:42 PDT 2009,NO_QUERY,damohopo,@Keryje i'm ok. And this isn't the best place to tell aunty jen 

4,2052214774,Sat Jun 06 00:00:42 PDT 2009,NO_QUERY,ShainaW,Ive decided. I would like to steal Blake Livelys hair. Its so long and prettttty 

4,2052214804,Sat Jun 06 00:00:43 PDT 2009,NO_QUERY,FordCountryWA,Drove my Fiesta on the lawn tonight. Just a bit  #fiestamovement: Drove my Fiesta on the lawn tonight. Just a .. http://tinyurl.com/pcnak2

4,2052214836,Sat Jun 06 00:00:45 PDT 2009,NO_QUERY,thesickchick,@hulucrafts -- &quot;Authentic Knitting Board&quot; is the brand name: http://www.knittingboard.com/ (I can't needle knit so I loom knit instead!  )

