0,2266587877,Sun Jun 21 08:45:53 PDT 2009,NO_QUERY,RossFisk,Revising science  So boring

0,2266587976,Sun Jun 21 08:45:54 PDT 2009,NO_QUERY,OSTATE4454,Repaying my debt for Betsy letting me go to Wichita last Sunday for the Spider.  &quot;I'll do those next week&quot; finally caught up with me. 

0,2266587986,Sun Jun 21 08:45:54 PDT 2009,NO_QUERY,rebo11,i don't get to see my daddy today  but Happy Father's Day!

0,2266588090,Sun Jun 21 08:45:54 PDT 2009,NO_QUERY,dookie1293,@SpiderTre what's wrong?! 

0,2266588183,Sun Jun 21 08:45:55 PDT 2009,NO_QUERY,lulubeedavis,"I'm kinda in a sad mood, for blue skies is not helping much... such a sad song. "

0,2266588365,Sun Jun 21 08:45:56 PDT 2009,NO_QUERY,michellereneex,My teeth hurt  I wish the sun would work for just one day....

0,2266588405,Sun Jun 21 08:45:56 PDT 2009,NO_QUERY,sassysis54,"'HAPPY FATHER'S DAY' TO ALL DADS, I MISS MINE "

0,2266588561,Sun Jun 21 08:45:57 PDT 2009,NO_QUERY,debbie_bailey,"@stevebalderson we can't do next week at all, we're in centre parcs from this friday to next  xx"

0,2266588699,Sun Jun 21 08:45:57 PDT 2009,NO_QUERY,subhr0,man I wish I had gone earlier to the tweetup  sorry......

0,2266588767,Sun Jun 21 08:45:58 PDT 2009,NO_QUERY,WeddingRadio,@TeamTorture Like the cover but aren't we tortured enough? 

0,2266589085,Sun Jun 21 08:46:00 PDT 2009,NO_QUERY,vesileal,Would have been nice if yesterday was as nice as today!  Rained all day for the Highland Creek Parade 

0,2266589141,Sun Jun 21 08:46:00 PDT 2009,NO_QUERY,rachaeljean,"Another rainy day, another day no pay "

0,2266589344,Sun Jun 21 08:46:01 PDT 2009,NO_QUERY,McflyDramaQueen,Still need so food! The Beef was the small on from tesco yummy...Mum didn't get me fizzy cola bottles from Asda  Goin' downstaires now xxx

0,2266589600,Sun Jun 21 08:46:03 PDT 2009,NO_QUERY,princelili,@mynamesnemo1 tell me about it 

0,2266589908,Sun Jun 21 08:46:04 PDT 2009,NO_QUERY,stfudemo,looking for cars is so disheartening  WANT A BEETLE.

0,2266590109,Sun Jun 21 08:46:06 PDT 2009,NO_QUERY,guilty_,Atmosphere in Iran is getting dire  The party who rigged the election has totally closed off the country! Communication black out!

0,2266590168,Sun Jun 21 08:46:06 PDT 2009,NO_QUERY,aidenmckenna,Have to try and get it to work now 

0,2266590288,Sun Jun 21 08:46:07 PDT 2009,NO_QUERY,smile_aud,@mileycyrus hey Miley (: how was the show with JB yesterday ? Cant wait to see you again  ilove you

0,2266590298,Sun Jun 21 08:46:07 PDT 2009,NO_QUERY,j_zillmann24,I hope he can come down or me going to be a very sad camper 

0,2266590373,Sun Jun 21 08:46:07 PDT 2009,NO_QUERY,TiiShirt,@0cL0ver thanks.. 

0,2266590438,Sun Jun 21 08:46:08 PDT 2009,NO_QUERY,McZoe,"bored   I think I'm gonna go watch the rest of that stephen dorff dvd that I fell asleep halfway through watching on friday night, lol"

0,2266590473,Sun Jun 21 08:46:08 PDT 2009,NO_QUERY,nyceness,"This humidity in NYC is killing me,Got my hair looking extra Frizzy! "

0,2266590479,Sun Jun 21 08:46:08 PDT 2009,NO_QUERY,hoshin,@KevinDoyle man!  I want to move to England so bad!!  U would but I'd miss grass too much 

0,2266590711,Sun Jun 21 08:46:09 PDT 2009,NO_QUERY,KBenn87,Man my shoulder is Killing me! I need a massage! Wish my man was here! 

0,2266591009,Sun Jun 21 08:46:11 PDT 2009,NO_QUERY,mikemueller,Happy Father's Day Dad! You've been gone way too long!  #cancersucks http://myloc.me/4R17

0,2266591072,Sun Jun 21 08:46:11 PDT 2009,NO_QUERY,JBnVFCLover786,@JakeTAustin aaahh!!  I called and was leaving a msg but all I said was Hey how you?and I cut it by mistake  but call me back?? please

0,2266591147,Sun Jun 21 08:46:12 PDT 2009,NO_QUERY,moti0614,"Will fly to Jkt tomorrow (June 22), will be there till 30, wont be online much "

0,2266591513,Sun Jun 21 08:46:14 PDT 2009,NO_QUERY,SolveMyMaze,"Gubbed earphones, can only hear through one of them "

0,2266591654,Sun Jun 21 08:46:15 PDT 2009,NO_QUERY,lomooutloud,"GREAT, now Mary J. is singing my life...&quot;No More Drama&quot; ugh. Throwback theme song from middle school! "

0,2266591673,Sun Jun 21 08:46:15 PDT 2009,NO_QUERY,Nathan133,yeti and Abominable are full my fave servers 

0,2266591763,Sun Jun 21 08:46:15 PDT 2009,NO_QUERY,Scream4IceCream,Might have to fly across this seaport and push some of these KNIck city dancers over the ledge. 

0,2266591947,Sun Jun 21 08:46:16 PDT 2009,NO_QUERY,loveheartholly,"fathers day always makes me a lil glum, reminds me that my dad wont speak to me, yet speaks to my brothers and theres no reason for it "

0,2266592402,Sun Jun 21 08:46:19 PDT 2009,NO_QUERY,cristina_16,i hate this freakin P.E independent study thing 

0,2266592665,Sun Jun 21 08:46:21 PDT 2009,NO_QUERY,OnAFriday_,"@absobloodyloote i don't have imagination  i wrote something like a poem, but it's not finished yet"

0,2266592716,Sun Jun 21 08:46:21 PDT 2009,NO_QUERY,talei,The ending of Eden of the East was disappointing.  But I can't wait for teh movies. I do think it'd make a good film and Live Action

0,2266593402,Sun Jun 21 08:46:26 PDT 2009,NO_QUERY,JennyJaklovsky,Day off!!!!!!! Pool for a little bit. I don't really feel so hot 

0,2266594204,Sun Jun 21 08:46:30 PDT 2009,NO_QUERY,jaimegallant,seriously bummed out on so much stuff right now. I really just want to sleep all day. 

0,2266594771,Sun Jun 21 08:46:34 PDT 2009,NO_QUERY,HayleyBee1,Shit i have a biology test tomorrow. 

0,2266595139,Sun Jun 21 08:46:36 PDT 2009,NO_QUERY,aussiedogs4,"Just unfollowed a few folks... please do not spam me w/how to get 10,000 followers or how to make a million dollars! I'm not interested. "

0,2266595162,Sun Jun 21 08:46:37 PDT 2009,NO_QUERY,efortit,Happy fathers day! It's still too hot to shoot some hoops 

0,2266595614,Sun Jun 21 08:46:39 PDT 2009,NO_QUERY,silenth0pez,shucks. I think I've been too close to music nowadays that I wonder if I made the right decision.  thoughts wavered again. HOLY!

0,2266596011,Sun Jun 21 08:46:42 PDT 2009,NO_QUERY,ravyn,"Oh and more car FAIL, after all the work i had done Fri., the Check Engine light went on just as i got home last night "

0,2266596014,Sun Jun 21 08:46:42 PDT 2009,NO_QUERY,wearenightowls,@sleepysongbird yeah they were supposed to but the writers didn't want that in the first season.  GOOD i can only handle 1 girl having him

0,2266596097,Sun Jun 21 08:46:42 PDT 2009,NO_QUERY,C14w,"Father shouted @ baby brother, baby brother started crying "

0,2266596155,Sun Jun 21 08:46:42 PDT 2009,NO_QUERY,Dakit,Happy Fatherless day!! 

0,2266596366,Sun Jun 21 08:46:44 PDT 2009,NO_QUERY,EvanHendershot,@LANBANxx i'm so bored too  how's country market yo?

0,2266596651,Sun Jun 21 08:46:46 PDT 2009,NO_QUERY,kittenclawss,The garage door won't open and my beetle is trapped inside!! 

0,2266596698,Sun Jun 21 08:46:46 PDT 2009,NO_QUERY,Trebstar,"Watching the athletics on tv, it's making me feel so unfit!!! "

0,2266596826,Sun Jun 21 08:46:47 PDT 2009,NO_QUERY,lyssa_b,@Isa_483 tom and chantelle  I think you need to visit tokiohotelrocks

0,2266597129,Sun Jun 21 08:46:49 PDT 2009,NO_QUERY,mosaicmoon,"Having to make some serious life decisions today. I want to say it's easy, but it's not. "

0,2266597202,Sun Jun 21 08:46:49 PDT 2009,NO_QUERY,jamesirwin1,Feeling incredibly down. 

0,2266597248,Sun Jun 21 08:46:49 PDT 2009,NO_QUERY,moderno1211,I'm feeling better now after a long night of drinking yesterday... Don't wanna work all day 

0,2266597275,Sun Jun 21 08:46:50 PDT 2009,NO_QUERY,ben0bi,"I won 1'000'000 Euro but I cannot claim them.  I do not have a credit card. At least none that counts. Ok, GOD, that was a good joke..."

0,2266597294,Sun Jun 21 08:46:50 PDT 2009,NO_QUERY,currios,"How come every country seem's to have Fathers Day today, except us  At least we already had Fathers Day this year ."

0,2266597343,Sun Jun 21 08:46:50 PDT 2009,NO_QUERY,steller_chelle,Finally getting ready for the day... I'm lazy 

0,2266597462,Sun Jun 21 08:46:51 PDT 2009,NO_QUERY,hollow__crown,@EmmAargh annnnnd i still don't know where the case is....and it's so pretty. 

0,2266597560,Sun Jun 21 08:46:52 PDT 2009,NO_QUERY,V_Lovely,@joeaggie91 Silk is not too good. I prefer Lactaid...if it's lactose you're trying to stay away from...I'm intolerant 

0,2266597654,Sun Jun 21 08:46:52 PDT 2009,NO_QUERY,megsy96,my cow just died. too sad 

0,2266601074,Sun Jun 21 08:47:12 PDT 2009,NO_QUERY,jnbounds,"So excited! Seeing Star Trek (3rd time) and going to rock climbing gym today. Sad, I'm having more fun today than my dad is. "

0,2266601806,Sun Jun 21 08:47:17 PDT 2009,NO_QUERY,foiledcupcakes,"@CesLSU i'm sorry too! delivery person delivered cupcakes, but to the wrong hotel! marriott, not courtyard. oops.  are you still in town?"

0,2266602009,Sun Jun 21 08:47:18 PDT 2009,NO_QUERY,BlauerPanther,"@dtrabert oh, I think, you are not happy like this!Poor little girl! I'm feeling pitty for you "

0,2266602097,Sun Jun 21 08:47:19 PDT 2009,NO_QUERY,xbaz,@pbrack just bought a mito for my crappy micra  now got an 8 week wait for it to be delivered 

0,2266602613,Sun Jun 21 08:47:22 PDT 2009,NO_QUERY,MKEWired,@NikESweetz  well i tried i guess

0,2266602735,Sun Jun 21 08:47:23 PDT 2009,NO_QUERY,MirandaGomez,happy daddys day!!!!!!!!!!!!!!!!!!!!!!!!! i love you pappyy!!! I miss you 

0,2266602752,Sun Jun 21 08:47:23 PDT 2009,NO_QUERY,getschmann,"i dont want to be awake. i called my dad to tell him happy fathers day, but he was too sick to come to the phone. "

0,2266602853,Sun Jun 21 08:47:24 PDT 2009,NO_QUERY,katesadams,@jcschaser I'm jealous.  didn't get to go. Yet another missed opportunity.....

0,2266602919,Sun Jun 21 08:47:24 PDT 2009,NO_QUERY,babblespace,Just got to work...I'm always late on sunday  I need to get it together here!

0,2266603984,Sun Jun 21 08:47:31 PDT 2009,NO_QUERY,trucha_xo,http://twitpic.com/80ew1 - lmao:] my pinkie got stuck with my backyard door  &amp; it flinged off

0,2266604266,Sun Jun 21 08:47:33 PDT 2009,NO_QUERY,icedgems03,"@bex_1210 hmmm well I've watched BTS but that is as far as I'm going!! Gah, I'll prolly cave eventually  I can't wait 5 months D:"

0,2266604555,Sun Jun 21 08:47:35 PDT 2009,NO_QUERY,frannek,@JJPNY what does shitting mean.? Sorry i did not understand 

0,2266604731,Sun Jun 21 08:47:36 PDT 2009,NO_QUERY,RaNdyRaGe,Dumb ass negros took my effin bike!! Wtf!! 

0,2266605178,Sun Jun 21 08:47:38 PDT 2009,NO_QUERY,amber_newton, About to leave Newcastle ):

0,2266605190,Sun Jun 21 08:47:38 PDT 2009,NO_QUERY,devasya_angana,ok I should have stopped eating churan but couldn't....now I am facing the after effects 

0,2266605602,Sun Jun 21 08:47:41 PDT 2009,NO_QUERY,chrizza31,is weeeehhh.. its so kaka aasar.. got allergy from crab..  http://plurk.com/p/12qnc2

0,2266605731,Sun Jun 21 08:47:42 PDT 2009,NO_QUERY,comaxed,"@nessamcv Tea and a bagel sounds so yummy. I have tea, but no bagel... "

0,2266605785,Sun Jun 21 08:47:42 PDT 2009,NO_QUERY,fleax,@Dannymcfly You didn't read my banner out on friday  It said it was my birthday. I had the best 17th on fri because i saw you guys! x

0,2266605814,Sun Jun 21 08:47:42 PDT 2009,NO_QUERY,skaro964,"off to change Eric's bed he disconneted his g-tube some time after 4 am, oh well more laundry "

0,2266606004,Sun Jun 21 08:47:43 PDT 2009,NO_QUERY,baf03,"waaaait, so when did @mrchicity33 let you give him your phone number so he can personally call you?! i am VERY late to that party... "

0,2266606085,Sun Jun 21 08:47:44 PDT 2009,NO_QUERY,angiegudaitis,"@ukiguy  It's not dedication, it's desperation.  What are we going to hand out tomorrow?  "

0,2266606326,Sun Jun 21 08:47:45 PDT 2009,NO_QUERY,amandagabiz,"@mileycyrus, you are very perfect, please answer me "

0,2266607064,Sun Jun 21 08:47:50 PDT 2009,NO_QUERY,FlipLloyd,"@Rabrika i stay off of Grove, but i think i might do the party later this week cuz i gotta work later now "

0,2266607179,Sun Jun 21 08:47:51 PDT 2009,NO_QUERY,hollyknowsbest,@rosie_rage nice seeing you briefly yesterday rosie! we should of got a picture though  x

0,2266607900,Sun Jun 21 08:47:55 PDT 2009,NO_QUERY,Dmon33,They got me in here tutoring. Poor kids! 

0,2266608077,Sun Jun 21 08:47:57 PDT 2009,NO_QUERY,starbeatriz,getting ready to clean house 

0,2266608237,Sun Jun 21 08:47:57 PDT 2009,NO_QUERY,Shawndlite,"@SaveOurPets  thats true, isn't that a joke!  "

0,2266608311,Sun Jun 21 08:47:58 PDT 2009,NO_QUERY,werne1nm,Oh Man espn outside the lines.... tear 

0,2266608842,Sun Jun 21 08:48:01 PDT 2009,NO_QUERY,caliday,Leaving garner. Missin me some river already. 

0,2266609042,Sun Jun 21 08:48:02 PDT 2009,NO_QUERY,mazzieemoo,Happy Fathers day to any Daddies out there. I miss Dad today a year ago he passed we have our second fathers day without him 

0,2266609189,Sun Jun 21 08:48:03 PDT 2009,NO_QUERY,Foreverbellas,so nobody is on 

0,2266609474,Sun Jun 21 08:48:05 PDT 2009,NO_QUERY,yayitskathleen,brother's graduation todayyyy. i can't believe it 

0,2266609894,Sun Jun 21 08:48:08 PDT 2009,NO_QUERY,Vonnieee,"...I feel like giving up already.  oh well, I'm still on a sleep strike."

0,2266610190,Sun Jun 21 08:48:10 PDT 2009,NO_QUERY,Shals24,dont want the weekend to end 

0,2266610296,Sun Jun 21 08:48:10 PDT 2009,NO_QUERY,MadTooey,boo hiss  poor Ivan try again anouther time i guess re: http://ff.im/4avz4

0,2266610399,Sun Jun 21 08:48:11 PDT 2009,NO_QUERY,KlassikMusic,@avasamone You know what I find worse than having kids and not supporting them.... Going thru so many women u don't know you have them. 

0,2266610580,Sun Jun 21 08:48:12 PDT 2009,NO_QUERY,joonieb,Can't believe how quiet its been in work this weekend 

0,2266610796,Sun Jun 21 08:48:13 PDT 2009,NO_QUERY,juantf,@SushiFabush prima wish u were here    p.s. i didnt know i was so tall either lol

0,2266610985,Sun Jun 21 08:48:14 PDT 2009,NO_QUERY,Alex_Hamblen,Going to church by myself on Father's Day..  My family's out of town..

0,2266611954,Sun Jun 21 08:48:20 PDT 2009,NO_QUERY,amblastic,"@jessygrass well, we COULD be roomies, but you just offered me your bed for free- i have to pay now? "

0,2266612026,Sun Jun 21 08:48:21 PDT 2009,NO_QUERY,bee_lee,@horrortrailer unfortunately I'll probably have to wait until next year. movies start way later here in germany than in the US.  

0,2266612073,Sun Jun 21 08:48:21 PDT 2009,NO_QUERY,djmole,Just noticed that AOA rehearsal is on fathers day 

0,2266612190,Sun Jun 21 08:48:22 PDT 2009,NO_QUERY,sunandanarayan,"I find that I strikingly resemble Garfield at the mo.. droopy-eyed, hungry-faced and supremely sloppy. "

0,2266612349,Sun Jun 21 08:48:23 PDT 2009,NO_QUERY,Preity22,@peterfacinelli: It's really unfortunate that we in Germany can't see Nurse Jackie 

0,2266612742,Sun Jun 21 08:48:25 PDT 2009,NO_QUERY,JCS4UA,@christybobo There is no such thing as FunDay in Summer School... 

0,2266612838,Sun Jun 21 08:48:26 PDT 2009,NO_QUERY,kkmiskin,sad time at the steam trains  poor nate

0,2266613376,Sun Jun 21 08:48:29 PDT 2009,NO_QUERY,nautical_leo,"is really missing Tanya, Courtney and Mike. Tons of hours together straight = withdrawl later.. "

0,2266613516,Sun Jun 21 08:48:30 PDT 2009,NO_QUERY,BlauerPanther,"@dtrabert oh,it seems you are not happy like this.Poor little girl, I'm feeling pity for you "

0,2266613583,Sun Jun 21 08:48:31 PDT 2009,NO_QUERY,SmileyRose,"Having roast gammon for dinner this evening. Only one problem, I forgot the pineapple. "

0,2266613599,Sun Jun 21 08:48:31 PDT 2009,NO_QUERY,bryanx13,Ugh shopping with my sister    BORED

0,2266613689,Sun Jun 21 08:48:31 PDT 2009,NO_QUERY,SophiaIsabella,Back in Windsor after going home to see the parents this weekend. Left early to go to the gym (mad?!) and now I miss them all 

0,2266614313,Sun Jun 21 08:48:35 PDT 2009,NO_QUERY,lolaphilologist,@kasterma that sucks about your modem. 

0,2266614322,Sun Jun 21 08:48:36 PDT 2009,NO_QUERY,DutchHollow,"@AlpacaFarmgirl Yeah, Chick-Fil-A doesn't travel well "

0,2266614444,Sun Jun 21 08:48:37 PDT 2009,NO_QUERY,MiloNatal,I can't do my homework 

0,2266614838,Sun Jun 21 08:48:39 PDT 2009,NO_QUERY,omgitsbrandonn,@ohai_makayla the tunic! It was all like image coming soon 

0,2266614916,Sun Jun 21 08:48:39 PDT 2009,NO_QUERY,patriki,lately my weekends are way too short  #exhausted - btw.: portfolio updated with: &quot;Out in Space&quot; Artwork - http://patrik-inzinger.at/ #fb

0,2266615256,Sun Jun 21 08:48:42 PDT 2009,NO_QUERY,MileyParamore,@EmerLadd  Mod 3? Thats the hardest of them all i dont have a maths till november then im done maths for life!!!!!!! unless i do A level

0,2266615470,Sun Jun 21 08:48:43 PDT 2009,NO_QUERY,runningnowhere,"I want to move to New Zealand, anyone wanna come with? "

0,2266615504,Sun Jun 21 08:48:43 PDT 2009,NO_QUERY,1OpenedMind,have the most horrible stomach acid ever... these rolaids aint fuckin workin.   

0,2266615562,Sun Jun 21 08:48:44 PDT 2009,NO_QUERY,McflyDramaQueen,Nothing to eat downstaries  Apart from pears...ewwww!I hate pears

0,2266615616,Sun Jun 21 08:48:44 PDT 2009,NO_QUERY,2xtdg,@The_Kingfisher ahhh tht sucks  whats up then?

0,2266615790,Sun Jun 21 08:48:45 PDT 2009,NO_QUERY,q_salazar,Happy Father's Day to all u fathers that follow me. I'm stuck at work for most of the day. 

0,2266616004,Sun Jun 21 08:48:46 PDT 2009,NO_QUERY,LiddoMissJONAS,"@SimplyLetii yeah well who knows  i need to ask my dad to pick one for me to atleast meet, and i have a feeling he will pick megan"

0,2266616601,Sun Jun 21 08:48:50 PDT 2009,NO_QUERY,Alexx_xo,MIssing my Best Friend in Texas 

0,2266617288,Sun Jun 21 08:48:54 PDT 2009,NO_QUERY,simplydivina,"Sister, I miss YOUUUUUUUUUUUUUUUUUUUUU!!!!!!! "

0,2266617310,Sun Jun 21 08:48:54 PDT 2009,NO_QUERY,adnama_wpg,@backseatsurfer9 I was up at 6:30 today.  I WISH 10:30 was the number I saw on the clock. 

0,2266621000,Sun Jun 21 08:49:17 PDT 2009,NO_QUERY,LittleAppleBird,@famouslyfresh I'm so sorry. 

0,2266621363,Sun Jun 21 08:49:19 PDT 2009,NO_QUERY,fredie92,Time to go run  happy fathers day everyone!

0,2266621426,Sun Jun 21 08:49:19 PDT 2009,NO_QUERY,simonuccc,@mileycyrus I'm happy yu enjoyed the show!! I wish I had been there 

0,2266621474,Sun Jun 21 08:49:20 PDT 2009,NO_QUERY,KATHHrine,"Completed the yearbook page , Chemistry and Physics up next . FML "

0,2266621747,Sun Jun 21 08:49:21 PDT 2009,NO_QUERY,Azundris,"Gnomes! Lockers! Guitars! http://is.gd/18oeO Not unlike my own experiences â€¦  Went with http://is.gd/18ogp in the end, had music to write."

0,2266622029,Sun Jun 21 08:49:23 PDT 2009,NO_QUERY,Kitt69,Okay my cake is sinking in the middle! Thanks a lot batter. 

0,2266622139,Sun Jun 21 08:49:24 PDT 2009,NO_QUERY,ummkujo,@audiolove jerrrrrk. i want a slushie. 

0,2266622507,Sun Jun 21 08:49:26 PDT 2009,NO_QUERY,Phaedre,he's making me wish i wasn't leaving tomorrow. 

0,2266623217,Sun Jun 21 08:49:31 PDT 2009,NO_QUERY,missvanessaxo,Think I may actually still be drunk... Ace of Spaces taste won't go away  fack

0,2266623326,Sun Jun 21 08:49:31 PDT 2009,NO_QUERY,sunandanarayan,"I find that I strikingly resemble Garfield at the mo.. droopy-eyed, hunger-faced and supremely sloppy. "

0,2266623427,Sun Jun 21 08:49:32 PDT 2009,NO_QUERY,shizukera,"@AnansiER I'm 30 years old. If I haven't found it by now, I think it's just about too late. "

0,2266623700,Sun Jun 21 08:49:34 PDT 2009,NO_QUERY,MitchieKelso,"Finally taking an hour to listen to Lines, Vines and Trying Times. It's been almost a week. "

0,2266623756,Sun Jun 21 08:49:34 PDT 2009,NO_QUERY,SteelFist_XII,today is ok i miss my woman and im going to my grandparents  fun fun happy fathers day dads

0,2266624814,Sun Jun 21 08:49:41 PDT 2009,NO_QUERY,lexipanda,Happy Father's Day everyone. I miss my dad  *waves across the ocean*

0,2266624855,Sun Jun 21 08:49:41 PDT 2009,NO_QUERY,zephystephy,I really don't feel well 

0,2266624874,Sun Jun 21 08:49:41 PDT 2009,NO_QUERY,flapjacks9702,@productthespic that's so wack dude. 

0,2266624885,Sun Jun 21 08:49:41 PDT 2009,NO_QUERY,KawaiiBerry,"Trace TV, stop showing the Clean Version of Paparazzi "

0,2266625162,Sun Jun 21 08:49:43 PDT 2009,NO_QUERY,massmass,"I just burned my finger.  Don't play with lighters, kids!"

0,2266625213,Sun Jun 21 08:49:43 PDT 2009,NO_QUERY,marissaxalonso,This is the worst day at the beach i have ever had. Cant go swimming now b/c i just saw a shark. Fml! Its so hot and this park is gross! 

0,2266625242,Sun Jun 21 08:49:44 PDT 2009,NO_QUERY,StephieeRosee,courseworkk has ruineddd my day 

0,2266625282,Sun Jun 21 08:49:43 PDT 2009,NO_QUERY,janaebritt,"sad that the fam isn't coming up until next weekend now  happy father's day, dad!! ( #squarespace )"

0,2266625337,Sun Jun 21 08:49:44 PDT 2009,NO_QUERY,alimc,About to go put my bathing suit on and lay by the pool for the day!!! But wishing @andynewman had the day off &amp; could join 

0,2266625404,Sun Jun 21 08:49:44 PDT 2009,NO_QUERY,Deesmileyface,@elperrogrande no! It just reopened a few months ago 

0,2266625496,Sun Jun 21 08:49:45 PDT 2009,NO_QUERY,ridor9th,My Father's Day is the first one without my father.  He died on 10/4/08.  

0,2266625618,Sun Jun 21 08:49:45 PDT 2009,NO_QUERY,Danisidhe,@TheCharmQuark I know how you feel  I'm in Japan and it's 4am for me - luckily my muse sometimes keeps me up that late!  #WriteChat

0,2266625712,Sun Jun 21 08:49:46 PDT 2009,NO_QUERY,kinematografia,"My throat hurts, I think I'm getting sick again "

0,2266626015,Sun Jun 21 08:49:48 PDT 2009,NO_QUERY,mernthefern,"hard to say goodbye to Rob, Ratna &amp; Anjali  they never seem to stay long enough"

0,2266626037,Sun Jun 21 08:49:48 PDT 2009,NO_QUERY,lizschenkat,MAJOR food baby 

0,2266626251,Sun Jun 21 08:49:49 PDT 2009,NO_QUERY,ShaneDawsonGeek,i am bored as iain hoey is away 

0,2266626956,Sun Jun 21 08:49:54 PDT 2009,NO_QUERY,curious_cat09,@KitiaraTomsen my girl is in tears im making her stay home.  

0,2266627040,Sun Jun 21 08:49:54 PDT 2009,NO_QUERY,DREEE9,"I am in a desperate mode to shop, with no money "

0,2266627109,Sun Jun 21 08:49:55 PDT 2009,NO_QUERY,indio809,I lost everything all my music my videos everything! And im still moving forward  i just wanna die!

0,2266627558,Sun Jun 21 08:49:57 PDT 2009,NO_QUERY,Ameliajaynee,"Cream crackered, but can't actually sleep "

0,2266627937,Sun Jun 21 08:50:00 PDT 2009,NO_QUERY,heykimmers,Too bad the tickets were a little bit too expensive for me 

0,2266628081,Sun Jun 21 08:50:01 PDT 2009,NO_QUERY,margaret916,goodmorning everyone &amp; happy fathers day ! overslept by 15 minutes today 

0,2266628544,Sun Jun 21 08:50:04 PDT 2009,NO_QUERY,ariannechan,damn drawer is still stuck  sister comes over to help.. keep your fingers crossed. lol

0,2266628558,Sun Jun 21 08:50:04 PDT 2009,NO_QUERY,pcalitz,Had a great day with Carla and her Dad.  I'm missing my Dad today 

0,2266628971,Sun Jun 21 08:50:06 PDT 2009,NO_QUERY,ben_betts,@scottydavis1 - they are lovely however I'm out of butter so can't do any icing 

0,2266629429,Sun Jun 21 08:50:08 PDT 2009,NO_QUERY,Kdudders,@hossheckler I'm right there with you buddy 

0,2266629470,Sun Jun 21 08:50:08 PDT 2009,NO_QUERY,rosie_rage,"this is me tired, after mcfly and work   x http://tinyurl.com/nsj9te"

0,2266630549,Sun Jun 21 08:50:14 PDT 2009,NO_QUERY,nitssss,don't want to start work so soon! 

0,2266630701,Sun Jun 21 08:50:15 PDT 2009,NO_QUERY,punkinnn,"gonna spend time with my daddy today, geez who knew living alone would make me miss him so much "

0,2266631234,Sun Jun 21 08:50:18 PDT 2009,NO_QUERY,rezarizki,Longing again  http://myloc.me/4R3H

0,2266631273,Sun Jun 21 08:50:18 PDT 2009,NO_QUERY,xxJONASaholicxx,@mileycyrus I CANT BELIEVE YOUR DATING NICK...AGAIN!!! HOW COULD U!!!!!   

0,2266631657,Sun Jun 21 08:50:21 PDT 2009,NO_QUERY,sarahkatherine1,I wish someone loved me. 

0,2266631807,Sun Jun 21 08:50:22 PDT 2009,NO_QUERY,sedentarymonkey,"@Toriana - muffins rocked, I thank ye.  Suffolk - somewhere near rail links.   What the word for more depressed than depressed?"

0,2266631874,Sun Jun 21 08:50:22 PDT 2009,NO_QUERY,airgonaut,"Happy Father's Day, to the dads out there. Also, I would like to express my discontent at working open to close today.  #fakejob"

0,2266632270,Sun Jun 21 08:50:25 PDT 2009,NO_QUERY,sissisuseso,need an awesome time with my Point's.i miss you already  http://myloc.me/4R3R

0,2266632408,Sun Jun 21 08:50:25 PDT 2009,NO_QUERY,Luskica,My washing machine is broken  Need to call tomorrow the repairer..!!!

0,2266632429,Sun Jun 21 08:50:26 PDT 2009,NO_QUERY,rnsn,My last day at the PBL National Conference  Gonna make the best of today then fly back to Tucson tonight.

0,2266633183,Sun Jun 21 08:50:30 PDT 2009,NO_QUERY,passion_in_life,"There goes my diet @sweetcakesbakes The herb knots, asiago biscuits, and cinnamon pecan rolls will only add to my weight "

0,2266634453,Sun Jun 21 08:50:38 PDT 2009,NO_QUERY,melissa_rae,So tired!! I was up all night with a sick little girl. 

0,2266634604,Sun Jun 21 08:50:39 PDT 2009,NO_QUERY,xtinec,worrying... what's taking him so long... 

0,2266634637,Sun Jun 21 08:50:39 PDT 2009,NO_QUERY,TeamJonass,"Im sad ='[ why did parents have to be so difficult  , GOSH i hate life, why couldnt i be american? I have the eurge to DANCE (:"

0,2266635048,Sun Jun 21 08:50:42 PDT 2009,NO_QUERY,jlynx3,Slightly dressed up for my dance recital. I feel like an adult. Ew 

