sentiment,userid,date,query,userId,text0,2189856190,Tue Jun 16 01:05:21 PDT 2009,NO_QUERY,debrabigshot,@becnom I know right. Haha it sucksss 

0,2189856303,Tue Jun 16 01:05:22 PDT 2009,NO_QUERY,kitschtique,"@TempSec Oh no, sounds horrible  Nearly over now then lovely x"

0,2189856357,Tue Jun 16 01:05:22 PDT 2009,NO_QUERY,chemicalzombie,@AstroZombie13 vicky! jake is mad at me! 

0,2189856450,Tue Jun 16 01:05:23 PDT 2009,NO_QUERY,Harukio,Why the hell did I decide to take the camera off the tripod during that part? Ugh shaky cam  And the other camera had a bad angle 

0,2189856508,Tue Jun 16 01:05:24 PDT 2009,NO_QUERY,daretobecrazy,@item84jeremy i know. and i have so much to do tomorrow... 

0,2189856544,Tue Jun 16 01:05:24 PDT 2009,NO_QUERY,fayyazb,Immersed in work so I don't MISS my BABY! 

0,2189856702,Tue Jun 16 01:05:26 PDT 2009,NO_QUERY,KsenchyM,...received a SMS with a very spooky content... 

0,2189856861,Tue Jun 16 01:05:27 PDT 2009,NO_QUERY,heywidya,sun is shining so bright right now and i dont really like it 

0,2189856979,Tue Jun 16 01:05:28 PDT 2009,NO_QUERY,violetile,@iDeviant It's the Baboon's BB! I don't think the BB Tour is going to be available in SG anytime soon 

0,2189857690,Tue Jun 16 01:05:34 PDT 2009,NO_QUERY,socalpie,@xmeganreneex i can't wait to finish school this week so i can finally play!  i got it like 2 weeks ago and i haven't gotten the chance 

0,2189858012,Tue Jun 16 01:05:37 PDT 2009,NO_QUERY,j_noelle,"@AmberAusten Aw, I read your blog.   You have all &quot;A's&quot; in your family; I have all &quot;J's.&quot; ;)"

0,2189858597,Tue Jun 16 01:05:43 PDT 2009,NO_QUERY,bellametaphor,"@JansportJ crack music for diddy, diddy cant rap.  i hope he dont search his name."

0,2189858775,Tue Jun 16 01:05:44 PDT 2009,NO_QUERY,SarahNicholas,@Sianz The cape shop wasn't open this morning  Am making do with a swirly dress and some extra eyeliner.

0,2189858956,Tue Jun 16 01:05:46 PDT 2009,NO_QUERY,ChrisHerd,On the bus heading from Luton airport to High Wycombe 

0,2189858959,Tue Jun 16 01:05:46 PDT 2009,NO_QUERY,atomicshed,Swift3d has a cross-platform serial (good)! Ah but why not tell me this months ago when I was trying to upgrade at a better price 

0,2189859506,Tue Jun 16 01:05:51 PDT 2009,NO_QUERY,pinoytagapantok,no food  I'm bored again

0,2189859809,Tue Jun 16 01:05:54 PDT 2009,NO_QUERY,xhollywoodkissx,Is sad. She knew it would eventually hit her soon. 

0,2189860013,Tue Jun 16 01:05:56 PDT 2009,NO_QUERY,louiselane,Where I cand find Harper's Island single links to download? I'm getting tired to looking into Warez BB boards. 

0,2189860141,Tue Jun 16 01:05:58 PDT 2009,NO_QUERY,a_glance_behind,Naaaw. My &quot;She falls asleep&quot; music is dodgy! Looks like i'm changing the song 

0,2189860311,Tue Jun 16 01:05:59 PDT 2009,NO_QUERY,sashii,@Cassie_kayyy i was gonna go look at your pics but it told me that your myspace profile was under maintenance 

0,2189861600,Tue Jun 16 01:06:11 PDT 2009,NO_QUERY,ncSquare,CRAZY thunderstorm here in Charleston. My girl and I can't sleep 

0,2189862354,Tue Jun 16 01:06:18 PDT 2009,NO_QUERY,Kyyanno,@bearskunk I hate you....  Â£50 gets me to yours and back

0,2189863076,Tue Jun 16 01:06:25 PDT 2009,NO_QUERY,SWAYSWAYBRitty,i feeeel so shitty 

0,2189863086,Tue Jun 16 01:06:25 PDT 2009,NO_QUERY,Tennesseexo,@nitchxo its taking the piss I've had 45 mins sleep  http://myloc.me/40tx

0,2189863512,Tue Jun 16 01:06:29 PDT 2009,NO_QUERY,djaudissey,@DJJohnnieFrench i know but i forgot...and now i'm so sad 

0,2189864012,Tue Jun 16 01:06:34 PDT 2009,NO_QUERY,translactism,@noedition thanks baby girl...... my nostrils hurts alot 

0,2189864331,Tue Jun 16 01:06:37 PDT 2009,NO_QUERY,Izzytheteenager,Omg omg I just found this picture of miley Cyrus mitchel musso it's a dirty picture!!!! Wow I can't believe her 

0,2189864487,Tue Jun 16 01:06:38 PDT 2009,NO_QUERY,All_About_Giana,"Great, I'm stuck here, till I can get out, and I said &quot;F*ck&quot; and horny hottie is following me again. Well so far today sucks! "

0,2189864595,Tue Jun 16 01:06:39 PDT 2009,NO_QUERY,missmahogani,@DajaBadAzz i dunno if i can take it anymore..read my blog 

0,2189864633,Tue Jun 16 01:06:40 PDT 2009,NO_QUERY,osmarsusilo,"@CRSete hey, since u are with madrid now, are you going to indonesia? if not, i'll just sell my tickets "

0,2189864665,Tue Jun 16 01:06:40 PDT 2009,NO_QUERY,iamvlady,@mostazzza i know you miss me 

0,2189864669,Tue Jun 16 01:06:40 PDT 2009,NO_QUERY,DaCremeDela,is missing daddy  i can't wait 4 him 2 come home so he can make it wetter :p

0,2189864705,Tue Jun 16 01:06:41 PDT 2009,NO_QUERY,tonyarnold,"Whhhhy is there a $20 minimum on internet orders, Dominos? You've cut me reeeeal deep "

0,2189865283,Tue Jun 16 01:06:46 PDT 2009,NO_QUERY,cinemaviscera,"@efisiafele  Sad to hear that. Hope you're still going, though! It'll inspire the fuck outta you. You know it!!"

0,2189865304,Tue Jun 16 01:06:46 PDT 2009,NO_QUERY,kebukebu,"Alright, had a couple nice long naps and some neat dreams.. But I must have bumped the sleep window closed again "

0,2189865835,Tue Jun 16 01:06:52 PDT 2009,NO_QUERY,TickinToTheTop,Fuck!!! I really hope that I'm nearing my last night alone...i miss his touch 

0,2189866496,Tue Jun 16 01:06:58 PDT 2009,NO_QUERY,christakeizer,"noooo it looks like June gloom will be burnt off this week  goodbye high 60s, hello high 80s/90s :["

0,2189866867,Tue Jun 16 01:07:02 PDT 2009,NO_QUERY,louiselane,Where I can find Harper's Island single links to download? I'm getting tired to looking into WBB boards. 

0,2189867031,Tue Jun 16 01:07:04 PDT 2009,NO_QUERY,phillsacre,Why can Microsoft not generate proper HTML? I thought the days of FrontPage 98 were over! 

0,2189867195,Tue Jun 16 01:07:05 PDT 2009,NO_QUERY,devin4l,Sleep is impossible 

0,2189867248,Tue Jun 16 01:07:06 PDT 2009,NO_QUERY,MissHKS,@davesusetty has your GFgone? 

0,2189867312,Tue Jun 16 01:07:07 PDT 2009,NO_QUERY,MissSimone32,#True Tuesdays: I wish I had a fck buddy on the side cause my man aint hittin it right.  Im sad.

0,2189867346,Tue Jun 16 01:07:07 PDT 2009,NO_QUERY,nicksynet,"@GirlGamersUK yeah it is, for up to 24hrs "

0,2189867694,Tue Jun 16 01:07:10 PDT 2009,NO_QUERY,suleatun,"Oh nooo please dont send me anything regarding messaging format, I dunn wanna know or involve in that    #imnotITgirl"

0,2189867941,Tue Jun 16 01:07:12 PDT 2009,NO_QUERY,Icklesal,@10TheDoctor10 Take good care of yourself hun. You've got us very worried at present 

0,2189867943,Tue Jun 16 01:07:12 PDT 2009,NO_QUERY,Ne55iepooh,Frustration... The kid fell asleep at 6 just woke up at midnight Grr! Looks like i'll be awake for awhile  lol!

0,2189868409,Tue Jun 16 01:07:17 PDT 2009,NO_QUERY,andyflisher,"Self destructing iMac round 2, bye bye Ethernet   Not important, can live without it, and the hard drive, don't need that either /-("

0,2189868848,Tue Jun 16 01:07:22 PDT 2009,NO_QUERY,daniiidarko,no greek til august. 

0,2189868887,Tue Jun 16 01:07:22 PDT 2009,NO_QUERY,LauraBear,"Can't decide if its a cold or hayfever. I know which I'd prefer, but sadly I think its the other "

0,2189868898,Tue Jun 16 01:07:22 PDT 2009,NO_QUERY,LeelooDogBlog,Fan pages can't get Facebook names unless they have 1000 followers. Only 941 to go for Leeloo  Help us? http://tinyurl.com/llsrhx

0,2189869339,Tue Jun 16 01:07:26 PDT 2009,NO_QUERY,kat_mandu_,@slgavin Oh no! How demoralising  hope you get moving soon

0,2189869498,Tue Jun 16 01:07:28 PDT 2009,NO_QUERY,rhemsworth,@JanisSharp - Yes I  have heard that 

0,2189869910,Tue Jun 16 01:07:32 PDT 2009,NO_QUERY,tudssiazon,hates it that she's home while her friends are having a great time! 

0,2189870051,Tue Jun 16 01:07:33 PDT 2009,NO_QUERY,edrabbit,"An evening of pitting cherries and playing Rock Band, hard to argue with that. Sad that Xbox Live is down though. I cant buy more songs! "

0,2189870167,Tue Jun 16 01:07:35 PDT 2009,NO_QUERY,Wizzybang,Going to dentist today 

0,2189870256,Tue Jun 16 01:07:35 PDT 2009,NO_QUERY,shntenchi,@sinatao   what's wrong?

0,2189870530,Tue Jun 16 01:07:38 PDT 2009,NO_QUERY,sunbludysun,Wishing i could meet Megan Fox. 

0,2189870548,Tue Jun 16 01:07:39 PDT 2009,NO_QUERY,louisachoo,Worm in my farm 

0,2189871245,Tue Jun 16 01:07:46 PDT 2009,NO_QUERY,andrewhirst,Doing my accounts again.... 

0,2189871276,Tue Jun 16 01:07:46 PDT 2009,NO_QUERY,The_Posh,"Heyyyyy peoples, sat in a it class asusual, how was the site matinence i missed it  lol"

0,2189871404,Tue Jun 16 01:07:48 PDT 2009,NO_QUERY,EucalyptusShake,@BrookeAlley I hope Everie is okay.  

0,2189871479,Tue Jun 16 01:07:48 PDT 2009,NO_QUERY,wavygravy525,@DonnieWahlberg So Sorry I hope Ddub can forgive me  not myself these days!

0,2189871835,Tue Jun 16 01:07:52 PDT 2009,NO_QUERY,x_Emily,is tired but neeedas to do much much more science revision 

0,2189872095,Tue Jun 16 01:07:55 PDT 2009,NO_QUERY,Palooosh,YAY!finally summer!but ofcourse Im going to work today.... 

0,2189872167,Tue Jun 16 01:07:55 PDT 2009,NO_QUERY,sammuellee,@JAMIEgasm what about me? i dont comfort you? 

0,2189872250,Tue Jun 16 01:07:56 PDT 2009,NO_QUERY,kaseypoteet,@Smitheejr But no wang shots. 

0,2189872413,Tue Jun 16 01:07:58 PDT 2009,NO_QUERY,BusterGreer,Trying to sleep but thinking the stress from work is making it hard to sleep 

0,2189872518,Tue Jun 16 01:07:59 PDT 2009,NO_QUERY,james_brodie,im sick of not having a phone. and im sick of not having any money. and im sick 

0,2189872695,Tue Jun 16 01:08:01 PDT 2009,NO_QUERY,moominboy,@MissMinda The animation doesn't work for me 

0,2189872737,Tue Jun 16 01:08:01 PDT 2009,NO_QUERY,Tamaragotchi,dont know about tomorrow 

0,2189872948,Tue Jun 16 01:08:03 PDT 2009,NO_QUERY,midnight_plue,@myvanitybag yes it does  le sigh.

0,2189873144,Tue Jun 16 01:08:05 PDT 2009,NO_QUERY,_anthonyjames,#iremember not having terrible hayfever 

0,2189873227,Tue Jun 16 01:08:06 PDT 2009,NO_QUERY,sincereserenity,i got a bump on my head and it really hurts  random bump...dont know how it got there...what a mystery

0,2189873237,Tue Jun 16 01:08:06 PDT 2009,NO_QUERY,fakedarren,Wish I'd taken the opportunity to go to Ascot now 

0,2189873406,Tue Jun 16 01:08:08 PDT 2009,NO_QUERY,twago,Walked to work wishing I had worn shorts  #twago @twago

0,2189873793,Tue Jun 16 01:08:12 PDT 2009,NO_QUERY,killerstarfish,feels like a high school student again.  

0,2189873794,Tue Jun 16 01:08:12 PDT 2009,NO_QUERY,b1ng0bang0,@feblub I need some help already  how do I see my followers?

0,2189874102,Tue Jun 16 01:08:15 PDT 2009,NO_QUERY,alex_and_brooke,@Yasminmusic haha i have 2 weeks till school end.  you lucky girl 

0,2189874638,Tue Jun 16 01:08:20 PDT 2009,NO_QUERY,joanneatkinson,should really start updating my twitter more often no wonder no one follows me! today stu has a meeting about redundancies at work 

0,2189874666,Tue Jun 16 01:08:20 PDT 2009,NO_QUERY,stefantRO,@eCostin incerc sa o uploadez - twitpic fail 

0,2189874810,Tue Jun 16 01:08:21 PDT 2009,NO_QUERY,xhollywoodkissx,Is sad. Knew it would eventually hit her. Wishes she had a time machine 

0,2189875137,Tue Jun 16 01:08:25 PDT 2009,NO_QUERY,shaaqT,@krist0ph3r @ideasmithy I m pretty much stuck at 978 

0,2189875257,Tue Jun 16 01:08:26 PDT 2009,NO_QUERY,jcallahan,Damn you AT&amp;T I want the iPhone 3GS but I don't got 500 bones to drop on it. Time for sad face. 

0,2189875672,Tue Jun 16 01:08:30 PDT 2009,NO_QUERY,lilmissgigi,I am so livid right now. 1st: Walmart didn't have the @Jonasbrothers CD at midnight then I find out I can't use my phone 

0,2189876114,Tue Jun 16 01:08:34 PDT 2009,NO_QUERY,TiannaLynn79,I need some cheering up  some kind words for me? post em on my blog http://bit.ly/cSG3g

0,2189876330,Tue Jun 16 01:08:36 PDT 2009,NO_QUERY,ShayyyG,Still haven't been able to sleep. Thinking I should maybe go to the hospital soon  help

0,2189876439,Tue Jun 16 01:08:38 PDT 2009,NO_QUERY,jmoo2,@EarlTwitition did u give up? 

0,2189876616,Tue Jun 16 01:08:39 PDT 2009,NO_QUERY,ClareBaptist,"i am so not good at having like no sleep,, COLLEGE WORK TO DO "

0,2189876872,Tue Jun 16 01:08:42 PDT 2009,NO_QUERY,boobsie_lu,"@LmofuknC eeeekkk! Its been that long since we graduated? Fuck!!!! I feel sad now! Thanks for mentioning that, Leo! "

0,2189877120,Tue Jun 16 01:08:44 PDT 2009,NO_QUERY,JodiMullen,"Augh, forgot my iPod/hphones for iTunes. Today is going to be much less bearable without music "

0,2189877286,Tue Jun 16 01:08:46 PDT 2009,NO_QUERY,June_Bear,@jenwhyy dyu maybe wanna phone me later? (or il come on msn if i can figure out Matt's mac lol) wanna talk tyu - im stupid 

0,2189877293,Tue Jun 16 01:08:46 PDT 2009,NO_QUERY,kirfree924,watching American Idol with my mom...upset that i didnt get to see the baby elephant when i went to the zoo today 

0,2189877562,Tue Jun 16 01:08:50 PDT 2009,NO_QUERY,luvbella24,isn't quite sure if she wants to break up with him or not 

0,2189877691,Tue Jun 16 01:08:51 PDT 2009,NO_QUERY,nehxb3,forgot I had twitter--will work on it. 

0,2189877950,Tue Jun 16 01:08:54 PDT 2009,NO_QUERY,pandaaMONIA,@loz_chanteuse aww  - why i dropped OHS really fast. too stressful. are you dropping next year?

0,2189878136,Tue Jun 16 01:08:55 PDT 2009,NO_QUERY,Connornet,Fourms and xbox down  bored

0,2189878246,Tue Jun 16 01:08:57 PDT 2009,NO_QUERY,yourknee,@jackfburke LOL I wrote &quot;robins&quot; instead of &quot;robina&quot; I swear I backspaced that  It was really nice and I could totes see you working there

0,2189878331,Tue Jun 16 01:08:57 PDT 2009,NO_QUERY,lalagwayzv,"@christelmcr u know christel, im so upsets. Guys from mcr didn't send me a reply "

0,2189878425,Tue Jun 16 01:08:58 PDT 2009,NO_QUERY,stephdadi,Hi @NameCheap - out of interest what is the rule of you mis-spell something and re-enter your answer? I've done it twice in 24 hr 

0,2189878531,Tue Jun 16 01:08:59 PDT 2009,NO_QUERY,Chezzzzz,@schofe sounds good i think ill curl up on the sofa with tissues 2 hand &amp; watch .......got flu ( the normal annoying type not swine lol ) 

0,2189878630,Tue Jun 16 01:09:00 PDT 2009,NO_QUERY,stimpy_,Trying to find a band that don't remind me of him is impossible 

0,2189878775,Tue Jun 16 01:09:01 PDT 2009,NO_QUERY,jennierg_,@Nataliejfk I know I know I know  I wanted to cry when I read it. I actually did. Did you listen to them on Radio1 yesterday? =D I did. ha

0,2189879336,Tue Jun 16 01:09:06 PDT 2009,NO_QUERY,RealChristine,@dannykurily hahah aww  I hate when flights get delayed!

0,2189879519,Tue Jun 16 01:09:08 PDT 2009,NO_QUERY,JordanJx,is curled up in a ball! feel soo sicckkkkk  why today? On my leavers day!!! boohooo. 

0,2189880216,Tue Jun 16 01:09:15 PDT 2009,NO_QUERY,emmy_563,"I couldn't begin with the games, cuz I'm the last person on the list... that'S bad "

0,2189880320,Tue Jun 16 01:09:16 PDT 2009,NO_QUERY,Aaron_Horne,Can't sleep. Keep waking up suddenly when my throat restricts my breathing. 

0,2189880335,Tue Jun 16 01:09:17 PDT 2009,NO_QUERY,PumaSwede,"@Reilly30 aagh, I love Clint and I can't believe I haven't seen it yet "

0,2189880541,Tue Jun 16 01:09:19 PDT 2009,NO_QUERY,konsnos,My exams just started  Boring.

0,2189880637,Tue Jun 16 01:09:20 PDT 2009,NO_QUERY,Talikins,"@thnksfrthgrg what happened?  i keep getting blamed for shizz too, i need to read the other slash now x"

0,2189881121,Tue Jun 16 01:09:24 PDT 2009,NO_QUERY,Mypec,Suns gone in now 

0,2189881199,Tue Jun 16 01:09:25 PDT 2009,NO_QUERY,pinkteddybear,really wants that job... waiting sucks... 

0,2189881489,Tue Jun 16 01:09:28 PDT 2009,NO_QUERY,sarls,"dang, i did close to nothing today. this sucks "

0,2189881547,Tue Jun 16 01:09:28 PDT 2009,NO_QUERY,marioloveswario,"spending the day in bed/working out. Fun day, topped off by GCSE chemistry tomorrow "

0,2189881601,Tue Jun 16 01:09:29 PDT 2009,NO_QUERY,Sarah_831,im out of the shower...  grr my laptop and fone off my everynight 8:30

0,2189881838,Tue Jun 16 01:09:31 PDT 2009,NO_QUERY,adrianabannana,I hate not sleeeping  stupid bad dreams

0,2189881960,Tue Jun 16 01:09:33 PDT 2009,NO_QUERY,kat_n,"morning everyone,, got a sore throat.can hardly speak   "

0,2189881967,Tue Jun 16 01:09:33 PDT 2009,NO_QUERY,janicechian,I'm so sleepy. My eyes are about to close and the classroom is freezing.  I wanna go home and sleep!

0,2189882162,Tue Jun 16 01:09:35 PDT 2009,NO_QUERY,vvveriteh,ahhhh i woke up one massive blob of snot  hayfever? i think so!

0,2189882210,Tue Jun 16 01:09:35 PDT 2009,NO_QUERY,marig16,It's a sad day for Gaia. They sold out. 

0,2189882478,Tue Jun 16 01:09:38 PDT 2009,NO_QUERY,vickylunabee,"Ugh, I can't find any where online to watch true blood "

0,2189882576,Tue Jun 16 01:09:40 PDT 2009,NO_QUERY,pramestiwidya,Delivered a package to the wrong address. No harm done--thank god for that--but I feel soooooooo guilty 

0,2189882625,Tue Jun 16 01:09:40 PDT 2009,NO_QUERY,Elisexo,My throat hurts like fuck. 

0,2189883526,Tue Jun 16 01:09:50 PDT 2009,NO_QUERY,jfernand3z,now I have my twitter and FB web master. thanks AJ for the help. 

0,2189883623,Tue Jun 16 01:09:51 PDT 2009,NO_QUERY,Sandra_Soriano,drank too much diet coke and now can't sleep. 

0,2189883849,Tue Jun 16 01:09:53 PDT 2009,NO_QUERY,JoBroLuv,nooooo LVATT isn't out today!!! its coming out on friday  cry cry cry!

0,2189884204,Tue Jun 16 01:09:57 PDT 2009,NO_QUERY,x_tara,@WooopJess aww lame! mine wont let me upload a vid  siigh lol.

0,2189884379,Tue Jun 16 01:09:59 PDT 2009,NO_QUERY,Angieewahh,@URIENATOR  sammee! gosh how r we meant to finish it in a week! plus we have to do a portfolio&gt;___&lt;

0,2189884540,Tue Jun 16 01:10:00 PDT 2009,NO_QUERY,Anesia,@Eucalypt *deletes mine as well* 

0,2189885032,Tue Jun 16 01:10:04 PDT 2009,NO_QUERY,rhcp011235,Wishing he understood the process of de-zending. Would  make my job 100% easier 

0,2189885198,Tue Jun 16 01:10:05 PDT 2009,NO_QUERY,michaelajayne,want this week to be over already  stupid fmp

0,2189885247,Tue Jun 16 01:10:06 PDT 2009,NO_QUERY,USCtrackstar12,@FLYESTofthemALL Im not a TRack star. Im the STAR of TRACK ! boom lol but yes. idk its a pain i never felt . 

0,2189885384,Tue Jun 16 01:10:07 PDT 2009,NO_QUERY,AyshPattinson,R.I.P Nathan &amp; Cheryl. Braces fucking hurt 

0,2189885498,Tue Jun 16 01:10:08 PDT 2009,NO_QUERY,lilmissdainty,"@SexyKellyC Yes, very sad. "

0,2189885981,Tue Jun 16 01:10:12 PDT 2009,NO_QUERY,pbrack,Broken down and waiting for the RAC man to arrive   http://bit.ly/wop2G

0,2189886001,Tue Jun 16 01:10:12 PDT 2009,NO_QUERY,Jerome_143,@McChickie Hmmm you're right about that.There are a lot of people who tweeted that.This might get worse before it gets better 

0,2189886026,Tue Jun 16 01:10:12 PDT 2009,NO_QUERY,trpennington,I hate that my grandma was just in the hospital... Being homesick makes falling asleep near impossible. 

0,2189886830,Tue Jun 16 01:10:20 PDT 2009,NO_QUERY,GlissGuitar,@radmark @thezunicorn  what... you think you can go on the road and not see us in LA???? Sheeeesh!

0,2189886964,Tue Jun 16 01:10:21 PDT 2009,NO_QUERY,ghulai,"says Its not about how tired you are, its about how much you really want to be with me  http://plurk.com/p/11acut"

0,2189887012,Tue Jun 16 01:10:22 PDT 2009,NO_QUERY,oinkd,@neimanmarcus922 aww  we might have to change that lol

0,2189888157,Tue Jun 16 01:10:32 PDT 2009,NO_QUERY,FrankoCon, not good hospital in 5 mins

0,2189888242,Tue Jun 16 01:10:33 PDT 2009,NO_QUERY,Imicus,Download was amazing! Feeling tired and burnt today though 

0,2189888261,Tue Jun 16 01:10:33 PDT 2009,NO_QUERY,n8lewis,I do but this was a I don't want to sit next to him moment and not a your team moment. I scare away women... 

0,2189888273,Tue Jun 16 01:10:33 PDT 2009,NO_QUERY,cruisemaniac,@psam will have to manually check... dont use MFE regularly... so i dunno if i can fix from remote  u can check with @bhuwan or @jijoy tho

0,2189888489,Tue Jun 16 01:10:35 PDT 2009,NO_QUERY,lancione,Bringing Patric home   i wont see him for a week ima be lonely.

0,2189888814,Tue Jun 16 01:10:39 PDT 2009,NO_QUERY,chaoscartel,@missAnnabell no more play time for this kid. Settled down as of last week. So busy now til London that I haven't time to party anymore  x

0,2189889274,Tue Jun 16 01:10:43 PDT 2009,NO_QUERY,mjh81,"@MiriamCheah so your a proper music head then, wish I could play the guitar well "

0,2189889909,Tue Jun 16 01:10:49 PDT 2009,NO_QUERY,Krispyb,Just woken up...anyone got tips for puffy eyes?! LOL. Gotta go running in like an hour 

0,2189890047,Tue Jun 16 01:10:51 PDT 2009,NO_QUERY,Ciwwaffan10111,My ribs hurt 

0,2189890054,Tue Jun 16 01:10:53 PDT 2009,NO_QUERY,vaibhavgoswami,Tired of traveling and working 

0,2189890262,Tue Jun 16 01:10:53 PDT 2009,NO_QUERY,sinyocute,"my body is not delicious, kena plu neh...idungku jd meler.....hiks..... "

0,2189890383,Tue Jun 16 01:10:54 PDT 2009,NO_QUERY,ItsmeJeni,Beau beau morning!! Dinner and a catch up with the girlies tonight! For now time to start working... 

0,2189890414,Tue Jun 16 01:10:54 PDT 2009,NO_QUERY,matthew2909,Ooh i'm lucky my internet has not screwed up yet cuz its so slow 

0,2189891059,Tue Jun 16 01:11:01 PDT 2009,NO_QUERY,brahhh,@baby__jane you didn't even watch it with me  miss too sleepy all the time. heart breaker.

0,2189891409,Tue Jun 16 01:11:04 PDT 2009,NO_QUERY,XLou_LouXx,"@wwecodyrhodes shame your not the champion, good for randy though, havent seen Raw yet "

0,2189891704,Tue Jun 16 01:11:07 PDT 2009,NO_QUERY,katyhaughey,"I really, really hate being up this early. "

0,2189891868,Tue Jun 16 01:11:08 PDT 2009,NO_QUERY,darshu,"@liatvardibar yes, missed my candy and pastrami too "

0,2189892170,Tue Jun 16 01:11:11 PDT 2009,NO_QUERY,elliejanexo,in media doing coursework even though im falling asleep 

0,2189892300,Tue Jun 16 01:11:13 PDT 2009,NO_QUERY,fiionerr,@DanMerriweather ahhww thats mean and horrible  did the old man see you write that?

0,2189892423,Tue Jun 16 01:11:14 PDT 2009,NO_QUERY,Beenbag,is wondering when it'll get easier dropping little man off at nursery. 2 years in and still tears from both of us 

0,2189892438,Tue Jun 16 01:11:14 PDT 2009,NO_QUERY,piaaguirre,Self quarantine sucks. I want to see my friends! 

0,2189892535,Tue Jun 16 01:11:15 PDT 2009,NO_QUERY,tristanking19,So I'm allergic to apple sauce??? Come on!!  WTF will I eat then??

0,2189892574,Tue Jun 16 01:11:15 PDT 2009,NO_QUERY,NarcoticThought,is felling a bit sick but there's so much to study 

0,2189892785,Tue Jun 16 01:11:18 PDT 2009,NO_QUERY,karinjenkins,this is not fun 

0,2189892990,Tue Jun 16 01:11:20 PDT 2009,NO_QUERY,pishka,"i am that way inclined. are you? 4AM. still can't sleep. ah, boo. "

0,2189893115,Tue Jun 16 01:11:21 PDT 2009,NO_QUERY,HelenaAg,Good morning!Just had breakfast and now I'm studying 

0,2189893201,Tue Jun 16 01:11:22 PDT 2009,NO_QUERY,brahhh,@baby__jane you didn't even watch it with me  ms. too sleepy all the time. heart breaker.

0,2189893311,Tue Jun 16 01:11:23 PDT 2009,NO_QUERY,breathofawen,"@Rukamousse Me too, probably. "

0,2189893472,Tue Jun 16 01:11:25 PDT 2009,NO_QUERY,lisaphan,I didn't get to talk to him today -sits in corner- I moose you 

0,2189894042,Tue Jun 16 01:11:31 PDT 2009,NO_QUERY,ullrich,Seesmic still unusably slow in China 

0,2189894202,Tue Jun 16 01:11:32 PDT 2009,NO_QUERY,4nnie,I tried to contact Andrew Bird by his photographer... fail 

0,2189894502,Tue Jun 16 01:11:35 PDT 2009,NO_QUERY,beckacurrant,@stujohnson enjoy! I was going to go and present but couldn't in the end  be interested to see some tweets of the sessions

0,2189894625,Tue Jun 16 01:11:36 PDT 2009,NO_QUERY,Paulazz,still no sign fromhttp://twitter.com/Change_for_Iran 

0,2189894829,Tue Jun 16 01:11:38 PDT 2009,NO_QUERY,KiwiBeck,@tractorqueen I am 4 foot 11 inches and can't wear heels!!!! 

0,2189894947,Tue Jun 16 01:11:40 PDT 2009,NO_QUERY,GavinHolt,"Been up all night being sick, bad times  I think the chicken at dinner was off...im dying.on route to london dungeons"

0,2189895168,Tue Jun 16 01:11:42 PDT 2009,NO_QUERY,hannah1_7,"busy day for once, steggles, drama, hair... had a dream that i had 3 exams in one day and had to fly a plane "

0,2189895267,Tue Jun 16 01:11:43 PDT 2009,NO_QUERY,NiltonTheSoul,@maxcamsnet :S the Aplication for Twitter hummm for the customised u site in twitter $50 &gt;_&lt; wow  i no have money.

0,2189895443,Tue Jun 16 01:11:45 PDT 2009,NO_QUERY,Omperta,"Watching Highschool Musical 3, it's sad that I'm excited about it "

0,2189895519,Tue Jun 16 01:11:46 PDT 2009,NO_QUERY,nichiwot,"Ugh, I hate having to weed through followers.   I only have so many."

0,2189895773,Tue Jun 16 01:11:48 PDT 2009,NO_QUERY,LubnAhmad,Summer courses suck  bored in class!!!

0,2189895776,Tue Jun 16 01:11:48 PDT 2009,NO_QUERY,EllaPsycho,:-&lt; i know... @Plumxd that u are going to the country side 

0,2189895819,Tue Jun 16 01:11:49 PDT 2009,NO_QUERY,BecReedman,@brian_nathaniel Shame about your job  have you thought about working for yourself?  there's big money to be paid http://bit.ly/1864ml

0,2189896211,Tue Jun 16 01:11:52 PDT 2009,NO_QUERY,maddybt,wahh fb is being so slow.l. i hate 6-7pm 

0,2189896777,Tue Jun 16 01:11:57 PDT 2009,NO_QUERY,kristenlavsya,Fuckin amelia and her cats making me sneeze all over the place and itch to 

