sentiment,userid,date,query,userId,text0,2264360832,Sun Jun 21 03:37:26 PDT 2009,NO_QUERY,SuzyDaFloozy,@kazzba Hey hon! Not much planned - need to visit D's dad but got stinkin head!  Also Huuuuuge pile of ironing... the joys! LOL! You? xoxo

0,2264361219,Sun Jun 21 03:37:30 PDT 2009,NO_QUERY,DogLover892,Im totally shocked about whats happening in Iran!!  Its just sad what they are doing to innocent people who are trying to express themself

0,2264361518,Sun Jun 21 03:37:34 PDT 2009,NO_QUERY,MeghanLand,Sleep help hopefully. Took ambien &amp; watching the History Channel (sure thing usually) sleepy tea &amp; lights off. Quiet bedroom = loud brain 

0,2264361978,Sun Jun 21 03:37:40 PDT 2009,NO_QUERY,heathermilldo,my feet are still sore  panto auditions tonight xxx

0,2264362084,Sun Jun 21 03:37:41 PDT 2009,NO_QUERY,ikki_oo,@Shergmeister I`m the same on Mothers day so i know just how you feel  Just try hard to be lovely lol

0,2264362086,Sun Jun 21 03:37:41 PDT 2009,NO_QUERY,nikkigenevieve,My head is pounding. 

0,2264362135,Sun Jun 21 03:37:42 PDT 2009,NO_QUERY,Maiseyjon,i just want to give up 

0,2264362788,Sun Jun 21 03:37:50 PDT 2009,NO_QUERY,JoanaJonasFan,"Hey @Jonasbrothers ! All I wanted was be there, in the first show !!   !! Please come to Portugal ! CONGRATULATIONS "

0,2264363206,Sun Jun 21 03:37:56 PDT 2009,NO_QUERY,pleasureJALIN,man this show is depressing. 

0,2264363450,Sun Jun 21 03:37:59 PDT 2009,NO_QUERY,Techn1x,"Damn, its not down for the whole country.....search &quot;Rove&quot; and you'll see people are watching it "

0,2264364166,Sun Jun 21 03:38:07 PDT 2009,NO_QUERY,nozhat,"I think i just tore my back muscle, thanks to tennis  - http://tweet.sg"

0,2264364366,Sun Jun 21 03:38:09 PDT 2009,NO_QUERY,ellice_x,"raining, lazy day "

0,2264364386,Sun Jun 21 03:38:09 PDT 2009,NO_QUERY,bethanalice,pffft has to do the ironing ! very exciting 

0,2264364421,Sun Jun 21 03:38:10 PDT 2009,NO_QUERY,kluemaster,living at a place where there is only Reliance &quot;broad&quot;band 

0,2264364505,Sun Jun 21 03:38:11 PDT 2009,NO_QUERY,TraceyMmm,"@__mares__ Not sure, I haven't really been watching it religiously, but the guy in the hat is too damn cocky and I don't like him "

0,2264364642,Sun Jun 21 03:38:13 PDT 2009,NO_QUERY,VillaGirl75,"bit of a boring housework day   Washing in, clean clothes put away, dogs about to be walked..."

0,2264365210,Sun Jun 21 03:38:19 PDT 2009,NO_QUERY,mrhnh,"@bestieverdid Under the circumstances when I wrote it, punctuation= most excellent. Strange Brew IS way too loud. Now for the drama of FD "

0,2264365276,Sun Jun 21 03:38:20 PDT 2009,NO_QUERY,Anesia,for the first time in my habbo history life...iv been officially freaked out by something sexual someone said 

0,2264365395,Sun Jun 21 03:38:21 PDT 2009,NO_QUERY,HarryHarley,@NicoleJeane Yeah sweetie day almost done 8.45 pm Sunday night so back at work in the morning! 

0,2264365602,Sun Jun 21 03:38:24 PDT 2009,NO_QUERY,robynakabob,"@ZoeLucas92 havent started yet lol, will do today, know il struggle "

0,2264365656,Sun Jun 21 03:38:24 PDT 2009,NO_QUERY,amor030908,i definitely need someone to console me 

0,2264365702,Sun Jun 21 03:38:25 PDT 2009,NO_QUERY,jaaaynesplana,sakit ng paa q!  buong araw na..uploading pics

0,2264366365,Sun Jun 21 03:38:33 PDT 2009,NO_QUERY,CarlisleCullen_,@KrystalLaRae that must be bad for you. 

0,2264366606,Sun Jun 21 03:38:36 PDT 2009,NO_QUERY,ilovetwilightxo,Good Morningg! Computer crashed last night 

0,2264366721,Sun Jun 21 03:38:37 PDT 2009,NO_QUERY,Straw000,Gah!! Holiday is ending 

0,2264366800,Sun Jun 21 03:38:38 PDT 2009,NO_QUERY,GuyOnraetGuitar,"looking for an illustrator to do my album art, no luck yet "

0,2264366847,Sun Jun 21 03:38:38 PDT 2009,NO_QUERY,RopeMarksMuse,"yesterday I had to fake migraine to prepare the party for Bob, now I have a real headache "

0,2264367017,Sun Jun 21 03:38:41 PDT 2009,NO_QUERY,thatbmoviechick,"Just had to separate my guinea pig and my rabbit, and clean up blood. Not happy "

0,2264367195,Sun Jun 21 03:38:43 PDT 2009,NO_QUERY,Aimzzy,I'm wrecked from yesterday!!  Soo tired!!

0,2264367763,Sun Jun 21 03:38:50 PDT 2009,NO_QUERY,krissy_albano,i can't sleep... i wish you were here 

0,2264368029,Sun Jun 21 03:38:53 PDT 2009,NO_QUERY,roxybella143,On my way to airport.  Pray the weather holds up! First stop ATL which makes me sad since it's where dad lives but I can't see him 

0,2264368211,Sun Jun 21 03:38:55 PDT 2009,NO_QUERY,annarikje,"I have to cancel my gig tonight, because I am still in bed with the worst flu!!! Not getting better "

0,2264368303,Sun Jun 21 03:38:57 PDT 2009,NO_QUERY,Dangalangg,i miss homeeeee! hopefully 2 weeks and i'll be home 

0,2264368366,Sun Jun 21 03:38:57 PDT 2009,NO_QUERY,rachgoesRAAAAWR,is having a lazy day but I have work later 

0,2264368393,Sun Jun 21 03:38:58 PDT 2009,NO_QUERY,sandradouma,is having a headache! 

0,2264369551,Sun Jun 21 03:39:11 PDT 2009,NO_QUERY,djaudissey,@djsho @djELITE @DaLionofjudah @djdoggfather all 5 lugs snapped and my tire flew off on the the freeway 

0,2264369855,Sun Jun 21 03:39:15 PDT 2009,NO_QUERY,HannahVernon,last week of lving in portsmouth 

0,2264369891,Sun Jun 21 03:39:15 PDT 2009,NO_QUERY,DuluxDog,is going to work  but on the bright side she is going to emmas tonight to see princess protection program

0,2264370009,Sun Jun 21 03:39:16 PDT 2009,NO_QUERY,Dylan_Nicholson,@ ilovejacob4evan just reply to me 

0,2264370040,Sun Jun 21 03:39:17 PDT 2009,NO_QUERY,Dangalangg,vietnam is lame as of right now 

0,2264370661,Sun Jun 21 03:39:24 PDT 2009,NO_QUERY,anzcee,is not feeling well  http://plurk.com/p/12nmeq

0,2264370984,Sun Jun 21 03:39:28 PDT 2009,NO_QUERY,lrnn,I hope these never deflate  http://mypict.me/4P8N

0,2264371053,Sun Jun 21 03:39:29 PDT 2009,NO_QUERY,miss_r,The hours I'll never get back from TH  I gotta get up! It's the British GP and Father's Day!

0,2264371412,Sun Jun 21 03:39:34 PDT 2009,NO_QUERY,pauline11810,im really really really bored.... 

0,2264371569,Sun Jun 21 03:39:35 PDT 2009,NO_QUERY,emmaatkinsonxxx,doing geography homework... yay. 

0,2264371607,Sun Jun 21 03:39:36 PDT 2009,NO_QUERY,Mr_Doyle,is gym.... Oslo.... Edinburgh all on a Sunday 

0,2264371707,Sun Jun 21 03:39:37 PDT 2009,NO_QUERY,PoynterJones,"@staceyyhoward Awww   Don't worry, so am I... *Strokes*"

0,2264371911,Sun Jun 21 03:39:40 PDT 2009,NO_QUERY,samanthajeans,Generally gravy shouldn't be jelly-like 

0,2264371975,Sun Jun 21 03:39:40 PDT 2009,NO_QUERY,megatantri,In PS and too nite to bring myson actually!! Hoping he will be ok...first going out without stroller...  http://myloc.me/4P9I

0,2264372313,Sun Jun 21 03:39:45 PDT 2009,NO_QUERY,ginolocascio,ughhh... woke up at 6 and couldnt go back to sleep 

0,2264372402,Sun Jun 21 03:39:46 PDT 2009,NO_QUERY,lynne08_,@KeNiJoeFanatic ha. i forgot to add home economics on that. we'll study acctg  gaaah.

0,2264372774,Sun Jun 21 03:39:50 PDT 2009,NO_QUERY,wptavern,Trying to help a guy get his site back in order but just discovered his wpcontent-themes and plugins folder has 777 for permissions 

0,2264372911,Sun Jun 21 03:39:52 PDT 2009,NO_QUERY,Julialalala,Most annoying dream ever. It's all your fault 

0,2264373001,Sun Jun 21 03:39:53 PDT 2009,NO_QUERY,temporaryscars,@rebeccargh sadly he awoke by himself 

0,2264373045,Sun Jun 21 03:39:54 PDT 2009,NO_QUERY,annasaccone,"@MupNorth thanks michelle, i'll be fine it's just hard it's the first year  xx"

0,2264373253,Sun Jun 21 03:39:57 PDT 2009,NO_QUERY,_magic8ball,@AbbeyEmm My reply is no 

0,2264373389,Sun Jun 21 03:39:58 PDT 2009,NO_QUERY,jampoot,I hate learning 

0,2264373748,Sun Jun 21 03:40:02 PDT 2009,NO_QUERY,Dilly_dream,week one of home alone done..week 2 just begun..and its gonna be the last for a while 

0,2264374864,Sun Jun 21 03:40:12 PDT 2009,NO_QUERY,ranoona,@ddlovato if u  dated trace u'll regrect it i love u alot but i swear u''ll sooo doo  and u'll lose waayy 2 fans !!

0,2264374956,Sun Jun 21 03:40:13 PDT 2009,NO_QUERY,srh_rosco,Just woke up and its mid day! How bads that? See! Thats what happens when your manager takes your shifts away! Still working tonite tho! 

0,2264375189,Sun Jun 21 03:40:15 PDT 2009,NO_QUERY,JonnySayer,Has just got out of shower and for some reason it was freezing 

0,2264375618,Sun Jun 21 03:40:20 PDT 2009,NO_QUERY,joooline,is home and is still sick 

0,2264376065,Sun Jun 21 03:40:25 PDT 2009,NO_QUERY,Claudi83,Wish you all a nice sunday!!!! But thereÂ´s no sparkle weather today 

0,2264376761,Sun Jun 21 03:40:34 PDT 2009,NO_QUERY,evregirl,gonna set the table for the big Fathers Day lunch. ps what do I say to a friend who doesnt have a dad anymore? 

0,2264377090,Sun Jun 21 03:40:37 PDT 2009,NO_QUERY,Jan_Geronimo,"@Zorlone - Doc Z, where's Jedi master @dezertsnow.  I hardly see him these days.  Any news? "

0,2264377112,Sun Jun 21 03:40:38 PDT 2009,NO_QUERY,strwbrryshrtck,says i can't sleep. my nose is too stuffy.  http://plurk.com/p/12nmrf

0,2264377137,Sun Jun 21 03:40:38 PDT 2009,NO_QUERY,trinsgarcia,@luigiquisumbing unfair!!!  I haven't had a drink in what seems to be forever already!

0,2264377336,Sun Jun 21 03:40:41 PDT 2009,NO_QUERY,ThatGreenGent,"@JessObsess yeah, it really kind of doess.  God...wheres Brendon when we need him..."

0,2264377454,Sun Jun 21 03:40:42 PDT 2009,NO_QUERY,Graeme_Skinner,"@bobbyllew It's certainly a non event if you don't have children, no cards, no presents "

0,2264377519,Sun Jun 21 03:40:43 PDT 2009,NO_QUERY,BrokenMasques,@johncmayer I would love to get some guitar lessons! I've always wanted to learn but the youtube lessons are too fast for me 

0,2264377631,Sun Jun 21 03:40:45 PDT 2009,NO_QUERY,Dylan_Nicholson,@ilovejacob4evan just reply to me 

0,2264378092,Sun Jun 21 03:40:50 PDT 2009,NO_QUERY,madowney63,"Why is it when i have 3 adult kids and 2 grand kids, i still get my fathers day card bought and written my my wife?? "

0,2264378330,Sun Jun 21 03:40:52 PDT 2009,NO_QUERY,yaniiputrii,miss him more and more  that's make me sad

0,2264378356,Sun Jun 21 03:40:53 PDT 2009,NO_QUERY,X_BleedXLove_X,Can't wait til monday night Raw! YEAH ! i am also bored !  bot usually up this early in the morning !

0,2264378798,Sun Jun 21 03:40:58 PDT 2009,NO_QUERY,naiveKK,It is not pressure but sense of responsibility makes me cry     I care about ur feelings rather than mine.And this time what I can say ...

0,2264378817,Sun Jun 21 03:40:58 PDT 2009,NO_QUERY,sfaraja,Bought teethers for my children to chew on. My son took it right away but my daughter doesn't seem to like the texture 

0,2264378959,Sun Jun 21 03:41:00 PDT 2009,NO_QUERY,MegALegz,Happy Fathers Day!(:...I have to go help my mummy 

0,2264379026,Sun Jun 21 03:41:01 PDT 2009,NO_QUERY,Tweegan,"Very, very jealous of Holly, who got to go the the Westlake Ball. She looked really pretty though. I want to go to a ball. "

0,2264379345,Sun Jun 21 03:41:04 PDT 2009,NO_QUERY,blackrose46,Dreading to go back to work.  the only thing im looking forward tomorrow is Transformers 2!

0,2264379631,Sun Jun 21 03:41:07 PDT 2009,NO_QUERY,rachelhatesjazz,Didn't cope too well with day leave today  Relieved to be back in the safety of the clinic.

0,2264379756,Sun Jun 21 03:41:09 PDT 2009,NO_QUERY,mpd57,http://tinyurl.com/nrwccg #neda #tehran #iranelection RIP and puts my previous flipancy to shame 

0,2264380013,Sun Jun 21 03:41:12 PDT 2009,NO_QUERY,KaylaaCole,Morning! (: Rather stressed out this morning... not good 

0,2264380341,Sun Jun 21 03:41:16 PDT 2009,NO_QUERY,neondeception,@berrygurl919 sorry  Have you seen a doctor about it?

0,2264381568,Sun Jun 21 03:41:31 PDT 2009,NO_QUERY,helz_,My dad didnt even read his card 

0,2264381642,Sun Jun 21 03:41:32 PDT 2009,NO_QUERY,MissSunshiiiine,rainy day  and it's boring...hearing music and relax in my bed :p

0,2264381753,Sun Jun 21 03:41:33 PDT 2009,NO_QUERY,bakesy515,@asdfology What about me. 

0,2264381858,Sun Jun 21 03:41:34 PDT 2009,NO_QUERY,mellisalamay,phone is currently not working.  i havnt had a chance to pay the bill yet. ive been a busy bumblebeeeeee!

0,2264382130,Sun Jun 21 03:41:37 PDT 2009,NO_QUERY,XEmzie_RetardX,"Still doing my English H/w, I won't see my duckie Laura tomoz  Sad times....sad times.... "

0,2264382191,Sun Jun 21 03:41:38 PDT 2009,NO_QUERY,tayloremily24,"lunch with nan, tidy room "

0,2264382276,Sun Jun 21 03:41:39 PDT 2009,NO_QUERY,thegrandcricket,"On the bright side, I made a yummy angel food cake for my dad. Sadly, I put them in 4 baking cups that tipped over while baking. "

0,2264382503,Sun Jun 21 03:41:42 PDT 2009,NO_QUERY,jordynrae,My eyes hurt. 

0,2264382576,Sun Jun 21 03:41:43 PDT 2009,NO_QUERY,CompassWoman,@ANDREAamara Thank you.  I do love hummus but we did not have any in the house... 

0,2264383066,Sun Jun 21 03:41:48 PDT 2009,NO_QUERY,mipster,at work on a sunday 

0,2264383079,Sun Jun 21 03:41:48 PDT 2009,NO_QUERY,steviedaniele,@mmitchelldaviss did you get your myspace straightened out yet? 

0,2264383120,Sun Jun 21 03:41:49 PDT 2009,NO_QUERY,painted_flame,Completely broke until the bank opens tomorrow...why do all banks hate me?! 

0,2264383277,Sun Jun 21 03:41:51 PDT 2009,NO_QUERY,nicb09,my tummy hurts 

0,2264383298,Sun Jun 21 03:41:51 PDT 2009,NO_QUERY,colz,@nesslei enjoy! Just checking the raindrops are of consistent size here. Yep. Big 

0,2264383897,Sun Jun 21 03:41:59 PDT 2009,NO_QUERY,mialegria,missing wearing a skirt to work. my worksite doesn't allow me to do so 

0,2264384000,Sun Jun 21 03:42:00 PDT 2009,NO_QUERY,revolt10,I wish the world was simpler than it is. My tiny brain cant handle the madness. 

0,2264384155,Sun Jun 21 03:42:01 PDT 2009,NO_QUERY,SallytheShizzle,@OfficialAS http://twitpic.com/7yod7 - omg...WHERE IS THIS FROM?! gaah. Arses! :'( and that's not true. 2 1/2 stars? That's tight! 

0,2264384215,Sun Jun 21 03:42:02 PDT 2009,NO_QUERY,deathangel3030,"Waaa, i had a haircut yesterday and my hair is waist long  i wanted it longeerr!!!"

0,2264384255,Sun Jun 21 03:42:02 PDT 2009,NO_QUERY,aichaku,"http://twitpic.com/7zvv9 - this is why i wanna give up crafting. super fail, incomplete stuff, aft hrs &amp; hrs of work. "

0,2264384490,Sun Jun 21 03:42:05 PDT 2009,NO_QUERY,gurlypinkbea,Hmm. Now I'm suffering. 

0,2264385062,Sun Jun 21 03:42:11 PDT 2009,NO_QUERY,debbiebigbee,LUCAS!!!! you're super sweet! 

0,2264385325,Sun Jun 21 03:42:14 PDT 2009,NO_QUERY,lena_hh,kind of bored today &gt; the bad weather fits to my mood 

0,2264385635,Sun Jun 21 03:42:17 PDT 2009,NO_QUERY,MissHKS,@SharonHayes You're gonna get me crying of love lost 

0,2264385694,Sun Jun 21 03:42:18 PDT 2009,NO_QUERY,LinaAmalina,"@serinurshira i dont know, its written as gia, so i think its Gia. hahaha. i hate her, she's soooooo ugly. i think, she's ugly! not cute. "

0,2264385852,Sun Jun 21 03:42:19 PDT 2009,NO_QUERY,Iddara,"would lllllluv to let the sunshine in, but it's raining cats and dogs.... "

0,2264386096,Sun Jun 21 03:42:22 PDT 2009,NO_QUERY,pilky,"Bah, went to both Game and GameStation for Ghostbusters. Both seem to have pleanty of PS3 versions but the PS2 ones have sold out "

0,2264386284,Sun Jun 21 03:42:25 PDT 2009,NO_QUERY,ateen83,"cloudy on the longest day of the year.....grrr, that sucks!!  ....atleast there's a better week to look forward to!"

0,2264386591,Sun Jun 21 03:42:29 PDT 2009,NO_QUERY,rampantheart,@thenalirama i have not been prolific but i tweet nw and then 

0,2264387271,Sun Jun 21 03:42:36 PDT 2009,NO_QUERY,kateblogs,"@SpikeTheLobster I'm sorry to hear that  Hope you're both having a better day today! You must be a nice man, my dh wouldn't do that."

0,2264387342,Sun Jun 21 03:42:37 PDT 2009,NO_QUERY,julia_95,learning for the history test...i hate it... 

0,2264387402,Sun Jun 21 03:42:38 PDT 2009,NO_QUERY,goddessella,"i hate the falsies i bought.. they look, well, false. :C  loving the new bag i bought tho cuz im depressed. "

0,2264387483,Sun Jun 21 03:42:39 PDT 2009,NO_QUERY,funkymrmagic,@carole29 I'm on my way... 

0,2264387854,Sun Jun 21 03:42:45 PDT 2009,NO_QUERY,MI_VA,Just found out it might be released on August 6th instead 

0,2264388337,Sun Jun 21 03:42:50 PDT 2009,NO_QUERY,mynameisnotkid,It's so dark already! 

0,2264388454,Sun Jun 21 03:42:51 PDT 2009,NO_QUERY,CosmicJase,DARKNESS is all i see. Imprisoning me. Absolute horror. I cannot live I cannot die. Trapped in my myself. Body my holding cell. Work time 

0,2264388466,Sun Jun 21 03:42:51 PDT 2009,NO_QUERY,colbsi,"@vickyhanlon Haven't found it, it didn't come inside following Persia. :/ So I think it's scaredy again "

0,2264388605,Sun Jun 21 03:42:53 PDT 2009,NO_QUERY,thomascrescenzi,burned the bacon 

0,2264388751,Sun Jun 21 03:42:55 PDT 2009,NO_QUERY,inetpics,Leanne is just too efficient so all the work's done and we sitting down outside for a nice dinner before flying home (on Jetstar 

0,2264389433,Sun Jun 21 03:43:03 PDT 2009,NO_QUERY,mnehughes,"@Rony_Wan Is it just me or is that Sonic's song being used in the LV car insurance ads? If it is, then it's a dreadful cover of it "

0,2264389555,Sun Jun 21 03:43:05 PDT 2009,NO_QUERY,Estherlala,@MariahCarey  it didn't work. Now we didn't have a NTT  Can you tweet one more ?  I love those ntt 

0,2264389572,Sun Jun 21 03:43:05 PDT 2009,NO_QUERY,beckyboo_x,Is Quite Sad That She Cant Be With Her Daddy On Fathers Day 

0,2264389648,Sun Jun 21 03:43:06 PDT 2009,NO_QUERY,corien,my hair is back to normal again... 

0,2264389698,Sun Jun 21 03:43:06 PDT 2009,NO_QUERY,Rich352,cant come in  Does anyone now how cams4cams.com works?

0,2264389914,Sun Jun 21 03:43:09 PDT 2009,NO_QUERY,Bridejed,@markh110 I'm sorry i disappointed you Mark Harris 

0,2264390017,Sun Jun 21 03:43:10 PDT 2009,NO_QUERY,EddieGord0,@AnMiTh I only see a blank page.  I think something may have gone wrong 

0,2264390215,Sun Jun 21 03:43:13 PDT 2009,NO_QUERY,daddyscunt,Rise and shine.. Didn't even shave my legs today.. Going to go see dad at the grave yard 

0,2264390863,Sun Jun 21 03:43:20 PDT 2009,NO_QUERY,lisamwill,Bloody stupid British weather 

0,2264391185,Sun Jun 21 03:43:25 PDT 2009,NO_QUERY,pinkbarbieee,sometimes piano teachers really.really.really suck  put me in bad mood only wah lau

0,2264391969,Sun Jun 21 03:43:34 PDT 2009,NO_QUERY,Nik_263_x,Really hoping it doesnt rain 2moz... cause then they won't film the ad and i will have to go to school 

0,2264392047,Sun Jun 21 03:43:35 PDT 2009,NO_QUERY,blogofmarek,"Consider it a test of sending updates to Twitter from my mobile. BTW, they're quite pricey "

0,2264392586,Sun Jun 21 03:43:42 PDT 2009,NO_QUERY,samieexxx,my knee is sore  there is a loose bone in it :O

0,2264392634,Sun Jun 21 03:43:43 PDT 2009,NO_QUERY,jupiterheels,@ahideousfacade yeaaa! u still owe me a shoot though 

0,2264392637,Sun Jun 21 03:43:43 PDT 2009,NO_QUERY,Michellepwnsyou,"You don't understand me at all, I really don't like you. "

0,2264392718,Sun Jun 21 03:43:44 PDT 2009,NO_QUERY,jackiesworld,oh my God!! may Neda and all other victims RIP 

0,2264392833,Sun Jun 21 03:43:45 PDT 2009,NO_QUERY,littlemissmessy,"@butadream *YAY* about what!? In fact, Min ... this track would fit for you I reckon, with all the shit going on in the past ... "

0,2264392966,Sun Jun 21 03:43:47 PDT 2009,NO_QUERY,X_BleedXLove_X,can't wait til tmr Monday night raw ! F***ing right ! ha ha ! also bored  not usually up this early !

0,2264393205,Sun Jun 21 03:43:50 PDT 2009,NO_QUERY,drfunkenstein2k,"@ddlovato not me  but ill be at the Greenville,SC show. to help your voice out, a gift from me http://bit.ly/13AOrE"

0,2264393740,Sun Jun 21 03:43:56 PDT 2009,NO_QUERY,VikingWoman72,Nobody's here 

0,2264394039,Sun Jun 21 03:44:00 PDT 2009,NO_QUERY,karina_chris,Pengen pancious... 

0,2264394205,Sun Jun 21 03:44:02 PDT 2009,NO_QUERY,Unjehrwear,WE LOVE YOU Bro. Ceci! We will surely miss you!  please take a picture for me of GOD with you 

0,2264394611,Sun Jun 21 03:44:06 PDT 2009,NO_QUERY,Phil_Esq,Oh noes! I've run out of Stargate Atlantis 

0,2264394626,Sun Jun 21 03:44:07 PDT 2009,NO_QUERY,naomi_taylor,"@DavidArchie hey, i just wanted to wish you good luck with your tour..im sulking becuase i cant come  take care of yourself and good luck!"

0,2264394635,Sun Jun 21 03:44:07 PDT 2009,NO_QUERY,areasontofight,@downrighteerie Are we going totry and get #happybdaykrisallen trending again later? I missed it. 

0,2264394808,Sun Jun 21 03:44:09 PDT 2009,NO_QUERY,snobb,"@Cre8tiveSin nothin, just a bad dream  http://myloc.me/4PaS"

0,2264395127,Sun Jun 21 03:44:13 PDT 2009,NO_QUERY,Stubidu,nr of followers decreases again 

0,2264395184,Sun Jun 21 03:44:13 PDT 2009,NO_QUERY,antonioval,@misspid I envy you - been raining non stop wherever I've been so far boooo 

0,2264395270,Sun Jun 21 03:44:15 PDT 2009,NO_QUERY,MicheleMarut,@neecouk thanks - he tried that - no luck 

0,2264395338,Sun Jun 21 03:44:15 PDT 2009,NO_QUERY,Maiseyjon,@howlieT too much..i just want time to myself but never seem to get any 

0,2264395440,Sun Jun 21 03:44:16 PDT 2009,NO_QUERY,LittleFuryBug,... I just wished I could've said goodbye to some of the channels...  lmao

0,2264395831,Sun Jun 21 03:44:21 PDT 2009,NO_QUERY,kknipp,@dkraciun  In the hospital?? What's going on? 

0,2264395953,Sun Jun 21 03:44:22 PDT 2009,NO_QUERY,feelfreetobeme,has so much to do...  http://plurk.com/p/12nns1

0,2264396231,Sun Jun 21 03:44:26 PDT 2009,NO_QUERY,KellyBobbins,Feeling rough... Hate that its the last day of my holiday 

0,2264396335,Sun Jun 21 03:44:27 PDT 2009,NO_QUERY,brooska,The journey continues - now in Aberdeen. Downside is 560 miles home later today...  AND missing the F1!

0,2264396929,Sun Jun 21 03:44:34 PDT 2009,NO_QUERY,lubritpetition,Watching flashdance 

0,2264397099,Sun Jun 21 03:44:36 PDT 2009,NO_QUERY,rubikah,Good morning tweetland i have yo say that before the storm in live is horrible NILEY NEVERR 

0,2264398323,Sun Jun 21 03:44:51 PDT 2009,NO_QUERY,FrontDeskLady,ewww its raining 

0,2264398455,Sun Jun 21 03:44:53 PDT 2009,NO_QUERY,Shinybiscuit,@WWDWD Oh no  I fainted in a clothes shop once when my mum jumped out of a rail of coats. I didn't know she was in town. The shame 

0,2264398538,Sun Jun 21 03:44:54 PDT 2009,NO_QUERY,sarebearxx8,@emmaroo i know 

0,2264398861,Sun Jun 21 03:44:58 PDT 2009,NO_QUERY,gppetro,"I'm so dead for QCS, seriously I'm in holiday mode why do you insist on us doing boring exams "

0,2264398996,Sun Jun 21 03:45:00 PDT 2009,NO_QUERY,MagicTina,Today is editing day. If I ever get to go on the PC that is  .

0,2264399198,Sun Jun 21 03:45:01 PDT 2009,NO_QUERY,Meggerina,still hasn't taken off. Apparently there's something wrong with the starter valve. Engine won't start 

0,2264399498,Sun Jun 21 03:45:04 PDT 2009,NO_QUERY,lala_Leesa,I don't wanna go back home  someone please send me my stuffd

0,2264399750,Sun Jun 21 03:45:06 PDT 2009,NO_QUERY,jayjohnsonaus,@copticsoldier I'd rather not know as I paid a ridiculus amount for my 16gb 

0,2264400264,Sun Jun 21 03:45:11 PDT 2009,NO_QUERY,shondaDee,"home at 3:45 am, had a good nite tonite. headache tho mixin henne and patron is not a good look! at all. "

0,2264401222,Sun Jun 21 03:45:21 PDT 2009,NO_QUERY,iand,didn't sleep as well as i'd hoped on flight. Tried watching films i thought would put me to sleep but they turned out to be too good 

0,2264401523,Sun Jun 21 03:45:24 PDT 2009,NO_QUERY,whereislena,@miss_melbourne Same!!! Especially this time of the year when there's sooooo much fruit. I could live on fruit in Thailand. I miss it 

0,2264401777,Sun Jun 21 03:45:27 PDT 2009,NO_QUERY,jetterz,"@the_lost_man we used Acaricide flea powder, still there though. it's really bad, our dog leaves trails of fleas everywhere he stays "

0,2264401796,Sun Jun 21 03:45:27 PDT 2009,NO_QUERY,Leximoran,there is a massive fly in the hallway! Its going to eat me! ahhh! 

0,2264402011,Sun Jun 21 03:45:30 PDT 2009,NO_QUERY,zydrate_anatomy,"currently stuck in my dead end piece of shit job workin 9-8 ,wat a way to make a livin  .   need excitement,need neeeeed excitement"

0,2264402306,Sun Jun 21 03:45:33 PDT 2009,NO_QUERY,DocIsInDaHouse,crying for #neda and all the iranian death 

0,2264402466,Sun Jun 21 03:45:35 PDT 2009,NO_QUERY,marizzleria,crazy fires that ruined my movie on the river! poor tomi was scared  happy fathers day dad!!! i love u

0,2264402743,Sun Jun 21 03:45:38 PDT 2009,NO_QUERY,elanawu,had a long day 

0,2264402771,Sun Jun 21 03:45:39 PDT 2009,NO_QUERY,Viennah,Off to Dinner in Vic Park with Georgie before he leave for Egypt. Not feeling the best though 

0,2264403198,Sun Jun 21 03:45:44 PDT 2009,NO_QUERY,xcrackwhore,@tinycastles bkk has the pink ones apparently!! haha it was too squeezy so wasn't that great 

0,2264403208,Sun Jun 21 03:45:44 PDT 2009,NO_QUERY,ashleigh_hawkes,bye bye liverpool  i'll miss here so much...

0,2264403711,Sun Jun 21 03:45:50 PDT 2009,NO_QUERY,MyImaginationxx,@DanaXDanger HEY!  I'm sad now. you seen Niley BTS live? Awhhhh. &lt;3

0,2264403849,Sun Jun 21 03:45:51 PDT 2009,NO_QUERY,snpower,"@lyda oh dear, that doesn't sound good "

0,2264404177,Sun Jun 21 03:45:56 PDT 2009,NO_QUERY,sportstraveller,"another huge weekend in sport. Sydney Origin is this week and our guys get back from the Darwin V8 Supercars, I didnt get to go "

0,2264404185,Sun Jun 21 03:45:56 PDT 2009,NO_QUERY,rodrickmartinez,Lit homework. 

