0,2006870993,Tue Jun 02 11:48:27 PDT 2009,NO_QUERY,ucf0503,@RyanSeacrest why did i not know about this? serves me right for not listening to ur show on the way to work today 

0,2006871686,Tue Jun 02 11:48:30 PDT 2009,NO_QUERY,omgfloofy,@kyle1point0 It does but I'm not much for download only content. 

0,2006872228,Tue Jun 02 11:48:34 PDT 2009,NO_QUERY,lilpaowow,"My grandpa is in ICU!  He have holes in his lungs, his bladder removed, &amp; his heart is in bad condition. Help me pray he be okay. &lt;3"

0,2006872389,Tue Jun 02 11:48:34 PDT 2009,NO_QUERY,tharealjaked,Ashley hugged me again. Forgot 2 ask her until now. She liked my &quot;Little Red Dress&quot; song lyrics. It's gonna hurt so bad 2 see her leave. 

0,2006872527,Tue Jun 02 11:48:35 PDT 2009,NO_QUERY,PoppyWay,i finnished my ice cream  tiss all gone  ahh wellll theres more in my frezzer hmmmm

0,2006872687,Tue Jun 02 11:48:36 PDT 2009,NO_QUERY,pippip1,@conkinho yeah it was old skl! it was like the first gameboy colour version  its gonne.. do u think it was worth more? :S

0,2006872770,Tue Jun 02 11:48:37 PDT 2009,NO_QUERY,chocokate,And now my happy mood is gone because Tony has to stay in California for an extra day. He won't be back until late Thursday! Boo 

0,2006873330,Tue Jun 02 11:48:39 PDT 2009,NO_QUERY,Just_Play_Love,"I have to leave for school in like 10 minutes.......I hate school, like all HS are done yet I still have to go, not fair "

0,2006873369,Tue Jun 02 11:48:40 PDT 2009,NO_QUERY,Jody_Lynne,No one's texting me today.... This makes me sad. 

0,2006873635,Tue Jun 02 11:48:41 PDT 2009,NO_QUERY,TIFFANYTRUONG,No fair! Why is everyone wearing a panda shirt today?! I want one 

0,2006874100,Tue Jun 02 11:48:44 PDT 2009,NO_QUERY,timberdog526,"my hair looks pretty bad. the dye didn't hold as well as it normally does, so now I've got patches of blonde. "

0,2006874672,Tue Jun 02 11:48:47 PDT 2009,NO_QUERY,the_ryanator,@KimKardashian so was drag me to hell really so bad that u walked out? i was gonna take my girl 

0,2006875292,Tue Jun 02 11:48:50 PDT 2009,NO_QUERY,Donnette,@verwon Comments closed 

0,2006875322,Tue Jun 02 11:48:50 PDT 2009,NO_QUERY,jesusismyoxygen,I hate getting bloodwork done.  but i'm off to ihop to nurse my wounds.

0,2006875514,Tue Jun 02 11:48:51 PDT 2009,NO_QUERY,lushcious,@LuvinMeSomeD i couldn't get whole vid to play.it kept stopping 

0,2006875854,Tue Jun 02 11:48:53 PDT 2009,NO_QUERY,livewgratitude,@ondemandgroup - isn't office space higher $$ closer to downtown Mpls as well?  Adding to a commute and higher $ space =  for small biz

0,2006875896,Tue Jun 02 11:48:54 PDT 2009,NO_QUERY,Kendallope,At the library on yet another gloomy day.  Maybe get out for a bike ride between spurts of rain 

0,2006876474,Tue Jun 02 11:48:57 PDT 2009,NO_QUERY,MandyPandy32,@CocaBeenSlinky Very true! Shame it's not staying much longer! 

0,2006876594,Tue Jun 02 11:48:58 PDT 2009,NO_QUERY,aramisette,"@MsJBell Hmm, don't think I know those peeps. Will imagine a silly voice instead. :o) I so Sad/Scared for him! "

0,2006877284,Tue Jun 02 11:49:02 PDT 2009,NO_QUERY,MuRd3RsauR,"Watch!ng a v!deo w!t the class and bummed about ton!te, guess a reschedule w!ll have to do "

0,2006877542,Tue Jun 02 11:49:03 PDT 2009,NO_QUERY,StacyMariee,Why aren't ludens cherry cough drops anywhere? I neeeeeed them 

0,2006877922,Tue Jun 02 11:49:05 PDT 2009,NO_QUERY,dannytatom,"I've been without internet for only a couple days, but I'm starting to get upset.  I got shit to do, son. "

0,2006877979,Tue Jun 02 11:49:05 PDT 2009,NO_QUERY,PeacemakerLetti,"After a though sandwiches and Chinese fast food, I'm still soooo hungry   It's unbelievable!"

0,2006886576,Tue Jun 02 11:49:52 PDT 2009,NO_QUERY,PoppyWay,@hatticusrex i do that 

0,2006886874,Tue Jun 02 11:49:54 PDT 2009,NO_QUERY,snobETTE,It should be illegal to miss someone this much 

0,2006887090,Tue Jun 02 11:49:55 PDT 2009,NO_QUERY,leciaphinney,@whimsyandspice yikes!   what new camera did you get?

0,2006887219,Tue Jun 02 11:49:55 PDT 2009,NO_QUERY,rebeccalovve,my birdie is so shy! i want buddy to sing! but all he does is eat and hide 

0,2006887791,Tue Jun 02 11:49:58 PDT 2009,NO_QUERY,Roku6wiz,"still away, i'm working on a big project so im a little occupied all the time "

0,2006887895,Tue Jun 02 11:49:59 PDT 2009,NO_QUERY,TheTentoSaga,I've come to the conclusion that the vast majority of the academically-trained HATE my writing style. Wooden prose! Crap! Un-publishable! 

0,2006888261,Tue Jun 02 11:50:01 PDT 2009,NO_QUERY,deeeelasoul,@nunnie20  don't rub it in (pause) how was last night?

0,2006888976,Tue Jun 02 11:50:05 PDT 2009,NO_QUERY,BeantownCutie,@LuvinMeSomeD I missed the chat 

0,2006889389,Tue Jun 02 11:50:07 PDT 2009,NO_QUERY,WormsAreFunny,@MYIDOLTOWN Me too...  I just gave another round of votes to GG gals on page 2 and no change.    

0,2006889499,Tue Jun 02 11:50:07 PDT 2009,NO_QUERY,nwoidaho,@NellaGrl I did see that in the forums. Sorry to hear about your discharge.  Made me sad...

0,2006889875,Tue Jun 02 11:50:09 PDT 2009,NO_QUERY,caseylk,"in a lot of pain and can barely move my legs  Thank you to all my friends helping out today, I appreciate it more than you know"

0,2006889917,Tue Jun 02 11:50:10 PDT 2009,NO_QUERY,AngieMac84,Kaka to Real Madrid? Gutted if it's true 

0,2006890046,Tue Jun 02 11:50:10 PDT 2009,NO_QUERY,KlubKelli,@xxxSupermodel Came out today.  I've spent the last 5 hours trying to download it.  Still trying   I suggest buying the DVD.

0,2006890277,Tue Jun 02 11:50:11 PDT 2009,NO_QUERY,lost_dog,@kruble88 I am lost. Please help me find a good home. 

0,2006890279,Tue Jun 02 11:50:11 PDT 2009,NO_QUERY,Ronnie_Rockwell,Damn i got ice water in my grrinder. And there was still herb and keif in the catcher 

0,2006890467,Tue Jun 02 11:50:12 PDT 2009,NO_QUERY,binch,"@Fannypak09 haha, my bitchassness has mutated into binchassness. deadlier form of the disease that makes me procrastinate hard "

0,2006890578,Tue Jun 02 11:50:13 PDT 2009,NO_QUERY,ragui5,Thirsty...but left my monies at home 

0,2006890600,Tue Jun 02 11:50:13 PDT 2009,NO_QUERY,apieceofheaven7,Talking to someone very special to me... don't want to leave but I have too!  Maybe I will stay for 10 more mins lol

0,2006890606,Tue Jun 02 11:50:13 PDT 2009,NO_QUERY,MARCisaballa,Headache is still here 

0,2006890763,Tue Jun 02 11:50:14 PDT 2009,NO_QUERY,JazziCouture,Im sooo hungry... i want burger king... ugh... gotta wait til the other receptionist comes back... 

0,2006891002,Tue Jun 02 11:50:15 PDT 2009,NO_QUERY,MyTrophySpace,@buckhollywood OH NO! What colour was it  xxxxxxxxxxx

0,2006891033,Tue Jun 02 11:50:15 PDT 2009,NO_QUERY,tanyvenuti,@demilovat0 i want so much u take one photo with a sign says &quot;Happy B-Day Tany!&quot;... just that  will be the best gift! 4real!!!

0,2006891168,Tue Jun 02 11:50:16 PDT 2009,NO_QUERY,brightondoll,@aaronob *hugs* I'm feeling your pain!! I have to work overtime all this week 

0,2006891266,Tue Jun 02 11:50:16 PDT 2009,NO_QUERY,kayla_anne,my car diedd  idk howw. poor little santa fe

0,2006891512,Tue Jun 02 11:50:17 PDT 2009,NO_QUERY,CannonGod,I think I know what happened to all those unsold Sony Mylo's - they got turned into PSP GO!'s  #e3

0,2006891750,Tue Jun 02 11:50:19 PDT 2009,NO_QUERY,lorenanator,Feels so bad hope my cracker is okayy 

0,2006892075,Tue Jun 02 11:50:20 PDT 2009,NO_QUERY,KellyLouisetm,"clouds have arrived  and my day was poo, im burnt and my boobies are sore. HOWEVER my mummy did buy me a cut top and i have a rolo yoghurt"

0,2006892210,Tue Jun 02 11:50:21 PDT 2009,NO_QUERY,Coops1989,i am soooooooo sad after watching the hills finale 

0,2006892217,Tue Jun 02 11:50:21 PDT 2009,NO_QUERY,SlimGoddess,ugh! i start work tomorrow! 

0,2006892317,Tue Jun 02 11:50:21 PDT 2009,NO_QUERY,andy065,@gpgirl i think that thanks to the sony press conference im gonna buy a psp  assassins creed and gran tourismo come out this year

0,2006892379,Tue Jun 02 11:50:22 PDT 2009,NO_QUERY,SandyCamelMedia,@sgriggs24 Yes - it just seems a long way off at the moment  

0,2006892419,Tue Jun 02 11:50:22 PDT 2009,NO_QUERY,karar,will sony stop suckign their brand name and show some real games 

0,2006892790,Tue Jun 02 11:50:24 PDT 2009,NO_QUERY,kateeess,"Uploading pictuurs...It's working   Msn per usual, nothing to do; anya's too busy curling her hair. Why not tomoro mornin  ? Laawl x"

0,2006892828,Tue Jun 02 11:50:24 PDT 2009,NO_QUERY,TIPfromtheVIP,I picked the wrong damn day to throw my contacts out. Now I have to distribute literature 2 the house and senate and u can't c shit 

0,2006892974,Tue Jun 02 11:50:25 PDT 2009,NO_QUERY,ElianFlenchFly,ugh i wanna go home 

0,2006893042,Tue Jun 02 11:50:25 PDT 2009,NO_QUERY,tranini,@tini21 work work work  but it pays for my shopping and chocolate addiction

0,2006893470,Tue Jun 02 11:50:28 PDT 2009,NO_QUERY,RosalieWilliams,@jadecrimes ME TOO!!! btw: I dont think I'm getting this apartment.. this lady is way shady 

0,2006893899,Tue Jun 02 11:50:30 PDT 2009,NO_QUERY,FrankieShotMe,@hothotwasabi  I am driving cross country! And currently in Oklahoma! 

0,2006894209,Tue Jun 02 11:50:32 PDT 2009,NO_QUERY,tonypeters,"@vicious696 nope, doesn't look like it will work with GT5 "

0,2006894273,Tue Jun 02 11:50:32 PDT 2009,NO_QUERY,jordanhowell,@robertsammons  looks well good

0,2006894530,Tue Jun 02 11:50:33 PDT 2009,NO_QUERY,Bambi429,@discosleeze Oh no!! That's awful 

0,2006894735,Tue Jun 02 11:50:34 PDT 2009,NO_QUERY,alexpham4,Wow downloading the Pitt and the other add on in fallout 3 sweet but slow 

0,2006895039,Tue Jun 02 11:50:36 PDT 2009,NO_QUERY,420thoughts,@ImTribute me too. I'm worried now. some douchebag has reuploaded 2 of his videos. he calls him mean names tho. 

0,2006895076,Tue Jun 02 11:50:36 PDT 2009,NO_QUERY,lovesickass,"@hmgarrison Right? Boring picture &amp; art and the face should have been red, idk "

0,2006895323,Tue Jun 02 11:50:38 PDT 2009,NO_QUERY,Bre1331,I broke my sunglasses!! 

0,2006895357,Tue Jun 02 11:50:38 PDT 2009,NO_QUERY,SignsNow,@signsnownw we've been missing you during the webinars 

0,2006895597,Tue Jun 02 11:50:39 PDT 2009,NO_QUERY,amitgupta,@rajeshlalwani: Yeah would be better for you. I did it in Yahoo! as well because all of a sudden I got added to lot of spam/porn groups! 

0,2006895775,Tue Jun 02 11:50:40 PDT 2009,NO_QUERY,RottenPrince,i need vacations right now 

0,2006895788,Tue Jun 02 11:50:40 PDT 2009,NO_QUERY,allisonwilton,ugh i better get that job. this retail jig is really really getting old 

0,2006895810,Tue Jun 02 11:50:40 PDT 2009,NO_QUERY,Naaanny,work went okay. just dreading thursday 

0,2006895914,Tue Jun 02 11:50:41 PDT 2009,NO_QUERY,MishGoddess,@topchef58 why 

0,2006895979,Tue Jun 02 11:50:41 PDT 2009,NO_QUERY,mac3388,doesn't wanna go to Anatomy 2 for 5hrs 

0,2006896122,Tue Jun 02 11:50:42 PDT 2009,NO_QUERY,JenWojcik,"@playspymaster No...I can log in, but all my stuff is gone "

0,2006896134,Tue Jun 02 11:50:42 PDT 2009,NO_QUERY,misfitina,@dhmorton ugh 

0,2006896590,Tue Jun 02 11:50:44 PDT 2009,NO_QUERY,SpaghettiCat,damien rice and arcade fire at the same time... idk what to pick 

0,2006896597,Tue Jun 02 11:50:44 PDT 2009,NO_QUERY,BrookeReviews,Doing laundry  Bjork makes me smile though. â « http://blip.fm/~7i7y8

0,2006896699,Tue Jun 02 11:50:45 PDT 2009,NO_QUERY,ismith5,hates packing!! 

0,2006896798,Tue Jun 02 11:50:45 PDT 2009,NO_QUERY,cathynose,Tony needs to get his own twitter 

0,2006897343,Tue Jun 02 11:50:48 PDT 2009,NO_QUERY,newchaosgirl,@Jana_sk8 ohh...from planet-sports a black top...they only have two tops 

0,2006897358,Tue Jun 02 11:50:48 PDT 2009,NO_QUERY,LadyESH,@BobbyBlackwolf we are on the balcony. 

0,2006897681,Tue Jun 02 11:50:50 PDT 2009,NO_QUERY,rose_engine,"@rhitgirl I bet you are! And I am below 2.0 as well  No, property files are not exciting at all. But me almost being done unpacking is!"

0,2006897835,Tue Jun 02 11:50:51 PDT 2009,NO_QUERY,Obie115,@JDiz sometimes we got to pay the price... at the end is all worth it. But I know the feeling. 

0,2006897863,Tue Jun 02 11:50:51 PDT 2009,NO_QUERY,Testament,"Am ajuns in camera mea, obositsi stresat.  Maine sper sa terminam treaba"

0,2006897954,Tue Jun 02 11:50:51 PDT 2009,NO_QUERY,grumpygrandma,laptop has just died 

0,2006898056,Tue Jun 02 11:50:52 PDT 2009,NO_QUERY,chairmanmhow,"Poor baby car is losing its 2nd gear  Buck up, Ty! We still need to make it through the next 25,000 miles together!"

0,2006898081,Tue Jun 02 11:50:52 PDT 2009,NO_QUERY,Kekeluvsday26,@uniqueluvsday26 thanx but im not near a computer right now. damnit! 

0,2006898115,Tue Jun 02 11:50:52 PDT 2009,NO_QUERY,violahou,working on history 

0,2006898954,Tue Jun 02 11:50:57 PDT 2009,NO_QUERY,arron_shutt,Writing a 20 page proposal document for another scary meeting. Too many variables to consider to get it into a final version for now. 

0,2006899213,Tue Jun 02 11:50:58 PDT 2009,NO_QUERY,titi_215,"@Poekasso damn, i didnt make the cut "

0,2006899429,Tue Jun 02 11:50:59 PDT 2009,NO_QUERY,lady09,@DwightHoward are you serious?  That sounds awful 

0,2006899523,Tue Jun 02 11:50:59 PDT 2009,NO_QUERY,shaeshae20,R.I.P Spencer... I really loved you puppy.... 

0,2006899753,Tue Jun 02 11:51:00 PDT 2009,NO_QUERY,risetto01,1 more day of school  i wish it wouldnt end! im gunna miss everyone way too much

0,2006899988,Tue Jun 02 11:51:02 PDT 2009,NO_QUERY,itscoreyholmes,if anyone one wants to donate a dvd player to me i won't mind.  i think mine is broke 

0,2006900117,Tue Jun 02 11:51:02 PDT 2009,NO_QUERY,JasonTankerley,I know I've said this a million times before but...I really wish I wasn't allergic to hair dye 

0,2006900265,Tue Jun 02 11:51:03 PDT 2009,NO_QUERY,manostorgo,x @rondean sorry but its letter size  I hope this hasnt ruined your day lol. They had a good deal on a pc so Mom gets a late b-day present

0,2006900524,Tue Jun 02 11:51:04 PDT 2009,NO_QUERY,PHiLOLS,"I predict it now, a MGS PSP  #E3"

0,2006952657,Tue Jun 02 11:55:43 PDT 2009,NO_QUERY,brunolovesbrit,wasn't able to tweet all day long!twitter was so slow! did it happed to u too??? PS:i'm not from China! (sorry 4 chinese ppl 

0,2006952978,Tue Jun 02 11:55:45 PDT 2009,NO_QUERY,jjohnstone5,Nikki goes back to London tomorrow. We're losing a part of our little Austin family. 

0,2006953008,Tue Jun 02 11:55:45 PDT 2009,NO_QUERY,TheSweetBitch,Boredddddddddddddddddddddddddddddddddddddddddddddd out me mind! And still have sunburnt ass 

0,2006953240,Tue Jun 02 11:55:46 PDT 2009,NO_QUERY,OliverSzondi,@danielvoyager im annoyed as well dan  seems like a captain is going down with there ship 

0,2006953289,Tue Jun 02 11:55:47 PDT 2009,NO_QUERY,xkacieee,c- in math right now. i'm sooo stressed. i need an a+ on this project and do realy well on every quiz to bring it up to a b 

0,2006953310,Tue Jun 02 11:55:47 PDT 2009,NO_QUERY,Killa4,@Chelly527 oh no!!!  hugs...

0,2006953312,Tue Jun 02 11:55:47 PDT 2009,NO_QUERY,FaithSherwood,waiting to get into see dr. so many conversations going on interesting to eavedrop blah i feel like shit 

0,2006953346,Tue Jun 02 11:55:47 PDT 2009,NO_QUERY,SlappnFaceHoles,@Jennsac: yeah .. This super sucks!! I is sad! 

0,2006953847,Tue Jun 02 11:55:50 PDT 2009,NO_QUERY,kate_klutz,exams starting tomorrow... 

0,2006953989,Tue Jun 02 11:55:51 PDT 2009,NO_QUERY,MsJuicy313,Well...guess it was meant for me to be single at this moment...guess u'll never understabd how I truly feel about u 

0,2006954052,Tue Jun 02 11:55:51 PDT 2009,NO_QUERY,itsnanda,"@demilovat0 im from south america, but my spanish is lame! i can sing in spanish 2, and even read some texts, but i cant speak it right! "

0,2006954432,Tue Jun 02 11:55:53 PDT 2009,NO_QUERY,Megs311,Life can change in the blink of an eye... I've always know that but was never prepared for it to actually happen 

0,2006954605,Tue Jun 02 11:55:54 PDT 2009,NO_QUERY,aalysonn,this tea tastes like my grandma's house 

0,2006954611,Tue Jun 02 11:55:54 PDT 2009,NO_QUERY,TeeDoll,@itscasibaby ...........you're not coming are you 

0,2006954624,Tue Jun 02 11:55:54 PDT 2009,NO_QUERY,FRANKIalexa,why do i keep losing followers? 

0,2006954784,Tue Jun 02 11:55:55 PDT 2009,NO_QUERY,gcampanelli,nothing interesting to say..im losing my cool 

0,2006955013,Tue Jun 02 11:55:56 PDT 2009,NO_QUERY,travelchic87,@SherriBabi I'm on my 5th week doing that! 

0,2006955135,Tue Jun 02 11:55:57 PDT 2009,NO_QUERY,Smokerette,"Why are bras, particularly nursing bras, so effing expensive?  Oh well... needs must"

0,2006955430,Tue Jun 02 11:55:59 PDT 2009,NO_QUERY,RaquelDenise31,My mom won't let me 

0,2006955597,Tue Jun 02 11:55:59 PDT 2009,NO_QUERY,Moongemini,I dont want to work two jobs anymore... 

0,2006956048,Tue Jun 02 11:56:02 PDT 2009,NO_QUERY,JNez,Omg that was exhausting. I need a nap &amp; silence. But i'll get neither: it's dismissal time. Gonna be a cranky afternoon 

0,2006956052,Tue Jun 02 11:56:02 PDT 2009,NO_QUERY,fddlgrl,@jennyonthespot What did you do to your teeth? They're beautiful! I need to go to a dentist.. 

0,2006956533,Tue Jun 02 11:56:05 PDT 2009,NO_QUERY,ButterflyNova,Morning.......just got home from the doctor and feeling very violated 

0,2006956569,Tue Jun 02 11:56:05 PDT 2009,NO_QUERY,britttnicole,getting ready to head to the hospital...PLEASE pray I don't have something serious! i'm freaking outttttt 

0,2006956663,Tue Jun 02 11:56:05 PDT 2009,NO_QUERY,heyitsanabelle,i love my family.  i love my friends.  it's going to be SO hard to move away by myself this summer.  idk what im going to do w/out them 

0,2006956764,Tue Jun 02 11:56:06 PDT 2009,NO_QUERY,luckystar37,"@Clare_B oops, did I get your fave wrong? I'm sorry  who's your boy?"

0,2006956829,Tue Jun 02 11:56:06 PDT 2009,NO_QUERY,TXFlutterGirl,Ignored again today.  It's ended.

0,2006956998,Tue Jun 02 11:56:07 PDT 2009,NO_QUERY,wood83,Ugh...today is one of those days when I wanted to initiate a few new positions and they are all up too damn much 

0,2006957121,Tue Jun 02 11:56:07 PDT 2009,NO_QUERY,Miss_NINJA,My eyes need a vacay away from computer screens 

0,2006957320,Tue Jun 02 11:56:09 PDT 2009,NO_QUERY,yassermahfooz,still not able to n'joi vacations as tabulation work is on... 

0,2006957484,Tue Jun 02 11:56:09 PDT 2009,NO_QUERY,joe_dolls_Doll,"HI @DonniedollsDoll ! My profile pic STILL doesn't work? Watsupwidat?!   PS: be a lady, dang it! (your strap's falling down!) shhhh...!"

0,2006957651,Tue Jun 02 11:56:10 PDT 2009,NO_QUERY,ErinO1539,Missing a very special friend right now!!!  

0,2006957669,Tue Jun 02 11:56:10 PDT 2009,NO_QUERY,Addicted2DEW,@youngq omg don't let me miss this...got get son from school n will be back @ 3:45...I missed Donnie talkin bout his sweaty balls 

0,2006957771,Tue Jun 02 11:56:11 PDT 2009,NO_QUERY,CynicalCeci,Stuck at work until 830 

0,2006957940,Tue Jun 02 11:56:12 PDT 2009,NO_QUERY,tanvirhaider,china blocks Twitter   http://bit.ly/ZN7Pp

0,2006958517,Tue Jun 02 11:56:15 PDT 2009,NO_QUERY,MOTUG7,I burnt my tongue 

0,2006958861,Tue Jun 02 11:56:17 PDT 2009,NO_QUERY,intr0vert,Does anyone know a CHEAP motorcycle mechanic in LA? I mean RECESSION cheap!? Maxine needs her cases split and a shifter fork replaced. 

0,2006959173,Tue Jun 02 11:56:20 PDT 2009,NO_QUERY,lovelyaiko,Last day of French  sadddddd D;

0,2006959865,Tue Jun 02 11:56:22 PDT 2009,NO_QUERY,Frekkuls,howdy twit world..have had an exhausting day at work..not looking forward to the weather turning tomorrow 

0,2006959975,Tue Jun 02 11:56:23 PDT 2009,NO_QUERY,rpattzlawyer,".@FakerStephanieR aw, poor rob.  he just needs a break! some time alone to rest up."

0,2006960124,Tue Jun 02 11:56:23 PDT 2009,NO_QUERY,Dancin_Giraffe,Last day of school ....and I'm like a river 

0,2006960501,Tue Jun 02 11:56:25 PDT 2009,NO_QUERY,roxiecathartic,@pookamachine  i had the same impeding doom feeling when we found out tate's mom has fiv

0,2006961429,Tue Jun 02 11:56:31 PDT 2009,NO_QUERY,zi11ion,"bah, damned live feed is choking up during the new metal gear trailer "

0,2006961456,Tue Jun 02 11:56:31 PDT 2009,NO_QUERY,marybethbeech,@jilliandanner Thanks!  It's also way over budget 

0,2006961662,Tue Jun 02 11:56:32 PDT 2009,NO_QUERY,kinslay3r,At the dentist office. Wish me luck 

0,2006961872,Tue Jun 02 11:56:33 PDT 2009,NO_QUERY,roryasdfasdf,#mit that is within view of the mental health services...  very sad if true

0,2006961885,Tue Jun 02 11:56:33 PDT 2009,NO_QUERY,kazzylady,"@MrJackO Enjoy the rush, we were to work with you on your last series, unfortunately you were ill so we were cancelled "

0,2006961933,Tue Jun 02 11:56:33 PDT 2009,NO_QUERY,JaxHolliday,"@onelessobvious aww Red  I've even seen them, so I'm not blindly commenting...I think they are purely one of the worst bands out there "

0,2006962430,Tue Jun 02 11:56:36 PDT 2009,NO_QUERY,stevendelman,@ajcalderon my texts I can't hear!! hahaha don't be mad 

0,2006962758,Tue Jun 02 11:56:38 PDT 2009,NO_QUERY,bbgrl,I'm still recovering from my unluckiness 

0,2006962849,Tue Jun 02 11:56:38 PDT 2009,NO_QUERY,Leslie1015,It is cloudy and gray with no internet today!!!  

0,2006963087,Tue Jun 02 11:56:39 PDT 2009,NO_QUERY,jamessingh,"Oh dear. Why has Gareth Barry gone to Man City? I thought he wanted Champions League football. Money, money, money, money... "

0,2006963286,Tue Jun 02 11:56:40 PDT 2009,NO_QUERY,TheJackel92,* :S not 

0,2006963601,Tue Jun 02 11:56:42 PDT 2009,NO_QUERY,JckOfAll_Trades,@XtremeElemental tix where? Lol about the lakers  hope they take the title this year

0,2006964039,Tue Jun 02 11:56:44 PDT 2009,NO_QUERY,mspamplease,room cleaned ...feelin super good about that accomplishment. Now i guess i'll get some mor stuff done. ps2 is broke so no Ghero for me 

0,2006964417,Tue Jun 02 11:56:46 PDT 2009,NO_QUERY,sophz_x,screw history revision...i'm gonna mourn the loss of ian crawford 

0,2006965056,Tue Jun 02 11:56:50 PDT 2009,NO_QUERY,Charne,@stolenxsanity I KNOW! They don't even have the decency to kill them BEFORE cutting off their fin. It's so sad  &amp; inhumane. Asses! 

0,2006965179,Tue Jun 02 11:56:51 PDT 2009,NO_QUERY,Kidflush,itunes ate my N.A.S.A. 

0,2006965196,Tue Jun 02 11:56:51 PDT 2009,NO_QUERY,TwyloII,I want the evening sun in MY garden!  â « http://blip.fm/~7i8f3

0,2006965472,Tue Jun 02 11:56:52 PDT 2009,NO_QUERY,sbc102003,@ksheen aw.. is it because you're not tall enough to go on any of the rides? poor midge  haha

0,2006965814,Tue Jun 02 11:56:54 PDT 2009,NO_QUERY,digiMAR_k,is preparing for tests  

0,2006965874,Tue Jun 02 11:56:54 PDT 2009,NO_QUERY,EHegenberger,@cronopia Right now I'm trying to track down about a year's worth of emails that went missing in Thunderbird when I ran a filter... 

0,2006965929,Tue Jun 02 11:56:55 PDT 2009,NO_QUERY,isdown,Nooo.. Ravelry is down.  http://bit.ly/11tmKL

0,2006966218,Tue Jun 02 11:56:56 PDT 2009,NO_QUERY,CIDx,"Drinking Tea, learning French and dreading the next four years "

0,2006966742,Tue Jun 02 11:56:59 PDT 2009,NO_QUERY,ChariseB,I'll be laying low a bit today since I woke up with a headache that simply WON'T go away.  

0,2006966787,Tue Jun 02 11:56:59 PDT 2009,NO_QUERY,BeantownCutie,@LuvinMeSomeD its not the same 

0,2006966867,Tue Jun 02 11:57:00 PDT 2009,NO_QUERY,leticiaperez,@itsNICKJONAS Are you a fake or not? I ask because some people tell me lies 

0,2006967127,Tue Jun 02 11:57:01 PDT 2009,NO_QUERY,hollywoodgirl1,@ashleytisdale how often do u fly to germany? hope u like our country  ) (o_o)

0,2006967376,Tue Jun 02 11:57:02 PDT 2009,NO_QUERY,catwomyn5,Its way too hot outside to work in the garden. I'm stuck in here for at least another hour. 

0,2006967564,Tue Jun 02 11:57:04 PDT 2009,NO_QUERY,KingsOfLeon_Grl,@Mollyschambrs Toothache. 

0,2006967609,Tue Jun 02 11:57:04 PDT 2009,NO_QUERY,Kidflush,itunes ate my N.A.S.A.  http://ff.im/-3vIQi

0,2006967616,Tue Jun 02 11:57:04 PDT 2009,NO_QUERY,C_h_e_e_k_y,It's day like today that I wish I had a dog 

0,2006967664,Tue Jun 02 11:57:04 PDT 2009,NO_QUERY,Sagan_Myers,"Picking up a cell charger for my old razor, hope it works, Our cell phone is BROKEN! Leaving around 3:30 to take my brother to my dads "

0,2006967942,Tue Jun 02 11:57:05 PDT 2009,NO_QUERY,pippip1,@conkinho i think its possibly better than #badsex lol but yeh exactly. i stil think i shud hav sold it for more tho  oh well :S

0,2006968063,Tue Jun 02 11:57:06 PDT 2009,NO_QUERY,BBKitten,The dogs are eating EGGS for breakfast because Merlot's daddy wont bring food home for her.    

0,2006968126,Tue Jun 02 11:57:06 PDT 2009,NO_QUERY,cursedbyevil,@Karen_Eden They do.  But expensive.  Will keep checking to see if price comes down.

0,2006988293,Tue Jun 02 11:58:55 PDT 2009,NO_QUERY,jcshy,@nxcole fgs neither do i LOL 

0,2006988790,Tue Jun 02 11:58:57 PDT 2009,NO_QUERY,baldeggie,omgosh Team Hawaii I am so jealous of my Oahu peeps ya'll have cocoa puffs @ Liliha bakery n we don't 

0,2006989151,Tue Jun 02 11:58:59 PDT 2009,NO_QUERY,RageuxDotInfo,next year 

0,2006989267,Tue Jun 02 11:59:00 PDT 2009,NO_QUERY,JewelsLB,Ahhhh. I'm still struggling w/celebration ideas 4 our anniversary 2night... Can't find a sitter either.  Any ideas?

0,2006989485,Tue Jun 02 11:59:01 PDT 2009,NO_QUERY,jtierney04,@filthyheart my aim crashed. 

0,2006989568,Tue Jun 02 11:59:01 PDT 2009,NO_QUERY,JayCeeLove,Working... missing a few people right now... 

