sentiment,userid,date,query,userId,text0,2198800244,Tue Jun 16 16:35:20 PDT 2009,NO_QUERY,foldingstars__x,Well aye what i meant to say was thinking of going to sleep but im not tiredddd 

0,2198800250,Tue Jun 16 16:35:20 PDT 2009,NO_QUERY,offtop,Missed FedEx delivery...grrrr...I was just a couple minutes late 

0,2198800308,Tue Jun 16 16:35:20 PDT 2009,NO_QUERY,lawsondf,hopes the car is ok. it did not like the trip at all...  http://plurk.com/p/11ghkp

0,2198800388,Tue Jun 16 16:35:21 PDT 2009,NO_QUERY,Bozleyyy,Riding the 4wheeler alone is never fun. 

0,2198800731,Tue Jun 16 16:35:22 PDT 2009,NO_QUERY,Owais_Iqbal,@scarletmandy @Donnette been planning on getting on there for some time.. but just cant manage the time.. 

0,2198800834,Tue Jun 16 16:35:23 PDT 2009,NO_QUERY,javibravo,just got home and my mms aren't working on my phone 

0,2198800961,Tue Jun 16 16:35:24 PDT 2009,NO_QUERY,camiroman93,@blueyoyo08 awww i wish you can too!! 

0,2198801615,Tue Jun 16 16:35:27 PDT 2009,NO_QUERY,allegra0,still tired  can i just sleep for the next 12 hours?

0,2198801986,Tue Jun 16 16:35:29 PDT 2009,NO_QUERY,juliegriese,Is BUMMED it's suppose to rain all day tomorrow...it's our last full day here too. 

0,2198802137,Tue Jun 16 16:35:30 PDT 2009,NO_QUERY,VyOLator,@heatherxxll yep. Broke the radial head. Get cast tomoro! Soooo I guess no jello wrestling for me 

0,2198802772,Tue Jun 16 16:35:33 PDT 2009,NO_QUERY,JOSWEETCOUTURE,Ugh! This guy won't let us LEAVE I am going TO LOSE IT! 

0,2198802797,Tue Jun 16 16:35:33 PDT 2009,NO_QUERY,jtabernilla,i'm pissed! (sort of!) i woke up very early just to retreive my laundry but i still haven't got any of it! company pictorial in minutes! 

0,2198802985,Tue Jun 16 16:35:34 PDT 2009,NO_QUERY,kyliieemac,@RockDaMullet you never sent me those photos 

0,2198803733,Tue Jun 16 16:35:38 PDT 2009,NO_QUERY,beasakurai,"anyway, tenho que me inscrever no enem "

0,2198803749,Tue Jun 16 16:35:38 PDT 2009,NO_QUERY,erinlynns,Pissed that Twitter didn't send ANYTHING to my phone today. I felt so disconnected to the outside world while stuck inside Kohl's 

0,2198803906,Tue Jun 16 16:35:39 PDT 2009,NO_QUERY,cisosbabygirl,wishin my &quot;BEST FRIEND&quot; would talk to me!!!! 

0,2198804009,Tue Jun 16 16:35:39 PDT 2009,NO_QUERY,wiillddkaaat,Goodbye long hair 

0,2198804046,Tue Jun 16 16:35:40 PDT 2009,NO_QUERY,cdub400H,bored as hell here in Statesboro 

0,2198804058,Tue Jun 16 16:35:40 PDT 2009,NO_QUERY,MusicMaN2,Learning song can be tough specialy when something is not working out 

0,2198810601,Tue Jun 16 16:36:13 PDT 2009,NO_QUERY,mikethorpe82,@ukgirlie I best off for some shut eye - got work in a few hours 

0,2198810695,Tue Jun 16 16:36:13 PDT 2009,NO_QUERY,nicolelovesalex,Whyyy am I not getting any updates?! The last one was at 3:53 am from alex. 

0,2198810890,Tue Jun 16 16:36:14 PDT 2009,NO_QUERY,MaraJonas,@glorianatheband http://twitpic.com/70h95 - awww he's ADORABLE! that sucks you couldnt keep him 

0,2198811108,Tue Jun 16 16:36:15 PDT 2009,NO_QUERY,GARDERLEFOI,she's not replied yet 

0,2198811670,Tue Jun 16 16:36:18 PDT 2009,NO_QUERY,ccacophony,"@Alexmcelroy I know. It seems like I'm being sodomized by many companies this week, though. "

0,2198811745,Tue Jun 16 16:36:19 PDT 2009,NO_QUERY,HollyAnne18,Why am i sick in june?? Not cool 

0,2198812355,Tue Jun 16 16:36:22 PDT 2009,NO_QUERY,ethankillett,"Man, today's starslip was really sad. "

0,2198812429,Tue Jun 16 16:36:22 PDT 2009,NO_QUERY,LizANN08,"I thought Wipeout was on tonight, its on tomorrow night...  O well, I'll watch the Twins game!"

0,2198813458,Tue Jun 16 16:36:28 PDT 2009,NO_QUERY,robotvsdinosaur,"@duncautumnstore @tekno_alice WTF, you said before I'd only receive one dunc? Shame, was looking forward to that robo pop comp..! "

0,2198813495,Tue Jun 16 16:36:28 PDT 2009,NO_QUERY,leah828,@mitchelmusso tosay i went to target and they didnt have ur cd i was bummed1!!! 

0,2198813523,Tue Jun 16 16:36:28 PDT 2009,NO_QUERY,claire_mcgovern,"blonde hair is AWFUL! i have straw, NOT hair.... STRAW!! "

0,2198813603,Tue Jun 16 16:36:29 PDT 2009,NO_QUERY,kosheracademic,@hsabomilner Just gave him some. Hadn't taken his temp for a while &amp; it wasn't this high b4. Waiting a bit to see if he keeps it down. 

0,2198814990,Tue Jun 16 16:36:36 PDT 2009,NO_QUERY,ThisIsLuke_,"god how im going to fail this exam, i dont know why i bothered revising! "

0,2198815109,Tue Jun 16 16:36:36 PDT 2009,NO_QUERY,luizacangussu,@jonasbrothers EVERYBODY THINKING THAT YOUR CHAT IS TODAY 

0,2198815179,Tue Jun 16 16:36:37 PDT 2009,NO_QUERY,Roughers,"@LauraHeatlie heyy! can't sleep either hahaa, none of the celebs will reply to me lol! its so sad "

0,2198815757,Tue Jun 16 16:36:40 PDT 2009,NO_QUERY,cccapple,"@allieg0rgeous im glad to see your finally listening to the new fall out boy stuff, but i dont like that you seem down, blehhh  &lt;3 ily!"

0,2198815924,Tue Jun 16 16:36:41 PDT 2009,NO_QUERY,randz10,"@neilhimself I noticed that, too, and started going to twitter.com just to check. "

0,2198816098,Tue Jun 16 16:36:41 PDT 2009,NO_QUERY,ashabanana11,@AndrewMBryant mann. i wish i could've gone! 

0,2198816549,Tue Jun 16 16:36:44 PDT 2009,NO_QUERY,brittanycates,doesnt get the point of twitter if you only have 8 followers.  

0,2198816691,Tue Jun 16 16:36:45 PDT 2009,NO_QUERY,biancafoppe,"Well, 1 thing down. Plenty more dental work ahead   ugh!! Can't wait untill I'm DONE with everything"

0,2198817060,Tue Jun 16 16:36:46 PDT 2009,NO_QUERY,CarrieLoel,MAn does anybody kno how to get your aim friends back ? my phone deleted all my firends 

0,2198817067,Tue Jun 16 16:36:46 PDT 2009,NO_QUERY,Betheaeroplane,@mandyxclear But then I might not be able to go 

0,2198817322,Tue Jun 16 16:36:47 PDT 2009,NO_QUERY,gabepancho, someone hacked my blog for class... and i got in trouble for it... that sucks. a lot

0,2198817553,Tue Jun 16 16:36:49 PDT 2009,NO_QUERY,Kianao4444,And like I predicted Nicoles Not with Keith tonight 

0,2198817604,Tue Jun 16 16:36:49 PDT 2009,NO_QUERY,Sephie,"sorry, I'm sounding cranky, it's just that this is my playground, and now it's full of business opportunities I never needed. "

0,2198817633,Tue Jun 16 16:36:49 PDT 2009,NO_QUERY,martyfnday,"tonight's dinner: Tuscan Chicken Pizza and pasta salad. Tomorrow, can't chew food. "

0,2198817711,Tue Jun 16 16:36:50 PDT 2009,NO_QUERY,hummingbird604,"My frustration comes from the fact that well, I'm NOT a depression expert. I'm an environmental politics and policy specialist "

0,2198818001,Tue Jun 16 16:36:51 PDT 2009,NO_QUERY,kimbahley,OMG DON'T CLOSE THE BOOK &amp; SWEET CAROLINE BACK TO BACK. HOW WILL I LIVE THROUGH THIS? meanwhile... BATTLEFIELD? 

0,2198818967,Tue Jun 16 16:36:56 PDT 2009,NO_QUERY,tori_love,@chadwsugg i wish i was there tonight.  have fun tho.

0,2198819211,Tue Jun 16 16:36:57 PDT 2009,NO_QUERY,carolinano,I need to go in and see what's wrong with my blackberry 

0,2198819267,Tue Jun 16 16:36:58 PDT 2009,NO_QUERY,Mgizzleness,I need a library room. I mean technically my room is practically a library but i'm running out of places to put my books. 

0,2198819455,Tue Jun 16 16:36:59 PDT 2009,NO_QUERY,meganledford,Why won't my BlackBerry and Twitter get along? I'm sick of this.  

0,2198820239,Tue Jun 16 16:37:03 PDT 2009,NO_QUERY,MarissaMascaro,@maxmarkson - Melbourne is terrible today... overcast  i've got the day off today so the heater is working it for me!

0,2198820923,Tue Jun 16 16:37:06 PDT 2009,NO_QUERY,Prueba_,"Hi, I am working now.... "

0,2198821102,Tue Jun 16 16:37:07 PDT 2009,NO_QUERY,mandduhh,"@HeyKarlie im jealous. oh hey, miss k called, golf starts july 1st at 630am, 9 holes then breakfast, alert the media "

0,2198821213,Tue Jun 16 16:37:08 PDT 2009,NO_QUERY,michellekl,"@teame yeah, i guess that could work. i am just not a fan of the clinic here at all. "

0,2198821692,Tue Jun 16 16:37:10 PDT 2009,NO_QUERY,JamieLeeWoods,"Hi everyone, cant trust anybody around me atm! "

0,2198822105,Tue Jun 16 16:37:12 PDT 2009,NO_QUERY,jonobabes,has been really enjoying living in Flat 49 these past few months. Shame it will all end next week 

0,2198822233,Tue Jun 16 16:37:13 PDT 2009,NO_QUERY,erinmurray94,is in maths 

0,2198822251,Tue Jun 16 16:37:13 PDT 2009,NO_QUERY,Ryan014,wants tickets for lady gaga and someone to see miley live with me 

0,2198822441,Tue Jun 16 16:37:14 PDT 2009,NO_QUERY,iamloz_JsPR,@nursedoublek I got CALEB !! haha well not in that way  haha but him and nath were in it doing a private show for us ! goddamitt be true!!

0,2198822477,Tue Jun 16 16:37:14 PDT 2009,NO_QUERY,maryam,@herbstsonne I get called sweet a least twice a week 

0,2198822885,Tue Jun 16 16:37:16 PDT 2009,NO_QUERY,thedustball,During these 2 weeks with Connor it's been awesome learning his rhythms and patterns. Just as I get to know him better it's almost over 

0,2198823741,Tue Jun 16 16:37:20 PDT 2009,NO_QUERY,Bia_Loves_NKOTB,@MysticFearie  i would to but i have a sprint aircard so i don't lose it unless i lose cell signal

0,2198823749,Tue Jun 16 16:37:20 PDT 2009,NO_QUERY,gemmalemma,@muntbag me too btw 

0,2198823925,Tue Jun 16 16:37:21 PDT 2009,NO_QUERY,CARDILAND,@damestoir yea I saw it! That's wats up! I'm on da low from fizz rite now! I lost the laker bet with him!! 

0,2198824030,Tue Jun 16 16:37:22 PDT 2009,NO_QUERY,MIGSSY,doesnt have twitter picture...  

0,2198824078,Tue Jun 16 16:37:22 PDT 2009,NO_QUERY,NylaPermataSari,so cold today 

0,2198824386,Tue Jun 16 16:37:24 PDT 2009,NO_QUERY,gennaaaaay,"@ezra_b blahhh you reminded me about my retainers. freaking A. my teeth shifted, but its not bad. its just not how it used to be "

0,2198824447,Tue Jun 16 16:37:24 PDT 2009,NO_QUERY,mere136,I cant wait until my new and fully functioning phone arrives...only 2-3 more business days 

0,2198824478,Tue Jun 16 16:37:24 PDT 2009,NO_QUERY,Charlliiee,"@mazza16 correction- after Thursday, YOU can do whatever the hell you like, unfortunately, I have to wait until Friday "

0,2198824545,Tue Jun 16 16:37:25 PDT 2009,NO_QUERY,lillybuck,"@millybuck aw, feelings hurt.  OMG! So, what car are we taking to VA?"

0,2198825240,Tue Jun 16 16:37:28 PDT 2009,NO_QUERY,joshwinningham,@PlayRadioPlay it's not worth it 

0,2198825255,Tue Jun 16 16:37:28 PDT 2009,NO_QUERY,ggail,been a busy day and evening.....plants are pretty but they have to have water  

0,2198825442,Tue Jun 16 16:37:29 PDT 2009,NO_QUERY,0127,still dont know what to do with my cat when i move 

0,2198825468,Tue Jun 16 16:37:29 PDT 2009,NO_QUERY,shanalovejb,im so sad i miss my kitties!!!!!!!!!!!     

0,2198825489,Tue Jun 16 16:37:29 PDT 2009,NO_QUERY,glamfnkdskobaby,@EliseHa   ya......... i got my iphone not too long ago either but if i wanna get the new one i have to wait until August 

0,2198825693,Tue Jun 16 16:37:31 PDT 2009,NO_QUERY,SirRaw,I was getting so sick of this lack of brown in my life 

0,2198825965,Tue Jun 16 16:37:32 PDT 2009,NO_QUERY,loveisonitsway7,i honestly don't think its possible for it to rain any more...it's been raining ALL summer 

0,2198826074,Tue Jun 16 16:37:33 PDT 2009,NO_QUERY,OliOlive,aaaaand the powers out 

0,2198826150,Tue Jun 16 16:37:33 PDT 2009,NO_QUERY,jfer32075,@spongecanary I don't think so. 

0,2198826201,Tue Jun 16 16:37:33 PDT 2009,NO_QUERY,ANGIESWORLD1,@bipolarbeauti7 Hey boo! Awww I just came from leaving work downtown!!  U shoulda called me earlier  Have fun! xoxox

0,2198826576,Tue Jun 16 16:37:36 PDT 2009,NO_QUERY,strawberrysgirl,Maaaan I need me some money. I'm like not getting any hours at work 

0,2198826739,Tue Jun 16 16:37:36 PDT 2009,NO_QUERY,rociopayan,my stomach hurts 

0,2198826966,Tue Jun 16 16:37:38 PDT 2009,NO_QUERY,jbluver3705,"My mom bought LVATT for me, and now I'm home, waiting for it. "

0,2198827130,Tue Jun 16 16:37:39 PDT 2009,NO_QUERY,143Rach,@heartmyscissors you have to go 

0,2198834859,Tue Jun 16 16:38:19 PDT 2009,NO_QUERY,Amyfugate,missing my house guests  she was so worth every single second.......I wish I could of kept her a few more days...

0,2198834875,Tue Jun 16 16:38:19 PDT 2009,NO_QUERY,audreyonline,@Chris62072 that sucks  hope ur day went well huuug

0,2198835150,Tue Jun 16 16:38:20 PDT 2009,NO_QUERY,jessicagoudy,i want starbucks 

0,2198835166,Tue Jun 16 16:38:20 PDT 2009,NO_QUERY,amyhansenid,"i am kinda lame, i thought maybe we were done with the freakin' rain!! "

0,2198835464,Tue Jun 16 16:38:22 PDT 2009,NO_QUERY,NikFreeman,@BrentLauren awwww man  this blows

0,2198835486,Tue Jun 16 16:38:22 PDT 2009,NO_QUERY,Rosie21,"@thetricktolife lol thats not nice! then again, sucks for being home "

0,2198835736,Tue Jun 16 16:38:23 PDT 2009,NO_QUERY,JeanneXay,"@yeemalee But you bought the CD at Wal Mart.. You go to the library to get it fixed? Well, i hope it gets fixed "

0,2198835785,Tue Jun 16 16:38:24 PDT 2009,NO_QUERY,MrsApollo19,"Hung out with the most adorable guy at the game, but hes 2 years younger than me! "

0,2198835963,Tue Jun 16 16:38:25 PDT 2009,NO_QUERY,conceived,@Devkss Aww. 

0,2198836064,Tue Jun 16 16:38:25 PDT 2009,NO_QUERY,sew_cute,@selfproduction  i hope you feel better soon. when are you due?

0,2198836217,Tue Jun 16 16:38:26 PDT 2009,NO_QUERY,worr,@geoffhotchkiss I don't have it. 

0,2198836398,Tue Jun 16 16:38:27 PDT 2009,NO_QUERY,bildani,Underperformed at the gym todayâ€¦and ruing the effects of a 4 week lay-off 

0,2198836746,Tue Jun 16 16:38:29 PDT 2009,NO_QUERY,wtao,SHOULD HAVE BROUGHT A CAMERA 

0,2198836824,Tue Jun 16 16:38:29 PDT 2009,NO_QUERY,iKarlie,"Wishing I still lived in San Antonio,Tx just so I could see the Metro Station concert october 15. "

0,2198836831,Tue Jun 16 16:38:29 PDT 2009,NO_QUERY,deannarooney,i need new music   http://bit.ly/J43cO

0,2198836836,Tue Jun 16 16:38:29 PDT 2009,NO_QUERY,Ayla_F,@rhondastapleton seriously. when does someone get whacked because i'm starting to think there isn't a mystery  (and why aren't you tweetin

0,2198837086,Tue Jun 16 16:38:31 PDT 2009,NO_QUERY,LettyA,@rachelinajolie aw sorry to hear that. 

0,2198837097,Tue Jun 16 16:38:31 PDT 2009,NO_QUERY,DaFreeK,"@MuscleNerd I can't wait for the demo, but it's already 1.35AM here in Croatia "

0,2198837171,Tue Jun 16 16:38:31 PDT 2009,NO_QUERY,angielaaa, I'm so sad for Tara and Ryne... Ughhhh :'(

0,2198837360,Tue Jun 16 16:38:32 PDT 2009,NO_QUERY,atlcutii,@Beehardy not yet  i should know by friday tho! im goin out fri nite; i forgot what club but u &amp;&amp; Mekia should come! when i remember lol

0,2198837614,Tue Jun 16 16:38:33 PDT 2009,NO_QUERY,carlina01,New to this Twitter thing. Looks like none of my friends are on Twitter.  

0,2198837909,Tue Jun 16 16:38:35 PDT 2009,NO_QUERY,ecm298,So bored at work and i'm only an hour and a half in.  Blech.

0,2198837943,Tue Jun 16 16:38:35 PDT 2009,NO_QUERY,ayoung8764,On the way home! 

0,2198837982,Tue Jun 16 16:38:35 PDT 2009,NO_QUERY,alaiagorexx,i HATE HATE HATE HATE HATEEE my stupid ass fucking dumb shit brother &gt; My summer is FUCKING RUINED!!!!!!! 

0,2198838269,Tue Jun 16 16:38:37 PDT 2009,NO_QUERY,StephyNoir,@IAMLEAH stuck at work  But im down on other days Im free. I can flounder like no other.

0,2198838357,Tue Jun 16 16:38:37 PDT 2009,NO_QUERY,singstar33,"I feel so bad for my doggy..she's miserably sick, shaking and all.  "

0,2198838667,Tue Jun 16 16:38:39 PDT 2009,NO_QUERY,_Jaska,"@imkrissy If I'm cryin over a $500 phone, what u think I'ma do for a $1300 laptop? o_O Guess I'm being mean huh? "

0,2198838769,Tue Jun 16 16:38:39 PDT 2009,NO_QUERY,nsquaredmagic,Dear APPLE - NEWSFLASH - It's June 17 in Sydney! Where's my iPhone upgrade?  The whole world is on PST now?

0,2198838774,Tue Jun 16 16:38:39 PDT 2009,NO_QUERY,DavidMexico,@enterbelladonna I will miss you 

0,2198839040,Tue Jun 16 16:38:41 PDT 2009,NO_QUERY,PsychicSophie,@barndogz I guess you'll need to email them...sorry 

0,2198840297,Tue Jun 16 16:38:47 PDT 2009,NO_QUERY,LindaDee,Not getting any tweets on my phone 2day  ? Been 2 busy 2 tweet myself nyway but not 2 busy 2 run 2 Yogurtland 4 peanutbutter w/chocchips!

0,2198840343,Tue Jun 16 16:38:48 PDT 2009,NO_QUERY,Broken_Vibes,@zoomswhizzkid can't find any! 

0,2198840582,Tue Jun 16 16:38:49 PDT 2009,NO_QUERY,mlle_elle,"Lame, someone outbid me on the vintage Jaws poster "

0,2198840786,Tue Jun 16 16:38:50 PDT 2009,NO_QUERY,cindylala,"flipping through tv channels, trying to decide what to watch. movie? show? idunno, but my sister is leaving me for work right now "

0,2198841358,Tue Jun 16 16:38:53 PDT 2009,NO_QUERY,AleisAwesome,3.48 for a pound of cherries?!?!?!?!? That is so ridiculous. 

0,2198841361,Tue Jun 16 16:38:53 PDT 2009,NO_QUERY,bortflancrest,"@Fiona_of_Toorak Well it does kinda,... but I can't compete with them.  My manbits are small, pale and unthreatening.  "

0,2198841362,Tue Jun 16 16:38:53 PDT 2009,NO_QUERY,PhanyPolar,I just simply donÂ´'t get it! 

0,2198841465,Tue Jun 16 16:38:54 PDT 2009,NO_QUERY,crickey23,I'm really craving Taco Bell for some reason. Why did they have to discontinue the chicken Crunchwrap? 

0,2198841613,Tue Jun 16 16:38:55 PDT 2009,NO_QUERY,sholnay,@arengh new music apps just seem so bloated.  I feel like an old man saying that though 

0,2198842256,Tue Jun 16 16:38:58 PDT 2009,NO_QUERY,lnnchn,@booey @srgntrose hope you guys got some sleep last night 

0,2198842377,Tue Jun 16 16:38:59 PDT 2009,NO_QUERY,TeriBeri,http://twitpic.com/7kvci - my pasty white foot on dash of car waiting for Ladley getting haircut. its raining 

0,2198842887,Tue Jun 16 16:39:01 PDT 2009,NO_QUERY,jaiceekaye17,just found out my all time favorite teacher died saturday 

0,2198843010,Tue Jun 16 16:39:02 PDT 2009,NO_QUERY,triciawohlford,"Finally at work. Dropped off Ck at camp, had to walk a bloody mile in mud! Already miss her. "

0,2198843016,Tue Jun 16 16:39:02 PDT 2009,NO_QUERY,Meli_mel_mel,Im being so clumsy today  i just tripped at my bro's house. Whats next?

0,2198843734,Tue Jun 16 16:39:06 PDT 2009,NO_QUERY,Girlypeekaboo,Feels horrible for deleting someone 

0,2198843911,Tue Jun 16 16:39:07 PDT 2009,NO_QUERY,hailey_letang,braves down 1-0 in the ^2nd. i missed mclouth up at bat though  hes first in the rotation

0,2198844223,Tue Jun 16 16:39:09 PDT 2009,NO_QUERY,wtf_elye,Ew @twitter why arent i gettin update txts 

0,2198844362,Tue Jun 16 16:39:09 PDT 2009,NO_QUERY,WackyLisa,@wednesday  that sucks. Sadness.

0,2198844423,Tue Jun 16 16:39:10 PDT 2009,NO_QUERY,nicx26,School's here once again... 

0,2198844438,Tue Jun 16 16:39:10 PDT 2009,NO_QUERY,meezieme,Heat has me exhausted like hell..wish I wouldve seen them throw bows lol but we got there too late 

0,2198844440,Tue Jun 16 16:39:10 PDT 2009,NO_QUERY,lolagirl5,"@alisaloki girl, I don't know when I will be up there. Maybe sometime before school starts.  Darn . Can't we stay 29 forever... lol"

0,2198844599,Tue Jun 16 16:39:10 PDT 2009,NO_QUERY,zachchisenhall,@imhayleykthnx and I am at work. I couldn't bring you a snow cone today. 

0,2198844799,Tue Jun 16 16:39:13 PDT 2009,NO_QUERY,Gabyta12,I did not buy today my Urbe 

0,2198845323,Tue Jun 16 16:39:14 PDT 2009,NO_QUERY,mandeliina,@peterfacinelli - i dropped my phone in the water  make a joke to make me happy! haha

0,2198845537,Tue Jun 16 16:39:15 PDT 2009,NO_QUERY,Sweet_Honey21,vending machines suck...took my damn dollar 

0,2198845732,Tue Jun 16 16:39:16 PDT 2009,NO_QUERY,Anddh,@unachance You're going to miss the CMTs 

0,2198845822,Tue Jun 16 16:39:17 PDT 2009,NO_QUERY,CalamityJen,@pprlisa I know...wasn't actually suggesting. Just bummed you can't come play. 

0,2198846281,Tue Jun 16 16:39:20 PDT 2009,NO_QUERY,Y0NAI,No signs that rain will stop. And water is dangerously approaching to my door 

0,2198846331,Tue Jun 16 16:39:20 PDT 2009,NO_QUERY,MeganMitchell92,"watching laguna beach. And i need to stop. The Graduation Episode is just making me cry, because thats us. And thats him, tomorrow. "

0,2198846465,Tue Jun 16 16:39:21 PDT 2009,NO_QUERY,jbarnholtz,"headache, stomach ache, ankle ache  boo"

0,2198846515,Tue Jun 16 16:39:21 PDT 2009,NO_QUERY,lameallenmark,I'm so down for a pasta bread bowl right now 

0,2198847033,Tue Jun 16 16:39:24 PDT 2009,NO_QUERY,justkaty,@hoshin costs money 

0,2198847069,Tue Jun 16 16:39:24 PDT 2009,NO_QUERY,TobyCharlesWard,cannot get to sleep...please somebody help me! 

0,2198847530,Tue Jun 16 16:39:26 PDT 2009,NO_QUERY,mikegoodner,@tbakun It is a foreign 4-door... Kia Rio  White with a big black molding stripe. Looks like a reverse oreo!

0,2198847632,Tue Jun 16 16:39:27 PDT 2009,NO_QUERY,pattihogan,anxiously awaiting my #leverage news of the day - still bummed that i live so far away from sunday's concert  WANTS VIDEO THIS TIME PEEPS

0,2198847741,Tue Jun 16 16:39:27 PDT 2009,NO_QUERY,Tabz,@mavjop awhh I hope she's better soon 

0,2198848776,Tue Jun 16 16:39:33 PDT 2009,NO_QUERY,LambdaCalculus,"Argh, an IM app quitting in the middle of a conversation isn't fun. "

0,2198848798,Tue Jun 16 16:39:33 PDT 2009,NO_QUERY,boffing,we could be living 1 block from mccarren park if jon was a team player!! 

0,2198848917,Tue Jun 16 16:39:33 PDT 2009,NO_QUERY,vixensfantasy,Great Diez 2 log in isnt working account in use 

0,2198848979,Tue Jun 16 16:39:34 PDT 2009,NO_QUERY,wxgirl2008,"well damn. I guess I still held out a very very small minuscule amount of hope that maybe, just maybe, Sammy didn't juice up. my bad... "

0,2198849018,Tue Jun 16 16:39:34 PDT 2009,NO_QUERY,TinkerbellsLite,Still nursing a sore knee.  I start physical therapy tomorrow... 

0,2198849078,Tue Jun 16 16:39:34 PDT 2009,NO_QUERY,JulieMincavage,Not a very exciting day today 

0,2198849245,Tue Jun 16 16:39:35 PDT 2009,NO_QUERY,Shawnna_Starr,LOL  @nottidread04 U DONT HAVE FOLLOWERS B/C UR NEVER ON!!!... BUT UMM IM STILL SAD ABOUT THE PETA MOVIE......  DONT EAT MEAT PEOPLE!!! JK

0,2198849693,Tue Jun 16 16:39:37 PDT 2009,NO_QUERY,_gemmarrh,watching band camp can;t sleep again 

0,2198850656,Tue Jun 16 16:39:42 PDT 2009,NO_QUERY,ilynickjxo,gah. my neck still hurts  i need to sleep some more.

0,2198860954,Tue Jun 16 16:40:33 PDT 2009,NO_QUERY,SLHamilton,"not cool pop, really really not cool "

0,2198861051,Tue Jun 16 16:40:34 PDT 2009,NO_QUERY,Saundraaa,@FeRReTbRaT text it to me cus from what i know it's not working!! 

0,2198861122,Tue Jun 16 16:40:34 PDT 2009,NO_QUERY,Dimelojuana,@Shylita damn... I wish I had some $! broke like a joke&lt;---- not funny! 

0,2198861655,Tue Jun 16 16:40:37 PDT 2009,NO_QUERY,sara3isenough,@PrincessJenn cuz no one liked them 

0,2198861789,Tue Jun 16 16:40:38 PDT 2009,NO_QUERY,xoalexis,My power just went out.. And didn't come back on 

0,2198861865,Tue Jun 16 16:40:38 PDT 2009,NO_QUERY,megannchristine,"OMG, my nose ring just got caught on my towel and ripped out. OUCH! Now I can't find it and have to put my old one in.  Booo!!!"

0,2198862281,Tue Jun 16 16:40:40 PDT 2009,NO_QUERY,volcom_baby,Right when you think life couldn't get any worse...you find out some not so happy news that could be life changing 

0,2198862422,Tue Jun 16 16:40:41 PDT 2009,NO_QUERY,JLanphear,Kinda bored. . . Xbox Live is down and I don't feel like playing any of my games anyways. Wowzerz. . . I'm out of things to do. 

0,2198862454,Tue Jun 16 16:40:41 PDT 2009,NO_QUERY,luizacangussu,@jonasbrothers EVERYBODY THINKING THAT YOUR CHAT IS TODAY 

0,2198862772,Tue Jun 16 16:40:43 PDT 2009,NO_QUERY,holidaynick,I'm going on strike because they aren't making a Jurassic Park 4  sniffle sniffle 

0,2198863367,Tue Jun 16 16:40:46 PDT 2009,NO_QUERY,anitakc,@kimberlymdg I have no money for gas 

0,2198863722,Tue Jun 16 16:40:47 PDT 2009,NO_QUERY,summer_g,Mine thighs have seen the glory of the coming of a Katy (Trail) run. SUCCESS today! SORENESS tomorrow. 

0,2198864000,Tue Jun 16 16:40:49 PDT 2009,NO_QUERY,jennymurder,"@putoutthemoon haha, you're cute! i'm so oldschool i don't even have an ipod. "

0,2198864435,Tue Jun 16 16:40:51 PDT 2009,NO_QUERY,Haley_Paige,Just got back from lunch with Emiliano and corin. Soooo full!! No more school   I dunno what imma do now!! Ugh

0,2198864545,Tue Jun 16 16:40:52 PDT 2009,NO_QUERY,VA_LEO,missing my girls 

0,2198864650,Tue Jun 16 16:40:52 PDT 2009,NO_QUERY,NoixdeeCoco,@ivyartemisia I know right... 

0,2198864981,Tue Jun 16 16:40:54 PDT 2009,NO_QUERY,leonardoq,to me esqueÃ§endo do twitter  

0,2198865249,Tue Jun 16 16:40:55 PDT 2009,NO_QUERY,tarajackson,My energy level is soooooo low.  Having to miss the Bridge tonight due to lack of any energy whatsoever. 

0,2198865265,Tue Jun 16 16:40:55 PDT 2009,NO_QUERY,Tforeman63,i miss my chancy 

0,2198865332,Tue Jun 16 16:40:56 PDT 2009,NO_QUERY,Rocio_omj,"Today!!... Lines, Vines and Trying Times!! but I still do not have one.  I have to buy! jeje"

0,2198865777,Tue Jun 16 16:40:58 PDT 2009,NO_QUERY,AKearbakowski,i wish my cat would come home. 

0,2198866119,Tue Jun 16 16:41:00 PDT 2009,NO_QUERY,JennyG03,@Treenie5 i really do... unless there is a way to make atlanta a ten minute drive from los angeles 

0,2198866347,Tue Jun 16 16:41:01 PDT 2009,NO_QUERY,_jibril,@Roto13 Sadly that is how ESPN and the general media treats these kinds of things 

0,2198866374,Tue Jun 16 16:41:01 PDT 2009,NO_QUERY,Giulianapb,So I tried taking a nap n it didn't work... Now I'm soooo tired I can't even think straight. 

