sentiment,userid,date,query,userId,text
0,2189549179,Tue Jun 16 00:17:56 PDT 2009,NO_QUERY,GeemaPee,"Walking to school, just had my dose of lung cancer this morning thanks to the smokers "

0,2189549681,Tue Jun 16 00:18:00 PDT 2009,NO_QUERY,Heinlein_Fan,You ever just wish you could take go back to being a child with no responsibilities or problems beyond school? Being an adult is no fun.  

0,2189549876,Tue Jun 16 00:18:02 PDT 2009,NO_QUERY,angelxwarrior,"@sjm28 just tried and still no luck,aww sarah  hope your feeling better soon,ive got a right headache at the min"

0,2189549975,Tue Jun 16 00:18:03 PDT 2009,NO_QUERY,Ramski24,BP at Mercury before my 2D echo ... 140/80  2D Echo was ok.

0,2189550254,Tue Jun 16 00:18:05 PDT 2009,NO_QUERY,pjvds,@faachman Nee 

0,2189550293,Tue Jun 16 00:18:06 PDT 2009,NO_QUERY,CarolineTimm,"now finally off to slumber. tired, sick butt must get up early to keep cleaning for mommy's visit. KEEP cleaning? that implies I have...  "

0,2189550404,Tue Jun 16 00:18:07 PDT 2009,NO_QUERY,ghostieee,is so stupid. 

0,2189550436,Tue Jun 16 00:18:07 PDT 2009,NO_QUERY,JessiJaeJoplin,video chatting with @majorlyepic ....she's sitting right next to me 

0,2189550499,Tue Jun 16 00:18:07 PDT 2009,NO_QUERY,sarahlestrange,I'm hungry and I can't eat anything.  Kill me?

0,2189550655,Tue Jun 16 00:18:09 PDT 2009,NO_QUERY,DharaEarth,Its 3rd week of June and no sign of monsoon setting in Bombay  This increases chances of diseases and famine 

0,2189550755,Tue Jun 16 00:18:10 PDT 2009,NO_QUERY,simithedemon,Working during the day is unnatural   *waves goodbye to net for the rest of the day*

0,2189550827,Tue Jun 16 00:18:11 PDT 2009,NO_QUERY,Mincess,I am now in pain as whilst cleaning some of the glass got into my foot it won't stop bleeding and hurts like hell 

0,2189550920,Tue Jun 16 00:18:11 PDT 2009,NO_QUERY,xcool,so embarrassing to send an email reply to the whole division - all thanks to the Reply All button 

0,2189551598,Tue Jun 16 00:18:17 PDT 2009,NO_QUERY,ashleeadams,oh fuck. Just realised i've only got 4 days left on my pill and didn't bring another pack. FUCK. That means i'll get my period in LA 

0,2189551661,Tue Jun 16 00:18:18 PDT 2009,NO_QUERY,Misslalahearts,&quot;you have stolen my heart&quot;    ..sum1 cheer me up ...bad day ((((

0,2189551962,Tue Jun 16 00:18:20 PDT 2009,NO_QUERY,PrincessKiss,sleeping on a couch = no bedpartner I am very sad that has been a constant alot this year... you won't get a no this time..125 I am not  

0,2189552032,Tue Jun 16 00:18:21 PDT 2009,NO_QUERY,division6,@ahadfromcheam Not good for the diet dude 

0,2189552037,Tue Jun 16 00:18:21 PDT 2009,NO_QUERY,heidiprice,"@thinkgeek luv ya stuff, and would buy heaps, but yr postage to Aussieland is expensive "

0,2189552266,Tue Jun 16 00:18:24 PDT 2009,NO_QUERY,meghanledger,Science exam tomorrow! Yeah! 

0,2189552526,Tue Jun 16 00:18:26 PDT 2009,NO_QUERY,ppossej,Wondering when Upwey station will ever get toilets ... it's a bloody long train trip from the city when you *really* have to go! 

0,2189552565,Tue Jun 16 00:18:26 PDT 2009,NO_QUERY,SeanaLyn,@HenleyFenix  click your heels three times!

0,2189552864,Tue Jun 16 00:18:29 PDT 2009,NO_QUERY,CrookieCat,"@RealRobBrydon How can anyone be as chipper as you this early in the morning?  You can tell you're not in Scotland, grey sky AGAIN "

0,2189552953,Tue Jun 16 00:18:30 PDT 2009,NO_QUERY,kalpik,So.. Opera Unite! The page isnt even opening here 

0,2189553055,Tue Jun 16 00:18:31 PDT 2009,NO_QUERY,Trannyyy,4 days - Boys are leaving 

0,2189553058,Tue Jun 16 00:18:31 PDT 2009,NO_QUERY,degsy,i hate our webmail system!!! just lost another email while typing due to a timeout... i forget everytime damn time! 

0,2189553590,Tue Jun 16 00:18:36 PDT 2009,NO_QUERY,delazni,got free tix for Video Games Live this Friday @ Indoor Stadium... Hubby can't make it coz he's working... Then I wanna go with who:... 

0,2189553754,Tue Jun 16 00:18:37 PDT 2009,NO_QUERY,LainaxBaina,@BrilliantBA Aww I miss our weekly dinners 

0,2189553889,Tue Jun 16 00:18:38 PDT 2009,NO_QUERY,VickiGarlick,@StockingsAddict this is why we don't do the hourglass stuff 

0,2189553937,Tue Jun 16 00:18:39 PDT 2009,NO_QUERY,daniperaza,@andytinoco :O! Damn! Will we never drink together 

0,2189554416,Tue Jun 16 00:18:43 PDT 2009,NO_QUERY,amanda_RAWR,So.. Opera Unite! The page isnt even opening here  http://bit.ly/EuF8U

0,2189554492,Tue Jun 16 00:18:44 PDT 2009,NO_QUERY,kawie88,"at university again, should do something for my classes but don't want to...should do it now instead of tonight at home...need more sleep "

0,2189554523,Tue Jun 16 00:18:44 PDT 2009,NO_QUERY,LiquidSpirit,Is the world is asleep 

0,2189554616,Tue Jun 16 00:18:45 PDT 2009,NO_QUERY,FrankiNicole,Cant believe Ed left tonight  I am so sad! I loved him!

0,2189555331,Tue Jun 16 00:18:52 PDT 2009,NO_QUERY,ChristaGiles,"@yarnpiggy Fer sure... When TC blogged about it a couple days ago, I was sad, 'cause it got people excited when we were at max already "

0,2189555335,Tue Jun 16 00:18:52 PDT 2009,NO_QUERY,slamdunka32,not doing so hot 

0,2189555655,Tue Jun 16 00:18:55 PDT 2009,NO_QUERY,stefstump,School time! do i have 2 go???? 

0,2189555675,Tue Jun 16 00:18:55 PDT 2009,NO_QUERY,elCAPTAIN2010,@janettlara I'm finishing right now. :/ I have to do the outline and actual biography. 

0,2189555720,Tue Jun 16 00:18:56 PDT 2009,NO_QUERY,AussieBritUSA,I miss texting to twitter all day long. I went over my texts this month by 430. Yikes! Needless to say I'm on text probation.   

0,2189556089,Tue Jun 16 00:18:59 PDT 2009,NO_QUERY,sekarnakula,Can you tell me some good songs? I'm bored 

0,2189556227,Tue Jun 16 00:19:00 PDT 2009,NO_QUERY,nicksynet,@GirlGamersUK not a lot as Xbox live is down 

0,2189556392,Tue Jun 16 00:19:02 PDT 2009,NO_QUERY,Donnytom,Back to office and still disconnected 

0,2189556530,Tue Jun 16 00:19:03 PDT 2009,NO_QUERY,mike_hignite,needs to go to bed 

0,2189556570,Tue Jun 16 00:19:03 PDT 2009,NO_QUERY,injenious,"@grum I use &quot;Four&quot; now at Gloria Jeans. &quot;Jen&quot; always became Jan, Jane, Jean, Jenny or Joan  &quot;Four&quot; works.. but sometimes they ask why. :/"

0,2189556748,Tue Jun 16 00:19:05 PDT 2009,NO_QUERY,samarudge,Ooo another day of doing nothing 

0,2189556909,Tue Jun 16 00:19:06 PDT 2009,NO_QUERY,babyowls,I like you so much. Call me.  im

0,2189557456,Tue Jun 16 00:19:11 PDT 2009,NO_QUERY,tihou,I nicked my leg while shaving.  

0,2189557936,Tue Jun 16 00:19:15 PDT 2009,NO_QUERY,Mizz_Emmzi,Homework  doing  this art thingo ... SO  WEIRD :S

0,2189557991,Tue Jun 16 00:19:16 PDT 2009,NO_QUERY,oolivia__,I hate looking at old pictures sometimes.. It makes me think of the way things used to be.. 

0,2189558932,Tue Jun 16 00:19:25 PDT 2009,NO_QUERY,walklikeduck,"Idk how some pple can rant on and on abt their stupidity when they are alr in top3. Can get in= stupid, cant get in= GONECASE? @$#! "

0,2189559216,Tue Jun 16 00:19:27 PDT 2009,NO_QUERY,sharadaprasad,"@mailsubash Sir, the problem has intensified... "

0,2189559489,Tue Jun 16 00:19:29 PDT 2009,NO_QUERY,AminatJ,@storme08 lucky! i have to wait 25  and yes JB is the coolest band in the world...cant wait to get my copy of LVATT!

0,2189559838,Tue Jun 16 00:19:33 PDT 2009,NO_QUERY,ninadengler,why do al good things come to an end? 

0,2189560220,Tue Jun 16 00:19:36 PDT 2009,NO_QUERY,pinkytoy,Hungry in class!!!! 

0,2189560241,Tue Jun 16 00:19:36 PDT 2009,NO_QUERY,Gadreel23,what's the point? 

0,2189560331,Tue Jun 16 00:19:37 PDT 2009,NO_QUERY,LadyLeshurr,@LadyChann yeah errytime i try download it disconnects me frm internet  @Silverchet well wat u jus said says it all lol whos iphone is it?

0,2189560473,Tue Jun 16 00:19:39 PDT 2009,NO_QUERY,CarlyKR,looking for my lost cat 

0,2189560539,Tue Jun 16 00:19:39 PDT 2009,NO_QUERY,patsylynn,Ugh. Can't sleep. Got too much on my mind. And no one to talk to. 

0,2189560590,Tue Jun 16 00:19:40 PDT 2009,NO_QUERY,lovelylivxo,Is on the bus to college! Well tired. 

0,2189560869,Tue Jun 16 00:19:42 PDT 2009,NO_QUERY,ssuny03,very tough day  i am going to night duty

0,2189561001,Tue Jun 16 00:19:43 PDT 2009,NO_QUERY,permanentdan,"@aromee i was trying to think of ways to get my dog to bark to scare the shit out of them, but he only barks at shady guys he can see "

0,2189561030,Tue Jun 16 00:19:44 PDT 2009,NO_QUERY,MissyPincushion,I look like i'm high.  My eyeballs hurt so bad  today was good. I wish i had a soap opera life like Cass. Nick gave me an ugly tattoo [=

0,2189561196,Tue Jun 16 00:19:45 PDT 2009,NO_QUERY,mazeratiiBOOGIE," smh , im hot as hell .  leave me alone."

0,2189561284,Tue Jun 16 00:19:46 PDT 2009,NO_QUERY,Kdsmissions,"Goodmorning world!been up 40mins and hav managed2hurt myself twice,u can tell what kind of say it's gonna be!!i wish we didnt hav toes  !"

0,2189561294,Tue Jun 16 00:19:46 PDT 2009,NO_QUERY,PilCurls,@thescript i wish i could go!!! 

0,2189561527,Tue Jun 16 00:19:48 PDT 2009,NO_QUERY,darrenwilliger,@TopSquidooLens I totally missed out on the Squidoo parade 

0,2189561777,Tue Jun 16 00:19:51 PDT 2009,NO_QUERY,Southpaw217,"@Lorax1515 thanks, now I can subscribe to your channel...and watch it get banned again "

0,2189562443,Tue Jun 16 00:19:57 PDT 2009,NO_QUERY,vdizzle3,At Untalan gym &amp; it's hot! 

0,2189562476,Tue Jun 16 00:19:57 PDT 2009,NO_QUERY,RightsideUK,Ok so it turns out the gig at the Douglas Vaults in South Shields tonight isn't happening  sorry guys

0,2189562680,Tue Jun 16 00:19:58 PDT 2009,NO_QUERY,yeyeismynicki,wants my adobe flash player back! 

0,2189563062,Tue Jun 16 00:20:02 PDT 2009,NO_QUERY,pamellafonseca,Ugh i need to sleep my eyes feel so tired. x.x but what if i don't wake up on time Alexandria WILL kill me 

0,2189563197,Tue Jun 16 00:20:03 PDT 2009,NO_QUERY,tami_engel,@Alyssa_Milano whereÂ´s your wonderful picture??? Lovely Greetings from rainy Germany 

0,2189563206,Tue Jun 16 00:20:03 PDT 2009,NO_QUERY,yayselina,Craving 85 degrees' cakes so badly 

0,2189563606,Tue Jun 16 00:20:05 PDT 2009,NO_QUERY,helloaberdeen,"@chelseaxhale Oh i think I'm going to cry now! I'm sitting here think about life with you in a different country, It's going to hurt "

0,2189564712,Tue Jun 16 00:20:14 PDT 2009,NO_QUERY,themeekshall,"@JamFactory I had that last night and night before, brain won't shut off "

0,2189565586,Tue Jun 16 00:20:21 PDT 2009,NO_QUERY,LadyLeshurr,@Icy1_Female i am shy 

0,2189565708,Tue Jun 16 00:20:22 PDT 2009,NO_QUERY,Nonoloco,@TheCupcakeNinja oh no your fish is a goner!! 

0,2189566099,Tue Jun 16 00:20:25 PDT 2009,NO_QUERY,Vikirnoff,@next_bold_move  sorry to hear that.  /hugs

0,2189567059,Tue Jun 16 00:20:33 PDT 2009,NO_QUERY,loyallove,omg..i just drove all the wat 2 TACO BELL and they were closed...im so sad! 

0,2189567322,Tue Jun 16 00:20:35 PDT 2009,NO_QUERY,badiit,"...arrve today.And now she's unreachable.Goodthing I dint give her downpayment.but sucks,I was extremely excited for my shoes "

0,2189569316,Tue Jun 16 00:20:53 PDT 2009,NO_QUERY,chloelees,"@bangover I had the coalface soap and the enzymion (or somehting) cream, and i broke out like craaaaazy "

0,2189569317,Tue Jun 16 00:20:53 PDT 2009,NO_QUERY,thelady,@defunct1 ha ha ha. you know i have problem buying shoes in Shanghai. Damn! They all have small feet!!! 

0,2189569583,Tue Jun 16 00:20:56 PDT 2009,NO_QUERY,JessicaGatto16,"i miss those days. the old hannah montana songs we used to sing to together, making up stupid songs at 2 in the morning. where'd they go? "

0,2189569604,Tue Jun 16 00:20:56 PDT 2009,NO_QUERY,edelq, seriously annoyed.. People thinkin its hilarious that someone would want to try and do extra work to make up for our hours being cut 

0,2189569646,Tue Jun 16 00:20:56 PDT 2009,NO_QUERY,kinkpink,Reviewing in history. I don't want to leave the house.  *advil*

0,2189570027,Tue Jun 16 00:21:00 PDT 2009,NO_QUERY,ianapplegate,@hellotom thief in the night  thanks for the links

0,2189570044,Tue Jun 16 00:21:00 PDT 2009,NO_QUERY,shinsh0ku,@janetfungus http://forums.philosophyforums.com/ the link doesnt work at the moment for some reason  well not for me anyway. how bout you?

0,2189570366,Tue Jun 16 00:21:03 PDT 2009,NO_QUERY,Kfeddd,@brynxo how the fuck did we miss the arena football game? It was free for god sakes! I seriously have been disappointed for weeks 

0,2189570972,Tue Jun 16 00:21:08 PDT 2009,NO_QUERY,ronaldtweedie,"London Gatwick......in the arrivals lounge, cappucino then next flight @ 10AM BST ......then into the office "

0,2189571062,Tue Jun 16 00:21:11 PDT 2009,NO_QUERY,ChinDesign,@tea_why it sounds like you are having a hell of a time wherever you are...sorry friend 

0,2189571069,Tue Jun 16 00:21:09 PDT 2009,NO_QUERY,litebriteac,@iamlottie i was on the fone wit @pmoney1 working out our pralums lol.. we hadnt spoken for one day it felt like 3 years 

0,2189571110,Tue Jun 16 00:21:09 PDT 2009,NO_QUERY,richonsecrets,never ever ever ever ever get a modem/router combo....it is destroying my life 

0,2189571223,Tue Jun 16 00:21:10 PDT 2009,NO_QUERY,jlieu,Get your ice skates on-hell has officially frozen over- I did not enjoy my creme brule'e at Ryan Bar &amp; Grill! 

0,2189571283,Tue Jun 16 00:21:10 PDT 2009,NO_QUERY,PwincessInLove,Been Sent Home From School Not Very Well  &lt;3 xx

0,2189571707,Tue Jun 16 00:21:14 PDT 2009,NO_QUERY,ayraaa,Misses when they were my fave two boys  ... now I only have one.

0,2189571725,Tue Jun 16 00:21:14 PDT 2009,NO_QUERY,SomersetBob,"@Denpasar Yes, that family's pain is unimaginable. "

0,2189571975,Tue Jun 16 00:21:16 PDT 2009,NO_QUERY,GayleHoward,@Pattycam booze and ciggies can do awful things to voices. 

0,2189572220,Tue Jun 16 00:21:18 PDT 2009,NO_QUERY,katlynw02,Was admitted to West Allis Memorial Hospital today-this sucks   I can't even sleep in this place

0,2189572237,Tue Jun 16 00:21:19 PDT 2009,NO_QUERY,Bigempty,@wiccasyouth  awww 

0,2189572302,Tue Jun 16 00:21:19 PDT 2009,NO_QUERY,itsandre13,"Everybody are sleeping.... I'm the only person who can't fall asleep again after that vibration, I was having a good dream!   aaarghhh!!!!"

0,2189572305,Tue Jun 16 00:21:19 PDT 2009,NO_QUERY,mcr_addict19,oh shit its one of THOSE nights........no please no......oh shit too late its one of those 

0,2189572332,Tue Jun 16 00:21:19 PDT 2009,NO_QUERY,Cherye101,I think i was irritating last night  sorry everyone!

0,2189572441,Tue Jun 16 00:21:20 PDT 2009,NO_QUERY,roxiijonas,"I can't get to sleep, might aswell get up and hope I don't ruin this exam :o "

0,2189572453,Tue Jun 16 00:21:20 PDT 2009,NO_QUERY,andtheholocaust,omg xbawks is down for 24 hours  brb going to an hero.

0,2189572710,Tue Jun 16 00:21:23 PDT 2009,NO_QUERY,silver_n,I wish my life had a Restart button that i could hit right now 

0,2189572745,Tue Jun 16 00:21:23 PDT 2009,NO_QUERY,lucyclare,I did get some sleep. But now I'm starting a cold sore. 

0,2189572979,Tue Jun 16 00:21:25 PDT 2009,NO_QUERY,PoloGee,@breeze_in you forgot about our plan to get famous 

0,2189572989,Tue Jun 16 00:21:26 PDT 2009,NO_QUERY,next_bold_move,"@Vikirnoff He's been working a lot lately, but "

0,2189573134,Tue Jun 16 00:21:27 PDT 2009,NO_QUERY,itsanimesh,@stuti_ I am trying to rest but just cant sleep... :-/ and the best thing is i have 2 small mischievous cousins at my home today.. 

0,2189573302,Tue Jun 16 00:21:28 PDT 2009,NO_QUERY,krjx,"@askseesmic Thanks for the followup. Well, restart solves some issues temporarily. I have to restart every hour or so to keep it working "

0,2189573558,Tue Jun 16 00:21:31 PDT 2009,NO_QUERY,havebettersex,Had a great curry lunch at the fullerton so feeling much better now! Was still drunk for first meeting this morning 

0,2189573768,Tue Jun 16 00:21:32 PDT 2009,NO_QUERY,AppleJuice1234,"Trying to go to sleep, but its just not working. Ughh "

0,2189573862,Tue Jun 16 00:21:33 PDT 2009,NO_QUERY,Hannanar,@ceekaigax Heyyyyyyyyyyy i've got school now LOL boooo 

0,2189574037,Tue Jun 16 00:21:35 PDT 2009,NO_QUERY,June_Bear,@Laird_Attwood sorry sorry sorry  if you like i could hop on train to crewe to bring phone/wallet?

0,2189574312,Tue Jun 16 00:21:37 PDT 2009,NO_QUERY,laniberms,@gmg2001 LOST is off season. NBA finals are done. what are we gonna do now? 

0,2189574450,Tue Jun 16 00:21:38 PDT 2009,NO_QUERY,ilove_joe_jonas,@jonasbrothers http://twitpic.com/7gowf - LOL I love Joe with glasses. PLEASE COME TO AUSTRALIA. We only got your movie for one week. 

0,2189574554,Tue Jun 16 00:21:39 PDT 2009,NO_QUERY,De3De3x3, 3 hrs on da phone...lol dude is hilarious

0,2189575097,Tue Jun 16 00:21:44 PDT 2009,NO_QUERY,thatrachelgirl,Basil is for real dying. I'm heartbroken. 

0,2189575338,Tue Jun 16 00:21:46 PDT 2009,NO_QUERY,evrenk,"Amarok used to be great, now it's uncomfortable to use and forgets about the podcast episodes it downloaded. I want my Amarok1 "

0,2189575632,Tue Jun 16 00:21:49 PDT 2009,NO_QUERY,b_lips,@Tits_N_Tatts vegas?? I'm not there  I wish!!

0,2189575641,Tue Jun 16 00:21:49 PDT 2009,NO_QUERY,xiaobaomei,@SwanLin i have class  i really wanna go though. oh well. i think i'm just gonna regular gym it or do pure strength at 6:35 ?? dunno..

0,2189575686,Tue Jun 16 00:21:49 PDT 2009,NO_QUERY,ashley_s15,talking to fabian!!!! my only follower!!! 

0,2189575944,Tue Jun 16 00:21:52 PDT 2009,NO_QUERY,charlieboy808,@jlieu aww im sorry 2 hear that  maybe next time?

0,2189575978,Tue Jun 16 00:21:52 PDT 2009,NO_QUERY,EnsilBSB,I'm going to give up... 

0,2189576013,Tue Jun 16 00:21:52 PDT 2009,NO_QUERY,Jusssstin,XBOX live is down for the day. 

0,2189576026,Tue Jun 16 00:21:52 PDT 2009,NO_QUERY,Kailynwailyn,@himynameislexie haha. great minds . and yes poor kailyn didnt know why. she just wanted to know y 

0,2189576377,Tue Jun 16 00:21:56 PDT 2009,NO_QUERY,PjFromOz,I think tonight needs to be an early one...I'm exhausted 

0,2189576416,Tue Jun 16 00:21:56 PDT 2009,NO_QUERY,dindahh,@ohmonika I really wished I live closer to Bowen now 

0,2189576766,Tue Jun 16 00:22:00 PDT 2009,NO_QUERY,anamika22,Back to Mysore and work and feeling really tiered....never liked traveling early in the morning 

0,2189576926,Tue Jun 16 00:22:01 PDT 2009,NO_QUERY,AimeeCarver,"Schoooool Soon, Exam At 9 Arghhhhh "

0,2189577453,Tue Jun 16 00:22:05 PDT 2009,NO_QUERY,dkmashino,@Yoda808 I don't even know what Harpers Island is  LOL

0,2189577867,Tue Jun 16 00:22:09 PDT 2009,NO_QUERY,lenniecurry,@RightsideUK ....shame  x

0,2189577870,Tue Jun 16 00:22:10 PDT 2009,NO_QUERY,iamboring,everybody's sick! 

0,2189578355,Tue Jun 16 00:22:14 PDT 2009,NO_QUERY,rbuerckner,"@osrin I just hope that not too many die, the reports of students being thrown by police off buildings if true is very bad "

0,2189578382,Tue Jun 16 00:22:14 PDT 2009,NO_QUERY,jesss_xx,i think im going to fail first aid just cause i couldnt get up this morning 

0,2189578522,Tue Jun 16 00:22:15 PDT 2009,NO_QUERY,suli90,"just woke up, not that I want to , but I have to pick up my aunt from school in an hour! "

0,2189579101,Tue Jun 16 00:22:21 PDT 2009,NO_QUERY,Taqo_Belle,my poor bb Miley  lol. I still have an inkling of hope of them being fake..

0,2189579461,Tue Jun 16 00:22:24 PDT 2009,NO_QUERY,vibbio999,chilling out in a hot hot summer 

0,2189579512,Tue Jun 16 00:22:24 PDT 2009,NO_QUERY,xxlilxxleannexx,"@jesscocaine i feel ya! I got sore throat, ear ache, bloody sneezing &amp; a groggy head  hope ya feel better soon -boob girl"

0,2189579579,Tue Jun 16 00:22:25 PDT 2009,NO_QUERY,QueenKaySpeaks,Not tired. I love baby so much..too bad i cant see him until like thursday 

0,2189579906,Tue Jun 16 00:22:28 PDT 2009,NO_QUERY,isacullen,awake! horrible sleep though 

0,2189580026,Tue Jun 16 00:22:29 PDT 2009,NO_QUERY,CinaTheDiva,@Hesguapanese popcorn LOL good nap? U not my friend nomore damn how quickly things change  tear

0,2189580614,Tue Jun 16 00:22:34 PDT 2009,NO_QUERY,kendra_bunch,my internets wack so im sendin this update from my phone my ipod is doin better every1 pray that it stays alive and works  kk thanks

0,2189580666,Tue Jun 16 00:22:35 PDT 2009,NO_QUERY,petecullen,"Sally bought me an ankle support yesterday to help get over my EA Active ankle injury.Made me feel ancient,then she did the hard workout "

0,2189580705,Tue Jun 16 00:22:35 PDT 2009,NO_QUERY,JhoyBoy,"@nittienerdface ohohoho, why yes it can. I think i have reached a new low too "

0,2189580737,Tue Jun 16 00:22:35 PDT 2009,NO_QUERY,buttaflygirly7,Really cold here  x

0,2189580958,Tue Jun 16 00:22:37 PDT 2009,NO_QUERY,JeromeKoehler,Looks like my iPhone 3GS isn't arriving till the 22nd 

0,2189581180,Tue Jun 16 00:22:40 PDT 2009,NO_QUERY,scottmallinson,@iphigenie @keanrichmond It's because there was such a long period of time (7 months) between permanent employment jobs due to redundancy 

0,2189581211,Tue Jun 16 00:22:40 PDT 2009,NO_QUERY,vickidenisa,really needs her soul 

0,2189581697,Tue Jun 16 00:22:44 PDT 2009,NO_QUERY,Jesi_Lu,BLAHHHH hayfever tablets not working 

0,2189581986,Tue Jun 16 00:22:47 PDT 2009,NO_QUERY,jeanneherawati,help me to make cast study marketing strategi @nandiia and @desyarey pleasee 

0,2189582078,Tue Jun 16 00:22:48 PDT 2009,NO_QUERY,minzesm,says Mikie not feeling well  http://plurk.com/p/119ylw

0,2189582289,Tue Jun 16 00:22:50 PDT 2009,NO_QUERY,LadyLeshurr,"OMG I JUST SIN A MASSIVE SPIDER INMY SINK &amp; IM PETRIFIED OF THEM I WENT2BRUSH MY TEETH &amp; IT WAS JUST LYING THERE, I SCREAMED N IT JUMPED "

0,2189583627,Tue Jun 16 00:23:02 PDT 2009,NO_QUERY,AminatJ,i am sooo jealous of everyone who is getting LVATT right now @ midnight....i still have to wait about 7 hours 

0,2189583714,Tue Jun 16 00:23:03 PDT 2009,NO_QUERY,Twospeedcycle,Rock band is over at my house until further notice. my bass pedal finally took a shit 

0,2189584080,Tue Jun 16 00:23:06 PDT 2009,NO_QUERY,divya084,"@baxiabhishek well i can, but I guess sometimes impulsive shopping doesn't work out right "

0,2189585267,Tue Jun 16 00:23:17 PDT 2009,NO_QUERY,BobGodbolt,Baby Jebus hates me!  at 4am this morning he gave me leg cramp!  and my wife is 600 miles away to kiss my boo boo better 

0,2189585389,Tue Jun 16 00:23:18 PDT 2009,NO_QUERY,CatChicotka,Don't have my own computer because its getting fixed  Not that anyone probably pays attention to my tweets so it's all good.

0,2189585464,Tue Jun 16 00:23:19 PDT 2009,NO_QUERY,rose2784,It's raining in Tokyo... 

0,2189585496,Tue Jun 16 00:23:19 PDT 2009,NO_QUERY,NITSIRKoy,Why does the asian guy always have to die 

0,2189585566,Tue Jun 16 00:23:20 PDT 2009,NO_QUERY,olly2,Theres still sand on my flipflops.. i miss portugal 

0,2189586001,Tue Jun 16 00:23:24 PDT 2009,NO_QUERY,snowy_twilight,ew.....cow dissection 2day  i have a MASSIVE HEADACHE :'( ugh

0,2189586240,Tue Jun 16 00:23:26 PDT 2009,NO_QUERY,Networking_Lady,colour your profile green- show solidarity  with #iranelection-that's all we can do 

0,2189586314,Tue Jun 16 00:23:26 PDT 2009,NO_QUERY,Ger_scf,"Quiero ver Transformers 2, The Proposal y Up "

0,2189586368,Tue Jun 16 00:23:27 PDT 2009,NO_QUERY,iamajeanius,@jasminanguyen OH MANN I WISH I SAW THIS EARLIER!  I stuffed up so badly in my SAC today!

0,2189586874,Tue Jun 16 00:23:31 PDT 2009,NO_QUERY,MaddisonDerrico,Damn i hate this cold 

0,2189586994,Tue Jun 16 00:23:32 PDT 2009,NO_QUERY,psam,MFE update #FAIL  #Nokia

0,2189587031,Tue Jun 16 00:23:33 PDT 2009,NO_QUERY,carlashleyphoto,soup for tea. lovely stuff straight from a plastic bowl in the cupboard 

0,2189587421,Tue Jun 16 00:23:36 PDT 2009,NO_QUERY,frann_ncine,"Ando c/ insÃ´nia, shit. "

0,2189588201,Tue Jun 16 00:23:44 PDT 2009,NO_QUERY,courtneyjane_,its too cold  athletics carnival tomorrow

0,2189588226,Tue Jun 16 00:23:44 PDT 2009,NO_QUERY,alltimelowjody,@heykelly_ i know.. i didn't even know they were back together? lol. yeah i would def go if it was ga... 

0,2189588476,Tue Jun 16 00:23:46 PDT 2009,NO_QUERY,meggles0,finally has my new blog up since i cant fix my other one  http://megglesphotos.blogspot.com/

0,2189588774,Tue Jun 16 00:23:49 PDT 2009,NO_QUERY,kerrygreyhounds,"Very sorry if anyone felt bombarded by tweets yesterday  Just care so much about helping these unwanted hounds, I get a bit carried away  "

0,2189588836,Tue Jun 16 00:23:50 PDT 2009,NO_QUERY,jakeashley,"@applicantjan yeah dude, a part of me needs more spitalfield though "

0,2189589203,Tue Jun 16 00:23:54 PDT 2009,NO_QUERY,lisetteziere,@Pink No pictures?  LOL

0,2189589551,Tue Jun 16 00:23:57 PDT 2009,NO_QUERY,LindseyThorn,Wanting to be asleep yet not wanting to. I'm bummed I can't see the CMT Awards tomorrow with my basic cable  I must-no-I WILL find a way

0,2189590003,Tue Jun 16 00:24:01 PDT 2009,NO_QUERY,rachearnshaww,"eurgh, off ill "

0,2189590218,Tue Jun 16 00:24:03 PDT 2009,NO_QUERY,joiedetea,My cat is chewing the sticky tabs out of my tea notebook  oh dear.

0,2189590351,Tue Jun 16 00:24:04 PDT 2009,NO_QUERY,anisafd,miss you all 

0,2189590457,Tue Jun 16 00:24:05 PDT 2009,NO_QUERY,twixpolicarpio,woot! the rain ruined my first day in school.. 

0,2189590474,Tue Jun 16 00:24:05 PDT 2009,NO_QUERY,grum,oh fuck off. NKOTB aren't coming to Australia   http://bit.ly/7oYbR

0,2189590894,Tue Jun 16 00:24:09 PDT 2009,NO_QUERY,brenz88,@MrEricPiRaTe haha noooo just for my ortho appointment.  lol what will u do tomorrow??

