sentiment,userid,date,query,userId,text
0,2263447702,Sun Jun 21 00:50:23 PDT 2009,NO_QUERY,mollyisabamf,@ambiiomfg Once My House Arrest Is Over 

0,2263448097,Sun Jun 21 00:50:27 PDT 2009,NO_QUERY,Just_Plain_Mary, i have already seen all the episodes of forensic files they are playing tonight.

0,2263448360,Sun Jun 21 00:50:29 PDT 2009,NO_QUERY,FunkySweets,watched &quot;Marley and Me&quot; earlier today .. made me very emotional  great movie .. not usually an Owen Wilson fan but I liked this movie alot

0,2263448603,Sun Jun 21 00:50:31 PDT 2009,NO_QUERY,vulcanella,@sassyback yes!!!! Oh but I'm here  sing very very loudly for me!!!

0,2263448818,Sun Jun 21 00:50:34 PDT 2009,NO_QUERY,helloreimei,@mistressmayhem no internet at my mom's place  Anddd I only go to my dad's on Sundays.

0,2263449834,Sun Jun 21 00:50:43 PDT 2009,NO_QUERY,cindyexxtreme,@imthegoldenboy -- wachu been up to?? Haven't tweeted with ya since Portland got knocked out 

0,2263450309,Sun Jun 21 00:50:48 PDT 2009,NO_QUERY,Lenpestana,"Smooth Jazz with Peter White, Philippe Saisse &amp; Michael Paulo  at Royal Hawaiian Shopping Center.  Up 10 floors of parking and 0 found "

0,2263450589,Sun Jun 21 00:50:50 PDT 2009,NO_QUERY,HovX,So bored can't sleep 

0,2263451207,Sun Jun 21 00:50:56 PDT 2009,NO_QUERY,bryanfake,is going to hell...not purgatory says janelle 

0,2263451975,Sun Jun 21 00:51:04 PDT 2009,NO_QUERY,SteveMoraco,http://bit.ly/X1viU  - That saddens me 

0,2263452335,Sun Jun 21 00:51:07 PDT 2009,NO_QUERY,withlovesevelyn,sad that i'm missing the i feel pretty &amp; stars outing. i wanna watch dance subaru too. sigh 

0,2263452454,Sun Jun 21 00:51:08 PDT 2009,NO_QUERY,blackrugger,@annedisasterrr i'm kinda depressed...the girl was sexy and I couldn't close.  

0,2263452507,Sun Jun 21 00:51:09 PDT 2009,NO_QUERY,candlesbychewie,Time to start filling another skip  

0,2263453309,Sun Jun 21 00:51:16 PDT 2009,NO_QUERY,Giorginz,A lot of raining in Misano.. 

0,2263453659,Sun Jun 21 00:51:20 PDT 2009,NO_QUERY,shiatheninja,I haven't gotten to talk to any of my ninjas in a long time 

0,2263453843,Sun Jun 21 00:51:22 PDT 2009,NO_QUERY,callmeshakag,is having a hard time keeping up with twitter.  darn i  miss my blackberry.

0,2263453885,Sun Jun 21 00:51:22 PDT 2009,NO_QUERY,GlitterAbuser,@Dismal_Moron You gotta love that 

0,2263454115,Sun Jun 21 00:51:25 PDT 2009,NO_QUERY,TwinHype,Gotta get up and tidy the house now 

0,2263454307,Sun Jun 21 00:51:26 PDT 2009,NO_QUERY,myxillusi0ns,"@ItaloGnomo it's not the sameeeee!  it's good, but not the same! "

0,2263454474,Sun Jun 21 00:51:28 PDT 2009,NO_QUERY,madamecupcake,"@Kimberley__ baby doll, what is going on? email me!!! i'm here for you "

0,2263454830,Sun Jun 21 00:51:31 PDT 2009,NO_QUERY,theboss0817,@lyrically_vain: omg come rescue me   {A_LisTeR}

0,2263454869,Sun Jun 21 00:51:32 PDT 2009,NO_QUERY,jituppal,"@LeeMcIntyre Hey Lee, I'm having that same problem right now with Skype... "

0,2263455082,Sun Jun 21 00:51:34 PDT 2009,NO_QUERY,roxxyheart,i miss u baby  

0,2263455508,Sun Jun 21 00:51:39 PDT 2009,NO_QUERY,peabss,condolences to the whole La Sallian community 

0,2263455826,Sun Jun 21 00:51:42 PDT 2009,NO_QUERY,djvimala,I'm hosting Singtel show till 9pm in Fort Canning Park.. Omg! I'm hving fever 

0,2263456194,Sun Jun 21 00:51:46 PDT 2009,NO_QUERY,rlinder22,just took my puppy to the animal emergency hospital 

0,2263456213,Sun Jun 21 00:51:46 PDT 2009,NO_QUERY,emilyclarkftw,what a great day. it's starting to feel like summer even though I have work tomorrow 

0,2263456475,Sun Jun 21 00:51:49 PDT 2009,NO_QUERY,marilee,#neda heartbreaking 

0,2263456483,Sun Jun 21 00:51:49 PDT 2009,NO_QUERY,Cinestry,Feeling pretty like shit. Felt this way since last night. Hnnf.  

0,2263456537,Sun Jun 21 00:51:49 PDT 2009,NO_QUERY,melohhknee,so @my cousin steph how do you twitter 

0,2263456735,Sun Jun 21 00:51:53 PDT 2009,NO_QUERY,fazm,"I hate Sundays. Bloody bored now, secretly dying inside "

0,2263457292,Sun Jun 21 00:51:57 PDT 2009,NO_QUERY,atkailash,Eeww. They just brought a girl up to her room in a wheel chair with a bucket she can puke in  gross

0,2263457662,Sun Jun 21 00:52:01 PDT 2009,NO_QUERY,daniecallahanx,Down one spot?   #happybdaykrisallen #happybdaykrisallen #happybdaykrisallen #happybdaykrisallen #happybdaykrisallen #happybdaykrisallen

0,2263457695,Sun Jun 21 00:52:02 PDT 2009,NO_QUERY,david_bunzli,Did an easy river loop. Legs sore. Came off in the wet so grazes on right side 

0,2263458486,Sun Jun 21 00:52:09 PDT 2009,NO_QUERY,kimberlyannnnee,On the phone with the chinkiest Asian man  &quot;sheeet thee feeeck uppp&quot;

0,2263458639,Sun Jun 21 00:52:11 PDT 2009,NO_QUERY,freshypanda,@krystynchong Which I'm sure you'll also get eventually...  LOL!

0,2263458657,Sun Jun 21 00:52:11 PDT 2009,NO_QUERY,Elsa_DC,"Wondering if my perception of life is widespread...looking around me, the first answer that comes to my mind is: &quot;definitely not!&quot;  "

0,2263458708,Sun Jun 21 00:52:11 PDT 2009,NO_QUERY,MunkeyPunch,It's finally hit me...no. I mean somethings literally hit me in the balls. 

0,2263458815,Sun Jun 21 00:52:12 PDT 2009,NO_QUERY,valora_ixchel,"@glitterrayne: missed you tonite, love!  Merry Solstice!"

0,2263458962,Sun Jun 21 00:52:14 PDT 2009,NO_QUERY,katiemaren,@agent_maxine  I haven't found a good background to use yet. I just didn't hate this one. &gt;.&gt;!! I need one of Gaspard. LOL

0,2263459269,Sun Jun 21 00:52:17 PDT 2009,NO_QUERY,jeloestrada,RIP brother ceci 

0,2263459365,Sun Jun 21 00:52:18 PDT 2009,NO_QUERY,lostalphabets,my face hurrrrrts. 

0,2263459491,Sun Jun 21 00:52:19 PDT 2009,NO_QUERY,sweetsheilx,@xoxojizni ) pero i got jealous Taecyeon kissed the girl  wahhh

0,2263459629,Sun Jun 21 00:52:21 PDT 2009,NO_QUERY,forshurs,My buzz went away... 

0,2263459727,Sun Jun 21 00:52:22 PDT 2009,NO_QUERY,brentonfinn,ughhh feeling so sick! and i dont feel like going to get my car  ! @vikkkki take meee to that chinese place in toowong

0,2263459797,Sun Jun 21 00:52:23 PDT 2009,NO_QUERY,Mark5Films,@johnmayer indian anytime soon ? 'something's missing' in india 

0,2263459920,Sun Jun 21 00:52:25 PDT 2009,NO_QUERY,hardg,"Temperature in Luxor: really freaking hot (about 95 @10:30, expected high of 105) Still no tan "

0,2263460475,Sun Jun 21 00:52:30 PDT 2009,NO_QUERY,Jessica_Tucker, That is all.

0,2263460566,Sun Jun 21 00:52:31 PDT 2009,NO_QUERY,alexisnicholex3,"Laying in bed and texting, haha. I'm going to sleep though; so exhausted and I miss my babies.  'Night."

0,2263460634,Sun Jun 21 00:52:32 PDT 2009,NO_QUERY,SmileySal1,"@tommcfly ouch, that doesn sound good.  Hope you've had a good sleep. I have the hangover from hell, from Red Bull, never again, :'( XX"

0,2263460658,Sun Jun 21 00:52:32 PDT 2009,NO_QUERY,rr_fash,someone cracked my twitt password.  gee...

0,2263460980,Sun Jun 21 00:52:36 PDT 2009,NO_QUERY,Jessabeans,"home from work, and i got a headaaachhhee "

0,2263461128,Sun Jun 21 00:52:37 PDT 2009,NO_QUERY,tonylucente,"not exactly the best day, in a weird mood "

0,2263461463,Sun Jun 21 00:52:41 PDT 2009,NO_QUERY,memith,@burrow I'm sorry to hear about your friend 

0,2263461642,Sun Jun 21 00:52:43 PDT 2009,NO_QUERY,zoolazoola,Happy Fathers Day everyone from 1:52 A.M.! I can't sleep like always 

0,2263462171,Sun Jun 21 00:52:49 PDT 2009,NO_QUERY,lisa24270,"Fed up with my e-mail inbox being filled by Claims Direct, fake lottery wins &amp; the like  (sorry, appear to have woken up grumpy!)"

0,2263462319,Sun Jun 21 00:52:50 PDT 2009,NO_QUERY,nb42,@sitaram Brazil should win 2-0 I think. Haven't seen any games though  Sutpid cable guy.

0,2263462547,Sun Jun 21 00:52:53 PDT 2009,NO_QUERY,elpie,@winewanker Sorry to hear that   Thinking of you all.

0,2263462667,Sun Jun 21 00:52:54 PDT 2009,NO_QUERY,MarkRanier,Rhymes coming down w a fever. just got some motrin. 

0,2263463118,Sun Jun 21 00:52:59 PDT 2009,NO_QUERY,Kountry404,Is missin his son this Father's Day!!! Damn i love my son! This some hard shit! 

0,2263463382,Sun Jun 21 00:53:01 PDT 2009,NO_QUERY,CynthiaLaac,Didn't see him today  it's been a week.

0,2263463504,Sun Jun 21 00:53:02 PDT 2009,NO_QUERY,Elsa_DC,"Wondering if my perception of life is widespread...looking around, the first answer that comes to my mind is: &quot;definitely not!&quot;  "

0,2263463798,Sun Jun 21 00:53:05 PDT 2009,NO_QUERY,Steve_Gonzales,Awe freshman year book from colony highschool  I miss Ontario sometimes. Actually it's real ghetto now I'm glad I left safley

0,2263463947,Sun Jun 21 00:53:07 PDT 2009,NO_QUERY,katiemaren, Happy Fathers day. ILUDaddy.    First father's day sans father.

0,2263464334,Sun Jun 21 00:53:11 PDT 2009,NO_QUERY,Cherrybee82,plays too much warcraft  waaaay too much.

0,2263464348,Sun Jun 21 00:53:11 PDT 2009,NO_QUERY,justinforrest,Damnit! He left before I got a chance to ask him what it was like to make out with Mandy Moore. 

0,2263464530,Sun Jun 21 00:53:13 PDT 2009,NO_QUERY,TashaSancheezie,Fractured hand  so sad! http://mypict.me/4OmI

0,2263464842,Sun Jun 21 00:53:16 PDT 2009,NO_QUERY,alviena,Time to take a shower...1st day period always suck!  http://myloc.me/4OmX

0,2263465272,Sun Jun 21 00:53:21 PDT 2009,NO_QUERY,memorabledesign,I'll probably be studying for most of the day 

0,2263465476,Sun Jun 21 00:53:23 PDT 2009,NO_QUERY,iandolphin24,Administrivia - travel &amp; filing - followed by attempt to find suitable replacement for now defunct Dell mini 8 which didn't get ordered 

0,2263465496,Sun Jun 21 00:53:23 PDT 2009,NO_QUERY,teamnative,its fathers day for all those who have fathers 

0,2263465816,Sun Jun 21 00:53:26 PDT 2009,NO_QUERY,WrightVoice,@johnmayer I have a singing question. Should I really be able to just pick out the harmony w/o hearing and practicing it? Don't know how. 

0,2263466710,Sun Jun 21 00:53:35 PDT 2009,NO_QUERY,ali10230,@tierneywilson you are welcome. and yes it is. but i havent been able to sleep for 3 days. 

0,2263466775,Sun Jun 21 00:53:36 PDT 2009,NO_QUERY,chachanowrhend,i got a bad score !  cry cry

0,2263467540,Sun Jun 21 00:53:44 PDT 2009,NO_QUERY,CatharineLK,Sick of feeling like i'm not good enough maybe im not the prettiest or the thinest ect.But I'm..oh nevermind that just made me feel worse 

0,2263467695,Sun Jun 21 00:53:45 PDT 2009,NO_QUERY,stephanieDRIZ,leaving home again 

0,2263467849,Sun Jun 21 00:53:47 PDT 2009,NO_QUERY,GeorgeJulian,@Binky_2301 Oh bugger  They'll get over themselves in time. Chin up x

0,2263467877,Sun Jun 21 00:53:47 PDT 2009,NO_QUERY,AteAnna,loves been 4 days and still counting...  http://plurk.com/p/12mcxx

0,2263468447,Sun Jun 21 00:53:53 PDT 2009,NO_QUERY,mad21185,standing at red light. 

0,2263471081,Sun Jun 21 00:54:19 PDT 2009,NO_QUERY,linuxwitch,Sorta forgot to Tweet today.  Most of the repairs were made to house.  They forgot a window 

0,2263471126,Sun Jun 21 00:54:20 PDT 2009,NO_QUERY,LaBelleChanson,i wish my dad was here for father's day 

0,2263471955,Sun Jun 21 00:54:28 PDT 2009,NO_QUERY,jknippschild,back in HH and already off Aida Cara! 

0,2263472297,Sun Jun 21 00:54:31 PDT 2009,NO_QUERY,pandoramae,"@wickdaman ah well I hope that you're feeling better soon, btw are you back on wow yet? Think we might be leaving, just no interest in it "

0,2263472440,Sun Jun 21 00:54:33 PDT 2009,NO_QUERY,sssahar,@moniiicaa @mattattackup  Zac was hella cute in it! i dont remember the songs matthew  but i rememer lovin them

0,2263473524,Sun Jun 21 00:54:44 PDT 2009,NO_QUERY,SammiiSTACK,@PrincessDiviney Sorry Bout trashingg yuur house babe  i could not resist a popcorn fight XD

0,2263473731,Sun Jun 21 00:54:46 PDT 2009,NO_QUERY,JWNY,On the way home. We lost 2-1  http://myloc.me/4Ony

0,2263473959,Sun Jun 21 00:54:49 PDT 2009,NO_QUERY,pedestrians,And I never meant that phrase as much as I do with you. Can I say I miss you one more time? 

0,2263474442,Sun Jun 21 00:54:54 PDT 2009,NO_QUERY,shinyperson,First leg of journey done - waiting at Didcot for leg 2. Am v cold 

0,2263474469,Sun Jun 21 00:54:54 PDT 2009,NO_QUERY,autumnzy,"i'm so hook on a chinese web-farming game... å¼€å¿ƒç½‘ At level 2 now!!  Niway, MJ last night sux "

0,2263474865,Sun Jun 21 00:54:58 PDT 2009,NO_QUERY,reii_,So sleepy lately  why!?

0,2263475079,Sun Jun 21 00:55:00 PDT 2009,NO_QUERY,chelsdixon,misses youuuuu 

0,2263475198,Sun Jun 21 00:55:01 PDT 2009,NO_QUERY,Beeyuncah,"I feel like crying, because of the ep. "

0,2263475597,Sun Jun 21 00:55:04 PDT 2009,NO_QUERY,mr_magnet0812,Too many books to read 

0,2263475797,Sun Jun 21 00:55:06 PDT 2009,NO_QUERY,jesssssiiccaa,Revision day  last 4 exams this week kidddds. (Y) x

0,2263475871,Sun Jun 21 00:55:07 PDT 2009,NO_QUERY,rockababyrock,@bElizabethz thanks for responding to my texts friend. 

0,2263475993,Sun Jun 21 00:55:08 PDT 2009,NO_QUERY,ohheytaylor,"I'm terrible at this game. I lost all my oxen,my wagon,and 2 of my kids drowned trying to cross the Kansas River. "

0,2263476020,Sun Jun 21 00:55:08 PDT 2009,NO_QUERY,vossy23,Its bout to go down. I'm exited but its gonna be a bitter sweet kinda deal 

0,2263476223,Sun Jun 21 00:55:10 PDT 2009,NO_QUERY,lostwithoutsara,@yahforchelsea What did he say in it? I missed it 

0,2263476682,Sun Jun 21 00:55:14 PDT 2009,NO_QUERY,stapochick,"i am board,tired,hungry.... what can i do "

0,2263476913,Sun Jun 21 00:55:17 PDT 2009,NO_QUERY,nazihahsofian,I need to pee. But I'm too lazy to even get up from bed 

0,2263476939,Sun Jun 21 00:55:17 PDT 2009,NO_QUERY,cassiekitsch,@ZackHatcher Unfortunately. 

0,2263477297,Sun Jun 21 00:55:21 PDT 2009,NO_QUERY,lovely_star4896,I can't speak English! Hhuhuhu!!! Every body don't understand Vietnamese. Can they understand my update??? No. I don't think so! 

0,2263477302,Sun Jun 21 00:55:21 PDT 2009,NO_QUERY,EmmieJ,@moburns67 i might keep it in our new car but our other car has a DVD player so i don't get any choice in what we listen to. movies only. 

0,2263477368,Sun Jun 21 00:55:22 PDT 2009,NO_QUERY,missmcj,@communicating Stings 

0,2263477814,Sun Jun 21 00:55:27 PDT 2009,NO_QUERY,Rkoluvsdiana,Woke up at 7 after a dream which totlaly fucked with my head gotta stop drinking before bed o well another long Sunday at work  ilptaf

0,2263479273,Sun Jun 21 00:55:41 PDT 2009,NO_QUERY,cdozier,I finally watched Madea Goes to Jail today! I am a huge Tyler Perry fan...but...the movie left me wanting more 

0,2263479767,Sun Jun 21 00:55:46 PDT 2009,NO_QUERY,chachanowrhend,i got a bad score !  cry cry

0,2263480133,Sun Jun 21 00:55:50 PDT 2009,NO_QUERY,BradmanTV,"@JayLink_ I have no idea, but I pissed of a niche group of grandmothers tonight "

0,2263480255,Sun Jun 21 00:55:51 PDT 2009,NO_QUERY,histapleface,@swayswaystacey wtf do you get done!! hahaha i got a few foils and a trim! and baaam she takes my life savings 

0,2263480275,Sun Jun 21 00:55:51 PDT 2009,NO_QUERY,Teradoll,@futuredirected There's the whole range of intersex phenotypes which unfortunately get lumped to one gender or the other at birth 

0,2263480422,Sun Jun 21 00:55:53 PDT 2009,NO_QUERY,itsmegannn,@angella2290 but they are! 

0,2263480599,Sun Jun 21 00:55:54 PDT 2009,NO_QUERY,ashleydelgado,@shayna21 well maybe it didn't work idk... Hopefully you won't have to delete your twitter and start over 

0,2263480684,Sun Jun 21 00:55:55 PDT 2009,NO_QUERY,RAYCHUUUL,@DDRFanatic682 No one ever invites me anymore.  @FletcherAmazes LMAO! Okay well bring it out into the open and I'm your slave.

0,2263480955,Sun Jun 21 00:55:58 PDT 2009,NO_QUERY,Fluffy_Cupycake,@SingmySorrow i did  i'll bring my laptop to work and burn it while im waiting lol

0,2263481018,Sun Jun 21 00:55:59 PDT 2009,NO_QUERY,obsessedwithyou,my ears hurt. 

0,2263481786,Sun Jun 21 00:56:06 PDT 2009,NO_QUERY,nuclearxwinter,I'm bored. And everyone is asleep. 

0,2263481967,Sun Jun 21 00:56:08 PDT 2009,NO_QUERY,MarkInciong,"My brother, Matthew, Is having the signs of Swine Flu... Please Lord, Don't give him the flu... Please... "

0,2263481975,Sun Jun 21 00:56:08 PDT 2009,NO_QUERY,freestresstest,"i think so too @fatfreeyay  call on jesus, he's everyone's homeboy"

0,2263482093,Sun Jun 21 00:56:09 PDT 2009,NO_QUERY,GianMC,Goodbye freedom. 

0,2263482254,Sun Jun 21 00:56:11 PDT 2009,NO_QUERY,rehmaaa,"@lostwithoutsara awww  idk, it's like no one likes where they live..haha"

0,2263482550,Sun Jun 21 00:56:13 PDT 2009,NO_QUERY,TroubleHots,"@tynie626 nice! i did not drink tonight, sadly  lol"

0,2263482635,Sun Jun 21 00:56:14 PDT 2009,NO_QUERY,homebiss,@shamhardy Torrenting it right now but it would take me a week+ to hav everything &amp; I don't hav the patience to wait that long. 

0,2263482842,Sun Jun 21 00:56:16 PDT 2009,NO_QUERY,myheroinee,"just got back from niece's 1st mth, rushing the god damn bcs now which leaves me so damn clueless about what im supposed to do.  help?"

0,2263482848,Sun Jun 21 00:56:16 PDT 2009,NO_QUERY,Rohan_01,@HoneyJune hey tomboy... did u jus feel sad for some1??? lolzzz... ya i noe its really sad.... 

0,2263483015,Sun Jun 21 00:56:18 PDT 2009,NO_QUERY,SwinginCouple,OK so tonight did not pan out  Ooh well maybe tomorrow.

0,2263483208,Sun Jun 21 00:56:20 PDT 2009,NO_QUERY,Furynull,@tehemopenguin I miss you 

0,2263483537,Sun Jun 21 00:56:23 PDT 2009,NO_QUERY,JaimiNicole,I miss my birthday  hahaha

0,2263483716,Sun Jun 21 00:56:25 PDT 2009,NO_QUERY,ElectricLoveee,@ddlovato  Wish I could goooo    Good luck thoughh.

0,2263483828,Sun Jun 21 00:56:26 PDT 2009,NO_QUERY,zilla_darling,I have a lovely 5c size blister from boiling water 

0,2263483888,Sun Jun 21 00:56:26 PDT 2009,NO_QUERY,SKINNYTHICKNESS,anyone know of 24 hr delivery food in san jose? 

0,2263484288,Sun Jun 21 00:56:30 PDT 2009,NO_QUERY,HeathCastor,I can't believe my phone died while I was trying to switch back to a more important phone call tonight.   's why I should charge it more.

0,2263485183,Sun Jun 21 00:56:40 PDT 2009,NO_QUERY,RozeKasmani,@imranajmain such a sad day! you wont sayang me anymore when you make up with your buah hati! 

0,2263485312,Sun Jun 21 00:56:41 PDT 2009,NO_QUERY,FeynmanC,Went for quick blast round fields and paths with the hounds. My knee ain't right still  #cycling dogs all knackered now though #dogs

0,2263486844,Sun Jun 21 00:56:56 PDT 2009,NO_QUERY,curlygurl576,I'm not feeling so hot 

0,2263486964,Sun Jun 21 00:56:57 PDT 2009,NO_QUERY,hottfoxxymama,It is so hard to c happy couples n b the single one 

0,2263487092,Sun Jun 21 00:56:59 PDT 2009,NO_QUERY,rugger2141,"@Aashay She was terribly boring about the &quot;adventures&quot; in her life, oh, and her belly hung out farther than her boobies, "

0,2263487246,Sun Jun 21 00:57:00 PDT 2009,NO_QUERY,hundred20,off for work... on a sunday...  *K%&amp;6Â§$%* &lt; terrible swear words!

0,2263487255,Sun Jun 21 00:57:00 PDT 2009,NO_QUERY,carolynb3,"Slight headache today-was it the cheap champagne, the homemade redcurrant wine or the copious amounts of other wines? Or all of the above "

0,2263487642,Sun Jun 21 00:57:04 PDT 2009,NO_QUERY,Brainix,@prismsinc You're scaring me with your vast knowledge that you just read on Wikipedia. 

0,2263487798,Sun Jun 21 00:57:05 PDT 2009,NO_QUERY,kleinlauren,Party bust 

0,2263488555,Sun Jun 21 00:57:13 PDT 2009,NO_QUERY,Gill_Fairley,The summer solstice &amp; longest day today. From now on the days get shorter. It kind of feels like downhill to winter 

0,2263488596,Sun Jun 21 00:57:13 PDT 2009,NO_QUERY,passiondivastef,@TwihardsAntiR But let's get real. NO real man sparkles and is so perfect.  It's a nice dream but highly unlikely

0,2263489240,Sun Jun 21 00:57:20 PDT 2009,NO_QUERY,phantompop,@feliciaday My friend dared me to message you. I'm sorry. 

0,2263489639,Sun Jun 21 00:57:24 PDT 2009,NO_QUERY,WeatheredSoul,"is about to watch Scrubs, just cleaned my new piercing and is wondering why the hell he is awake this early "

0,2263489735,Sun Jun 21 00:57:24 PDT 2009,NO_QUERY,immakilla,is really bored back home... shoulda stayed in sj for another night...  o well... happy fathers day!

0,2263489762,Sun Jun 21 00:57:25 PDT 2009,NO_QUERY,myeshaaa,done. should have made that call...damnit lol. ihatemyself 

0,2263489793,Sun Jun 21 00:57:25 PDT 2009,NO_QUERY,mirschandhismac,dropped my mobile yesterday. forgot the pin - now it's locked   dammit!

0,2263490502,Sun Jun 21 00:57:32 PDT 2009,NO_QUERY,AlunHanford,"At work, and not even get paid for it! "

0,2263490845,Sun Jun 21 00:57:35 PDT 2009,NO_QUERY,theguiltshow,using baby's phone to tweet! headache 

0,2263490934,Sun Jun 21 00:57:36 PDT 2009,NO_QUERY,MrsDeer,@katyperry did you get the earrings from the briefcase? I hope they didnt get lost. 

0,2263491117,Sun Jun 21 00:57:38 PDT 2009,NO_QUERY,jasoismynameo,@dreamdressing lol. i always forget how to read korean. i remember most characters one day... and then forget later 

0,2263491143,Sun Jun 21 00:57:38 PDT 2009,NO_QUERY,waldorfs,my nails are so sore 

0,2263491777,Sun Jun 21 00:57:46 PDT 2009,NO_QUERY,ErikaHoney,@1STUD1 I'm missing ur ass babe! That's wat I'm doin  wat u doin...@O_Crazy stop hating haha

0,2263492046,Sun Jun 21 00:57:47 PDT 2009,NO_QUERY,Q80BOY,morning tweeps !! its the start of ANOTHER loong week at home ... doing NOTHING 

0,2263492096,Sun Jun 21 00:57:47 PDT 2009,NO_QUERY,TheeFantab1,@SuckaproofHov and regardless of how bored u might claim to be i still wish i was there. .my white dress is def in the cleaners  lol

0,2263492407,Sun Jun 21 00:57:51 PDT 2009,NO_QUERY,emrabes,has not tweeted in a bit.. heading out into the rain soon 

0,2263492413,Sun Jun 21 00:57:51 PDT 2009,NO_QUERY,jonmoss,"@hasbean Hmmmm, that is not the best to say it politely  Oh man, hope it turns up Steve."

0,2263492563,Sun Jun 21 00:57:53 PDT 2009,NO_QUERY,ladybaglady,i'm officially 18 finally in 8 hours. too bad i dont need to buy cigarettes and it lost its thrill anyways. i dont feel badass anymore 

0,2263492756,Sun Jun 21 00:57:55 PDT 2009,NO_QUERY,Alisha_Herself,eh im bored....  theres nothing to do when its raining 

0,2263493013,Sun Jun 21 00:57:58 PDT 2009,NO_QUERY,amalinaaa,@LittleFletcher awww that's sad 

0,2263493361,Sun Jun 21 00:58:01 PDT 2009,NO_QUERY,sushi0135,lol. do u love me too? 

0,2263493964,Sun Jun 21 00:58:07 PDT 2009,NO_QUERY,Cali_Diva,@casssidyblog awww you sound like me.. my BFF is 350 miles away 

0,2263494491,Sun Jun 21 00:58:13 PDT 2009,NO_QUERY,gg32,"gah, i want to go clothes shopping so much but im saving for my comp... controlling an addiction is sooooo hard. "

0,2263494841,Sun Jun 21 00:58:16 PDT 2009,NO_QUERY,solandri,@zilla_darling Want to go to pole instead of fail exam on IR  If I finish half an hour early I will call you and meet you somewhere!

0,2263495111,Sun Jun 21 00:58:18 PDT 2009,NO_QUERY,annedisasterrr,@blackrugger apologies again but i know zero single females. 

0,2263495255,Sun Jun 21 00:58:20 PDT 2009,NO_QUERY,JulsVuorinen,I want breakfast 

0,2263496044,Sun Jun 21 00:58:28 PDT 2009,NO_QUERY,ronakbhagdev,ColorZilla does not work for Flash website  #fail

0,2263496453,Sun Jun 21 00:58:32 PDT 2009,NO_QUERY,MariaRosario86,why are the &quot;children&quot; so loud???!! 

0,2263496726,Sun Jun 21 00:58:35 PDT 2009,NO_QUERY,INhockey,woke up early cuzz I have to learn today 

0,2263496730,Sun Jun 21 00:58:35 PDT 2009,NO_QUERY,MissChelleBelle,@icedruids im sorry. its so unfair. were ALL very upset about it. 

0,2263497777,Sun Jun 21 00:58:45 PDT 2009,NO_QUERY,gee38l,@appleiphoneapps 

0,2263497802,Sun Jun 21 00:58:45 PDT 2009,NO_QUERY,MargaretJow,whatchu mean season 3 of weeds isn't on netflix instant??!!  

0,2263498134,Sun Jun 21 00:58:49 PDT 2009,NO_QUERY,jmwl,@forresearchonly Totes 

0,2263498212,Sun Jun 21 00:58:49 PDT 2009,NO_QUERY,babyabby214,"I agree, I agree. - prettypinkshoes: I wish I could see them. why canâ€ t you?  Nope. We donâ€ y have fall... http://tumblr.com/xec23v7n9"

0,2263498476,Sun Jun 21 00:58:52 PDT 2009,NO_QUERY,nealchambers,@tamaslorincz @burcuakyol we had some techinical difficulties because the PCs in the lab were in Japanese  but it went all right.

0,2263498515,Sun Jun 21 00:58:53 PDT 2009,NO_QUERY,NNIKKKKI,Cant get onto her FACEBOOK!!!!!!!!!!!!    And feels rly bad for her country (Iran)!

0,2263498634,Sun Jun 21 00:58:54 PDT 2009,NO_QUERY,deals_travel,@jonathanrknight heard Auzzie was cnceled  -news dsnt travel fast in canada lol. That sux but u'll be able 2 get ... http://bit.ly/40Rsb

0,2263498719,Sun Jun 21 00:58:55 PDT 2009,NO_QUERY,drawntolive,I feel bad but I have to go to a concert  I dunno what to do

0,2263499758,Sun Jun 21 00:59:05 PDT 2009,NO_QUERY,ssoun126,@brandi_lynne year one is a rental 

0,2263500093,Sun Jun 21 00:59:09 PDT 2009,NO_QUERY,Cillykat,sun shine where i need it most&lt;3 

0,2263500125,Sun Jun 21 00:59:09 PDT 2009,NO_QUERY,natsukigirl,"I wish I could have gotten into blythe a little sooner, I could have had twice as many dolls for the same amount of money. "

0,2263500185,Sun Jun 21 00:59:10 PDT 2009,NO_QUERY,espicot,"Good morning, not to bad, fresh morning, no sun  but we expect more sun and warm for this afternoon!, Breakfast outside, or inside?"

0,2263500487,Sun Jun 21 00:59:13 PDT 2009,NO_QUERY,HartzandSocks,@periodicjunkie We won't be able to gossip about Lex on the way there now since She's going. 

