sentiment,userid,date,query,userId,text
0,2197757024,Tue Jun 16 15:07:41 PDT 2009,NO_QUERY,KarenSteph,i can feel u all around me. thickening the air im breathing.. 

0,2197757258,Tue Jun 16 15:07:43 PDT 2009,NO_QUERY,JenLovesJoey,"@katiachic Hey girl, I just saw your tweet!  No, I wasn't selected.   He doesn't like me. I'm gonna have to cheat on him with Jordan."

0,2197757277,Tue Jun 16 15:07:43 PDT 2009,NO_QUERY,hylogicalchris,"@danielreid1 I wish I was a proud unicorn :L, Doing new layouts are mean and tiring...and I haven't started doing any yet! "

0,2197757281,Tue Jun 16 15:07:43 PDT 2009,NO_QUERY,robinbobbin13,Rehearsal time! Im still feeling kinda carsick 

0,2197757339,Tue Jun 16 15:07:43 PDT 2009,NO_QUERY,_kitsy, I just heard skins music and wants skins back on 

0,2197757752,Tue Jun 16 15:07:46 PDT 2009,NO_QUERY,jorussell,Knew this wasn't a good-news day. 

0,2197757767,Tue Jun 16 15:07:46 PDT 2009,NO_QUERY,FakeJackHowson,I wish I had a big one to make her so very happy... 

0,2197758140,Tue Jun 16 15:07:48 PDT 2009,NO_QUERY,kkindlen,"@ScottRhodie Yes, yes it does. "

0,2197758179,Tue Jun 16 15:07:48 PDT 2009,NO_QUERY,SarahLovesJls,"off to bed- i feel shocking, my neck hurt like hell   think ive got tonsilitis again..... so wrong *grumble* night casexuals *waves*"

0,2197758233,Tue Jun 16 15:07:48 PDT 2009,NO_QUERY,slvrqt01,i can't see boogie's secrets  and i needz them!!!

0,2197758253,Tue Jun 16 15:07:49 PDT 2009,NO_QUERY,Saffy,@jenblower one of the kittens is excluded from kitten love 

0,2197758344,Tue Jun 16 15:07:49 PDT 2009,NO_QUERY,x_greenmints,@stranger_danger me too  I have to wait until I can go to curry's to get my stuff. I am too lazy to go and spend money D:

0,2197758896,Tue Jun 16 15:07:52 PDT 2009,NO_QUERY,ArlonOsta,@Luphinus Apparently not. 

0,2197759107,Tue Jun 16 15:07:54 PDT 2009,NO_QUERY,DMF94,"Today I tried fasting...it only lasted 18 hours (Good Attempt), but as so as I tasted food I went crazy. That means no food tomorrow "

0,2197759648,Tue Jun 16 15:07:57 PDT 2009,NO_QUERY,themarvelous,Pam might stay late tonight too!    FML

0,2197759667,Tue Jun 16 15:07:57 PDT 2009,NO_QUERY,Karabella7_4,@yolibonilla hey.. cute pic...  and seriously its like un-seasonably cold here... 

0,2197759757,Tue Jun 16 15:07:57 PDT 2009,NO_QUERY,sophanny,@tommcfly your duet with @jonasbrothers was amazing. i wish i'd been there 

0,2197759824,Tue Jun 16 15:07:58 PDT 2009,NO_QUERY,jessicuhahax3,@heeeyitsapreeel Can't im in sd. Have fun thouugh 

0,2197759889,Tue Jun 16 15:07:58 PDT 2009,NO_QUERY,borigurl08,Having Friends fight is the worst feeling ever! 

0,2197759951,Tue Jun 16 15:07:59 PDT 2009,NO_QUERY,thepanicroom09,Back from the beach.................bummed 

0,2197760029,Tue Jun 16 15:07:59 PDT 2009,NO_QUERY,tsand,"Do you have fun at work? I do, but think most don't. "

0,2197760033,Tue Jun 16 15:07:59 PDT 2009,NO_QUERY,Annabel_Boyd,DAMN. missed tourist #6  

0,2197760137,Tue Jun 16 15:08:00 PDT 2009,NO_QUERY,twinkleworm,i think the heat fried my brains today and summer is barely getting started 

0,2197760404,Tue Jun 16 15:08:01 PDT 2009,NO_QUERY,GGSerena,@lifegrd31 truth! youre not a gg member anymores??? 

0,2197760658,Tue Jun 16 15:08:03 PDT 2009,NO_QUERY,MilaFHarris,"I donÂ´t wanna do the level test of math, that is tomorrow "

0,2197760707,Tue Jun 16 15:08:03 PDT 2009,NO_QUERY,alinesenas,"I almost forget, portuguese test too, I don't know nothing too "

0,2197760718,Tue Jun 16 15:08:03 PDT 2009,NO_QUERY,karinamack,Wishing I had a web cam cause I don't ever get to do the daily live chats with Dax from TMZ and today Nina and Harvey were on there! 

0,2197760806,Tue Jun 16 15:08:03 PDT 2009,NO_QUERY,carolnovakc,@mcflymusic neighter do I.. 

0,2197761415,Tue Jun 16 15:08:07 PDT 2009,NO_QUERY,Shelliebabeey,waiting in the disney parking lot for nadolee... oh how i wish i can go into the park  such a tease!!

0,2197761532,Tue Jun 16 15:08:08 PDT 2009,NO_QUERY,Starletty,Wishing i were back in nyc with my pals 

0,2197761778,Tue Jun 16 15:08:09 PDT 2009,NO_QUERY,lozzam77,"I've had the most bizarre weekend, didn't like the feeling it gave me "

0,2197761840,Tue Jun 16 15:08:09 PDT 2009,NO_QUERY,MeganShearstone,@stephenfry maintenance! Happens often.  lol

0,2197762090,Tue Jun 16 15:08:11 PDT 2009,NO_QUERY,Revolver956,"feels sick, I don't think a cookie will do it this time.  cheer up?"

0,2197762126,Tue Jun 16 15:08:11 PDT 2009,NO_QUERY,gillymo,I think Cairon should go. I feel sorry for Halfwit 

0,2197762178,Tue Jun 16 15:08:11 PDT 2009,NO_QUERY,chloethelwell,@tommcfly Get Harry back on Twitter!! Somehow! I miss his tweets! Really I do  haha xxxx

0,2197762260,Tue Jun 16 15:08:12 PDT 2009,NO_QUERY,Joesther,"@laura_dolcepics @always_v   no other damage, BUT can't find hub's keys..hope it wasn't in the van!! Imagine keys to house, van, apts, FS."

0,2197762261,Tue Jun 16 15:08:12 PDT 2009,NO_QUERY,Jenny_Araujo,Awww I just went to what used to be my home.....  awww

0,2197762554,Tue Jun 16 15:08:13 PDT 2009,NO_QUERY,Meggylyn,misses talking to him 

0,2197762948,Tue Jun 16 15:08:15 PDT 2009,NO_QUERY,Holldoll200,"had fun with Jade on her birthday, saw 'imagine that' it was adorable! Got a scarf and new sunglasses, cause my other ones broke "

0,2197763344,Tue Jun 16 15:08:17 PDT 2009,NO_QUERY,AJWilz,gonna go to the signing party tonight and then geography 

0,2197763379,Tue Jun 16 15:08:18 PDT 2009,NO_QUERY,EndlessWire,Played my last game of backgammon with Rew-anne until late August   Hanno un grande viaggio Rewan!!! verra perdere!

0,2197763479,Tue Jun 16 15:08:18 PDT 2009,NO_QUERY,SabrinaR12,@SpenRiv Please tell me u are ok?? 

0,2197763941,Tue Jun 16 15:08:21 PDT 2009,NO_QUERY,desde_debajo,I'm ready to go home. 

0,2197764274,Tue Jun 16 15:08:22 PDT 2009,NO_QUERY,pgantley,@stephenfry it was as down as I feel 

0,2197764435,Tue Jun 16 15:08:23 PDT 2009,NO_QUERY,ashleyreigh,i wanna go home 

0,2197764580,Tue Jun 16 15:08:24 PDT 2009,NO_QUERY,Jem_x,*sighs* Writing never used to be this hard. 

0,2197765001,Tue Jun 16 15:08:26 PDT 2009,NO_QUERY,EmilyNatanya,"@stephenfry Yup, down down down "

0,2197765092,Tue Jun 16 15:08:27 PDT 2009,NO_QUERY,tjsr,"Smashed it in to work along Malvern Rd, until glasses fogged right up and couldn't even see parked cars "

0,2197765297,Tue Jun 16 15:08:30 PDT 2009,NO_QUERY,JakeTrujillo,@hilaurenjohnson you better hurry back here my heads about to explode 

0,2197765578,Tue Jun 16 15:08:30 PDT 2009,NO_QUERY,vickaay,end of the year field trip was fun today! i hurt my butt while roller skating 

0,2197765598,Tue Jun 16 15:08:30 PDT 2009,NO_QUERY,ANGiExcoco3,@ddlovato whats wrong with her dad? 

0,2197765750,Tue Jun 16 15:08:31 PDT 2009,NO_QUERY,polvadore,How do you explain death to a 5 year old?? 

0,2197766193,Tue Jun 16 15:08:33 PDT 2009,NO_QUERY,suzannerom,Just ran 5.5 miles now I have to go to work 230-1115  boo

0,2197766206,Tue Jun 16 15:08:33 PDT 2009,NO_QUERY,luckygnahhh,"@ShenaniganJenn omg, that makes me sad thinking about it  what would we all do?!"

0,2197766678,Tue Jun 16 15:08:36 PDT 2009,NO_QUERY,TEMPiiE,@KingMajesty I guess I'm not going to go 

0,2197766696,Tue Jun 16 15:08:36 PDT 2009,NO_QUERY,Calibanie,hmmm note to self... keep a closer eye on phone bills :s new phone = data = money 

0,2197795224,Tue Jun 16 15:11:17 PDT 2009,NO_QUERY,Spangie,@SteveLL I wish I had a pool at my apt. 

0,2197795493,Tue Jun 16 15:11:18 PDT 2009,NO_QUERY,stephanieRreed,wishes that i could actually fall asleep like normal people 

0,2197795577,Tue Jun 16 15:11:19 PDT 2009,NO_QUERY,anniee_x,Dental work = massss amounts of pain 

0,2197795738,Tue Jun 16 15:11:20 PDT 2009,NO_QUERY,speakingnoword,i can't see the signes 

0,2197795747,Tue Jun 16 15:11:20 PDT 2009,NO_QUERY,mike_nelson,@momtotwinsons Sorry I couldn't get that autograph for you  I didn't even get one. It's kind of unprofessional when ur workin with someone

0,2197795812,Tue Jun 16 15:11:20 PDT 2009,NO_QUERY,No_sleep,The music i listen to these days is too 'Purple'. 

0,2197795972,Tue Jun 16 15:11:21 PDT 2009,NO_QUERY,duncanchew,has swollen right eyelid 

0,2197796058,Tue Jun 16 15:11:21 PDT 2009,NO_QUERY,VsMama,"Got to the U about 45 min ago. Up in Vs room and she's back gettin' poked.  Jer's not here yet, so I'm w the girls..."

0,2197796173,Tue Jun 16 15:11:22 PDT 2009,NO_QUERY,jasontill,No bottles of ice cold San Miguel at the filling station so made do with Wifebeater.  Doesn't come close 

0,2197796194,Tue Jun 16 15:11:22 PDT 2009,NO_QUERY,bigchuckd,no internet 2night. Thanks Time Warner  Charlie

0,2197796356,Tue Jun 16 15:11:23 PDT 2009,NO_QUERY,_K_Money_,Forgot where i parked 

0,2197796464,Tue Jun 16 15:11:24 PDT 2009,NO_QUERY,mrsz_flaca,Damn my feet hurt needing a massage still got an hour n half left of work 

0,2197796519,Tue Jun 16 15:11:24 PDT 2009,NO_QUERY,yulixenexai,"damn this stupid rain! I didnt even bring a sweater, boots or umbrella today! HOY! "

0,2197797172,Tue Jun 16 15:11:28 PDT 2009,NO_QUERY,misocutesoup,Woke up at 5am  so unfair

0,2197797277,Tue Jun 16 15:11:28 PDT 2009,NO_QUERY,kelseymccool,@mileycyrus Why did you have to be born in Tennessee?! Your tickets are so hard to get for the Nashville show 

0,2197797506,Tue Jun 16 15:11:30 PDT 2009,NO_QUERY,rihannadaily,"I hate spammers, hackers and everyone who wants to take advantage on little fansites like RD "

0,2197797793,Tue Jun 16 15:11:31 PDT 2009,NO_QUERY,jenniferpiazza,Watching chelsey lately sucks when your sick because you cant laugh!! 

0,2197798216,Tue Jun 16 15:11:34 PDT 2009,NO_QUERY,cryptictoaster,"@ashleyfrigginb yeah, i'm working tomorrow  i'm off tuesdays, fridays, and the weekends"

0,2197798359,Tue Jun 16 15:11:35 PDT 2009,NO_QUERY,Jsias99,Working  want to have some drinks?

0,2197798635,Tue Jun 16 15:11:36 PDT 2009,NO_QUERY,Karen230683,@VioletsCRUK @glasgowlassy hello #twitterpussies i've  missed ya tonight 

0,2197798977,Tue Jun 16 15:11:39 PDT 2009,NO_QUERY,angelaraew,Nothing from the builder yet   Praying we hear something SOON - we want to move in JUNE

0,2197799160,Tue Jun 16 15:11:40 PDT 2009,NO_QUERY,SelfHelpGoddess,Twitter seems to be having problems today... 

0,2197799170,Tue Jun 16 15:11:40 PDT 2009,NO_QUERY,clarabethcreep,Goddamnit I love UFC...and WEC...and all of the rest. Urijah is amazing. &lt;3 (...so is Cam but he never fights.  )

0,2197799284,Tue Jun 16 15:11:40 PDT 2009,NO_QUERY,annastella,"URGH I want my LVATT CD!  I should have just gone to Target to buy it. I'm so frustrated, you have no idea."

0,2197799696,Tue Jun 16 15:11:43 PDT 2009,NO_QUERY,ctinechung,just said no to an invite to a stylist event in LA w/ kardashians 

0,2197799803,Tue Jun 16 15:11:43 PDT 2009,NO_QUERY,mekatek,&quot;no anestisia for you since it doesn't work on you anyway&quot; 

0,2197800052,Tue Jun 16 15:11:45 PDT 2009,NO_QUERY,MorningMajor,"@thelane Boy, have we got to sort your messenger out!!!!! "

0,2197800281,Tue Jun 16 15:11:46 PDT 2009,NO_QUERY,AlexLovesNathan,:/ aaaaahhhhh brilliant!! 

0,2197800654,Tue Jun 16 15:11:48 PDT 2009,NO_QUERY,MRIGUY129, says it all

0,2197800912,Tue Jun 16 15:11:50 PDT 2009,NO_QUERY,abbiealmasco,"Im exchanging text messages with Basilio and the movie is still on,but  I'm really sleepy  I might drift off so, MORNIGHT,Twitterians! xx"

0,2197801440,Tue Jun 16 15:11:53 PDT 2009,NO_QUERY,laylabear1,"is busy with Fashion show stuff, l didnt realise how stresful building a simple catwalk would be  x"

0,2197801930,Tue Jun 16 15:11:56 PDT 2009,NO_QUERY,hannahmeiton,@ScottH1979  sorry it will have to be August...I'm traveling all July 

0,2197802079,Tue Jun 16 15:11:57 PDT 2009,NO_QUERY,amandavolz,"this one's for you, Hemily! stalker. watching clips of Jesse Joyce on Red Eye, since i can't stay up that late anymore "

0,2197802111,Tue Jun 16 15:11:57 PDT 2009,NO_QUERY,iceisawesome,@CurtaBoy agreed! (: it's getting a lot of mixed reviews however and it makes me sad.  but I LOVE it!

0,2197802329,Tue Jun 16 15:11:58 PDT 2009,NO_QUERY,julie22macy,take that tickets still aren't heree! not happy at all 

0,2197802363,Tue Jun 16 15:11:58 PDT 2009,NO_QUERY,diddilovesmusic,#haveyouever written a test and didn't learn until the night before the test? well that's what i do all the time  i don't mean to though.

0,2197802946,Tue Jun 16 15:12:01 PDT 2009,NO_QUERY,bajajacks,Haven't been able to get twitter on the computer all day     anyone else having trouble?

0,2197803283,Tue Jun 16 15:12:03 PDT 2009,NO_QUERY,TymelMiles,Bored as hell my first day of summer and nothing to do 

0,2197803467,Tue Jun 16 15:12:04 PDT 2009,NO_QUERY,dgregryc,@Harvey1966 twitter went down  #GES

0,2197803913,Tue Jun 16 15:12:07 PDT 2009,NO_QUERY,Sopheliaophelia,I started tanning wayy too early this year. Tanlines are fading 

0,2197804016,Tue Jun 16 15:12:07 PDT 2009,NO_QUERY,PurestLight,@igwarrender  well its upset me even though i knew it was coming via the trailers  Think he comes back in someone elses body or something

0,2197804348,Tue Jun 16 15:12:09 PDT 2009,NO_QUERY,sereneclaire,Pootling around getting ready to hit the hay. Keep thinking there's something missing... what is it again?? Oh yes... a husband 

0,2197804485,Tue Jun 16 15:12:09 PDT 2009,NO_QUERY,ibushra,i hate it wen i miss all the action :/ dam man this stuff is good  XD every1s gone 

0,2197805166,Tue Jun 16 15:12:13 PDT 2009,NO_QUERY,leannelaine,"Day 2 of Masters program: Completed 10 min presentation, now moving on to my 130 pages of assigned article reading for TONIGHT "

0,2197805420,Tue Jun 16 15:12:15 PDT 2009,NO_QUERY,MileyObsessedx,Why does miley keep hanging up on interviews.What the Kidd people where saying about her when she hung up was mean 

0,2197805861,Tue Jun 16 15:12:17 PDT 2009,NO_QUERY,xNicoleAlinex,I am all kinds of sore today and I don't know why    Need a massage and a couple aspirin lol

0,2197805979,Tue Jun 16 15:12:18 PDT 2009,NO_QUERY,AliciaGold,"waaa! just got home, soooo hungry  got dinner in front of me, think i will watch a movie and go to bed! nigh all xxx"

0,2197806243,Tue Jun 16 15:12:19 PDT 2009,NO_QUERY,hannah106,@stephenfry twitter has been down 

0,2197806481,Tue Jun 16 15:12:20 PDT 2009,NO_QUERY,Inlovesd,@lexylynn I know I was looking for you  but yeah hit me up when u come back so we can hit the pool 

0,2197806482,Tue Jun 16 15:12:20 PDT 2009,NO_QUERY,stephenweppler,South Beach Diet Day 3 - No Caffeine + No Sugar = 2 Day Headache 

0,2197806750,Tue Jun 16 15:12:22 PDT 2009,NO_QUERY,jazify,something's wrong with my tweetdeck. 

0,2197807000,Tue Jun 16 15:12:23 PDT 2009,NO_QUERY,TheJohn_M,I miss EmÃ­lia... 

0,2197807092,Tue Jun 16 15:12:24 PDT 2009,NO_QUERY,xxbensxx,"Lack of things going on, so lack of tweets "

0,2197807248,Tue Jun 16 15:12:25 PDT 2009,NO_QUERY,sungangs,Don't want to go home tomorrow 

0,2197807335,Tue Jun 16 15:12:25 PDT 2009,NO_QUERY,socialrockboy,Poor Lindsay..  Do we need to have a celebrity edition of Intervention ?

0,2197807445,Tue Jun 16 15:12:26 PDT 2009,NO_QUERY,eternityfalconi,"@evafalconi I want to go to sleep, Still have a lot to study for tomorrows exam "

0,2197807455,Tue Jun 16 15:12:27 PDT 2009,NO_QUERY,FeelingFan,@ThisisDavina Can't believe Rodrigo voted for Halfwit  I thought they had something going on!!!

0,2197807515,Tue Jun 16 15:12:26 PDT 2009,NO_QUERY,dziedzam,is ready for bed. even though it's only 5 

0,2197807555,Tue Jun 16 15:12:26 PDT 2009,NO_QUERY,geetly,"has finally vowed not to have anymore desserts in her fridge.She needs sweets, she eats an apple  Give me strength and wisdom,good Lord!"

0,2197807774,Tue Jun 16 15:12:28 PDT 2009,NO_QUERY,caitlindean,I'm not a very good hipster today. 

0,2197807937,Tue Jun 16 15:12:29 PDT 2009,NO_QUERY,Jackierob,Very excited about new iphone...hope I can download before work or can't do it until Friday 

0,2197807998,Tue Jun 16 15:12:29 PDT 2009,NO_QUERY,Jeniffer96, why must i miss EVERYTHING  apparently #LVATT or #LinesVinesAndTryingTimes was trending &amp; where was i? sleeping

0,2197808373,Tue Jun 16 15:12:31 PDT 2009,NO_QUERY,kebukebu,"Left my car out on the curb over the weekend to let the rain clean it off. No rain, but got a ticket for not doing my safety inspection "

0,2197808435,Tue Jun 16 15:12:32 PDT 2009,NO_QUERY,STFUitsSARA,i look like i got punched in the eye. it hurts 

0,2197808553,Tue Jun 16 15:12:32 PDT 2009,NO_QUERY,itsmealysha,@QueenBitch93 well yeah aha xD but my dad won't wake up  but i'm so gonna get it!!!

0,2197808748,Tue Jun 16 15:12:33 PDT 2009,NO_QUERY,PaulaAbdulRocks,@PaulaAbdul Hey paula i heard it on simon and paula central plez dnt leave idol there would be no idol without you  luv u paula x0x 

0,2197808996,Tue Jun 16 15:12:35 PDT 2009,NO_QUERY,vintagy,practicing piano and craving watermelon slush 

0,2197809661,Tue Jun 16 15:12:39 PDT 2009,NO_QUERY,katiebruce,@AdamBoreland aw babe! You make me miss ballet. 

0,2197809677,Tue Jun 16 15:12:39 PDT 2009,NO_QUERY,mwotitzk,Trying to relax away this headache 

0,2197809735,Tue Jun 16 15:12:39 PDT 2009,NO_QUERY,Karen230683,@Firequacker I know  poor thing

0,2197810035,Tue Jun 16 15:12:41 PDT 2009,NO_QUERY,anthonypants,twitter is slow today after that maintenance 

0,2197810111,Tue Jun 16 15:12:41 PDT 2009,NO_QUERY,yomommameche,I think I am done swimming for the summer  I'm too dark I don't recognize myself...

0,2197818042,Tue Jun 16 15:13:28 PDT 2009,NO_QUERY,shew4,"I should be sleeping before work, but I can't turn my brain off  lol"

0,2197818377,Tue Jun 16 15:13:29 PDT 2009,NO_QUERY,zooweeh,just saw a free whopper receipt in the trash. I didn't pick it up 

0,2197818678,Tue Jun 16 15:13:31 PDT 2009,NO_QUERY,RSingleterry,is cleaning 

0,2197818947,Tue Jun 16 15:13:33 PDT 2009,NO_QUERY,cgazzia,back on twitter..europe was amazing!!!! now unpacking 

0,2197819060,Tue Jun 16 15:13:33 PDT 2009,NO_QUERY,stevensparkman,so what's everyone got going on this evening? i still have another hour before i get to go home 

0,2197819296,Tue Jun 16 15:13:35 PDT 2009,NO_QUERY,ibushra,bye ppl/ ghosts  x

0,2197819300,Tue Jun 16 15:13:35 PDT 2009,NO_QUERY,JK85,@EwMedia seems to be the case with most episodes this season  Not as good as season 1. Mr Derby really is saving the show this time.

0,2197819301,Tue Jun 16 15:13:35 PDT 2009,NO_QUERY,LookItsLewis,"firefox your so good thats why i click a link and you turn an unordered list into an ordered one, no matter how much you refresh "

0,2197819343,Tue Jun 16 15:13:35 PDT 2009,NO_QUERY,VAMBAY,@alliekinsss baaaby. call my mom's phone. I think I called your gma's house but no one answered 

0,2197820031,Tue Jun 16 15:13:39 PDT 2009,NO_QUERY,briandorsey,"Sadly, I can't make it to OS Bridge.  @osbridge - can I transfer my ticket to someone else?"

0,2197820283,Tue Jun 16 15:13:40 PDT 2009,NO_QUERY,evelyn_m,All my replies are wiped out on Tweet deck since it went thru maintenance.  It looks so EMPTY hehe

0,2197820683,Tue Jun 16 15:13:43 PDT 2009,NO_QUERY,Cazzarama1,@stephenfry it's been down  glad you enjoyed the Ballet. xx

0,2197820746,Tue Jun 16 15:13:43 PDT 2009,NO_QUERY,mikesouza,"@thegraysadie how about if I just bring my duckpin bowling skills instead?  Oh wait, I don't have any "

0,2197820864,Tue Jun 16 15:13:44 PDT 2009,NO_QUERY,saisschmuck,"@NINASKY That's nothing. I live near a firestation, within 750 feet of busy interstate, and stupid train horns from all over the place. "

0,2197821430,Tue Jun 16 15:13:47 PDT 2009,NO_QUERY,ohthatellen,i hate cramps 

0,2197821749,Tue Jun 16 15:13:49 PDT 2009,NO_QUERY,Lieslvz,Misses Mr.Pepper 

0,2197821766,Tue Jun 16 15:13:49 PDT 2009,NO_QUERY,mattaleao,"@MarkStAmant Can you get behind a hochevar pickup this week in a QS heavy, thin WW, 5-player keeper league? If not, it'll be contreras "

0,2197822083,Tue Jun 16 15:13:51 PDT 2009,NO_QUERY,pearlbones,@Lannaa i got really happy someone had tweeted more than me. turns out i was wrong   3105  euuuugh

0,2197822145,Tue Jun 16 15:13:51 PDT 2009,NO_QUERY,milly_2000,@PaulaAbdul didnt you have a family BBQ recently? or maybe that was just with your mom? my parents are divorced too 

0,2197822427,Tue Jun 16 15:13:53 PDT 2009,NO_QUERY,clampsoup,@loco_coco_12 maybe I will later.....Im pooped!  I have to clean my house 

0,2197822435,Tue Jun 16 15:13:53 PDT 2009,NO_QUERY,sydbob,hannahs coming at 4 instead of 3 

0,2197822467,Tue Jun 16 15:13:53 PDT 2009,NO_QUERY,CalamityCharls,@shitshoveller Poor Kay  x

0,2197822833,Tue Jun 16 15:13:55 PDT 2009,NO_QUERY,CheChexoxo,#MyFirstTime in a car accident wasnt with my own car       Sorry @leroyjabari!!! I've been much better with driving tho..lol

0,2197822883,Tue Jun 16 15:13:55 PDT 2009,NO_QUERY,DoctorClaws,New Bed from Ikea in the end but i had to pay a hooker extra to set it up before we sleep together on it. she lost a screw she will pay 

0,2197822919,Tue Jun 16 15:13:55 PDT 2009,NO_QUERY,crazyco44,I just found out that my favorite show &quot;Life&quot; got cancelled   I freaking hate NBC!!

0,2197822949,Tue Jun 16 15:13:55 PDT 2009,NO_QUERY,jocelynumengan,is new to twitter and is sad to see that there are soooo many haters in the world 

0,2197823524,Tue Jun 16 15:13:59 PDT 2009,NO_QUERY,aliciamielke,"is writing one more paper and then no more for summer semester, then finishing outline for history, and more english... summer school "

0,2197823565,Tue Jun 16 15:13:59 PDT 2009,NO_QUERY,mom2orw,Ugggh- O's running a fever on vacation. 

0,2197823961,Tue Jun 16 15:14:01 PDT 2009,NO_QUERY,MellyMels,;( i want a girlfriend 

0,2197824183,Tue Jun 16 15:14:02 PDT 2009,NO_QUERY,Jgrdaniel,oh why do we sin so much 

0,2197824680,Tue Jun 16 15:14:05 PDT 2009,NO_QUERY,justinenaraval,starting to hate school 

0,2197824682,Tue Jun 16 15:14:05 PDT 2009,NO_QUERY,jeseka86,@Destini41  any news on the girl yet desti ??? please let us know when u do ... were all worried 

0,2197824687,Tue Jun 16 15:14:05 PDT 2009,NO_QUERY,Emilyx0,@chriscornell Wish I could've seen you in Dublin 

0,2197824694,Tue Jun 16 15:14:05 PDT 2009,NO_QUERY,damieri,watching the storm and csi... it's hailing i think 

0,2197824977,Tue Jun 16 15:14:07 PDT 2009,NO_QUERY,BethTN09,@belleann IK! i don't know what happened to it! i Am SOOOOO sorry  i wish i would have let you keep it all day... damnit &amp; my stupidity

0,2197825221,Tue Jun 16 15:14:08 PDT 2009,NO_QUERY,alexkata,guys whats up ??? i am new here can you say something ..i am feeling 

0,2197825328,Tue Jun 16 15:14:09 PDT 2009,NO_QUERY,xoxo_Linett,"Shaun just left, I miss him already "

0,2197825333,Tue Jun 16 15:14:09 PDT 2009,NO_QUERY,MissHKS,@ODarling Dunno...nearly last 

0,2197825507,Tue Jun 16 15:14:10 PDT 2009,NO_QUERY,paulwmk,need a cuddle 

0,2197826106,Tue Jun 16 15:14:13 PDT 2009,NO_QUERY,bunnyyychow,HTC touch diamond 2 = teh sex. me = teh broke 

0,2197826318,Tue Jun 16 15:14:14 PDT 2009,NO_QUERY,Oafy,It's a sad day today...A bear friend died due to DEC stupidity 

0,2197827420,Tue Jun 16 15:14:20 PDT 2009,NO_QUERY,kmh4200,@sefrancis They did until they left. Now I haven't heard from any of them since 

0,2197827427,Tue Jun 16 15:14:20 PDT 2009,NO_QUERY,Crissi807,Why's it so cold outside? 

0,2197827502,Tue Jun 16 15:14:21 PDT 2009,NO_QUERY,ebonylovesyoux,"oh god, p-e fist period tomorrow. i really cant be arsed "

0,2197827535,Tue Jun 16 15:14:21 PDT 2009,NO_QUERY,ikkle87,@squarespace have you had any non american winners yet  I'm in the UK and really wanna win

0,2197827618,Tue Jun 16 15:14:21 PDT 2009,NO_QUERY,jaybutcher,thinks he may have just powernapped as he appears to be fully awake now 

0,2197827672,Tue Jun 16 15:14:22 PDT 2009,NO_QUERY,rocishot,@rocishot come on guys #ihaveaproblemwith getting 8 more followers to get me to the 700 mark pleeeeeeeeaase help 

0,2197827687,Tue Jun 16 15:14:22 PDT 2009,NO_QUERY,MidlightRain,AND FOOD. Thats what i also want. My stomach is eating itself. 

0,2197827729,Tue Jun 16 15:14:22 PDT 2009,NO_QUERY,SizzleMayfield,#haveyouever is falling off the charts fast 

0,2197827886,Tue Jun 16 15:14:23 PDT 2009,NO_QUERY,xxxmariaxxxx,weird people keep emailing me... 

0,2197827983,Tue Jun 16 15:14:24 PDT 2009,NO_QUERY,ChloePink11104,can't find my BFF Jackie 

0,2197828326,Tue Jun 16 15:14:25 PDT 2009,NO_QUERY,stayjassie,Its raining so hard and I have my good hair in 

0,2197828557,Tue Jun 16 15:14:26 PDT 2009,NO_QUERY,portsidetwd,...I bet I won't be able to move in the morning  ah well that's what pain killers are for! Http://the-port.co.uk

0,2197828580,Tue Jun 16 15:14:26 PDT 2009,NO_QUERY,NatashaTutty,Woop. Most of the day off tomorrow...though i have to go in for 3.25 for twilight 

0,2197828623,Tue Jun 16 15:14:26 PDT 2009,NO_QUERY,CatMeagher,going to work when what i really want to do is hang out with @besskretsinger  come viiissiitt meee!

0,2197829056,Tue Jun 16 15:14:29 PDT 2009,NO_QUERY,supadupafresh,MUTHAFUCKIN CRISIS! MY BLACK ASS IS HAVING A MELTDOWN! http://twitpic.com/7kj5l no more left 

0,2197829224,Tue Jun 16 15:14:29 PDT 2009,NO_QUERY,watermelon_pear,guys..my sunburn is peeling and it looks like i have dry skin. WHY!?!? that's soooo embarrassing. it's not dry skin. it's my sunburn. 

0,2197829310,Tue Jun 16 15:14:30 PDT 2009,NO_QUERY,bobberss,WHY DOES MY LIFE SUCK??? I HAVE ABSOLUTE WORST LUCK IN THE WORLD!!! 

