sentiment,userid,date,query,userId,text0,1966821310,Fri May 29 18:27:42 PDT 2009,NO_QUERY,opiekent,LOL a new puppet commercial... kobe jumping into a car.. i thought lebron was going to run him over  lol

0,1966821424,Fri May 29 18:27:43 PDT 2009,NO_QUERY,Natalan,wants Matt back 

0,1966821717,Fri May 29 18:27:45 PDT 2009,NO_QUERY,Sweet_As_AJ,@youngscraphics LOL I ate it at this place in my hometown! Sorry! 

0,1966821784,Fri May 29 18:27:45 PDT 2009,NO_QUERY,marly3,I took em haha cause i didn't get any.  it wasn't 3d

0,1966821792,Fri May 29 18:27:45 PDT 2009,NO_QUERY,imarriage,@jasonarredondo wow. heartbreaking 

0,1966821914,Fri May 29 18:27:46 PDT 2009,NO_QUERY,dellamargaretta,@RYANWWILLIAMS wha? what did you pass? um... i miss you  i wanna dance on table tops with you

0,1966822268,Fri May 29 18:27:48 PDT 2009,NO_QUERY,stepheatyerface,Malllllllll... its gonna suck 

0,1966822412,Fri May 29 18:27:49 PDT 2009,NO_QUERY,sinosplice,@nileshk @asciigod I think he got in through an old Wordpress install I forgot to delete. 

0,1966822648,Fri May 29 18:27:52 PDT 2009,NO_QUERY,sweetrush,@VERSE2HOOK  who broke your heart Verse???? 

0,1966822733,Fri May 29 18:27:51 PDT 2009,NO_QUERY,felicity_aug20,I just want to go home. 

0,1966822839,Fri May 29 18:27:52 PDT 2009,NO_QUERY,BCJelly,"@actionamanda i hate no playtime  i hate getting up at 7:30 in the morning, and i hate being tired by 9pm...wow i hate a lot of things"

0,1966822861,Fri May 29 18:27:52 PDT 2009,NO_QUERY,youtalk_toomuch,So exhausted from shopping. The heat is amazing !!!!! Miss cali  especially my mish !!!

0,1966825336,Fri May 29 18:28:08 PDT 2009,NO_QUERY,sunbot,I wish time would fast foward so my sister can be here... so I can have someone to talk to everyday again... 

0,1966825427,Fri May 29 18:28:08 PDT 2009,NO_QUERY,LoveAndHearts22,"@DearPanda Lol, momss..... they're always anoyying. "

0,1966825522,Fri May 29 18:28:09 PDT 2009,NO_QUERY,RM16JB,@mitchelmusso i didn't know where u're live chat was!! guess i missed it!! 

0,1966825913,Fri May 29 18:28:11 PDT 2009,NO_QUERY,eleven8,@TEYANATAYLOR awww poor thing 

0,1966825969,Fri May 29 18:28:12 PDT 2009,NO_QUERY,breathejess,Drag Me To Hell was fucking creepy as shit. I hate you Brie. 

0,1966826084,Fri May 29 18:28:12 PDT 2009,NO_QUERY,QueenNiNi,@TEYANATAYLOR  whats wrong?

0,1966826454,Fri May 29 18:28:15 PDT 2009,NO_QUERY,omgitsxliss,"@ellohv_ee  im determined to like, start being friends with him. you know. instead of just a little &quot;hi&quot;"

0,1966826517,Fri May 29 18:28:15 PDT 2009,NO_QUERY,rach_garfunkel,@TBEAustralia   at least your not sick... have a good gig you guys.  Hopefully the rain will stay away.

0,1966826777,Fri May 29 18:28:17 PDT 2009,NO_QUERY,NeilaRich,"@SuckonDz oh my goodness, i hope he is okay "

0,1966827090,Fri May 29 18:28:19 PDT 2009,NO_QUERY,wfrv5,"@bigpieps  That's why great, locally owned breakfast restaurants like Chef's Hat in De Pere have to stop serving breakfast - making me "

0,1966827145,Fri May 29 18:28:19 PDT 2009,NO_QUERY,findyourqi,Mourning the sad loss of a work colleague. Rest in peace Ron - we'll miss you. 

0,1966827404,Fri May 29 18:28:21 PDT 2009,NO_QUERY,lelandgirl,@hollia369 she ignored my call 

0,1966827468,Fri May 29 18:28:22 PDT 2009,NO_QUERY,enitaaaa,@iSUCK Kajo is bailing tonight cuz he's sick  I feel bad.

0,1966827577,Fri May 29 18:28:22 PDT 2009,NO_QUERY,dearvaliant,The episode of that 70s show that hw watching is making me kind me depressed. Class day was today. What am i doing with my life? Fuck. 

0,1966829036,Fri May 29 18:28:32 PDT 2009,NO_QUERY,sweetsammie84,#myweakness a love that I no longer have  Oh an also food and twitter. http://myloc.me/22sj

0,1966829630,Fri May 29 18:28:36 PDT 2009,NO_QUERY,Awesome_Cougars,@monster_laura I sent at least 10 of those. Hope you're ok   come on msn if you want an inappropriate and drunken chat. xx

0,1966829774,Fri May 29 18:28:37 PDT 2009,NO_QUERY,dannigyrl,Listening to Ne-yo's Mirror. Why am I torturing myself? Ugh! Frustrated 

0,1966829803,Fri May 29 18:28:37 PDT 2009,NO_QUERY,kiaraaaa,i really don't want pirates to end.  how upsetting.  i love it so much. and i'm gonna miss it.

0,1966830524,Fri May 29 18:28:41 PDT 2009,NO_QUERY,meeshers,Car is acting up again. 

0,1966830685,Fri May 29 18:28:42 PDT 2009,NO_QUERY,ninasburningup,miss may 24th SOOO MUUCH! the best day E-V-E-R.. de verdade 

0,1966830735,Fri May 29 18:28:43 PDT 2009,NO_QUERY,farrock438,I'm @ CarrabbaLs celebrating a friends birthday..... So why do I feel so weird?...maybe b/c he use to be my best friend...... 

0,1966830793,Fri May 29 18:28:43 PDT 2009,NO_QUERY,adam9998,Back from work! bed time but cant sleep  bad times

0,1966831013,Fri May 29 18:28:45 PDT 2009,NO_QUERY,dia_paula,"at Tula for appetizer and drinks. No Shish Kabab tonight  It's ok, I had my Zeppolis earlier.  http://twitpic.com/685uo"

0,1966831063,Fri May 29 18:28:45 PDT 2009,NO_QUERY,smileybubbbles,i can barely breath!!! i have no idea whats is wrong with me!! 

0,1966831156,Fri May 29 18:28:45 PDT 2009,NO_QUERY,MrsMCR1, me and old bf not together.... now im totally single

0,1966831160,Fri May 29 18:28:45 PDT 2009,NO_QUERY,shaundiviney,Ehhhh my bones hurt  why the fuck did I buy flowers last night? Haha

0,1966831332,Fri May 29 18:28:47 PDT 2009,NO_QUERY,sentachristine,@kirstiealley I totally love you.. I will miss ur tweets 

0,1966831714,Fri May 29 18:28:49 PDT 2009,NO_QUERY,savingunicorns,Making phone calls I don't want to make... Have to work at 9. Say some prayers it will probably be a week. 

0,1966831914,Fri May 29 18:28:50 PDT 2009,NO_QUERY,specialagentZD,My cousin lost my sock 

0,1966832224,Fri May 29 18:28:53 PDT 2009,NO_QUERY,LarryWalksFast,@AndreaApplegate:  I thought I was already a 10.  

0,1966832257,Fri May 29 18:28:53 PDT 2009,NO_QUERY,GracieAdler,my phone broke 

0,1966833489,Fri May 29 18:29:01 PDT 2009,NO_QUERY,bjaurigue,had to run to vons&amp;carlsjr and barely got back and missed 1st quarter  and my uti is getting worse? ugh.

0,1966833523,Fri May 29 18:29:02 PDT 2009,NO_QUERY,juanthrowdown,I wish I was with my boys flatoppin &lt;3 

0,1966833587,Fri May 29 18:29:02 PDT 2009,NO_QUERY,sweetmonimons,@ericad - poor livvy  hopefully it's just the excitement of your visitors!

0,1966833688,Fri May 29 18:29:03 PDT 2009,NO_QUERY,BadgerBlogger,"@Realdebate Thanks, I'll miss you guys too, I was really looking forward to it "

0,1966833690,Fri May 29 18:29:03 PDT 2009,NO_QUERY,whatyousaygoes,My foot got cut when I was moving away from the door 

0,1966833755,Fri May 29 18:29:03 PDT 2009,NO_QUERY,SodaSipperzx3,UGH!! im scared for monday...my parents are probably gonna take my laptop because of my math test they're gonna see... 

0,1966833888,Fri May 29 18:29:01 PDT 2009,NO_QUERY,lindtdale,Oh crap.... My billiards mouse is broken.... I can't use my mighty mouse for games.... Sigh. 

0,1966834117,Fri May 29 18:29:05 PDT 2009,NO_QUERY,_heyduder,just killed a spider. *punches self* 

0,1966834498,Fri May 29 18:29:08 PDT 2009,NO_QUERY,AwesomeArianna,@Cowgirl1011 I know I miss you on there  lol

0,1966834690,Fri May 29 18:29:09 PDT 2009,NO_QUERY,hithah,"@travln1 So it looks like they went on sale at noon *today* and then sold out immediately, including the CCTV overflow rooms. Sad. "

0,1966834924,Fri May 29 18:29:11 PDT 2009,NO_QUERY,noladl,still sick. i wish i didnt have an exam tomorrow or have to work. 

0,1966835351,Fri May 29 18:29:13 PDT 2009,NO_QUERY,evelynchrist,new tub means no shower.... for 3 days   Just when I was on a showering kick too.

0,1966835438,Fri May 29 18:29:14 PDT 2009,NO_QUERY,shmalexis,"wooow of course the blockbuster near me doesn't sell livenation tix, no ATL tic til tomorrow "

0,1966835623,Fri May 29 18:29:15 PDT 2009,NO_QUERY,1orraine,@lalalizbeth  aww 

0,1966835751,Fri May 29 18:29:16 PDT 2009,NO_QUERY,Jssg86,that was supposed to be 

0,1966836229,Fri May 29 18:29:19 PDT 2009,NO_QUERY,VirginiaArchie,one of the strangest things just happened to me. O_o + my tummy hurts 

0,1966836428,Fri May 29 18:29:20 PDT 2009,NO_QUERY,chennysherm13,glad @justinarnold and @nhenick are together 

0,1966836436,Fri May 29 18:29:20 PDT 2009,NO_QUERY,kittygutz,@RedDuchess The law doesn't change until July. 

0,1966836550,Fri May 29 18:29:21 PDT 2009,NO_QUERY,Jaicenia,wish my Twitter Crush was here laid up wit me !! 

0,1966836675,Fri May 29 18:29:22 PDT 2009,NO_QUERY,Gmtwana,is missing her family and friends in DSM 

0,1966836848,Fri May 29 18:29:23 PDT 2009,NO_QUERY,Luphinus,@Syrus_Draco Meh! That was my plan...  

0,1966837371,Fri May 29 18:29:26 PDT 2009,NO_QUERY,jmarie7481,Ugh...I wasn't as done with my finals as I thought 

0,1966837591,Fri May 29 18:29:27 PDT 2009,NO_QUERY,jaime_08,still sick  chicken soup doesn't seem to do the trick :] can anyone suggest a cure? i'm open for ANYTHING!

0,1966838725,Fri May 29 18:29:35 PDT 2009,NO_QUERY,DJ_HOT_SAUCE,Frankie Beverly and Maze will be here tomorrow night.....and I gotta club 

0,1966838795,Fri May 29 18:29:35 PDT 2009,NO_QUERY,hithah,"Well, that dilemma is solved. The Paley tickets are sold out already. They went on sale TODAY at noon, not yesterday. Bummer. "

0,1966838874,Fri May 29 18:29:36 PDT 2009,NO_QUERY,beverlyislike,Only $35 left in my bank account. I am a very sad panda. 

0,1966838880,Fri May 29 18:29:36 PDT 2009,NO_QUERY,teodramaqueen,just finished watching les miserables it was such a good movie! i almost cried 

0,1966838925,Fri May 29 18:29:36 PDT 2009,NO_QUERY,robthepierce,"@felicitydee  tried to get matt to hang out with us, but he don't like me anymore"

0,1966839030,Fri May 29 18:29:37 PDT 2009,NO_QUERY,schrodinger_cat,Miss my girls. 

0,1966839173,Fri May 29 18:29:38 PDT 2009,NO_QUERY,constellations7,"@sccastaneda they always pick on your videos it seems, lol "

0,1966839189,Fri May 29 18:29:38 PDT 2009,NO_QUERY,Xial,Ugh. Sprint needs to offer better phones. I need a new one: This one is crashing on nearly EVERYTHING. It's unusable.  

0,1966839452,Fri May 29 18:29:40 PDT 2009,NO_QUERY,abcalifornia,just got off of work. now i have nothing to do cause everyone has plans except me 

0,1966839703,Fri May 29 18:29:42 PDT 2009,NO_QUERY,robots_,@withasound it's being a complete dick tonight. i should've kept the old one up and now i got nothing 

0,1966840419,Fri May 29 18:29:46 PDT 2009,NO_QUERY,mel_o_dee, lol &quot;you guys text fast.&quot;

0,1966841074,Fri May 29 18:29:51 PDT 2009,NO_QUERY,rozuliani,to com sono 

0,1966841198,Fri May 29 18:29:52 PDT 2009,NO_QUERY,bellavoce4,"@ForgetfulDeity oh man, the BIG day. "

0,1966841237,Fri May 29 18:29:52 PDT 2009,NO_QUERY,tristankent,..I've already listened to all the S4 commentary except the finale 

0,1966841523,Fri May 29 18:29:54 PDT 2009,NO_QUERY,jeriac,"Flopped two pair, but does not beat a straight.  I sometimes wonder why I continue to play. "

0,1966842870,Fri May 29 18:30:03 PDT 2009,NO_QUERY,Taybay1984,Basketball iz so much more interesting when my boo watches it with me!!!   Wake up hunny!

0,1966842885,Fri May 29 18:30:03 PDT 2009,NO_QUERY,suicidal_panda,"@LauraManiscalco yep, it was super old. He died. "

0,1966842996,Fri May 29 18:30:04 PDT 2009,NO_QUERY,megpoynter,"arghhh im shaking so bad, just killed a spider i think.. i dunno where it's went "

0,1966843050,Fri May 29 18:30:04 PDT 2009,NO_QUERY,hotnizz,@Junbee Still incomplete? Aaaaaah I'm missing this!!! Nooo! I miss you 

0,1966843072,Fri May 29 18:30:04 PDT 2009,NO_QUERY,NoNamesJustLo,These sun dresses are not titty friendly.....too many close calls 

0,1966843194,Fri May 29 18:30:05 PDT 2009,NO_QUERY,BossTycoonLZ,@idkDiVAS thankss 

0,1966843575,Fri May 29 18:30:07 PDT 2009,NO_QUERY,ohdangggitsmary,At Joni's house. Getting ready to go to graduation. I'll miss the seniors 

0,1966843961,Fri May 29 18:30:09 PDT 2009,NO_QUERY,TeresavBurns,who knows maybe her last name is different now. i cant find any of her family to get in touch though 

0,1966843993,Fri May 29 18:30:09 PDT 2009,NO_QUERY,TwatRock,Realized today that all of my good friends are scattered throughout the USA and I don't really have any close ones left here. minus 3. 

0,1966844130,Fri May 29 18:30:10 PDT 2009,NO_QUERY,Punkin_spie,I thought i was over it but i so still wanna move to NY 

0,1966844356,Fri May 29 18:30:11 PDT 2009,NO_QUERY,c4mXD,I wanna go see Up  anybody wanna take me?

0,1966844362,Fri May 29 18:30:11 PDT 2009,NO_QUERY,teodramaqueen,and ok seriously y do ppl keep blockin me am i doin somethin wrong  i do not feel loved at this moment

0,1966844422,Fri May 29 18:30:12 PDT 2009,NO_QUERY,bellaC19,@bellaC19 I guess not  we should take a trip and get away for awhile

0,1966844539,Fri May 29 18:30:12 PDT 2009,NO_QUERY,KDH945,so tired i need to go to sleep.......but there are to many people in my house 

0,1966844578,Fri May 29 18:30:12 PDT 2009,NO_QUERY,masashitogami,I need more friends in toronto 

0,1966844795,Fri May 29 18:30:14 PDT 2009,NO_QUERY,LintangNova,tummy storm 

0,1966844849,Fri May 29 18:30:14 PDT 2009,NO_QUERY,misty50,"is saying a sad farewell to her little dog today, "

0,1966845291,Fri May 29 18:30:17 PDT 2009,NO_QUERY,apache_rose,Omg I want @FloodedLungs new Sidekick 

0,1966846294,Fri May 29 18:30:23 PDT 2009,NO_QUERY,katemanamtam,"says goodmorning (lol) nalate ng gsing, 19 missed calls sorry anna  http://plurk.com/p/x3d9h"

0,1966846651,Fri May 29 18:30:25 PDT 2009,NO_QUERY,Squirrel_Monkey,Damnit!! they are for her bible study!! No cookies for me 

0,1966846729,Fri May 29 18:30:26 PDT 2009,NO_QUERY,Laanya,Im gonna watch a move don't know witch movie. PPP is online on megaupload but in french and I don't spek french. 

0,1966847178,Fri May 29 18:30:28 PDT 2009,NO_QUERY,melissaceratti,Just realized she shouldn't tweet when she is drunk because she can't type right!! Ergh seedy  RIOT IN BELGIUM TONIGHT BABY!!

0,1966848031,Fri May 29 18:30:34 PDT 2009,NO_QUERY,moccah,@DerrellRicardo ass to go to the emergency right now! So my mommy is takin me now... 

0,1966848047,Fri May 29 18:30:34 PDT 2009,NO_QUERY,samorajones,@waynosocrazy I wanted to see that 

0,1966848260,Fri May 29 18:30:35 PDT 2009,NO_QUERY,311Bunny,@evanmiles ur soooo mean!!! It was soo horrible!! I'm a bird killer! 

0,1966849052,Fri May 29 18:30:40 PDT 2009,NO_QUERY,lolakissesxo,My twitpic is def NOT WORKING!! WTF?? 

0,1966849164,Fri May 29 18:30:40 PDT 2009,NO_QUERY,melissamy18,It just hit me that this amazing ride called high school is almost over. 

0,1966849549,Fri May 29 18:30:43 PDT 2009,NO_QUERY,SpikeUK,@maggz I'm hoping to watch ER this weekend out tomorrow night so prob Sun so no one can see my red frog-eyes 

0,1966849621,Fri May 29 18:30:43 PDT 2009,NO_QUERY,LoveAshleeNOeL,Watchn the laker game alone at the house  someone come post up with me

0,1966849914,Fri May 29 18:30:45 PDT 2009,NO_QUERY,benson18,just home from wrk not allowed me ifone so cant tweet 

0,1966850480,Fri May 29 18:30:51 PDT 2009,NO_QUERY,Sarahlovesyousm,Steve is gone! i am still crying and i can't stop  worst day of my life!!!

0,1966850670,Fri May 29 18:30:50 PDT 2009,NO_QUERY,KahilleD,NYC BookExpo was fantastic-I wish I could go tomorrow also 

0,1966851779,Fri May 29 18:30:57 PDT 2009,NO_QUERY,AnalystAlterEgo,"@Pandabeara  Bless your heart. I had the same issue w/ each of my pregnancies. You will survive. Three more weeks, girl."

0,1966851966,Fri May 29 18:30:58 PDT 2009,NO_QUERY,beckysamways,@1jaredPADALECKI aww i missed the whole question answer thingy  youll have to let me know when its happening again. sucks diff time zones!

0,1966852031,Fri May 29 18:30:59 PDT 2009,NO_QUERY,naomicupcakes,"LAKERSSSS. Ugh, game casting again!!! "

0,1966852077,Fri May 29 18:30:59 PDT 2009,NO_QUERY,travisexy,I hate this. I'm not strong enough. 

0,1966852331,Fri May 29 18:31:01 PDT 2009,NO_QUERY,TIARAHH,"I hate when people say they love you, but its just till they find something better "

0,1966852457,Fri May 29 18:31:02 PDT 2009,NO_QUERY,mrsdegeneres,My life SUCKS 

0,1966852467,Fri May 29 18:31:02 PDT 2009,NO_QUERY,chiragbatra,One minute to Seven and still up. Darn! this layout it taking forever!! 

0,1966852476,Fri May 29 18:31:02 PDT 2009,NO_QUERY,niki7a,I can't find my wedding rings... Let's see where did I bury the hooker again? Jk but seriously can't find my rings 

0,1966852626,Fri May 29 18:31:03 PDT 2009,NO_QUERY,jcrimjustice,"note to self never give mom keys to house, damn woman nearly scared me to death, made me leave calidornia "

0,1966853020,Fri May 29 18:31:05 PDT 2009,NO_QUERY,teammartin,@keishajay jealous! I have I work 

0,1966853779,Fri May 29 18:31:10 PDT 2009,NO_QUERY,Deaddrop,Dislocated and sprained the thumb on my dominant hand. 

0,1966854288,Fri May 29 18:31:14 PDT 2009,NO_QUERY,xNissax,I am absolutely broken hearted.  I HATE THIS!

0,1966854551,Fri May 29 18:31:16 PDT 2009,NO_QUERY,HABLBAH,I miss my kids. Feeling a little anxious and sad.   

0,1966854556,Fri May 29 18:31:16 PDT 2009,NO_QUERY,24lbsofBoost,@Irishise Shoes no longer a team member 

0,1966855077,Fri May 29 18:31:19 PDT 2009,NO_QUERY,etherealemk,I just walked out of a shoestore without buying anything. And there were really fantastc shoes there 

0,1966855286,Fri May 29 18:31:21 PDT 2009,NO_QUERY,captainplanet93,"@sonnyjoeflangan haha, 'the power is YOURRRRS!' i miss that cartoon  kids shows these days are so screwed up"

0,1966855384,Fri May 29 18:31:21 PDT 2009,NO_QUERY,J_Monopoly,@mrsdcrack Nah seriously 2day I beat her 21-8 Lol...SHE NORMALLY WINS..y can't I have my moment 2 gloat lol? 

0,1966855430,Fri May 29 18:31:22 PDT 2009,NO_QUERY,freddyworkout,"@brookeburke Good for you, have a glass of red for me too... I'm jealous, I have to study for work tomorrow so need to lay off the red "

0,1966855555,Fri May 29 18:31:23 PDT 2009,NO_QUERY,staciodaviso, ugh....great

0,1966856272,Fri May 29 18:31:27 PDT 2009,NO_QUERY,gangstamittens,@djbelle Just to San Fran to take the Bar Exam in July.  

0,1966856490,Fri May 29 18:31:29 PDT 2009,NO_QUERY,TigMH,Credit Card was stolen and used 

0,1966856787,Fri May 29 18:31:31 PDT 2009,NO_QUERY,krysann,ugh. ughh. ugghgughghhguh. i can't get over it 

0,1966856853,Fri May 29 18:31:31 PDT 2009,NO_QUERY,Crunk_45,"is home with D, not sure what is going to happen?? "

0,1966857952,Fri May 29 18:31:38 PDT 2009,NO_QUERY,luhhcosta,"all about love hurts.. has no difference in both, love and life. actually, nothing. im freaking "

0,1966858034,Fri May 29 18:31:39 PDT 2009,NO_QUERY,sauravdhungana,"good morning everyone, its saturday but i gotta work, "

0,1966858097,Fri May 29 18:31:39 PDT 2009,NO_QUERY,danilou,tried to nap before my overnight shift. fail.   i hope its not too busy.

0,1966858232,Fri May 29 18:31:40 PDT 2009,NO_QUERY,kaitlynedunn,back from wonderland... headache from roller coasters 

0,1966858733,Fri May 29 18:31:44 PDT 2009,NO_QUERY,annalisaceccato,i had an hour sleep last night ahh and when i was asleep i got m&amp;ms thrown at me  so now i dont want to go to dance ah

0,1966858763,Fri May 29 18:31:44 PDT 2009,NO_QUERY,JaylaStarr,@dukedinero lol!!! I actually ain't getting smashed right now! lol 

0,1966858989,Fri May 29 18:31:46 PDT 2009,NO_QUERY,y0itzmariko,Yay I'm home!!! But my weekend still doesn't start till Wednesday  I need a mivie

0,1966859176,Fri May 29 18:31:47 PDT 2009,NO_QUERY,MStokes,"@PragerC Been there done that last year, except it was in Ocean City and there was no skeeball  LOL"

0,1966859551,Fri May 29 18:31:50 PDT 2009,NO_QUERY,tracy_detlor,@Eri8321317 I don't think there are any 

0,1966859789,Fri May 29 18:31:51 PDT 2009,NO_QUERY,jakeypwn,@abcalifornia thats sad 

0,1966859879,Fri May 29 18:31:52 PDT 2009,NO_QUERY,CiaraRenee,I really don't care about this game ... and I ABHOR the Fakers. That's how I know I'm not right 

0,1966860217,Fri May 29 18:31:54 PDT 2009,NO_QUERY,snowkuo,got a nightmare 

0,1966860243,Fri May 29 18:31:54 PDT 2009,NO_QUERY,pegasus_buffalo,does anyone wanna hang out this weekend? its so boring at my house 

0,1966860413,Fri May 29 18:31:55 PDT 2009,NO_QUERY,mynameisisobel,@LDubbs14 i haven't had wendy's in such a long time. 

0,1966860435,Fri May 29 18:31:55 PDT 2009,NO_QUERY,malvaz_moon,I just want to rest!!! forgetting al my homeworks and all the things related with the school..... XD 

0,1966863365,Fri May 29 18:32:15 PDT 2009,NO_QUERY,airarowena,@jes1129 why? playboy? yah! i hate them! especially the one who make you believe that they love you.. 

0,1966863947,Fri May 29 18:32:19 PDT 2009,NO_QUERY,j2k13,I miss Radio one from the UK. I can't listen to it anymore 

0,1966864583,Fri May 29 18:32:23 PDT 2009,NO_QUERY,kareneeezy,So sad I'm missing the Lakers game todaaaay 

0,1966864644,Fri May 29 18:32:23 PDT 2009,NO_QUERY,SnoFox,Tweet! Just uninstalled TweetDeck and Adobe AIR until it decides to work again. 

0,1966864719,Fri May 29 18:32:24 PDT 2009,NO_QUERY,lyse,@kylanath  That isn't very nice. 

0,1966864806,Fri May 29 18:32:24 PDT 2009,NO_QUERY,etherealemk,I just walked out of a shoestore without buying anything. And they had really fantastic shoes. 

0,1966864866,Fri May 29 18:32:25 PDT 2009,NO_QUERY,hithah,@travln1 There were THREE overflow rooms on that form I had briefly. This thing must have sold out *immediately*. Crazy. Oh well. 

0,1966864958,Fri May 29 18:32:25 PDT 2009,NO_QUERY,APMotorsports,@JChronicle Don't say things that scare me! I haven't seen anything that concerns me but maybe I'll re-read the terms of use 

0,1966865075,Fri May 29 18:32:26 PDT 2009,NO_QUERY,jamycupcake,omfg  streched my ear and it like hurts                      nomnom i like cheese  lol

0,1966865336,Fri May 29 18:32:28 PDT 2009,NO_QUERY,maledicency,"...Wait, what? Mr Kennedy released??? This is a sad day "

0,1966865342,Fri May 29 18:32:28 PDT 2009,NO_QUERY,Ominouscw23,Nice my scorpion scyth +5 is gond again 

0,1966865846,Fri May 29 18:32:32 PDT 2009,NO_QUERY,irishsamom,"@MyBottlesUp yeah sure, I'm definitely one of them.  Just got KIDS to bed.  No hot dates here... "

0,1966866226,Fri May 29 18:32:36 PDT 2009,NO_QUERY,brinahxo,"@SaraShootemup sadly I can't come down to FL  I can only go to GA. But once I turn 18, I am so coming down "

0,1966866368,Fri May 29 18:32:35 PDT 2009,NO_QUERY,Princesssvall,i am so sore from the gym yesterday... i seriously cant move my arms 

0,1966866956,Fri May 29 18:32:39 PDT 2009,NO_QUERY,simonspark,@Ruthycpr Stu told me about the chinchillas when he was at my gaf in Jan. They sound great but I'm probably allergic to their fur 

0,1966867047,Fri May 29 18:32:40 PDT 2009,NO_QUERY,tintalasia,@yahooprofiles Y! profiles are awful. Tried it. Didn't like it. Will go elsewhere. Archives have been preparing for download for an hour 

0,1966867185,Fri May 29 18:32:41 PDT 2009,NO_QUERY,Hollix,@JulesMilmine why wasn't i invited? 

0,1966867308,Fri May 29 18:32:42 PDT 2009,NO_QUERY,facebook_rt,@hhking I hate having to endure baby pics on Facebook. 

0,1966867346,Fri May 29 18:32:43 PDT 2009,NO_QUERY,silly_silla,at maggie's choir concert =] its senior farewell and imma say buy to all my seniors 

0,1966867448,Fri May 29 18:32:43 PDT 2009,NO_QUERY,ericford,@Bean525 Haven't been able to find anything that'll help you  A few forums say it's not really possible without expensive switches.

0,1966867457,Fri May 29 18:32:43 PDT 2009,NO_QUERY,Benniboy22,@amysav83 aww you still awake 

0,1966867657,Fri May 29 18:32:44 PDT 2009,NO_QUERY,Puthi,so bored 

0,1966867893,Fri May 29 18:32:46 PDT 2009,NO_QUERY,RounNiez,my radio just turned on by itself  creeeeepyyyyyyyy

0,1966868146,Fri May 29 18:32:47 PDT 2009,NO_QUERY,katierulezd00d,facebook is being really slow for me today 

0,1966868949,Fri May 29 18:32:53 PDT 2009,NO_QUERY,ccvanbuskirk,@passageC Where are you?  I teased you... but no reaction 

0,1966868983,Fri May 29 18:32:53 PDT 2009,NO_QUERY,followyourlead_,@jessiiccaa idk bb. i had to borrow money to get by this week 

0,1966868989,Fri May 29 18:32:53 PDT 2009,NO_QUERY,smoney313,Feeling exhausted. I just want to go home. 

0,1966869669,Fri May 29 18:32:58 PDT 2009,NO_QUERY,crystal715,@mclinklove Is tonight his last night  I love him! Why did he decide to leave??

0,1966869862,Fri May 29 18:32:59 PDT 2009,NO_QUERY,AA_Punk,why doesnt anyone want to have dinner with me? 

0,1966870549,Fri May 29 18:33:03 PDT 2009,NO_QUERY,fiorelli,Fios is installed and working well.  Now I have to re-create all Season Passes on 3 Tivos because channels are completely different.  ugh.

0,1966870850,Fri May 29 18:33:05 PDT 2009,NO_QUERY,Jessica_Summer_,I think I got sun poisoning today. I'm not feeling too shabby. 

0,1966871762,Fri May 29 18:33:11 PDT 2009,NO_QUERY,kluckey,"I would like to know if there is ANYONE out there that could sit through &quot;Marley and Me&quot; without bawling?!!? OMG!  So, so SAD! "

0,1966871934,Fri May 29 18:33:12 PDT 2009,NO_QUERY,crIttOpher,@SweetSimple thats what i'm afraid of 

0,1966872128,Fri May 29 18:33:13 PDT 2009,NO_QUERY,shanncake,@wcrouse hahaha that was the worst day ever. But I still miss it 

0,1966872673,Fri May 29 18:33:17 PDT 2009,NO_QUERY,pat1tay,"i cant believe i didnt win crap! i had people singing along, waving phones, blah blah blah... and walked out with nothing "

