sentiment,userid,date,query,userId,text0,2254203686,Sat Jun 20 09:23:17 PDT 2009,NO_QUERY,shrimpiiiii,@ginachristine14 cuz i have a huge headache  shhhhhhhh i drank red bull and vodka secret lol

0,2254203895,Sat Jun 20 09:23:18 PDT 2009,NO_QUERY,nickjenks03,Letting my broken collar bone rest up 

0,2254204674,Sat Jun 20 09:23:23 PDT 2009,NO_QUERY,katyhardy,"@shonuffarty I guess so. I mean, basically what they told me is it's not completely official, but sounds like it's def a hiatus. "

0,2254204783,Sat Jun 20 09:23:23 PDT 2009,NO_QUERY,kristentutas,Packing up the store.....sad 

0,2254204818,Sat Jun 20 09:23:23 PDT 2009,NO_QUERY,aaamanda,@marissamonotony i wish i had the guts to cut my hair short. 

0,2254204958,Sat Jun 20 09:23:24 PDT 2009,NO_QUERY,michellefares,Just found out that Chuck Bass will be in a remake of Wuthering Heights as Heathcliff- perfect!!! Too bad Cathy is too whiny for blair 

0,2254204977,Sat Jun 20 09:23:24 PDT 2009,NO_QUERY,niffirgelleinad,I really wish he didn't have to go to work... I haven't seen my husband for more then 10 min in over a week... 

0,2254205495,Sat Jun 20 09:23:27 PDT 2009,NO_QUERY,DaniBlake,fuck both of yall @MrsPerfect30 and @youngblacknfab! this is why i dont come around...im nvr wanted! 

0,2254205580,Sat Jun 20 09:23:28 PDT 2009,NO_QUERY,keishalover,@keisha_buchanan I'm sad. my granddad today is die. 

0,2254205757,Sat Jun 20 09:23:29 PDT 2009,NO_QUERY,amazing_grace13,"@ree_i I'm off to find me a party dress.  Of course, cuz I'm looking I prolly won't find one.... "

0,2254206082,Sat Jun 20 09:23:30 PDT 2009,NO_QUERY,davieroxson,"@janeeexx this is interesting, hmmm, o only have one follower (how unpopular am i) "

0,2254206644,Sat Jun 20 09:23:33 PDT 2009,NO_QUERY,mrsbeck78,I knew it was only a tease.  

0,2254206656,Sat Jun 20 09:23:34 PDT 2009,NO_QUERY,ashleyyakira,@plofficial  and a double sadface cause u left me on bbm! im not being a bodybuilder nomore!!

0,2254206839,Sat Jun 20 09:23:34 PDT 2009,NO_QUERY,joelward89,Had a good night in croyde! Back up there tonight for the main events! Gotta start getting for for preseason 

0,2254206841,Sat Jun 20 09:23:34 PDT 2009,NO_QUERY,annieluvs,any @kjhk dj's out there who can help a sick girl out by covering her 4-6 pm show today? i wouldn't ask if i weren't supersick 

0,2254206932,Sat Jun 20 09:23:35 PDT 2009,NO_QUERY,Pauline_x,i hate homework. 

0,2254207146,Sat Jun 20 09:23:36 PDT 2009,NO_QUERY,jetaunelysse,Knew I shouldn't have Tweeted about how bored I was.... I'm stucj babysitting for the day 

0,2254207340,Sat Jun 20 09:23:37 PDT 2009,NO_QUERY,cairistiona,@carlothewacko GIAAAAN! long time no everything! we weren't able to meet lahat nung termbreak 

0,2254207748,Sat Jun 20 09:23:40 PDT 2009,NO_QUERY,OHEMGEERACHELLE,"just let the maid into my house, still sleepy  hoping they finish up early before i have to head to work. another night of closing, fun."

0,2254207767,Sat Jun 20 09:23:40 PDT 2009,NO_QUERY,lizzayyyyyy,"Ugh, so bored today! "

0,2254208068,Sat Jun 20 09:23:41 PDT 2009,NO_QUERY,miss_charmed,"@DavidArchie aww, have fun! wish i could go "

0,2254208077,Sat Jun 20 09:23:41 PDT 2009,NO_QUERY,smithcor,&lt;--- No Mayercraft next year makes my exoticbeachfeet sad. 

0,2254208273,Sat Jun 20 09:23:42 PDT 2009,NO_QUERY,carolbellopacs,Just found the awesome fathers day gift at tar-jay for my hubby. They have everything. Best buy doesn't open till 10am. Lost a sale. 

0,2254208688,Sat Jun 20 09:23:45 PDT 2009,NO_QUERY,oneallstar32,Had a great workout....now i''m @ work 

0,2254209041,Sat Jun 20 09:23:47 PDT 2009,NO_QUERY,lauraphilly,@caROBBS &quot;lover of true loves&quot; i like that... too bad about Bluesfest but i figured maybe work would be tricky. 

0,2254209686,Sat Jun 20 09:23:51 PDT 2009,NO_QUERY,BenBuzzsaw,@amywilliams99 I also have a small list of wonderful items from Allsaints that I want but can't afford 

0,2254209999,Sat Jun 20 09:23:52 PDT 2009,NO_QUERY,mayajewell,@indpnt1 oh no! poor you. OUch! 

0,2254210070,Sat Jun 20 09:23:53 PDT 2009,NO_QUERY,lorisheldon,"@mmkrill safe travels, btw, from what I have read, new software will allow music via bluetooth, just have to figure out how "

0,2254210153,Sat Jun 20 09:23:53 PDT 2009,NO_QUERY,TheOfficeTroll,"@thequestess Aww.  Didn't know it was out, should have watched it together "

0,2254210431,Sat Jun 20 09:23:55 PDT 2009,NO_QUERY,niklemler,Is jealous of everyone that is outside today!  Weather is beautiful and I'm stuck inside.....working..... 

0,2254210633,Sat Jun 20 09:23:56 PDT 2009,NO_QUERY,elliehash,@hugsandtugs i'm soooo freakin' sad! 

0,2254210824,Sat Jun 20 09:23:57 PDT 2009,NO_QUERY,abbiealmasco,"@rayamai And that sucks!Cos it affects everything.It affects how you view yourself,life,and love. "

0,2254211517,Sat Jun 20 09:24:01 PDT 2009,NO_QUERY,sirspocksalot,My glasses got bent somehow.  Gotta get them readjusted.

0,2254211570,Sat Jun 20 09:24:01 PDT 2009,NO_QUERY,SugarSickness,Work sucks - I want to go hommmeee   

0,2254211880,Sat Jun 20 09:24:03 PDT 2009,NO_QUERY,shawak,"big job, no time to chill, "

0,2254211897,Sat Jun 20 09:24:03 PDT 2009,NO_QUERY,Boadle_,"Can't. Sleep. Taxi coming in, 3.5 hours. Oh dang shit, I shouldn't have had that diet coke/be a nervous flyer "

0,2254211900,Sat Jun 20 09:24:03 PDT 2009,NO_QUERY,skyb5766,Watching Hannah Montana 

0,2254212570,Sat Jun 20 09:24:06 PDT 2009,NO_QUERY,ILOVEHOOKERS,Sick  this sucks

0,2254212718,Sat Jun 20 09:24:07 PDT 2009,NO_QUERY,uhohhspaghetios,Doesnt want lauren to go 

0,2254212820,Sat Jun 20 09:24:09 PDT 2009,NO_QUERY,andrewbloom,"i think my baking powder is old, these cakes have no lift. should have made eggs "

0,2254213013,Sat Jun 20 09:24:09 PDT 2009,NO_QUERY,RachPadilla,Being a boring bum around the house 

0,2254213044,Sat Jun 20 09:24:09 PDT 2009,NO_QUERY,Bennum,@besskretsinger  I'm soooooorrryyyyy. I hope everything works out. #besscartotalled

0,2254213058,Sat Jun 20 09:24:09 PDT 2009,NO_QUERY,happylovesChuck,@annaisdanielle  how are you? Been wanting to stop by at the station but I'm always stuck at home. haha!

0,2254213138,Sat Jun 20 09:24:10 PDT 2009,NO_QUERY,ruthagua,"Well, The concert was good but... It would be better "

0,2254213207,Sat Jun 20 09:24:10 PDT 2009,NO_QUERY,amelthecurl,@tyosaurus Sick of my face? How could you........ 

0,2254213293,Sat Jun 20 09:24:10 PDT 2009,NO_QUERY,pottergirll,what a crazy weekend for Toronto! wish i could partake 

0,2254213749,Sat Jun 20 09:24:13 PDT 2009,NO_QUERY,lalalytysha,@MonicaHluv u must have insomnia too lol I hadda retire from twitter and still couldn't sleep til like 415 

0,2254214050,Sat Jun 20 09:24:15 PDT 2009,NO_QUERY,TeamSwift_,Gosh i just lost 3 followers 

0,2254214148,Sat Jun 20 09:24:15 PDT 2009,NO_QUERY,Vorbb,Whats with adsense and denying my application 

0,2254214476,Sat Jun 20 09:24:17 PDT 2009,NO_QUERY,AlicjaD,getting ready for a long day at work... 

0,2254214492,Sat Jun 20 09:24:17 PDT 2009,NO_QUERY,steeleagle94,tired sending my lappy in for repairs 

0,2254214682,Sat Jun 20 09:24:19 PDT 2009,NO_QUERY,vbbug99,Leaving charlotte  off to stay with the fam for a week. #squarespace if I get an iphone ill be less likely to kill my dad....

0,2254215148,Sat Jun 20 09:24:21 PDT 2009,NO_QUERY,LiamJ7X,Cant find my ipod  @meekakitty not just you.

0,2254215789,Sat Jun 20 09:24:25 PDT 2009,NO_QUERY,xoracheljean_09,@rebeccaaaaaaa ahh your so lucky your going to 2  the one im going to i got floor seats? soo im excited lol

0,2254222046,Sat Jun 20 09:25:00 PDT 2009,NO_QUERY,josemanuelgoig,Recent news I'm reading from Iran make me very sad  #iranelection

0,2254222433,Sat Jun 20 09:25:02 PDT 2009,NO_QUERY,ibella_chic,@ReaganGomez Jersey either 

0,2254222584,Sat Jun 20 09:25:03 PDT 2009,NO_QUERY,maureenwahlberg,cant find any vids of the show last nite 

0,2254223009,Sat Jun 20 09:25:05 PDT 2009,NO_QUERY,mcampion1,"Tiling the kitchen, Fixing a water pipe in the bathroom, cutting the grass, washing the car. You know enjoying my day off! "

0,2254223052,Sat Jun 20 09:25:05 PDT 2009,NO_QUERY,hannahray91,Ahhh @oliviabaker I'm glad I got to year them sing for a Second I'm just sad I didn't get to see them 

0,2254223328,Sat Jun 20 09:25:07 PDT 2009,NO_QUERY,boltlovergirl,hey guys i wont be on youtube alot im going to 3 partys this week!! sorry! 

0,2254223385,Sat Jun 20 09:25:07 PDT 2009,NO_QUERY,eldritch48,"@cgretton Make it home ok?  Weather wasn't the best for sight-seeing yesterday, at least in Western OR "

0,2254223500,Sat Jun 20 09:25:07 PDT 2009,NO_QUERY,__Caaro,whoooho. still diseased. but everything is alright. haha. i'm happy. BUT there's one thing.. I'M STRESSED OF A SPECIAL PERSON 

0,2254223679,Sat Jun 20 09:25:08 PDT 2009,NO_QUERY,Sue_Lewis,Evie isn't feeling well this morning  http://yfrog.com/7gdmlvj

0,2254223822,Sat Jun 20 09:25:09 PDT 2009,NO_QUERY,Wilfy84,is sore from the paint balling - got a massive bruise on my ribs 

0,2254224565,Sat Jun 20 09:25:13 PDT 2009,NO_QUERY,KyleHigdon,lighting strikes my work  had to go in for a bit

0,2254225261,Sat Jun 20 09:25:17 PDT 2009,NO_QUERY,sinnerella6669,ugh...i'm way under the weather 

0,2254225286,Sat Jun 20 09:25:17 PDT 2009,NO_QUERY,LiveHappee,Sooo over this stupid computer! 

0,2254225307,Sat Jun 20 09:25:17 PDT 2009,NO_QUERY,AshleyAnn21,Can't believe I'm actually going to say... I'm going to miss Boston 

0,2254225449,Sat Jun 20 09:25:18 PDT 2009,NO_QUERY,edemarco,@cynthialarson shit is it Sunday?...damn I lost a day thought it was Saturday 

0,2254226133,Sat Jun 20 09:25:22 PDT 2009,NO_QUERY,Swanky_Kades,is missing some people today! 

0,2254226160,Sat Jun 20 09:25:22 PDT 2009,NO_QUERY,Makkaveli,OMG WORK! SUPER LATE!   10-6pm

0,2254226838,Sat Jun 20 09:25:26 PDT 2009,NO_QUERY,wakeup_maggie,ugh headache 

0,2254227218,Sat Jun 20 09:25:28 PDT 2009,NO_QUERY,rubikah,@MimiJB i vvant a nick 

0,2254227637,Sat Jun 20 09:25:30 PDT 2009,NO_QUERY,Jessiedawn30,my hips hurt so bad I'm on the verge of tears 

0,2254227772,Sat Jun 20 09:25:32 PDT 2009,NO_QUERY,baconcoyote,"@microdile I ruined the mac and cheese with putting in too much olive oil    It wasnt horrible, but Hegdish wouldn't eat it!"

0,2254227780,Sat Jun 20 09:25:31 PDT 2009,NO_QUERY,GotOne94,"Was going to go to my great-grandmother's birthday party, but it rained, so it was canceled..... "

0,2254227783,Sat Jun 20 09:25:31 PDT 2009,NO_QUERY,jenicaarvee,wants to greet mike a happy birthday! im really missing him so much! 

0,2254227874,Sat Jun 20 09:25:31 PDT 2009,NO_QUERY,RRRosiee,Still no sign of @gladysmadrigal I don't think she's going anymore. gawww.   D:&lt;

0,2254227929,Sat Jun 20 09:25:32 PDT 2009,NO_QUERY,AMart_07,ALMOST adopted the baby dachsund. 

0,2254227951,Sat Jun 20 09:25:32 PDT 2009,NO_QUERY,mizzamber,@itsmeduh omg u did  ughhhh !!! That's weird thy come out. I must have hit mine I had some antibiotics its red around it

0,2254228020,Sat Jun 20 09:25:32 PDT 2009,NO_QUERY,MsAmberRiley,ready for my close up lol!!! Man its so ugly outside  where did the sun go?

0,2254228887,Sat Jun 20 09:25:37 PDT 2009,NO_QUERY,djdivya24,suffering frm fever n soar throat    

0,2254229678,Sat Jun 20 09:25:42 PDT 2009,NO_QUERY,AlBooqie,@ThatNeeshChick hey why arent u followin me 

0,2254230151,Sat Jun 20 09:25:44 PDT 2009,NO_QUERY,raymjoe,at work work work work..     I think my days being a scientist are over if this keeps up

0,2254230217,Sat Jun 20 09:25:45 PDT 2009,NO_QUERY,larissarose09,@kaitikeller you might have to poke me in the eye because we're having fathers day dinner tonight  Meet me &amp; sarrah for lunch nxt week?

0,2254230432,Sat Jun 20 09:25:46 PDT 2009,NO_QUERY,toriness,threw up at work. feeling extra sick. 

0,2254230499,Sat Jun 20 09:25:46 PDT 2009,NO_QUERY,HannahMcLane,Eating lunch by myself 

0,2254230888,Sat Jun 20 09:25:49 PDT 2009,NO_QUERY,donna144,@Mayzie27 No Champers then????? 

0,2254231139,Sat Jun 20 09:25:50 PDT 2009,NO_QUERY,BeccaFick,@KARupert its 65 degrees and its going to rain/storm until Friday....every single day 

0,2254231169,Sat Jun 20 09:25:50 PDT 2009,NO_QUERY,gogogiraffes,I dunno what bit me  http://twitpic.com/7wrnp

0,2254231301,Sat Jun 20 09:25:51 PDT 2009,NO_QUERY,meowberry,i had a yummy sandwich from panera but now my breath smells oniony 

0,2254231302,Sat Jun 20 09:25:51 PDT 2009,NO_QUERY,ElviraValera,all my neighbors feel the urge to move in/out saturdays early in the morning 

0,2254231480,Sat Jun 20 09:25:52 PDT 2009,NO_QUERY,gigarcia,My Twitter is stll crazy 

0,2254232063,Sat Jun 20 09:25:55 PDT 2009,NO_QUERY,cri_sty,uhm....I'm dreaming...as always 

0,2254232103,Sat Jun 20 09:25:55 PDT 2009,NO_QUERY,arem128,Rick rolled at work 

0,2254232332,Sat Jun 20 09:25:56 PDT 2009,NO_QUERY,jayegan,@F1_Girl not too sure yet - all i know is i'll be getting up early 

0,2254232687,Sat Jun 20 09:25:58 PDT 2009,NO_QUERY,jmeelyn,@LaurenConrad I wish I could go!! I'm stuck working 4 hours away 

0,2254232835,Sat Jun 20 09:25:59 PDT 2009,NO_QUERY,jklcassidy,cooties at the Cassidy House.  JOhn burned up with fever all night and was pitiful and now Reed is not feeling well.  

0,2254232914,Sat Jun 20 09:26:00 PDT 2009,NO_QUERY,ggimmickgirl,Ihammock.com/boysandclubbing 

0,2254232994,Sat Jun 20 09:26:00 PDT 2009,NO_QUERY,TobyTalksToRain,@fawned My rent finishes on Friday 

0,2254233064,Sat Jun 20 09:26:00 PDT 2009,NO_QUERY,dannii2eyes,@piercingwhore i know mrs but i only just got your messege i went out with the mother for a bit and forgot thee old phone gutted 

0,2254233482,Sat Jun 20 09:26:03 PDT 2009,NO_QUERY,bonamoz,Clove cigarettes are illegal now? wtf.  

0,2254233560,Sat Jun 20 09:26:03 PDT 2009,NO_QUERY,princesslatifah,To bad I won't be here to enjoy it... g2g2 work 

0,2254234097,Sat Jun 20 09:26:06 PDT 2009,NO_QUERY,paigerpenland,"Yesterday, a hostel owner said a bad review in Lonely Planet had destroyed her business. I've stayed there on vacation, nice place. "

0,2254234940,Sat Jun 20 09:26:11 PDT 2009,NO_QUERY,VNinny,I now know what its like to be an only child. Its the best. But i miss my brother a little bit. 

0,2254235077,Sat Jun 20 09:26:11 PDT 2009,NO_QUERY,japanhorserider,"Special dressage lesson &amp; practice under the sun for 2.5 hrs. Enjoyed the day, but feeling slightly sick now  Best to go to bed..."

0,2254235326,Sat Jun 20 09:26:13 PDT 2009,NO_QUERY,MalphasWats,"@domster yeah, it's a Twitter problem, @tweetie posted an update but it isn't approved yet "

0,2254235343,Sat Jun 20 09:26:13 PDT 2009,NO_QUERY,FriedToast,Hot. Gonna have to give in to the AC tonight 

0,2254235390,Sat Jun 20 09:26:13 PDT 2009,NO_QUERY,ryan_riva,@inretrospekt yeah I miss her 2! She doesn't do anything anymore  just straight to dvd movies and nbc guest spots 

0,2254235481,Sat Jun 20 09:26:13 PDT 2009,NO_QUERY,ApproachableArt,"Was going to see an Aaron Sorkin play today but I have too much to do at home, will have to miss the show and eat the ticket costs. "

0,2254235651,Sat Jun 20 09:26:14 PDT 2009,NO_QUERY,PostSecretFan,I just found 3 more gray hairs.  I'm up to 5 total.  

0,2254235807,Sat Jun 20 09:26:15 PDT 2009,NO_QUERY,helloshikha,@_manik_ : The other girl did not confirm the apartment - in the meantime it was taken by someone else  (

0,2254236294,Sat Jun 20 09:26:18 PDT 2009,NO_QUERY,genessar,"yup, worst week ever, just found a friend has stage 3 lymphoma and started chemo yesterday "

0,2254236443,Sat Jun 20 09:26:19 PDT 2009,NO_QUERY,Death_Eater129,ugh stomach ache!Z 

0,2254236666,Sat Jun 20 09:26:20 PDT 2009,NO_QUERY,VeronicaEbie,MY I PHONE HAS BEEN STOLEN  SOOOO if your trying to reach me email me or if you call leave your number. THANKS

0,2254236779,Sat Jun 20 09:26:20 PDT 2009,NO_QUERY,MrsGreenfield,I wish I had a basket on my bike for Ms. Izzy. 

0,2254236851,Sat Jun 20 09:26:21 PDT 2009,NO_QUERY,lady4d,Sitting at my yard sale made 11 hubs spent 12.50  l o l

0,2254236999,Sat Jun 20 09:26:22 PDT 2009,NO_QUERY,ellenisprincess,at work alone 

0,2254237723,Sat Jun 20 09:26:25 PDT 2009,NO_QUERY,iammykei,@skatergator777  yeah we did..-tear-

0,2254237771,Sat Jun 20 09:26:26 PDT 2009,NO_QUERY,chinawhite516,at the library 4 sum peace n quiet....got online course n a thesis to do 

0,2254243045,Sat Jun 20 09:26:55 PDT 2009,NO_QUERY,lauren__x33,peter pan finished 

0,2254243373,Sat Jun 20 09:26:57 PDT 2009,NO_QUERY,hrsoutherncharm,@PreppyPrincess The prices look the same to me. 

0,2254243834,Sat Jun 20 09:27:00 PDT 2009,NO_QUERY,petemoralez,Woke up with someone next to me 

0,2254244051,Sat Jun 20 09:27:01 PDT 2009,NO_QUERY,thepete,"@SteveTalkowski tell me about it!  In fact, I've lost jobs for it! "

0,2254244792,Sat Jun 20 09:27:05 PDT 2009,NO_QUERY,VicToryUhh,Crying ...  My boyfriend &amp; I just got in a stupid argument &amp; its really messed up ... Someone hold me in your arms ]:

0,2254244809,Sat Jun 20 09:27:05 PDT 2009,NO_QUERY,Amanda21crook,Rite i dont have a lift in2 town 2nite so im gona be Â£8 down b4 i even have my 1st drink 

0,2254244852,Sat Jun 20 09:27:05 PDT 2009,NO_QUERY,linxbee,"I'm really sorry that forever-miley isn't opened yet, it will open tomorrow &lt;3 Just my stupid updates won't change it's width "

0,2254245468,Sat Jun 20 09:27:09 PDT 2009,NO_QUERY,Deanmcken,"ipod, as usual. thinkin. erm bored "

0,2254245722,Sat Jun 20 09:27:10 PDT 2009,NO_QUERY,SoliceDelMazo,going to my grandpa's for father's day.. nothing to do over there though 

0,2254246181,Sat Jun 20 09:27:12 PDT 2009,NO_QUERY,PWayneJr,Missing Saturday funday due to illness 

0,2254246184,Sat Jun 20 09:27:12 PDT 2009,NO_QUERY,Star_90,wants the new iPhone! 

0,2254246201,Sat Jun 20 09:27:13 PDT 2009,NO_QUERY,jessrae79,"@gfitz wish I could be there, but 3 week old babies and 100+ degree heat don't mix well...    say hi to peeps and enjoy a cold beer for me"

0,2254246396,Sat Jun 20 09:27:14 PDT 2009,NO_QUERY,vanesssamedina,Feeling the after effects from last night 

0,2254246477,Sat Jun 20 09:27:14 PDT 2009,NO_QUERY,jjgxxx,Back in Pittsburgh 

0,2254246598,Sat Jun 20 09:27:15 PDT 2009,NO_QUERY,jonscovergirl,@JONSGIRL6769 it's raining in Toronto too 

0,2254247167,Sat Jun 20 09:27:18 PDT 2009,NO_QUERY,EGGYHitchcock,@dagenhamkellee lolololol I DON'T KNOW WATS GOIN ON. 

0,2254247186,Sat Jun 20 09:27:18 PDT 2009,NO_QUERY,lawpower,"Used Pwnage to upgrade to 3.0 to use my non-iPhone plan AT&amp;T sim. Guess they don't like that, I have phone but no data.  Back to 2.2.1 "

0,2254247672,Sat Jun 20 09:27:20 PDT 2009,NO_QUERY,raudhah,After a long dae of ndp training!!! poor bby... i ghees!!! i mish him oready!!! 

0,2254247780,Sat Jun 20 09:27:21 PDT 2009,NO_QUERY,iamlie,I can't believe I forgot my magazines at home...I had stuff do with those books today 

0,2254247826,Sat Jun 20 09:27:21 PDT 2009,NO_QUERY,tielenn,Way to tired to be working right now 

0,2254248709,Sat Jun 20 09:27:26 PDT 2009,NO_QUERY,Insatiable7,Going to a funeral with my friend.  

0,2254248791,Sat Jun 20 09:27:27 PDT 2009,NO_QUERY,la_pRHOfesora,@jtotheizzo87 lol grilling sounds nice. It's raining here though 

0,2254248958,Sat Jun 20 09:27:28 PDT 2009,NO_QUERY,_thebrit,Playing tennis on the wii and losing 

0,2254249229,Sat Jun 20 09:27:29 PDT 2009,NO_QUERY,ohlux,@nebthet I guess it's because of the server change 

0,2254249609,Sat Jun 20 09:27:31 PDT 2009,NO_QUERY,emilysmum,Finally - last of the clothes away! Now just need to do mine  tomorrow I think!!

0,2254250068,Sat Jun 20 09:27:34 PDT 2009,NO_QUERY,silver_apple,Had a reallly bad dream last night that all of my friends rejected me 

0,2254250364,Sat Jun 20 09:27:36 PDT 2009,NO_QUERY,therealjana,shopping was great...but the JB Album wasnÂ´t there 

0,2254250406,Sat Jun 20 09:27:36 PDT 2009,NO_QUERY,michael_muller,@SaraW I should have seen you at ohare - I was there for nine hours  . I hope you get out yoday

0,2254250460,Sat Jun 20 09:27:36 PDT 2009,NO_QUERY,StephanieFierce,@purplepleather Ugh! - You poor thing! 

0,2254250506,Sat Jun 20 09:27:37 PDT 2009,NO_QUERY,Joe_Giampa,Too bad we can't hang poolside in VA all day 

0,2254250529,Sat Jun 20 09:27:37 PDT 2009,NO_QUERY,Ambahhhh,@repentyoursins bored 

0,2254250676,Sat Jun 20 09:27:38 PDT 2009,NO_QUERY,mabelchow,"I am so thirsty right now, but lazy to go downstairs to get a drink "

0,2254251207,Sat Jun 20 09:27:41 PDT 2009,NO_QUERY,jolkow,Is this my belt or Jess's? A question only she could answer. 

0,2254251414,Sat Jun 20 09:27:42 PDT 2009,NO_QUERY,shariselw,@ashleybroadnax now its at the sad part when he didnt show up.  i HATE this part. . .

0,2254251417,Sat Jun 20 09:27:42 PDT 2009,NO_QUERY,ahoydivision,someone do a reverse rain dance and send this shitty weather away!  #mermaidparade

0,2254251493,Sat Jun 20 09:27:42 PDT 2009,NO_QUERY,MiaLotta,Headaches back 

0,2254251538,Sat Jun 20 09:27:43 PDT 2009,NO_QUERY,deannersss,@lightsresolve feel better matt  xo

0,2254251557,Sat Jun 20 09:27:43 PDT 2009,NO_QUERY,shesherara,Just finished set up in the pouring rain. Bands have started going on. Few peeps in da streets. Am worried about tryna sell soggy pillows 

0,2254251566,Sat Jun 20 09:27:43 PDT 2009,NO_QUERY,haleyFNdennis,T-minus 31 hours until I move to Oklahoma. 

0,2254251690,Sat Jun 20 09:27:43 PDT 2009,NO_QUERY,aslesinski,@Mostar  let me know how it was!

0,2254252116,Sat Jun 20 09:27:46 PDT 2009,NO_QUERY,bethdelusional,@Beetthhoxo I feel exactly the same  My stomach hates me.

0,2254252120,Sat Jun 20 09:27:46 PDT 2009,NO_QUERY,uberingram,Despite my growing hatred for Windows in general I'm really digging on Window Media Center.   I've tried foobar but it ran like ass.

0,2254252136,Sat Jun 20 09:27:46 PDT 2009,NO_QUERY,LaydeeEnCee,"I was really hoping it didn't, but this rain is killing my day already "

0,2254252391,Sat Jun 20 09:27:47 PDT 2009,NO_QUERY,em_dude,cramps r no fun. pure pain 

0,2254253879,Sat Jun 20 09:27:56 PDT 2009,NO_QUERY,joloboie,the rain........ oh the rain 

0,2254254053,Sat Jun 20 09:27:57 PDT 2009,NO_QUERY,FakeHollywood,@KeishaKash you aren't the only one  i thought it was next week!

0,2254254534,Sat Jun 20 09:27:59 PDT 2009,NO_QUERY,Lizaax3,"i miss you  its still a long time, until you come home "

0,2254254551,Sat Jun 20 09:27:59 PDT 2009,NO_QUERY,halbug,@Jatheree are you all by yourself? 

0,2254254787,Sat Jun 20 09:28:01 PDT 2009,NO_QUERY,triiishh,I ate half the tub of ice-cream! I would've finished it off if it wasn't for my parents 

0,2254254798,Sat Jun 20 09:28:01 PDT 2009,NO_QUERY,mmaddielion,building day.  ugh.  &amp; i thought i would be able to hang out with friends.  

0,2254254991,Sat Jun 20 09:28:02 PDT 2009,NO_QUERY,JustMelly,gawdd some people are mean 

0,2254255144,Sat Jun 20 09:28:03 PDT 2009,NO_QUERY,W_Ent,at work today.  Deciding on where to go for lunch... hmmmm

0,2254255469,Sat Jun 20 09:28:05 PDT 2009,NO_QUERY,bjones0011,@cullenboy 4 now. The visitors are getting here now 

0,2254255699,Sat Jun 20 09:28:06 PDT 2009,NO_QUERY,Ryannktsu,"Flying jitters yay!  I don't fly well, at all.  "

0,2254255727,Sat Jun 20 09:28:06 PDT 2009,NO_QUERY,raqinqredbone,raleigh is wackk . i miss ahoskie 

0,2254255833,Sat Jun 20 09:28:07 PDT 2009,NO_QUERY,kenneally2,Waiting for the sunshine 

0,2254256165,Sat Jun 20 09:28:08 PDT 2009,NO_QUERY,lemonayd,WoW's 3.2 notes makes me want to play again 

0,2254256307,Sat Jun 20 09:28:09 PDT 2009,NO_QUERY,severly01,I jumped i the water forgetting my phone was in my pocket. Its broken now 

0,2254256365,Sat Jun 20 09:28:10 PDT 2009,NO_QUERY,iCherAnn,i got a cold  vancouver weather changed so fast. was so used to the sun and heat..

0,2254256475,Sat Jun 20 09:28:10 PDT 2009,NO_QUERY,laurasymonds,Prom was fantastic! Really enjoyed it. It's just sad there's so may people I'll never see again 

0,2254256835,Sat Jun 20 09:28:12 PDT 2009,NO_QUERY,PrincessxEmma,Can't believe i decked it last night haha thn banged my head i now had a lump 

0,2254257220,Sat Jun 20 09:28:14 PDT 2009,NO_QUERY,manicpop,"i'm already following 43 people, i haven't even had this account for 12 hours yet   i don't know if i should be disappointed or proud."

0,2254257228,Sat Jun 20 09:28:14 PDT 2009,NO_QUERY,sarahar092,@katia12 i know  whatever i exposed you to &quot;real&quot; toronto where they play kings and have old men who are more glamorous then me. REAL TALK

0,2254257620,Sat Jun 20 09:28:17 PDT 2009,NO_QUERY,popcorn44,@SarahRoseMusic so I wished her happy both holidays. Then we started talking a lot and I askedbfor a pic but she said no  ....

0,2254258232,Sat Jun 20 09:28:20 PDT 2009,NO_QUERY,Kisses_And_Love,@chrishasboobs Hey what's been up latley Chrisy? You haven't twittering that much. 

0,2254258335,Sat Jun 20 09:28:21 PDT 2009,NO_QUERY,Rachalot,is working 2-close 

0,2254258973,Sat Jun 20 09:28:24 PDT 2009,NO_QUERY,Caestellase,"i never wanted to be ur ex-besties.I wanted u be my besties 4ever.! polkadot,seriosa,ags,haha. I miss you all.! "

0,2254259036,Sat Jun 20 09:28:25 PDT 2009,NO_QUERY,Maggss,@Zeuginy I think it is the server. 

0,2254259056,Sat Jun 20 09:28:25 PDT 2009,NO_QUERY,BubblesChloo,Shattered after a day of walking 

0,2254259100,Sat Jun 20 09:28:25 PDT 2009,NO_QUERY,charcopley,"I only have 5 followers, I want more "

0,2254259173,Sat Jun 20 09:28:25 PDT 2009,NO_QUERY,cancerlady84,http://twitpic.com/7wrz6 - Puddin in her hospital gown 

