0,1880058426,Thu May 21 23:58:21 PDT 2009,NO_QUERY,paranoia_suxx,I am up waaaaay to early considering I have nothing to do today. I blame my stupid ear 

0,1880058722,Thu May 21 23:58:25 PDT 2009,NO_QUERY,Panda_s1,"@Lyzee42 Oh dear, I hope she's okay "

0,1880058985,Thu May 21 23:58:28 PDT 2009,NO_QUERY,SarahMorrison,I am gonna throw up again 

0,1880059055,Thu May 21 23:58:29 PDT 2009,NO_QUERY,hayles,"It was so nice and sunny this morning, now it's raining and grey "

0,1880059058,Thu May 21 23:58:29 PDT 2009,NO_QUERY,VegasDiamond,"@krystaldelacruz I know, my husband is pissed off "

0,1880059061,Thu May 21 23:58:29 PDT 2009,NO_QUERY,idazlious,5) Stuff my face with food 6) Pick my mum up lol 7) Do the washing.  8) Twitter. 9) Get more money.

0,1880059191,Thu May 21 23:58:31 PDT 2009,NO_QUERY,mmacrae48,not liking ga weather! 

0,1880059445,Thu May 21 23:58:34 PDT 2009,NO_QUERY,bitchRix,missing someone..  can't believe i will miss him..

0,1880060096,Thu May 21 23:58:42 PDT 2009,NO_QUERY,heytheregloria,Im stupid. Really really dumb. 

0,1880060195,Thu May 21 23:58:43 PDT 2009,NO_QUERY,chocolate_dip,@nettabrielle congrats girl!! I wish I wasn't at work tonight  but I know you did wonderfully! I'm soooooo proud of you!!

0,1880060332,Thu May 21 23:58:45 PDT 2009,NO_QUERY,DivineChihuahua,@RnRyorkiemom They treat me like I'm making up the pain to get pills regardless of my diagnosis of Fibromyalgia. It's really frustrating 

0,1880060855,Thu May 21 23:58:51 PDT 2009,NO_QUERY,RAVERJONO,"Just got home. Good afternoon, although I forgot to get my lightbulb. "

0,1880060967,Thu May 21 23:58:52 PDT 2009,NO_QUERY,rubyrafael,"Got headache  so,i shouldnt have to attend LIA,should i? mmmph"

0,1880061097,Thu May 21 23:58:54 PDT 2009,NO_QUERY,phantastic95,I'd love the song Every Part Of Me but it's not been released or leaked HQ full yet 

0,1880061324,Thu May 21 23:58:57 PDT 2009,NO_QUERY,GarageGlamorous,@popbytes I swear I was supposed to live through that era...but something went horribly wrong 

0,1880061339,Thu May 21 23:58:57 PDT 2009,NO_QUERY,msslf7,@queenmeemee thatgon be cool for the holiday. Going to the A? I gotta work this weekend  boooooo

0,1880061457,Thu May 21 23:58:58 PDT 2009,NO_QUERY,mariusoczon,@m3anstreak me too. 

0,1880061521,Thu May 21 23:58:59 PDT 2009,NO_QUERY,atarigeek,@hugosdad sorry  im sure thats my fault

0,1880062119,Thu May 21 23:59:05 PDT 2009,NO_QUERY,ganeshkn,Datacard not working.. browsing frm office.. 

0,1880062598,Thu May 21 23:59:11 PDT 2009,NO_QUERY,chrismahon,"@jonathanchong By the way dude, having to work from home again as machine still not setup "

0,1880063195,Thu May 21 23:59:18 PDT 2009,NO_QUERY,N_sweetie,its winter im cold   my sailor is away so sleeping alone again tonight.

0,1880063295,Thu May 21 23:59:19 PDT 2009,NO_QUERY,chadfu,@teeeeeef I hear ya! I can't imagine being twitterless...I don't know what the answer is. 

0,1880063585,Thu May 21 23:59:22 PDT 2009,NO_QUERY,Thalia_S,@RosaStergio den tha erthw telika shmera poulaki...   isws na meinw to sabbato thes/niki.tha doume.etsi ki alliws tlm aurio apo konta!

0,1880063703,Thu May 21 23:59:23 PDT 2009,NO_QUERY,deedeeamin,is having a major soar throat. 

0,1880064069,Thu May 21 23:59:28 PDT 2009,NO_QUERY,Socks01,Half the skools gone and theres only 50 peeps left 

0,1880064426,Thu May 21 23:59:32 PDT 2009,NO_QUERY,rachborntorun,It's so early   

0,1880065089,Thu May 21 23:59:39 PDT 2009,NO_QUERY,OGemilyhall,Dad closed the family business  tonight after 100 years in the movie business       http://bit.ly/vG0OA

0,1880065129,Thu May 21 23:59:39 PDT 2009,NO_QUERY,jose9,Too many Friday lollies 

0,1880065846,Thu May 21 23:59:47 PDT 2009,NO_QUERY,MZenani,@ilikecupcakes that?sucks balls. I'm sorry. A Toyota clipped my back wheel when I was changing lanes on the 105 and he sped up to stop me 

0,1880066094,Thu May 21 23:59:50 PDT 2009,NO_QUERY,lezizzle,@akennedy23 june can't come soon enough   insufficient

0,1880066264,Thu May 21 23:59:52 PDT 2009,NO_QUERY,JoshuaSacramoni,"up at 7:45am.......not a morning person, particularly when it comes to being up to revise before a 9.30 exam "

0,1880066443,Thu May 21 23:59:54 PDT 2009,NO_QUERY,MadreDeLosGatos,@mimirenee 

0,1880066684,Thu May 21 23:59:58 PDT 2009,NO_QUERY,KyzerSoze,my work week begins here 

0,1880066885,Fri May 22 00:00:00 PDT 2009,NO_QUERY,Brenna_Bee,hates being broke  especially on the weekend to cause all i wana do is go out

0,1880068812,Fri May 22 00:00:15 PDT 2009,NO_QUERY,Haley311,"srs bsns circulating around the 311BB, and its keeping me up past 3AM "

0,1880069275,Fri May 22 00:00:18 PDT 2009,NO_QUERY,ravikanth,oops...just realized that my car insurance got expired  calling up those folks

0,1880069320,Fri May 22 00:00:19 PDT 2009,NO_QUERY,vanessawest,@nagelface Awww so sweet! I'm sad that I had to miss it 

0,1880069460,Fri May 22 00:00:20 PDT 2009,NO_QUERY,Mandyboo92,my baby went to sleep  boreddd!

0,1880069491,Fri May 22 00:00:20 PDT 2009,NO_QUERY,OxyContin,Who misses the Internet?  I do.  

0,1880069665,Fri May 22 00:00:22 PDT 2009,NO_QUERY,Spidersamm,"got our music performance out of the way today, it wasnt as hectic as i though..mainly cos im a bass extraudonaire,hahahah not really but "

0,1880070240,Fri May 22 00:00:27 PDT 2009,NO_QUERY,stokely,@jasondunstone The email address on your website doesn't work. 

0,1880070425,Fri May 22 00:00:29 PDT 2009,NO_QUERY,marion_shaw,Another Grey wet day in Dun Laoghaire  On the up side it is FRIDAY! WOO HOO

0,1880070531,Fri May 22 00:00:30 PDT 2009,NO_QUERY,scampbell734,hates trying to get out of bed in the mornings 

0,1880070908,Fri May 22 00:00:34 PDT 2009,NO_QUERY,Mona26,@luv2shopinay oh yeah the previews looked awesome 

0,1880071275,Fri May 22 00:00:37 PDT 2009,NO_QUERY,teeeeeef,-@chadfu i will miss you guys so much  ...i will be crying on tv to barbara walters lol

0,1880071349,Fri May 22 00:00:38 PDT 2009,NO_QUERY,emmammme,why isnt it stopping 

0,1880071495,Fri May 22 00:00:39 PDT 2009,NO_QUERY,TroyEspiritu,"After a long  time of searching, I'm already feeling the vibe of the things I love to do in life. Then I realize, &quot;I'm turning 24&quot; "

0,1880071518,Fri May 22 00:00:39 PDT 2009,NO_QUERY,STeFF722,"I came to meet tesha, took a shot, got my car towed, luckily a friend saw it  , went n got it and I'm back at the bar already"

0,1880071740,Fri May 22 00:00:41 PDT 2009,NO_QUERY,stealthpixie,"@chriswindram rumours are not nice  don't be sad, you are a wonderful person  xxx"

0,1880071763,Fri May 22 00:00:44 PDT 2009,NO_QUERY,recycledstars,@stickypearls  good luck.

0,1880071927,Fri May 22 00:00:43 PDT 2009,NO_QUERY,cloverdash,"@leannenufc Oooh I wish! The boys were munching bacon butties yesterday &amp; stinking the house out with gorge food smells, the meanies "

0,1880072308,Fri May 22 00:00:48 PDT 2009,NO_QUERY,senoshi,"@laienne hgskfhkfhk!!! OMG, you look gorgeous in that piratey outfit!    Also, I am so jealous of your pancakes "

0,1880072514,Fri May 22 00:00:50 PDT 2009,NO_QUERY,mynamewastaken,is lonely girl for the weekend 

0,1880072643,Fri May 22 00:00:51 PDT 2009,NO_QUERY,dreakills,"its raining, its pouring, and I love it. hopefully my tunnels get here tomorrow otherwise I won't get them til tues. or wed. "

0,1880072674,Fri May 22 00:00:51 PDT 2009,NO_QUERY,nylahsmomma,Wooow! Just spent an hour tryin to get the keys out of a locked car WHILE the car was running!  wasted hella gas. Jharp late for work.

0,1880072796,Fri May 22 00:00:53 PDT 2009,NO_QUERY,fwenzel,"@JabbaDow grrrr. Due to starting my job later in the year, I get reduced vacation this year "

0,1880072979,Fri May 22 00:00:54 PDT 2009,NO_QUERY,caelagoestweet,Happy birthday me!  Happy birthday evil identical twin! We're old 

0,1880073361,Fri May 22 00:00:59 PDT 2009,NO_QUERY,schmoo_pr,@khillPurdue  i miss u too......  

0,1880074138,Fri May 22 00:01:10 PDT 2009,NO_QUERY,AmandaNeuman,"Listening to incubus after seeing the black heart inertia video, why isn't it available to buy on itunes!? It's not fair "

0,1880074691,Fri May 22 00:01:15 PDT 2009,NO_QUERY,fwzynn,@raracandyfloss hoi i nk away plk  nk msk wkakakkakakaka benci btol td x de line skrg nk kene msk susah tau haih

0,1880074959,Fri May 22 00:01:17 PDT 2009,NO_QUERY,JMARCS,i didn't clean...i over-twittered instead 

0,1880075100,Fri May 22 00:01:19 PDT 2009,NO_QUERY,bekkka_,"omg, my eyes keep closing my sidekick hasnt arrived "

0,1880075343,Fri May 22 00:01:21 PDT 2009,NO_QUERY,twilighterteegs,YAY!!!! Weekend finally here!! but how can i enjoy when i have tons of homework!!!! 

0,1880075346,Fri May 22 00:01:21 PDT 2009,NO_QUERY,Jasselle,"Has officially left the building  Goodbye dorm room, Spens-Black #613. You were my home away from home. Aw, it's so hard to say goodbye."

0,1880075390,Fri May 22 00:01:22 PDT 2009,NO_QUERY,ohnoitslinnette,"due to my friend's constant reminder to me that its sixteen days until school, i'm starting to loose the feeling of summer. "

0,1880075595,Fri May 22 00:01:24 PDT 2009,NO_QUERY,kellycdb,"@Delta224 Aww, damn... I hate that! "

0,1880075984,Fri May 22 00:01:28 PDT 2009,NO_QUERY,natz2010,I'm going to have to reinstall WoW  It is broken... again...

0,1880076258,Fri May 22 00:01:32 PDT 2009,NO_QUERY,Socks01,No-one belives im a beta  But ill put it in my avatar to proove it! :@

0,1880076283,Fri May 22 00:01:32 PDT 2009,NO_QUERY,jkaine11,hey you have any advice for me? i have been falling behind in school but can't seem to bring myself to do my work 

0,1880076674,Fri May 22 00:01:37 PDT 2009,NO_QUERY,mksmith2,"Double bugger, this ear wax removal stuff isn't working as I had hoped...guess I'm off to the doctor tomorrow. "

0,1880076783,Fri May 22 00:01:38 PDT 2009,NO_QUERY,MrsColman,Annoyed that Sainsbugs online isn't working 

0,1880076869,Fri May 22 00:01:39 PDT 2009,NO_QUERY,ashrose,Cant sleep .... My mind is still on the college sleep clock 

0,1880076957,Fri May 22 00:01:40 PDT 2009,NO_QUERY,dunkdaft,Is Twitter becoming a bookmarking site?     @twitter

0,1880077000,Fri May 22 00:01:40 PDT 2009,NO_QUERY,StephoneyAnnexo,@Riskybusinessmb we just got here and youre gone 

0,1880077351,Fri May 22 00:01:44 PDT 2009,NO_QUERY,glomontiel2003,@SassyGal07 still don't quite know...i'm going to chcecck in at school tomorrow 

0,1880077509,Fri May 22 00:01:46 PDT 2009,NO_QUERY,sabel_b,@mcapil gross. stats is full!! 

0,1880077584,Fri May 22 00:01:47 PDT 2009,NO_QUERY,mustntgrumble,Oh bum - just had notification that my book for #wossybookclub has been posted! Looks like I won't get it in time to read for Sunday 

0,1880077742,Fri May 22 00:01:48 PDT 2009,NO_QUERY,craigalexander,@BryanMouat morrissey 50? my god do i feel old 

0,1880077801,Fri May 22 00:01:49 PDT 2009,NO_QUERY,alicianospace,slumber party minus paul and megan cuz theyre leaving 

0,1880079062,Fri May 22 00:02:03 PDT 2009,NO_QUERY,hathari,@artric I suppose so 

0,1880079360,Fri May 22 00:02:07 PDT 2009,NO_QUERY,kenkancal,So pain is 80% gone but replaced w/ a fever.... FAIL 

0,1880079535,Fri May 22 00:02:09 PDT 2009,NO_QUERY,Mildredo,Last day of college today.  And I've forgotten what it's like to have more than 5 hours sleep... *snore*

0,1880079563,Fri May 22 00:02:09 PDT 2009,NO_QUERY,kbal24,"@kayleelovexx Poor puppy! Puppies should never be sick, it's just no fun "

0,1880080136,Fri May 22 00:02:16 PDT 2009,NO_QUERY,ketene,ugh i keep crying at work. 

0,1880080259,Fri May 22 00:02:18 PDT 2009,NO_QUERY,breatheitin,"Man I'm a lil upset, no kole...  well I didn't see her"

0,1880080742,Fri May 22 00:02:23 PDT 2009,NO_QUERY,Daveuk12001,@Rick_Stronghold oh I dunno then 

0,1880080999,Fri May 22 00:02:26 PDT 2009,NO_QUERY,willtompsett,"#followfriday loads more but can't list them all now  check my followong list though, they're all worth it!!!"

0,1880081034,Fri May 22 00:02:26 PDT 2009,NO_QUERY,chrisRRR,@oohlatara what does? 

0,1880081056,Fri May 22 00:02:27 PDT 2009,NO_QUERY,New_Invention,@ladyspeaker Ouch! I hope you're okay.  Yep. Heels are the invention of a misogynistic man.: @ladyspeaker Ouch.. http://tinyurl.com/pet794

0,1880081194,Fri May 22 00:02:28 PDT 2009,NO_QUERY,katytron,@dsturnbull also it corrects fucking to ducking 

0,1880081269,Fri May 22 00:02:29 PDT 2009,NO_QUERY,KHarbourt,I now want a Crushroom!!!  

0,1880081401,Fri May 22 00:02:31 PDT 2009,NO_QUERY,fakedarren,"Why do I feel so hungover, I only had a couple of pints last night! Unacceptable "

0,1880081455,Fri May 22 00:02:31 PDT 2009,NO_QUERY,thepetshopboy,"@stnihu delphic, deadmau5 AND little boot...lucky...lucky...lucky...jealous...jealous...jealous "

0,1880081586,Fri May 22 00:02:32 PDT 2009,NO_QUERY,iYNGLEO,i wish my phone could play videos  cant wait til i get my computer back

0,1880082010,Fri May 22 00:02:37 PDT 2009,NO_QUERY,laurenjessicaH,"Val and Jacobe made me sad  I know they were talking to my brother, cuz they know I'll listen to Val she the best Role Model ever luvher&lt;3"

0,1880082092,Fri May 22 00:02:38 PDT 2009,NO_QUERY,lescalera,wired to the wallllls and i have to work in 6 hours 

0,1880082226,Fri May 22 00:02:40 PDT 2009,NO_QUERY,laaaur,Up so early.. Really don't want to go to work 

0,1880082397,Fri May 22 00:02:42 PDT 2009,NO_QUERY,babyxkeiks,to end the night 

0,1880082605,Fri May 22 00:02:44 PDT 2009,NO_QUERY,DEZoh,@xdarthtaberx i don't ever want to see you angry 

0,1880082786,Fri May 22 00:02:46 PDT 2009,NO_QUERY,mikedeleon,@katelynfBABY I know. Since I'm such a loner right? 

0,1880083304,Fri May 22 00:02:52 PDT 2009,NO_QUERY,jaimilicious,"I am hurting  post surgery made worse by migraines,worse from Endometriosis&amp; end of 'Seasonel' BCP cycle, on top of Fibro pain &amp; weather"

0,1880083401,Fri May 22 00:02:54 PDT 2009,NO_QUERY,_izzy_,is wishing she was at Leaky Con 

0,1880083955,Fri May 22 00:03:00 PDT 2009,NO_QUERY,MigSSaavedra,We lost again at G Arena..   I'll play again later &quot;

0,1880084086,Fri May 22 00:03:02 PDT 2009,NO_QUERY,holycrap09,the 140 character limit in twitter sucks 

0,1880084779,Fri May 22 00:03:09 PDT 2009,NO_QUERY,imnickyip,@alexkillby oh well.. they didnt really like.. do anything WRONG..  i think i'll just wait... 

0,1880084797,Fri May 22 00:03:09 PDT 2009,NO_QUERY,lydiacaitlin,YAY 9 sleeps until mtv awards 2009...so watching it! School update = LAME 9as usual) SHIT WEATHER HERE IN CHRISCHURCH &amp; it not winter yet 

0,1880084867,Fri May 22 00:03:10 PDT 2009,NO_QUERY,cHeezAy,cut my bangs too short!!!  gonna have to pull off a slight side bang look....

0,1880085123,Fri May 22 00:03:13 PDT 2009,NO_QUERY,bells911,i miss my friends in the other school sooo much i didn't see them 4 almost 3 weeks 

0,1880085195,Fri May 22 00:03:14 PDT 2009,NO_QUERY,xstefakneex,P.S. I miss my boyfriend  a lot.

0,1880085351,Fri May 22 00:03:16 PDT 2009,NO_QUERY,teacupcoeur,In Virginia! I forgot the sandwiches I made for the roadtrip at home. 

0,1880085605,Fri May 22 00:03:18 PDT 2009,NO_QUERY,dreamboi,@TootsiiePop....so not fair I been askin for a movie date gurl..nobody wanna take me..  guess im washed up..lol

0,1880085821,Fri May 22 00:03:21 PDT 2009,NO_QUERY,jessisabellB,My throath is burning  it feels like it 

0,1880085935,Fri May 22 00:03:22 PDT 2009,NO_QUERY,courtneyyy3,@RiskyBusinessMB i wish i could have been there 

0,1880086025,Fri May 22 00:03:23 PDT 2009,NO_QUERY,kikomonsterx,what the heck is wong with eradioportal?!? 

0,1880086156,Fri May 22 00:03:24 PDT 2009,NO_QUERY,TotallyM,I have a head ache... 

0,1880086341,Fri May 22 00:03:26 PDT 2009,NO_QUERY,LizBloxsom,month of hell continues.. was just in a car accident 

0,1880086640,Fri May 22 00:03:29 PDT 2009,NO_QUERY,MeganPSHouston,"I don't know if you guys saw and I'm just late on the tweeting, but Gallery furniture went up in flames this evening. Crazy! So sad "

0,1880086787,Fri May 22 00:03:31 PDT 2009,NO_QUERY,jobeaz,@earleyedition so sorry to hear about your nan 

0,1880087145,Fri May 22 00:03:35 PDT 2009,NO_QUERY,incongruous,@ketene   *glomps you*

0,1880087259,Fri May 22 00:03:36 PDT 2009,NO_QUERY,nanapm,SF Giants what happened in the 9th tonight. 

0,1880087298,Fri May 22 00:03:37 PDT 2009,NO_QUERY,plumsiren,my whole body aches like i have the flu 

0,1880087339,Fri May 22 00:03:37 PDT 2009,NO_QUERY,heymcmuffin,"fucking work. i made �10 yesterday, for a full days graft "

0,1880087473,Fri May 22 00:03:38 PDT 2009,NO_QUERY,mzhanna,what am i supposed to do on a rainy friday night?? 

0,1880087641,Fri May 22 00:03:40 PDT 2009,NO_QUERY,_ashul,ANGRY - 3 days spent moving sites from one data center to the other notifying customers and planning - outage gets canceled - billable? n 

0,1880087851,Fri May 22 00:03:43 PDT 2009,NO_QUERY,zoeelvins,Off to school for an hour  then home again

0,1880088184,Fri May 22 00:03:46 PDT 2009,NO_QUERY,lydiacaitlin,YAY 9 sleeps until mtv awards 09..so watching it! School update = LAME 9as usual) SHIT WEATHER HERE IN CHRISTCHIRCH &amp; IT NOT WINTER YET 

0,1880088307,Fri May 22 00:03:48 PDT 2009,NO_QUERY,themarvelous,can't sleep again... stupid sugar!!! 

0,1880088451,Fri May 22 00:03:49 PDT 2009,NO_QUERY,leslierosales,"@nnamdi_okafor Yea, I just did. But you're not popping up online "

0,1880088476,Fri May 22 00:03:50 PDT 2009,NO_QUERY,ivey3671,restless . . . so tired 

0,1880088777,Fri May 22 00:03:53 PDT 2009,NO_QUERY,ganeshkn,Datacard not working.. had to rush to office.. 

0,1880088942,Fri May 22 00:03:55 PDT 2009,NO_QUERY,melissaaaaaaaaa,only 5 oclock 

0,1880089459,Fri May 22 00:04:00 PDT 2009,NO_QUERY,weremidget,"weird mood like im worrying about something i dont know what it is yet, i just got a bad feeling for some reason "

0,1880089657,Fri May 22 00:04:02 PDT 2009,NO_QUERY,tathamoddie,@corneliu I'm presenting at #auremix! I'll be there ... It's @ducas who's depressed about not being able to make it. 

0,1880089835,Fri May 22 00:04:04 PDT 2009,NO_QUERY,Myjadedsavior,No quote from telly or movies today 

0,1880089848,Fri May 22 00:04:04 PDT 2009,NO_QUERY,SankofaSoul77,6 am is far too early for a mixture of seventh graders and dirty school bus. Cringe 

0,1880090550,Fri May 22 00:04:12 PDT 2009,NO_QUERY,funkcrusader,blames the Lakers loss on himself...I slept through the game to leave for Miami...I ididn't feed them any positive energy in my tweets 

0,1880090588,Fri May 22 00:04:13 PDT 2009,NO_QUERY,wesaysummerrr,I'm so hungry it hurts 

0,1880090907,Fri May 22 00:04:16 PDT 2009,NO_QUERY,HotMess4CCNK,@PandaMayhem LOL! I actually forgot *gasp* I'm a sinner. 

0,1880090982,Fri May 22 00:04:17 PDT 2009,NO_QUERY,lydiacaitlin,YAY 9 sleeps until mtv awards 09..so watching it! School update = LAME 9as usual) SHIT WEATHER HERE IN CHRISTCHURCH &amp; IT NOT WINTER YET 

0,1880091064,Fri May 22 00:04:17 PDT 2009,NO_QUERY,raefon12,wow anotha sleepless night!.....help  lol

0,1880091141,Fri May 22 00:04:18 PDT 2009,NO_QUERY,haushi87,I'm so tired  I'm literally passing out! We gonna have to celebrate tomorrow

0,1880091588,Fri May 22 00:04:23 PDT 2009,NO_QUERY,LynziMarie,Well I ordered style warriors on Tuesday.... Won't be in until friggin next Thursday  sad story!

0,1880091664,Fri May 22 00:04:24 PDT 2009,NO_QUERY,1Ele,@djgiovanny Noo Don't be mad!! I'm sry 

0,1880091718,Fri May 22 00:04:25 PDT 2009,NO_QUERY,AceArtemis7,"@Piercing_thesky o_o Damn! Ill stick with my $25 Mp3 player for now. Im too poor for that. And if i werent, i am now cause of yesterday "

0,1880091803,Fri May 22 00:04:26 PDT 2009,NO_QUERY,scenariogirl,"Only disappointing part of @shanemo's preso was that he said he was going to show us his rear, but didn't "

0,1880092200,Fri May 22 00:04:30 PDT 2009,NO_QUERY,elanaskye,"I miss duck hunt  Im gonna come over and you're going to let me play, k thanks. @chasepino"

0,1880092783,Fri May 22 00:04:37 PDT 2009,NO_QUERY,jwan808,Wanna go to sleep but allergies are still kickin my butt.... Claritin 24 has failed me 

0,1880092793,Fri May 22 00:04:37 PDT 2009,NO_QUERY,lisaxjbx3,@RiskyBusinessMB I wish I could have gone! I live to far away though! 

0,1880092919,Fri May 22 00:04:39 PDT 2009,NO_QUERY,CATHYDUHH,@RiskyBusinessMB aww wish i couldve been there  well next time for sure!

0,1880093245,Fri May 22 00:04:43 PDT 2009,NO_QUERY,Leik_Leviathn,Wondering what is going to be on 106.5 KWOD after 9:00am tomorrow 

0,1880093295,Fri May 22 00:04:43 PDT 2009,NO_QUERY,sarahmurrell,"@hypnotistchris Morning! Thanks for last weeks #followfriday - sadly, no new followers and no one has tweeted me for a whole week "

0,1880093612,Fri May 22 00:04:47 PDT 2009,NO_QUERY,liliona,@BattleWizzard .....pssssssssst! Hey you!!    Im worried

0,1880093638,Fri May 22 00:04:47 PDT 2009,NO_QUERY,eatupsf,"Tonight at Mission Street Food: Trumpet mushrooms with 3x fried potatoes in flatbread: sleeper hit! Tongue, lamb good. No sliders left "

0,1880093666,Fri May 22 00:04:47 PDT 2009,NO_QUERY,alexroots,"On route to secondary school number one, secondary's are the scary one's i hope they are nice  Xxx"

0,1880093713,Fri May 22 00:04:48 PDT 2009,NO_QUERY,SchoolDuggery,Oh no. Teacher facing disciplinary in Argyll and Bute is one of my network. Really sorry. 

0,1880093937,Fri May 22 00:04:50 PDT 2009,NO_QUERY,writer2day,@EricRobertsER Not happy to hear that about the Sex &amp; the City women 

0,1880094246,Fri May 22 00:04:54 PDT 2009,NO_QUERY,ChaniiChan,@semplyabelle aww  ur makin me sad

0,1880094312,Fri May 22 00:04:55 PDT 2009,NO_QUERY,ScottLezak,@Christa_137 I would miss you 

0,1880094318,Fri May 22 00:04:55 PDT 2009,NO_QUERY,cmoore09,Good day gone horrible. Watching &quot;Seven Pounds.&quot; I need better friends. 

0,1880094395,Fri May 22 00:04:56 PDT 2009,NO_QUERY,DawgOnU,This 2 to 3 hours asleep at night just isn't work 

0,1880094783,Fri May 22 00:05:00 PDT 2009,NO_QUERY,Vemsteroo,Trying to wake up  Sudden and desperate urge to play Escape from Monkey Island... I'm sure I bought it for the Mac years ago!

0,1880094793,Fri May 22 00:05:00 PDT 2009,NO_QUERY,henhenmom,"@mamarissa It's full of scams now, every other listing is a stupid scammer. It annoys me. "

0,1880094999,Fri May 22 00:05:02 PDT 2009,NO_QUERY,bobbyMGF,"Albuquerque show cancelled  not our fault, I promise. Unfortunate events, hope all is well!"

0,1880095041,Fri May 22 00:05:02 PDT 2009,NO_QUERY,Kate_____x,Has a really sore throat 

0,1880095043,Fri May 22 00:05:02 PDT 2009,NO_QUERY,failwatcher,FAIL! @jwan808: Wanna go to sleep but allergies are still kickin my butt.... Claritin 24 has failed me 

0,1880095161,Fri May 22 00:05:03 PDT 2009,NO_QUERY,Marjoray,stomach is feeling uneasy. can't wait to have the doctor diagnose it tomorrow. hopefully it's nothing too extreme 

0,1880095270,Fri May 22 00:05:04 PDT 2009,NO_QUERY,GeraldTC,"Don't know why my humans keep leaving the house in the morning! When I first moved in they were on caternity leave, but not anymore. "

0,1880095334,Fri May 22 00:05:05 PDT 2009,NO_QUERY,danewilliams,Kind of pissed that I'm considering grad school again. I thought I was done 

0,1880095370,Fri May 22 00:05:05 PDT 2009,NO_QUERY,CforrClemmensen,thnk for putting up with my flooding ill stop now im soori 

0,1880095385,Fri May 22 00:05:05 PDT 2009,NO_QUERY,Jessica_Clem,So Bored now that Garrett left! 

0,1880095525,Fri May 22 00:05:06 PDT 2009,NO_QUERY,alexhendershott,"@thinkaboutart I would really rather be sleeping though, ha.  I need some sleeping pills to knock me out. Working on anything interesting?"

0,1880095685,Fri May 22 00:05:08 PDT 2009,NO_QUERY,AlluringBri,@Redgie ugh he's even hard to watch on the hills. but he has my fav car  bmw 650

0,1880096019,Fri May 22 00:05:12 PDT 2009,NO_QUERY,AnouckB,I'm eating cereal; sulking because I broke my washing machine 

0,1880096266,Fri May 22 00:05:14 PDT 2009,NO_QUERY,faeristar,@fi69urgh i feel your pain  i get a hangover from going to bed late with or without alcohol .so what fandabbydosey stuff u doing today ?

0,1880096318,Fri May 22 00:05:15 PDT 2009,NO_QUERY,infectedarea,Didn't get mutantized...   

0,1880096398,Fri May 22 00:05:16 PDT 2009,NO_QUERY,addamh,Not shit to do for the rest of the night 

0,1880096446,Fri May 22 00:05:16 PDT 2009,NO_QUERY,evancampcom,"Hoping emily-vancamp.com finds a new, driven, owner. They've all dropped like flies "

0,1880096469,Fri May 22 00:05:16 PDT 2009,NO_QUERY,smartbrain,"@stshuting virgin media has a limited rolout of 201 mbps in some towns,  but not yet manchester "

0,1880096620,Fri May 22 00:05:18 PDT 2009,NO_QUERY,RacingGirlUK,Off to my stressy job! So unhappy at the moment   Anybody want to employ a 37 yr old able lady?? Have cv ready.

0,1880096987,Fri May 22 00:05:22 PDT 2009,NO_QUERY,angeliDoo,REALLY WHAT IS GOING ON BETWEEN US?  missin u like hell!  hope ur day was ok .

0,1880097253,Fri May 22 00:05:25 PDT 2009,NO_QUERY,frockandroll,"@poppygallico Oh, that's terrible - I'm sorry!  ?"

0,1880097320,Fri May 22 00:05:25 PDT 2009,NO_QUERY,nathanrdotca,"@Axelsrose *eyebrow raise, then gives you a huuuge hug* That sucks... "

0,1880097569,Fri May 22 00:05:28 PDT 2009,NO_QUERY,melodyee,oh i see. . V. hahah  se where to much like them 

0,1880097868,Fri May 22 00:05:31 PDT 2009,NO_QUERY,joolzgirl,Am still stuck at my desk boohoo 

0,1880097939,Fri May 22 00:05:32 PDT 2009,NO_QUERY,traceydukes,@MissCocoaLuv I'm slow I live under a rock  I'm sorry! 
