0,2206372787,Wed Jun 17 06:26:32 PDT 2009,NO_QUERY,heathmccormick,@xrachelcahillx me too!  err i duno i think she said she was going to stay in and revise but im not sure.. are your mum + dad back?

0,2206379675,Wed Jun 17 06:27:11 PDT 2009,NO_QUERY,MoniqueDuPless,Some people have to actually work for a living 

0,2206379930,Wed Jun 17 06:27:13 PDT 2009,NO_QUERY,AntixOnline,"@roseybeth Unfortunately, said gnome was suicidal and headbutted a lamp post shortly after we met... Rest In Pieces, little fella "

0,2206380523,Wed Jun 17 06:27:16 PDT 2009,NO_QUERY,meiser88,tired  wish I could sleep more

0,2206381210,Wed Jun 17 06:27:20 PDT 2009,NO_QUERY,maddieangles,going to work  

0,2206381402,Wed Jun 17 06:27:21 PDT 2009,NO_QUERY,Krispyb,Didn't know it was possible to be bored of ice cream. 

0,2206381540,Wed Jun 17 06:27:22 PDT 2009,NO_QUERY,jameslangtonn,Shit orphadontist at half. 3 

0,2206381968,Wed Jun 17 06:27:24 PDT 2009,NO_QUERY,Tom_Tracey,Got up at 5:45 to work out and all of the machines in the hotel are busy...   Gonna try again shortly...

0,2206382727,Wed Jun 17 06:27:28 PDT 2009,NO_QUERY,veinte,i look fat in my new twitter photo. 

0,2206382957,Wed Jun 17 06:27:30 PDT 2009,NO_QUERY,kahloism,"Another day, more meetings=dreaded tension headaches "

0,2206382989,Wed Jun 17 06:27:30 PDT 2009,NO_QUERY,WalkingTheTrack,Drinking Coffee and munching on apples. yuuumm. Oh and revising 

0,2206383320,Wed Jun 17 06:27:33 PDT 2009,NO_QUERY,aarmitage,@campaignmonitor doesn't like my uploads today 

0,2206383340,Wed Jun 17 06:27:32 PDT 2009,NO_QUERY,pixelnoid,@pimparella one more week to wait for an answer 

0,2206383362,Wed Jun 17 06:27:32 PDT 2009,NO_QUERY,klodaasaporta,@trohman want worse? visit ireland! 3rd year of rain in a row! 

0,2206383417,Wed Jun 17 06:27:32 PDT 2009,NO_QUERY,ejmariano619,@jspotnigarma i dont need dougnuts. i need ah1n1!!!!!!!!!!!!!!!!!!!!!!!!!!!!!!!!!!!! now na. 

0,2206383606,Wed Jun 17 06:27:34 PDT 2009,NO_QUERY,Cloeee, my ear just started bleeding

0,2206383730,Wed Jun 17 06:27:34 PDT 2009,NO_QUERY,iris_lim,@brendanchng Yeah but if I don't use footnotes my word count would exceed 

0,2206383804,Wed Jun 17 06:27:34 PDT 2009,NO_QUERY,TinkerGrrl,"@mark32i5b think I posted enough letters for everyone! Roll on 6pm so I can get new software, cept will be more luke 10 when I finish "

0,2206383856,Wed Jun 17 06:27:35 PDT 2009,NO_QUERY,milkxtea,@thrila oh my. breakup 

0,2206384037,Wed Jun 17 06:27:36 PDT 2009,NO_QUERY,thisworld,"@marcusflint LOL, i know, right? i have to stick to a quote from twelfth night.  even if my sister's hair looks like wire."

0,2206384068,Wed Jun 17 06:27:36 PDT 2009,NO_QUERY,cloclo101,At home sick 

0,2206384401,Wed Jun 17 06:27:38 PDT 2009,NO_QUERY,cherryworld,wwooooww had a blast tonight. I will miss you guys so baaaad 

0,2206384709,Wed Jun 17 06:27:39 PDT 2009,NO_QUERY,Raydachic,@MaxxLaBella HAVE A GOOD ONE MAX.  I just woke up and it is already a sucky day. 

0,2206384876,Wed Jun 17 06:27:40 PDT 2009,NO_QUERY,shoestringing,@LADYwSENSE I do just LOVE animals....hate to see them suffer 

0,2206384897,Wed Jun 17 06:27:40 PDT 2009,NO_QUERY,diana0123,Too sick to go to the gym 

0,2206384935,Wed Jun 17 06:27:41 PDT 2009,NO_QUERY,foreverdazzled,damn im hungry its 2.28 pm and i havnt even had breakfast yet 

0,2206385016,Wed Jun 17 06:27:41 PDT 2009,NO_QUERY,angelacordero,i don't want to commute anymore!  just sucks!!

0,2206385107,Wed Jun 17 06:27:42 PDT 2009,NO_QUERY,kcwins,workin' in the rain 

0,2206385185,Wed Jun 17 06:27:42 PDT 2009,NO_QUERY,warneronstine,#amazon #fail I decided to buy some mp3 downloads from @amazonmp3 this morning with a gift certificate. It just charged me without asking 

0,2206385398,Wed Jun 17 06:27:43 PDT 2009,NO_QUERY,Alris,@SeanBeeson damn you - i can;t get the game till october 

0,2206385604,Wed Jun 17 06:27:44 PDT 2009,NO_QUERY,McKinnon92,my attempt at downloading OS 3 beta was a fail so I'll have to wait like everyone else 

0,2206385944,Wed Jun 17 06:27:46 PDT 2009,NO_QUERY,DjKaplin,"Waiting to go back to China, i so miss the culture there while i cant stand it here in the Uk anymore "

0,2206386610,Wed Jun 17 06:27:50 PDT 2009,NO_QUERY,HibaNick,"trying to fix my camera. it dropped today in the train, and it won't turn on - problem is, the lens are sticking out. "

0,2206386893,Wed Jun 17 06:27:51 PDT 2009,NO_QUERY,that_kat,@bambinogoodies  Milla kissed Monty's better and it worked!

0,2206386905,Wed Jun 17 06:27:52 PDT 2009,NO_QUERY,hamtra,Did you know that not everything that is shake enabled for the iPhone works for the Touch?  

0,2206387100,Wed Jun 17 06:27:53 PDT 2009,NO_QUERY,kavipaul,finally god helped me in identifying if i was in Love...and the answer is &quot;NO&quot; 

0,2206387242,Wed Jun 17 06:27:54 PDT 2009,NO_QUERY,originaldiva24,@PETEYG284 i THiNK i REALiZED U DON'T LOVE ME ANYMORE... 

0,2206387484,Wed Jun 17 06:27:55 PDT 2009,NO_QUERY,MeikeZane,@nadie20 &quot;The password you entered is not in our system&quot;. So it didn't work.. 

0,2206387897,Wed Jun 17 06:27:57 PDT 2009,NO_QUERY,MyBottlesUp,@heartmychloe we'll come home to annapolis on saturday...  

0,2206388041,Wed Jun 17 06:27:58 PDT 2009,NO_QUERY,ann_donnelly,It's hell being a little bit good at technology!  So much that's just outside the reach of your fingertips! **stretch** Not working 

0,2206388069,Wed Jun 17 06:27:58 PDT 2009,NO_QUERY,hillarymarie25,&quot;if it ain't on dirt. it ain't racing.&quot;....missing my racing boys  &lt;3

0,2206388190,Wed Jun 17 06:27:59 PDT 2009,NO_QUERY,MikeBrown7905,grade 12 history final today at noon! 

0,2206388758,Wed Jun 17 06:28:02 PDT 2009,NO_QUERY,hatty_g,"Naomi says hi, she has no twitter, she should get twitter, oh she's not allowed it, not even msn, poor child "

0,2206388842,Wed Jun 17 06:28:03 PDT 2009,NO_QUERY,pixie75,chemistry revision 

0,2206389369,Wed Jun 17 06:28:05 PDT 2009,NO_QUERY,JohnMReynolds,Looks like I'll be waiting until 2pm my time for my #iPhone 3.0 update.  

0,2206389441,Wed Jun 17 06:28:06 PDT 2009,NO_QUERY,snsmom18,@Mom_20  my 3 yr old up at 6:30 also 

0,2206389734,Wed Jun 17 06:28:08 PDT 2009,NO_QUERY,amaznmastermind,"@BiloxiWarTribe do you think i could burn a copy of your zwan cd, please, sir? mine disappeared. "

0,2206390203,Wed Jun 17 06:28:10 PDT 2009,NO_QUERY,Darren_Mack,@html5gallery Are there any HTML5 Cheat sheets available at the moment? The 300+ W3C document is a nightmare to trawl 

0,2206390312,Wed Jun 17 06:28:11 PDT 2009,NO_QUERY,ArchiStudent,I hate doing all the work for meetings and then not going to them.. 

0,2206390569,Wed Jun 17 06:28:12 PDT 2009,NO_QUERY,serbchicknaynay,who knew that drama hw would take my away my non school hours 

0,2206390601,Wed Jun 17 06:28:12 PDT 2009,NO_QUERY,lidasshi,@nadhirarchangel i'm so scare about the announcement  freakin scare!

0,2206390910,Wed Jun 17 06:28:14 PDT 2009,NO_QUERY,Mikea131,"Im sick and i dont like it  , Justin Jynxed me "

0,2206391488,Wed Jun 17 06:28:17 PDT 2009,NO_QUERY,caucazianasian,Worst way to wake up in the morning. Sick to my stomach. 

0,2206391858,Wed Jun 17 06:28:20 PDT 2009,NO_QUERY,Doops1620,Wishing i could get a good nights sleep one of these days!  

0,2206391893,Wed Jun 17 06:28:20 PDT 2009,NO_QUERY,tigerriry,"Im angry, I dont have a full G on my phone and fuckkkkk I cant even go on interwebs  why is it doing this?"

0,2206392301,Wed Jun 17 06:28:22 PDT 2009,NO_QUERY,anntheessaa,so not in the mood to study for the final exam 

0,2206392347,Wed Jun 17 06:28:22 PDT 2009,NO_QUERY,trinsgarcia,Nothing to watch  why must fall be so far away??

0,2206392392,Wed Jun 17 06:28:23 PDT 2009,NO_QUERY,ashleyny,I realllyyyyy miss winterbreak  oh the memories

0,2206392490,Wed Jun 17 06:28:23 PDT 2009,NO_QUERY,cardward,"allergic to smthg i ate today i think, kakiku gatel2 "

0,2206392566,Wed Jun 17 06:28:24 PDT 2009,NO_QUERY,stephanieDRIZ, i'll be leaving home tomorrow.

0,2206392727,Wed Jun 17 06:28:25 PDT 2009,NO_QUERY,bluejena,"@mungersmurf I'm sorry to hear that... I know how much of a bummer that is. I'll be here, slaving away on my research. "

0,2206392891,Wed Jun 17 06:28:26 PDT 2009,NO_QUERY,suttonlasater,signing up for a free trip for the @tomsshoes south african shoe drop in oct! id pay for it but spent all my $ going to south am in march 

0,2206392901,Wed Jun 17 06:28:26 PDT 2009,NO_QUERY,modelchick85,man my body hurts but day 3 of training begins today soooo i just have to push through it 

0,2206392945,Wed Jun 17 06:28:26 PDT 2009,NO_QUERY,missplendor,"Doughnut from, Sugarbabies Doughnut Works! ...Coffee, from the nearest Sev "

0,2206392986,Wed Jun 17 06:28:26 PDT 2009,NO_QUERY,kfuckingc,@dreamincolours I liked big bang theory until they took it off. 

0,2206393054,Wed Jun 17 06:28:27 PDT 2009,NO_QUERY,kluzzle,I'm going to miss my @justinghattas so much while he's in China 

0,2206393121,Wed Jun 17 06:28:27 PDT 2009,NO_QUERY,Wickedredhead67,Needs collective strength from my tweeple this AM. I am Heading to my Mother's funeral service. 

0,2206393178,Wed Jun 17 06:28:27 PDT 2009,NO_QUERY,gabby_marshall,doesnt like rain  makes me sad

0,2206393416,Wed Jun 17 06:28:29 PDT 2009,NO_QUERY,AvWeekBenet,@boingo What would make Aunt Benet happy is a reason why Boingo wireless on the iPod/Touch didn't work at BWI Airport. 

0,2206393695,Wed Jun 17 06:28:30 PDT 2009,NO_QUERY,radicalmatt07,On my way to carowinds with youth leader in his van lol im such a badass its raining 

0,2206393772,Wed Jun 17 06:28:30 PDT 2009,NO_QUERY,fanyechka,@eliiiiza what are you stressed about 

0,2206398353,Wed Jun 17 06:28:56 PDT 2009,NO_QUERY,ejmariano619,boo. now i have too sleep early. ick.  weeeeekeeeeeennnnnd! were are you?!?!

0,2206398423,Wed Jun 17 06:28:57 PDT 2009,NO_QUERY,Dumskull,"@Goleudy doing ok, still job hunting  and getting bored, just an acoustic guitar for now how long you had the sore throat?"

0,2206398550,Wed Jun 17 06:28:57 PDT 2009,NO_QUERY,jportier,"PIcked up the rental car today, was hoping for a &quot;We'll need to give you the upgrade for free&quot; but drove off with a PT Crusier instead "

0,2206398660,Wed Jun 17 06:28:58 PDT 2009,NO_QUERY,dresdenblack,the romance goes right out of a thing with the 1st truck that sprays you as it passes 

0,2206398764,Wed Jun 17 06:28:59 PDT 2009,NO_QUERY,luvlee_ashh,so nervous...and hungry. getting my wisdom teeth pulled today so i cant eat anything  this blows

0,2206398946,Wed Jun 17 06:29:00 PDT 2009,NO_QUERY,Tayloner182,"Finished homework 5 minutes after they made the final boarding call, sprinted on to plane at last minute, didn't even get to eat McD's "

0,2206399553,Wed Jun 17 06:29:03 PDT 2009,NO_QUERY,LadyIsle,Another day another dollar!...Starting to feel increasingly harder..so tired of people thinking their opinions and ideas are always right 

0,2206400041,Wed Jun 17 06:29:06 PDT 2009,NO_QUERY,jthomp40,@MsLovely_Jalene NOT THE HAIR! 

0,2206400051,Wed Jun 17 06:29:06 PDT 2009,NO_QUERY,kandyjohnson,"Thinking my son is having an allergic reaction to bleach. My poor baby is so uncomfortable, and his eyes are so swollen. "

0,2206400310,Wed Jun 17 06:29:07 PDT 2009,NO_QUERY,ashbashh7,@geemtz #haveyouever .... yes i have tweeted a celeb in hopes they would respond 

0,2206400739,Wed Jun 17 06:29:10 PDT 2009,NO_QUERY,shearer260,my boy has died    i have never been this upset. i feel empty and like someone is stabbing me in the heart...he was my best friend

0,2206400794,Wed Jun 17 06:29:10 PDT 2009,NO_QUERY,komplettie,@feylya Yeah... and I sold my soul to Steve Jobs a couple of years back 

0,2206400803,Wed Jun 17 06:29:10 PDT 2009,NO_QUERY,Multiwan,"thinking about nothing, doing nothing, being nothing! "

0,2206400966,Wed Jun 17 06:29:11 PDT 2009,NO_QUERY,chanaya_ashley,&quot;BrokenHearted Girl&quot; is 1 of my faves fr &quot;I Am...&quot; &amp; the vid was quite disappointing 

0,2206402008,Wed Jun 17 06:29:17 PDT 2009,NO_QUERY,siege72,Work NW is having issues. 

0,2206402199,Wed Jun 17 06:29:18 PDT 2009,NO_QUERY,Philzah,@LeloB Where and why are you not taking me with  ???

0,2206402237,Wed Jun 17 06:29:18 PDT 2009,NO_QUERY,MrAshton84,Annnd workout with trainer time! Sooo early 

0,2206402466,Wed Jun 17 06:29:19 PDT 2009,NO_QUERY,vhopkins,"Sleepy, wish I could hang with @JctBoyz all day "

0,2206402651,Wed Jun 17 06:29:20 PDT 2009,NO_QUERY,lori529,@DonnieWahlberg IVE BEEN TWEETING &amp; TWITTING FOR MONTHS NOW CAN I GET A HOLLARRRRRR? LOL GOT DUPED OUT OF FACETIME AT JONES BEACH AT VIP 

0,2206402742,Wed Jun 17 06:29:21 PDT 2009,NO_QUERY,micheala02,We r currently following a HOUSE through the back roads of Minnesota! 

0,2206402975,Wed Jun 17 06:29:22 PDT 2009,NO_QUERY,brat20,goin to the doctors today...checkin for an ear infection 

0,2206403044,Wed Jun 17 06:29:23 PDT 2009,NO_QUERY,vickymontiel,sleepy head...don't wanna work today  #bsb

0,2206403090,Wed Jun 17 06:29:23 PDT 2009,NO_QUERY,MissUniques,wants to go in pooool 

0,2206403097,Wed Jun 17 06:29:23 PDT 2009,NO_QUERY,kimgrunick,"Are we really learning for us??? I don't think so, 'cause if it is so why do we get bad marks at school??? That ruins our life "

0,2206403153,Wed Jun 17 06:29:23 PDT 2009,NO_QUERY,PTOSullivan,@thejackanory I's very confused... 

0,2206403398,Wed Jun 17 06:29:25 PDT 2009,NO_QUERY,Crazy_Moo,Where Has the Sun Went  ?

0,2206403805,Wed Jun 17 06:29:27 PDT 2009,NO_QUERY,Nickiieee,Feeling ill so no school for me today 

0,2206403866,Wed Jun 17 06:29:27 PDT 2009,NO_QUERY,witnessamiracle,"@manicmai HAHA, oh yes!! But dang it, my pockets are empty!  Which mags have you bought? "

0,2206404209,Wed Jun 17 06:29:29 PDT 2009,NO_QUERY,iammzd_1,HEy twitts dang i miss my phone. this is y i am out of comission... 

0,2206404506,Wed Jun 17 06:29:31 PDT 2009,NO_QUERY,CrunkyyD,That was not a long enough nap  i need a case of red bull stat!!!

0,2206404738,Wed Jun 17 06:29:33 PDT 2009,NO_QUERY,kristenhaaalo,Goodbye ocean city 

0,2206404759,Wed Jun 17 06:29:33 PDT 2009,NO_QUERY,Bexwire,"Bugger, missed the quiz again, 1st day back in office, too busy shovelling poo.   Rubbish.  Not having a good day "

0,2206405178,Wed Jun 17 06:29:35 PDT 2009,NO_QUERY,Piper1983,105 days to get down to a size 16!  How did I ever let myself get this way 

0,2206405305,Wed Jun 17 06:29:36 PDT 2009,NO_QUERY,ceezjr,my regional president is visiting the branch today.  i really don't get any breaks 

0,2206405511,Wed Jun 17 06:29:37 PDT 2009,NO_QUERY,AntixOnline,@roseybeth I know... Even the guilt trip didn't work on him lol.... &quot;You can't leave... It's my birthday... You're my best friend&quot;   haha

0,2206405554,Wed Jun 17 06:29:37 PDT 2009,NO_QUERY,kiof,Still studying for that Physio quiz! Word vomit!! 5am tom 

0,2206405943,Wed Jun 17 06:29:40 PDT 2009,NO_QUERY,HarleighPrince,Tired.....but not aloud to sleep in anymore!!! 

0,2206405990,Wed Jun 17 06:29:40 PDT 2009,NO_QUERY,adventurouskate,"Sore throat, no voice -- post-Vegas illness has officially kicked in as of around 9:00 PM last night. "

0,2206406130,Wed Jun 17 06:29:41 PDT 2009,NO_QUERY,daynajd30,back to work today... 

0,2206406364,Wed Jun 17 06:29:42 PDT 2009,NO_QUERY,isadoracosta7,@luqueiroz certo..  meu the hills ja ta acabando. vo ver greek e depois partiu the hills =]

0,2206406398,Wed Jun 17 06:29:42 PDT 2009,NO_QUERY,sofiamccain,Anybody ??? 

0,2206406667,Wed Jun 17 06:29:44 PDT 2009,NO_QUERY,anniehuser,Why am I so dizzy today? 

0,2206407237,Wed Jun 17 06:29:47 PDT 2009,NO_QUERY,Corne,@ingeHIT have no link here... there is only a Twitter and Flickr backchannel 

0,2206407267,Wed Jun 17 06:29:48 PDT 2009,NO_QUERY,lostlo,For weeks seeing my stepmom &amp; counselor for 1st time in 3 years has kept me going. She was coming w/dad on Sat. They just canceled. 

0,2206407576,Wed Jun 17 06:29:49 PDT 2009,NO_QUERY,EmmyLegend,missed you 

0,2206407928,Wed Jun 17 06:29:51 PDT 2009,NO_QUERY,trinketbox24,this rain is really putting a damper on my treasure hunting plans 

0,2206407942,Wed Jun 17 06:29:52 PDT 2009,NO_QUERY,jalada,Still no support for message timeouts/max queue lengths in RabbitMQ though 

0,2206408103,Wed Jun 17 06:29:52 PDT 2009,NO_QUERY,OraiaSpeaks,@magellanlive Shut UP!! LOL!! its very scary  I don't know how they're getting in. I don't wanna die like this!!

0,2206408305,Wed Jun 17 06:29:54 PDT 2009,NO_QUERY,xmissmcflyx,is lookin oot the window n the rain is bouncin of the road  !! x.x.

0,2206408321,Wed Jun 17 06:29:54 PDT 2009,NO_QUERY,raya_fitriasari,Feeling so lonely tonite.. 

0,2206408373,Wed Jun 17 06:29:54 PDT 2009,NO_QUERY,niccowboys944,I wonder what was going through the Micros worker's mind when he started a software update on Pizza Hut's till system during peak rush! 

0,2206408393,Wed Jun 17 06:29:54 PDT 2009,NO_QUERY,Ryuus_Wardrobe,I'm back for a little while. My body hurts... I slept on my arm wrong and my back hurts near my shoulderblade 

0,2206408440,Wed Jun 17 06:29:54 PDT 2009,NO_QUERY,charlesepres,Finding it hard to get back on track after the marathon presentation work... 

0,2206408746,Wed Jun 17 06:29:56 PDT 2009,NO_QUERY,broccoli89,@AVDstudios  Dude I just got up thinking it was going to be available since the mornining  FML

0,2206408845,Wed Jun 17 06:29:57 PDT 2009,NO_QUERY,benclatworthy,"@Rindel would have been nice, but no "

0,2206408858,Wed Jun 17 06:29:57 PDT 2009,NO_QUERY,xxTrueBlondexx,Miserable day today 

0,2206409158,Wed Jun 17 06:29:59 PDT 2009,NO_QUERY,brittanybitch55,so tired. don't wanna go to work today....lame 

0,2206409312,Wed Jun 17 06:30:00 PDT 2009,NO_QUERY,LittleBigTito,@DearJim_ ahhhh nooooo 

0,2206409358,Wed Jun 17 06:30:00 PDT 2009,NO_QUERY,kaykay364,Getting ready for the day!!! and very mad because my whole family wants to get together and celebrate my bday. Just what I wanted 

0,2206409376,Wed Jun 17 06:30:00 PDT 2009,NO_QUERY,keithmccormick,can you see the hive???  hopefully it doesn't wreck my tattoo... http://twitpic.com/7m9tf

0,2206409383,Wed Jun 17 06:30:00 PDT 2009,NO_QUERY,EzraSpurlin,Going to doctor for regular 38 week check up. Mom feels defeated and has no hope of progress. I think I hear her crying 

0,2206409725,Wed Jun 17 06:30:02 PDT 2009,NO_QUERY,clarer,@thelongmile  you're making me sad.

0,2206409963,Wed Jun 17 06:30:03 PDT 2009,NO_QUERY,LilMsKeri,@HauteSnobiety yea... 

0,2206410073,Wed Jun 17 06:30:03 PDT 2009,NO_QUERY,ChantalePark,"@Jinnnnny they are but i was born in canada. Imagine, they didn't make an effort to make me learn korean! chengpi. "

0,2206411050,Wed Jun 17 06:30:08 PDT 2009,NO_QUERY,msedwardcullen0,Gotta go to the dentist today  ugh i hate it! I'm so ready for vacation Friday!!!

0,2206411102,Wed Jun 17 06:30:09 PDT 2009,NO_QUERY,markcannings,@CathyWallace At first I thought it was a trick but it really wass the most important news story ever - thank you 

0,2206411714,Wed Jun 17 06:30:11 PDT 2009,NO_QUERY,iHilary,Getting ready for this appointment. Going back to sleep when I get home. The update will be at 3pm 

0,2206412095,Wed Jun 17 06:30:13 PDT 2009,NO_QUERY,KatieCurl,in physics on annoying laptop 

0,2206413248,Wed Jun 17 06:30:18 PDT 2009,NO_QUERY,Kooshii,Wanna go watch takin of pelham 123 

0,2206413321,Wed Jun 17 06:30:19 PDT 2009,NO_QUERY,iloveburritos,@ljauss Damn that looks good...minimum of 30 people though   I think we're only going to have 15-20.

0,2206414225,Wed Jun 17 06:30:23 PDT 2009,NO_QUERY,xx_Sakura_xx,trying to find the energy (after having a head cold) to do my essay for uni  think i may buy some lucozade =]

0,2206414352,Wed Jun 17 06:30:24 PDT 2009,NO_QUERY,j16saw,Jeans noticeably tighter at work today. 

0,2206414634,Wed Jun 17 06:30:25 PDT 2009,NO_QUERY,Julialalala,I want to see @metrostation in madrid  Wish I had the moneyyyyy

0,2206421833,Wed Jun 17 06:31:04 PDT 2009,NO_QUERY,thatothertime,@nickowastaken not even the sexy pose? 

0,2206422427,Wed Jun 17 06:31:07 PDT 2009,NO_QUERY,ihatemyjob2,Fu...... WORK!!!!! I HATE MY BOSS!!!!!!!!!!!!!!!!! : Fu...... WORK!!!!! I HATE MY BOSS!!!!!!!!!!!!!!!!!  http://bit.ly/3zhoKB

0,2206422517,Wed Jun 17 06:31:08 PDT 2009,NO_QUERY,Ma3hem,@Ezzawesome I'm not coming to school 

0,2206423087,Wed Jun 17 06:31:11 PDT 2009,NO_QUERY,Velvet_Whip,"@mrjameszz I mean: I have to take a certain amount of proteins, fibers, carbs (not many), vitamins, minerals a day... that's how I &quot;feed&quot; "

0,2206423362,Wed Jun 17 06:31:12 PDT 2009,NO_QUERY,wharnarine,Last day in NYC  back to T. Tonight

0,2206423886,Wed Jun 17 06:31:15 PDT 2009,NO_QUERY,RoseLibra,@1capplegate Noooo I loved Samantha Who!!! 

0,2206424089,Wed Jun 17 06:31:17 PDT 2009,NO_QUERY,Ceren_,THE RING THREE IS ANNOUNCED! Fuq yes. What must I do to be cast in this film? I'd love to be Samara's next victim 

0,2206424263,Wed Jun 17 06:31:18 PDT 2009,NO_QUERY,Dinesha_D,On my way to class...yay...NOT 

0,2206425137,Wed Jun 17 06:31:23 PDT 2009,NO_QUERY,LauRenxExCarter,"@lilcreolesd no  it flew off somewhere, so now I'm on the lookout for it w/a hammer, a high heeled wedge &amp;&amp; windex at my side lol"

0,2206425285,Wed Jun 17 06:31:24 PDT 2009,NO_QUERY,humanzz,"@tercowas It should, bas heya fein bas "

0,2206425400,Wed Jun 17 06:31:24 PDT 2009,NO_QUERY,LauraC2689,Gutted I got rid of my Oasis tickets for tonight.....and my T in the Park tickets!!  2009 is over for me 

0,2206425655,Wed Jun 17 06:31:26 PDT 2009,NO_QUERY,iamloz_JsPR,@rob_alexander - its sooooooo cold here ! ....  wheat pack is in bed with me

0,2206425731,Wed Jun 17 06:31:26 PDT 2009,NO_QUERY,joetabao,dance today oh snap! rember to check me out on blogtv tonight. twitters not working on my phone 

0,2206425779,Wed Jun 17 06:31:26 PDT 2009,NO_QUERY,crissy76,Gotta roll out of bed! Wait! I'm suppose 2 b leavin already 

0,2206425956,Wed Jun 17 06:31:27 PDT 2009,NO_QUERY,talkaboutluck,"was doing so well with waking up. And now, blah, waking up in the afternoon again "

0,2206425990,Wed Jun 17 06:31:28 PDT 2009,NO_QUERY,sxhunny1983,is feeling really good today but is wondering what is going to happen to bring it all crashing down again....ive got an idea.....   

0,2206426238,Wed Jun 17 06:31:29 PDT 2009,NO_QUERY,mugluf,500 calories for a smoothie ... thats my lunch then 

0,2206426534,Wed Jun 17 06:31:30 PDT 2009,NO_QUERY,_Tanyya,@ChantiParnell 1 a day i think!  but there only 10mg :/ whatever that means! my eyes are itching too!

0,2206426971,Wed Jun 17 06:31:33 PDT 2009,NO_QUERY,Jillllyyyy,@chappellshow im jealoussss i wanna be at the beach  im stuckk at my stupid internship..misssssyou!

0,2206427008,Wed Jun 17 06:31:33 PDT 2009,NO_QUERY,AdorkableKati,@MarinkaNYC hugs. I can attest to the fact that they grow up WAY too fast. Don't Blink 

0,2206427168,Wed Jun 17 06:31:34 PDT 2009,NO_QUERY,_ophelia,@poppythecat Yeah I heard. Just didnt think a forum member would be one of them 

0,2206427485,Wed Jun 17 06:31:36 PDT 2009,NO_QUERY,crAZdutch,blackberry is sick 

0,2206428134,Wed Jun 17 06:31:40 PDT 2009,NO_QUERY,Reecce,cannot seem to focus on revising  and hasnt got a CLUUUUE what to wear to the boat party..

0,2206428172,Wed Jun 17 06:31:40 PDT 2009,NO_QUERY,ashface,@adolescents I wish I was 

0,2206428378,Wed Jun 17 06:31:41 PDT 2009,NO_QUERY,StooLaird,I've WELL got man flu  this is when i need a husband to take care of me...

0,2206428512,Wed Jun 17 06:31:42 PDT 2009,NO_QUERY,Ellen_Stafford,I could do with a @Schofe hug 

0,2206428529,Wed Jun 17 06:31:42 PDT 2009,NO_QUERY,no1lefthere,@jungvolk if we chant Brookes name.. will that bring her back??????  Twitter is becoming a very lonely place now.......

0,2206428821,Wed Jun 17 06:31:43 PDT 2009,NO_QUERY,maitelalinda28,burned my finger... 

0,2206428847,Wed Jun 17 06:31:43 PDT 2009,NO_QUERY,stefking1028,starting to pack  5 more weeks and i'm done at Ball State

0,2206428978,Wed Jun 17 06:31:44 PDT 2009,NO_QUERY,dukel_boy,its been a busy day. 

0,2206429138,Wed Jun 17 06:31:45 PDT 2009,NO_QUERY,Harribobaggins,@PerezHilton there's something wrong with your website  code is all funky

0,2206429183,Wed Jun 17 06:31:45 PDT 2009,NO_QUERY,hey_romeo,is eating cold pizza...again. worrying about ron 

0,2206429232,Wed Jun 17 06:31:46 PDT 2009,NO_QUERY,GeminiandI,Can't sleep from the pain...heeeelp... 

0,2206429269,Wed Jun 17 06:31:46 PDT 2009,NO_QUERY,willtompsett,Are anyone else's Reply and Favourite buttons messing about on their Twitter homepage? Their not aligning with the tweets for me?!?!? 

0,2206429404,Wed Jun 17 06:31:46 PDT 2009,NO_QUERY,Crupuscular,Why does everyone get rain apart from me? Not fair 

0,2206429495,Wed Jun 17 06:31:47 PDT 2009,NO_QUERY,feliciashley,got invited to go on a vacation to Langkawi next week. TEMPTATION! damn assignments+homework+presentations. 

0,2206429604,Wed Jun 17 06:31:48 PDT 2009,NO_QUERY,_kwini_,i don't know what to say.i'm crazy.i hope he's not mad at all. 

0,2206429621,Wed Jun 17 06:31:48 PDT 2009,NO_QUERY,malkinbister,@tubbsmcguire You'd have to cook the fuckers for three hours to get them cooked. Imagine how grim the outsides would be by then - shudder 

0,2206429730,Wed Jun 17 06:31:48 PDT 2009,NO_QUERY,RevJArthurRank,"@StrayTogether @swingtastic I guess I missed the #tworgy , huh?    Oh well, maybe later.  ;-)"

0,2206429758,Wed Jun 17 06:31:48 PDT 2009,NO_QUERY,lay2,I am very sad to live where I live. were so cnear  and yet so far 

