0,2208724231,Wed Jun 17 09:33:03 PDT 2009,NO_QUERY,MixitupMich,At Maudies for one last lunch with the girls 

0,2208724406,Wed Jun 17 09:33:04 PDT 2009,NO_QUERY,heatherdee409,@jenlen Our texts and emails are so jam-packed with info these days because of the reduced girl-time 

0,2208724439,Wed Jun 17 09:33:04 PDT 2009,NO_QUERY,2cute_2001,This raffic out here is stupid crzy... im 30mins late. I didn't even kno tha parade was gonna touch Vermont. Im mad 

0,2208724917,Wed Jun 17 09:33:06 PDT 2009,NO_QUERY,keepinitill,"@Just_A_Girrl OMG. i know. that's why i decided not to go, plus i didn't even get up early enough.  i think i'm just going to Venice."

0,2208724927,Wed Jun 17 09:33:06 PDT 2009,NO_QUERY,rdtrash,Today is a work day 

0,2208725190,Wed Jun 17 09:33:07 PDT 2009,NO_QUERY,dododolifesgood,"Home from the hospital and mummy looked terrible. I hate seeing her like that. It really upset me, i just hope she gets better real soon! "

0,2208725351,Wed Jun 17 09:33:08 PDT 2009,NO_QUERY,pmfashionreport,looks like my gshock ppl deleted their pages @mrpeteywheat 

0,2208725359,Wed Jun 17 09:33:08 PDT 2009,NO_QUERY,chrisakagi,"@jgvii  aww poo. I see the pre order of it on the gamestop website is 1/1/10 but I dunno if that means anything to you, hahaha."

0,2208725744,Wed Jun 17 09:33:10 PDT 2009,NO_QUERY,annarina,"@jennysunphoto too bad you couldn't join  nevermind, there's always a next time! get well soon and get plenty of rest =D"

0,2208726141,Wed Jun 17 09:33:12 PDT 2009,NO_QUERY,caBangal,My eyes hurt. No damn sleep and 

0,2208726261,Wed Jun 17 09:33:12 PDT 2009,NO_QUERY,lhazlett,"Just found my dream dog on GRRR, too bad I can't get it "

0,2208726347,Wed Jun 17 09:33:13 PDT 2009,NO_QUERY,missyvie,@lesley007 I'm v jealous!  Half starving myself to lose weight &amp; haven't had choc for weeks 

0,2208726435,Wed Jun 17 09:33:13 PDT 2009,NO_QUERY,BlessedRude,"dayum lunch was wonderful, need something sweet now! well bout to go to the job &amp; not do anything! getting paid to chill! terrible "

0,2208726596,Wed Jun 17 09:33:14 PDT 2009,NO_QUERY,marjoleinW,burned my hand and tongue on microwaved lasagna 

0,2208727494,Wed Jun 17 09:33:18 PDT 2009,NO_QUERY,lisakm1109,@LynnaKay eww laundry folding is oh so much fun!Sorry you have three times the amount 

0,2208738308,Wed Jun 17 09:34:05 PDT 2009,NO_QUERY,donnamatrix,waiting to hear from the vet. Poor Justice. 

0,2208738393,Wed Jun 17 09:34:06 PDT 2009,NO_QUERY,Schouest,I want to see a movie  But that is the one thing I refuse to do alone.

0,2208738626,Wed Jun 17 09:34:07 PDT 2009,NO_QUERY,haleighhxo,"Just came home from the rec... gottta find somethin to do, so text ;D i hope it doesnt rain all day  !!!!"

0,2208738673,Wed Jun 17 09:34:04 PDT 2009,NO_QUERY,shalomj,Out the lab bout to go to song stank self 

0,2208738688,Wed Jun 17 09:34:07 PDT 2009,NO_QUERY,Katiemmabbz,.. open just to feel 

0,2208738756,Wed Jun 17 09:34:07 PDT 2009,NO_QUERY,MsBrooks2U,@SVUBCOD That storm las night uprooted part of my garden and it made me sick! 

0,2208739502,Wed Jun 17 09:34:11 PDT 2009,NO_QUERY,iamvictorious,@_Smiles_ a Jelly filled donut and a blueberry one! 

0,2208740012,Wed Jun 17 09:34:13 PDT 2009,NO_QUERY,joseadanof,Waiting my 3.0.... 

0,2208740084,Wed Jun 17 09:34:13 PDT 2009,NO_QUERY,Ciel_Rouge,Crap now need to figure out how to record that Thirlwell thing as I so t be home to listen to it 

0,2208740573,Wed Jun 17 09:34:15 PDT 2009,NO_QUERY,mamadukers,looks like rain for this afternoon   ... I'm pumped to watch &quot;so you think i can dance&quot; tonight ... I love that show

0,2208740782,Wed Jun 17 09:34:16 PDT 2009,NO_QUERY,nanda_oliver,I can barely wait for the debut of New Moon. Oh God...missing 155 days... 

0,2208741209,Wed Jun 17 09:34:18 PDT 2009,NO_QUERY,HockeyChickd12,is going to teach NVCI 

0,2208741550,Wed Jun 17 09:34:19 PDT 2009,NO_QUERY,amandarie,Ariel: &quot;Drop the phone!&quot; 

0,2208741746,Wed Jun 17 09:34:20 PDT 2009,NO_QUERY,True_Sanctuary,@RedMonetMizrahi poor lilly!!!  she is so happy right now and been through so much.

0,2208742091,Wed Jun 17 09:34:22 PDT 2009,NO_QUERY,faemino,@ErneX shit 

0,2208742166,Wed Jun 17 09:34:22 PDT 2009,NO_QUERY,MissKianaBaby,Dang: are there not anymore sexy white dresses n the world??? 

0,2208742360,Wed Jun 17 09:34:23 PDT 2009,NO_QUERY,isabeez,Does the purple is IN this summer ?  Sunburn... 

0,2208742622,Wed Jun 17 09:34:24 PDT 2009,NO_QUERY,havebettersex,brix was pumping! meeting early tomorrow so bed with no company tonight 

0,2208743342,Wed Jun 17 09:34:28 PDT 2009,NO_QUERY,Music_love,IS GOING CRAZY LET ME PLEASE PASS MY THEORY TEST 

0,2208743536,Wed Jun 17 09:34:28 PDT 2009,NO_QUERY,lishaa26,@whoisthetruth I have nothing more to say...I'm completely hurt...you just came for me in the worst way... 

0,2208743566,Wed Jun 17 09:34:29 PDT 2009,NO_QUERY,NickkkJonasss,Thank you guys for all of your great questions. But I have to go  Talk to you guys later! Love you guys!

0,2208744269,Wed Jun 17 09:34:32 PDT 2009,NO_QUERY,Bethylou,@Jamie__Bailey just listened to my voicemail..im sad 

0,2208744778,Wed Jun 17 09:34:34 PDT 2009,NO_QUERY,lexcaluza,Grrr..today'ss the @Lakers championship parade and me and @chchcholo aren't there   

0,2208744784,Wed Jun 17 09:34:34 PDT 2009,NO_QUERY,luannaan,"@tommcfly HAHAHA oh dear, ask Kathy where is it... I'm sure that he has a brain, is just that maybe his neurons are gone  haha Xxx"

0,2208744834,Wed Jun 17 09:34:34 PDT 2009,NO_QUERY,AmyChristiney,Not in a great mood 

0,2208744992,Wed Jun 17 09:34:35 PDT 2009,NO_QUERY,LeslieRocha11,@aplusk rofl. ouch!!!! thats got to hurt 

0,2208745163,Wed Jun 17 09:34:36 PDT 2009,NO_QUERY,jhall49,"My wallet was stolen along with all of my cash. Got the wallet back sans cash. Amcore sucks, too. FML. "

0,2208746061,Wed Jun 17 09:34:40 PDT 2009,NO_QUERY,RachaelNicole09,At work 

0,2208746556,Wed Jun 17 09:34:42 PDT 2009,NO_QUERY,xotaylorlongxo,On my way back home again 

0,2208746643,Wed Jun 17 09:34:42 PDT 2009,NO_QUERY,SusanneBarrett,is up and barely moving after spending three hours sorting the boys' clothing yesterday. Hoping that pain meds will help.  

0,2208746820,Wed Jun 17 09:34:43 PDT 2009,NO_QUERY,dantheWOman,"@Anti2Ben i'm sorry.  now, tell me this: what the hell is a twi'lek?"

0,2208747388,Wed Jun 17 09:34:46 PDT 2009,NO_QUERY,poppycede,@flyingjenny @apacheman just saw the launch is delayed until July because of hydrogen. Bummer. 

0,2208747655,Wed Jun 17 09:34:47 PDT 2009,NO_QUERY,indysoulja,Dam I miss my crew already....this is gonna be a long 2 weeks 

0,2208747763,Wed Jun 17 09:34:48 PDT 2009,NO_QUERY,TrufanColorado,im sorry i jinxed the streak  http://www.trufancolorado.blogspot.com  my official apology to the Rockies and the fans.

0,2208747765,Wed Jun 17 09:34:48 PDT 2009,NO_QUERY,ChazElite,Once again bored @ work! Smelly people present 

0,2208747886,Wed Jun 17 09:34:48 PDT 2009,NO_QUERY,TeeBiscuit,@JustBella aww thank you for asking and in a word ... No ... can I have a hug now please 

0,2208748196,Wed Jun 17 09:34:49 PDT 2009,NO_QUERY,jvaccz,Maybe its not tanning weather  to windy and to many cloudss

0,2208748405,Wed Jun 17 09:34:50 PDT 2009,NO_QUERY,adampatterson,@jeffparks all my pod casts got wiped out  i messed uo my ipod. hopefully i can recall what three i have not listend to.

0,2208748579,Wed Jun 17 09:34:51 PDT 2009,NO_QUERY,Ryanboy,"@ewitsmikayla aw, scratch that. it's U.S. only. "

0,2208749081,Wed Jun 17 09:34:54 PDT 2009,NO_QUERY,lilmissaw3s0m3,missed class but on my way to work... 

0,2208749217,Wed Jun 17 09:34:54 PDT 2009,NO_QUERY,fifthand56th,"@msilve I neeed to go look thattt uppp! I can't find the book, I took it to Hof with me lmao but I can't find ittttt "

0,2208749236,Wed Jun 17 09:34:54 PDT 2009,NO_QUERY,degsy,"@krazypinkminx just seems very desperate of them to offer money to do it, and to write an IE8 that's still non-standard! "

0,2208749261,Wed Jun 17 09:34:54 PDT 2009,NO_QUERY,smness2,"Feeling like crap. Cough, sore throat, sinus pain. Ugh. I think I'd feel better if I were hungover... "

0,2208749837,Wed Jun 17 09:34:57 PDT 2009,NO_QUERY,Garthic,@Adoralyna OMG. I love StoceTop stuffing! But the Carbs. 

0,2208749876,Wed Jun 17 09:34:57 PDT 2009,NO_QUERY,DarthBlingBling,@vegas0zero I already promised one person he'd get a shot at the alternative text after missing out. He even bought a new mic 

0,2208749986,Wed Jun 17 09:34:58 PDT 2009,NO_QUERY,Kristin_514,@andreaonFOD Really? I guess that's why my phone has stopped buzzing today. I hope they fix it or I'll feel really cut off. 

0,2208750093,Wed Jun 17 09:34:58 PDT 2009,NO_QUERY,Tawcan,TwitterFox not working for me this morning. 

0,2208750416,Wed Jun 17 09:35:00 PDT 2009,NO_QUERY,AlisonWildish,Going home is depressing when I know I have to switch off work brain and switch on student brain. 

0,2208750998,Wed Jun 17 09:35:03 PDT 2009,NO_QUERY,yohanamursari,I don't do play for a while 

0,2208751115,Wed Jun 17 09:35:03 PDT 2009,NO_QUERY,ramabama,@CHANGE12 work is dumb slow  no one want come by a car.

0,2208751625,Wed Jun 17 09:35:05 PDT 2009,NO_QUERY,officialRedd,"hangin out w/ @lele2lele , @nonnieyanie , &amp;some other folks... not going to the jumpoff this sat ; family stuff is going on "

0,2208752142,Wed Jun 17 09:35:07 PDT 2009,NO_QUERY,davidcwest,@Chadchadelvis stop clicking it will either be 6 or 7 tonight now when its out 

0,2208752756,Wed Jun 17 09:35:10 PDT 2009,NO_QUERY,heva2392,ronaldo gone to real  traitor  united need to sign new players soon otherwise we ain gunna win jack.

0,2208752810,Wed Jun 17 09:35:10 PDT 2009,NO_QUERY,AndrewSidney,"@sambrooklyn I'm a Penn State fan, gotta love JOEPA lol. UGA had a tough season this season, pre-season #1 "

0,2208752839,Wed Jun 17 09:35:10 PDT 2009,NO_QUERY,Kristoffer1080p,Stupid electronic circuits 

0,2208752904,Wed Jun 17 09:35:10 PDT 2009,NO_QUERY,rad_ali,Whew. Its humid. Four more days till girls leave. 

0,2208752906,Wed Jun 17 09:35:10 PDT 2009,NO_QUERY,garygannon,testing...my tweets arent populating 

0,2208752939,Wed Jun 17 09:35:11 PDT 2009,NO_QUERY,larissaluv1236,ouch!!! my stomach is full i really need to exercise everyday (which i do every week) but everyday but im sooo lazy 

0,2208753021,Wed Jun 17 09:35:11 PDT 2009,NO_QUERY,miamisammy,@blackvisor Bummer I missed it!  Zoe is supposed to remind me these things...

0,2208753526,Wed Jun 17 09:35:13 PDT 2009,NO_QUERY,readysteadystop,NO 2.2.1 IS NOT THE CURRENT VERSION. Give me 3.0 now thank you 

0,2208753700,Wed Jun 17 09:35:14 PDT 2009,NO_QUERY,djnayyzkrbe,I misss sampson 

0,2208753735,Wed Jun 17 09:35:14 PDT 2009,NO_QUERY,majikelbeans,*Totally behind on everything* OH SNAP I WANT TO GO TO COMIC CON 

0,2208753843,Wed Jun 17 09:35:15 PDT 2009,NO_QUERY,Aimeeeeb,working out-wish there was sunshine 

0,2208754019,Wed Jun 17 09:35:15 PDT 2009,NO_QUERY,2liveLea,My aunt just put crackers in my Steven Sprouse 

0,2208754139,Wed Jun 17 09:35:16 PDT 2009,NO_QUERY,runycat,@stoppableforce I've only ever watched it.  Seen the thing where the person single-mans two-player mode?

0,2208754151,Wed Jun 17 09:35:16 PDT 2009,NO_QUERY,LeviathanChrons,"Remember me complaining about my LCD monitor a couple of days ago? Think the DVI input on it died altogether, had to fall back to VGA "

0,2208754719,Wed Jun 17 09:35:19 PDT 2009,NO_QUERY,becca_skydives,my entire library! now my playlists are gone 

0,2208792660,Wed Jun 17 09:38:09 PDT 2009,NO_QUERY,londonspirate,Ouch must stop sitting at desk with hand under my chin. now have a big hurting spot there 

0,2208793015,Wed Jun 17 09:38:10 PDT 2009,NO_QUERY,bruhparcianello,@seblefebvre ohh i'm so jealous of you  wanna go to these concerts too! enjooy &lt;3

0,2208793158,Wed Jun 17 09:38:11 PDT 2009,NO_QUERY,LMarle,@katiebeth @mtsquirrel @RikRay OMG - that's awful! Would make it hard to feel safe anywhere... 

0,2208793625,Wed Jun 17 09:38:13 PDT 2009,NO_QUERY,ichadman,@JoellynDetjen I would gladly exchange gray for a little hair 

0,2208794584,Wed Jun 17 09:38:17 PDT 2009,NO_QUERY,Jessicaaxo,@mhairi1234 awww what! actually nobody is going 

0,2208794880,Wed Jun 17 09:38:18 PDT 2009,NO_QUERY,teetee_71,@ready2lose Oh I'm SO sorry!!!!! 

0,2208795605,Wed Jun 17 09:38:21 PDT 2009,NO_QUERY,blakelivelyweb,"@anatty Of course! Im so so sorry I got your name wrong. Wow, I feel awful  Will fix it right now. Sorry again!"

0,2208796010,Wed Jun 17 09:38:23 PDT 2009,NO_QUERY,kliptic,It is official chloe has strep throat. 

0,2208796230,Wed Jun 17 09:38:24 PDT 2009,NO_QUERY,edubb323,"@LuvvieIG Uuum, so what's happenin at VSB???  **walkin wit head down kickin rocks**"

0,2208796296,Wed Jun 17 09:38:25 PDT 2009,NO_QUERY,LovelyChi1908,My stomach hurts. I shouldn't have ate the gyros sandwich last night 

0,2208796876,Wed Jun 17 09:38:27 PDT 2009,NO_QUERY,alisbabe86,"And, I DON'T WANNA GO TO THE STAFF MEETING THAT WILL MAKE ME LATE TO BANANA!! "

0,2208796962,Wed Jun 17 09:38:28 PDT 2009,NO_QUERY,skittysayRAWR,my essay won't attach itself to my mail. will try again tomorrow. 

0,2208797003,Wed Jun 17 09:38:28 PDT 2009,NO_QUERY,SamyLei,@godfree hell yeah!! The jaaam.. RIP Aaliyah 

0,2208797312,Wed Jun 17 09:38:29 PDT 2009,NO_QUERY,Breeyannah,I need a job like yestrday. My fone cut off &amp; i gotta giv my mama some money.  Plus i owe my granny $150 &amp; my auntie another million. lol

0,2208798459,Wed Jun 17 09:38:34 PDT 2009,NO_QUERY,aboateng,jus eaten the most amazin meal.. im gettin good at this healthy eatin shit lol.. now im stuffed and gotta get ready for wrk 

0,2208798688,Wed Jun 17 09:38:35 PDT 2009,NO_QUERY,jjjamiee,is it bad that when tarzan kills the leopard i feel sorry for it  

0,2208798691,Wed Jun 17 09:38:35 PDT 2009,NO_QUERY,martynmcf,Horrified to see Charlie from Busted using my guitar in the latest Fightstar video 

0,2208798867,Wed Jun 17 09:38:36 PDT 2009,NO_QUERY,ultra_balexbot,i'm sooo tired! got up at 4am and now i have nothing to do at the office   #squarespace

0,2208798935,Wed Jun 17 09:38:36 PDT 2009,NO_QUERY,isabeeela,"liiife, is getting harder day by day, and I dont know what to do, whaaat to say (8) not alone me deprime  e"

0,2208799557,Wed Jun 17 09:38:39 PDT 2009,NO_QUERY,clawsoca,@AtoDa I turned back to real housewives  I suck

0,2208800575,Wed Jun 17 09:38:44 PDT 2009,NO_QUERY,Mizcity,May have to cancel my plans for tonight... still not felling well 

0,2208801069,Wed Jun 17 09:38:46 PDT 2009,NO_QUERY,sincerelysarahx,I just woke up with a sore throat and little to no voice. Awesomeeee. 

0,2208801242,Wed Jun 17 09:38:47 PDT 2009,NO_QUERY,deepthi1704, #trackle

0,2208801270,Wed Jun 17 09:38:47 PDT 2009,NO_QUERY,fifthand56th,@msilve Niceeee tryyyyyy!  I really want to come back 

0,2208801372,Wed Jun 17 09:38:48 PDT 2009,NO_QUERY,thalia_leonard,Cleaning and relaxing today. Yay. Graduation tomorrow!!!  

0,2208801482,Wed Jun 17 09:38:48 PDT 2009,NO_QUERY,griffineats,might have spoken too soon about the router. don't see anything running on that computer til i get a new hard drive 

0,2208801862,Wed Jun 17 09:38:50 PDT 2009,NO_QUERY,werdnum,@thornet that's what I miss about San Francisco. The regular culinary gatherings of people who work for various parts of the internets 

0,2208801913,Wed Jun 17 09:38:50 PDT 2009,NO_QUERY,ktbryant,Missing my Landon  happy hump day!

0,2208802900,Wed Jun 17 09:38:54 PDT 2009,NO_QUERY,ringoroses, You promised   

0,2208803067,Wed Jun 17 09:38:55 PDT 2009,NO_QUERY,LaLaTalent,drinking tea in hopes of this sore throat going away. ive been sick/had a cold again for the last week now  i just want to be better!

0,2208803231,Wed Jun 17 09:38:56 PDT 2009,NO_QUERY,Kristin_514,@suttygal No.   I'm not getting anyones on my phone. Are you?

0,2208803354,Wed Jun 17 09:38:56 PDT 2009,NO_QUERY,omegathakid,@BrittaniP guess not 

0,2208803369,Wed Jun 17 09:38:56 PDT 2009,NO_QUERY,_emmajane_,"@BingyBongy thank you! i would tweet from there, but learnt my lesson the hard way, was twittering from US earlier this year = Â£300 bill "

0,2208803861,Wed Jun 17 09:38:59 PDT 2009,NO_QUERY,HALLEYCASARES,I don't want to go to the doctors 

0,2208804207,Wed Jun 17 09:39:00 PDT 2009,NO_QUERY,jimbobvaquero,"@mpfox223 I don't need smartass comments, I need my keys "

0,2208804469,Wed Jun 17 09:39:02 PDT 2009,NO_QUERY,R0gersG1rl,Left lower leg angio. Vascular procedure in the next room! Crazy angio day. They'll both take hous. 

0,2208804738,Wed Jun 17 09:39:03 PDT 2009,NO_QUERY,itsJohno,"blehh, feeling sick  maybe an iphone would make me feel better #squarespace"

0,2208804989,Wed Jun 17 09:39:04 PDT 2009,NO_QUERY,Marie2Dessy,Afraid to leave for breakfast incase the dsl people need me at the house. I'm close to cancelling before I even get service. 

0,2208805236,Wed Jun 17 09:39:05 PDT 2009,NO_QUERY,abbiealmasco,@leeolim But wai? Wai in Valenzuela?  I can't wait for us to meet again 

0,2208805472,Wed Jun 17 09:39:06 PDT 2009,NO_QUERY,missu,"Okay, so it looks like I will be visiting Cali all by myself "

0,2208805564,Wed Jun 17 09:39:06 PDT 2009,NO_QUERY,randicramer,"i was sooooo excited to have a tuna sandwich for lunch, but i haven't unpacked the can opener yet "

0,2208805693,Wed Jun 17 09:39:07 PDT 2009,NO_QUERY,CarrieCheap,@MyOpenWallet is it just the spray or is is all Zicam!  I swear by the chewables!! 

0,2208806399,Wed Jun 17 09:39:10 PDT 2009,NO_QUERY,rhondapartridge,At the dr's office for an NST... 

0,2208806600,Wed Jun 17 09:39:11 PDT 2009,NO_QUERY,BrockleeTheDuke,Working a funeral today 

0,2208806690,Wed Jun 17 09:39:11 PDT 2009,NO_QUERY,Hayzool,@Rutzzz sorry to tell u but zac efron does NOT have a twitter account  but hiiiiii rutahhh

0,2208806719,Wed Jun 17 09:39:11 PDT 2009,NO_QUERY,KimberlySaia,sry..Seesmic froze up while sending a Tweet..looked not sent..kept retrying. main page shows it tweeted numerous times. 

0,2208806797,Wed Jun 17 09:39:12 PDT 2009,NO_QUERY,rarahlovesyou,"awesumz, need f00d. im so hungry "

0,2208807740,Wed Jun 17 09:39:16 PDT 2009,NO_QUERY,SDuffy92,Why is iPhone 3.0 not here yet? 

0,2208807986,Wed Jun 17 09:39:17 PDT 2009,NO_QUERY,m92u,@MariaEllsworth i said stick bug! not dick bug. 

0,2208808056,Wed Jun 17 09:39:17 PDT 2009,NO_QUERY,Kimber_Ann,"@csi_printchick i reread your post and i interpreted it wrong, but fawkin twitter.com won't let me delete it "

0,2208808385,Wed Jun 17 09:39:19 PDT 2009,NO_QUERY,greenondine,is trying to recover from a damned 4.45 am shift. 

0,2208808740,Wed Jun 17 09:39:21 PDT 2009,NO_QUERY,jesslynh,@AllThingsiPhone I'm on 2.2.1 so can't use the file. 

0,2208809101,Wed Jun 17 09:39:22 PDT 2009,NO_QUERY,ilovepandabears,Missing my baby 

0,2208809132,Wed Jun 17 09:39:22 PDT 2009,NO_QUERY,mikeyzito,Aw man they did this to me at my company when I started also  http://flic.kr/p/6xhsco

0,2208809149,Wed Jun 17 09:39:23 PDT 2009,NO_QUERY,NELLYBABY86,@DAREALGC where have u been??? Have not seen u for days!!! Ivy leaving me  gunna need some friends lol http://myloc.me/4a4X

0,2208809314,Wed Jun 17 09:39:23 PDT 2009,NO_QUERY,katie_bug9,@sevendaymile I miss Buffy too 

0,2208809397,Wed Jun 17 09:39:24 PDT 2009,NO_QUERY,LaurenRodbard,Wicked night at Kings of Leon last night...just wish we weren't high up in the rafters of the O2  

0,2208809439,Wed Jun 17 09:39:24 PDT 2009,NO_QUERY,JosephTexDozier,@nansen Especially when you need your laptop for school and taking notes during lecture.  They're so pricey too.

0,2208810318,Wed Jun 17 09:39:28 PDT 2009,NO_QUERY,nicotico,i really really miss my MLTM cd 

0,2208810446,Wed Jun 17 09:39:28 PDT 2009,NO_QUERY,imshelledin,@reeology Awww.. that is sad. 

0,2208811011,Wed Jun 17 09:39:31 PDT 2009,NO_QUERY,janetewu,@wangsanata that sucks..  going for a 3rd?

0,2208811063,Wed Jun 17 09:39:31 PDT 2009,NO_QUERY,jekajamboree,i don't feel so good anymore 

0,2208811134,Wed Jun 17 09:39:31 PDT 2009,NO_QUERY,MizzLanea,@misskia910 so im on the curb wit my 3 bags car seat n miss whites floatie.. Hurryyyyyyy!! O n &quot;king&quot; is mad @ me 

0,2208818665,Wed Jun 17 09:40:05 PDT 2009,NO_QUERY,ElizSturdivant,test and presentation over and only 2 days til pgroove!! can't come fast enough! i wish mary and @jamisonspivey would be here though 

0,2208819149,Wed Jun 17 09:40:07 PDT 2009,NO_QUERY,au99i3,work is boring 

0,2208819489,Wed Jun 17 09:40:08 PDT 2009,NO_QUERY,melonpop,@TalesOfSaku Oh man  Let me know when you have some free time after you come back &lt;3 I'll go over and help with anything ^^

0,2208819584,Wed Jun 17 09:40:08 PDT 2009,NO_QUERY,dfield88,today so far has been pretty good! really slow here which worries me alot 

0,2208819861,Wed Jun 17 09:40:09 PDT 2009,NO_QUERY,lindbrownsay,Wicked headache. Feeling low today 

0,2208820165,Wed Jun 17 09:40:11 PDT 2009,NO_QUERY,Neirdak,tonight will be bloody 

0,2208820270,Wed Jun 17 09:40:11 PDT 2009,NO_QUERY,mariomorgan,my pancakes arent light enough 

0,2208820304,Wed Jun 17 09:40:11 PDT 2009,NO_QUERY,xAllie,"has a swollen finger, not sure why "

0,2208820374,Wed Jun 17 09:40:12 PDT 2009,NO_QUERY,fizzlenizzle,i need money  sucks being skint

0,2208820541,Wed Jun 17 09:40:12 PDT 2009,NO_QUERY,jemnaa,@Jessmicuh Boo  That is not good. Try and have fun :|

0,2208821155,Wed Jun 17 09:40:15 PDT 2009,NO_QUERY,BigPalookaD,last nice day today - 5 or 6 straight  days of rain to follow 

0,2208821259,Wed Jun 17 09:40:16 PDT 2009,NO_QUERY,upsidedownland,"wishes he was moving to London now, rather than October "

0,2208821641,Wed Jun 17 09:40:17 PDT 2009,NO_QUERY,SnakeDoc71,I'm like procrastinating bout goin to the gym... Let me get my a** up and go 

0,2208821876,Wed Jun 17 09:40:18 PDT 2009,NO_QUERY,bjaxson,"this day is going to be horrible, i already feel it "

0,2208822086,Wed Jun 17 09:40:19 PDT 2009,NO_QUERY,Jennbop,"Aww hunny, i'm sorry you have a cold  ... MY UTERUS IS FALLING OUT!"

0,2208822504,Wed Jun 17 09:40:21 PDT 2009,NO_QUERY,MrGregCupcake,Frank is getting beat on by the callers.  

0,2208822523,Wed Jun 17 09:40:21 PDT 2009,NO_QUERY,tehjummie,I'm pissed off with Apple waiting for the 3.0 update 

0,2208822678,Wed Jun 17 09:40:22 PDT 2009,NO_QUERY,x_Beckiie_x,OMG! @jonasbrothers are doing TWO MORE shows in london this year! and they only do one in manchester 

0,2208822683,Wed Jun 17 09:40:22 PDT 2009,NO_QUERY,sacred_silence,@211me  doesn`t work? &quot;The resource cannot be found.&quot; #peterfacinelli

0,2208822763,Wed Jun 17 09:40:22 PDT 2009,NO_QUERY,melonpop,@genwar &lt;3 Chin up  Things will look better eventually.

0,2208823329,Wed Jun 17 09:40:24 PDT 2009,NO_QUERY,klaustria,Wishing OS 3 would get here already - 6.40 PM here in Germany! 

0,2208823478,Wed Jun 17 09:40:25 PDT 2009,NO_QUERY,Sweetheart_Jess,learning all day 

0,2208823502,Wed Jun 17 09:40:25 PDT 2009,NO_QUERY,fanpire007,@rosalie4emmett aww whats wrong 

0,2208823727,Wed Jun 17 09:40:26 PDT 2009,NO_QUERY,NuLambda,@gorgeousikon florida for the summer?!?! Noooooooooo. Don't let her get to you....     :-/

0,2208824061,Wed Jun 17 09:40:28 PDT 2009,NO_QUERY,hello1105,dissappointed w Amazon because of a failed delivery 

0,2208824133,Wed Jun 17 09:40:28 PDT 2009,NO_QUERY,karmat1,what happened to the abillity to delete a tweet??? it's all out of whack since maint yesterday 

0,2208824639,Wed Jun 17 09:40:31 PDT 2009,NO_QUERY,XoxoDollisha,"Back on my Peanut Butter Reese's Cup diet, feeling bloated as hell "

0,2208824676,Wed Jun 17 09:40:31 PDT 2009,NO_QUERY,Sexy_Sweet,cant believe she is spending close to 500 for one class 

0,2208825143,Wed Jun 17 09:40:33 PDT 2009,NO_QUERY,JoJo8304,Pub after work but no drinking for skint me 

0,2208825202,Wed Jun 17 09:40:33 PDT 2009,NO_QUERY,kangel_05,matagal ng sakit ng tao -&gt; amnesia. people tend to forget things...esp good things when overwhelmed by bad ones. 

0,2208825615,Wed Jun 17 09:40:35 PDT 2009,NO_QUERY,jessicajaynex,@nickjonas i so wish i could watch american tv..  i love you guys.. can't wait till manchester 22nd nov  gonna be amazing. loveyounickxx

0,2208826461,Wed Jun 17 09:40:38 PDT 2009,NO_QUERY,KirstieLove,@AL_AL_AL Aw man that sounds so good!  I went to Newquay last year and I so want to do it again  Maybe just a long weekend this year 

0,2208826908,Wed Jun 17 09:40:40 PDT 2009,NO_QUERY,JoelleLisa,@ian_watkins  not the dogs

0,2208827658,Wed Jun 17 09:40:44 PDT 2009,NO_QUERY,reeology,@imshelledin I know  why couldn't it have picked a normal time

0,2208827705,Wed Jun 17 09:40:44 PDT 2009,NO_QUERY,TashaLxo,@bclark1492 like one Jackson said MrRathbone is a fake 

0,2208827986,Wed Jun 17 09:40:45 PDT 2009,NO_QUERY,anmeixner,@Lauren_Kobus &amp; @katherinekeogh I'm already getting a taste of what it feels like when you guys leave the country  once is enough

0,2208828194,Wed Jun 17 09:40:46 PDT 2009,NO_QUERY,shortyinabox,"No swimming for me today  And no one wants to go to the splash pad, either. This town is filled with fun-less jerks "

0,2208828205,Wed Jun 17 09:40:46 PDT 2009,NO_QUERY,keepmileysmiley,My finger is still sooo sore   

0,2208828282,Wed Jun 17 09:40:47 PDT 2009,NO_QUERY,indybyteman,My XBOX got Red Ring Last night   Took it into Best Buy today (Had Replacement Plan).  Got new Xbox with no hassle.  Best Buy FTW!!!

0,2208828461,Wed Jun 17 09:40:47 PDT 2009,NO_QUERY,lelebee,"dream, why cant you be real?... "

