0,2266904655,Sun Jun 21 09:17:41 PDT 2009,NO_QUERY,chot32,dont want to go to school tom. Miss hs  cant move on. Lol

0,2266904667,Sun Jun 21 09:17:41 PDT 2009,NO_QUERY,narenbs,The Mon(ster)day is here! 

0,2266905644,Sun Jun 21 09:17:48 PDT 2009,NO_QUERY,jmexxxrawr,I'm suddenly exhausted. 

0,2266905749,Sun Jun 21 09:17:48 PDT 2009,NO_QUERY,NIALOVETT,@BCESTABLISHED06 nope still don't see 

0,2266905995,Sun Jun 21 09:17:50 PDT 2009,NO_QUERY,annabanana34,"At church..trying not to fall asleep, but its really warm in here "

0,2266906016,Sun Jun 21 09:17:50 PDT 2009,NO_QUERY,Charbotta3,I miss my sunglasses... The river ate them up.  

0,2266906167,Sun Jun 21 09:17:51 PDT 2009,NO_QUERY,inidhieta,he's always on my mind .. i wish u mine 

0,2266906267,Sun Jun 21 09:17:52 PDT 2009,NO_QUERY,apups25,i love my daddy and my g-daddy... I hope he feels better soon 

0,2266906515,Sun Jun 21 09:17:53 PDT 2009,NO_QUERY,themartinio,@migs88 did you? haha. yeah i was there. i didnt see you though sorry 

0,2266906616,Sun Jun 21 09:17:54 PDT 2009,NO_QUERY,julieem,@NessUHH I can't I dont have a wrist band. 

0,2266906709,Sun Jun 21 09:17:55 PDT 2009,NO_QUERY,Zewhatcher,Hurt my ankle last night. tis stiff now.  Gonna keep it on ice and elevated as much as possible. THough zoo was still fun.

0,2266906730,Sun Jun 21 09:17:54 PDT 2009,NO_QUERY,alexstewart11,miss you poppy 

0,2266906902,Sun Jun 21 09:17:55 PDT 2009,NO_QUERY,mandilou,"Officially 4 months pregnant today, but I just look like I ate a big lunch.   And happy father's day to all you dads!"

0,2266906961,Sun Jun 21 09:17:56 PDT 2009,NO_QUERY,by_candlelight,"@hushiefan90 that girl is too young to be so obsessive about babies, if she's serious. I hope she doesn't do something she'll regret "

0,2266906994,Sun Jun 21 09:17:56 PDT 2009,NO_QUERY,kenzie4eva,Whoo-hoo! Miley Cyrus+Metro Station is coming to Atlanta! YEHA! lubb her! i wish i could go see FOB/Blink182   

0,2266907232,Sun Jun 21 09:17:58 PDT 2009,NO_QUERY,MrsHillman,Have left Mr H in Hampshire for another week. Been home all of half and hour and missing him already 

0,2266907321,Sun Jun 21 09:17:58 PDT 2009,NO_QUERY,JamilahCreekmur,@BadBoyHenRoc I'm sure it was great!  I haven't been able to get there as much since we moved...  

0,2266907446,Sun Jun 21 09:17:59 PDT 2009,NO_QUERY,yaneri,Everyone keeps calling my dad to the house phone &amp; I can't sleep  &amp; my brother woke me up &amp; shit like why he calling me I'm not a dad

0,2266907779,Sun Jun 21 09:18:01 PDT 2009,NO_QUERY,iRidgeTV,Didnt Go To Bed Till 6am And Had To Be Up At 11am Ugh This Suck Im So Sleepy 

0,2266907873,Sun Jun 21 09:18:02 PDT 2009,NO_QUERY,erinseelert,my neck is jacked  boooooo

0,2266907911,Sun Jun 21 09:18:02 PDT 2009,NO_QUERY,DemiRock,"@punki_x3 Yes, I do...and it's friggin pissing me off  that hurts"

0,2266908754,Sun Jun 21 09:18:07 PDT 2009,NO_QUERY,taylorinksater,@melzieclark @saamm im so jellin' because of you guys 

0,2266908758,Sun Jun 21 09:18:07 PDT 2009,NO_QUERY,DSSDirtyHoney,lost my dog  it hurts so much..wtf

0,2266909200,Sun Jun 21 09:18:10 PDT 2009,NO_QUERY,Emilyx0,I kinda miss Slane now...despite all that walking 

0,2266909562,Sun Jun 21 09:18:12 PDT 2009,NO_QUERY,LegendFox,Good morning everyone. I guess I fell asleep just a few minutes to early last night. 

0,2266909665,Sun Jun 21 09:18:13 PDT 2009,NO_QUERY,imoneawesomekid,"@icrashplanes aww, i miss you too, macaroo. "

0,2266910644,Sun Jun 21 09:18:19 PDT 2009,NO_QUERY,oxallyxo65,@livetosingxo thanks leia. and i'll try. 

0,2266910730,Sun Jun 21 09:18:19 PDT 2009,NO_QUERY,Can_dee,Feels like some nandos but is too ill to get some 

0,2266910822,Sun Jun 21 09:18:20 PDT 2009,NO_QUERY,xmellowd,"I bought the wrong SD card  ugh, I'll just get a new camera.. Panasonic? Casio? Sony? :?"

0,2266910859,Sun Jun 21 09:18:20 PDT 2009,NO_QUERY,DawnWeatherbed,revising for maths exam on tuesday which im gonna fail badly 

0,2266911288,Sun Jun 21 09:18:23 PDT 2009,NO_QUERY,Solunathegold,Missing my pop on fathers day 

0,2266911591,Sun Jun 21 09:18:25 PDT 2009,NO_QUERY,urmanlovesniecy,@CatsHoodRich  lol waht i does ?

0,2266912305,Sun Jun 21 09:18:29 PDT 2009,NO_QUERY,vanessalimsp,"There are just sooo many articles to write. Goldie, missed you alr! Should have just go eat with you n xiaocui!  - http://tweet.sg"

0,2266912540,Sun Jun 21 09:18:30 PDT 2009,NO_QUERY,OhThatStevie,"I'm a bad friend  I missed St. Candi's day! Happy belated birthday, @CandiiD! Hope it was a good one!"

0,2266912629,Sun Jun 21 09:18:31 PDT 2009,NO_QUERY,eniee111,listening to jazzy music today. Should have gone to the jazz festival this weekend. 

0,2266913106,Sun Jun 21 09:18:34 PDT 2009,NO_QUERY,TheEmster,wishing I was going back home this summer 

0,2266913173,Sun Jun 21 09:18:35 PDT 2009,NO_QUERY,chelseadeptula,wishes she could be home for father's day.  love you dad!

0,2266914040,Sun Jun 21 09:18:40 PDT 2009,NO_QUERY,ryanbeatty,@someonesprncss sorry for the let down 

0,2266914220,Sun Jun 21 09:18:41 PDT 2009,NO_QUERY,kylerevans,"Leaving best buy, even though i bought at GC I cant drive tmrw "

0,2266914922,Sun Jun 21 09:18:46 PDT 2009,NO_QUERY,mklujszo,@starbucks in warsaw.... is it always that crouded? 

0,2266915204,Sun Jun 21 09:18:48 PDT 2009,NO_QUERY,amdev,Always want chick-fil-a the most on Sundays 

0,2266915505,Sun Jun 21 09:18:49 PDT 2009,NO_QUERY,corieography,@allieraebot r u feeling better? i really hope so..  im sad u were sick...

0,2266915607,Sun Jun 21 09:18:50 PDT 2009,NO_QUERY,cubastank,"So not looking forward to this week.  Maybe I'll get more in-depth later, but probably not. "

0,2266915698,Sun Jun 21 09:18:51 PDT 2009,NO_QUERY,monicamcghie,I get super stressed when I have to teach Relief Society... in Chinese. 

0,2266915755,Sun Jun 21 09:18:51 PDT 2009,NO_QUERY,FancyFranzy,"watched: Milk....so sad, i nearly cried at the end.. "

0,2266916166,Sun Jun 21 09:18:54 PDT 2009,NO_QUERY,Abilicious00,I've been up since 8. Way to freaking early on a day off! 

0,2266916187,Sun Jun 21 09:18:54 PDT 2009,NO_QUERY,julieunplugged,@sinatra70  Hope they all feel rested and better soon.

0,2266916487,Sun Jun 21 09:18:56 PDT 2009,NO_QUERY,missaminata,@sum1cute i didnt think that i was invited 

0,2266916593,Sun Jun 21 09:18:56 PDT 2009,NO_QUERY,scarysarey,@DonnieWahlberg I wish I could come see you tonight! 

0,2266916657,Sun Jun 21 09:18:57 PDT 2009,NO_QUERY,radiostopshere,@thepianoplayer there was an update but push for fb. Still no push IM apps  #fail

0,2266916961,Sun Jun 21 09:18:59 PDT 2009,NO_QUERY,itstinystar,This little girl wont stop crying !!!!!!! im gonna shoot her; 

0,2266917041,Sun Jun 21 09:18:59 PDT 2009,NO_QUERY,amysnowbaby,Getting ready for Fathers Day things..I'm sad that the family 'father' won't be here this year...Miss you Papa. 

0,2266917606,Sun Jun 21 09:19:03 PDT 2009,NO_QUERY,swoozay,Ugh. Work from 2-10pm all day..  I hope it's not busy at rubys today..

0,2266917937,Sun Jun 21 09:19:05 PDT 2009,NO_QUERY,mizzmimi94,fingers and feet are still sore... as well as the rest of my body. 

0,2266918063,Sun Jun 21 09:19:06 PDT 2009,NO_QUERY,sierra_misty,i feel like i slept for 5 mins. blahhhh  not cool

0,2266918428,Sun Jun 21 09:19:08 PDT 2009,NO_QUERY,drtyjerz,@buttercupd http://tinyurl.com/lzepok it doesn't work 

0,2266918597,Sun Jun 21 09:19:09 PDT 2009,NO_QUERY,GabylovesCHER,r u going to cook cher??? wow!! what a suprise mmmm somethings smell fishy 

0,2266918918,Sun Jun 21 09:19:11 PDT 2009,NO_QUERY,EmilyTebbetts,@auroille its practically impossible with this weather 

0,2266919983,Sun Jun 21 09:19:18 PDT 2009,NO_QUERY,NathalieCaron,I have a splitting headache coming up. I can feel it. 

0,2266920240,Sun Jun 21 09:19:19 PDT 2009,NO_QUERY,prettyxugly,"oh shit it's fathers day, I forgot. good thing I dont have a father anymore "

0,2266925013,Sun Jun 21 09:19:48 PDT 2009,NO_QUERY,geeekgurl,@pinkhairedcyn I wish I was there to join you. 

0,2266925073,Sun Jun 21 09:19:49 PDT 2009,NO_QUERY,eunicesandoval,I QUIT. I WOULD IF I COULD! HAHAHAHA. GIVE MY &quot;LIFE&quot; BACK.  

0,2266925122,Sun Jun 21 09:19:49 PDT 2009,NO_QUERY,DottyAnissa,"tired, but i cant sleep.. grrrr please help me to sleep! i wish i can sleep &amp; have a wonderful dream "

0,2266925283,Sun Jun 21 09:19:50 PDT 2009,NO_QUERY,Mcbumrash,@xlovelydearx nothing much  x

0,2266925366,Sun Jun 21 09:19:50 PDT 2009,NO_QUERY,YoungBlood19,ugh..this day is going to suck 

0,2266925410,Sun Jun 21 09:19:51 PDT 2009,NO_QUERY,pinkpebs,Eating what could possibly my last ever packet of Chilli &amp; Chocolate Crisps 

0,2266925512,Sun Jun 21 09:19:51 PDT 2009,NO_QUERY,Golfhotel,Command &amp; Conquer is not working 

0,2266925865,Sun Jun 21 09:19:54 PDT 2009,NO_QUERY,ellefie,@KhuramMalik Sadly Jense couldn't do it.  But at least he got back up to 6th!

0,2266926076,Sun Jun 21 09:19:55 PDT 2009,NO_QUERY,EquanimityImage,Think tonight could be a late one! 

0,2266926398,Sun Jun 21 09:19:57 PDT 2009,NO_QUERY,Pepe_x,Very Cold  I Need My Hoodie Maybe....

0,2266927336,Sun Jun 21 09:20:03 PDT 2009,NO_QUERY,djrye,"Happy Fathers Day, Missing My Kristina "

0,2266927544,Sun Jun 21 09:20:04 PDT 2009,NO_QUERY,rorambenjimouse,"@SoulIsTheGoal neither do I, and I live in the whong part of the country for the decent stuff "

0,2266928234,Sun Jun 21 09:20:07 PDT 2009,NO_QUERY,Elenarghh,scary airport experience tonight 

0,2266928826,Sun Jun 21 09:20:10 PDT 2009,NO_QUERY,deardeonya,"I'm so crazy, I'm going through withdrawl from @suprach... my coooooousin. "

0,2266928886,Sun Jun 21 09:20:11 PDT 2009,NO_QUERY,v_concessi,"@TCardona Why, did you find a babysitter?? And damn, I'm looking on my phone... you did call late    Me so sorry!!"

0,2266929430,Sun Jun 21 09:20:14 PDT 2009,NO_QUERY,Heartnet13,@dorkabella Oh btw I did try magicians quest again and it doesn't work with my internet  It's lame. And it makes me very very sad :'(

0,2266929453,Sun Jun 21 09:20:14 PDT 2009,NO_QUERY,jazzyj889,aww i dnt wana leave the downtown is great here and so was that bed 

0,2266929539,Sun Jun 21 09:20:14 PDT 2009,NO_QUERY,Jennie91,don't feel well 

0,2266929567,Sun Jun 21 09:20:15 PDT 2009,NO_QUERY,joannaa24,@Skratch323 haha sooo..I was bored  I think it's cute

0,2266929619,Sun Jun 21 09:20:15 PDT 2009,NO_QUERY,Susanluann,@tbajgrow help me find a good guy like that! lol u would not be driving by urself if u came with us! Hehe jk I feel bad tho 

0,2266929863,Sun Jun 21 09:20:16 PDT 2009,NO_QUERY,neobluepanther,trying to understand loan swaps... 

0,2266929912,Sun Jun 21 09:20:17 PDT 2009,NO_QUERY,MarcelaRod,@SPiCYFRiiZ its okay zanzi.. my dad isnt here either. 

0,2266930439,Sun Jun 21 09:20:20 PDT 2009,NO_QUERY,IanOh85,Can't wait for top gear tonight!! Although I may miss it. 

0,2266930647,Sun Jun 21 09:20:21 PDT 2009,NO_QUERY,mssouthsyda17,Haven't gotten any sleep at the ER with anthony.  but he doing better now.

0,2266930834,Sun Jun 21 09:20:22 PDT 2009,NO_QUERY,roseclear,SUCH a good sleep! I don't want to leave Brian. 

0,2266930852,Sun Jun 21 09:20:22 PDT 2009,NO_QUERY,xlovelydearx,@Mcbumrash Aw.   That sucks.

0,2266930994,Sun Jun 21 09:20:23 PDT 2009,NO_QUERY,kittychaaaa,"@Kyrie81 Whoa, a few thousand miles is certainly not next door. "

0,2266931181,Sun Jun 21 09:20:24 PDT 2009,NO_QUERY,caseysevenfold,I can't get over saturday night. :\ I hope something happens between the two of us 

0,2266931239,Sun Jun 21 09:20:25 PDT 2009,NO_QUERY,hplusw,"Another rainy day in Bremen.  Making the best of it while playing Wii, watching TV and searching cool Phone-Apps."

0,2266931439,Sun Jun 21 09:20:26 PDT 2009,NO_QUERY,bgirlcoconut,"I love him, but he has a lot of girls who love him... HARDDD!!! rrrrrawrrrr "

0,2266931639,Sun Jun 21 09:20:27 PDT 2009,NO_QUERY,needham_chris,Off to the game.  Guess I can't boo today.  

0,2266931808,Sun Jun 21 09:20:28 PDT 2009,NO_QUERY,gigad0m,"@asobitech If I had the money, I would "

0,2266931812,Sun Jun 21 09:20:28 PDT 2009,NO_QUERY,dimabm,@kmbuck ahh that sucks! sorry about your wallet  you little dweeter you haha

0,2266931855,Sun Jun 21 09:20:28 PDT 2009,NO_QUERY,debra47,@sarahndipitous That is one more aspect of British summers that's lousy - no fireflies. 

0,2266931859,Sun Jun 21 09:20:28 PDT 2009,NO_QUERY,ShesElectric_,@brandywandlover I tried to have a nap earlier but everyone started mowing the lawns and it was too noisy  yay I'll cook some for youu!xx

0,2266932079,Sun Jun 21 09:20:29 PDT 2009,NO_QUERY,ClaireWynarczyk,@StephenMulhern was gutted when they didn't perform in newcastle  you were a great host on wednesday

0,2266932361,Sun Jun 21 09:20:31 PDT 2009,NO_QUERY,presto990,@dibbly21 Good stuff.   I have Craft HMW 

0,2266932592,Sun Jun 21 09:20:33 PDT 2009,NO_QUERY,Gregor_Boyd,@MissNiccy Me too tbh  have fun last night?

0,2266932597,Sun Jun 21 09:20:33 PDT 2009,NO_QUERY,Shuraine,Cant get out of bed yet. i had a dream that my stomach hurt n it really is  Happy Fathers Day Everyone. Love my daddy 2 death!

0,2266932697,Sun Jun 21 09:20:34 PDT 2009,NO_QUERY,___rachel,"@billyraz Happy Father's Day, Dad... though you can't enjoy it because you have swine flu "

0,2266932784,Sun Jun 21 09:20:34 PDT 2009,NO_QUERY,BriieButterfly,"is going home soon, daddy just arrived. i dont wanna go "

0,2266932807,Sun Jun 21 09:20:34 PDT 2009,NO_QUERY,sjvalentine85,"@rwdave Yes, yes it does. "

0,2266933051,Sun Jun 21 09:20:36 PDT 2009,NO_QUERY,OreoBearPwnWIN,mom why were you here at 8am  well my apartment is only one last box and a room full of papers to go through left with junk. YAY!

0,2266933709,Sun Jun 21 09:20:40 PDT 2009,NO_QUERY,erinyeye,Jeez TOM why did you have to arrive at this time!? I want to swim so bad 

0,2266934349,Sun Jun 21 09:20:43 PDT 2009,NO_QUERY,lushvalley,I weighed myself and the scale did nnt budge since last week.  Maybe I should try again now that I made a deposit.

0,2266934414,Sun Jun 21 09:20:44 PDT 2009,NO_QUERY,barribaskoro,there's nothing on tv 

0,2266934460,Sun Jun 21 09:20:44 PDT 2009,NO_QUERY,aradhanarawks11,help me im feeling very ..................... 

0,2266934465,Sun Jun 21 09:20:44 PDT 2009,NO_QUERY,Rachael90210,"Back from the races. Good times. Cried lots saying good bye to Ellie and Owen, who are going to Spain next year. "

0,2266934575,Sun Jun 21 09:20:45 PDT 2009,NO_QUERY,alexanderrobson,cant stop thinkin  wants to go back and make everythin right 

0,2266934671,Sun Jun 21 09:20:46 PDT 2009,NO_QUERY,Bekkahluv90210,stupid ppl didnt even show up at the game my team was so upset. 

0,2266934860,Sun Jun 21 09:20:47 PDT 2009,NO_QUERY,dknutson,@thed00d Yep - crappy weather tho 

0,2266934868,Sun Jun 21 09:20:47 PDT 2009,NO_QUERY,lyneka,"@Nakisha That makes sense. But, I miss the theme song being played by a different artist each week. "

0,2266935200,Sun Jun 21 09:20:49 PDT 2009,NO_QUERY,iLeanlalala,@yeahman4real i know 

0,2266935458,Sun Jun 21 09:20:50 PDT 2009,NO_QUERY,blindoctorswife,"@GwenArtax Yes, that's exactly how mine feel.   I'd share my menudo if I were there, it works."

0,2266935807,Sun Jun 21 09:20:53 PDT 2009,NO_QUERY,sinclairexoh,@mileycyrus I hope u &amp; nick had a good time. I'm at the beach and haven't been able 2 catch up on my miley news as well 

0,2266936886,Sun Jun 21 09:20:59 PDT 2009,NO_QUERY,korimU,misses his umekal 

0,2266937450,Sun Jun 21 09:21:03 PDT 2009,NO_QUERY,PopeJames7,Is preparing for curry and having face blown off in process. More work tonight so another night of coming home smelling  likw Sambuca 

0,2266937526,Sun Jun 21 09:21:03 PDT 2009,NO_QUERY,Dejam88,Morning recovery wasn't all that bad now I'm out shoppin but I can't shop  I need to work some more

0,2266937649,Sun Jun 21 09:21:04 PDT 2009,NO_QUERY,Smackari,"Had awesome breakfast in bed this morning! But my family ate in the kitchen  Happy Fathers Day, eat by yourself ha ha"

0,2266937703,Sun Jun 21 09:21:04 PDT 2009,NO_QUERY,kellibellyxo,"@mileycyrus &amp; @jonasbrothers performances together was amazing last night, wish i was there "

0,2266938108,Sun Jun 21 09:21:07 PDT 2009,NO_QUERY,likeamovie,"@tashamclellan lol no shame, i can't watch the lion king without crying "

0,2266938442,Sun Jun 21 09:21:09 PDT 2009,NO_QUERY,kikabkika,"up early, going inner tubing and jet skying today YEY so excited! Two hour drive ahed thought "

0,2266938934,Sun Jun 21 09:21:12 PDT 2009,NO_QUERY,alexyeee,Ugh. Omg. So tired 

0,2266939061,Sun Jun 21 09:21:13 PDT 2009,NO_QUERY,currykidd,@katyelizabethh my camera card is still not working 

0,2266939075,Sun Jun 21 09:21:13 PDT 2009,NO_QUERY,TheJellojelly,@Chantelsays A lot of people lor!! Damn sad one!!  I look stuck up meh!

0,2266939188,Sun Jun 21 09:21:13 PDT 2009,NO_QUERY,kris89,http://twitpic.com/80i6p - just realized how much i miss these girls and how much i want our march back 

0,2266939190,Sun Jun 21 09:21:14 PDT 2009,NO_QUERY,MKW1,Happy Father's Day/Happy Birthday Mom! Wish I was home to celebrate 

0,2266939220,Sun Jun 21 09:21:14 PDT 2009,NO_QUERY,pogoshocks,"i hate hayfever, its such a downer "

0,2266939417,Sun Jun 21 09:21:15 PDT 2009,NO_QUERY,Doktor_Wilhelm,"Ack, why did no one tell me PokÃ mon Platinum has a glitch within the GTS, I can't believe I bought Vicky a broken game for her Birthday!  "

0,2266940168,Sun Jun 21 09:21:20 PDT 2009,NO_QUERY,muddi900,Nice batting. Dont be complacent again please  #pakistan

0,2266940346,Sun Jun 21 09:21:21 PDT 2009,NO_QUERY,GraceySomers,Not once have I lost my car keys... The one time I let my dad use my car he looses my car keys  happy fathers day any ways daddy

0,2266942967,Sun Jun 21 09:21:37 PDT 2009,NO_QUERY,daniacil,hates my self  http://plurk.com/p/12qzl1

0,2266943237,Sun Jun 21 09:21:39 PDT 2009,NO_QUERY,vuitton,@morningdoves lucky  you can't buy fireworks in nj

0,2266943949,Sun Jun 21 09:21:44 PDT 2009,NO_QUERY,musicide1,My 'donut fish' sandwich has been discontinued. 

0,2266944165,Sun Jun 21 09:21:45 PDT 2009,NO_QUERY,goldenlady,There's something up w/my host - I can't upload anything. 

0,2266944680,Sun Jun 21 09:21:48 PDT 2009,NO_QUERY,DominoBond,could really use a phone call right now 

0,2266944838,Sun Jun 21 09:21:49 PDT 2009,NO_QUERY,TheBlisschick,"@YogaforCynics oye...too late.    really bad, but then i can usually let comics slide -- someone has to push buttons, explore edges."

0,2266944849,Sun Jun 21 09:21:49 PDT 2009,NO_QUERY,PrincessMir,@tweenkiebelle damn really coz was in a vintage shop n i quite liked it!  darn it

0,2266945035,Sun Jun 21 09:21:50 PDT 2009,NO_QUERY,TeamMrPresident,@TeamMiley I know! Its REALLY cool! Except @OfficialTL doesn't tweet a lot so I'm sad  but I've like his acting since Sharkboy&amp;Lavagirl

0,2266945515,Sun Jun 21 09:21:54 PDT 2009,NO_QUERY,Ally0218,studying gross anatomy - wishing I could be with Dad 

0,2266945573,Sun Jun 21 09:21:54 PDT 2009,NO_QUERY,KateSellers,@IAMFILDONOTYOU No I don't think I'm gonna be able to able to...I have family time to do  Sorry!

0,2266945967,Sun Jun 21 09:21:56 PDT 2009,NO_QUERY,AyCami,Mommy leaves soon 

0,2266946298,Sun Jun 21 09:21:58 PDT 2009,NO_QUERY,establishedin89,@GoRangersFan i can't  i want to sleep anyway.    &lt;3

0,2266947725,Sun Jun 21 09:22:07 PDT 2009,NO_QUERY,Lesyaaayaya,is thinking that the weather is too cold for almost July 

0,2266947814,Sun Jun 21 09:22:08 PDT 2009,NO_QUERY,benningtonisgod,@Joey_DC soon then hubby plays poker all night then i dont get much of a chance in the week  normally i sneak on sons laptop

0,2266948433,Sun Jun 21 09:22:11 PDT 2009,NO_QUERY,Beckii94,i'm going to cry... nothing will work 

0,2266948486,Sun Jun 21 09:22:12 PDT 2009,NO_QUERY,RoXyGurl,I WANT HOME!!!!  @Gezzi @ReturnofthaMatt

0,2266949124,Sun Jun 21 09:22:16 PDT 2009,NO_QUERY,kellymrockson,On the plane. Heading home  as much as I don't like miserably hot dallas. I don't wanna go home. 

0,2266949141,Sun Jun 21 09:22:16 PDT 2009,NO_QUERY,damieri,i'm awake. i feel kinda sick  maybe cause i've been in bed so long.

0,2266949403,Sun Jun 21 09:22:17 PDT 2009,NO_QUERY,_DUST,@SheGotYouCraven damn so u just ruined my rep  lmao

0,2266949815,Sun Jun 21 09:22:19 PDT 2009,NO_QUERY,yourstargirl09,omg less than 6 hours i wil be half way to zante!!! going to miss my wee family and amanda 

0,2266950536,Sun Jun 21 09:22:24 PDT 2009,NO_QUERY,ramandt7,"on second thought, spice is closed "

0,2266950729,Sun Jun 21 09:22:25 PDT 2009,NO_QUERY,kmrtct,is not enjoying the texas heat 

0,2266950911,Sun Jun 21 09:22:26 PDT 2009,NO_QUERY,winda_samakoen,"@jezzms iih najis deh gw tdi liat majalah trus sih taylor bilang &quot;selena, she's a great girl&quot; di cfda  and then he smiled, aargh eff her!"

0,2266951072,Sun Jun 21 09:22:27 PDT 2009,NO_QUERY,darthchavie,@PapareBoy you were right... damn 

0,2266951228,Sun Jun 21 09:22:28 PDT 2009,NO_QUERY,katyRspringett,Thinking..am I not part of anything anymore. 

0,2266951472,Sun Jun 21 09:22:30 PDT 2009,NO_QUERY,Slayer_89,"Doing art work for my installation, been doing it since I got back from work, and expect to be doing it till late tonight...god i'm tired "

0,2266951938,Sun Jun 21 09:22:33 PDT 2009,NO_QUERY,annamols,jst finished w/ my meal.i ddnt eat all of em.naw am goin back 2 my bed.&amp;still waiting...  whrru?

0,2266952231,Sun Jun 21 09:22:35 PDT 2009,NO_QUERY,LaurenHolloway,@Kikiusa so i totally went to coldstone the other day (fri) to get a fathers day cake and you werent there 

0,2266952391,Sun Jun 21 09:22:36 PDT 2009,NO_QUERY,gerryc,"Took the subway. From the stop closest to where I'm staying to the stop close to the office: about 10 minutes. Kinda unkept, too. "

0,2266952506,Sun Jun 21 09:22:36 PDT 2009,NO_QUERY,Bleumoon_Selene,I'm 4 feet 10 1/2 inches. I haven't grown for a long time. Maybe my growing is broken 

0,2266952845,Sun Jun 21 09:22:39 PDT 2009,NO_QUERY,beckiimcfly,"really tired, but i have to revise!! maths gcse on tuesday, "

0,2266953344,Sun Jun 21 09:22:42 PDT 2009,NO_QUERY,82kg,@preethzzz @badavarascal I can understand Tamil. but not Tinglish! (Tamil written in English). it's difficult! I'm already weak in tamil 

0,2266953425,Sun Jun 21 09:22:42 PDT 2009,NO_QUERY,kellyzimmer,Will someone please tell me why I set my alarm for 9:00?? I woke up and felt like someone punched me in the stomach..? Why am I in pain? 

0,2266953443,Sun Jun 21 09:22:42 PDT 2009,NO_QUERY,ImaniLust,@SLprettyyboyy lol!!!! u know what i meant shiiaatt gimmie a break had a long night 

0,2266953724,Sun Jun 21 09:22:44 PDT 2009,NO_QUERY,ghazalrahimi,Is in bed feelin ill  sad times for me

0,2266953950,Sun Jun 21 09:22:45 PDT 2009,NO_QUERY,xzenax,This work is taking wayyy longer than it should! 

0,2266954039,Sun Jun 21 09:22:46 PDT 2009,NO_QUERY,CoraGraze,it's summer but where is the sun????? 

0,2266954116,Sun Jun 21 09:22:46 PDT 2009,NO_QUERY,ambbradshaw,oh and i think there going now 

0,2266954413,Sun Jun 21 09:22:48 PDT 2009,NO_QUERY,Grifmike,Wexford just lost Leinster senior hurling championship semi-final to Dublin -  ouch!

0,2266954579,Sun Jun 21 09:22:49 PDT 2009,NO_QUERY,nicolejeanne,I wish there was a way to make it all go away 

0,2266955011,Sun Jun 21 09:22:52 PDT 2009,NO_QUERY,LittleMrsTom,@JessStar_x whaaat? Not even Abi? 

0,2266955454,Sun Jun 21 09:22:55 PDT 2009,NO_QUERY,donnyridds,@RiotSM  hey I have an exam 

0,2266955649,Sun Jun 21 09:22:56 PDT 2009,NO_QUERY,neniell,this chair they so rudely replaced my desk chair with is very uncomfortable 

0,2266955879,Sun Jun 21 09:22:58 PDT 2009,NO_QUERY,SweetyCj,I'm missing my dad... 

0,2266955930,Sun Jun 21 09:22:58 PDT 2009,NO_QUERY,hicksdan1,Had to work almost 20 hours this weekend   But had a great night out with friends.

0,2266956095,Sun Jun 21 09:22:59 PDT 2009,NO_QUERY,trillyMAYTEE,@_JadeLakeasha my dad is listening to sum weird man and wont let me switch it off 

0,2266956358,Sun Jun 21 09:23:01 PDT 2009,NO_QUERY,sarws,@marianafarfan que tienes? 

0,2266956613,Sun Jun 21 09:23:02 PDT 2009,NO_QUERY,hannahfaulkes,Finishing off question 2. Looks like revision won't be happening till tomorrow after all 

0,2266956671,Sun Jun 21 09:23:03 PDT 2009,NO_QUERY,uacmb02,@mitchelmusso are you not coming to Columbus oh? 

0,2266956969,Sun Jun 21 09:23:04 PDT 2009,NO_QUERY,NGaviola,Happy Fathers Day!..I wish I could actually be with my Dad today 

0,2266956999,Sun Jun 21 09:23:04 PDT 2009,NO_QUERY,analiec,First fathers day without my grandpa  .. Going to visit him today.. Bittersweet

0,2266957080,Sun Jun 21 09:23:05 PDT 2009,NO_QUERY,dorkabella,@Heartnet13 That's heartbreaking.  Booo.

0,2266957140,Sun Jun 21 09:23:05 PDT 2009,NO_QUERY,seesee,"hm, saxonica is down, just wanted to try Saxon with Jython "

0,2266957310,Sun Jun 21 09:23:06 PDT 2009,NO_QUERY,NKArmyTNgirl,"@youngq Hope u have a great Father's Day...my dad isn't doing to well today, so its a rough one for me "

0,2266957868,Sun Jun 21 09:23:10 PDT 2009,NO_QUERY,chinkaren, I've been working the whole Sunday!

0,2266957920,Sun Jun 21 09:23:10 PDT 2009,NO_QUERY,ilovehaggis666,Great Card last night!!! I can't believe Damarques lost! 

0,2266958347,Sun Jun 21 09:23:13 PDT 2009,NO_QUERY,yadayada6,I have slow cooked ribs all night 4 a Father's Day Feast today. But DS has an earache that came uninvited in the night 

