0,2258890782,Sat Jun 20 16:40:06 PDT 2009,NO_QUERY,mariaeduardab,"@tommcfly hey tom  say hi to me, please please please, my hand will fall haha and my mom will kill me"

0,2258890939,Sat Jun 20 16:40:07 PDT 2009,NO_QUERY,screenboy02,just woke up happy go skateboarding day!!!! except its still wet atm 

0,2258891041,Sat Jun 20 16:40:07 PDT 2009,NO_QUERY,_andyLa,"@eddred5 then erika and after that you, no?  why edward, why? :'("

0,2258891508,Sat Jun 20 16:40:10 PDT 2009,NO_QUERY,amisanthropist,@An_Irish_Brit Plus I've drank all the booze that was left here       

0,2258891540,Sat Jun 20 16:40:10 PDT 2009,NO_QUERY,SimonaaBrahh,Goiing on Coastal Potrol today 

0,2258891657,Sat Jun 20 16:40:10 PDT 2009,NO_QUERY,t33na,"@BeerAdvocate aww darn missed you guys!   Had a blast at the #ACBF, though. Sure I'll see you soon... Hair of the Dog, perhaps..."

0,2258892322,Sat Jun 20 16:40:14 PDT 2009,NO_QUERY,MistakenIdenty,"@DenPoet sorry, didn't see your tweets earlier. YOUR headache from yesterday seems to be contagious "

0,2258892737,Sat Jun 20 16:40:16 PDT 2009,NO_QUERY,discoagogo,"@kezbat I want to stay in EF, but just not in this flat "

0,2258892775,Sat Jun 20 16:40:16 PDT 2009,NO_QUERY,slurredspeech,Bedtime. Goodnight everyone. I love you! You're mean  mwah!        i'm waiting for that to get old...

0,2258892825,Sat Jun 20 16:40:17 PDT 2009,NO_QUERY,AmylvsPapaRoach,@PapaRoachWhore I cant find it anywhere 

0,2258892927,Sat Jun 20 16:40:18 PDT 2009,NO_QUERY,LJM_x,"@jamiewarnock1 Not funnyy, itss due yesterdaay n i havent read the book yet! :L it aint looking goood!  *Penguin noise*? xxxxxxxxxxxx"

0,2258893183,Sat Jun 20 16:40:19 PDT 2009,NO_QUERY,talkaboutluck,http://breakfornews.com/KarekarAveShooting090620.htm Sad  Rest in Peace.

0,2258893485,Sat Jun 20 16:40:21 PDT 2009,NO_QUERY,thathyanna,@tommcfly tom answer me and say happy bday to @nanda_marinho ... what did we do for you just ignore..!!! 

0,2258893644,Sat Jun 20 16:40:22 PDT 2009,NO_QUERY,Hardykat1027,Tomorrow is gonna be kinda hard to get through. I really miss my dad 

0,2258893668,Sat Jun 20 16:40:23 PDT 2009,NO_QUERY,lbennoch,a little sunburnt and bored (but not wanting to pack).    I need motivation!!

0,2258893701,Sat Jun 20 16:40:22 PDT 2009,NO_QUERY,Maria_paranoid,Jonas brother and Miley cyrus in Dallas tonight i wish i lived in Dallas 

0,2258893831,Sat Jun 20 16:40:23 PDT 2009,NO_QUERY,LovebugLucee,@exohbellaaaaa whattt??? i am  so tired... 

0,2258893945,Sat Jun 20 16:40:24 PDT 2009,NO_QUERY,nabigator,"@MsNabilalah They have been here last year, in June, but I was on vacation at that moment!  BUT!!! they are coming again on Nov. 13th! D"

0,2258894730,Sat Jun 20 16:40:28 PDT 2009,NO_QUERY,albisc,been speaking with in french and with french accent all day. don;t want to be me today. 

0,2258894837,Sat Jun 20 16:40:29 PDT 2009,NO_QUERY,briannaMcFLYx,i have hurt my tongue 

0,2258901258,Sat Jun 20 16:41:07 PDT 2009,NO_QUERY,CoachChelsey,@RochelleVeturis was my slavedriver at the babyshower.... Not very nice 

0,2258901362,Sat Jun 20 16:41:07 PDT 2009,NO_QUERY,Evie_89,A brief mention.... They normally say a lot more about Paddy  I hoped they were gonna talk about their Le Mans finish a little...

0,2258901411,Sat Jun 20 16:41:08 PDT 2009,NO_QUERY,xxxCandy,im Eating a hamburger. andd... studying for my rel/math exam 

0,2258901554,Sat Jun 20 16:41:08 PDT 2009,NO_QUERY,mariaeduardab,"@tommcfly hey tom  say hi to me, please please please, my hand will fall haha and my mom will kill me.."

0,2258901601,Sat Jun 20 16:41:09 PDT 2009,NO_QUERY,dailyireland,@taylorswift13 you are brilliant!! cant beliveve you are not coming ti ireland!  i would deffo come...please c.. http://bit.ly/sf6wQ

0,2258901842,Sat Jun 20 16:41:10 PDT 2009,NO_QUERY,JoyceJustice,@lightskinnnn38 I know I saw them today  1000 is our limit boooo

0,2258901861,Sat Jun 20 16:41:10 PDT 2009,NO_QUERY,Wingkit,wow just slepted for 4 hours....now im probably not gonna sleep again 

0,2258902065,Sat Jun 20 16:41:11 PDT 2009,NO_QUERY,stumpyhorse,@sonmi bummer about the AC!! i didn't think those window units were too bad  stay cool.

0,2258902130,Sat Jun 20 16:41:11 PDT 2009,NO_QUERY,Michy3993,Ok that cat's hair is killing me  i am definetly sure i am allergic

0,2258902166,Sat Jun 20 16:41:12 PDT 2009,NO_QUERY,dspecial1,@EDotDizzy iv not been up to date with music recently man 

0,2258902737,Sat Jun 20 16:41:15 PDT 2009,NO_QUERY,SocialiteSteph,@edrosa they don't we checked 

0,2258902746,Sat Jun 20 16:41:15 PDT 2009,NO_QUERY,becorrupted,@Bah_Howard MORRA -NN inveja 

0,2258902838,Sat Jun 20 16:41:16 PDT 2009,NO_QUERY,briannaMcFLYx,ive hurt my tongue 

0,2258903165,Sat Jun 20 16:41:18 PDT 2009,NO_QUERY,mariaeduardab,"@tommcfly hey tom  say hi to me, please please please, my hand will fall haha and my mom will kill me"

0,2258903409,Sat Jun 20 16:41:20 PDT 2009,NO_QUERY,DanyFBRodriguez,church in spanish feels forever n i still have about half to go. 

0,2258903804,Sat Jun 20 16:41:22 PDT 2009,NO_QUERY,_rhiannon,I look like a little boy 

0,2258904022,Sat Jun 20 16:41:23 PDT 2009,NO_QUERY,mariaeduardab,"@tommcfly hey tom  say hi to me, please please please, my hand will fall haha and my mom will kill me..."

0,2258904034,Sat Jun 20 16:41:23 PDT 2009,NO_QUERY,ne0nkisseZ,@arneishaOC. I soo wanted to be 

0,2258904097,Sat Jun 20 16:41:24 PDT 2009,NO_QUERY,brookesprague,@Giovannaepae same here !  lets do something !

0,2258904191,Sat Jun 20 16:41:24 PDT 2009,NO_QUERY,inireland,@taylorswift13 you are brilliant!! cant beliveve you are not coming ti ireland!  i would deffo come...please c.. http://bit.ly/sf6wQ

0,2258904510,Sat Jun 20 16:41:26 PDT 2009,NO_QUERY,bobbiejostewart,Its 7:41pm on a saturday night &amp; I wanna go to bed... 

0,2258904530,Sat Jun 20 16:41:26 PDT 2009,NO_QUERY,barrymoves,"If my account does get rewound because of the XBL data, it will happen early this week  -and I won't have time to re-use it "

0,2258904546,Sat Jun 20 16:41:26 PDT 2009,NO_QUERY,naanyzinha,"@tommcfly , say hi to me , please ! I'm crying "

0,2258904639,Sat Jun 20 16:41:27 PDT 2009,NO_QUERY,pensiveczarina,no clubbing for me tonight... 

0,2258904849,Sat Jun 20 16:41:28 PDT 2009,NO_QUERY,mariaeduardab,"@tommcfly hey tom  say hi to me, please please please, my hand will fall haha and my mom will kill me"

0,2258904969,Sat Jun 20 16:41:29 PDT 2009,NO_QUERY,Dakit,I'm going to watch the last few episodes of Skins 3...this better get good soon!! 

0,2258905057,Sat Jun 20 16:41:29 PDT 2009,NO_QUERY,Me_Mason,I'm wishing someone in particular was here right now!.... 

0,2258905562,Sat Jun 20 16:41:33 PDT 2009,NO_QUERY,brooke022,my ankle hurts 

0,2258905821,Sat Jun 20 16:41:34 PDT 2009,NO_QUERY,UALFLYBOi,In LAX and my man is not here  what are yall doing?

0,2258905876,Sat Jun 20 16:41:35 PDT 2009,NO_QUERY,hillaryxcore,Can't get pierced tonight. Sadness. 

0,2258906054,Sat Jun 20 16:41:36 PDT 2009,NO_QUERY,jullesodope,I'm a burnt cookie  so daaawwwkkk dude wtf. I don't like today!!!

0,2258906253,Sat Jun 20 16:41:37 PDT 2009,NO_QUERY,cjdaddysprinces,when is this headache going to go away? ugh shoot me 

0,2258906380,Sat Jun 20 16:41:38 PDT 2009,NO_QUERY,MicheleLee5,At Neka's. Wishing he would talk to me. 

0,2258906482,Sat Jun 20 16:41:38 PDT 2009,NO_QUERY,geloreyes,i fell sleep with my laptop on my tummy. what a bright day in Manila Philippines. but weather is so hot. 

0,2258906743,Sat Jun 20 16:41:40 PDT 2009,NO_QUERY,glasgowgirl2009,dying with the cold so looks like ill be up most of the night 

0,2258906833,Sat Jun 20 16:41:42 PDT 2009,NO_QUERY,mishyfu,Cleaning is boring 

0,2258907185,Sat Jun 20 16:41:43 PDT 2009,NO_QUERY,rawrrasian,cleaning then errands?! something bit my knee and now its all red and puffy 

0,2258907723,Sat Jun 20 16:41:46 PDT 2009,NO_QUERY,iamjesschiriano,"1 month to plan, 1 minute for it all to crumble into tiny pieces.  Next month Dylan, next month."

0,2258907981,Sat Jun 20 16:41:48 PDT 2009,NO_QUERY,eminevitableart,@coalminer78 ? this sounds not good 

0,2258907995,Sat Jun 20 16:41:48 PDT 2009,NO_QUERY,Boss23,Being outside so long got my allergies bothering me. I scratched my nose so much its red as hell like I have a sore. I look like Rudolph 

0,2258908008,Sat Jun 20 16:41:48 PDT 2009,NO_QUERY,lulubrazil,"@tommcfly tom,i'm freaking out..please reply me! i miss you "

0,2258908206,Sat Jun 20 16:41:49 PDT 2009,NO_QUERY,TashNezz,iis Thiinkiing If She Wants to Make Youtube Videos Lol;;Probably Not  and iis Excited to For toniite

0,2258908490,Sat Jun 20 16:41:51 PDT 2009,NO_QUERY,mizzsarona,MiSsIn My bOo 

0,2258908620,Sat Jun 20 16:41:51 PDT 2009,NO_QUERY,BrittanyYoung,ugh my hairs a frizzy mess from the pool  oh well at least i had fun

0,2258908672,Sat Jun 20 16:41:52 PDT 2009,NO_QUERY,Scaleytron,my dog farted  it smells.

0,2258908900,Sat Jun 20 16:41:53 PDT 2009,NO_QUERY,nickL0V3,@ourannual that's really sad 

0,2258908972,Sat Jun 20 16:41:54 PDT 2009,NO_QUERY,SassyLassie007,wishes she could get twitterberry to work on the blackberry. 

0,2258909253,Sat Jun 20 16:41:55 PDT 2009,NO_QUERY,astyles101,@FollowJanae LMAO u might  thats y i go alone other wise i be crackin jokes da whole time ;) but 1 time is good lol

0,2258909574,Sat Jun 20 16:41:57 PDT 2009,NO_QUERY,MMjones_90,I have a bad headache....sumbody help me! 

0,2258909701,Sat Jun 20 16:41:58 PDT 2009,NO_QUERY,leebo,@isthatcherdead Fuck 

0,2258909786,Sat Jun 20 16:41:59 PDT 2009,NO_QUERY,mariaeduardab,"@tommcfly hey tom  say hi to me, please please please, my hand will fall haha and my mom will kill me.."

0,2258909882,Sat Jun 20 16:41:59 PDT 2009,NO_QUERY,DesiGennaro,Missing Darby already.  

0,2258910114,Sat Jun 20 16:42:00 PDT 2009,NO_QUERY,EllPeezy,5 hours of nashville house hunting later... No luck 

0,2258910194,Sat Jun 20 16:42:01 PDT 2009,NO_QUERY,Nileyluvv,@NLS_yt  i kNOE YAh  #BTS ShOUld bE ON TV !!! -xoxoniley4ever&lt;3

0,2258910287,Sat Jun 20 16:42:02 PDT 2009,NO_QUERY,lexismariem,broke my camera 

0,2258910362,Sat Jun 20 16:42:02 PDT 2009,NO_QUERY,tourmaline1973,@Roryjames  *sends smishes*

0,2258910393,Sat Jun 20 16:42:02 PDT 2009,NO_QUERY,rhonda_,Running thru the car wash. We somehow wound up with gum all down the driver's side. 

0,2258910618,Sat Jun 20 16:42:04 PDT 2009,NO_QUERY,mariaeduardab,"@tommcfly hey tom  say hi to me, please please please, my hand will fall haha and my mom will kill me"

0,2258910726,Sat Jun 20 16:42:04 PDT 2009,NO_QUERY,TwitMarii4Peace,i cant sleep (1:40 am in france)... 

0,2258910905,Sat Jun 20 16:42:05 PDT 2009,NO_QUERY,DedeHuber,Collapsable cups and cupon cutters? Packing for camp is so stressful 

0,2258911168,Sat Jun 20 16:42:07 PDT 2009,NO_QUERY,JonnySayer,Is lying in his mums bed cos he is too tired to get ready for bed 

0,2258911280,Sat Jun 20 16:42:08 PDT 2009,NO_QUERY,kittenspawn,@drpandamonium damn it! and i just ordered pizza 

0,2258911622,Sat Jun 20 16:42:10 PDT 2009,NO_QUERY,mattfitz1981,has had a good day/afternoon and is now upset it's over 

0,2258911723,Sat Jun 20 16:42:10 PDT 2009,NO_QUERY,aimzsta,"ouch hangover  busy busy week ahead, packing up room to move n wishing a fairy would deliver me french fries from an evil place"

0,2258911742,Sat Jun 20 16:42:10 PDT 2009,NO_QUERY,rawrrasian,something bit my knee and now its all red and puffy..and not only is it itchy but it hurts!! 

0,2258911947,Sat Jun 20 16:42:12 PDT 2009,NO_QUERY,EmilieRoseBurt,tired but cant sleep boooo 

0,2258912047,Sat Jun 20 16:42:12 PDT 2009,NO_QUERY,breeziibabyax3,@smoothandsincer ii miss yu 

0,2258912070,Sat Jun 20 16:42:12 PDT 2009,NO_QUERY,srslyjomo,I lost my burt's bees lip balm. 

0,2258912099,Sat Jun 20 16:42:13 PDT 2009,NO_QUERY,thathyanna,"@tommcfly  great,, ignore people who loves you !!! "

0,2258912165,Sat Jun 20 16:42:13 PDT 2009,NO_QUERY,littlemissglitz,"@jneworleans yeah..chest pains, stomach aches, and throwing up. i'm wondering who i hurt to deserve this pain "

0,2258912405,Sat Jun 20 16:42:14 PDT 2009,NO_QUERY,keepdoingnothin,yeep..hÃ¤ha with flash back you make me cry... 

0,2258912438,Sat Jun 20 16:42:14 PDT 2009,NO_QUERY,ElizaNicoo,@elesbells Dallas please 

0,2258912638,Sat Jun 20 16:42:16 PDT 2009,NO_QUERY,luverof1,@cleopatralove fakin most run in the family! we were supposed to hang out before you leave!!! 

0,2258912773,Sat Jun 20 16:42:18 PDT 2009,NO_QUERY,vanelozada,"@angeloanniemate in Colombia, this is not that fun "

0,2258912804,Sat Jun 20 16:42:17 PDT 2009,NO_QUERY,mariaeduardab,"@tommcfly hey tom  say hi to me, please please please please, my hand will fall haha and my mom will kill me"

0,2258914098,Sat Jun 20 16:42:24 PDT 2009,NO_QUERY,KaitiDidd,@ThatJonasKidJoe  How come you aren't on  Twitter is boring with out you!

0,2258918431,Sat Jun 20 16:42:50 PDT 2009,NO_QUERY,Saaarrsarr,realy mad the stupid lady cut my bangs too short  Gggrrr !!

0,2258918502,Sat Jun 20 16:42:51 PDT 2009,NO_QUERY,manuellatta,"@PlayWithCaio  LOL... yeah! U're right! but sometimes I fail, and I can't comand my fellings! "

0,2258918828,Sat Jun 20 16:42:53 PDT 2009,NO_QUERY,edd8990,"It has been pointed out in my inebriation tjat I typed Mohammed Suresh, when of course, it should be Mohinder. My geek card is forfeited "

0,2258919208,Sat Jun 20 16:42:55 PDT 2009,NO_QUERY,mariaeduardab,"@tommcfly hey tom  say hi to me, please please please please please, my hand will fall haha and my mom will kill me"

0,2258919968,Sat Jun 20 16:43:00 PDT 2009,NO_QUERY,sarahpenrose,Why is there nothing on worth watching after midnight? 

0,2258920119,Sat Jun 20 16:43:01 PDT 2009,NO_QUERY,breauxsan,had a great 2 week vacation with her boyfriend. now he is gone and I am lonely 

0,2258920335,Sat Jun 20 16:43:02 PDT 2009,NO_QUERY,JoshyPear,@rygledhill i cant watch the link until tomorron  does it look good? No will ferrell

0,2258920482,Sat Jun 20 16:43:03 PDT 2009,NO_QUERY,maripilon,"@tommcfly say hi to me too Tom, I was jealous because you told another girl "

0,2258920573,Sat Jun 20 16:43:04 PDT 2009,NO_QUERY,ThisStarChild,@and1001 Uh! Driving me mad. It's just now they've done this their 'war' is over! Yayyyyy - Iran is saved by green Twitter faces!! Not! 

0,2258920870,Sat Jun 20 16:43:05 PDT 2009,NO_QUERY,carollyne_,"@tommcfly Tom, awswer me, please. says 'hi carol'  i cry so much :/ please please, i beg tom, i beg! i love you so much! Xx"

0,2258920875,Sat Jun 20 16:43:05 PDT 2009,NO_QUERY,JeffNeaseJr,Jon and Kate to announce divorce Monday 

0,2258920966,Sat Jun 20 16:43:06 PDT 2009,NO_QUERY,4EverAngelique,@LadyShottaJessB im sad...I wasnt invited to the shindig yesterday!    JK

0,2258921201,Sat Jun 20 16:43:07 PDT 2009,NO_QUERY,MissKRYP2NT,http://twitpic.com/7ycdk - Aww Brody aww  the WRX has found a new home w RSD &amp; Kirill

0,2258921320,Sat Jun 20 16:43:08 PDT 2009,NO_QUERY,kholl7,http://twitpic.com/7ycdn - My unbelievably sad view of a pretty southern Saturday 

0,2258921636,Sat Jun 20 16:43:10 PDT 2009,NO_QUERY,LynnSongbird,Can't believe I'm still sick. Hospitals aren't as fun as they use to be when I was a kid. 

0,2258921873,Sat Jun 20 16:43:11 PDT 2009,NO_QUERY,KatieBlockley,I'm kinda disappointed with #lvatt. I mean...it's good. But not amazing.  ah well. I still love them.

0,2258921924,Sat Jun 20 16:43:12 PDT 2009,NO_QUERY,hkremer,@db there was a problem w/ your twitpic 

0,2258921932,Sat Jun 20 16:43:12 PDT 2009,NO_QUERY,_BigK_,Low blood sugar uggggg 

0,2258922381,Sat Jun 20 16:43:14 PDT 2009,NO_QUERY,thecryptic,just tried http://helpiranelection.com/ but i think it destroyed my avatar 

0,2258922446,Sat Jun 20 16:43:15 PDT 2009,NO_QUERY,Jennify,tough day today   Tomorrows a new day.

0,2258923066,Sat Jun 20 16:43:19 PDT 2009,NO_QUERY,S3xY_Guh_YazZ,i wan weed now 

0,2258923278,Sat Jun 20 16:43:20 PDT 2009,NO_QUERY,IncompleteJonas,@nileybulgaria http://twitpic.com/7xn1l - OMJ! i cant see the pic! can u post it again or something 

0,2258923340,Sat Jun 20 16:43:20 PDT 2009,NO_QUERY,JenaeJawbreaker,I MISS HIM GODDAMN IT! 

0,2258923571,Sat Jun 20 16:43:21 PDT 2009,NO_QUERY,TheCatcherOnRye,"@christianwilson they were all out  my case will remain phone-less for 7-10 days, but think I can get my old # w/o messing up dad/brother"

0,2258923708,Sat Jun 20 16:43:22 PDT 2009,NO_QUERY,mslayla25,my baby doesn't love me anymore 

0,2258924018,Sat Jun 20 16:43:24 PDT 2009,NO_QUERY,BrittanyMouse09,it just sucks that it got rained out. 

0,2258924174,Sat Jun 20 16:43:25 PDT 2009,NO_QUERY,Sdchai2,@mitchelmusso WHAT ARE U GETTING?  i don't know what 2 get my dad 

0,2258924304,Sat Jun 20 16:43:26 PDT 2009,NO_QUERY,Saaarrsarr,realy mad the stupid lady cut my bangs too short  Grrrr !!

0,2258924427,Sat Jun 20 16:43:26 PDT 2009,NO_QUERY,shannon1320,Missed BB  need to watch tomorrow i'm so glad halfwits still in i love him felt bad for cairon though x

0,2258924761,Sat Jun 20 16:43:28 PDT 2009,NO_QUERY,sweet_yola,Oh no Pleasure P is not tall 

0,2258925003,Sat Jun 20 16:43:30 PDT 2009,NO_QUERY,nancy_co,taking a quick shower... i wish i was in dallas 

0,2258925305,Sat Jun 20 16:43:31 PDT 2009,NO_QUERY,Embraceware,@mattgemmell as a Ghostbusters and PS3 fan - sad to see the XBOX version has more detail: http://www.lensoftruth.com/?p=10974 

0,2258925361,Sat Jun 20 16:43:32 PDT 2009,NO_QUERY,gwlaforce,my job is chill.... but the people aren't 

0,2258925456,Sat Jun 20 16:43:32 PDT 2009,NO_QUERY,StillTickTockin,@Darling_Darla NY is wet!!!! The rain won't stop!!!! 

0,2258925544,Sat Jun 20 16:43:33 PDT 2009,NO_QUERY,lost_dog,@EdmOilers023 I am lost. Please help me find a good home. 

0,2258925582,Sat Jun 20 16:43:33 PDT 2009,NO_QUERY,Brina07,@kidquizine I've been a slave all day. 

0,2258925855,Sat Jun 20 16:43:34 PDT 2009,NO_QUERY,lulubrazil,@mcflyharry please harry..you don't reply me..i'm sad 

0,2258925874,Sat Jun 20 16:43:34 PDT 2009,NO_QUERY,nycsav,Number portability from 415 is causing all kinds of problems with getting an Iphone 

0,2258925920,Sat Jun 20 16:43:35 PDT 2009,NO_QUERY,reminicole,saturday night fever 

0,2258925977,Sat Jun 20 16:43:35 PDT 2009,NO_QUERY,roylevitt,is sitting in the oasis lounge delayed already 

0,2258926300,Sat Jun 20 16:43:37 PDT 2009,NO_QUERY,thekellyj,sweet lord i bit off more than i can chew. closets vomited on my living room and now i have to clean it up. 

0,2258926600,Sat Jun 20 16:43:39 PDT 2009,NO_QUERY,collosus,Im at wallyworld 

0,2258926691,Sat Jun 20 16:43:40 PDT 2009,NO_QUERY,Maiseyjon,i cant really sleep very well 

0,2258926811,Sat Jun 20 16:43:40 PDT 2009,NO_QUERY,CollegeDancer08,I want to go home I love theater but this is giving me a headache. GET ME OUT OF HERE. please 

0,2258927138,Sat Jun 20 16:43:42 PDT 2009,NO_QUERY,ReporterFi,"@jamesdelong she did, so Im trying to talk to her ,someone already did  on fb too "

0,2258927428,Sat Jun 20 16:43:44 PDT 2009,NO_QUERY,bee_wilson,o man- i gotta get pretty again fro work tonight (sigh) i dont want too  come visit me tonight @ Luxe lounge

0,2258927741,Sat Jun 20 16:43:46 PDT 2009,NO_QUERY,agnesnutter,@squarespace sometimes...sometimes I think....you are just a mean ol fake giveaway....like happiness in life #squarespace  

0,2258928232,Sat Jun 20 16:43:49 PDT 2009,NO_QUERY,Lacey0108,@scraplady2005 and effort into it and so many ppl contributed and I don't even know for sure that he got it!!   Totally sucks right now

0,2258928503,Sat Jun 20 16:43:51 PDT 2009,NO_QUERY,SwordofSparda,@Mad_Gab  I was singing some Foreigner while I did it....

0,2258928504,Sat Jun 20 16:43:51 PDT 2009,NO_QUERY,mariaeduardab,"@tommcfly hey tom  say hi to me, please please please, my hand will fall haha and my mom will kill me"

0,2258928596,Sat Jun 20 16:43:51 PDT 2009,NO_QUERY,fanofdonald,@kellyelawson once again lamberts was packed so we settled for mexican 

0,2258928668,Sat Jun 20 16:43:52 PDT 2009,NO_QUERY,miszmanda,"is really sad she's missing her favorite boys of sparks the rescue, stop is the new go, too late the hero &amp; signal the escape, tonight "

0,2258928887,Sat Jun 20 16:43:53 PDT 2009,NO_QUERY,betterlftunsaid,So for some strange reason all the guitar shops are closed. Ugh  But still giving all my love to the best boys in the world @Jonasbrothers

0,2258929054,Sat Jun 20 16:43:54 PDT 2009,NO_QUERY,laurenlaux,"@logansutch they didn't reply me, i'm losing my hopes that someday they'll say just &quot;hello&quot; to me... "

0,2258929881,Sat Jun 20 16:43:59 PDT 2009,NO_QUERY,ajrystad,"@georgerapp Nate's the oppo, for Peggy he's great, for me, not so much.  #babyian #babynate"

0,2258929987,Sat Jun 20 16:44:00 PDT 2009,NO_QUERY,BeOWT,@tnLos  Damn played me...... Forget you too then 

0,2258930791,Sat Jun 20 16:44:05 PDT 2009,NO_QUERY,CTaquechel17,@Cubancita27 I couldn't tweet 

0,2258930895,Sat Jun 20 16:44:05 PDT 2009,NO_QUERY,Dowbiggin,@TeachaKidd I would go to Yankees game! But I am here in San Jose. 

0,2258930899,Sat Jun 20 16:44:05 PDT 2009,NO_QUERY,daaanneee,Back to the forest till monday 

0,2258930950,Sat Jun 20 16:44:06 PDT 2009,NO_QUERY,alesiaxx,@brittdainard violence does not = love 

0,2258931315,Sat Jun 20 16:44:08 PDT 2009,NO_QUERY,Jocey17,so right now i dont have my ipod! D: which im dying for cuz i cant hear my music NOO 

0,2258931673,Sat Jun 20 16:44:11 PDT 2009,NO_QUERY,katrinaa_x,@jamie_grandison what a bore! im on now  lol i'll speak to you tomorrow then smelly. xx

0,2258932115,Sat Jun 20 16:44:13 PDT 2009,NO_QUERY,mikes1988," Work at 7am, CBA..."

0,2258932527,Sat Jun 20 16:44:16 PDT 2009,NO_QUERY,Eedabadee,The guests have eaten ALL of the appetizers &amp; still no bride&amp; groom. And I can't drink b/c I'm first shift driver tonight. 

0,2258932535,Sat Jun 20 16:44:16 PDT 2009,NO_QUERY,zippy007,at grandma's house yay 

0,2258932543,Sat Jun 20 16:44:16 PDT 2009,NO_QUERY,katrivinna,is exhausted... 2 more days and vacation is over... 

0,2258933158,Sat Jun 20 16:44:20 PDT 2009,NO_QUERY,Crazy_juju,I'm missing my friends so much right now it hurts 

0,2258933490,Sat Jun 20 16:44:22 PDT 2009,NO_QUERY,milienn,Trying to go to sleep while listening to Use Somebody - King Of Leon. Wish me luck 

0,2258933531,Sat Jun 20 16:44:22 PDT 2009,NO_QUERY,lucyjasmine_,Thinks her 4 hour unplanned nap this afternoon is keeping her wide awake still 

0,2258933589,Sat Jun 20 16:44:23 PDT 2009,NO_QUERY,karibean,@dorotheasalo I already eated them.  Have this sugar snap pea instead! (I didn't even shred it this time!)

0,2258933649,Sat Jun 20 16:44:23 PDT 2009,NO_QUERY,the_real_rafa,Misses Zoe.  even if i just saw her yesterday. :|

0,2258934058,Sat Jun 20 16:44:26 PDT 2009,NO_QUERY,carmenincalgary,Updating the iTouch to 3.0... how did I live without this thing? The countdown is on until I can get an iPhone... 2 years  - stupid Telus.

0,2258934138,Sat Jun 20 16:44:26 PDT 2009,NO_QUERY,yumsbokchoi,Ahhh Thai tea stain on pants = ruined pants fohevaaaah 

0,2258934377,Sat Jun 20 16:44:29 PDT 2009,NO_QUERY,sonicsociety,@chrismoody Let mek now if you still have problems and which episodes 

0,2258934837,Sat Jun 20 16:44:31 PDT 2009,NO_QUERY,Loafobread101,@laura4744 ...so much for your cross county trip! 

0,2258940292,Sat Jun 20 16:45:05 PDT 2009,NO_QUERY,Breigh,House is completely infested with mosquitoes. What is going on?! Worse this year than EVER!! Even getting inside my net and biting me 

0,2258940320,Sat Jun 20 16:45:05 PDT 2009,NO_QUERY,la_discoteca,Apparently my spf 50 sunscreen didn't work. I have awful sunburn with stupid lines on the right half of me. Awesome 

0,2258940630,Sat Jun 20 16:45:06 PDT 2009,NO_QUERY,Davos_the_greek,Can't sleep hollie has taken over the bed 

0,2258941403,Sat Jun 20 16:45:11 PDT 2009,NO_QUERY,xomalese,last day on set  all prom scenes though! I'll try &amp; post some pics for you guys.

0,2258941458,Sat Jun 20 16:45:11 PDT 2009,NO_QUERY,mk_ken_thatdude,too sleepy in the morning &gt;&lt; where Lyka at? 

0,2258941465,Sat Jun 20 16:45:11 PDT 2009,NO_QUERY,LilTOhDang,Sprinkled was a bust too long of a line  now I'm home imma watch tv w/ my sista

0,2258941467,Sat Jun 20 16:45:11 PDT 2009,NO_QUERY,JoserdelaTrashy,http://twitpic.com/7ycm9 - My niece is all grown up  it trips me out

0,2258941833,Sat Jun 20 16:45:13 PDT 2009,NO_QUERY,discoagogo,@kezbat i can't just yet 

0,2258941900,Sat Jun 20 16:45:13 PDT 2009,NO_QUERY,Jakeycake_,@Kayleeleanne Its not my fault the internet decided to go and take a trip somewhere  and Jordan isnt here now xxx

0,2258942361,Sat Jun 20 16:45:16 PDT 2009,NO_QUERY,ruario,"crap, just deleted all my pics off my phone...loads of good ones "

0,2258943097,Sat Jun 20 16:45:21 PDT 2009,NO_QUERY,Veronica91,"MMVA'S TOMORROW def watching it on the teevo, since i can't be in Toronot "

0,2258944260,Sat Jun 20 16:45:28 PDT 2009,NO_QUERY,ksemp,@mododson Boo on not coming this weekend  but for sure coming your birthday weekend. Get Excitedd!! love you miss you mean it bye! haha.

0,2258944267,Sat Jun 20 16:45:29 PDT 2009,NO_QUERY,RavenLaR,@RealBRITannica it's gonna rain here soon 

0,2258944418,Sat Jun 20 16:45:28 PDT 2009,NO_QUERY,HayleyyFitch,@erikaANGEL D: D: D: i would seriously be crying..im supposed to go this summer..im going to cry going past planet hollywood! 

0,2258944428,Sat Jun 20 16:45:28 PDT 2009,NO_QUERY,Natalie_1990,"i need sleep, not use to working, really not looking forward to 10 hours shift on monday "

