sentiment,userid,date,query,userId,text
0,2253141004,Sat Jun 20 07:39:33 PDT 2009,NO_QUERY,kisnacapri,@jwffjose i tried but  didnt work.. 

0,2253143125,Sat Jun 20 07:39:46 PDT 2009,NO_QUERY,Imi__x,"shattered, and i have so much to do today! I havent even been on the treamill yet  xxx"

0,2253143220,Sat Jun 20 07:39:47 PDT 2009,NO_QUERY,maiamorgan,I'm bored.  I don't know what to do without my little girl.    Life is so boring without her.  

0,2253143234,Sat Jun 20 07:39:47 PDT 2009,NO_QUERY,poobear2,At work starting a 12 hour shift 

0,2253143517,Sat Jun 20 07:39:49 PDT 2009,NO_QUERY,laceyloveriot,headaches =    going to the mall though today!

0,2253143815,Sat Jun 20 07:39:50 PDT 2009,NO_QUERY,pittsburghbabe1,@BrodyJenner  lucky you...ive been up since 8am  boo lol

0,2253144441,Sat Jun 20 07:39:54 PDT 2009,NO_QUERY,causeimgreat,"@luvlocked hi joanne, do you know who i am? "

0,2253144540,Sat Jun 20 07:39:55 PDT 2009,NO_QUERY,Jemma_Mason,hair is too short 

0,2253144616,Sat Jun 20 07:39:55 PDT 2009,NO_QUERY,GenericHipster,Then we can get to some smooching on the grass..nah she don't do it in public  smh

0,2253144922,Sat Jun 20 07:39:57 PDT 2009,NO_QUERY,andreea_hirica,"no #canneslions this year, doctor says, still dangerous virus  however, 'll be lively following @luckthelady and the twittersphere"

0,2253144995,Sat Jun 20 07:39:58 PDT 2009,NO_QUERY,angelmarie20090,gotta do some work around the house then work at 4.  Its rained for 4 days now   gahhh

0,2253145134,Sat Jun 20 07:39:59 PDT 2009,NO_QUERY,eatmydazzledust,"Had a baaaarrrrilllliant day/night yesterday, feeling a tad delicate today journey home was a killer "

0,2253145417,Sat Jun 20 07:40:01 PDT 2009,NO_QUERY,Sweetheart_Jess,learning 

0,2253146132,Sat Jun 20 07:40:05 PDT 2009,NO_QUERY,xokayy,work 11-7. ive had no time for tweeteringg  i will soon though bbwl.

0,2253146259,Sat Jun 20 07:40:05 PDT 2009,NO_QUERY,nmhrbrtsn,@acceptmyheart aww whats up bb?  *hugs*

0,2253146410,Sat Jun 20 07:40:06 PDT 2009,NO_QUERY,igwarrender,At the Hoppings at Newcastle Town Moor... And its wet  again

0,2253146510,Sat Jun 20 07:40:07 PDT 2009,NO_QUERY,theprettybird,@jellyfishsea I'm starting to think it is a sign that I've really got to change my music taste - no it's not -rubbish Ipod. 

0,2253146628,Sat Jun 20 07:40:07 PDT 2009,NO_QUERY,cherrychuchu,Othas are in B.  wat a bitch huh?

0,2253147471,Sat Jun 20 07:40:12 PDT 2009,NO_QUERY,Ediesedgwick83,I am VERY cold  jumper and a wooly hat on @otisbear isnt cold so he doesnt think this means we need heating on x

0,2253147992,Sat Jun 20 07:40:15 PDT 2009,NO_QUERY,para_whoree,cant sleep  who wants to chat it up on msn (:

0,2253148378,Sat Jun 20 07:40:17 PDT 2009,NO_QUERY,barribaskoro,@nadhiraameria IYAAAA! shit we're not gonna see each other for like 2 more weeks 

0,2253148683,Sat Jun 20 07:40:19 PDT 2009,NO_QUERY,chadro89,I want my lip pierced so bad  -_- pack my bags mum

0,2253148763,Sat Jun 20 07:40:20 PDT 2009,NO_QUERY,SheanyYasTaj,"I'm totally booorrreeedd. Sitting here, drinking caramel cream blended... Ugghhh. Bored. "

0,2253148822,Sat Jun 20 07:40:20 PDT 2009,NO_QUERY,_cee,@lovest0ned omg jen! Sooo crappy  how are you?! How's the pg coming along?

0,2253148996,Sat Jun 20 07:40:21 PDT 2009,NO_QUERY,enmusic,Trying to sleep in! But having no luck 

0,2253149171,Sat Jun 20 07:40:22 PDT 2009,NO_QUERY,netfreedom,"Bejing 1989, Tehran 2009  saddened by reports of police beatings/killings in Tehran. Thoughts and prayers are with Iranian people today."

0,2253149401,Sat Jun 20 07:40:23 PDT 2009,NO_QUERY,Arianna_Johnson,ughh I feel like crap. and I definitely don't want to work today. Ef this. 

0,2253149449,Sat Jun 20 07:40:23 PDT 2009,NO_QUERY,jenn_darling,Moving day 

0,2253149468,Sat Jun 20 07:40:23 PDT 2009,NO_QUERY,hannah1721,going to my last two hip-hop classes for the summer 

0,2253149588,Sat Jun 20 07:40:24 PDT 2009,NO_QUERY,southernmojo,@andiesmith You are a strong woman. I've not had my morning coffee yet and my head is pounding. 

0,2253149679,Sat Jun 20 07:40:25 PDT 2009,NO_QUERY,pecenco,"Farmer's Market, errands, dishes, bake a cake, make pizza ... doesn't seem to be much time to edit photos "

0,2253149986,Sat Jun 20 07:40:27 PDT 2009,NO_QUERY,Zweibz7,Didn't get to live-blog this morning's #musicedweek opening session b/c there was no wireless available in the conference room  #menc09

0,2253150415,Sat Jun 20 07:40:29 PDT 2009,NO_QUERY,muffinlovestom,end today  saddddddddddd

0,2253150781,Sat Jun 20 07:40:31 PDT 2009,NO_QUERY,bugsyTay2x,feels worthless 

0,2253150847,Sat Jun 20 07:40:32 PDT 2009,NO_QUERY,joeltotherescue,nooot having the best morning 

0,2253151131,Sat Jun 20 07:40:34 PDT 2009,NO_QUERY,AntoniaClark,now only 2 hours till work - sad panda 

0,2253151826,Sat Jun 20 07:40:38 PDT 2009,NO_QUERY,tweetzmarie,Leaving Lakeside now 

0,2253151951,Sat Jun 20 07:40:39 PDT 2009,NO_QUERY,staceyhumphrey,i'm going to miss my sister so much 

0,2253151990,Sat Jun 20 07:40:39 PDT 2009,NO_QUERY,ringetterocks,switchfoot's coming to toronto tomorro!!   im not going   but the SOund of Music Festival is still on!

0,2253152043,Sat Jun 20 07:40:39 PDT 2009,NO_QUERY,dirtboy_br,Took charlie to puppy jail bc vaca starts today. Still sad even tho I'll see him next week. 

0,2253152426,Sat Jun 20 07:40:41 PDT 2009,NO_QUERY,chloedimond,waiting for mum to get home... she takes farrrrrkin days! and i lost my phone 

0,2253152461,Sat Jun 20 07:40:42 PDT 2009,NO_QUERY,georgekjoy,All we r gettin is 7 days as holidays 

0,2253152472,Sat Jun 20 07:40:42 PDT 2009,NO_QUERY,scotthamilton,@MieAase http://twitpic.com/7wh7r - God damn it!  That water looks SO cool! Oh my god.

0,2253152796,Sat Jun 20 07:40:44 PDT 2009,NO_QUERY,VANJADOSAN,I love summer. We'll see how it goes once summer classes start monday 

0,2253153468,Sat Jun 20 07:40:48 PDT 2009,NO_QUERY,gio_joy,has just spilt pink nail varnish all over her new carpet 

0,2253153779,Sat Jun 20 07:40:50 PDT 2009,NO_QUERY,bradlehdave,@trixietia no. my parents don't want me to 

0,2253153794,Sat Jun 20 07:40:50 PDT 2009,NO_QUERY,lojukwu,"home... finally, class in the AM. "

0,2253153892,Sat Jun 20 07:40:50 PDT 2009,NO_QUERY,karinahernandez,h1n1 treatment...dayum 

0,2253154347,Sat Jun 20 07:40:54 PDT 2009,NO_QUERY,Bill12951,Morning everyone. It's so humid today!  

0,2253154370,Sat Jun 20 07:40:54 PDT 2009,NO_QUERY,Aye_Dub,Oh my goodness.  Apparently the Hannah Montana season 4 will be the last one... 

0,2253154450,Sat Jun 20 07:40:54 PDT 2009,NO_QUERY,dinafragola,I am cold and uninspired...at this rate my bedroom will never be finished 

0,2253154471,Sat Jun 20 07:40:55 PDT 2009,NO_QUERY,aatona,Good morning!!... Time to put the winter clothes away and bring up the summer clothes.. 

0,2253154725,Sat Jun 20 07:40:56 PDT 2009,NO_QUERY,yooolivia,@jesssaywhattt guys .. Em is mean to me 

0,2253154776,Sat Jun 20 07:40:56 PDT 2009,NO_QUERY,TheBirdman,Did a rescue job last night: 16th birthday. Rescuing myself this morning: just woke up. Time for brekdist. Wishing they had paid w/ cash. 

0,2253155058,Sat Jun 20 07:40:58 PDT 2009,NO_QUERY,violetfrosting,"@cynicalcylon Respecting the choice, but still "

0,2253155066,Sat Jun 20 07:40:58 PDT 2009,NO_QUERY,alanturner1,Wishes he wasn't in work on a Saturday nite! 

0,2253155639,Sat Jun 20 07:41:02 PDT 2009,NO_QUERY,Tileah,This feels like the longest morning!!!  I need work to be OvER!

0,2253155655,Sat Jun 20 07:41:02 PDT 2009,NO_QUERY,lucyluz1284,gettin ready to rain..what's new??? freaking rain go away!!!! wanna b in my bed with my hunny 

0,2253156263,Sat Jun 20 07:41:06 PDT 2009,NO_QUERY,tinapatina,@meagafly can't read. i'm in class!! 

0,2253156438,Sat Jun 20 07:41:07 PDT 2009,NO_QUERY,froieex3,@toniixmariee  miss you guys

0,2253156664,Sat Jun 20 07:41:08 PDT 2009,NO_QUERY,krystalbeth,my dog ate the cord to my computer...No more twitter at hom for me...  

0,2253156683,Sat Jun 20 07:41:08 PDT 2009,NO_QUERY,ChooeyC,Last full day in atlanta  off to waffle house!! Yummmmm

0,2253157650,Sat Jun 20 07:41:15 PDT 2009,NO_QUERY,iphonechik,Sooooo hello tweets... Beautiful sunny day here in FL. Let's hope it stays that way for my car's sake 

0,2253157887,Sat Jun 20 07:41:17 PDT 2009,NO_QUERY,Rukamousse,I &quot;went to sleep&quot; five hours ago. I should not be awake......  mrrrrr.  

0,2253158203,Sat Jun 20 07:41:19 PDT 2009,NO_QUERY,SirCrumpet,That makes the song about 50 times less awesome now. 

0,2253158587,Sat Jun 20 07:41:21 PDT 2009,NO_QUERY,guitar_crazy,i have a difficult descsion to make 

0,2253158878,Sat Jun 20 07:41:23 PDT 2009,NO_QUERY,tokiorose,@firebolts  YOU'RE NOT THE ONLY ONE.

0,2253158903,Sat Jun 20 07:41:23 PDT 2009,NO_QUERY,haolepinay,"Going to the hospital for my blood work. So proud of my hubby! Hating that the boat is back, which means less time with my hubby. Sucks! "

0,2253159078,Sat Jun 20 07:41:24 PDT 2009,NO_QUERY,rachtreacy,@MindofZ jealous wish I was still in Tokyo 

0,2253160156,Sat Jun 20 07:41:31 PDT 2009,NO_QUERY,chriscanal,"Daaaamn, forgot my phone charger and iPhone is at 20% charge! "

0,2253160185,Sat Jun 20 07:41:31 PDT 2009,NO_QUERY,SarahG8s,Got this really nice dress and a nice top n this other dress was 2 big was still really nice n they didnt av it in a smaller size 

0,2253160191,Sat Jun 20 07:41:31 PDT 2009,NO_QUERY,mitsumtnasu,i really need to do some laundry... but i sooooo don't feel like it... lotta pain in my jaw today  shouldn't it be better by now!?

0,2253160423,Sat Jun 20 07:41:33 PDT 2009,NO_QUERY,MsBUNNYbby,I'm so hungry I'm about to cry 

0,2253160530,Sat Jun 20 07:41:33 PDT 2009,NO_QUERY,Cimental,I'm up for another day but my back still hurts...  LAME

0,2253160599,Sat Jun 20 07:41:34 PDT 2009,NO_QUERY,_SharonnJ,"@smueller94, do you have a guitar?:O damn why does everybody has a guitar and play guitar? i want it 2 "

0,2253160683,Sat Jun 20 07:41:34 PDT 2009,NO_QUERY,Yani_the_yakk,"@aaronnjohnson hey, where can i get my hands on some of your music? Any web sites, cuz here they dnt have it in the stores. "

0,2253162967,Sat Jun 20 07:41:49 PDT 2009,NO_QUERY,davidpkelly,"Off to DUB to head to STN, forgot about online check in time limits and gonna have to pay â‚¬40 "

0,2253163069,Sat Jun 20 07:41:50 PDT 2009,NO_QUERY,natashaw1,"@joyroett LOL cause I am at work, and there is nothing open to buy real food  I am doing Harvey's for lunch  boo! lol"

0,2253163119,Sat Jun 20 07:41:50 PDT 2009,NO_QUERY,rivensky,I hate paying bills.  Money sucks. I wish I never had any to begin with.

0,2253163336,Sat Jun 20 07:41:51 PDT 2009,NO_QUERY,OliviaWilkins,hey @shmonnie .... i miss your face. badly  

0,2253163643,Sat Jun 20 07:41:53 PDT 2009,NO_QUERY,hope_won,"Watching &quot;The Dark Knight&quot;...again, nothing on HBO this morning "

0,2253164124,Sat Jun 20 07:41:57 PDT 2009,NO_QUERY,childishhh,Needs a case for my itouch... So I can finally open it 

0,2253164157,Sat Jun 20 07:41:57 PDT 2009,NO_QUERY,KoRnieKelli,up at 9:30 after a show and beer... wtf??? 

0,2253164177,Sat Jun 20 07:41:57 PDT 2009,NO_QUERY,KarinIrani,"so early to be up, 7:15, I guess I am getting old! old people can't sleep "

0,2253164377,Sat Jun 20 07:41:58 PDT 2009,NO_QUERY,CaseyCornett,@wen1027 In a random hotel. Uploading the video right now. I'm gonna miss Liverpool!!!  

0,2253164574,Sat Jun 20 07:42:00 PDT 2009,NO_QUERY,Jayniebop,"@snickystalker I really want to go and see Transformers, no one wants to see it though "

0,2253164596,Sat Jun 20 07:42:00 PDT 2009,NO_QUERY,cazp09,@JessMcFlyxxx hi hun i see your poorly  xxxxx

0,2253164825,Sat Jun 20 07:42:01 PDT 2009,NO_QUERY,Juliasmom66,"@IslandBreeez That sounds fun!We have a drivein half mile from here but mosquitos r so bad,cant go  We r going 2 nephews 1st bd party"

0,2253165719,Sat Jun 20 07:42:06 PDT 2009,NO_QUERY,Ethier44,"@Gatorval  what is the matter Val,why so sad  Sorry"

0,2253165914,Sat Jun 20 07:42:08 PDT 2009,NO_QUERY,lornadeng,"I have to sleep on my couch tonight... NEG!  hope you all sleep tight, I won't."

0,2253166174,Sat Jun 20 07:42:09 PDT 2009,NO_QUERY,curiouslt,"@MadBrad good morning! Lucky you, we got our one nice day yesterday and back to rain today "

0,2253166810,Sat Jun 20 07:42:13 PDT 2009,NO_QUERY,tam319,@jlkupstas this week has been bad.  don't want to do it but I'm considering locking my acct 

0,2253166863,Sat Jun 20 07:42:13 PDT 2009,NO_QUERY,krisgarza,On our way to the river still dont kno which one 

0,2253166958,Sat Jun 20 07:42:14 PDT 2009,NO_QUERY,corina24,@AnnLinny  miss you too! Just read your messages! wish we could be somewhere else now 

0,2253166973,Sat Jun 20 07:42:14 PDT 2009,NO_QUERY,xxparanoid,"@yourdeclared oo nga! Naku, gusto ko na bumalik sa 2nd year. "

0,2253167032,Sat Jun 20 07:42:14 PDT 2009,NO_QUERY,thikkumz_kkeVP,@collegiate84 nothin procrastinating on gettin up n out in this dumb ass rain 

0,2253167447,Sat Jun 20 07:42:17 PDT 2009,NO_QUERY,EricWood73,@ mvizdos Thanks for the training. Got back to find out that we only completed 1 story this iter. And corporate is coming to our review. 

0,2253168013,Sat Jun 20 07:42:20 PDT 2009,NO_QUERY,lalalauraxo,"wow, so glad i stayed up late last night  my day home till friday  stupid camp."

0,2253168284,Sat Jun 20 07:42:22 PDT 2009,NO_QUERY,Can_dee,@Sela_Frans f - off 

0,2253168721,Sat Jun 20 07:42:24 PDT 2009,NO_QUERY,Hungry4Moore,is cleaning his room 

0,2253169210,Sat Jun 20 07:42:27 PDT 2009,NO_QUERY,adeeba1511,had a bad day--too many blunders for one day  !!

0,2253169531,Sat Jun 20 07:42:29 PDT 2009,NO_QUERY,karinebb,in my bed the hole day 

0,2253169589,Sat Jun 20 07:42:30 PDT 2009,NO_QUERY,kpeters27,http://twitpic.com/7whkk - leaving the beach 

0,2253169757,Sat Jun 20 07:42:31 PDT 2009,NO_QUERY,xxprincessxx_89,cant believe i waited up till 4 o'clock this morning just to get stood up  whats that all about?! no txt/phonecall or anything!...

0,2253169894,Sat Jun 20 07:42:31 PDT 2009,NO_QUERY,hoopycat,@Astronautics how is your ratio of &quot;real&quot; followers to obviously spammy followers?  95% of my new followers are crap anyway 

0,2253170831,Sat Jun 20 07:42:37 PDT 2009,NO_QUERY,ong_annc,doesn't know where to download songs  FROSTWIRE broken... 

0,2253171268,Sat Jun 20 07:42:40 PDT 2009,NO_QUERY,unfnshdrambler,"@nipplelicious I got my mojo working, I guess...or not, it's still raining here with storms on the way this afternoon "

0,2253171339,Sat Jun 20 07:42:40 PDT 2009,NO_QUERY,PumaJackson,Owners leaving outta state tomorrow.  Without me. I am going to miss them!!! I need a hug!

0,2253171568,Sat Jun 20 07:42:42 PDT 2009,NO_QUERY,emmaraybould11,@himynameisjames i knewwwww you would say something like that! Its my webcam.. i can't turn it 

0,2253171697,Sat Jun 20 07:42:43 PDT 2009,NO_QUERY,saintUK,"hoping gadget show comes back on soon, still not won a competition "

0,2253171767,Sat Jun 20 07:42:43 PDT 2009,NO_QUERY,Maandeerz,"@NicoleRengel awww i'm gonna miss you too  and like u can see, i can't send direct messages :S"

0,2253171884,Sat Jun 20 07:42:44 PDT 2009,NO_QUERY,Angela_Grace,ROMY &amp; MICHELLES HIGH SCHOOL REUNION! YAAYAYAA but daaaaaaamn i have to go to work       

0,2253172409,Sat Jun 20 07:42:47 PDT 2009,NO_QUERY,KarlaKelly93,"summer, but no parties. spending the day babysitting. so annoying "

0,2253172476,Sat Jun 20 07:42:48 PDT 2009,NO_QUERY,udgata,Note: dinner takes time on Sundays. 

0,2253172500,Sat Jun 20 07:42:48 PDT 2009,NO_QUERY,missnancii,I need a comfort hug right now 

0,2253172775,Sat Jun 20 07:42:50 PDT 2009,NO_QUERY,Musique,@loweruno I still can't teleport over to the SLB6 site.  Not sure why.  

0,2253173222,Sat Jun 20 07:42:53 PDT 2009,NO_QUERY,irishbabe3,"Ive got the flu and I have to go view wedding cars, I really couldn't be bothered, feeling awful "

0,2253173263,Sat Jun 20 07:42:53 PDT 2009,NO_QUERY,tomgirl360,so much 4 sleeping in!  darn kid sleepovers been up since 7

0,2253173367,Sat Jun 20 07:42:54 PDT 2009,NO_QUERY,emmaarrr,@nmhrbrtsn i had been ignoring all reading/leeds tweets because i didnt think i could go 

0,2253173765,Sat Jun 20 07:42:56 PDT 2009,NO_QUERY,mcflyJessxxx,biting your nails hurts everyone dont try it my fingers are red  i blame mother for making me bored!!!! nothing to do

0,2253174042,Sat Jun 20 07:42:58 PDT 2009,NO_QUERY,emmacherry,"~ why is it, that when your hair looks like shit, everything else looks and feels like shit too? I so need to get my roots done - badly "

0,2253174215,Sat Jun 20 07:42:59 PDT 2009,NO_QUERY,mstohl,@reviewerx sounds horrible 

0,2253174232,Sat Jun 20 07:42:59 PDT 2009,NO_QUERY,cammydahharper,URGH. BCG Vaccination scab is really sore 

0,2253174251,Sat Jun 20 07:43:00 PDT 2009,NO_QUERY,EntityComputerS,eating cheerios... remembering back when girls were cool to hang out with... now they just want me up... not awake 

0,2253174294,Sat Jun 20 07:43:00 PDT 2009,NO_QUERY,airabak,"last day of ACS 2009 National Convention  Looking forward to Elizabeth Warren at lunch, however #ACS09"

0,2253174424,Sat Jun 20 07:43:01 PDT 2009,NO_QUERY,asianmatt,"@modelity hush you, its one of my fav. blink songs that goes along with this weather! you never texted me back this morning either "

0,2253174773,Sat Jun 20 07:43:03 PDT 2009,NO_QUERY,alethiatoh,am so disappointed with today's flea 

0,2253174886,Sat Jun 20 07:43:04 PDT 2009,NO_QUERY,jessijuliedot,@suzyv the venue you played at in Huntington just closed the other day (the Imac) just thought you'd want to know 

0,2253174891,Sat Jun 20 07:43:04 PDT 2009,NO_QUERY,kusuma06,missing my boyfriend soo..why he isn't call me this night 

0,2253174898,Sat Jun 20 07:43:04 PDT 2009,NO_QUERY,Rutto_chan,i'm soooo hungry  but i wanted to finish this before!! how do i evaluate myself!?

0,2253174971,Sat Jun 20 07:43:04 PDT 2009,NO_QUERY,that70sgrl,@MaggieKattan oh maggie!!  Hope you feel better!! Workin out when you're congested is NEVER fun!

0,2253175110,Sat Jun 20 07:43:05 PDT 2009,NO_QUERY,measureinlove,http://twitpic.com/7whm0 - starting to rain 

0,2253175124,Sat Jun 20 07:43:05 PDT 2009,NO_QUERY,kevonil,out drank and out pokered @tupaz last night. Now? foggy with spinning head. you win buddy 

0,2253176295,Sat Jun 20 07:43:13 PDT 2009,NO_QUERY,nicoleburmeiste,itÂ´s sooo boring today  (huuu.......)

0,2253176348,Sat Jun 20 07:43:13 PDT 2009,NO_QUERY,bldngnerd,Slept in. Time to get up and do some yardwork 

0,2253176758,Sat Jun 20 07:43:16 PDT 2009,NO_QUERY,honey274,@AntBoogieWorld I wanna be in london now!!! 

0,2253176777,Sat Jun 20 07:43:16 PDT 2009,NO_QUERY,chrisbrogan,"@lewishowes - no one asked me to.  . If it were soon-ish, I'd visit. "

0,2253176834,Sat Jun 20 07:43:16 PDT 2009,NO_QUERY,potsplants,Probably going to have to shop for a new desktop computer this weekend.  

0,2253177353,Sat Jun 20 07:43:20 PDT 2009,NO_QUERY,chazzerbezzer,Trust be to get caught in the rain too 

0,2253177420,Sat Jun 20 07:43:20 PDT 2009,NO_QUERY,Jmoney718,This weather is crazy...it makes me depress 

0,2253177570,Sat Jun 20 07:43:21 PDT 2009,NO_QUERY,nisash,i miss my sis serge so badly 

0,2253177852,Sat Jun 20 07:43:23 PDT 2009,NO_QUERY,ox_Emma,omg i just watched the season finale of greys anatomy. omg. omg. 

0,2253177963,Sat Jun 20 07:43:24 PDT 2009,NO_QUERY,kimdurant,yayyyy my best friend hates me 

0,2253178602,Sat Jun 20 07:43:28 PDT 2009,NO_QUERY,AshleyEccentric,Just homeee. I wanna jump in the shower but I'm not sure I have time  FML. Cook out thing today at Buddha's. I get to see Jeremy &lt;3

0,2253178844,Sat Jun 20 07:43:30 PDT 2009,NO_QUERY,guardiemaddie,Ike band finally does an alumni band on homecoming and I can't go because I have albion homecoming that weekend 

0,2253178979,Sat Jun 20 07:43:31 PDT 2009,NO_QUERY,johnnygf,r @codinghorror if I hadn't seen the iphone3G v 3GS smackdown I wouldn't have known the difference   I'll just have to wait for the 4G...

0,2253178994,Sat Jun 20 07:43:31 PDT 2009,NO_QUERY,JoeisRad,Cloudy day 

0,2253179102,Sat Jun 20 07:43:31 PDT 2009,NO_QUERY,bedazzledaz,"Won sod all at Ascot  BT managed to 'change' my phone number and no broadband for 2 days, good times!"

0,2253179271,Sat Jun 20 07:43:32 PDT 2009,NO_QUERY,imagirraffe,Throwing up all night and not sleeping at all means i will be so cranky for jakes wedding today 

0,2253179301,Sat Jun 20 07:43:33 PDT 2009,NO_QUERY,adnmcnmom,Going to wake the baby...who is actually not really a baby anymore 

0,2253179460,Sat Jun 20 07:43:34 PDT 2009,NO_QUERY,lindssraee,Dunno what to do today 

0,2253179683,Sat Jun 20 07:43:35 PDT 2009,NO_QUERY,hollybee6,"@MyCatCrash lol i work up at 745 freaking out, thought i had to be at the bank today.  realized i didnt, felt stupid got back in bed. lol"

0,2253180046,Sat Jun 20 07:43:37 PDT 2009,NO_QUERY,SieraNaomi,Funeral today.  and I'm so tired.. :/

0,2253180108,Sat Jun 20 07:43:38 PDT 2009,NO_QUERY,dorksR4ev3R1997,K so i have no where to go. So i have to sit thro this 8 hr long meeting... 

0,2253180165,Sat Jun 20 07:43:38 PDT 2009,NO_QUERY,BrookeLaurenB,no one said the third day would be ther worst! i thought i would be all better by now 

0,2253180203,Sat Jun 20 07:43:38 PDT 2009,NO_QUERY,JonHotchkiss,took nearly 5 hours get home from race.... gona miss church meeting now and still got 2 hours on the bike to do!!! 

0,2253184705,Sat Jun 20 07:44:08 PDT 2009,NO_QUERY,Hugasaurus,(@PumaJackson) Owners leaving outta state tomorrow.  Without me. I am going to miss them!!! I need a hug!

0,2253184819,Sat Jun 20 07:44:09 PDT 2009,NO_QUERY,lightanddark,@StuffByEd That reminds me that I need to search for a Graduate School 

0,2253184827,Sat Jun 20 07:44:09 PDT 2009,NO_QUERY,3rblogging,"so, here comes the rain again. yay. "

0,2253185032,Sat Jun 20 07:44:10 PDT 2009,NO_QUERY,shelbyrae27,on my way home getting ready for an extremely long day. keep your fingers cross the phone doesn't die on me. 

0,2253185033,Sat Jun 20 07:44:11 PDT 2009,NO_QUERY,Cashalee,@IAmSnakeyMan no i dnt have one either 

0,2253185077,Sat Jun 20 07:44:11 PDT 2009,NO_QUERY,AnnMHarvey,@htownsnkrsummit its going down tonite ! I need someone to roll with me 

0,2253185105,Sat Jun 20 07:44:11 PDT 2009,NO_QUERY,ArchaneBlog,can barely walk after football training today ... I need to get so much fitter and learn how to play on grass again 

0,2253185270,Sat Jun 20 07:44:12 PDT 2009,NO_QUERY,onecharming1,"@Stylish_Living Thanks for the FF. Beautiful today &amp; I'm not feeling well. Go fiqure   The offer of help still stands, just let me know."

0,2253185362,Sat Jun 20 07:44:12 PDT 2009,NO_QUERY,Soupdragonkl,"@Jimmy_Poodle You're not snedwan in 'realife' are you?  If so, my love for you has died "

0,2253185378,Sat Jun 20 07:44:13 PDT 2009,NO_QUERY,bigpolla,"Sunny day in ireland again ...lovely . I'm working tonight @ 6,  ."

0,2253185400,Sat Jun 20 07:44:13 PDT 2009,NO_QUERY,qwerty2k,"@White69Devil txt dave earlier and he said we currently have 5 lol, footy is at 7.30pm i think and top gear at 8pm "

0,2253185605,Sat Jun 20 07:44:14 PDT 2009,NO_QUERY,emaciee,"@looseitall - ahh i know what you mean about being forced to eat, i've got family dinners every night  sounds like you're doing good tho!"

0,2253185959,Sat Jun 20 07:44:16 PDT 2009,NO_QUERY,AndreaRS,@MariSRU Yuuumi! I had the worst breakfast ever! 

0,2253186115,Sat Jun 20 07:44:17 PDT 2009,NO_QUERY,MaggieSawicki,Good morning loves! Gotta take Timmy to the vet to get fluids  poor kitty!

0,2253186290,Sat Jun 20 07:44:18 PDT 2009,NO_QUERY,dmacias,ran 10 miles this morning and got lost again... might have lost my 4 year old iPod in the rain too. 

0,2253186391,Sat Jun 20 07:44:19 PDT 2009,NO_QUERY,robyngodfrey,"OMG I is getting a headache  I KNOW! cereal, aspirin, and water...will it work? dondondonnnnnnnn usuefhosfor I wanna' be with HIM! &gt;:&quot;("

0,2253186440,Sat Jun 20 07:44:19 PDT 2009,NO_QUERY,iheartnynuk,@Flipalicious But u didn't know it was me tho! I was CRAZY that day! But the twins looked so sad.  What chat room did u guys meet in?

0,2253186753,Sat Jun 20 07:44:21 PDT 2009,NO_QUERY,morecowbellllll,last dance recital tonight  DISNEY TOMORROW.

0,2253186850,Sat Jun 20 07:44:22 PDT 2009,NO_QUERY,stringfellow65,WAITING FOR THIS DANG RAIN TO STOP SO I CAN ENJOY MY BABY 

0,2253187188,Sat Jun 20 07:44:24 PDT 2009,NO_QUERY,clag_on_toast,Mission walk to the bottle shop and it's closed 

0,2253187207,Sat Jun 20 07:44:24 PDT 2009,NO_QUERY,stephenwerner,@mdd1985 hey mr - sorry couldnt make last night  what are your plan be for tonaaaight? i'm working 'til 12... but thereafter i'm yours

0,2253187419,Sat Jun 20 07:44:25 PDT 2009,NO_QUERY,Nezza27,"@mirtilla83 Dude, I hate thunderstorms!! Especially when they wake me up "

0,2253187928,Sat Jun 20 07:44:28 PDT 2009,NO_QUERY,Karobabii,"@St3phLuva not everyone, I didn't go  !!! N today we r all going to Candidas bc welo n wela r here n ur the only one missin "

0,2253187972,Sat Jun 20 07:44:28 PDT 2009,NO_QUERY,lesbi_honest1,okay so i'm new to this whole twitter thing.....and i'm usually great at playing with twits AND twitters but i dnt knw how to mke friends 

0,2253188241,Sat Jun 20 07:44:30 PDT 2009,NO_QUERY,Jennifer_x_,Omg peach snapps...man i fell ill  not good!

0,2253188498,Sat Jun 20 07:44:32 PDT 2009,NO_QUERY,krissynh,"Omg, the special olympics is today at harvard! I wish i was volunteering "

