0,2206779492,Wed Jun 17 07:02:36 PDT 2009,NO_QUERY,Teifion,@codekoala Omnigraffle crashes if I try to do that 

0,2206779665,Wed Jun 17 07:02:36 PDT 2009,NO_QUERY,Celz29,@YahooAnswersAU i have a question that i'd like an answer to!! why is criminal minds a repeat next week?? no excuses channel 7!! 

0,2206779853,Wed Jun 17 07:02:37 PDT 2009,NO_QUERY,yvette368,Is go the school yard getting wet. I don't know how to reply to people from my phone 

0,2206780339,Wed Jun 17 07:02:40 PDT 2009,NO_QUERY,Sadaf_Rocks,Someone shoot me!!!!!!!!!!! lol..this work is endless   

0,2206780450,Wed Jun 17 07:02:40 PDT 2009,NO_QUERY,RyanLansley,@keisha_buchanan I'm so upset and annoyed! Can't go to the Thetford gig anymore! So annoyed. Was so looking forward to it! 

0,2206780784,Wed Jun 17 07:02:42 PDT 2009,NO_QUERY,jlee912,wow 2 tests already  

0,2206781137,Wed Jun 17 07:02:43 PDT 2009,NO_QUERY,thetidalrabbit,@mtmodular Train's &quot;Drops of Jupiter&quot; is playing on our work radio and I want to shoot my face off 

0,2206781252,Wed Jun 17 07:02:44 PDT 2009,NO_QUERY,dennychapin,Meeting maker of baby namer iPhone app then quick chat about my own projects. Bye bye philosophy 

0,2206785708,Wed Jun 17 07:03:07 PDT 2009,NO_QUERY,anandjangid,OMG!!! when will the work get over 

0,2206785986,Wed Jun 17 07:03:08 PDT 2009,NO_QUERY,jaiddd,"I'm awake at midnight, ergh. I feel like crap!   -wanting to watch HBP now! &lt;3"

0,2206786158,Wed Jun 17 07:03:09 PDT 2009,NO_QUERY,JuliaBinias,i have jammed my finger in the door.  ouch!!

0,2206786265,Wed Jun 17 07:03:10 PDT 2009,NO_QUERY,flibbidyfloo,"Aww, no iPhone for me  wah wah wah. Ok #squarespace step it up. I expect to be winner number 10 !! Oh, gratz to jasonmarkjones!"

0,2206786703,Wed Jun 17 07:03:12 PDT 2009,NO_QUERY,denicesy,"is depressed. Don't ask why, I do not know. "

0,2206786782,Wed Jun 17 07:03:12 PDT 2009,NO_QUERY,laurabligh,REALLY want to get into Big Brother this year - but finding it hard 

0,2206787227,Wed Jun 17 07:03:14 PDT 2009,NO_QUERY,Tawmu,iPhone 3.0 won't be any good unitil its jailbroken anyway 

0,2206787288,Wed Jun 17 07:03:15 PDT 2009,NO_QUERY,prettiPORSH,this office is freezing..and i have no sweatshirt nothin... 

0,2206787438,Wed Jun 17 07:03:15 PDT 2009,NO_QUERY,kidmanproject,"@opposable_thumb Over here it's looking like 3.0 won't be released until about 6pm-ish, so it'll probably be evening for you too "

0,2206788296,Wed Jun 17 07:03:19 PDT 2009,NO_QUERY,Saknika,Awake and crampy. 

0,2206788505,Wed Jun 17 07:03:20 PDT 2009,NO_QUERY,__jordan,"mac room, about to give some presentation to half the class and two tutors and a camera  gutted benny got kicked off the course too"

0,2206789119,Wed Jun 17 07:03:24 PDT 2009,NO_QUERY,b1ng0bang0,@MelissaSuzanne Ooh which movie? Or are we not alowed to know 

0,2206789182,Wed Jun 17 07:03:24 PDT 2009,NO_QUERY,LFCTV,"@johnmcmahonirl @simonsays321 The fixtures copyright is held by Premier League, so I think any calendar would have to come from them  Matt"

0,2206789310,Wed Jun 17 07:03:24 PDT 2009,NO_QUERY,rameshnid,down with fever 

0,2206790287,Wed Jun 17 07:03:30 PDT 2009,NO_QUERY,_taylortrash_,@IanHilldoi  awwww I am sorry... It's the worst feeling hating to go to work

0,2206790617,Wed Jun 17 07:03:31 PDT 2009,NO_QUERY,Karissadanae,gets jealous easily 

0,2206790757,Wed Jun 17 07:03:32 PDT 2009,NO_QUERY,ElmerM,The markets are very brutal this week. I see nothing but red blood in my portfolio. 

0,2206790773,Wed Jun 17 07:03:32 PDT 2009,NO_QUERY,zoom703,@Shesouldeep lol i know what we gonna do  whats for lunch

0,2206790797,Wed Jun 17 07:03:32 PDT 2009,NO_QUERY,SuperJennBlogs,@Complex_Mom Oh yuck!  I did that in KC for 3 years....ts worse in the city don't you think?  All the other cars and the asphalt... sorry 

0,2206791133,Wed Jun 17 07:03:34 PDT 2009,NO_QUERY,kathryneliz,"@NSalassi I'm glad you're feeling better! Sorry about the extra duty, though. "

0,2206791176,Wed Jun 17 07:03:34 PDT 2009,NO_QUERY,funsep,"End of school year is filled with excitement and sheer exhaustion. Taking 4 vac days to celebrate, but KK is sick. "

0,2206791361,Wed Jun 17 07:03:35 PDT 2009,NO_QUERY,andrewmilton,@pbwotw don't mind offices. It's just that they expect you to work in them 

0,2206791750,Wed Jun 17 07:03:37 PDT 2009,NO_QUERY,missangel5,Just not feelin it today! 

0,2206792008,Wed Jun 17 07:03:39 PDT 2009,NO_QUERY,islandchic,@heuristicideas Not happy tho  Dunno why they had to do 'that' argh!

0,2206792294,Wed Jun 17 07:03:40 PDT 2009,NO_QUERY,ErynHart,Sick  . . . Feeling like this may be the longest car ride ever!

0,2206792433,Wed Jun 17 07:03:41 PDT 2009,NO_QUERY,bigseaton,@magnolia57 Morning to you...I feel left out 

0,2206792525,Wed Jun 17 07:03:41 PDT 2009,NO_QUERY,MsRae04,"at work, SUPER exhausted  its goin 2 be a LOOOONG day for me!"

0,2206793059,Wed Jun 17 07:03:44 PDT 2009,NO_QUERY,Finnimbrun,Got a head ache  and bored

0,2206793130,Wed Jun 17 07:03:44 PDT 2009,NO_QUERY,matchbradford,Time to go to work.  No 3.0 yet.  

0,2206793375,Wed Jun 17 07:03:45 PDT 2009,NO_QUERY,ArcieriKeness,@d33zilla I cut my little bit w/ clippers because it itches sometimes 

0,2206793431,Wed Jun 17 07:03:46 PDT 2009,NO_QUERY,Xxmuffin1215xX,i hate school!!! i still have 3 days after today... 

0,2206793858,Wed Jun 17 07:03:48 PDT 2009,NO_QUERY,missleah0108,@Pink_LoveChild haha...u &amp; i lead such similar lives freezin at work 2 cuz they blastin the ac! hope u did sum booty blastin..i didnt  lol

0,2206794002,Wed Jun 17 07:03:49 PDT 2009,NO_QUERY,Capitandequeso,Must wait a bit longer for 3.0 

0,2206794148,Wed Jun 17 07:03:49 PDT 2009,NO_QUERY,minus_four,"yeah, i really needed to get my period and be cramping like fuck and then get caught in a rainstorm. look and feel horrible "

0,2206794290,Wed Jun 17 07:03:50 PDT 2009,NO_QUERY,Pnataly,"My baby sleep already,hubby out to town, and me?? Nothin to do ( wht should I do now? Hikss  sleep? Owchh its to early "

0,2206794509,Wed Jun 17 07:03:51 PDT 2009,NO_QUERY,lianybean,And the person for the interview is late. As if it wasnt bad enough that it is am interview 

0,2206794690,Wed Jun 17 07:03:52 PDT 2009,NO_QUERY,clarkeana,@xoxoalexamae  I knoooo

0,2206794960,Wed Jun 17 07:03:53 PDT 2009,NO_QUERY,TaraRoe3,i wish i was samantha off bewitched so i could wiggle my nose and my house would be clean...wiggle wiggle dang it didn't work 

0,2206795180,Wed Jun 17 07:03:55 PDT 2009,NO_QUERY,ciara73,@beckinelson same 

0,2206795259,Wed Jun 17 07:03:55 PDT 2009,NO_QUERY,madamluna,http://bit.ly/NrbpB pop'n music wii characters! OH GOD WHERE ARE THEIR LEGS. Hopefully this isn't all of them. I'm greedy and want Zizz 

0,2206795829,Wed Jun 17 07:03:58 PDT 2009,NO_QUERY,patrickmcgovern,So maybe 2 more hours till OS 3    http://www.engadget.com/2009/06/17/stop-hitting-f5-iphone-os-3-0-release-still-hours-away/

0,2206796364,Wed Jun 17 07:04:01 PDT 2009,NO_QUERY,jewelss,ugh.  I'm getting the bad part of laying out in the sun this past weekend today.  My face is peeling  gross.

0,2206796461,Wed Jun 17 07:04:01 PDT 2009,NO_QUERY,CoConutShelle,@LipsyLondon i rele want the lipsy bustier ruffle dress but there's no size 6 left  x

0,2206796688,Wed Jun 17 07:04:02 PDT 2009,NO_QUERY,EvaTEsq,@veganrunningmom You have a run planned today? Its such a nice day outside. I almost played hookie. I wish I could run instead of work!  

0,2206797240,Wed Jun 17 07:04:05 PDT 2009,NO_QUERY,sarisam,Oh noes... forgot to bring the Jesse McCartney album to work 

0,2206797255,Wed Jun 17 07:04:05 PDT 2009,NO_QUERY,sharpy23,"for such a happy day (exams being over) I feel pretty crappy, the exams have taken it out of me "

0,2206797719,Wed Jun 17 07:04:07 PDT 2009,NO_QUERY,emma42a,"Bought another 3 books at lunchtime today, Im so naughty "

0,2206797817,Wed Jun 17 07:04:08 PDT 2009,NO_QUERY,paperpixie,@MelsterB sorry you can't be there  you will be missed.

0,2206797821,Wed Jun 17 07:04:08 PDT 2009,NO_QUERY,jenaker,have been sick with a fever for about 6 days 

0,2206797877,Wed Jun 17 07:04:08 PDT 2009,NO_QUERY,sarah6800,i barley have anybody to hang out with now 

0,2206798031,Wed Jun 17 07:04:09 PDT 2009,NO_QUERY,sp3cialk,@ijustine Seriously?? that blows.. 3.0 was going to be the highlight of my day 

0,2206798063,Wed Jun 17 07:04:09 PDT 2009,NO_QUERY,Townissnatty,"When am I goin 2 drive ma dad 2 da airport  I shoulda shame. bout I cant drive, look from wen I learnin. dad sey I drive like im in a game"

0,2206799051,Wed Jun 17 07:04:14 PDT 2009,NO_QUERY,zz7goku,"Hmm, seems a mix up in names has delayed me starting for another 2 weeks  ... Sometimes I just hate my luck..."

0,2206800137,Wed Jun 17 07:04:19 PDT 2009,NO_QUERY,kerwinsentillas,"@tojipot Sorry, sorry. I'll be in Tagaytay this weekend, so I can't come. Sadness to the max. "

0,2206800696,Wed Jun 17 07:04:22 PDT 2009,NO_QUERY,FrogsOfWar,250 emblems rings empty when I realised I spent them all on stuff I no longer need 

0,2206800891,Wed Jun 17 07:04:23 PDT 2009,NO_QUERY,vivifs,@brianmccoll hey share some M&amp;M's here too!!! 

0,2206801139,Wed Jun 17 07:04:24 PDT 2009,NO_QUERY,ecirtap00,@marshaambrosius caught the alarm..but I forgot to turn my dang ringer off 

0,2206801553,Wed Jun 17 07:04:26 PDT 2009,NO_QUERY,hellaword,@lindynicole preach on sister. Insomnia Summer 2009 

0,2206802490,Wed Jun 17 07:04:31 PDT 2009,NO_QUERY,primerx24,@JessDeLo awe booo  &quot;This video is no longer available due to a copyright claim by Viacom. &quot;

0,2206802621,Wed Jun 17 07:04:31 PDT 2009,NO_QUERY,fwzynn,12.45 before you get paid! cpt ahh. aku nak dating makan kfc fiery crunch (kot nama dia) dgn fwz nanti 

0,2206802852,Wed Jun 17 07:04:33 PDT 2009,NO_QUERY,Leonardo_Garcia,Pq nao consigo acc  ninguem no meu twitter!!!?  

0,2206803247,Wed Jun 17 07:04:34 PDT 2009,NO_QUERY,ashleychante,And once again the rain has returned 

0,2206803610,Wed Jun 17 07:04:36 PDT 2009,NO_QUERY,theJheG,Trying out natsulion for iPhone. Have to update to buy twitterrific. 

0,2206803615,Wed Jun 17 07:04:36 PDT 2009,NO_QUERY,EvilEmpire,"@BiGdOGGPHiL Oh well, another day. "

0,2206803834,Wed Jun 17 07:04:37 PDT 2009,NO_QUERY,dmarshall6708,Really needs to get ready for work. But just wants to lay in bed and sleep. Sunday cant get here soon enough 

0,2206804132,Wed Jun 17 07:04:39 PDT 2009,NO_QUERY,yellowdogsandy,@cami_lou I can't ever catch one...  They're too smart. I need to go in to a hunting school for dogs somewhere.

0,2206804524,Wed Jun 17 07:04:41 PDT 2009,NO_QUERY,__nicola__,no iphone 3.0 update today   have to wait until tomorrow #FB

0,2206812889,Wed Jun 17 07:05:22 PDT 2009,NO_QUERY,b50,"@ksavai uh...well...I don't know how to connect with someone else via intranet. In any case, I'm terrified of all these high-funda things "

0,2206813091,Wed Jun 17 07:05:23 PDT 2009,NO_QUERY,Sweet_Shonie,... K ... that 4 hours of sleep I got is starting to kick in.   God please help me stay woke!

0,2206813110,Wed Jun 17 07:05:23 PDT 2009,NO_QUERY,AnnekeTaylor,Time to tidy room 

0,2206813199,Wed Jun 17 07:05:24 PDT 2009,NO_QUERY,roxiijonas,@xloveisonitsway i know yeah! No I'm not coz im going to 2 jonas and miley  too many shows at once!

0,2206813233,Wed Jun 17 07:05:24 PDT 2009,NO_QUERY,ecsalomon,I can't believe I didn't think to try to update my iPhone this morning before I left for work. 

0,2206813426,Wed Jun 17 07:05:25 PDT 2009,NO_QUERY,colinprime,"@deepee27 ......yea, went to Rhyl but got rained off "

0,2206813502,Wed Jun 17 07:05:25 PDT 2009,NO_QUERY,MiriamElliott,I just made some amazing choc chip muffins and they smell so good!!! But I can't eat them!! 

0,2206813740,Wed Jun 17 07:05:27 PDT 2009,NO_QUERY,mcrfash1,"@Clumsyxheart  ugh, cant they understand that we try! we do, we do everything but it's just never enough when we come short..im sorry"

0,2206814126,Wed Jun 17 07:05:28 PDT 2009,NO_QUERY,cararaej,so wish twitter worked on phones in France 

0,2206814683,Wed Jun 17 07:05:31 PDT 2009,NO_QUERY,albertdchung,"uggghhhh... allergies!  this is the worst i've had them in a while.  reactin is my friend, but not helping too much "

0,2206815031,Wed Jun 17 07:05:33 PDT 2009,NO_QUERY,lindatusti,"@Disney_Dreaming No, I haven't seen anyone of my favourite celebs in person  Only Backstreet Boys "

0,2206815498,Wed Jun 17 07:05:36 PDT 2009,NO_QUERY,Buddahyo,thinking about how this weeknd i rewli want to see brandon and jen 

0,2206815685,Wed Jun 17 07:05:37 PDT 2009,NO_QUERY,Tony_Tam,@Sweetzzzzz man 8gb is small u might get be able to fit like 2 HD movies    I'll give u $170! and a free golf lesson from me hahaha

0,2206816093,Wed Jun 17 07:05:39 PDT 2009,NO_QUERY,sja7122,back to work 

0,2206816314,Wed Jun 17 07:05:40 PDT 2009,NO_QUERY,robbjbrowning,"Only 3 hours until the iPhone 3.0 software comes out! However I have a lesson in an hour and a half, wont get back until 4 hours from now "

0,2206816368,Wed Jun 17 07:05:40 PDT 2009,NO_QUERY,morg_an,"getting in the groove at work! unfortunately, i am in pain again/still. this is terrible...i dont want to take meds this early in the day "

0,2206816782,Wed Jun 17 07:05:43 PDT 2009,NO_QUERY,alicia052987,"why does every band i &lt;3 evolve into bands that i dont &lt;3  bullet for my valentine, underoath, avenged 7x, in flames, and now alexisonfire"

0,2206816979,Wed Jun 17 07:05:44 PDT 2009,NO_QUERY,ceejaaylove,sleepy. i so don't want to get up. 

0,2206817260,Wed Jun 17 07:05:45 PDT 2009,NO_QUERY,HoneyH1,Playing guitar and chatting on MSN. My fingertips are very sore from doing both of these...  But it's fun XD

0,2206817679,Wed Jun 17 07:05:47 PDT 2009,NO_QUERY,alexanelson503,Would any of my SF friends like to join me for the Coldplay concert next month?? My original date doesn't think she can go 

0,2206818035,Wed Jun 17 07:05:49 PDT 2009,NO_QUERY,Nan0uche,@AshleyLTMSYF You'll never tweet back 

0,2206818416,Wed Jun 17 07:05:51 PDT 2009,NO_QUERY,ecirez,Somebody give me a scientific calculator! Mine's not working. 

0,2206818821,Wed Jun 17 07:05:53 PDT 2009,NO_QUERY,dustymusty,very very lazy to studyyyyyyyyyyyyyy and i am craving for little cupcakes! 

0,2206819046,Wed Jun 17 07:05:55 PDT 2009,NO_QUERY,stusshed,Tried TweetDeck for iPhone but can't see &gt; 5 prev posts on All Friends. Rather a decent history than heaps of columns. Crashes on launch 

0,2206819252,Wed Jun 17 07:05:55 PDT 2009,NO_QUERY,appleroncal,i am now officially sick and super scared hoping this is NOT swine flu.  goodnight!

0,2206819421,Wed Jun 17 07:05:56 PDT 2009,NO_QUERY,ohanablue,But I must get ready... Work in bout an hr.... 

0,2206819614,Wed Jun 17 07:05:57 PDT 2009,NO_QUERY,therebecca,"My life is just plain boring right now. Ha, ha. Just kiddin'! Need make my homeworks "

0,2206819844,Wed Jun 17 07:05:58 PDT 2009,NO_QUERY,GLOCHY,@Ricardo5518 lol oh boy. ricardo please 4 david in the TCA FOD just reported that david is doing really bad in the polls there 

0,2206820499,Wed Jun 17 07:06:01 PDT 2009,NO_QUERY,viivien,have to do a lot for school 

0,2206821411,Wed Jun 17 07:06:05 PDT 2009,NO_QUERY,ameebamee,"It's BACON! Well, Morningstar Farms bacon.  Doesn't get burned when overcooked like real bacon.  Nummy, but not real. No burnedness "

0,2206821566,Wed Jun 17 07:06:06 PDT 2009,NO_QUERY,jeannebopp,iPhone 3.0 update release moved to the 18th &gt; apple! (via @ijustine) Ballz. 

0,2206821617,Wed Jun 17 07:06:06 PDT 2009,NO_QUERY,thatdariachick,Figures. The 1 time I go to Subway theres a big order in front of me 

0,2206821806,Wed Jun 17 07:06:07 PDT 2009,NO_QUERY,peachonice,@roxtarrr omg I'm dying here  I hope we both feel better soon bb

0,2206821812,Wed Jun 17 07:06:07 PDT 2009,NO_QUERY,CarissaOhMighty,Just came back from the ever-so-fascinating Communic Asia. Tired. 

0,2206821849,Wed Jun 17 07:06:07 PDT 2009,NO_QUERY,DJNike,argh! need insperation for advanced search on a category home page such as Audio Visual products =&gt; Brand/Tech/Attribute = limited space 

0,2206822738,Wed Jun 17 07:06:12 PDT 2009,NO_QUERY,safwanahamd,and you will be gone until sunday. 

0,2206823200,Wed Jun 17 07:06:14 PDT 2009,NO_QUERY,donburtoni,Last school run.  New job next week. :-D

0,2206823215,Wed Jun 17 07:06:14 PDT 2009,NO_QUERY,T_RozM2,"see, soon and now aren't the same thing   http://twitpic.com/7mc7n"

0,2206823375,Wed Jun 17 07:06:15 PDT 2009,NO_QUERY,juniperus,"@wingal Pats! w00t! I'd LOVE to come help, but I'm in a freakout -going to SF next month and the stuff I have to get done is staggering. "

0,2206823598,Wed Jun 17 07:06:16 PDT 2009,NO_QUERY,missez81,Tryna convince my best friend aka my bro bro 2 get on twitter! 'Tis not having it tho 

0,2206823827,Wed Jun 17 07:06:18 PDT 2009,NO_QUERY,hkinuthia,no bike today  Have to wait a little longer...

0,2206823941,Wed Jun 17 07:06:18 PDT 2009,NO_QUERY,Yuifan16,I miss Digimon. I haven't watched it in a little over a year. I wish they'd make a new season. 

0,2206824097,Wed Jun 17 07:06:19 PDT 2009,NO_QUERY,shanwink,Another rainy gloomy day 

0,2206824148,Wed Jun 17 07:06:19 PDT 2009,NO_QUERY,nfurek,Haunted by old sports injury. Ouchy-can hardly move! Any stretch/fitness tips for bulging disk in lumbar? Pwr yoga no good - made worse. 

0,2206824261,Wed Jun 17 07:06:20 PDT 2009,NO_QUERY,wonko101010,Just working in the rain. What fun! 

0,2206824410,Wed Jun 17 07:06:20 PDT 2009,NO_QUERY,JeJa6,"Big Red is dying  TTFN. Ps, weezy kills me 'but I be like daaaaaamn all I got is 1 dick' Pps, can bus drivers smile? Geez! K, over + out!"

0,2206825085,Wed Jun 17 07:06:24 PDT 2009,NO_QUERY,kikighio,My trip to sbux to avoid wierd people has backfired. Stale croissant yucky. Dreaming of boiled egg in lunch bag 

0,2206825333,Wed Jun 17 07:06:25 PDT 2009,NO_QUERY,Wyssel,Yoga is done on Thursday and there will be no more until September  Goodbye sweet rock hard ass.

0,2206825345,Wed Jun 17 07:06:25 PDT 2009,NO_QUERY,TheSonSon,so im guessing i work a full 8 today.............fun 

0,2206825414,Wed Jun 17 07:06:26 PDT 2009,NO_QUERY,heatherharkin,Apparently everything I've tried on 4 2night isnt gonna work 

0,2206825486,Wed Jun 17 07:06:26 PDT 2009,NO_QUERY,pokedigimaniac,FB: Also ow. Was I freaking punching the wall in my sleep or something? My middle/ring knuckles on my right hand are cut up. 

0,2206825963,Wed Jun 17 07:06:28 PDT 2009,NO_QUERY,JanaBanana5,@shustonphotos My son dropped my laptop ..the desk top is sooo slow for editing my pics  Laptop fixed for my b-day present I hope. I need

0,2206826040,Wed Jun 17 07:06:29 PDT 2009,NO_QUERY,avneetsethi,will miss her spanish class 

0,2206826208,Wed Jun 17 07:06:30 PDT 2009,NO_QUERY,eclass491,"Was just about to say that how much I like tweetdeck for iPhone, but it crashed on me  it's nice but a bit complicated!"

0,2206826304,Wed Jun 17 07:06:30 PDT 2009,NO_QUERY,olavogay49464,Super Easy Wind Power Generator For Home Use go http://bit.ly/Xnyntd :]Has a bad feeling about college 

0,2206826321,Wed Jun 17 07:06:30 PDT 2009,NO_QUERY,ninaziuzina,"ohw, i hate exams  -.-'"

0,2206826422,Wed Jun 17 07:06:31 PDT 2009,NO_QUERY,hannahcurrin,is sad...where did Evangeline Lilly go? She was one of the coolest celebrities on here...she would actually follow you and tweet back... 

0,2206826605,Wed Jun 17 07:06:32 PDT 2009,NO_QUERY,precisionglass,sick of this wind and rain 

0,2206827225,Wed Jun 17 07:06:35 PDT 2009,NO_QUERY,lhayes12,Sitting in class 

0,2206827397,Wed Jun 17 07:06:36 PDT 2009,NO_QUERY,tylerwinfield,@seanwalberg i've tried to tell women that i just want to practice making kids so that i'll be good at the real thing. they don't buy it 

0,2206827466,Wed Jun 17 07:06:36 PDT 2009,NO_QUERY,damoto,@beafunky no ramona with bb browser  ill meet her later... :p

0,2206827534,Wed Jun 17 07:06:36 PDT 2009,NO_QUERY,hahaharachel,my eyes feel super heavy and gross. i want a delicious breakfast. i don't think i'm getting one.. 

0,2206827580,Wed Jun 17 07:06:37 PDT 2009,NO_QUERY,wendywood,@STACIJANSMA  I bet it will be awesome. I'm still waiting for the day that DSL will be available where I live. 

0,2206827791,Wed Jun 17 07:06:38 PDT 2009,NO_QUERY,megsmitley,@gjtaylor I've had same problem. Councils and supposed aid orgs won't take them. We end up hoarding all our old components in basement 

0,2206828345,Wed Jun 17 07:06:40 PDT 2009,NO_QUERY,rubi_imogen,@sophiewhinray I KNOW. I KNOW. so so so very saddening. 

0,2206828350,Wed Jun 17 07:06:40 PDT 2009,NO_QUERY,reannatugiri,"@TonyLetts Good afternoon! I was so proud, I guessed an English dude, but then I was accused of cheating. "

0,2206828874,Wed Jun 17 07:06:43 PDT 2009,NO_QUERY,angelahuynh,@labellavie i love her!! but too poor for those tix 

0,2206828963,Wed Jun 17 07:06:43 PDT 2009,NO_QUERY,helloyellowbird,Just as my nose piercing starts healing nicely - I half rip it out in the night. OUCHIESSS 

0,2206829105,Wed Jun 17 07:06:44 PDT 2009,NO_QUERY,k33pit,@DaisyOfLove  daisy this fox im sorry and can i come back   and y is my name k33p no dont y it sa oliver bennett dont kown

0,2206829239,Wed Jun 17 07:06:45 PDT 2009,NO_QUERY,allyhellyer,@Lisa_Marie713 thanks i love you. sorry for being such a bum the past few days 

0,2206829333,Wed Jun 17 07:06:45 PDT 2009,NO_QUERY,msDUKES,@Wongstuhh whyyy?  care to talk about it? i really want to understand why you feel the way you doo because you nevah really elaborated.

0,2206829395,Wed Jun 17 07:06:46 PDT 2009,NO_QUERY,auntieshawn519,It's raining like a biatch. It's so depressing. 

0,2206829587,Wed Jun 17 07:06:46 PDT 2009,NO_QUERY,devman77,@uhmberr movie maker freezes my whole computer now 

0,2206839155,Wed Jun 17 07:07:34 PDT 2009,NO_QUERY,GJO87,Off to class 

0,2206839364,Wed Jun 17 07:07:35 PDT 2009,NO_QUERY,Mangoatdotnet,Apparently Alice cracked open her noggin.. Her first real injury and I'm missing it 

0,2206839415,Wed Jun 17 07:07:35 PDT 2009,NO_QUERY,GCs_RIOT_GURL,@Yashrocks they never come to australia 

0,2206839957,Wed Jun 17 07:07:38 PDT 2009,NO_QUERY,Gi_Coscelli,@_nataly What?! algu m falou en RNR Coaster? Qdo eu ouo Aerosmith d vontade de chorar de saudade....&quot;there's a hole in my soul&quot;... 

0,2206840013,Wed Jun 17 07:07:38 PDT 2009,NO_QUERY,Amyltimmins,"grim weather  work, maybe gym, sleeeeeeeeeeeeep"

0,2206840203,Wed Jun 17 07:07:39 PDT 2009,NO_QUERY,stephia04,Sitting at work..thinking I wish I would have sent Josh to camp Tan Da Ko.... 

0,2206840209,Wed Jun 17 07:07:40 PDT 2009,NO_QUERY,afarley08,is lazing all day tryin to take care oh her effed up back muscles 

0,2206840488,Wed Jun 17 07:07:41 PDT 2009,NO_QUERY,nancetron,"@Oedipus_Lex almost definitely. in other news though, bunny said she saw your bum and i got jealous "

0,2206840684,Wed Jun 17 07:07:42 PDT 2009,NO_QUERY,baranga,"@GVale Pois o meu s tem acdc, julliete and the licks, stooges, mid oil, eagles of d m, zutons desde nascena. Mas nem tchuns pro last.fm "

0,2206840994,Wed Jun 17 07:07:43 PDT 2009,NO_QUERY,lee_jr,@_meeks_ LOL! get yo' tail up! I wish i coulda slept till 9:30  How was taco Mac?

0,2206841069,Wed Jun 17 07:07:45 PDT 2009,NO_QUERY,Anays_,"I miss you , if you knew  "

0,2206841283,Wed Jun 17 07:07:45 PDT 2009,NO_QUERY,mahfrot,@billingsj but we can't do it til she gets back in the States after honeymoon 

0,2206841445,Wed Jun 17 07:07:46 PDT 2009,NO_QUERY,pretzelwife,Cramps from the devil  Do not want!

0,2206841600,Wed Jun 17 07:07:47 PDT 2009,NO_QUERY,voidspace,@mjs0 I reluctantly installed cygwin and it works fine. 

0,2206842131,Wed Jun 17 07:07:49 PDT 2009,NO_QUERY,DJFoxyJenna,@chemarsh because life isn't fair!! 

0,2206843173,Wed Jun 17 07:07:54 PDT 2009,NO_QUERY,dazza_18,tidying the room but im sick 

0,2206843186,Wed Jun 17 07:07:55 PDT 2009,NO_QUERY,macmuse,Really liking TweetDeck on iPhone. Just wish the desktop version wasn't AIR. 

0,2206843387,Wed Jun 17 07:07:56 PDT 2009,NO_QUERY,MichaelPrutsman,@triciagrace oh. oops.  

0,2206843451,Wed Jun 17 07:07:56 PDT 2009,NO_QUERY,Laderinmytights,Discovered that the scary banging noise upstairs was caused by my housemate leaving her window open. Still no one around. 

0,2206843633,Wed Jun 17 07:07:57 PDT 2009,NO_QUERY,eshapoo123,missing my mommy 

0,2206843653,Wed Jun 17 07:07:57 PDT 2009,NO_QUERY,lil_laura_loo,dont know where to start with all these packing/cleaning...i just want to go home now  x

0,2206843902,Wed Jun 17 07:07:58 PDT 2009,NO_QUERY,catarionna,ARGHHH. Having a major &quot;I really wish we were back in Seattle&quot; moment 

0,2206843925,Wed Jun 17 07:07:58 PDT 2009,NO_QUERY,MiZzCHaOtic,Sorry followers I've been scarce.. Just busy with work and personal stuff. Can't promise that I'll start soon tweeting more.  #Squarespace

0,2206844182,Wed Jun 17 07:08:00 PDT 2009,NO_QUERY,JohnathanMac,"I suppose $29 is not so bad to update to snow leopard, how much will it cost for MS Windows 7? More than I make In a year I suspect "

0,2206844332,Wed Jun 17 07:08:00 PDT 2009,NO_QUERY,caniszczyk,@dpinn it's a bad sad that their solution was maven + transitive deps... there's no enforcement at runtime 

0,2206845206,Wed Jun 17 07:08:04 PDT 2009,NO_QUERY,ricans_chula88,bored at the airport.....nooo ipod 

0,2206845557,Wed Jun 17 07:08:06 PDT 2009,NO_QUERY,Shamrock1278,@LKColtsFan4life All you have to do is say the word and I will have my buddies Corey and Steve come and fix it!  Sorry!  

