0,1971014250,Sat May 30 05:57:51 PDT 2009,NO_QUERY,Meginsky,I hear all the speed boats and a jet ski or two on the lake already... Another party weekend? I'm still bruised from the last one 

0,1971014816,Sat May 30 05:57:57 PDT 2009,NO_QUERY,LinhKTong,hungoverrrr. it's gonna be a long day at work 

0,1971015105,Sat May 30 05:58:01 PDT 2009,NO_QUERY,MileyRayFan94,"@ddlovato Is incredible,ur HUGE dreams have come true &amp; mine.(meeting u &amp; miley) havnt even begun!  maybe 1 day they'll come true like urs"

0,1971015702,Sat May 30 05:58:07 PDT 2009,NO_QUERY,JennyMaggie,by for now twitter i got to tidy up 

0,1971015944,Sat May 30 05:58:10 PDT 2009,NO_QUERY,RockSteddyBaby,"getting ready for work at Torrid... trying to figure out what to wear! Usually it comes to me in a dream the night before, but not 2day "

0,1971016761,Sat May 30 05:58:19 PDT 2009,NO_QUERY,TriciaRuiiiz,I spent half of my day watching my cousins play Halo. ) My life sucks. =((( I must IMPROOOVE! 

0,1971017036,Sat May 30 05:58:22 PDT 2009,NO_QUERY,DivasMistress,I tried home depot @dozi1 and they told me they dont 

0,1971017247,Sat May 30 05:58:24 PDT 2009,NO_QUERY,Kogenre,"@Isak Aww, that sucks  Were you close?"

0,1971017376,Sat May 30 05:58:26 PDT 2009,NO_QUERY,karenmc13,what a gorgous day pity im spending it scrubbing my oven n packing 4 the big move 

0,1971017385,Sat May 30 05:58:26 PDT 2009,NO_QUERY,OuGee,"I feel like crying out loud .. Forgive me, iPan and Olga dear  I'll come back tmorrow I'm sure"

0,1971017467,Sat May 30 05:58:27 PDT 2009,NO_QUERY,Supastardamo,Major crampage.. ughhhh ..9am=nite nite.. see y'all next week 

0,1971017563,Sat May 30 05:58:28 PDT 2009,NO_QUERY,stephleooo,Watching My Bloody Valentine! Too bad it can't be 3D at home  - http://tweet.sg

0,1971017698,Sat May 30 05:58:30 PDT 2009,NO_QUERY,logicattraction,@Sean_T_Wright sadly it refuses to play on my iPhone 

0,1971017722,Sat May 30 05:58:30 PDT 2009,NO_QUERY,MauB3000,Is about to work on installing laminate flooring.. 

0,1971017835,Sat May 30 05:58:31 PDT 2009,NO_QUERY,Jiggatron,"afternoon twitter! so glad i ddnt go to sugar rush last night - blood was shed,not good. lesbians are vicious these days "

0,1971017983,Sat May 30 05:58:33 PDT 2009,NO_QUERY,brastee,Yehey for no work!!! Can't believe long weekend is almost over 

0,1971018450,Sat May 30 05:58:38 PDT 2009,NO_QUERY,jrstanley,Poor me. @cpearson1990 is being very tormentative today 

0,1971018475,Sat May 30 05:58:38 PDT 2009,NO_QUERY,Kelz_A,Blahhhhh another day of retail 

0,1971019147,Sat May 30 05:58:46 PDT 2009,NO_QUERY,Hnyangelfire,"Missing my second hubby, wish he'd come see me soon.  Yes I got 2 hubbys lol"

0,1971019372,Sat May 30 05:58:49 PDT 2009,NO_QUERY,NoMeg,@grimmers I'm more worried about your bare feet. What about glass on the pavement? 

0,1971019390,Sat May 30 05:58:49 PDT 2009,NO_QUERY,ellierose94,Just watched marley and me and my eyes hurt from crying because its a true story   just reading josh thomas' twitters to make me laugh..

0,1971019657,Sat May 30 05:58:52 PDT 2009,NO_QUERY,FeeBooths,Can't shake my sadness..... 

0,1971020006,Sat May 30 05:58:56 PDT 2009,NO_QUERY,paulpuddifoot,@EstherSausages Does the van come your way? Never comes down our road 

0,1971020258,Sat May 30 05:58:59 PDT 2009,NO_QUERY,Laylibug,Last day at Disney  going to Epcot.

0,1971020447,Sat May 30 05:59:01 PDT 2009,NO_QUERY,Jimmy_D123,"needs to go to the runhead soon like, my asthma is going to kill me if i stay in "

0,1971020564,Sat May 30 05:59:02 PDT 2009,NO_QUERY,Angelfish42,is missing the welsh coast today 

0,1971020633,Sat May 30 05:59:03 PDT 2009,NO_QUERY,nmobrien,Oh my gosh.  I got to CPR class an hour and 15 minutes early today.  Thought it started at 8...  

0,1971020910,Sat May 30 05:59:06 PDT 2009,NO_QUERY,BeccaxVipx,@sugarghc no  no plans -.- my friends went out but i didnt go with them..i dont want to take any risks and get sick again..for now xD

0,1971021006,Sat May 30 05:59:07 PDT 2009,NO_QUERY,christinaleon,Got a bad electric shock today at work  Still another 4 hours to go before I can go home and get a cuddle.

0,1971021044,Sat May 30 05:59:08 PDT 2009,NO_QUERY,i4anEyeRtistry,leave the house.....THEY CANCEL!!!! I HATE THAT!!!! I SOOO NEEDED THAT MONEY! 

0,1971021052,Sat May 30 05:59:08 PDT 2009,NO_QUERY,ivgphotography,"The chasing season is very non-existent this season  Anybody going to Pierre, SD 2day 4 possible superecells? 2far 2day. 14hrs away"

0,1971021835,Sat May 30 05:59:16 PDT 2009,NO_QUERY,hao_country,my god! my mobile phone web browser connection here in Antipolo City is so slow! i can't tweet as much as i can.  *poor @hao_country*

0,1971021932,Sat May 30 05:59:17 PDT 2009,NO_QUERY,CrazyMadThing,Ballacks not playing 

0,1971022326,Sat May 30 05:59:22 PDT 2009,NO_QUERY,aliron1982,"talking to Rita and Gen on yahoo messenger, and getting mad at my dial up, omg dial up, help  lol"

0,1971022346,Sat May 30 05:59:22 PDT 2009,NO_QUERY,TyIerDurden,take two!!!: @danadearmond Ive decide @madisonmitchell is keeping us from our forever soulmatitude based on ripples of tweetostrophy ... 

0,1971022564,Sat May 30 05:59:24 PDT 2009,NO_QUERY,ceejayaycee,Just buried a loved one this morning. 

0,1971022829,Sat May 30 05:59:28 PDT 2009,NO_QUERY,hash_iphone,@logicattraction @Sean_T_Wright sadly it refuses to play on my iPhone 

0,1971023169,Sat May 30 05:59:31 PDT 2009,NO_QUERY,amz2188,homework then out for the day but still burnt from the beach yesterday! ouch 

0,1971023326,Sat May 30 05:59:33 PDT 2009,NO_QUERY,hash_yahoo,"@aliron1982 talking to Rita and Gen on yahoo messenger, and getting mad at my dial up, omg dial up, help  lol"

0,1971023384,Sat May 30 05:59:33 PDT 2009,NO_QUERY,hashitsucks,@pauliiiiine #itsucks because the delicious are the ones that make you fat. 

0,1971023989,Sat May 30 05:59:41 PDT 2009,NO_QUERY,corinnegalvin,work on a SATURDAY? 

0,1971024783,Sat May 30 05:59:50 PDT 2009,NO_QUERY,soporificfrog,@t_isfortammy Going out in Northbridge makes me jealous of you. I'm stuck in packing for an apartment move and finishing some work  FAIL!

0,1971025337,Sat May 30 05:59:56 PDT 2009,NO_QUERY,SongoftheOss,"@Jayne0807 oh no they still there, how long does it have to take! I wish you an empty road though - too hot for long drive "

0,1971025609,Sat May 30 05:59:59 PDT 2009,NO_QUERY,_FunkyFreshhh,"@ChristineMoo94 omg! thats a bummer!  and i'm sure they are nice! also, me you and hollie don't dance anyway cos we arn't in it. ;)"

0,1971026159,Sat May 30 06:00:03 PDT 2009,NO_QUERY,JodieWainwright,absolutely soo guttered u have 2 b 18 to b in live audience of @alancarr s new show!! i figured 18 was the age but stil guttered!  3YEARS!

0,1971026368,Sat May 30 06:00:04 PDT 2009,NO_QUERY,iHaps,"@tc2866 shops in this town r just crap, don't normally have this prob in London "

0,1971027554,Sat May 30 06:00:13 PDT 2009,NO_QUERY,nananadelonge,"so hurt and want to cry :'( just seeing pictues of them, breaks my heart, all over again....... "

0,1971027808,Sat May 30 06:00:14 PDT 2009,NO_QUERY,csurvivor7,GOOD MORNING! hehe. I am going to my last gymnastics practice  Oh well at least I will still see them when I do tumbling.

0,1971027841,Sat May 30 06:00:15 PDT 2009,NO_QUERY,R_D13,@leilaluciano wanna be with uuuuu!  miss u

0,1971028344,Sat May 30 06:00:19 PDT 2009,NO_QUERY,annamams,wine country hot air balloon ride cancelled again (4th time!) due to foggy weather 

0,1971028613,Sat May 30 06:00:22 PDT 2009,NO_QUERY,alps05,is a hopeless romantic.  http://plurk.com/p/x78vj

0,1971029539,Sat May 30 06:00:29 PDT 2009,NO_QUERY,Sweetness317,Because i lost my favourite piece out in colorado springs. 

0,1971029811,Sat May 30 06:00:32 PDT 2009,NO_QUERY,idapinky,so worried about my sis I might get sick myself 

0,1971030300,Sat May 30 06:00:36 PDT 2009,NO_QUERY,cheeeebeeeezy,cant get php pages working on my laptop 

0,1971030311,Sat May 30 06:00:36 PDT 2009,NO_QUERY,Jboy201,"I hacked my linksys router and now i can only SSH into it, the web gui was disabled and i can't get it back... so sad...  "

0,1971030459,Sat May 30 06:00:38 PDT 2009,NO_QUERY,ukmarketer,@DotSauce I'm trying to get a tribute site built - tributes are growing in popularity world-wide. Just sacked the developers though 

0,1971030818,Sat May 30 06:00:41 PDT 2009,NO_QUERY,anitaa02,"atl nd some ppl are in malay. why dnt they give away an octodrive ? ok, still far frm here "

0,1971030953,Sat May 30 06:00:42 PDT 2009,NO_QUERY,therealolliie,Why is it every time I eat something my teeth hurt..!! Soooo painful I have to bite on something..!!! Owiie 

0,1971031099,Sat May 30 06:00:43 PDT 2009,NO_QUERY,Victoriabd,"Feel like playing guitar, if i only had one "

0,1971031134,Sat May 30 06:00:44 PDT 2009,NO_QUERY,jasonfry,The forbidden planet store is always a disappointment since ebay 

0,1971031326,Sat May 30 06:00:46 PDT 2009,NO_QUERY,babykashyap,"Stuck in frickin stand still traffic on the motorway, just wana get to the airporrrrrrt godammit!!!!!!!!!! "

0,1971031457,Sat May 30 06:00:47 PDT 2009,NO_QUERY,SamsungTweets,Free Blu-Ray player with Samsung HDTV purchases at onecall.com. Hey OneCall...why not a Samsung BluRay Player?   http://tinyurl.com/npdu8h

0,1971031626,Sat May 30 06:00:49 PDT 2009,NO_QUERY,henouk,my heythrop library card expires tomorrow 

0,1971031805,Sat May 30 06:00:51 PDT 2009,NO_QUERY,inimeg,@CrazyBallerina can't. my sal wont be in until next week 

0,1971031999,Sat May 30 06:00:52 PDT 2009,NO_QUERY,elainerogers,@primaryposition yeah load of crap. Never finished it 

0,1971032046,Sat May 30 06:00:53 PDT 2009,NO_QUERY,aalrashid,Back to Q8 

0,1971032287,Sat May 30 06:00:55 PDT 2009,NO_QUERY,mcraddictal,@Boy_Kill_Boy  Not blaming you. Just sayin. I didn't know. Sorry.

0,1971032329,Sat May 30 06:00:56 PDT 2009,NO_QUERY,meredi,"Need a good hair stylist, preferably in the East End - my stylist had a fam. emergency this morning and I'm about to leave for chicago. "

0,1971032593,Sat May 30 06:00:59 PDT 2009,NO_QUERY,ramsin_taffles,It's got to that time of day when I can no long see my computer screen do to the sun. Time to close the curtains 

0,1971032929,Sat May 30 06:01:02 PDT 2009,NO_QUERY,katyaxoxo,will miss babe and lex 

0,1971033162,Sat May 30 06:01:04 PDT 2009,NO_QUERY,TheBubbleGum,@ChocMarshmallow gotta go and help with the food.. -.- miss you @wafflesWithJam and @chocmarsmallow 

0,1971033417,Sat May 30 06:01:10 PDT 2009,NO_QUERY,WhiteMonster1,I've got to trim the Sago Palms today and there are hornets or wasps in the fronds ...      Yowie !!

0,1971033434,Sat May 30 06:01:10 PDT 2009,NO_QUERY,vspinklover24,noooo we ran of a vanilla soy milk .... what will i do  

0,1971033761,Sat May 30 06:01:13 PDT 2009,NO_QUERY,AshleaEvans,Why is the weather always amazing when u have yucky errands to run? I want to go play 

0,1971034096,Sat May 30 06:01:16 PDT 2009,NO_QUERY,lareveuse,Ronica is a sippy-cup-assembling failure.  Thank goodness the couch is leather-type stuff.

0,1971034305,Sat May 30 06:01:18 PDT 2009,NO_QUERY,jessicarabbityu,"i got to work 2day.  awwwww, it bright sunny and warm outside. i could be at da beach, da lake, anywhere outside but noo..gots 2 work. "

0,1971034503,Sat May 30 06:01:20 PDT 2009,NO_QUERY,TehStalker, but still sad.........i wanna go to cruces too see her!

0,1971034786,Sat May 30 06:01:23 PDT 2009,NO_QUERY,ashutosh27,working on a weekend 

0,1971035474,Sat May 30 06:01:30 PDT 2009,NO_QUERY,Ivan85Pk,"why nobody want's to twit with me? C'm on,I'm sooo bored,it's 4 degrees outside and I must stay in "

0,1971035933,Sat May 30 06:01:35 PDT 2009,NO_QUERY,Reena_P,"Boy enjoying today, weather is great and I'm inside studing' just slipt on a mag on my floor and spilt my drink down myself. Not happy  ;o"

0,1971036413,Sat May 30 06:01:40 PDT 2009,NO_QUERY,vspinklover24,noooooo we ran out of vanilla soy soy milk... what will i do 

0,1971036458,Sat May 30 06:01:41 PDT 2009,NO_QUERY,anitamaritz,Hope and pray the 50+ Pilot Whales beached on Kommetjie Long Beach will be saved. 3 have already died. 

0,1971036730,Sat May 30 06:01:43 PDT 2009,NO_QUERY,ivgphotography,"The chasing season is non-existent so far  Anybody going to Pierre, SD 2day 4 possible superecells? 2far 2day. 14hrs away."

0,1971036798,Sat May 30 06:01:44 PDT 2009,NO_QUERY,xonicoleashley,swollen cheeks 

0,1971036946,Sat May 30 06:01:45 PDT 2009,NO_QUERY,yaneri,"Limping to work, my knee hurts "

0,1971036988,Sat May 30 06:01:45 PDT 2009,NO_QUERY,sapperfox,UNCLASSIFIED Someone scratched my TV  grumble grumble...

0,1971037217,Sat May 30 06:01:48 PDT 2009,NO_QUERY,louise__,and there goes one of my favourite bands  aussie music just died a little

0,1971037349,Sat May 30 06:01:50 PDT 2009,NO_QUERY,urdainess,I want to play the #Sims3  I already made space for it. damn.

0,1971037453,Sat May 30 06:01:50 PDT 2009,NO_QUERY,n8lewis,http://twitpic.com/694m8 - Count down. 

0,1971038110,Sat May 30 06:01:57 PDT 2009,NO_QUERY,withlovesevelyn,i miss annual camp 07 too much and i shouldn't. 

0,1971038244,Sat May 30 06:01:58 PDT 2009,NO_QUERY,misshelen20,@westender68 I have a huge sycamore tree in my garden. Saw a woodpecker there once.... But only once 

0,1971038389,Sat May 30 06:02:00 PDT 2009,NO_QUERY,evilflu,@davekeen69 there were only two houses... It was sad 

0,1971038624,Sat May 30 06:02:02 PDT 2009,NO_QUERY,gabbydario,@iHeartKayla I miss you more 

0,1971038635,Sat May 30 06:02:02 PDT 2009,NO_QUERY,Vonnieee,@Kendal_ Me too  It's so unfair.

0,1971038923,Sat May 30 06:02:05 PDT 2009,NO_QUERY,glamgurl_12,is tired! 

0,1971039244,Sat May 30 06:02:08 PDT 2009,NO_QUERY,CarissaWee,Easily hungered  Gosh my stomach's producing a tad too mcuh hydrochloric acid

0,1971039376,Sat May 30 06:02:09 PDT 2009,NO_QUERY,bunni3burn,Morning twitter. Trying this morning people thing of coffee again. Not sure its doing anything for me. 

0,1971039569,Sat May 30 06:02:11 PDT 2009,NO_QUERY,kukivitz,Bye bye beach  http://twitpic.com/694mz

0,1971039673,Sat May 30 06:02:12 PDT 2009,NO_QUERY,R33S,Just did some research on Chrome.. it's not available to me  I have a Apple! D'oh!

0,1971039760,Sat May 30 06:02:13 PDT 2009,NO_QUERY,Circuscat,"needs a haircut, my hair is all over the place "

0,1971040297,Sat May 30 06:02:18 PDT 2009,NO_QUERY,ArielCo,@zupergarl sa fiu al dracu daca stiam ca poza mea poate fi marita. fuck ce urat sunt! 

0,1971040486,Sat May 30 06:02:20 PDT 2009,NO_QUERY,ALoS,Such a nice day. And I'm trapped in the office... 

0,1971040582,Sat May 30 06:02:21 PDT 2009,NO_QUERY,forwardviolet,"dnw you toothache, dnw. "

0,1971041021,Sat May 30 06:02:25 PDT 2009,NO_QUERY,KittyMadCow,@resiliencyyy yes you want to read FB messages 

0,1971041417,Sat May 30 06:02:29 PDT 2009,NO_QUERY,philou90,"and now lautern leads again , for fucks sake, that cant be true "

0,1971041462,Sat May 30 06:02:30 PDT 2009,NO_QUERY,Haileyyyyyy,@R33S fine..  no goodnight to you EITHA

0,1971041576,Sat May 30 06:02:31 PDT 2009,NO_QUERY,ic_KADE,Even my dreams are depressing. 

0,1971042103,Sat May 30 06:02:37 PDT 2009,NO_QUERY,vIDo20,Spending the weekend at my grandmother... No internet! 

0,1971042196,Sat May 30 06:02:38 PDT 2009,NO_QUERY,electrickattt,@cooool. ive moved inside now coz its a bit warm  is tonight the bgt finale?

0,1971042198,Sat May 30 06:02:38 PDT 2009,NO_QUERY,bindymack,"I very strongly dislike learning journals as uni assessments, they are not fun to do AT ALL "

0,1971042300,Sat May 30 06:02:39 PDT 2009,NO_QUERY,MEGhostHunters,Is driving by Teagan's work.... Byeeeee!!! 

0,1971042615,Sat May 30 06:02:42 PDT 2009,NO_QUERY,Prof_Davros,Gah! Need a new phone but Vodafone's being annoying saying I have to be 18  I'm too tired to be getting stressed! Bah humbug.

0,1971042872,Sat May 30 06:02:45 PDT 2009,NO_QUERY,sarahmcollins,@PhatCrayonz I'm sorry. 

0,1971042914,Sat May 30 06:02:45 PDT 2009,NO_QUERY,Gemsi666,"My copy of demon's soul has just come, but I have to stop myself from playing it and get this assignment done for monday "

0,1971042932,Sat May 30 06:02:45 PDT 2009,NO_QUERY,bigtunasgirl,@luvdacil why are you going to bed at 5:3O in the morning?! Eh...i just woke up and now i can't in back to bed 

0,1971042941,Sat May 30 06:02:45 PDT 2009,NO_QUERY,dillan44,i want tickets for jay-z/coldplay 

0,1971043164,Sat May 30 06:02:48 PDT 2009,NO_QUERY,wickedbee,hates her PE class.  Why volleyball of all? :'-( http://plurk.com/p/x79ks

0,1971043563,Sat May 30 06:02:52 PDT 2009,NO_QUERY,stimpalicious,@yelyahwilliams  i'll make sure I call everyone I see Hayley so I don't make the same mistake

0,1971043619,Sat May 30 06:02:52 PDT 2009,NO_QUERY,lorihooood,@melissajane93 whats up baaaabe?  x

0,1971043846,Sat May 30 06:02:55 PDT 2009,NO_QUERY,samipantha,I'm going home 2moro  sad times!but at least can celebrate at the summer ball 2nite!bring on pendulum!

0,1971043855,Sat May 30 06:02:55 PDT 2009,NO_QUERY,sydo93,up wayyyyyyyyyyyy to early 

0,1971043925,Sat May 30 06:02:56 PDT 2009,NO_QUERY,R33S,Just did some research on Chrome.. it's not available to me  I have an Apple! D'oh!

0,1971044102,Sat May 30 06:02:57 PDT 2009,NO_QUERY,JWarrenJackson,@narsil1978 I don't like that idea at all. 

0,1971044458,Sat May 30 06:03:01 PDT 2009,NO_QUERY,geckosteve,"sun, laptop, music, garden, magazine = Bliss and and BBQ later mmm back to work monday tho "

0,1971044462,Sat May 30 06:03:01 PDT 2009,NO_QUERY,tmofee,@blue_cupcakes  *hugs*

0,1971044602,Sat May 30 06:03:02 PDT 2009,NO_QUERY,nmscuri,Can't run all the time &amp; I won't be watching much rugby in June  http://www.suite101.com/course.cfm/18511/lessons

0,1971044694,Sat May 30 06:03:03 PDT 2009,NO_QUERY,CommanderJake,@Spartan007 is on a night shift tonight so no company tonight 

0,1971044982,Sat May 30 06:03:06 PDT 2009,NO_QUERY,Colleen8284,"In the 9 yrs I've had a cell phone I never lost one, until Thursday night when I lost my iPhone "

0,1971045355,Sat May 30 06:03:10 PDT 2009,NO_QUERY,troist,@adav Oh noes!  The clouds 

0,1971045891,Sat May 30 06:03:16 PDT 2009,NO_QUERY,alydescends,"Ugh, the internet here at Mum's keeps stuffing up...pages periodically won't load or the CSS is stripped, etc. What a pain! "

0,1971046090,Sat May 30 06:03:18 PDT 2009,NO_QUERY,peastham,@smittyhalibut will be out there tomorrow as well!  I've only got about 4 hours to take it all in though 

0,1971046316,Sat May 30 06:03:21 PDT 2009,NO_QUERY,MissPeterPan,too hot! 

0,1971046784,Sat May 30 06:03:26 PDT 2009,NO_QUERY,libertad15,in class 

0,1971046895,Sat May 30 06:03:27 PDT 2009,NO_QUERY,persefone_cv,"@chi22ko Im bored, I wish I could be bored with u "

0,1971046900,Sat May 30 06:03:27 PDT 2009,NO_QUERY,ray23002,Mowing the lawn 

0,1971047192,Sat May 30 06:03:30 PDT 2009,NO_QUERY,omgshinythings,High School til 11-1130ish.  I'm REALLY gonna miss that building 

0,1971047435,Sat May 30 06:03:33 PDT 2009,NO_QUERY,timspear,"nice day out there, well it looks like it from my desk "

0,1971047453,Sat May 30 06:03:33 PDT 2009,NO_QUERY,PIrate12384,Finally a break in the clouds yesterday I used my telescope last night .. 3 days out of  2 months without some sort of rain. 

0,1971047537,Sat May 30 06:03:34 PDT 2009,NO_QUERY,babakt,Had an OD last night... feel pain.. couldn't go to work 

0,1971047656,Sat May 30 06:03:35 PDT 2009,NO_QUERY,tracy_detlor, Still can't log into @danecook's Su-Fi Hotspot. I really hope it's back up and running soon...

0,1971047700,Sat May 30 06:03:36 PDT 2009,NO_QUERY,QueenOfKnights,Moving day...bittersweet 

0,1971047720,Sat May 30 06:03:36 PDT 2009,NO_QUERY,nandavillas,@tommcfly why don't you like Rio as the other citys ? you will just spend some hours here 

0,1971048233,Sat May 30 06:03:42 PDT 2009,NO_QUERY,JanaAlyssa,It's weird because movies never make me cry. Maybe I just needed a good cry lol work in 6 hours  

0,1971048234,Sat May 30 06:03:43 PDT 2009,NO_QUERY,liedra,@wooliewombat i know!! 

0,1971048692,Sat May 30 06:03:47 PDT 2009,NO_QUERY,olivijavan,felling just a bit sick 

0,1971048842,Sat May 30 06:03:48 PDT 2009,NO_QUERY,miszsarahz,"@priscx haha we girls complain too much! lol. and priscx, yes when they start working and we're working, we'll all not see each other "

0,1971049101,Sat May 30 06:03:51 PDT 2009,NO_QUERY,megaskud,Went to play some survival mode on L4D. Welcome to the red rings my friend 

0,1971049182,Sat May 30 06:03:53 PDT 2009,NO_QUERY,amysav83,@fjkeogh tired.. just woke up and missin all the sunshine  hows ya?

0,1971049439,Sat May 30 06:03:55 PDT 2009,NO_QUERY,shealiberation,"So my mom comes in my room and asks me if I'm awake... Well I am now, thanks a lot MOM! "

0,1971049807,Sat May 30 06:03:59 PDT 2009,NO_QUERY,cesa_sesa,miss moscow 

0,1971049892,Sat May 30 06:04:00 PDT 2009,NO_QUERY,RickiCullen,"For some reason, when I'm sad I get sick "

0,1971049897,Sat May 30 06:04:00 PDT 2009,NO_QUERY,angelajewell,@nathanbweller i miss that    you need to come stay at the new place and we'll do that!

0,1971050006,Sat May 30 06:04:01 PDT 2009,NO_QUERY,twinschick1,"Wow. Just found out that Ronald Takaki committed suicide this week.  RIP, Professor.  http://bit.ly/DbuT1"

0,1971050007,Sat May 30 06:04:01 PDT 2009,NO_QUERY,Dreana,"Damn, i really dont want to get up  but im up now. (Sigh)"

0,1971050334,Sat May 30 06:04:05 PDT 2009,NO_QUERY,desireey,Doesnt want to go to work tonight...and its my first day. 

0,1971050631,Sat May 30 06:04:07 PDT 2009,NO_QUERY,willgresham,"@sovietkiki Mebbe, but I dislike the freedom to live and work in the UK if you live in Europe. They don't even have to speak english "

0,1971050791,Sat May 30 06:04:09 PDT 2009,NO_QUERY,raghu_shadow,"cant wait for wave, bing and squared now that wolfram was big disappointment "

0,1971050818,Sat May 30 06:04:09 PDT 2009,NO_QUERY,PounceRific73,Hey sis seen where yahoo 360 Is closing bummer for Traciey 

0,1971050830,Sat May 30 06:04:09 PDT 2009,NO_QUERY,Robynnn_b,I envy EVERYONE thats not working today.l Such a nice day 

0,1971050995,Sat May 30 06:04:11 PDT 2009,NO_QUERY,milienn,Cleaning my room :/ So exhausted and I'm not even finished! 

0,1971051011,Sat May 30 06:04:11 PDT 2009,NO_QUERY,heartbomb,Everything feels crappy. 

0,1971051389,Sat May 30 06:04:15 PDT 2009,NO_QUERY,Zoth,"@twitt3rbox first off live your app  1 question, why does your app always load tweets from 41days ago? Also mark as read never works "

0,1971051635,Sat May 30 06:04:17 PDT 2009,NO_QUERY,darrrrr,I can't believe it's snowing now in other parts of NZ. Hey Snow! Come to effin Auckland! playing favourites aye... 

0,1971051734,Sat May 30 06:04:19 PDT 2009,NO_QUERY,jai_dee,28 years on and still nobody can trip up Ricky Villa 

0,1971051830,Sat May 30 06:04:20 PDT 2009,NO_QUERY,KirstyAnnx3,lovely sunny day and i'm stuck in the house with nothing to do  my life sucks tbh :-/

0,1971051935,Sat May 30 06:04:21 PDT 2009,NO_QUERY,davestacey,The problem with open plan coffee shops and eateries is that none of them have plug sockets 

0,1971051984,Sat May 30 06:04:21 PDT 2009,NO_QUERY,t_isfortammy,@troyjh tried it n it didn't work hm 

0,1971052282,Sat May 30 06:04:24 PDT 2009,NO_QUERY,Almed22,"i just realize, in a few days i'll start college, goodbye home, see you every saturdays "

0,1971052335,Sat May 30 06:04:25 PDT 2009,NO_QUERY,CrazyMadThing,@Nayvan They want to play Mikel instead!! 

0,1971052383,Sat May 30 06:04:26 PDT 2009,NO_QUERY,AndyCarolan,about to change Helen's bike tyre  - wish us both luck please :S

0,1971052685,Sat May 30 06:04:28 PDT 2009,NO_QUERY,cokeisha,"Fresh blueberry pancakes $6, crispy maple bacon $5, fresh iced suntea $3; discovering ur kids don't like blueberry pancakes... Priceless "

0,1971052858,Sat May 30 06:04:30 PDT 2009,NO_QUERY,allisoncolelove,feeling sentimental and missing 1 saturday morning  since when am i so old?!

0,1971052975,Sat May 30 06:04:31 PDT 2009,NO_QUERY,hash_yahoo,@PounceRific73 Hey sis seen where yahoo 360 Is closing bummer for Traciey 

0,1971053048,Sat May 30 06:04:32 PDT 2009,NO_QUERY,cutiemonkey,What the deuce!?! I thought it was 11am! I can't sleep in anymore  It's only 9am!!!

0,1971053554,Sat May 30 06:04:37 PDT 2009,NO_QUERY,grasshopper2513,still feeling the effects from the sunburn I got Thursday 

0,1971053659,Sat May 30 06:04:38 PDT 2009,NO_QUERY,crtclpnymxms,"new twitter pix has been successfully uploaded. that was me and our late pet, vandolph "

0,1971053785,Sat May 30 06:04:40 PDT 2009,NO_QUERY,starsburnblack,"Withdraws, Been up all night "

0,1971053914,Sat May 30 06:04:41 PDT 2009,NO_QUERY,izelle_faller,dammit im bored.... 

0,1971054850,Sat May 30 06:04:51 PDT 2009,NO_QUERY,moggy99,@robfindlay I was trying but am now going to give in too sleep 

0,1971055050,Sat May 30 06:04:53 PDT 2009,NO_QUERY,liber8dsoul,@PhatCrayonz I feel you on that - the realization that the person you thought was *the one* turns out only to be human - can be hard.  

0,1971055246,Sat May 30 06:04:55 PDT 2009,NO_QUERY,chivc,i have a simpsons face 

0,1971055262,Sat May 30 06:04:55 PDT 2009,NO_QUERY,Claire_Nelson,"pretty gutted we cant do Beautiful Days this year, our resident dogsitters are away, so no-one to have marley the puli pig dog "

0,1971055658,Sat May 30 06:05:00 PDT 2009,NO_QUERY,x3cristinaaaaaa,kind of really misses her boyfriend right now 

