0,2207211373,Wed Jun 17 07:38:04 PDT 2009,NO_QUERY,NellyThomasElli,Britney @ the MEN tonight and I'm not even going  Cunt @ My life 

0,2207211481,Wed Jun 17 07:38:05 PDT 2009,NO_QUERY,JonnyP23,"i miss my chandler  and today is packed with stress god, i hope i make it today."

0,2207211507,Wed Jun 17 07:38:05 PDT 2009,NO_QUERY,sundeeptoor,just got back from car journey. now suffering from car sickness. I have reluctantly decided to have a lie down 

0,2207211625,Wed Jun 17 07:38:05 PDT 2009,NO_QUERY,blackkitty,There was a time when a little less than  90% of my inbox was legit mail. Now it's about 20% 

0,2207211677,Wed Jun 17 07:38:06 PDT 2009,NO_QUERY,daisyotv,"@lillyotv  yes , I will .. too bad that you don't come "

0,2207211848,Wed Jun 17 07:38:06 PDT 2009,NO_QUERY,loriz1525,"@blondeonbrdwy Hey girl!  I'm so upset the iphone software update isn't out!  What the hell, ya know!  It was supose to be here today! "

0,2207212025,Wed Jun 17 07:38:07 PDT 2009,NO_QUERY,spider_cider,Going to work until 7:30.  Ugh.

0,2207212032,Wed Jun 17 07:38:07 PDT 2009,NO_QUERY,Hybrid911,@PRoachCrackHead yeah i'm sicky  lmao i feel like shit x

0,2207212177,Wed Jun 17 07:38:08 PDT 2009,NO_QUERY,josiejacobs,@robotmunky me too. i wish the doctor would call back. i'm freaking out 

0,2207212245,Wed Jun 17 07:38:09 PDT 2009,NO_QUERY,Andrewdoeshair,"iPod's selection reminds me of 3 summers ago; Casey, My Fiction, playing Warped tour... Now my amp collects junk  http://twitpic.com/7mei5"

0,2207212453,Wed Jun 17 07:38:10 PDT 2009,NO_QUERY,nbrick,"@jeffmacarthur I've heard 10 am PST, which makes it mid-afternoon for us in Atlantic "

0,2207212461,Wed Jun 17 07:38:10 PDT 2009,NO_QUERY,Jenybaybe,@bong_leech ahh no its not!  ima be late to school 

0,2207212793,Wed Jun 17 07:38:11 PDT 2009,NO_QUERY,WinsHooi,"someon tell me,Twitter it's not for me this kind of people to play! Not for fun, only for business! "

0,2207212915,Wed Jun 17 07:38:12 PDT 2009,NO_QUERY,heyitsashleyy,"I should probably study, but I want to play sims3 "

0,2207212974,Wed Jun 17 07:38:12 PDT 2009,NO_QUERY,Keri_Keuning,"@saulandromans I'd say hospital  I  hope you're okay,have you got a rash or anything? a fever?"

0,2207212994,Wed Jun 17 07:38:12 PDT 2009,NO_QUERY,FaceofFOXToledo,Too bad sleeping doesn't burn as many calories as exercise. 

0,2207213282,Wed Jun 17 07:38:14 PDT 2009,NO_QUERY,arpitamukherjee,Dead... and tired 

0,2207213302,Wed Jun 17 07:38:14 PDT 2009,NO_QUERY,hdcrazy68,"missing my brother 2day it would be his 48thb-day luv u bro, miss u terribly  sad"

0,2207213328,Wed Jun 17 07:38:14 PDT 2009,NO_QUERY,Lacey0108,@JonathanRKnight Again that would be *twuckered* lol damn crackberry! I'm not even getting my updates 

0,2207213771,Wed Jun 17 07:38:16 PDT 2009,NO_QUERY,anandregunathan,no sachin for WI tour! 

0,2207213811,Wed Jun 17 07:38:16 PDT 2009,NO_QUERY,hannasole,I would want to be with you 

0,2207214067,Wed Jun 17 07:38:18 PDT 2009,NO_QUERY,MarionDuTilly,figuring out why I'm on day #3 of a headache 

0,2207214491,Wed Jun 17 07:38:19 PDT 2009,NO_QUERY,ScoobieKisses,@YOUNGCASHFLOW I hope so too. 

0,2207214652,Wed Jun 17 07:38:20 PDT 2009,NO_QUERY,kylabean,@Jemima13 It's raining here because you've left 

0,2207214740,Wed Jun 17 07:38:20 PDT 2009,NO_QUERY,starnut,@funkysoul sadly @nothingagency never sent back the clowns from Bern I sent them I while ago 

0,2207215049,Wed Jun 17 07:38:22 PDT 2009,NO_QUERY,MwahAlicexxx,Indoors Bored as it is raining again.   x x

0,2207215391,Wed Jun 17 07:38:24 PDT 2009,NO_QUERY,lolivia,..would really like it to be tomorrow now please 

0,2207216431,Wed Jun 17 07:38:29 PDT 2009,NO_QUERY,thatkidwho,@germaine1202 it's kinda rainy here 

0,2207217122,Wed Jun 17 07:38:32 PDT 2009,NO_QUERY,Meliciousx3,very bad mood.. so much english grammar to learn.. oh noo 

0,2207217297,Wed Jun 17 07:38:33 PDT 2009,NO_QUERY,roshm,feel sick.. having a headache as well 

0,2207217716,Wed Jun 17 07:38:35 PDT 2009,NO_QUERY,blaremanclure,Just woke up....bleh cleaning day  YUCK

0,2207218549,Wed Jun 17 07:38:39 PDT 2009,NO_QUERY,8reemah7,"#haveyouever faked an orgasm so well that the person u fcking was like who's yah daddy, (iLL, plzs,  ) ?"

0,2207218867,Wed Jun 17 07:38:41 PDT 2009,NO_QUERY,xHayleyxBabyx,Is so bored I mite jus fall asleep rite now!!! Borrrriiiinnnnggg!!!!  http://myloc.me/49hb

0,2207218980,Wed Jun 17 07:38:41 PDT 2009,NO_QUERY,SamJamesRose,Live is back! School exams sucked  I need prototype!

0,2207219175,Wed Jun 17 07:38:42 PDT 2009,NO_QUERY,crazylegsclub,@SoulMotivator arghhhh i know  where is it?!!!?

0,2207230314,Wed Jun 17 07:39:38 PDT 2009,NO_QUERY,coachbear,@taptam_76 @JCCub1 i dont know the exact date 

0,2207231124,Wed Jun 17 07:39:42 PDT 2009,NO_QUERY,cehyde9,"@katygal I SO want to-not sure how tight security is?! If they find it, do they confiscate it or do I have to take the train back to car "

0,2207231198,Wed Jun 17 07:39:43 PDT 2009,NO_QUERY,littlemama81,think's the past may be about to show it's face and bite me in the ass. Oh god.  I feel sick

0,2207231238,Wed Jun 17 07:39:43 PDT 2009,NO_QUERY,LizzieyTish,"at the USO, bored. I know daniel wants the computer, so its making me slow, because I cant think of what I want to do. "

0,2207231654,Wed Jun 17 07:39:45 PDT 2009,NO_QUERY,SGUINE,If only the spreadsheets worked the way I wanted them to 

0,2207231827,Wed Jun 17 07:39:46 PDT 2009,NO_QUERY,maxlagos,@PsycheDiver morning dude...sounds like a major tech fail day for you 

0,2207232431,Wed Jun 17 07:39:49 PDT 2009,NO_QUERY,krayzdreamr,i miss my buddy already 

0,2207232734,Wed Jun 17 07:39:50 PDT 2009,NO_QUERY,Bond_No9,@R2E2 sorry your refill experience wasn't a good one  contact us on our website www.bondno9.com to make sure your in our data base!

0,2207232891,Wed Jun 17 07:39:51 PDT 2009,NO_QUERY,faceonmars,started an excercise program yesterday.. and I am feeling it today. 

0,2207232952,Wed Jun 17 07:39:51 PDT 2009,NO_QUERY,angelaisawesome,"I feel sleepy. But I still need to read  Ohwell, good night for now "

0,2207233082,Wed Jun 17 07:39:52 PDT 2009,NO_QUERY,PFCMcCollin,Waiting sucks.... Still stuck in harrisburg... 

0,2207233146,Wed Jun 17 07:39:52 PDT 2009,NO_QUERY,bbeccaaa,"off to work in five minutes..head is thumping  and its raining, oh the joys of living in Scotland!"

0,2207233374,Wed Jun 17 07:39:53 PDT 2009,NO_QUERY,michygirl74,@cupcake_nyc Hey girl!  We missed you at PNC on Sat.    I hope your week is going OK!  

0,2207233661,Wed Jun 17 07:39:55 PDT 2009,NO_QUERY,unachance,"I don't care if it's by B*witched, Blame it on the weatherman is such a sad, lovely song. Reminds me of Charmed "

0,2207233716,Wed Jun 17 07:39:55 PDT 2009,NO_QUERY,HolidayFromReal,twitter broke again. it wont send updates to my phone  i feel out of the loop now.

0,2207233876,Wed Jun 17 07:39:56 PDT 2009,NO_QUERY,trishkaa,Walked around like a zombie for 3 hours  this morning. Finally waking up but I bought the wrong milk. Vit D instead of 2% 

0,2207233950,Wed Jun 17 07:39:56 PDT 2009,NO_QUERY,nova937music,@EskimoJoeMusic You drink too much 

0,2207235276,Wed Jun 17 07:40:03 PDT 2009,NO_QUERY,mrs_bungle2,getting ready for work...     boooooo....

0,2207235338,Wed Jun 17 07:40:03 PDT 2009,NO_QUERY,stacksZs,@MzPhoenix82 lol awww man  we could have had best friend rings lol

0,2207235605,Wed Jun 17 07:40:04 PDT 2009,NO_QUERY,acosmos,"@LaLaLaLaLemon I was denied lunch yesterday because of the roadwork! Lamberts was too risky to try to get to, you'd be stuck for a while. "

0,2207236023,Wed Jun 17 07:40:06 PDT 2009,NO_QUERY,swiss_scales,"@RyanSeacrest i thinka dog would be perfect, i wish i had a dog of my own  good luck with your decision!"

0,2207236964,Wed Jun 17 07:40:10 PDT 2009,NO_QUERY,CJATL,@Shanna_Monic girl I wish LOL not even a 2min nap 2day!  but it's allllll good!

0,2207236997,Wed Jun 17 07:40:10 PDT 2009,NO_QUERY,bwd73,&quot;Grandpa's funeral is on Friday not Thursday; still sad  

0,2207237209,Wed Jun 17 07:40:12 PDT 2009,NO_QUERY,Duffy177,Messed up my webserver last night  trying to get it back online now still having connection issues  isp as responsive as a brick wall

0,2207237256,Wed Jun 17 07:40:12 PDT 2009,NO_QUERY,jUNiTT,"Boring day at school today  Ah well its over now, gunna write a blog post http://jakeunitt.com all feedback welcome =D"

0,2207237263,Wed Jun 17 07:40:12 PDT 2009,NO_QUERY,eellsworth,oh no! feedburner tells me I lost a subscriber yesterday. Each one of my 28 subscribers is important to me. 

0,2207237453,Wed Jun 17 07:40:13 PDT 2009,NO_QUERY,MJihad,I'd so rather be at the lakers parade. 

0,2207237459,Wed Jun 17 07:40:13 PDT 2009,NO_QUERY,jessicatedi,"Ughhh worst night ever, was so sick from the afternoon until now "

0,2207237645,Wed Jun 17 07:40:11 PDT 2009,NO_QUERY,hypnoticzexy,"Night night , headache  x"

0,2207237653,Wed Jun 17 07:40:11 PDT 2009,NO_QUERY,SonjaAislynne,Sad a/b my Drs appt today! Typical I'd pull something in my back once I get my running routine back on track! 

0,2207237837,Wed Jun 17 07:40:14 PDT 2009,NO_QUERY,koltregaskes,"Why is it do difficult to move from dev to beta to full versions of Chrome?  Dev still cashing, given up with it, using Firefox Beta 3.5"

0,2207237904,Wed Jun 17 07:40:15 PDT 2009,NO_QUERY,Haleyyyyyy,Soooo tired! My nose has stopped whistling. I'm slightly sad as I had just learnt 'crack a bottle' on it  David Dickinson is an umpa lumpa

0,2207238204,Wed Jun 17 07:40:16 PDT 2009,NO_QUERY,unitymm2,@laurencornelius but it was faster. dont make excuses.im sad 

0,2207238361,Wed Jun 17 07:40:17 PDT 2009,NO_QUERY,sagejonas,is not knowing at all how you feel...  ughh

0,2207238768,Wed Jun 17 07:40:18 PDT 2009,NO_QUERY,ClaireeRrr,Don't want to go to work.. Its pouring! 

0,2207238990,Wed Jun 17 07:40:20 PDT 2009,NO_QUERY,jake0261,Getting ready for work! 

0,2207239016,Wed Jun 17 07:40:20 PDT 2009,NO_QUERY,LorelieBrown,"@c2s Oh yes, I have every faith in @Kmont when it comes to @kingmhofho. But since he broke my heart, I'm done with him. "

0,2207239507,Wed Jun 17 07:40:22 PDT 2009,NO_QUERY,Waynedudebeacom,@lilyroseallen show off 

0,2207239583,Wed Jun 17 07:40:22 PDT 2009,NO_QUERY,shauna324,twitter is still not working on my phone  what will entertain me at work? jasooon fix it pleassssse

0,2207240000,Wed Jun 17 07:40:24 PDT 2009,NO_QUERY,CyrusFan4Life,"@BeBrezzyGurl haha, ok. but i don't think i have $. "

0,2207240208,Wed Jun 17 07:40:25 PDT 2009,NO_QUERY,fvandongen,@ijustine it's not available in Canada as of 6:00am this morning. I was praying for it to be available. 

0,2207240211,Wed Jun 17 07:40:25 PDT 2009,NO_QUERY,laura_x3,physics exam on friday 

0,2207240446,Wed Jun 17 07:40:26 PDT 2009,NO_QUERY,JamieLynnWright,@CherylLHC drat! I forgot to send it the 'right' way...my bad..  I thought she sent me a txt not a tweet

0,2207240469,Wed Jun 17 07:40:27 PDT 2009,NO_QUERY,emmao414,"@jayteebee life has been pretty hectic since we got back, with sick mothers, and shitty jobs! feels like I was never away "

0,2207240784,Wed Jun 17 07:40:28 PDT 2009,NO_QUERY,samkeen,"@lokkju (regarding XSS...&quot;valuable attack tool on sites which use accounts&quot;...), true, he's shown the same issues on many banking sites "

0,2207240811,Wed Jun 17 07:40:28 PDT 2009,NO_QUERY,AfterDeath399,Disturbed by White Light 

0,2207241036,Wed Jun 17 07:40:29 PDT 2009,NO_QUERY,lancelot622,"Sad, sad news:  http://tr.im/oMLC (via @devilmotors) - Indeed, very sad news "

0,2207241260,Wed Jun 17 07:40:30 PDT 2009,NO_QUERY,ravemonkey27,damn it happened again  I am telling you they are stalking my dreams!

0,2207242110,Wed Jun 17 07:40:34 PDT 2009,NO_QUERY,Ricoshat,"Getting ready to work, missed my gym today  though friday thru Sunday will go.."

0,2207242197,Wed Jun 17 07:40:34 PDT 2009,NO_QUERY,khorshid,@hamedh i'm glad to hear that about nowbat-e shoma. too bad people can't watch us in iran now 

0,2207242932,Wed Jun 17 07:40:38 PDT 2009,NO_QUERY,spicyjw,@DonnieWahlberg I am sad today . Husband says our marrige ovr aftr 7 years . Hve 2 year old  How did you get thru it?) i need a hug!

0,2207242966,Wed Jun 17 07:40:38 PDT 2009,NO_QUERY,maureenjsellers,"Hi Wes, can't wait to see you all again this week-end. Missing Paige stax and stax  Enjoy your evening. Give Rylan a BIG kiss for me"

0,2207243211,Wed Jun 17 07:40:40 PDT 2009,NO_QUERY,mlittledevil77,@sapphire_city im sorry to hear that miley cyrus doesnt like asians  but i still like her music and shows sorry 

0,2207243320,Wed Jun 17 07:40:40 PDT 2009,NO_QUERY,chocomeow,"my first half day --&gt;  , and the second half --&gt; "

0,2207243926,Wed Jun 17 07:40:43 PDT 2009,NO_QUERY,clairebostock,sore throat 

0,2207244360,Wed Jun 17 07:40:45 PDT 2009,NO_QUERY,abba_ks,"I remember when &quot;14 days til end of the qtr&quot; meant 14 days til a bonus. Ah, nostalgia. "

0,2207244580,Wed Jun 17 07:40:47 PDT 2009,NO_QUERY,kittenspawn,@GraveYardAngel *Hugs* I'm sorry sweetheart 

0,2207244636,Wed Jun 17 07:40:47 PDT 2009,NO_QUERY,harrydebom,@gfalcone601 yeah i had exactly the same feeling! been so busy that i didnt realise it was that late! 

0,2207244695,Wed Jun 17 07:40:47 PDT 2009,NO_QUERY,abednaderbc,These fire alarm and sprinkler people are the slowest people in the world. 2 hours later and still not done. 

0,2207244787,Wed Jun 17 07:40:47 PDT 2009,NO_QUERY,AndrewScriven,"says, no iPhone for Andy. Sprint won't let me go for less than $200 until Nov. 8!  Oh well..."

0,2207245349,Wed Jun 17 07:40:50 PDT 2009,NO_QUERY,RyenSnow,"Oh, fuck. So little sleep. "

0,2207245613,Wed Jun 17 07:40:51 PDT 2009,NO_QUERY,justRy,"@socialitejungle according to MotherNature, Summer won't be around till August! Yes, what is up wit this weather??? More rain later today "

0,2207245966,Wed Jun 17 07:40:53 PDT 2009,NO_QUERY,cohesiondesigns,@LandauArt is it really happening? You're being replaced with you-know-who??? 

0,2207246342,Wed Jun 17 07:40:55 PDT 2009,NO_QUERY,inki33,"To sandra girl u are not the only one, felt the same way this morning "

0,2207246354,Wed Jun 17 07:40:55 PDT 2009,NO_QUERY,michygirl74,@TIBlockhead Hey there!  So good to see you again on Sat!  I wish I was going to more shows... No more for me.   Will have to liv thru u!

0,2207247649,Wed Jun 17 07:41:01 PDT 2009,NO_QUERY,GlennW,@BedlamB I seeeee. I cant even walk down the road without missing internet  that must be tough

0,2207248005,Wed Jun 17 07:41:03 PDT 2009,NO_QUERY,sebbity,ok maybe swarmplayer doesnt work so well.. sad panda 

0,2207248042,Wed Jun 17 07:41:04 PDT 2009,NO_QUERY,nicole9791,@luapossab are u using tweetdeck? it's missing lots of options 

0,2207248366,Wed Jun 17 07:41:04 PDT 2009,NO_QUERY,oddknock,No iPhone update for me yet   http://yfrog.com/5asksp

0,2207248371,Wed Jun 17 07:41:04 PDT 2009,NO_QUERY,moonhare,"@Purpleyblue I faced it, and now  have wet feet "

0,2207248391,Wed Jun 17 07:41:04 PDT 2009,NO_QUERY,Rico_Montega,@_ashleysays  ur right.

0,2207255597,Wed Jun 17 07:41:40 PDT 2009,NO_QUERY,jediwann0b1,HappyYellow is going to my doom. 

0,2207255720,Wed Jun 17 07:41:40 PDT 2009,NO_QUERY,cantgetenough81,@Peterfacinelli we are  losing so sad  sorry but will keep fighting to the end

0,2207255728,Wed Jun 17 07:41:40 PDT 2009,NO_QUERY,angelacintha,"Baru sampe rumah,lelah bersama bule2 itu seharian "

0,2207256043,Wed Jun 17 07:41:42 PDT 2009,NO_QUERY,chanmaster,Richard's nail on his finger randomly broke... no more guitar... bleh 

0,2207256299,Wed Jun 17 07:41:43 PDT 2009,NO_QUERY,lilbronx,I'm missing my baby! 

0,2207256329,Wed Jun 17 07:41:43 PDT 2009,NO_QUERY,DaleSwagga,Quote from a Dude last night I was on the Phone with Dale I don't want to be with you like that I just want to Fuck you  Sad isn't it

0,2207256991,Wed Jun 17 07:41:47 PDT 2009,NO_QUERY,Attamusc,So Apple just rerouted my new macbook AND cancelled my 3GS pre-order AFTER my phone was shown as being upgraded so I can't reorder. WTF 

0,2207257005,Wed Jun 17 07:41:47 PDT 2009,NO_QUERY,ohitsgerald,I hate pooping in the morning cuz then i feel dirty for the rest of the day 

0,2207257239,Wed Jun 17 07:41:48 PDT 2009,NO_QUERY,lauren_brooke,Another sleepy day. I stayed up late reading and overslept this morning. I have a feeling this is going to be loooong day 

0,2207257438,Wed Jun 17 07:41:49 PDT 2009,NO_QUERY,Chrissy_Jean,I stepped on a shower hook last night. It went through and now My heel really hurts. I also cannot remember my last tetanus shot..    ...

0,2207257791,Wed Jun 17 07:41:51 PDT 2009,NO_QUERY,iconslost,"Omg I just had to scream into an oldmans face I had to check a bitch before I wrecked a bitch, for real just fought with a senior  ackward"

0,2207258061,Wed Jun 17 07:41:52 PDT 2009,NO_QUERY,Jana_sk8,"@newchaosgirl Aww no, you cried becuz of him? Gosh, I feel sooo sorry for you!! "

0,2207258193,Wed Jun 17 07:41:53 PDT 2009,NO_QUERY,jessicatedi,"@SoFloBoJo did you decide?? Also, feel better!! And sorry I barely responded last night, was sooooooo sick and could barely lift my head "

0,2207258666,Wed Jun 17 07:41:55 PDT 2009,NO_QUERY,cpearson1990,"Silly MobileMe, duplicating all my contacts *sigh*. Further study of the sync order is needed "

0,2207258719,Wed Jun 17 07:41:55 PDT 2009,NO_QUERY,tailwag,@nikyun tokimeki 2 is the only game where I got a boyfriend 

0,2207258787,Wed Jun 17 07:41:56 PDT 2009,NO_QUERY,shadyasays,I DON'T WANT TO SEE YOU. CAN'T YOU JUST LEAVE ALREADY ?! 

0,2207258940,Wed Jun 17 07:41:57 PDT 2009,NO_QUERY,Lauralatch,sneezing made my nose bleed  I never have nosebleeds

0,2207258953,Wed Jun 17 07:41:57 PDT 2009,NO_QUERY,meshter,Waiting for my new iphone... schedule to arrive on 19th. Checked UPS site it seems to be on hold so that doesn't arrive earlier 

0,2207259067,Wed Jun 17 07:41:57 PDT 2009,NO_QUERY,Wolfgang_,@jerminho it would? seriously? 

0,2207259153,Wed Jun 17 07:41:58 PDT 2009,NO_QUERY,skypretzel159,"i'm moving out of columbia, mo today... going home indefinately "

0,2207259476,Wed Jun 17 07:41:59 PDT 2009,NO_QUERY,Peter_Nehem,"@jtbritto I go commando everyday, just wish more could tell I was doing that, when you sit it hides it too much.  #commandofriday"

0,2207259500,Wed Jun 17 07:41:59 PDT 2009,NO_QUERY,divatheriva,@ThatDanielSaxon I wanna go to aussie!!! 

0,2207259775,Wed Jun 17 07:42:01 PDT 2009,NO_QUERY,Storm_rider_uk,"stupid flippin' crohns related arthritis, my fecking leg is killing me!!  "

0,2207259892,Wed Jun 17 07:42:01 PDT 2009,NO_QUERY,xXxMeggsxXx,"Is listening to the Twilight soundtrack, while reading Eclipse. Oh how I wish Edward were not just a fictional character  xXx"

0,2207260188,Wed Jun 17 07:42:03 PDT 2009,NO_QUERY,mrswilcox09,playing Employee fo rthe day then home to play Supermom again until J gets home late 

0,2207260737,Wed Jun 17 07:42:05 PDT 2009,NO_QUERY,Jessica381x,"is bored at college, miss my babyyyyyyyyyy  xx xx xx"

0,2207261610,Wed Jun 17 07:42:10 PDT 2009,NO_QUERY,OneLoneKnight,mates cu later_need to recharge the battery 

0,2207261613,Wed Jun 17 07:42:10 PDT 2009,NO_QUERY,jbabby,"The chances of my getting a new iPhone from #squarespace are not looking good, things like that don't happen to me "

0,2207261694,Wed Jun 17 07:42:10 PDT 2009,NO_QUERY,PBB72,Annoyed/angry/upset............................   

0,2207261839,Wed Jun 17 07:42:11 PDT 2009,NO_QUERY,macboiz,home alone till 1AM  errrrrrr

0,2207262121,Wed Jun 17 07:42:12 PDT 2009,NO_QUERY,theonlybrain,I may have strained my rotator cuff?  It keeps clicking and I can't reach backward?  No Ultimate Frisbee for me today 

0,2207262931,Wed Jun 17 07:42:16 PDT 2009,NO_QUERY,df82,http://twitpic.com/7metg - Sitting in manchester picadilly-no orig glazed tho!!! 

0,2207263120,Wed Jun 17 07:42:17 PDT 2009,NO_QUERY,Me72724,Uhhhh!!!!!!!!!!! I have a dentist apointment 

0,2207263144,Wed Jun 17 07:42:17 PDT 2009,NO_QUERY,YoDiddy,@1cakebaker Youre making me hungry 

0,2207263441,Wed Jun 17 07:42:18 PDT 2009,NO_QUERY,millzypoo,@paulskibrah i'm working for 8 hours today too 

0,2207263531,Wed Jun 17 07:42:19 PDT 2009,NO_QUERY,elainecharmaine,is sleepy reading her own industrial training report 

0,2207263683,Wed Jun 17 07:42:19 PDT 2009,NO_QUERY,rdiaz03429,Christopher Nolan Has Still Not Signed For Batman 3  

0,2207264127,Wed Jun 17 07:42:22 PDT 2009,NO_QUERY,hemantmehta,@TheLASIKDoc My eyes are just bad candidates  Some medical issues with them that aren't going away anytime soon.  Oh well.

0,2207264276,Wed Jun 17 07:42:22 PDT 2009,NO_QUERY,rob5six2,iPhone 3.0 is still being released today. Sorry for my inaccurate tweets. I just wish they woulda gave us a time with the date  SUPER LAME

0,2207264476,Wed Jun 17 07:42:23 PDT 2009,NO_QUERY,WetDishRag,"@Shoe_Junkie so I've been MIA whilst I try and cope with her. I've hardly been on just to post on my blog and that all, I miss every1 "

0,2207264774,Wed Jun 17 07:42:25 PDT 2009,NO_QUERY,KaitlynMurphey,is so tired. 

0,2207264852,Wed Jun 17 07:42:25 PDT 2009,NO_QUERY,Pauli76,@cjsj79 it sunny?  can't tell in my little old office 

0,2207265351,Wed Jun 17 07:42:28 PDT 2009,NO_QUERY,melissa_hoop88,@apopa yes but torrential downpour every day. it sucks walking to class in this... 

0,2207265355,Wed Jun 17 07:42:28 PDT 2009,NO_QUERY,karlerikson,"@bubblewench Missing my Confab buds, too. "

0,2207265481,Wed Jun 17 07:42:29 PDT 2009,NO_QUERY,nova937music,Just reading that all four judges are returning to American Idol next year.  That's a relief.  Wouldn't have been able to sleep otherwise 

0,2207265584,Wed Jun 17 07:42:29 PDT 2009,NO_QUERY,Kaiti_Batie,"@lorenita327 you can at least go on the cruise next year, I'm not old enough "

0,2207265804,Wed Jun 17 07:42:30 PDT 2009,NO_QUERY,markphelan,"3pm has come and gone, no iPhone 3.0 software  @dougspain"

0,2207266088,Wed Jun 17 07:42:32 PDT 2009,NO_QUERY,borntodance26,is not looking forward to having her injection tomow 

0,2207266222,Wed Jun 17 07:42:32 PDT 2009,NO_QUERY,EiBall326,Im done and i saw you leaving the store 

0,2207266391,Wed Jun 17 07:42:33 PDT 2009,NO_QUERY,virtualdrew,No school for me today.  I'm really sick!!!   

0,2207266495,Wed Jun 17 07:42:34 PDT 2009,NO_QUERY,KelseyGavit,"I convince myself all the time I can cook bacon in a pan, and then I come close to burning down my apt and remember why I can't. "

0,2207266557,Wed Jun 17 07:42:34 PDT 2009,NO_QUERY,alrightmousey,@BrumGPA you can! You were the only one too. WELL DONE. Although i still have 7 hours to go 

0,2207266641,Wed Jun 17 07:42:35 PDT 2009,NO_QUERY,scottbuergcool,"Ok, I'm getting addicted to the Bachelorette. I can't believe Jillian is still keeping Wes and Tanner "

0,2207266960,Wed Jun 17 07:42:36 PDT 2009,NO_QUERY,tthorny,@1capplegate the should of put it on a Thurs night and then it would of been the hit that it was.  So sad and so sorry 

0,2207268106,Wed Jun 17 07:42:42 PDT 2009,NO_QUERY,menzieto,@daniellajohnson Why do all our events have to be on a tues or a thurs!!  I can never go! 

0,2207268119,Wed Jun 17 07:42:42 PDT 2009,NO_QUERY,DanielleLee09,@Tigerlily_Manj LOL! Andy is too funny!! You'll have to tell me what u read earlier that made u upset againg 

0,2207268340,Wed Jun 17 07:42:43 PDT 2009,NO_QUERY,CMChadwick,@susankildahl I am not seeing anything on face book re the party 

0,2207268386,Wed Jun 17 07:42:44 PDT 2009,NO_QUERY,RocketMinx,The interwebs are being so slow 

0,2207268545,Wed Jun 17 07:42:44 PDT 2009,NO_QUERY,shantala_anand,Watched Angels n Demons and happy houred at Elysian Fields. Wish I lived on 8th and Olive 

0,2207268731,Wed Jun 17 07:42:45 PDT 2009,NO_QUERY,sgtcrid,i really dont wanna do my physical fitness test tomorrow. i have a fantasy of how i am still in shape and its about to be shattered..... 

0,2207268736,Wed Jun 17 07:42:45 PDT 2009,NO_QUERY,typicalben,"Anyway after 12am, it'll be 10 more days and i'll be back home! I so miss mummy, daddy and ran! "

0,2207268793,Wed Jun 17 07:42:45 PDT 2009,NO_QUERY,DiscoUke,Obama's same-sex partner benefits for fed. employees do not include health benefits. Excuse? DOMA.  #gayrights

0,2207268831,Wed Jun 17 07:42:46 PDT 2009,NO_QUERY,tiffanypringle,my ankle still hurts really bad.  hope i didn't do something stupid.....wait...wait..oh...yep

0,2207268876,Wed Jun 17 07:42:46 PDT 2009,NO_QUERY,mayratrindade,"@tommcfly Tom, Ask Dougie because all his girlfriends are so ugly? He does not answer me  Kisses, I Love You."

0,2207269423,Wed Jun 17 07:42:49 PDT 2009,NO_QUERY,fahmiriza,Ya ampring. Chips poker gw 0 dolar. 

0,2207269906,Wed Jun 17 07:42:51 PDT 2009,NO_QUERY,dileeshvar,Hats off guys !! but I will be missing u   http://www.imdb.com/title/tt0455275/  Don't know what I am gonna do with out u !!

0,2207270323,Wed Jun 17 07:42:53 PDT 2009,NO_QUERY,bwd73,&quot;Grandpas funeral is on Friday not Thursday SAD 

0,2207270412,Wed Jun 17 07:42:53 PDT 2009,NO_QUERY,clairebear_12,@spidermonkeyloo what's up? 

0,2207270438,Wed Jun 17 07:42:53 PDT 2009,NO_QUERY,kayteebyrne,"wish i was going to blue syndrome, fox avenue and i fight crime in dorans tonight. fuckkk you over 18's gigs. "

0,2207270585,Wed Jun 17 07:42:54 PDT 2009,NO_QUERY,bluegod,"@FIFAWorldCupTM If this annoying buzzing keeps on next year, it's going to seriously disappoint viewers worldwide.  Can't it be stopped?"

0,2207271095,Wed Jun 17 07:42:57 PDT 2009,NO_QUERY,vickaay,gonna go to school... byeee.  i love beat freaksssssss.

